	wavfile	start_seconds	start_frames	end_seconds	end_frames	identifier	inferred_text_with_hotwords	inferred_text_without_hotwords	motherfile	dist
246	/media/hugo/Seagate Expansion Drive/ALICE_BACKUP/voshpde/pipeLine/segmentation_wavfiles/20150616/247_20150616.wav	5525.205578231293	243661566	5553.355578231292	244902981	246_20150616	my concerns our that on the resolution as a whole we still have a long way to go and in ending the a being deliberately provocative and suggest thing that on the resolution we have still the gaps and on that point i want to has the co particularly to members have been following this in some detail and ask them for their abuse and particularly with members of the monitoring group and taking with	my concerns our that on the resolution as a whole we still have a long way to go and in ending the a being deliberately provocative and suggest thing that on the resolution we have still the gaps and on that point i want to has the co particularly to members have been following this in some detail and ask them for their abuse and particularly with members of the monitoring group and taking with	/media/hugo/Seagate Expansion Drive/ALICE_BACKUP/voshpde/wav_files/zipfiles/20150616.wav	0
247	/media/hugo/Seagate Expansion Drive/ALICE_BACKUP/voshpde/pipeLine/segmentation_wavfiles/20150616/248_20150616.wav	5553.35560090703	244902982	5576.905600907029	245941537	247_20150616	mr president i happily say something about the resolution that are limit myself for time reasons to six points firstly on paragraph for i take the view that	mr president i happily say something about the resolution that are limit myself for time reasons to six points firstly on paragraph for i take the view that	/media/hugo/Seagate Expansion Drive/ALICE_BACKUP/voshpde/wav_files/zipfiles/20150616.wav	0
248	/media/hugo/Seagate Expansion Drive/ALICE_BACKUP/voshpde/pipeLine/segmentation_wavfiles/20150616/249_20150616.wav	5576.905623582767	245941538	5602.555623582766	247072703	248_20150616	this is a little obsolute because yesterday council came to an agreement on data protection so i would think that this is no longer current paragraph six i would say that one year on this package in its rrigiont form is perhaps no longer effective	this is a little obsolute because yesterday council came to an agreement on data protection so i would think that this is no longer current paragraph six i would say that one year on this package in its rrigiont form is perhaps no longer effective	/media/hugo/Seagate Expansion Drive/ALICE_BACKUP/voshpde/wav_files/zipfiles/20150616.wav	0
249	/media/hugo/Seagate Expansion Drive/ALICE_BACKUP/voshpde/pipeLine/segmentation_wavfiles/20150616/250_20150616.wav	5602.555646258504	247072704	5624.305646258504	248031879	249_20150616	maybe in parallel we can begin negotiations on this but whether it should come to a conclusion at the same time is a moot point i think we should be more flexible in our treatment of this question on paragraph nine to thirteen safe harbour my feeling is that	maybe in parallel we can begin negotiations on this but whether it should come to a conclusion at the same time is a moot point i think we should be more flexible in our treatment of this question on paragraph nine to thirteen safe harbour my feeling is that	/media/hugo/Seagate Expansion Drive/ALICE_BACKUP/voshpde/wav_files/zipfiles/20150616.wav	0
250	/media/hugo/Seagate Expansion Drive/ALICE_BACKUP/voshpde/pipeLine/segmentation_wavfiles/20150616/251_20150616.wav	5624.30566893424	248031880	5653.655668934241	249326215	250_20150616	if we do not want to repeat what we say last year we should rather adapt to current circumstances and say firstly we do support the commissions negotiations and will assess the results and alternatives allowing us to achieve save harder by other means perhaps by the location and if	if we do not want to repeat what we say last year we should rather adapt to current circumstances and say firstly we do support the commissions negotiations and will assess the results and alternatives allowing us to achieve save harder by other means perhaps by the location and if	/media/hugo/Seagate Expansion Drive/ALICE_BACKUP/voshpde/wav_files/zipfiles/20150616.wav	0
251	/media/hugo/Seagate Expansion Drive/ALICE_BACKUP/voshpde/pipeLine/segmentation_wavfiles/20150616/252_20150616.wav	5653.655691609977	249326216	5683.205691609977	250629371	251_20150616	not everything is installed as we wish we could call for its cancellation on paragraph seventeen i think that national security remains within the remit of member states and we should not take up anything there it is simply not one of our powers on paragraph twenty tftp i continue to believe last year we did not have in the information of abuse	not everything is installed as we wish we could call for its cancellation on paragraph seventeen i think that national security remains within the remit of member states and we should not take up anything there it is simply not one of our powers on paragraph twenty tftp i continue to believe last year we did not have in the information of abuse	/media/hugo/Seagate Expansion Drive/ALICE_BACKUP/voshpde/wav_files/zipfiles/20150616.wav	0
252	/media/hugo/Seagate Expansion Drive/ALICE_BACKUP/voshpde/pipeLine/segmentation_wavfiles/20150616/253_20150616.wav	5683.205714285714	250629372	5706.855714285714	251672337	252_20150616	why do we want to raise it again that is not something that we would contemplate paragraph twenty four again my feeling is that we have no powers to do this at a european level paragraph thirty i would like to point out that this may be a suitable	why do we want to raise it again that is not something that we would contemplate paragraph twenty four again my feeling is that we have no powers to do this at a european level paragraph thirty i would like to point out that this may be a suitable	/media/hugo/Seagate Expansion Drive/ALICE_BACKUP/voshpde/wav_files/zipfiles/20150616.wav	0
253	/media/hugo/Seagate Expansion Drive/ALICE_BACKUP/voshpde/pipeLine/segmentation_wavfiles/20150616/254_20150616.wav	5706.855736961451	251672338	5733.205736961451	252834373	253_20150616	time frame but i would ton to say we should come in when it is net of sary rather than according to a fixed time table thank thank you for being so for some many point i know you wanted to keep a lot more thank you very much colleagues in that spirit i am going to cause the speakers eva joly barvatpinearlymrkcopmrkeli	time frame but i would ton to say we should come in when it is necessary rather than according to a fixed time table thank thank you for being so for some many point i know you wanted to keep a lot more thank you very much colleagues in that spirit i am going to cause the speakers ever url barvatpinearlymrkcopmrkeli	/media/hugo/Seagate Expansion Drive/ALICE_BACKUP/voshpde/wav_files/zipfiles/20150616.wav	10
254	/media/hugo/Seagate Expansion Drive/ALICE_BACKUP/voshpde/pipeLine/segmentation_wavfiles/20150616/255_20150616.wav	5733.205759637188	252834374	5754.455759637188	253771499	254_20150616	mrs ernst and birgit tittle if that ok an colleagues if you could take a couple of minutes each it is my vote il we have to cape votes for twenty that okay with all colleagues so eva pa you net preside	mrs arms and bergysittle if that okeing colleagues if you could take a couple of minutes each it is my vote we have to cape votes for twenty that okay with all colleagues so ever peso next preside	/media/hugo/Seagate Expansion Drive/ALICE_BACKUP/voshpde/wav_files/zipfiles/20150616.wav	21
255	/media/hugo/Seagate Expansion Drive/ALICE_BACKUP/voshpde/pipeLine/segmentation_wavfiles/20150616/256_20150616.wav	5754.455782312925	253771500	5773.305782312925	254602785	255_20150616	mr president i once again thank you very much indeed for a high caleba report which we as greens will support we together with you regret the fact that the agreements on safe harder and swift we are not suspended	mr president i once again thank you very much indeed for a high caleba report which we as greens will support we together with you regret the fact that the agreements on safe harder and swift we are not suspended	/media/hugo/Seagate Expansion Drive/ALICE_BACKUP/voshpde/wav_files/zipfiles/20150616.wav	0
256	/media/hugo/Seagate Expansion Drive/ALICE_BACKUP/voshpde/pipeLine/segmentation_wavfiles/20150616/257_20150616.wav	5773.305804988662	254602786	5798.555804988662	255716311	256_20150616	after the discovery of mass surveillance of eu citizens we like you regret that member states did not stop mass surveillance in cooperation with the nsa and gchq and i also must add that the discovery of	after the discovery of mass surveillance of eu citizens we like you regret that member states did not stop mass surveillance in cooperation with the nsa and gchq and i also must add that the discovery of	/media/hugo/Seagate Expansion Drive/ALICE_BACKUP/voshpde/wav_files/zipfiles/20150616.wav	0
257	/media/hugo/Seagate Expansion Drive/ALICE_BACKUP/voshpde/pipeLine/segmentation_wavfiles/20150616/258_20150616.wav	5798.555827664399	255716312	5820.805827664399	256697537	257_20150616	surveillance by the german secret services of most eu member states on the half of the us is something which is deeply shocking and which has not yet impacted on public opinion as he might have expected to discover that	surveillance by the german secret services of most eu member states on the half of the us is something which is deeply shocking and which has not yet impacted on public opinion as he might have expected to discover that	/media/hugo/Seagate Expansion Drive/ALICE_BACKUP/voshpde/wav_files/zipfiles/20150616.wav	0
258	/media/hugo/Seagate Expansion Drive/ALICE_BACKUP/voshpde/pipeLine/segmentation_wavfiles/20150616/259_20150616.wav	5820.805850340136	256697538	5843.255850340136	257687583	258_20150616	there was this spnase and can fifty other lines is just astonishing and for there to be no reaction likewise there is a lack of security in our european it systems generally look at the attacks on the german parliament	there was this spnase and can fifty other lines is just astonishing and for there to be no reaction likewise there is a lack of security in our european it systems generally look at the attacks on the german parliament	/media/hugo/Seagate Expansion Drive/ALICE_BACKUP/voshpde/wav_files/zipfiles/20150616.wav	0
259	/media/hugo/Seagate Expansion Drive/ALICE_BACKUP/voshpde/pipeLine/segmentation_wavfiles/20150616/260_20150616.wav	5843.255873015873	257687584	5871.605873015873	258937819	259_20150616	i also feel great indignation that the commission has taken a view it was more urgent to push the business confidentiality directive more which was sought only by lobbyists and rather than putting in some directive to cover this issue de of an alert system	i also feel great indignation that the commission has taken a view it was more urgent to push the business confidentiality directive more which was sought only by lobbyists and rather than putting in some directive to cover this issue of an alert system	/media/hugo/Seagate Expansion Drive/ALICE_BACKUP/voshpde/wav_files/zipfiles/20150616.wav	3
260	/media/hugo/Seagate Expansion Drive/ALICE_BACKUP/voshpde/pipeLine/segmentation_wavfiles/20150616/261_20150616.wav	5871.60589569161	258937820	5901.35589569161	260249795	260_20150616	three hundred zero eu citizens have appealed to the commission at this incongroiusstantswhonlessthanamonth so there is no alert system no and haznt really received asylum at all he still hold up in moscow and against this background the corporate on the ituality directive is shocking	three hundred zero eu citizens have appealed to the commission at this incongroiusstantswhonlessthanamonth so there is no alert system no and haznt really received asylum at all he still hold up in moscow and against this background the corporate on the ituality directive is shocking	/media/hugo/Seagate Expansion Drive/ALICE_BACKUP/voshpde/wav_files/zipfiles/20150616.wav	0
261	/media/hugo/Seagate Expansion Drive/ALICE_BACKUP/voshpde/pipeLine/segmentation_wavfiles/20150616/262_20150616.wav	5901.355918367347	260249796	5928.705918367347	261455931	261_20150616	de we have been calling for decripted mal to be de out with for two years how nothing happened allow me a couple of minutes please and because i am against the french intelligence law which is of matter of great concern that law allows the secret services to monitor all citizens unfettered there is no scrutiny because they have	we have been calling for decripted mal to be do out with for two years how nothing happened allow me a couple of minutes please and because i am against the french intelligence law which is of matter of great concern that law allows the secret services to monitor all citizens unfettered there is no scrutiny because they have	/media/hugo/Seagate Expansion Drive/ALICE_BACKUP/voshpde/wav_files/zipfiles/20150616.wav	4
262	/media/hugo/Seagate Expansion Drive/ALICE_BACKUP/voshpde/pipeLine/segmentation_wavfiles/20150616/263_20150616.wav	5928.705941043084	261455932	5947.455941043084	262282807	262_20150616	a preposterous scrutiny body they have just got a few people working part time to scrutinise millions of intercepts unfenchcomissioqitithatwe will be having a discussion on de fence law so that there will be a few discussion on that	a preposterous scrutiny body they have just got a few people working part time to scrutinise millions of intercepts unfenchcomissioqitithatwe will be having a discussion on defence law so that there will be a few discussion on that	/media/hugo/Seagate Expansion Drive/ALICE_BACKUP/voshpde/wav_files/zipfiles/20150616.wav	1
263	/media/hugo/Seagate Expansion Drive/ALICE_BACKUP/voshpde/pipeLine/segmentation_wavfiles/20150616/264_20150616.wav	5947.455963718821	262282808	5965.905963718821	263096453	263_20150616	the ask treat colleague hre this a coin because we know have puts for twenty and and we have to move rooms for our hearing with saidi so we have two two dablines coming up so please be diffiplinnow thank you f next as mr coco	the ask treat colleague hre this a coin because we know have puts for twenty and and we have to move rooms for our hearing with saidi so we have two two dablines coming up so please be diffiplinnow thank you f next as mr coco	/media/hugo/Seagate Expansion Drive/ALICE_BACKUP/voshpde/wav_files/zipfiles/20150616.wav	0
264	/media/hugo/Seagate Expansion Drive/ALICE_BACKUP/voshpde/pipeLine/segmentation_wavfiles/20150616/265_20150616.wav	5965.905986394558	263096454	5988.3559863945575	264086499	264_20150616	mp i would be very brief and focus president as has just been stated i think we speak are two ago indicated that mr voss i think it was i just remind everybody that competences not conferred on the union the treaties remain with member states and article four	mp i would be very brief and focus president as has just been stated i think we speak are two ago indicated that mr voss i think it was i just remind everybody that competences not conferred on the union the treaties remain with member states and article four	/media/hugo/Seagate Expansion Drive/ALICE_BACKUP/voshpde/wav_files/zipfiles/20150616.wav	0
265	/media/hugo/Seagate Expansion Drive/ALICE_BACKUP/voshpde/pipeLine/segmentation_wavfiles/20150616/266_20150616.wav	5988.356009070295	264086500	6012.606009070295	265155925	265_20150616	the eu should respect data functions including territorial integrity maintaining law and order and safeguarding national security so national security is of so responsibility of each member state that is something which i support fully i also support robust data protection policy the right to privacy and lawful conduct by security services	the eu should respect date functions including territorial integrity maintaining law and order and safeguarding national security so national security is of so responsibility of each member state that is something which i support fully i also support robust data protection policy the right to privacy and lawful conduct by security services	/media/hugo/Seagate Expansion Drive/ALICE_BACKUP/voshpde/wav_files/zipfiles/20150616.wav	1
266	/media/hugo/Seagate Expansion Drive/ALICE_BACKUP/voshpde/pipeLine/segmentation_wavfiles/20150616/267_20150616.wav	6012.6060317460315	265155926	6030.156031746032	265929881	266_20150616	however investigations international security should be carried out ideally by national scrutiny committees and not the european parliament and i would likely to clarify my point i have always been as you know quite open in my opposition in relation to mr snoden	however investigations international security should be carried out ideally by national scrutiny committees and not the european parliament and i would likely to clarify my point i have always been as you know quite open in my opposition in relation to mr snoden	/media/hugo/Seagate Expansion Drive/ALICE_BACKUP/voshpde/wav_files/zipfiles/20150616.wav	0
267	/media/hugo/Seagate Expansion Drive/ALICE_BACKUP/voshpde/pipeLine/segmentation_wavfiles/20150616/268_20150616.wav	6030.156054421769	265929882	6052.006054421769	266893467	267_20150616	mr snoden remains as fas i am concerned a wanted criminal and a fugitive who should return to the united states to face justice we have just had announcements on the last forty eight ours ec eu cham and a well aware off of the damage which mr snoden has done but to the united states anti european intelligence at s net anlearnenforcement authorities	mr snoden remains as fas i am concerned a wanted criminal and a fugitive who should return to the united states to face justice we have just had announcements on the last forty eight ours waceuchamand a well aware off of the damage which mr snoden has done but to the united states anti european intelligence at s no anlearnenforcement authorities	/media/hugo/Seagate Expansion Drive/ALICE_BACKUP/voshpde/wav_files/zipfiles/20150616.wav	7
268	/media/hugo/Seagate Expansion Drive/ALICE_BACKUP/voshpde/pipeLine/segmentation_wavfiles/20150616/269_20150616.wav	6052.006077097506	266893468	6077.556077097505	268020223	268_20150616	and the damages caused to western security he as potentially endangered many many lives maybe even loss and lives of citizens and the in the eu and in our armed force in serving overseas calling for the immediate suspension are they can they can law form i am talk about human lives and protection of our security calling for the immediate suspension of international agreements is totally irresponsible	and the damages caused to western security he as potentially endangered many many lives maybe even loss and lives of citizens and the in the eu and in our armed force in serving overseas calling for the immediate suspension are they can they can law form i am talk about human lives and protection of our security calling for the immediate suspension of international agreements is totally irresponsible	/media/hugo/Seagate Expansion Drive/ALICE_BACKUP/voshpde/wav_files/zipfiles/20150616.wav	0
269	/media/hugo/Seagate Expansion Drive/ALICE_BACKUP/voshpde/pipeLine/segmentation_wavfiles/20150616/270_20150616.wav	6077.556099773243	268020224	6099.306099773243	268979399	269_20150616	and as fad i am concerned cannot be supported by mr net president above all i would like to thank you for the magnificent report you brit	and as fad i am concerned cannot be supported by mr nextr president ibove all i would like to thank you for the magnificent report you brit	/media/hugo/Seagate Expansion Drive/ALICE_BACKUP/voshpde/wav_files/zipfiles/20150616.wav	3
270	/media/hugo/Seagate Expansion Drive/ALICE_BACKUP/voshpde/pipeLine/segmentation_wavfiles/20150616/271_20150616.wav	6099.306122448979	268979400	6121.45612244898	269956215	270_20150616	any also express the frustration and you also press determination to possibly use a legal right to protest about the failure of failure commission to act and the failure to implement programmes that is a question on the wittleblow	any also express the frustration and you also press determination to possibly use a legal right to protest about the failure of failure commission to act and the failure to implement programmes that is a question on the wittleblow	/media/hugo/Seagate Expansion Drive/ALICE_BACKUP/voshpde/wav_files/zipfiles/20150616.wav	0
271	/media/hugo/Seagate Expansion Drive/ALICE_BACKUP/voshpde/pipeLine/segmentation_wavfiles/20150616/272_20150616.wav	6121.456145124716	269956216	6144.306145124717	270963901	271_20150616	unfortunately we have not had a clear answer and i think that is very serious indeed i think it is very serious that her no an is being accused of having harmed individuals which he have not done and i wanted to ask you whether we possible wheat we possible to include in the report	unfortunately we have not had a clear answer and i think that is very serious indeed i think it is very serious that her no an is being accused of having harmed individuals which he have not done and i wanted to ask you whether we possible wheat we possible to include in the report	/media/hugo/Seagate Expansion Drive/ALICE_BACKUP/voshpde/wav_files/zipfiles/20150616.wav	0
272	/media/hugo/Seagate Expansion Drive/ALICE_BACKUP/voshpde/pipeLine/segmentation_wavfiles/20150616/273_20150616.wav	6144.306167800453	270963902	6161.156167800454	271706987	272_20150616	il the protection of a journalist not just those people working for companies but the protection of journalists and journalist who are informing auf and who want to protect their thoughts	also the protection of a journalist not just those people working for companies but the protection of journalists and journalist who are informing us and who want to protect their thoughts	/media/hugo/Seagate Expansion Drive/ALICE_BACKUP/voshpde/wav_files/zipfiles/20150616.wav	5
273	/media/hugo/Seagate Expansion Drive/ALICE_BACKUP/voshpde/pipeLine/segmentation_wavfiles/20150616/274_20150616.wav	6161.15619047619	271706988	6188.40619047619	272908713	273_20150616	pressure on them by multinational but the moment there is an appeal that going around to defend the secret directive secret a business directive preside	pressure on them by multinational but the moment there is an appeal that going around to defend the secret directive secret a business directive preside	/media/hugo/Seagate Expansion Drive/ALICE_BACKUP/voshpde/wav_files/zipfiles/20150616.wav	0
274	/media/hugo/Seagate Expansion Drive/ALICE_BACKUP/voshpde/pipeLine/segmentation_wavfiles/20150616/275_20150616.wav	6188.406213151928	272908714	6212.256213151927	273960499	274_20150616	above all i would like to congratulate you on the text that you have introduced it is an excellent bated to our work it can be improved but above all it does not point our attention to all the area where we need to find a response is my big fear my big fear and concern when it comes to the question of mass surveillance	above all i would like to congratulate you on the text that you have introduced it is an excellent bated to our work it can be improved but above all it does not point our attention to all the areas where we need to find a response is my big fear my big fear and concern when it comes to the question of mass surveillance	/media/hugo/Seagate Expansion Drive/ALICE_BACKUP/voshpde/wav_files/zipfiles/20150616.wav	1
275	/media/hugo/Seagate Expansion Drive/ALICE_BACKUP/voshpde/pipeLine/segmentation_wavfiles/20150616/276_20150616.wav	6212.256235827665	273960500	6239.206235827664	275148995	275_20150616	is that succeed in reacting when there are scandal in the media and then then we opsdrop it the fact that net some people libe committee should not drop this matter we have got to keep keep on to this issue i do one to go two point first of all that we have to be clear in our relations with third country is and secondly	is that succeed in reacting when there are scandal in the media and then then we opsdrop it the fact that one some people lb committee should not drop this matter we have got to keep keep on to this issue i do one to go two point first of all that we have to be clear in our relations with third country is and secondly	/media/hugo/Seagate Expansion Drive/ALICE_BACKUP/voshpde/wav_files/zipfiles/20150616.wav	4
276	/media/hugo/Seagate Expansion Drive/ALICE_BACKUP/voshpde/pipeLine/segmentation_wavfiles/20150616/277_20150616.wav	6239.206258503401	275148996	6264.3562585034015	276258111	276_20150616	we cant tutureld allow farms we cannot just pa that within our remit des not within our powers it is true that the ability to keep an eye and monitor tiglethorviceio national sovereignty but also true that we can help we can help spread best practices the example of the hearing that de committee organised eu	we cant tutureld allow farms we cannot just say that within our remit is not within our powers it is true that the ability to keep an eye and monitor tiglethorviceio national sovereignty but also true that we can help we can help spread best practices the example of the hearing that did the committee organised	/media/hugo/Seagate Expansion Drive/ALICE_BACKUP/voshpde/wav_files/zipfiles/20150616.wav	12
