	wavfile	start_seconds	start_frames	end_seconds	end_frames	identifier	inferred_text_with_hotwords	inferred_text_without_hotwords	motherfile	dist
151	/media/hugo/Seagate Expansion Drive/ALICE_BACKUP/voshpde/pipeLine/segmentation_wavfiles/20150616/152_20150616.wav	3412.753424036281	150502426	3438.503424036281	151638001	151_20150616	as ms lambert aid and people who are radicalised in different wait i much you de you what amendment from in this report on this issue because il de a huge issue and how much of your report doings he dealing with this are you not he eu report as dealing with this in a big way because it is a big national competence ca eu be judicial to time than i the deal with is but i gang de a major	as ms blambarstaidan people who are radicalised in different wait i much you do you what amendment from in this report on this issue because iklydoahuge issue and how much of your report doings he dealing with this are you not he you report as dealing with this in a big way because it is a big national competence co be judicial to time than i the deal with is but i going a major	/media/hugo/Seagate Expansion Drive/ALICE_BACKUP/voshpde/wav_files/zipfiles/20150616.wav	23
152	/media/hugo/Seagate Expansion Drive/ALICE_BACKUP/voshpde/pipeLine/segmentation_wavfiles/20150616/153_20150616.wav	3438.503446712018	151638002	3454.353446712018	152336987	152_20150616	issue of that clidation that if you if you want to as no and this is going to bring the commission in now and then il coming back eu for eu de that for just bring the commission manininandi ask you to do answers to	issue of that clidation that if you if you want to as no and this is going to bring the commission in now and then now coming back for we go that for just bring the commission manininand i ask you to do answers to	/media/hugo/Seagate Expansion Drive/ALICE_BACKUP/voshpde/wav_files/zipfiles/20150616.wav	11
153	/media/hugo/Seagate Expansion Drive/ALICE_BACKUP/voshpde/pipeLine/segmentation_wavfiles/20150616/154_20150616.wav	3454.353469387755	152336988	3472.703469387755	153146223	153_20150616	do you indicate tory justaskicotorigointo have you n the lit ok working home n begin the commission amend acheve them gin being you in at the end to de ante of the questions	do you indicate for justaskicotorigointo have you n the lit ok olkintimnnbaging the commission amend achevethemganiebengyouinat the end to the ante of the question	/media/hugo/Seagate Expansion Drive/ALICE_BACKUP/voshpde/wav_files/zipfiles/20150616.wav	25
154	/media/hugo/Seagate Expansion Drive/ALICE_BACKUP/voshpde/pipeLine/segmentation_wavfiles/20150616/155_20150616.wav	3472.703492063492	153146224	3488.5534920634923	153845209	154_20150616	mr president mr president thank you for having us here today i really believe that this this regular exchange of views can really help a better cooperation and better understanding between our two institutions are really thankful for your mogisation	mr president mr president thank you for having us here today i really believe that this this regular exchange of views can really help a better cooperation and better understanding between our two institutions are really thankful for your mogisation	/media/hugo/Seagate Expansion Drive/ALICE_BACKUP/voshpde/wav_files/zipfiles/20150616.wav	0
155	/media/hugo/Seagate Expansion Drive/ALICE_BACKUP/voshpde/pipeLine/segmentation_wavfiles/20150616/156_20150616.wav	3488.553514739229	153845210	3511.703514739229	154866125	155_20150616	de thanks to the rapporteur is is a very important report on an important subject as a very important time not only af the paris tunis and elsewhere but because as we speak the internal ministers or discussing ana new security agenda for europe	thanks to the rapporteur is is a very important report on an important subject as a very important time not only af the paris tunis and elsewhere but because as we speak the internal ministers at discussing in the new security agenda for europe	/media/hugo/Seagate Expansion Drive/ALICE_BACKUP/voshpde/wav_files/zipfiles/20150616.wav	10
156	/media/hugo/Seagate Expansion Drive/ALICE_BACKUP/voshpde/pipeLine/segmentation_wavfiles/20150616/157_20150616.wav	3511.703537414966	154866126	3528.753537414966	155618031	156_20150616	de proposed by the commission so a number of initiatives and proposals have already been main made actions are taking place but briefly we share the point of view that radicalisation is the very complex post	red proposed by the commission so a number of initiatives and proposals have already been main made actions are taking place but briefly we share the point of view that radicalisation is a very complex	/media/hugo/Seagate Expansion Drive/ALICE_BACKUP/voshpde/wav_files/zipfiles/20150616.wav	10
157	/media/hugo/Seagate Expansion Drive/ALICE_BACKUP/voshpde/pipeLine/segmentation_wavfiles/20150616/158_20150616.wav	3528.753560090703	155618032	3550.803560090703	156590437	157_20150616	and it is not the monupulliuofa faith or of a policy or a political system that are find main reasons for people being radicalised religion is only one of those so we must not stigmatise secondly	and it is not the monupulliuofa faith or of a policy or a political system that are find main reasons for people being radicalised religion is only one of those so we must not stigmatise secondly	/media/hugo/Seagate Expansion Drive/ALICE_BACKUP/voshpde/wav_files/zipfiles/20150616.wav	0
158	/media/hugo/Seagate Expansion Drive/ALICE_BACKUP/voshpde/pipeLine/segmentation_wavfiles/20150616/159_20150616.wav	3550.80358276644	156590438	3573.25358276644	157580483	158_20150616	religion itself in our point of view is not de prooted cause but it is the abuse of religion or a simplistic interpretation of religion and in a globalised world which is very stressful that is a market in certainty and	religion itself in our point of view is not deprooted cause but it is the abuse of religion or a simplistic interpretation of religion and in a globalised world which is very stressful that is a market in certainty and	/media/hugo/Seagate Expansion Drive/ALICE_BACKUP/voshpde/wav_files/zipfiles/20150616.wav	1
159	/media/hugo/Seagate Expansion Drive/ALICE_BACKUP/voshpde/pipeLine/segmentation_wavfiles/20150616/160_20150616.wav	3573.2536054421766	157580484	3588.9036054421767	158270649	159_20150616	propaganda of few like so we have to analyse because it is very in a eu ansfasion but we have to be home in our responses when we talk about prevention off des behards	propaganda of few like so we have to analyse because it is very in a new ansfasion but we have to be com in our responses when we talk about prevention sofftisbehards	/media/hugo/Seagate Expansion Drive/ALICE_BACKUP/voshpde/wav_files/zipfiles/20150616.wav	9
160	/media/hugo/Seagate Expansion Drive/ALICE_BACKUP/voshpde/pipeLine/segmentation_wavfiles/20150616/161_20150616.wav	3588.9036281179137	158270650	3614.7536281179136	159410635	160_20150616	de we have to talk about education and integration good pact is what happens in presente what happens with the first lines that people who are in the front line but it is very difficult to have a policy that deals with they all of this it a complex problem but we have to her rapid reaction	we have to talk about education and integration good pact is what happens in prisons what happens with the first lines that people who are in the front line but it is very difficult to have a policy that deals with they all of this it a complex problem but we have to her rapid reaction	/media/hugo/Seagate Expansion Drive/ALICE_BACKUP/voshpde/wav_files/zipfiles/20150616.wav	7
161	/media/hugo/Seagate Expansion Drive/ALICE_BACKUP/voshpde/pipeLine/segmentation_wavfiles/20150616/162_20150616.wav	3614.7536507936506	159410636	3632.603650793651	160197821	161_20150616	so there is a contradiction here politically s real challenge yes we will propose an amendment to the framework decision defining terrorism to include the so called foreign fighters and to include	so there is a contradiction here politically s real challenge yes we will propose an amendment to the framework decision defining terrorism to include the so called foreign fighters and to include	/media/hugo/Seagate Expansion Drive/ALICE_BACKUP/voshpde/wav_files/zipfiles/20150616.wav	0
162	/media/hugo/Seagate Expansion Drive/ALICE_BACKUP/voshpde/pipeLine/segmentation_wavfiles/20150616/163_20150616.wav	3632.6036734693876	160197822	3660.7536734693876	161439237	162_20150616	the fact that the received training abroad yes we have made a number of policy proposal so last on the twenty eight april in terms of radicalisation last year and we have a fifteen point action plan which was confirmed by the council last december and i am happy to discuss with in more detail eu but when it comes to good practice and the european network for making people aware about radicalisation	the fact that the received training abroad yes we have made a number of policy proposal so last on the twenty eight epril in terms of radicalisation last year and we have a fifteen point action plan which was confirmed by the council last december and i am happy to discuss with in more detail egue but when it comes to good practice and the european network for making people aware about radicalisation	/media/hugo/Seagate Expansion Drive/ALICE_BACKUP/voshpde/wav_files/zipfiles/20150616.wav	3
163	/media/hugo/Seagate Expansion Drive/ALICE_BACKUP/voshpde/pipeLine/segmentation_wavfiles/20150616/164_20150616.wav	3660.7536961451246	161439238	3689.6036961451246	162711523	163_20150616	we have heard your message from september the budget of the net network will be increased by five we have twenty people we have twenty people working on this few years ago now that a one zero five hundred organisations ngos and others who are working on this on daily basic sport colluptios trade unions youth organisation a present staff	we have heard your message from september the budget of the next network will be increased by five we have twenty people we have twenty people working on this few years ago now that a one zero five hundred organisations ngos and others who are working on this on daily basic sport colluptios trade unions youth organisation a present staff	/media/hugo/Seagate Expansion Drive/ALICE_BACKUP/voshpde/wav_files/zipfiles/20150616.wav	1
164	/media/hugo/Seagate Expansion Drive/ALICE_BACKUP/voshpde/pipeLine/segmentation_wavfiles/20150616/165_20150616.wav	3689.6037188208616	162711524	3719.3537188208616	164023499	164_20150616	police they are all working on exchange a good practicas every day but it is not enough just to have a list of good practices online some where we have to move we have move of the stage now where there is support to our various consultancy available to the member states this will be strengthened in september i real support from practitioners visa politicians	please they are all working on exchange a good practicas every day but it is not enough just to have a list of good practices online some where we have to move we have move of the stage now where there is support to our various consultancy available to the member states this will be strengthened in september i real support from practitionesthevisapolititians	/media/hugo/Seagate Expansion Drive/ALICE_BACKUP/voshpde/wav_files/zipfiles/20150616.wav	10
165	/media/hugo/Seagate Expansion Drive/ALICE_BACKUP/voshpde/pipeLine/segmentation_wavfiles/20150616/166_20150616.wav	3719.3537414965986	164023500	3744.0037414965986	165110565	165_20150616	evrieightyinmounths we organise an anisterial conference where we bring practitionisinanderhome office ministers for an exchange of views often it a comprentation of ideas about what works what does not work or at is lacking what the national level should do what the european level should do so all of these messages have been heard	evrieightyinmounths we organise an anisterial conference where we bring practitionisinanderhome office ministers for an exchange of views often it a comprentation of ideas about what works what does not work or at is lacking what the national level should do what the european level should do so all of these messages have been heard	/media/hugo/Seagate Expansion Drive/ALICE_BACKUP/voshpde/wav_files/zipfiles/20150616.wav	0
166	/media/hugo/Seagate Expansion Drive/ALICE_BACKUP/voshpde/pipeLine/segmentation_wavfiles/20150616/167_20150616.wav	3744.0037641723357	165110566	3759.7537641723357	165805141	166_20150616	as far as the internites concerned of course the main challenges to preserve the freedom of the web which is a fantastic tool but we have to avoid some content which would not be accepted in the offline world	as far as the internites concerned of course the main challenges to preserve the freedom of the web which is a fantastic tool but we have to avoid some content which would not be accepted in the offline world	/media/hugo/Seagate Expansion Drive/ALICE_BACKUP/voshpde/wav_files/zipfiles/20150616.wav	0
167	/media/hugo/Seagate Expansion Drive/ALICE_BACKUP/voshpde/pipeLine/segmentation_wavfiles/20150616/168_20150616.wav	3759.7537868480727	165805142	3780.9037868480727	166737857	167_20150616	we would not allow a megathy in clalcaiderinspared to be published on paper so why should it be a veible online so we have to engage the factor in this we have created a platform and in contact with them they want to explain who they are what they are doing that is be legal aspect of course	we would not allow a megathy in clalcaiderinspared to be published on paper so why should it be a veible online so we have to engage the factor in this we have created a platform and in contact with them they want to explain who they are what they are doing that is be legal aspect of course	/media/hugo/Seagate Expansion Drive/ALICE_BACKUP/voshpde/wav_files/zipfiles/20150616.wav	0
168	/media/hugo/Seagate Expansion Drive/ALICE_BACKUP/voshpde/pipeLine/segmentation_wavfiles/20150616/169_20150616.wav	3780.9038095238097	166737858	3801.0538095238094	167626473	168_20150616	there are illegal practices there are radical practices but thinking extremely having an extreme opinion in free societies not of crime in itself so there is a grey area we have to look at content which content	there are illegal practices there are radical practices but thinking extremely having an extreme opinion in free societies not of crime in itself so there is a grey area we have to look at content which content	/media/hugo/Seagate Expansion Drive/ALICE_BACKUP/voshpde/wav_files/zipfiles/20150616.wav	0
169	/media/hugo/Seagate Expansion Drive/ALICE_BACKUP/voshpde/pipeLine/segmentation_wavfiles/20150616/170_20150616.wav	3801.0538321995464	167626474	3830.6038321995466	168929629	169_20150616	violates bat all terms of views and we have to ask them not us them to remove this content which violate pair terms of views and we have to and europol is involved in that finally in terms of education there as well europe as new programmes following on erasmus programme ach can citizenship eu one of half billion is available the big advantage s	violates bat all terms of views and we have to ask them not us them to remove this content which violate pair terms of views and we have to and europol is involved in that finally in terms of education there as well europe as new programmes following on erasmus programme ach can citizenshipur one of half billion is available the big advantage	/media/hugo/Seagate Expansion Drive/ALICE_BACKUP/voshpde/wav_files/zipfiles/20150616.wav	5
170	/media/hugo/Seagate Expansion Drive/ALICE_BACKUP/voshpde/pipeLine/segmentation_wavfiles/20150616/171_20150616.wav	3830.6038548752836	168929630	3858.1538548752833	170144585	170_20150616	i am not programmes which have a syparcurosty aspect its education its prevention its critical thinking its media reding in order to form train a new generation of citizens so il free thinking and critical and it when it comes to financing of terrorism as well in it coming months we will be proposing a system to freeze terrorist	i am not programmes which have a syparcurosty aspect its education its prevention its critical thinking its media reading in order to form train a new generation of citizens so ile free thinking and critical and it when it comes to financing of terrorism as well in it coming months we will be proposing a system to freeze terrorist	/media/hugo/Seagate Expansion Drive/ALICE_BACKUP/voshpde/wav_files/zipfiles/20150616.wav	2
171	/media/hugo/Seagate Expansion Drive/ALICE_BACKUP/voshpde/pipeLine/segmentation_wavfiles/20150616/172_20150616.wav	3858.1538775510203	170144586	3884.6038775510206	171311031	171_20150616	de funds we did this terrorists identified by the un security council the paradoxes but we have nothing like lad at european level so very briefly the report touches on a very important number of points where we are active we are prepared to do more we are prepared to do better we are prepared to do it more quickly with your support	en funds we did this terrorists identified by the un security council the paradoxes but we have nothing like lad at european level so very briefly the report touches on a very important number of points where we are active we are prepared to do more we are prepared to do better we are prepared to do it more quickly with your support	/media/hugo/Seagate Expansion Drive/ALICE_BACKUP/voshpde/wav_files/zipfiles/20150616.wav	2
172	/media/hugo/Seagate Expansion Drive/ALICE_BACKUP/voshpde/pipeLine/segmentation_wavfiles/20150616/173_20150616.wav	3884.6039002267576	171311032	3900.3539002267576	172005607	172_20150616	de raporrmr president the have been many questions and many proposal	identrapporrmrpresidentther have been many questions and many proposals	/media/hugo/Seagate Expansion Drive/ALICE_BACKUP/voshpde/wav_files/zipfiles/20150616.wav	8
173	/media/hugo/Seagate Expansion Drive/ALICE_BACKUP/voshpde/pipeLine/segmentation_wavfiles/20150616/174_20150616.wav	3900.353922902494	172005608	3924.3039229024944	173061803	173_20150616	first of all you asked about the comperative approach do we have quality quality training to we have got training you talked about the uk in the uk there is good practice in terms of prevention we have got a lot of information from the uk there have been experiments and its striking if you compared to other countries	first of all you asked about the comperative approach do we have quality quality training to we have got training you talked about the uk in the uk there is good practice in terms of prevention we have got a lot of information from the uk there have been experiments and its striking if you compared to other countries	/media/hugo/Seagate Expansion Drive/ALICE_BACKUP/voshpde/wav_files/zipfiles/20150616.wav	0
174	/media/hugo/Seagate Expansion Drive/ALICE_BACKUP/voshpde/pipeLine/segmentation_wavfiles/20150616/175_20150616.wav	3924.3039455782314	173061804	3945.353945578231	173990109	174_20150616	authorities work very well wic a state and associations are involved all at the same level and it is different in other countries where associations are not treated in this same way are not considered so well and their work is often ignored but for political reasons il	authorities work very well wic a state and associations are involved all at the same level and it is different in other countries where associations are not treated in this same way are not considered so well and their work is often ignored but for political reasons a	/media/hugo/Seagate Expansion Drive/ALICE_BACKUP/voshpde/wav_files/zipfiles/20150616.wav	2
175	/media/hugo/Seagate Expansion Drive/ALICE_BACKUP/voshpde/pipeLine/segmentation_wavfiles/20150616/176_20150616.wav	3945.353968253968	173990110	3965.503968253968	174878725	175_20150616	authorities do not want to work with certain associations because pair of a different political collar that is a problem because the objective should be global and the objective is to be effective so yes a lot of work a lot of information lot of cot practice	authorities do not want to work with certain associations because pair of a different political collar that is a problem because the objective should be global and the objective is to be effective so yes a lot of work a lot of information lot of cot practice	/media/hugo/Seagate Expansion Drive/ALICE_BACKUP/voshpde/wav_files/zipfiles/20150616.wav	0
176	/media/hugo/Seagate Expansion Drive/ALICE_BACKUP/voshpde/pipeLine/segmentation_wavfiles/20150616/177_20150616.wav	3965.503990929705	174878726	3989.453990929705	175934921	176_20150616	we will depend on the analysis of this information a lot of information is available but there is not much analysis because not many people trying to analyse all of this information so that answers you in il question to answer ana gomes your quite right i agree with you we do have a problem if definition	we will depend on the analysis of this information a lot of information is available but there is not much analysis because not many people trying to analyse all of this information so that answers you initial question to answer an ago it your quite right i agree with you we do have a problem if definition	/media/hugo/Seagate Expansion Drive/ALICE_BACKUP/voshpde/wav_files/zipfiles/20150616.wav	8
177	/media/hugo/Seagate Expansion Drive/ALICE_BACKUP/voshpde/pipeLine/segmentation_wavfiles/20150616/178_20150616.wav	3989.454013605442	175934922	4017.004013605442	177149877	177_20150616	when i drafted this report we had a difficulty how you define radicalisation foreign fighter through our european who are not foreign you can be radicalised without being a terrorist you can be a religious fundamentalist without being a terrorist without having any criminal aspirations services all sensitive all difficult but we must not be nave we must	when i drafted this report we had a difficulty how you define radicalisation foreign fighter through our european who are not foreign you can be radicalised without being a terrorist you can be a religious fundamentalist without being a terrorist without having any criminal aspirations services all sensitive all difficult but we must not be nave we must	/media/hugo/Seagate Expansion Drive/ALICE_BACKUP/voshpde/wav_files/zipfiles/20150616.wav	0
178	/media/hugo/Seagate Expansion Drive/ALICE_BACKUP/voshpde/pipeLine/segmentation_wavfiles/20150616/179_20150616.wav	4017.004036281179	177149878	4037.1540362811793	178038493	178_20150616	we have to find a good definition if we going to find a good solution so i agree with you we have to find a way of wording lit precisely what des being radicalised mean we not going to prosecute all radicalised people	we have to find a good definition if we going to find a good solution so i agree with you we have to find a way of wording lit precisely what as being radicalised mean we not going the prosecute all radicalised people	/media/hugo/Seagate Expansion Drive/ALICE_BACKUP/voshpde/wav_files/zipfiles/20150616.wav	4
179	/media/hugo/Seagate Expansion Drive/ALICE_BACKUP/voshpde/pipeLine/segmentation_wavfiles/20150616/180_20150616.wav	4037.1540589569163	178038494	4066.604058956916	179337239	179_20150616	but people are being radicalised are being incited to come it crimes so we have to be careful about the formulation and we have to change it i also agree with you education religious education some countries to lose some dontnidonttbutthisperhole question of islamophobia it is not is a long which is a problem	but people are being radicalised are being incited to come it crimes so we have to be careful about the formulation and we have to change it i also agree with you education religious education some countries to lose some dontnidonttbutthisperhole question of islamophobia it is not is a long which is a problem	/media/hugo/Seagate Expansion Drive/ALICE_BACKUP/voshpde/wav_files/zipfiles/20150616.wav	0
180	/media/hugo/Seagate Expansion Drive/ALICE_BACKUP/voshpde/pipeLine/segmentation_wavfiles/20150616/181_20150616.wav	4066.604081632653	179337240	4084.554081632653	180128835	180_20150616	its certain extreme practices island is not a problem for any country religion is not a problem for any country any whey every one has the right to have a fait but it is criminal practice	its certain extreme practices island is not a problem for any country religion is not a problem for any country any whey every one has the right to have a fait but it is criminal practice	/media/hugo/Seagate Expansion Drive/ALICE_BACKUP/voshpde/wav_files/zipfiles/20150616.wav	0
181	/media/hugo/Seagate Expansion Drive/ALICE_BACKUP/voshpde/pipeLine/segmentation_wavfiles/20150616/182_20150616.wav	4084.55410430839	180128836	4107.50410430839	181140931	181_20150616	pa when religion is a pretext so we have to prevent some european citizens spain digmatised at the same time we have to prevent being a nuclear entionear or i	when religion is a pretext so we have to prevent some european citizens ten digmatised at the same time we have to prevent being a nuclear entionear or a	/media/hugo/Seagate Expansion Drive/ALICE_BACKUP/voshpde/wav_files/zipfiles/20150616.wav	8
182	/media/hugo/Seagate Expansion Drive/ALICE_BACKUP/voshpde/pipeLine/segmentation_wavfiles/20150616/183_20150616.wav	4107.504126984127	181140932	4131.954126984127	182219177	182_20150616	and being a muslim at the same time makes it very difficult for that persons to get a jobs so we have to talk about is it is a real problem and some people do not want to mention this do not want to hear about it because speaks our very sensitive subject i agree that il on saudi arabia	and being a muslim at the same time makes it very difficult for that persons to get a jobs so we have to talk about is it is a real problem and some people do not want to mention this do not want to hear about it because speaks our very sensitive subject i agree that elin on saudi arabia	/media/hugo/Seagate Expansion Drive/ALICE_BACKUP/voshpde/wav_files/zipfiles/20150616.wav	3
