	wavfile	start_seconds	start_frames	end_seconds	end_frames	identifier	inferred_text	motherfile
101	/media/hugo/Seagate Expansion Drive/ALICE_BACKUP/voshpde/pipeLine/segmentation_wavfiles/20150608/102_20150608.wav	2275.3522902494333	100343036	2291.302290249433	101046431	101_20150608	and i am glad to inform you that new operation triton is already a reality the patrolling area has expanded i praise member states who contributed assetis	/media/hugo/Seagate Expansion Drive/ALICE_BACKUP/voshpde/wav_files/zipfiles/20150608.wav
102	/media/hugo/Seagate Expansion Drive/ALICE_BACKUP/voshpde/pipeLine/segmentation_wavfiles/20150608/103_20150608.wav	2291.30231292517	101046432	2309.95231292517	101868897	102_20150608	iceland finland malta vesum great britain and norway and get officers for deployments in tractor those at its along with the italian one sill with naval vessels from other member	/media/hugo/Seagate Expansion Drive/ALICE_BACKUP/voshpde/wav_files/zipfiles/20150608.wav
103	/media/hugo/Seagate Expansion Drive/ALICE_BACKUP/voshpde/pipeLine/segmentation_wavfiles/20150608/104_20150608.wav	2309.952335600907	101868898	2335.502335600907	102995653	103_20150608	great britain germany ireland who contribute to the search and rest cooperation have saved the life of over zero people in the last two weeks over the quicken thirty two incidents were reported to frontex with approximately five zero seven hundred migrant respute in the central mediterrane the italian authorities	/media/hugo/Seagate Expansion Drive/ALICE_BACKUP/voshpde/wav_files/zipfiles/20150608.wav
104	/media/hugo/Seagate Expansion Drive/ALICE_BACKUP/voshpde/pipeLine/segmentation_wavfiles/20150608/105_20150608.wav	2335.502358276644	102995654	2358.152358276644	103994519	104_20150608	assisted by the screening teams deployed by frontex in joint operation trite are working on the identification of the people disembark and taking care of their accommodation and other means finally as part of the immediate reaction the foreign affairs council is tying to launch the cdp operation	/media/hugo/Seagate Expansion Drive/ALICE_BACKUP/voshpde/wav_files/zipfiles/20150608.wav
105	/media/hugo/Seagate Expansion Drive/ALICE_BACKUP/voshpde/pipeLine/segmentation_wavfiles/20150608/106_20150608.wav	2358.152380952381	103994520	2375.2023809523807	104746425	105_20150608	to disrupt human smuggling networks in the southern central mediterranean on june two thousand twenty two this agenda migration is also a strategy that should lead us forward in the next five to ten years the agenda	/media/hugo/Seagate Expansion Drive/ALICE_BACKUP/voshpde/wav_files/zipfiles/20150608.wav
106	/media/hugo/Seagate Expansion Drive/ALICE_BACKUP/voshpde/pipeLine/segmentation_wavfiles/20150608/107_20150608.wav	2375.2024036281177	104746426	2398.252403628118	105762931	106_20150608	responds to parliaments call for a genuinely holistic approach to migration and takes into account many of the ideas and requests formulated in this committee we are igar to work with you and her year views on the emergency response system based on article it paragratree of the treaty	/media/hugo/Seagate Expansion Drive/ALICE_BACKUP/voshpde/wav_files/zipfiles/20150608.wav
107	/media/hugo/Seagate Expansion Drive/ALICE_BACKUP/voshpde/pipeLine/segmentation_wavfiles/20150608/108_20150608.wav	2398.252426303855	105762932	2419.7024263038547	106708877	107_20150608	this was also suggested in your resolution on a migration ever the commission will also come forward by the end of two thousand and fifteen with a proposal for a more structural mechanism to active ate in case of future crisis	/media/hugo/Seagate Expansion Drive/ALICE_BACKUP/voshpde/wav_files/zipfiles/20150608.wav
108	/media/hugo/Seagate Expansion Drive/ALICE_BACKUP/voshpde/pipeLine/segmentation_wavfiles/20150608/109_20150608.wav	2419.7024489795917	106708878	2440.752448979592	107637183	108_20150608	the protection of migrants fundamental rights is a key concern especially when it comes to vulnerable group in this respect i expect agreement to be found during the upcoming trialogues on the regulation on anaccompanying minors	/media/hugo/Seagate Expansion Drive/ALICE_BACKUP/voshpde/wav_files/zipfiles/20150608.wav
109	/media/hugo/Seagate Expansion Drive/ALICE_BACKUP/voshpde/pipeLine/segmentation_wavfiles/20150608/110_20150608.wav	2440.752471655329	107637184	2468.602471655329	108865369	109_20150608	in addition i would like to thank parliament for all the work done on the students and research directive we should swiftly finalise this file which is a cornerstone of the well managed regular migration policy the commission is also reviewing the eu blue card directive in order to make it more effective	/media/hugo/Seagate Expansion Drive/ALICE_BACKUP/voshpde/wav_files/zipfiles/20150608.wav
110	/media/hugo/Seagate Expansion Drive/ALICE_BACKUP/voshpde/pipeLine/segmentation_wavfiles/20150608/111_20150608.wav	2468.602494331066	108865370	2497.252494331066	110128835	110_20150608	regarding our smart borders i would thank this committee for the hearing that was organised with national parliaments can gave us the chance to reflect on a number of sensitive issues not ably access for law enforcement purposes i would make a statement in the plenary tomorrow on the preparation of the proposals which we aim to table in early two thousand and fifteen	/media/hugo/Seagate Expansion Drive/ALICE_BACKUP/voshpde/wav_files/zipfiles/20150608.wav
111	/media/hugo/Seagate Expansion Drive/ALICE_BACKUP/voshpde/pipeLine/segmentation_wavfiles/20150608/112_20150608.wav	2497.252517006803	110128836	2517.2025170068027	111008631	111_20150608	we will also launch a public consultation to that tank i would also like to recall the visa package presented in april two thousand and fourteen the two proposal it contains are under your examination we must make sweet progress on both	/media/hugo/Seagate Expansion Drive/ALICE_BACKUP/voshpde/wav_files/zipfiles/20150608.wav
112	/media/hugo/Seagate Expansion Drive/ALICE_BACKUP/voshpde/pipeLine/segmentation_wavfiles/20150608/113_20150608.wav	2517.2025396825397	111008632	2540.35253968254	112029547	112_20150608	and examine them in parallel neanles to say that in line with the two agendas cooperation with third countries will become even more important in the near future together with the high representative mogherini we are refocusing our interventions in regions that are essential for our security and migration priorities	/media/hugo/Seagate Expansion Drive/ALICE_BACKUP/voshpde/wav_files/zipfiles/20150608.wav
113	/media/hugo/Seagate Expansion Drive/ALICE_BACKUP/voshpde/pipeLine/segmentation_wavfiles/20150608/114_20150608.wav	2540.352562358277	112029548	2556.7025623582767	112750583	113_20150608	let me remind you that in the field of security once the european court of justice has issued its opinion on the draft pnr agreement with canada and based on the courts conclusions the commission	/media/hugo/Seagate Expansion Drive/ALICE_BACKUP/voshpde/wav_files/zipfiles/20150608.wav
114	/media/hugo/Seagate Expansion Drive/ALICE_BACKUP/voshpde/pipeLine/segmentation_wavfiles/20150608/115_20150608.wav	2556.7025850340137	112750584	2581.1525850340136	113828829	114_20150608	will finalise work on legally sound and sustainable solutions to exchange pnr data with other third countries including by considering a model agreement on pena finally as commissioner for citizenship i am tend to give new momentum to the europe for citizens programme and also create	/media/hugo/Seagate Expansion Drive/ALICE_BACKUP/voshpde/wav_files/zipfiles/20150608.wav
115	/media/hugo/Seagate Expansion Drive/ALICE_BACKUP/voshpde/pipeLine/segmentation_wavfiles/20150608/116_20150608.wav	2581.1526077097506	113828830	2596.7026077097507	114514585	115_20150608	and initiate synergies with other areas of my prortofolia parliament will be a crucial partner in implementing the key actions and looking forward to hearing your contributions on the agendas	/media/hugo/Seagate Expansion Drive/ALICE_BACKUP/voshpde/wav_files/zipfiles/20150608.wav
116	/media/hugo/Seagate Expansion Drive/ALICE_BACKUP/voshpde/pipeLine/segmentation_wavfiles/20150608/117_20150608.wav	2596.7026303854877	114514586	2616.9526303854877	115407611	116_20150608	and to keep working in gold cooperation on very implementation thank you very much for your dentandyouareivelabecauseyoun	/media/hugo/Seagate Expansion Drive/ALICE_BACKUP/voshpde/wav_files/zipfiles/20150608.wav
117	/media/hugo/Seagate Expansion Drive/ALICE_BACKUP/voshpde/pipeLine/segmentation_wavfiles/20150608/118_20150608.wav	2616.9526530612243	115407612	2635.8026530612246	116238897	117_20150608	you are doing the work of that we appreciate he a statistic explain my her to be late the second thing is that i want to hear at you consistently mentioned in your opening remark the work of the committee which i do appreciate and went to the work that colleagues are doing here which out	/media/hugo/Seagate Expansion Drive/ALICE_BACKUP/voshpde/wav_files/zipfiles/20150608.wav
118	/media/hugo/Seagate Expansion Drive/ALICE_BACKUP/voshpde/pipeLine/segmentation_wavfiles/20150608/119_20150608.wav	2635.8026757369616	116238898	2665.5526757369616	117550873	118_20150608	i think was really helpful colleges when finish met meeking eight thirty so we are going to fit to the political agreement which we are made which is that it is going to be coordinators many of you have asked for the floor if we do have time we will do that but that is what technic technically known as a lie from the chair so look forgo to the coordinators as we agreed politically so we go first to to mr tolmy from the epp no to rebertemutila for the epp	/media/hugo/Seagate Expansion Drive/ALICE_BACKUP/voshpde/wav_files/zipfiles/20150608.wav
119	/media/hugo/Seagate Expansion Drive/ALICE_BACKUP/voshpde/pipeLine/segmentation_wavfiles/20150608/120_20150608.wav	2665.552698412698	117550874	2687.9026984126986	118536509	119_20150608	vermmrpresidentiwpresdenttheposition on our of our group allow me to start up by thanking you commissioner for all your hard work this so far and for taking the bull by the hones on a number of important issues in particular we welcome your strong commitment on migration policy and the relief in due time of the european migration agenda	/media/hugo/Seagate Expansion Drive/ALICE_BACKUP/voshpde/wav_files/zipfiles/20150608.wav
120	/media/hugo/Seagate Expansion Drive/ALICE_BACKUP/voshpde/pipeLine/segmentation_wavfiles/20150608/121_20150608.wav	2687.9027210884356	118536510	2712.7527210884355	119632395	120_20150608	we are particularly pleased that the commission had the courage to move forward so quickly on this issue on the proposal for a council decision on emergency measures for italy and greece this is a good step in the right direction but we would emphasise however that many member states have their concerns over the restrictive approach of the commission on this matter particularly with the criteria establishing the distribution key	/media/hugo/Seagate Expansion Drive/ALICE_BACKUP/voshpde/wav_files/zipfiles/20150608.wav
121	/media/hugo/Seagate Expansion Drive/ALICE_BACKUP/voshpde/pipeLine/segmentation_wavfiles/20150608/122_20150608.wav	2712.7527437641725	119632396	2734.9027437641726	120609211	121_20150608	territory it would team was not given the due waiting it deserves and we would therefore ask the commission to explain how it will intend to address those what we believe are justified concerns on another issue we hope that the commission will come up bet for the end of the year with concrete measures to better tackle child sexual abuse including awareness campaigns	/media/hugo/Seagate Expansion Drive/ALICE_BACKUP/voshpde/wav_files/zipfiles/20150608.wav
122	/media/hugo/Seagate Expansion Drive/ALICE_BACKUP/voshpde/pipeLine/segmentation_wavfiles/20150608/123_20150608.wav	2734.902766439909	120609212	2757.552766439909	121608077	122_20150608	we also welcome your commitment to propose before the end of the general framework for international agreement on the transfer of pnr data and the proposal for a mandate on the eu eu mexico pnr at for the priorities for the commission work programme of two thousand and fifteen i am here i collected the questions of my colleague and i will like them here	/media/hugo/Seagate Expansion Drive/ALICE_BACKUP/voshpde/wav_files/zipfiles/20150608.wav
123	/media/hugo/Seagate Expansion Drive/ALICE_BACKUP/voshpde/pipeLine/segmentation_wavfiles/20150608/124_20150608.wav	2757.552789115646	121608078	2784.5027891156465	122796573	123_20150608	we would emphity that the conclusion of the implementation process of the european strategy on migration should be one of the priority we would also like to see the presentation without delay of the revised proposal on smart borders the transposition and implementation report on the directive on attacks against information systems ensuring the full implementation of the european strategy on security	/media/hugo/Seagate Expansion Drive/ALICE_BACKUP/voshpde/wav_files/zipfiles/20150608.wav
124	/media/hugo/Seagate Expansion Drive/ALICE_BACKUP/voshpde/pipeLine/segmentation_wavfiles/20150608/125_20150608.wav	2784.502811791383	122796574	2802.4528117913833	123588169	124_20150608	new proposals to combat terrorist financing we believe it is time to reevaluate the feedability of a european terrorist finance racking system we would like to ensure the proper follow up to our recommendations on preventing and countering youth radicalisation in the union	/media/hugo/Seagate Expansion Drive/ALICE_BACKUP/voshpde/wav_files/zipfiles/20150608.wav
125	/media/hugo/Seagate Expansion Drive/ALICE_BACKUP/voshpde/pipeLine/segmentation_wavfiles/20150608/126_20150608.wav	2802.4528344671203	123588170	2824.6028344671204	124564985	125_20150608	and finally we would like to see the implementation of the europe for citizens programme we would call on the commission to publish a communication on e public e participation and evoting in europe how to improve in other words eu citizens political and electoral participation for the d	/media/hugo/Seagate Expansion Drive/ALICE_BACKUP/voshpde/wav_files/zipfiles/20150608.wav
126	/media/hugo/Seagate Expansion Drive/ALICE_BACKUP/voshpde/pipeLine/segmentation_wavfiles/20150608/127_20150608.wav	2824.602857142857	124564986	2849.252857142857	125652051	126_20150608	m present president i welcome in later of potovavadi gives my speaking president if to feel your speaking for the sd the agreement was that coordinators with speak i am glad everyone sticking to my agreement thank you very m in the internet can you really helping me this evening to feel your speaking to the sd	/media/hugo/Seagate Expansion Drive/ALICE_BACKUP/voshpde/wav_files/zipfiles/20150608.wav
127	/media/hugo/Seagate Expansion Drive/ALICE_BACKUP/voshpde/pipeLine/segmentation_wavfiles/20150608/128_20150608.wav	2849.252879818594	125652052	2873.902879818594	126739117	127_20150608	mr president on behalf of the s d group we have taken note of the effort by the commission to try to come to grit with migration effect a lot of the point in the agenda and the measures are in line with this house at fors and i can ensure you that you can count on	/media/hugo/Seagate Expansion Drive/ALICE_BACKUP/voshpde/wav_files/zipfiles/20150608.wav
128	/media/hugo/Seagate Expansion Drive/ALICE_BACKUP/voshpde/pipeLine/segmentation_wavfiles/20150608/129_20150608.wav	2873.902902494331	126739118	2893.152902494331	127588043	128_20150608	when comes to being clear on what is being put forward when it comes to a number of issues they have to be clarified because otherwise they may undermine come of the proposal on the table in particular when it comes to relocation	/media/hugo/Seagate Expansion Drive/ALICE_BACKUP/voshpde/wav_files/zipfiles/20150608.wav
129	/media/hugo/Seagate Expansion Drive/ALICE_BACKUP/voshpde/pipeLine/segmentation_wavfiles/20150608/130_20150608.wav	2893.152925170068	127588044	2917.202925170068	128648649	129_20150608	the mechanism will mainly hit the people who are international protection that account more than seventy explain indeed tail how do the commission plying to identify and provide protection on the basis of nationality and also the relocation mechanism	/media/hugo/Seagate Expansion Drive/ALICE_BACKUP/voshpde/wav_files/zipfiles/20150608.wav
130	/media/hugo/Seagate Expansion Drive/ALICE_BACKUP/voshpde/pipeLine/segmentation_wavfiles/20150608/131_20150608.wav	2917.202947845805	128648650	2938.152947845805	129572545	130_20150608	can really work it can only work if there is good governance in addition the relocation mechanism will without in titative eu effects	/media/hugo/Seagate Expansion Drive/ALICE_BACKUP/voshpde/wav_files/zipfiles/20150608.wav
131	/media/hugo/Seagate Expansion Drive/ALICE_BACKUP/voshpde/pipeLine/segmentation_wavfiles/20150608/132_20150608.wav	2938.152970521542	129572546	2954.902970521542	130311221	131_20150608	only if the good governance when it comes to near asylum pocetoit in particular when it comes to integrating refugees but also reflecting the right of refugees when it comes to they will be located to	/media/hugo/Seagate Expansion Drive/ALICE_BACKUP/voshpde/wav_files/zipfiles/20150608.wav
132	/media/hugo/Seagate Expansion Drive/ALICE_BACKUP/voshpde/pipeLine/segmentation_wavfiles/20150608/133_20150608.wav	2954.902993197279	130311222	2983.352993197279	131565867	132_20150608	are iter going to be additional proposal fifty to it that the will be good governance of the italum procedures and i would also ask and to go whether the commissioner thinks sufficient the fund four years to deal with twenty zero refuges as fifteen by the proposal we have all knoted the future revision of the blue card in two thousand and fifteen however	/media/hugo/Seagate Expansion Drive/ALICE_BACKUP/voshpde/wav_files/zipfiles/20150608.wav
133	/media/hugo/Seagate Expansion Drive/ALICE_BACKUP/voshpde/pipeLine/segmentation_wavfiles/20150608/134_20150608.wav	2983.353015873016	131565868	3006.703015873016	132595603	133_20150608	that is not the right way forward when it comes to the welcoming of legal migrant do you see that blue card being appropriate for these millions of people who are highly skilled i specialise defend is when it comes to new agenda for security	/media/hugo/Seagate Expansion Drive/ALICE_BACKUP/voshpde/wav_files/zipfiles/20150608.wav
134	/media/hugo/Seagate Expansion Drive/ALICE_BACKUP/voshpde/pipeLine/segmentation_wavfiles/20150608/135_20150608.wav	3006.703038548753	132595604	3030.953038548753	133665029	134_20150608	before the adoption of any new measure the parliament ask for a review a full comprehensive review of existing measures however it would seem that the commission did not take that into account there are commitment on the part of the commission to pursue a review and to submit the findings to parliament thank you	/media/hugo/Seagate Expansion Drive/ALICE_BACKUP/voshpde/wav_files/zipfiles/20150608.wav
135	/media/hugo/Seagate Expansion Drive/ALICE_BACKUP/voshpde/pipeLine/segmentation_wavfiles/20150608/136_20150608.wav	3030.95306122449	133665030	3054.60306122449	134707995	135_20150608	mr president for the ecr mr cop and thank mr great president can i first of all welcome the commissioner and i just have some brief questions or him whilst we all understand the pressures which certain countries are facing currently	/media/hugo/Seagate Expansion Drive/ALICE_BACKUP/voshpde/wav_files/zipfiles/20150608.wav
136	/media/hugo/Seagate Expansion Drive/ALICE_BACKUP/voshpde/pipeLine/segmentation_wavfiles/20150608/137_20150608.wav	3054.603083900227	134707996	3073.853083900227	135556921	136_20150608	i would like to ask the commission what they are planning to do about detention conditions and fundamental rights for those asylum seekers in the pressurised member states and how true the use of eu resources fundamental rights of asylum seekers will be correctly addressed	/media/hugo/Seagate Expansion Drive/ALICE_BACKUP/voshpde/wav_files/zipfiles/20150608.wav
137	/media/hugo/Seagate Expansion Drive/ALICE_BACKUP/voshpde/pipeLine/segmentation_wavfiles/20150608/138_20150608.wav	3073.853106575964	135556922	3099.703106575964	136696907	137_20150608	secondly can the european commission also tell us what they are planning to do about the situation we see currently in calay where asylum seekers are clambering onto trucks and cars in their hundreds and living in a falling conditions what action is the european commission taking and what is the european commission doing with the french authorities and transport operators to deal with this problem and finally i just want to emphasise in response to the commission s	/media/hugo/Seagate Expansion Drive/ALICE_BACKUP/voshpde/wav_files/zipfiles/20150608.wav
138	/media/hugo/Seagate Expansion Drive/ALICE_BACKUP/voshpde/pipeLine/segmentation_wavfiles/20150608/139_20150608.wav	3099.703129251701	136696908	3128.0531292517007	137947143	138_20150608	statement my commitment to the eu pnr file is well known an absolute i want however all groups to feel they have been listened to as well and that their questions that they have raised with the commission have been answered i wander if the commissioner would be prepared to confirm at that is in train that would be of course of great support to me in meeting our timetable i	/media/hugo/Seagate Expansion Drive/ALICE_BACKUP/voshpde/wav_files/zipfiles/20150608.wav
139	/media/hugo/Seagate Expansion Drive/ALICE_BACKUP/voshpde/pipeLine/segmentation_wavfiles/20150608/140_20150608.wav	3128.0531519274377	137947144	3149.0031519274376	138871039	139_20150608	mthealdr president i thank to you commissioner for sharing the evening without in strasbourg tonight thank you very much for for the ambitious european agenda on migration that you please thank it	/media/hugo/Seagate Expansion Drive/ALICE_BACKUP/voshpde/wav_files/zipfiles/20150608.wav
140	/media/hugo/Seagate Expansion Drive/ALICE_BACKUP/voshpde/pipeLine/segmentation_wavfiles/20150608/141_20150608.wav	3149.0031746031746	138871040	3169.0531746031747	139755245	140_20150608	we have all third you mentioned in this house in our resolution in april call for safe and legal access to the eu for asylum seekers and i am extremely happy to see that this is also a priority in the commission programme what we are doing together the two institutions is that we are breaking the eyes together and we should be	/media/hugo/Seagate Expansion Drive/ALICE_BACKUP/voshpde/wav_files/zipfiles/20150608.wav
141	/media/hugo/Seagate Expansion Drive/ALICE_BACKUP/voshpde/pipeLine/segmentation_wavfiles/20150608/142_20150608.wav	3169.0531972789117	139755246	3198.8031972789117	141067221	141_20150608	equally proud for that i have nevertheless studied your proposal for increased ree settlement and i am i am pleased that you are stepping up the effort but however we need to clarify if your ambition for the twenty zero reeled persons will be that referring to twenty zero thirty year which i hope it that but this is heavenly heavily discussed out there in the member states we need to clarify that	/media/hugo/Seagate Expansion Drive/ALICE_BACKUP/voshpde/wav_files/zipfiles/20150608.wav
142	/media/hugo/Seagate Expansion Drive/ALICE_BACKUP/voshpde/pipeLine/segmentation_wavfiles/20150608/143_20150608.wav	3198.8032199546487	141067222	3216.7532199546486	141858817	142_20150608	i also would like to underline the importance of all member state participating in the scheme i know that we share the ambition but it wont be interesting to know how on earth are you going to make sure that the member state actually do not partispipate at the and other date	/media/hugo/Seagate Expansion Drive/ALICE_BACKUP/voshpde/wav_files/zipfiles/20150608.wav
143	/media/hugo/Seagate Expansion Drive/ALICE_BACKUP/voshpde/pipeLine/segmentation_wavfiles/20150608/144_20150608.wav	3216.7532426303856	141858818	3241.4032426303856	142945883	143_20150608	your proposal long resettlement is based on a distribution key on population qualitative data such as population gdp and employment rate cer but would you also be willing to discus qualitative data such as family tie language religion at cetera things we know that this might improve the whole prospect of integration	/media/hugo/Seagate Expansion Drive/ALICE_BACKUP/voshpde/wav_files/zipfiles/20150608.wav
144	/media/hugo/Seagate Expansion Drive/ALICE_BACKUP/voshpde/pipeLine/segmentation_wavfiles/20150608/145_20150608.wav	3241.4032653061226	142945884	3270.7532653061226	144240219	144_20150608	in your action plan plan against to migrant smuggling you mention the possibility of amending the frontex legal basis to strengthen its role on return in that context would it also be possible to force a complete recast of the frontex regulation in order to allow for the agency to actually do proactive thurch and rescue operation in the high feed	/media/hugo/Seagate Expansion Drive/ALICE_BACKUP/voshpde/wav_files/zipfiles/20150608.wav
145	/media/hugo/Seagate Expansion Drive/ALICE_BACKUP/voshpde/pipeLine/segmentation_wavfiles/20150608/146_20150608.wav	3270.7532879818596	144240220	3298.6032879818595	145468405	145_20150608	as you remember we worked hard on that last mandate and is is very well needed and i am sure that a rapporteur that time would agree with me on that last but not ly i would like to come like to what you mention on article eight four on the dublin regulation of which i am the rapporteur it would be useful for this house confirm your full commitment	/media/hugo/Seagate Expansion Drive/ALICE_BACKUP/voshpde/wav_files/zipfiles/20150608.wav
