	wavfile	start_seconds	start_frames	end_seconds	end_frames	identifier	inferred_text	motherfile
280	/media/hugo/Seagate Expansion Drive/ALICE_BACKUP/voshpde/pipeLine/segmentation_wavfiles/20150127/281_20150127.wav	6307.006349206349	278138980	6327.65634920635	279049645	280_20150127	in the vicinity including the western balkans and the middle east we need better controls over the arms trade so that arms do not get into the wrong hands and we need better controls over financial flows going towards terrorist organisations i am	/media/hugo/Seagate Expansion Drive/ALICE_BACKUP/voshpde/wav_files/zipfiles/20150127.wav
281	/media/hugo/Seagate Expansion Drive/ALICE_BACKUP/voshpde/pipeLine/segmentation_wavfiles/20150127/282_20150127.wav	6327.656371882086	279049646	6344.506371882087	279792731	281_20150127	the shadow rapporteur of the epp on the financial transaction regulation and such i would like to welcome the agreement between the european parliament and the council on the money laundering	/media/hugo/Seagate Expansion Drive/ALICE_BACKUP/voshpde/wav_files/zipfiles/20150127.wav
282	/media/hugo/Seagate Expansion Drive/ALICE_BACKUP/voshpde/pipeLine/segmentation_wavfiles/20150127/283_20150127.wav	6344.506394557823	279792732	6359.8563945578235	280469667	282_20150127	regulation and the money laundering directive indeed we need to struggle against terrorist finances because if they do not have money they will be powerless and that is why we need special measures	/media/hugo/Seagate Expansion Drive/ALICE_BACKUP/voshpde/wav_files/zipfiles/20150127.wav
283	/media/hugo/Seagate Expansion Drive/ALICE_BACKUP/voshpde/pipeLine/segmentation_wavfiles/20150127/284_20150127.wav	6359.85641723356	280469668	6376.30641723356	281195113	283_20150127	and do you envisage any special measures this is my question in order to have better controls over financial flows for certain geographical regions and also over finances of suspect thank you ms	/media/hugo/Seagate Expansion Drive/ALICE_BACKUP/voshpde/wav_files/zipfiles/20150127.wav
284	/media/hugo/Seagate Expansion Drive/ALICE_BACKUP/voshpde/pipeLine/segmentation_wavfiles/20150127/285_20150127.wav	6376.306439909297	281195114	6406.056439909297	282507089	284_20150127	mr president my dear colleagues we all know that there is a lot of refugees reaching the european continent meanly from syria and it would appear that in the very best scenario	/media/hugo/Seagate Expansion Drive/ALICE_BACKUP/voshpde/wav_files/zipfiles/20150127.wav
285	/media/hugo/Seagate Expansion Drive/ALICE_BACKUP/voshpde/pipeLine/segmentation_wavfiles/20150127/286_20150127.wav	6406.056462585034	282507090	6429.806462585034	283554465	285_20150127	they are only being marginally screened are so perficially screened on arrival on the basis of their idea but research shows that terrorists are deliberately destroying their id and able to travel throughout the whole schengen area without	/media/hugo/Seagate Expansion Drive/ALICE_BACKUP/voshpde/wav_files/zipfiles/20150127.wav
286	/media/hugo/Seagate Expansion Drive/ALICE_BACKUP/voshpde/pipeLine/segmentation_wavfiles/20150127/287_20150127.wav	6429.806485260771	283554466	6453.956485260771	284619481	286_20150127	now without wishing to in court in any way on the right of refugees to apply for asylum is the commission not planning any specific actions to stop potential terrorists when they reach our borders very	/media/hugo/Seagate Expansion Drive/ALICE_BACKUP/voshpde/wav_files/zipfiles/20150127.wav
287	/media/hugo/Seagate Expansion Drive/ALICE_BACKUP/voshpde/pipeLine/segmentation_wavfiles/20150127/288_20150127.wav	6453.956507936508	284619482	6479.506507936508	285746237	287_20150127	mr pesideyverymchthankyoverymuchmr director for your clear presentation we need new measures and actions and first of all we need to start preparation of the renewal of the european internal security strategy	/media/hugo/Seagate Expansion Drive/ALICE_BACKUP/voshpde/wav_files/zipfiles/20150127.wav
288	/media/hugo/Seagate Expansion Drive/ALICE_BACKUP/voshpde/pipeLine/segmentation_wavfiles/20150127/289_20150127.wav	6479.506530612245	285746238	6500.356530612245	286665723	288_20150127	as we proposed in the european parliament resolution on december and we need a fast track for this work with an inclusion of the european parliament on that work where is the commission on the preparation of this strategy and when can we count to see some proposals from your side	/media/hugo/Seagate Expansion Drive/ALICE_BACKUP/voshpde/wav_files/zipfiles/20150127.wav
289	/media/hugo/Seagate Expansion Drive/ALICE_BACKUP/voshpde/pipeLine/segmentation_wavfiles/20150127/290_20150127.wav	6500.356553287982	286665724	6523.2065532879815	287673409	289_20150127	the internet is also used by the terrorist as a tool to disseminate terrorist material and as a tool for radicalisation we need tools to prevent it i believe this is not the censorship this is the possibility to remove material of terrorist propaganda which are illegal to this end we need cooperation	/media/hugo/Seagate Expansion Drive/ALICE_BACKUP/voshpde/wav_files/zipfiles/20150127.wav
290	/media/hugo/Seagate Expansion Drive/ALICE_BACKUP/voshpde/pipeLine/segmentation_wavfiles/20150127/291_20150127.wav	6523.206575963719	287673410	6548.056575963718	288769295	290_20150127	among the law enforcement authorities and internet companies but creating such a cooperation we have to remember that setting such solutions has to be discussed together with ensuring data protection and privacy guarantees for citizens may i ask whether you have started to discuss such solutions the edps and fundamental rights agencies	/media/hugo/Seagate Expansion Drive/ALICE_BACKUP/voshpde/wav_files/zipfiles/20150127.wav
291	/media/hugo/Seagate Expansion Drive/ALICE_BACKUP/voshpde/pipeLine/segmentation_wavfiles/20150127/292_20150127.wav	6548.056598639456	288769296	6567.506598639456	289627041	291_20150127	i believe that we should have in place the pnr directive taking into account how many third countries adopted similar legislation on how many member states are working on their solutions but of course it is better to have one pnr solution than twenty eight legal regimes on that	/media/hugo/Seagate Expansion Drive/ALICE_BACKUP/voshpde/wav_files/zipfiles/20150127.wav
292	/media/hugo/Seagate Expansion Drive/ALICE_BACKUP/voshpde/pipeLine/segmentation_wavfiles/20150127/293_20150127.wav	6567.506621315193	289627042	6589.156621315193	290581807	292_20150127	we need to join our efforts for security and privacy protection this two values are the two sides of one point we need security for our freedom and we need freedom for our security so we should refresh the discussion on pnr based on evidence and clear rules and in the context of data protection	/media/hugo/Seagate Expansion Drive/ALICE_BACKUP/voshpde/wav_files/zipfiles/20150127.wav
293	/media/hugo/Seagate Expansion Drive/ALICE_BACKUP/voshpde/pipeLine/segmentation_wavfiles/20150127/294_20150127.wav	6589.156643990929	290581808	6616.50664399093	291787943	293_20150127	at the same time i think that we need to radifin our understanding of the data retention directive after the explanation of the european court of justice we need to analyse all aspects for preparing the new directive following recommendations of the european court the question is in what way we should implement the courts recommendations could do give us some indications of how to achieve such goals	/media/hugo/Seagate Expansion Drive/ALICE_BACKUP/voshpde/wav_files/zipfiles/20150127.wav
294	/media/hugo/Seagate Expansion Drive/ALICE_BACKUP/voshpde/pipeLine/segmentation_wavfiles/20150127/295_20150127.wav	6616.506666666667	291787944	6636.856666666667	292685379	294_20150127	he bi cosies and reasonable at the aral of encryption we need to find solutions for security and early warning system related to the recognition of the threats but we do not need the back door to our citizens by a destruction of the encryption	/media/hugo/Seagate Expansion Drive/ALICE_BACKUP/voshpde/wav_files/zipfiles/20150127.wav
295	/media/hugo/Seagate Expansion Drive/ALICE_BACKUP/voshpde/pipeLine/segmentation_wavfiles/20150127/296_20150127.wav	6636.856689342404	292685380	6659.7066893424035	293693065	295_20150127	by default solutions last but not least if we want to implement all those solutions we need to finish other work on data protection package	/media/hugo/Seagate Expansion Drive/ALICE_BACKUP/voshpde/wav_files/zipfiles/20150127.wav
296	/media/hugo/Seagate Expansion Drive/ALICE_BACKUP/voshpde/pipeLine/segmentation_wavfiles/20150127/297_20150127.wav	6659.706712018141	293693066	6687.156712018141	294903611	296_20150127	we have to fight terrorism with all means and tools available it is not easy to find the right tools and means i would surpresse to hear the spanish position namely that inside the schengen zone we have to reintroduce morder checks molder controls nobody has ever mentioned this nobody has ever raised this i think this is unacceptable and not a possible solution	/media/hugo/Seagate Expansion Drive/ALICE_BACKUP/voshpde/wav_files/zipfiles/20150127.wav
297	/media/hugo/Seagate Expansion Drive/ALICE_BACKUP/voshpde/pipeLine/segmentation_wavfiles/20150127/298_20150127.wav	6687.156734693877	294903612	6714.306734693878	296100927	297_20150127	i still remember at the long accuse at the austria hungarian or german check borders when we had to wait hours to cross the border can you mention what it would mean if we reintroduce border checks where hundreds of thousands of people across the border every day for their for their daily commute especially in post communist countries	/media/hugo/Seagate Expansion Drive/ALICE_BACKUP/voshpde/wav_files/zipfiles/20150127.wav
298	/media/hugo/Seagate Expansion Drive/ALICE_BACKUP/voshpde/pipeLine/segmentation_wavfiles/20150127/299_20150127.wav	6714.306757369614	296100928	6739.556757369614	297214453	298_20150127	the number one achievement or benefit of eu membership is the freedom of movement reintroduction of border checks would be giant step backwards and would also be a victory for anti european forces my think how much with it cost to	/media/hugo/Seagate Expansion Drive/ALICE_BACKUP/voshpde/wav_files/zipfiles/20150127.wav
299	/media/hugo/Seagate Expansion Drive/ALICE_BACKUP/voshpde/pipeLine/segmentation_wavfiles/20150127/300_20150127.wav	6739.556780045352	297214454	6763.606780045351	298275059	299_20150127	effectively control europes internal borders should not we try to divert those resources to the protection of external borders side	/media/hugo/Seagate Expansion Drive/ALICE_BACKUP/voshpde/wav_files/zipfiles/20150127.wav
300	/media/hugo/Seagate Expansion Drive/ALICE_BACKUP/voshpde/pipeLine/segmentation_wavfiles/20150127/301_20150127.wav	6763.606802721089	298275060	6780.356802721089	299013735	300_20150127	i could now obese take hours to reply to your questions but i will try to be i will try to be as sure as possible first of all let me first of all let me let me be very clear with you	/media/hugo/Seagate Expansion Drive/ALICE_BACKUP/voshpde/wav_files/zipfiles/20150127.wav
301	/media/hugo/Seagate Expansion Drive/ALICE_BACKUP/voshpde/pipeLine/segmentation_wavfiles/20150127/302_20150127.wav	6780.356825396825	299013736	6797.2068253968255	299756821	301_20150127	mr president i think we are obviously discussing a lot of the issues since chalyhepdoand all the events which happened in paris and afterwards embelson but in reality we were discussing a lot of these issues before ha	/media/hugo/Seagate Expansion Drive/ALICE_BACKUP/voshpde/wav_files/zipfiles/20150127.wav
302	/media/hugo/Seagate Expansion Drive/ALICE_BACKUP/voshpde/pipeLine/segmentation_wavfiles/20150127/303_20150127.wav	6797.206848072562	299756822	6822.856848072563	300887987	302_20150127	men and it is not in my apologies to mr kurkov if i talked about a left of it is not that i have not been here sitting listening both madam manstrom and to mr abamopolosan terms of saying that there is a need to move ahead in terms of the eupnr it is not that we have not been discussing these things	/media/hugo/Seagate Expansion Drive/ALICE_BACKUP/voshpde/wav_files/zipfiles/20150127.wav
303	/media/hugo/Seagate Expansion Drive/ALICE_BACKUP/voshpde/pipeLine/segmentation_wavfiles/20150127/304_20150127.wav	6822.856870748299	300887988	6843.0068707483	301776603	303_20150127	also in the context of the internal security strategy is there and we should be moving ahead on that i have been ask in as much as european as concern	/media/hugo/Seagate Expansion Drive/ALICE_BACKUP/voshpde/wav_files/zipfiles/20150127.wav
304	/media/hugo/Seagate Expansion Drive/ALICE_BACKUP/voshpde/pipeLine/segmentation_wavfiles/20150127/305_20150127.wav	6843.006893424036	301776604	6861.156893424036	302577019	304_20150127	mr president how the meda costs of the data retention directive judgment could be in i think we all know that lots of discussions going on and speaking hills under the supervision of the european data protection supervisor	/media/hugo/Seagate Expansion Drive/ALICE_BACKUP/voshpde/wav_files/zipfiles/20150127.wav
305	/media/hugo/Seagate Expansion Drive/ALICE_BACKUP/voshpde/pipeLine/segmentation_wavfiles/20150127/306_20150127.wav	6861.156916099773	302577020	6887.306916099773	303730235	305_20150127	that in reality there needs needs to be discussion in terms of the scope needs to weak discussion in terms of the data attention period there needs to be discussion in terms of the role of data protection supervisory authorities in this context but i think you all now that	/media/hugo/Seagate Expansion Drive/ALICE_BACKUP/voshpde/wav_files/zipfiles/20150127.wav
306	/media/hugo/Seagate Expansion Drive/ALICE_BACKUP/voshpde/pipeLine/segmentation_wavfiles/20150127/307_20150127.wav	6887.30693877551	303730236	6915.45693877551	304971651	306_20150127	as much as questions that we all ask on implementations are concerned i think we have especially with the changes also in the treaty and the fact that we are actually now fully applying eu law and possibilities to start infringement proceedings are pushing implementation and a much stronger way than we ever have	/media/hugo/Seagate Expansion Drive/ALICE_BACKUP/voshpde/wav_files/zipfiles/20150127.wav
307	/media/hugo/Seagate Expansion Drive/ALICE_BACKUP/voshpde/pipeLine/segmentation_wavfiles/20150127/308_20150127.wav	6915.4569614512475	304971652	6942.106961451247	306146917	307_20150127	been doing so prm or the swedish initiative were mentioned here and i can assure you that the commission is putting a lot of pressure in terms of on the member states in terms of implementation something which we could not do before the first december of last year but also personally a been pushing this very strongly	/media/hugo/Seagate Expansion Drive/ALICE_BACKUP/voshpde/wav_files/zipfiles/20150127.wav
308	/media/hugo/Seagate Expansion Drive/ALICE_BACKUP/voshpde/pipeLine/segmentation_wavfiles/20150127/309_20150127.wav	6942.106984126985	306146918	6967.456984126984	307264853	308_20150127	no body in the debate whether it was on the level of the inter ministers the foreign ministers in the overall political debate in the cosy committee and son so fors has been putting into question schengen everybody thinks that schengen is one of the biggest are keys that we have in the european union and this is a good thing there is one	/media/hugo/Seagate Expansion Drive/ALICE_BACKUP/voshpde/wav_files/zipfiles/20150127.wav
309	/media/hugo/Seagate Expansion Drive/ALICE_BACKUP/voshpde/pipeLine/segmentation_wavfiles/20150127/310_20150127.wav	6967.4570068027215	307264854	6987.807006802721	308162289	309_20150127	question which is being debated and that is the effectiveness of the control of european citizens when they leave the european union there is a requirement in the schengen code to require to do systematic checks	/media/hugo/Seagate Expansion Drive/ALICE_BACKUP/voshpde/wav_files/zipfiles/20150127.wav
310	/media/hugo/Seagate Expansion Drive/ALICE_BACKUP/voshpde/pipeLine/segmentation_wavfiles/20150127/311_20150127.wav	6987.807029478458	308162290	7014.857029478458	309355195	310_20150127	in terms of the documents so any documents destroyed or falsified and all that but there is then a question of how to make sure in a certain situation either on entry or ex exit of eu citizens whether we can have a cross thread in terms of data in as much as identification as foreign fight us is concerned that is the	/media/hugo/Seagate Expansion Drive/ALICE_BACKUP/voshpde/wav_files/zipfiles/20150127.wav
311	/media/hugo/Seagate Expansion Drive/ALICE_BACKUP/voshpde/pipeLine/segmentation_wavfiles/20150127/312_20150127.wav	7014.857052154195	309355196	7044.607052154195	310667171	311_20150127	and it is a very if i can put it out relatively small debate which is linked to the overall question of risk analysis but i think we just have to be very clear with you there is no general debate on putting into question schengen or revising schengen in a general manner it is a question of gap analysis and whether we can actually within the present system function	/media/hugo/Seagate Expansion Drive/ALICE_BACKUP/voshpde/wav_files/zipfiles/20150127.wav
312	/media/hugo/Seagate Expansion Drive/ALICE_BACKUP/voshpde/pipeLine/segmentation_wavfiles/20150127/313_20150127.wav	7044.607074829932	310667172	7063.057074829932	311480817	312_20150127	i was ask when when we have a much more general on a holistic debate where we are preparing the european security agenda the planning at the moment of the commission is that the european security agenda would be put forward in april phase beginning of may	/media/hugo/Seagate Expansion Drive/ALICE_BACKUP/voshpde/wav_files/zipfiles/20150127.wav
313	/media/hugo/Seagate Expansion Drive/ALICE_BACKUP/voshpde/pipeLine/segmentation_wavfiles/20150127/314_20150127.wav	7063.057097505669	311480818	7082.507097505669	312338563	313_20150127	which will allow us than to have a more horizontal approach not only to terrorism but also to organise crime to anti corruption trafficking of human beings all these elements that you have also put into your resolution and this will be this will then be a kind of	/media/hugo/Seagate Expansion Drive/ALICE_BACKUP/voshpde/wav_files/zipfiles/20150127.wav
314	/media/hugo/Seagate Expansion Drive/ALICE_BACKUP/voshpde/pipeLine/segmentation_wavfiles/20150127/315_20150127.wav	7082.507120181406	312338564	7101.657120181406	313183079	314_20150127	five year action plan in terms of what we should be doing in terms of implementation and so on and so force and this would be probably the time than to have also more horizontal debate it is much as fire arms legislation is concerned	/media/hugo/Seagate Expansion Drive/ALICE_BACKUP/voshpde/wav_files/zipfiles/20150127.wav
315	/media/hugo/Seagate Expansion Drive/ALICE_BACKUP/voshpde/pipeLine/segmentation_wavfiles/20150127/316_20150127.wav	7101.657142857143	313183080	7129.107142857143	314393625	315_20150127	mr president i take the point that in reality you cannot change illegal behaviour through legislation but there are still quite substantial differences and national legislation on fire arms there is also perhaps a need in terms of feeding information systems schengen information system in providing information better information to europol and interpol	/media/hugo/Seagate Expansion Drive/ALICE_BACKUP/voshpde/wav_files/zipfiles/20150127.wav
316	/media/hugo/Seagate Expansion Drive/ALICE_BACKUP/voshpde/pipeLine/segmentation_wavfiles/20150127/317_20150127.wav	7129.10716553288	314393626	7153.0571655328795	315449821	316_20150127	there is obviously big need in terms of police cooperation which is also with third countries if you look at some of the roots of that fi arms take especially from the western balkans you can see that there are areas in which we could develop things quite closely	/media/hugo/Seagate Expansion Drive/ALICE_BACKUP/voshpde/wav_files/zipfiles/20150127.wav
317	/media/hugo/Seagate Expansion Drive/ALICE_BACKUP/voshpde/pipeLine/segmentation_wavfiles/20150127/318_20150127.wav	7153.057188208617	315449822	7175.307188208617	316431047	317_20150127	i did not mention a lot third countries and you have think in rich the debate by mentioning cooperation with third countries i think that is something which we could discuss for ours again where so will be concentrating on cooperation with turkey how do we cooperate with other third countries in this area	/media/hugo/Seagate Expansion Drive/ALICE_BACKUP/voshpde/wav_files/zipfiles/20150127.wav
318	/media/hugo/Seagate Expansion Drive/ALICE_BACKUP/voshpde/pipeLine/segmentation_wavfiles/20150127/319_20150127.wav	7175.3072108843535	316431048	7204.457210884354	317716563	318_20150127	i take the point that i did not mention education although it was clearly mentioned in the commission debate in terms of integration the appoint that mr borne was making in terms of cooperation on internet and with human rights agency and the edps is an important point	/media/hugo/Seagate Expansion Drive/ALICE_BACKUP/voshpde/wav_files/zipfiles/20150127.wav
319	/media/hugo/Seagate Expansion Drive/ALICE_BACKUP/voshpde/pipeLine/segmentation_wavfiles/20150127/320_20150127.wav	7204.457233560091	317716564	7226.007233560091	318666919	319_20150127	especially when you are moving towards some kind of governmental action the other question is is how do we actually encourage voluntary behaviour and whether there is also a need to discuss even if we are just encouraging voluntary behaviour in terms of removal of contact on the internet	/media/hugo/Seagate Expansion Drive/ALICE_BACKUP/voshpde/wav_files/zipfiles/20150127.wav
320	/media/hugo/Seagate Expansion Drive/ALICE_BACKUP/voshpde/pipeLine/segmentation_wavfiles/20150127/321_20150127.wav	7226.007256235827	318666920	7253.0572562358275	319859825	320_20150127	to me the big elephant in the room and it is a very difficult at ten and quite happy at you the cakofwill probably say lot on that as well is how do we make sure that we have bigger trust between member states in terms of exchange of information without them losing the data ownership	/media/hugo/Seagate Expansion Drive/ALICE_BACKUP/voshpde/wav_files/zipfiles/20150127.wav
321	/media/hugo/Seagate Expansion Drive/ALICE_BACKUP/voshpde/pipeLine/segmentation_wavfiles/20150127/322_20150127.wav	7253.057278911565	319859826	7275.807278911565	320863101	321_20150127	to certain extent we have in the schengen system with a sna system develop certain things we will have cooperation of the financial intelligence units we will have other cooperations we have the folcupoint travellers how do we make sure that there is enough trust	/media/hugo/Seagate Expansion Drive/ALICE_BACKUP/voshpde/wav_files/zipfiles/20150127.wav
322	/media/hugo/Seagate Expansion Drive/ALICE_BACKUP/voshpde/pipeLine/segmentation_wavfiles/20150127/323_20150127.wav	7275.8073015873015	320863102	7305.0573015873015	322153027	322_20150127	also in terms of sharing information in the system to make our systems work more effectively together and this is something which you cannot legislate don in reality this is something that you have to develop and is something which has to happen over the next year i sure i not unsend a lot of questions but temalsalian points i have hopefully touched	/media/hugo/Seagate Expansion Drive/ALICE_BACKUP/voshpde/wav_files/zipfiles/20150127.wav
323	/media/hugo/Seagate Expansion Drive/ALICE_BACKUP/voshpde/pipeLine/segmentation_wavfiles/20150127/324_20150127.wav	7305.057324263039	322153028	7324.607324263038	323015183	323_20150127	mr president on for time reasons i am going to move on now to the mr dikerkov the eu counterterrorism coordinator i am going to take ten minutes a substantial contribution from you been following that i was going to take questions directly from you but i am	/media/hugo/Seagate Expansion Drive/ALICE_BACKUP/voshpde/wav_files/zipfiles/20150127.wav
324	/media/hugo/Seagate Expansion Drive/ALICE_BACKUP/voshpde/pipeLine/segmentation_wavfiles/20150127/325_20150127.wav	7324.607346938776	323015184	7351.857346938776	324216909	324_20150127	hesitant now because if we have twenty seven twenty eight speakers after you and then we then take the other speakers i think things are going control i think the the problem we have is that there are just genuine questions based on expertise from this committee and we have substitute members ask on questions to colleagues with dossiers involved as well so that is that is the issue in this committee so know this is this is the issue so i think	/media/hugo/Seagate Expansion Drive/ALICE_BACKUP/voshpde/wav_files/zipfiles/20150127.wav
325	/media/hugo/Seagate Expansion Drive/ALICE_BACKUP/voshpde/pipeLine/segmentation_wavfiles/20150127/326_20150127.wav	7351.857369614512	324216910	7373.707369614513	325180495	325_20150127	but your contribution i think for ten minutes because i think it was restrict the last time so please and if it goes overuntabtlno problem so my too understand that after mr dekerkoalthe other speakers have can speak all other speakers before we are open up for question great thank you	/media/hugo/Seagate Expansion Drive/ALICE_BACKUP/voshpde/wav_files/zipfiles/20150127.wav
326	/media/hugo/Seagate Expansion Drive/ALICE_BACKUP/voshpde/pipeLine/segmentation_wavfiles/20150127/327_20150127.wav	7373.707392290249	325180496	7403.457392290249	326492471	326_20150127	mr thatrpideiam going to speak for french just in french of just for once in memory of the victims in france il tried to be brief because above all i would like colleagues to be able to speak the data protection supervisor and colleagues who are dealing with prevention and these are two issues that i think at are very important indeed	/media/hugo/Seagate Expansion Drive/ALICE_BACKUP/voshpde/wav_files/zipfiles/20150127.wav
