	wavfile	start_seconds	start_frames	end_seconds	end_frames	identifier	inferred_text_with_hotwords	inferred_text_without_hotwords	motherfile	dist
0	/media/hugo/Seagate Expansion Drive/ALICE_BACKUP/voshpde/pipeLine/segmentation_wavfiles/20150616/001_20150616.wav	0.0	0	28.65	1263465	000_20150616	ladies and gentlemen it is now two thirty and you were going to have the fun of myself in this chose aftenoninathe chairmen who i see is now arriving in fact a bit earlier than i thought had asked me to become a moderator this after un like this morning as proceedings and to wonder around and telling you all what to do all afternoon	ladies and gentlemen it is now two thirty and you were going to have the fun of myself in this chose aftenoninathechaismen who i see is now arriving in fact a bit earlier than i thought had asked me to become a moderator this after un like this morning as proceedings and to wonder around and telling you all what to do all afternoon	/media/hugo/Seagate Expansion Drive/ALICE_BACKUP/voshpde/wav_files/zipfiles/20150616.wav	2
1	/media/hugo/Seagate Expansion Drive/ALICE_BACKUP/voshpde/pipeLine/segmentation_wavfiles/20150616/002_20150616.wav	28.650022675736963	1263466	46.40002267573696	2046241	001_20150616	luckily the chairmen is now arrived in person and he will be now taking this chair and i should be vocating it	luckily the chairmen is now arrived in person and he will be now taking this chair and i should be vocating it	/media/hugo/Seagate Expansion Drive/ALICE_BACKUP/voshpde/wav_files/zipfiles/20150616.wav	0
2	/media/hugo/Seagate Expansion Drive/ALICE_BACKUP/voshpde/pipeLine/segmentation_wavfiles/20150616/003_20150616.wav	46.40004535147392	2046242	66.75004535147393	2943677	002_20150616	il eu	i very	/media/hugo/Seagate Expansion Drive/ALICE_BACKUP/voshpde/wav_files/zipfiles/20150616.wav	4
3	/media/hugo/Seagate Expansion Drive/ALICE_BACKUP/voshpde/pipeLine/segmentation_wavfiles/20150616/004_20150616.wav	66.75006802721089	2943678	83.60006802721088	3686763	003_20150616	the area eu ana il	the area on a	/media/hugo/Seagate Expansion Drive/ALICE_BACKUP/voshpde/wav_files/zipfiles/20150616.wav	7
4	/media/hugo/Seagate Expansion Drive/ALICE_BACKUP/voshpde/pipeLine/segmentation_wavfiles/20150616/005_20150616.wav	83.60009070294785	3686764	100.55009070294784	4434259	004_20150616	mpresdentbecause mr kercola kindly started the meeting an wandages keep to time keeping ana just explain out il formally ask mr ec to standing form eu for half an eu	mpresdentbecause mr kercola kindly started the meeting an wandages keep to time keeping a just explain out i formally ask mr kuc to standing form me for half an or	/media/hugo/Seagate Expansion Drive/ALICE_BACKUP/voshpde/wav_files/zipfiles/20150616.wav	9
5	/media/hugo/Seagate Expansion Drive/ALICE_BACKUP/voshpde/pipeLine/segmentation_wavfiles/20150616/006_20150616.wav	100.55011337868481	4434260	119.7001133786848	5278775	005_20150616	formally he had not just a fumather in some regulation ar manner we god ask him because now being an interview on the and in her weekin today but it finished on time to iris able to come on time to aldo de not losing at the moment i would like to thank him yet again for	formally he had not just a fumather in some regulationarymannerwe god ask him because now being an interview on the and in her weekin today but it finished on time to is able to come on time to alde not liming at the moment i would like to thank him yet again for	/media/hugo/Seagate Expansion Drive/ALICE_BACKUP/voshpde/wav_files/zipfiles/20150616.wav	10
6	/media/hugo/Seagate Expansion Drive/ALICE_BACKUP/voshpde/pipeLine/segmentation_wavfiles/20150616/007_20150616.wav	119.70013605442176	5278776	146.15013605442178	6445221	006_20150616	a trade eu take peter in this capacity when the other vice chairs are not able to nou i would like to thank him for doing that and also he de this an another occasion and i would like to thank you for doing and helping both me and efect yet and thank yous office as well thank you very much to it me and yet the de enjoy it would me chair with the t is du that a very good	a preside you take parcere in this capacity when the other vice chairs are not able to nou i would like to thank him for doing that and also he did this an another occasion and i would like to thank you for doing and helping both me and efect yet and thank yous office as well thank you very much to it me and yet the do enjoy it would me char with the t is fi that a very good	/media/hugo/Seagate Expansion Drive/ALICE_BACKUP/voshpde/wav_files/zipfiles/20150616.wav	16
7	/media/hugo/Seagate Expansion Drive/ALICE_BACKUP/voshpde/pipeLine/segmentation_wavfiles/20150616/008_20150616.wav	146.15015873015872	6445222	169.30015873015873	7466137	007_20150616	thank you very much coligueiljustaleadoptthe agenda net six seven and eight were all as the rapporteur have to be cospornd of the opinion of the legal service was to be presented that the meeting is now not available and again if the eu ana objection of the agenda to adopted as modified to be de il eu tit prof gi	thank you very much coligueiljustaleadoptthe agenda went six seven and eight were all as the rapbetter have to be cospornd of the opinion of the legal service was to be presented that the meeting is now not available and again if the or a ne objection of the agenda to adopted as modified to be gialestitprofigiv	/media/hugo/Seagate Expansion Drive/ALICE_BACKUP/voshpde/wav_files/zipfiles/20150616.wav	20
8	/media/hugo/Seagate Expansion Drive/ALICE_BACKUP/voshpde/pipeLine/segmentation_wavfiles/20150616/009_20150616.wav	169.3001814058957	7466138	189.35018140589568	8350343	008_20150616	i have a okigocolleagsititscalon to been durslin of coordinators recommendations an eu role to five and il ntinuetoitoquickleas possible a the nomination of rapporteurs we have mrs monica whole mire of the epp	i have a okigocolleagsititscalon to been durslin of coordinators recommendations on the role to five and illntinuetoitoquickleaspossibletaenomination of rapporteurs we have ms many ca whole mire of the epp	/media/hugo/Seagate Expansion Drive/ALICE_BACKUP/voshpde/wav_files/zipfiles/20150616.wav	15
9	/media/hugo/Seagate Expansion Drive/ALICE_BACKUP/voshpde/pipeLine/segmentation_wavfiles/20150616/010_20150616.wav	189.35020408163265	8350344	212.70020408163265	9380079	009_20150616	for the implementation report on directive two thousand and eleven ninety two the eu on combating sexual a bes in sexual exploitation of children there asked the nomination rapporteur here so they are very important il if i have your attention secondly mr keller of the green	for the implementation report on directive two thousand and eleven ninety two the eu on combating sexual a bes in sexual exploitation of children there asked the nomination rapporteurs here so they are very important told if i have your attention secondly mr arkeleofthegreen	/media/hugo/Seagate Expansion Drive/ALICE_BACKUP/voshpde/wav_files/zipfiles/20150616.wav	11
10	/media/hugo/Seagate Expansion Drive/ALICE_BACKUP/voshpde/pipeLine/segmentation_wavfiles/20150616/011_20150616.wav	212.70022675736962	9380080	240.85022675736963	10621495	010_20150616	for the proposal for a council decision establishing provisional measures in the area of international protection for the benefit of italy in reef that for the relocation mechanism and we have the nomination of rapporteur for an opinion early adminstepeople need an tale of the d on the mobilisation of the flexibility instrument for the provisional measures in the area of international protection for the benefit of italy an gref	for the proposal for a council decision establishing provisional measures in the area of international protection for the benefit of icaryingreefthatforhe relocation mechanism and we have the nomination of rapporteur for an opinion early adminstepeople need an tale of the d on the mobilisation of the flexibility instrument for the provisional measures in the area of international protection for the benefit of icayangref	/media/hugo/Seagate Expansion Drive/ALICE_BACKUP/voshpde/wav_files/zipfiles/20150616.wav	12
11	/media/hugo/Seagate Expansion Drive/ALICE_BACKUP/voshpde/pipeLine/segmentation_wavfiles/20150616/012_20150616.wav	240.85024943310657	10621496	259.5002494331066	11443961	011_20150616	and then i have du nounce additional libe meeting das agreed by the coordinators at ar last meeting again colleagues i lies a tentative matter but the additional committee ec engage ar agreed so that we can get you what is and now you will agree a very heavy work good	and then i have jonounce additional lib meeting da agreed by the coordinators at ar last meeting again colleagues i like es etentitive matter but the additional community met engage ar agreed so that we can get you what is and now you will agree a very heavy work good	/media/hugo/Seagate Expansion Drive/ALICE_BACKUP/voshpde/wav_files/zipfiles/20150616.wav	18
12	/media/hugo/Seagate Expansion Drive/ALICE_BACKUP/voshpde/pipeLine/segmentation_wavfiles/20150616/013_20150616.wav	259.50027210884355	11443962	282.6502721088435	12464877	012_20150616	agreed by the coordinators porsly the second of july in the aftenon monday with fixible july in strasbourg on nineteen hundred from meeting with commissioner avr mopulist and high representative mogherini in the framework of the strategic report on migration monday of strasbourg the situation now of the media and slovakia	agreed by the coordinators porsly the second of july in the aftenon monday with fixible july in strasbourg on nineteen hundred from meeting with commissioner avr mopulist and high representative mogherini in the framework of the strategic report on migration monday of strasbourg the situation now of the media and slovakia	/media/hugo/Seagate Expansion Drive/ALICE_BACKUP/voshpde/wav_files/zipfiles/20150616.wav	0
13	/media/hugo/Seagate Expansion Drive/ALICE_BACKUP/voshpde/pipeLine/segmentation_wavfiles/20150616/014_20150616.wav	282.6502947845805	12464878	298.9002947845805	13181503	013_20150616	this is a request again from coordinators following with slovakian government decision to forbid any communication between the government and the new paper bank coordinators decided that share with right alighted to the european commission asking for the views on that matter	this is a request again from coordinators following with slovakian government decision to forbid any communication between the government and the new paper bank coordinators decided that share with right alighted to the european commission asking for the views on that matter	/media/hugo/Seagate Expansion Drive/ALICE_BACKUP/voshpde/wav_files/zipfiles/20150616.wav	0
14	/media/hugo/Seagate Expansion Drive/ALICE_BACKUP/voshpde/pipeLine/segmentation_wavfiles/20150616/015_20150616.wav	298.90031746031747	13181504	314.55031746031744	13871669	014_20150616	on the subject of better law making eu lee they coordinators recommended to right elected to president shilks outlining the leave they priority in view of the review of rules and better law making and then on mission	on the subject of better law making lee they coordinators recommended to right elected to president shilks outlining the leave they priority in view of the review of rules and better law making and then on mission	/media/hugo/Seagate Expansion Drive/ALICE_BACKUP/voshpde/wav_files/zipfiles/20150616.wav	3
15	/media/hugo/Seagate Expansion Drive/ALICE_BACKUP/voshpde/pipeLine/segmentation_wavfiles/20150616/016_20150616.wav	314.55034013605444	13871670	338.80034013605444	14941095	015_20150616	we have again if eu colleague want to lit into the tlentherefully if they are involved in missions firstingat the we the mission to finland smart borders package according to the tank to fend of three member missions into the four members as authorised compost of one member of the epp and one of ec de covering the two rapporteurs and one member of ecr	we have again if colleague want to lit into the tent here fully if they are involved in missions firstingat the we the mission to finland smart borders package according to the tank to fend of three member missions into the four members as authorised compost of one member of the epp and one of cnd covering the two rapporteurs and one member of ecr	/media/hugo/Seagate Expansion Drive/ALICE_BACKUP/voshpde/wav_files/zipfiles/20150616.wav	9
16	/media/hugo/Seagate Expansion Drive/ALICE_BACKUP/voshpde/pipeLine/segmentation_wavfiles/20150616/017_20150616.wav	338.8003628117914	14941096	365.5503628117914	16120771	016_20150616	on the joint will need the budget mission to fiscally coordinators to say that we basic be represented to six numbers with the additional possibility of whether accompanying membership italy missions requested bale committee to coordinators to thank to request association to the mission of the internet governance forum two thousand and fifteen in brazil a char il riculauted to the three committee ec trade colt and dury involved and also de store	on the joint will need the budget mission to fiscally coordinators to say that we basic be represented to six numbers with the additional possibility of whether accompanying membership iqually missions requested bale committee to coordinators to thank to request association to the mission of the internet governance forum two thousand and fifteen in brazil a char will riculauted to the three committees each read colt and dury involved and also to store	/media/hugo/Seagate Expansion Drive/ALICE_BACKUP/voshpde/wav_files/zipfiles/20150616.wav	13
17	/media/hugo/Seagate Expansion Drive/ALICE_BACKUP/voshpde/pipeLine/segmentation_wavfiles/20150616/018_20150616.wav	365.55038548752833	16120772	391.30038548752833	17256347	017_20150616	now we come to motions for a resolution under il want to three of a rule to portedure coordinator you recommend ate at the following missions for resolution did not require as follow up il to quickly been ate or for nine in last two thousand and fifteen on the climate stalking be it or for inteigh two thousan an fifteen on the recognition appreciation the import for the role of function of the police force to it	now we come to motions for a resolution under well want to three of a rule to portedure coordinator you recommend ate at the following missions for resolution did not require as follow up ilo to quickly been ate or for nine entasttwo thousand and fifteen on the climate stalking be it or for inteigh two thousan an fifteen on the recognition appreciation the import for the role of function of the polish force to it	/media/hugo/Seagate Expansion Drive/ALICE_BACKUP/voshpde/wav_files/zipfiles/20150616.wav	10
18	/media/hugo/Seagate Expansion Drive/ALICE_BACKUP/voshpde/pipeLine/segmentation_wavfiles/20150616/019_20150616.wav	391.30040816326533	17256348	414.4504081632653	18277263	018_20150616	de t or for two thousand and fifteen on the establishment of the european public prosecutors offers de il by eu nine hundred two thousand and fifteen on the confiscation of got driving of criminal activity be it or for ec at two ton and fifteen ana online tail of works of art a strive by islamic state that a con to petition to il one to tax of the rules procedure	t or for two thousand and fifteen on the establishment of the european public prosecutors offers be it by un nine hundred two thousand and fifteen on the confiscation of got driving of criminal activity be it or for ataghttwo ton and fifteen on online tail of works of art a strive by islamic state that a con to petition to all one to tax of the rules procedure	/media/hugo/Seagate Expansion Drive/ALICE_BACKUP/voshpde/wav_files/zipfiles/20150616.wav	17
19	/media/hugo/Seagate Expansion Drive/ALICE_BACKUP/voshpde/pipeLine/segmentation_wavfiles/20150616/020_20150616.wav	414.45043083900225	18277264	436.50043083900226	19249669	019_20150616	cortnatos recommendatoreritallacts to be party committee regarding the petition by daniel opinia jordana of spain on frontex and this is the petition would the increase of competences and funding so legal to ask whether the committee endorsed is beef coordinators recommendation pursuant to rule to i	cortnatos recommendatoreritallactstobenthepetycommittee regarding the petition by danual opinia jordana of spain on frontex and this is the petition would the increase of competences and funding oleageanitoask whether the committee endorsed is beef coordinators recommendation pursuant to rule to i	/media/hugo/Seagate Expansion Drive/ALICE_BACKUP/voshpde/wav_files/zipfiles/20150616.wav	18
20	/media/hugo/Seagate Expansion Drive/ALICE_BACKUP/voshpde/pipeLine/segmentation_wavfiles/20150616/021_20150616.wav	436.5004535147392	19249670	463.95045351473925	20460215	020_20150616	so andor thank if i il also just mention at the end of those note if everyone mark eu ensure that we have your electronic voting cards because we have a vote it for twenty such as people show you have your electronic voting card if a short bot that an important month of you have your voting card now colleague come to	so andor thank if i it also just mention at the end of those note if everyone make ensure that we have your electronic voting cards because we have a vote it for twenty such as people show you have your electronic voting card if a short bot that an important month of you have your voting card now colleague come to	/media/hugo/Seagate Expansion Drive/ALICE_BACKUP/voshpde/wav_files/zipfiles/20150616.wav	4
21	/media/hugo/Seagate Expansion Drive/ALICE_BACKUP/voshpde/pipeLine/segmentation_wavfiles/20150616/022_20150616.wav	463.9504761904762	20460216	481.6004761904762	21238581	021_20150616	may an agenda i to point four which the prevention of radicalisation and ecopment of european political long i caroist organisation of our rapporteur forchieveadatyand we have a consideration of the draft report	may an agenda i to point four which the prevention of radicalisation and ecopment of european political long i caroist organisation of our rapporteur forchieveadatyand we have a consideration of the draft report	/media/hugo/Seagate Expansion Drive/ALICE_BACKUP/voshpde/wav_files/zipfiles/20150616.wav	0
22	/media/hugo/Seagate Expansion Drive/ALICE_BACKUP/voshpde/pipeLine/segmentation_wavfiles/20150616/023_20150616.wav	481.6004988662132	21238582	499.45049886621314	22025767	022_20150616	colleagues as you know it is a very important and complex topic de already houd some discussion on riba so without further i de i want to give the for eu rapporteur to present her chap report to me stati pre take before thank you	colleagues as you know it is a very important and complex topic already houd some discussion on riba so without further i do i want to give the for te rapporteur to present her chap report to me stati pre take before thank you	/media/hugo/Seagate Expansion Drive/ALICE_BACKUP/voshpde/wav_files/zipfiles/20150616.wav	6
23	/media/hugo/Seagate Expansion Drive/ALICE_BACKUP/voshpde/pipeLine/segmentation_wavfiles/20150616/024_20150616.wav	499.45052154195014	22025768	519.7005215419501	22918793	023_20150616	mr president colleagues i will be belief because what is important for me is do not here the debate and to hear members of the committee proposals i thank your draft report it is about	mr president colleagues i will be belief because what is important for me is do not here the debate and to hear members of the committees proposals i thank your draft report it is about	/media/hugo/Seagate Expansion Drive/ALICE_BACKUP/voshpde/wav_files/zipfiles/20150616.wav	1
24	/media/hugo/Seagate Expansion Drive/ALICE_BACKUP/voshpde/pipeLine/segmentation_wavfiles/20150616/025_20150616.wav	519.700544217687	22918794	546.6505442176871	24107289	024_20150616	prevention of radicalisation and recruitment of european citizens by terrorist organisations when drafting this i try to cover all effect as olli areas where we have to act and i take everybody is asking for a global strategy for preventing radicalisation in europe each country says that we cannot work alone and	prevention of radicalisation and recruitment of european citizens by terrorist organisations when drafting this i try to cover all effect as olli areas where we have to act and i take everybody is asking for a global strategy for preventing radicalisation in europe each country says that we cannot work alone and	/media/hugo/Seagate Expansion Drive/ALICE_BACKUP/voshpde/wav_files/zipfiles/20150616.wav	0
25	/media/hugo/Seagate Expansion Drive/ALICE_BACKUP/voshpde/pipeLine/segmentation_wavfiles/20150616/026_20150616.wav	546.6505668934241	24107290	569.300566893424	25106155	025_20150616	measures individually or in isolation in ec country we cannot have each country just reacting to periousatanfrance we reacted to be a january attacked and one i has my hearings i found that	measures individually or in isolation in eat country we cannot have each country just reacting to periousatanfrance we reacted to be a january attacked and one i heals my hearings i found that	/media/hugo/Seagate Expansion Drive/ALICE_BACKUP/voshpde/wav_files/zipfiles/20150616.wav	4
26	/media/hugo/Seagate Expansion Drive/ALICE_BACKUP/voshpde/pipeLine/segmentation_wavfiles/20150616/027_20150616.wav	569.300589569161	25106156	584.750589569161	25787501	026_20150616	france is far behind other countries like the uk denmark or belgium in preventing radicalisation so it must be a global european strategy i have a number of questions how can we	france is far behind other countries like the uk denmark or belgium in preventing radicalisation so it must be a global european strategy i have a number of questions how can we	/media/hugo/Seagate Expansion Drive/ALICE_BACKUP/voshpde/wav_files/zipfiles/20150616.wav	0
27	/media/hugo/Seagate Expansion Drive/ALICE_BACKUP/voshpde/pipeLine/segmentation_wavfiles/20150616/028_20150616.wav	584.750612244898	25787502	607.7006122448979	26799597	027_20150616	prevent before hand own rather than reacting after people have been radicalised and i have moved around a lot i have heard a lot and i am told that no matter which country it is no matter which individual it is bit happens through into night it we have to recognise bat we have to admit it	prevent before hand own rather than reacting after people have been radicalised and i have moved around a lot i have heard a lot and i am told that no matter which country it is no matter which individual it is bit happens through into night it we have to recognise bat we have to admit it	/media/hugo/Seagate Expansion Drive/ALICE_BACKUP/voshpde/wav_files/zipfiles/20150616.wav	0
28	/media/hugo/Seagate Expansion Drive/ALICE_BACKUP/voshpde/pipeLine/segmentation_wavfiles/20150616/029_20150616.wav	607.7006349206349	26799598	637.0506349206349	28093933	028_20150616	so this will lead to a debate about freedom of expression on the internet but the internet has become a botual recruitment and training ground it radicalise is people and entices on to the walfield and a second place of radicalisation for people who are not reached by the internet is the present people who are in prison	so this will lead to a debate about freedom of expression on the internet but the internet has become a botual recruitment and training ground it radicalise is people and entices on to the walfield and a second place of radicalisation for people who are not reached by the internet is the present people who are in prison	/media/hugo/Seagate Expansion Drive/ALICE_BACKUP/voshpde/wav_files/zipfiles/20150616.wav	0
29	/media/hugo/Seagate Expansion Drive/ALICE_BACKUP/voshpde/pipeLine/segmentation_wavfiles/20150616/030_20150616.wav	637.0506575963719	28093934	666.8006575963719	29405909	029_20150616	often radicalised people in prison for terrorist crimes receive long sentences bute the people are in prison who are radicalise their often for ordinary crimes far inpresson for short period but they radicalised the and when they and their sentence pay our time bombs so we have to look at the internet we have to lok ht the penal system	often radicalised people in prison for terrorist crimes receive long sentences bute the people o are in prison who are radicalise their often for ordinary crimes far inpresson for short period but they radicalised the and when they and their sentence pay our time bombs so we have to look at the internet we have to lok ht the penal system	/media/hugo/Seagate Expansion Drive/ALICE_BACKUP/voshpde/wav_files/zipfiles/20150616.wav	2
30	/media/hugo/Seagate Expansion Drive/ALICE_BACKUP/voshpde/pipeLine/segmentation_wavfiles/20150616/031_20150616.wav	666.8006802721088	29405910	683.3506802721089	30135765	030_20150616	and most people are very not about these are the internet supply ers pa they or net but maybe they are not because they naka out of profit and if we has fem to delete this content which apology exist terrorism	and most people are very not about these are the internet supply ers fa they or night but maybe they are not because they naka out of profit and if we has fem to delete this content which apology exist terrorism	/media/hugo/Seagate Expansion Drive/ALICE_BACKUP/voshpde/wav_files/zipfiles/20150616.wav	4
31	/media/hugo/Seagate Expansion Drive/ALICE_BACKUP/voshpde/pipeLine/segmentation_wavfiles/20150616/032_20150616.wav	683.3507029478458	30135766	703.4007029478458	31019971	031_20150616	there is a problem and we have to ask them to put discos on the internet which would prevent radicalisation we have to prevent the internet becoming a vector for these messages which	there is a problem and we have to ask them to put discos on the internet which would prevent radicalisation we have to prevent the internet becoming a vector for these messages which	/media/hugo/Seagate Expansion Drive/ALICE_BACKUP/voshpde/wav_files/zipfiles/20150616.wav	0
