	wavfile	start_seconds	start_frames	end_seconds	end_frames	identifier	inferred_text	motherfile
141	/media/hugo/Seagate Expansion Drive/ALICE_BACKUP/voshpde/pipeLine/segmentation_wavfiles/20150127/142_20150127.wav	3127.2531972789116	137911866	3148.6031972789115	138853401	141_20150127	and i refuse to give into this so called logic and what about when we are trying to combat terrorism should be not try and combat it where it exists i was present in northern iraq and we need to look at measures to be deployed on the ground tere to stop people getting involved in terrorism	/media/hugo/Seagate Expansion Drive/ALICE_BACKUP/voshpde/wav_files/zipfiles/20150127.wav
142	/media/hugo/Seagate Expansion Drive/ALICE_BACKUP/voshpde/pipeLine/segmentation_wavfiles/20150127/143_20150127.wav	3148.6032199546485	138853402	3175.1532199546486	140024257	142_20150127	we have to look at supporting refugees we have to look at supporting people who have returned from being terrorists we have to take care of them that is important those of issues that need to be looked at how can we make sure that terrorism cannot be financed anymore how can nobody talks about turkey supporting terrorism how can nobody talks about saudi arabia providing weapons for terrorists these are questions that will have to agree on	/media/hugo/Seagate Expansion Drive/ALICE_BACKUP/voshpde/wav_files/zipfiles/20150127.wav
143	/media/hugo/Seagate Expansion Drive/ALICE_BACKUP/voshpde/pipeLine/segmentation_wavfiles/20150127/144_20150127.wav	3175.1532426303856	140024258	3204.9032426303856	141336233	143_20150127	i will have to discuss how we stop young people in our member states from becoming do hadists there are number of programmes that are running in germany along these lines and we should do that elsewhere as well and what are we doing wrong on integration because there is something we are doing wrong when it comes to integration in our member states when it comes to people who basically come to our shores if we do not ask these questions we are not going to make any head way on terrorism	/media/hugo/Seagate Expansion Drive/ALICE_BACKUP/voshpde/wav_files/zipfiles/20150127.wav
144	/media/hugo/Seagate Expansion Drive/ALICE_BACKUP/voshpde/pipeLine/segmentation_wavfiles/20150127/145_20150127.wav	3204.9032653061226	141336234	3222.7532653061226	142123419	144_20150127	mr president next dntinforthegrenr president adding to the list of examples that so fee gave on un perpetrators dealt were know and i would like to add two thousand and four am sadam mohamed be who killed	/media/hugo/Seagate Expansion Drive/ALICE_BACKUP/voshpde/wav_files/zipfiles/20150127.wav
145	/media/hugo/Seagate Expansion Drive/ALICE_BACKUP/voshpde/pipeLine/segmentation_wavfiles/20150127/146_20150127.wav	3222.7532879818596	142123420	3243.5032879818596	143038495	145_20150127	who assassinated tale fan hoc and i take that example because i come from am sudan i was member of the city council at that point and i have been feel like have been living in ground holkday the last weeks i am listening to stories and examples and proposals that i have heard ten years ago	/media/hugo/Seagate Expansion Drive/ALICE_BACKUP/voshpde/wav_files/zipfiles/20150127.wav
146	/media/hugo/Seagate Expansion Drive/ALICE_BACKUP/voshpde/pipeLine/segmentation_wavfiles/20150127/147_20150127.wav	3243.5033106575966	143038496	3269.8533106575965	144200531	146_20150127	and i would like to underline that when it comes to deradicalisation i embrace this and i constantly wonder what happened since two thousand and four when big deradicalisation programmes were set up and then later on we were lost again or left again but when it comes to measures to make us feel more secure i really wonder and we	/media/hugo/Seagate Expansion Drive/ALICE_BACKUP/voshpde/wav_files/zipfiles/20150127.wav
147	/media/hugo/Seagate Expansion Drive/ALICE_BACKUP/voshpde/pipeLine/segmentation_wavfiles/20150127/148_20150127.wav	3269.8533333333335	144200532	3289.903333333333	145084737	147_20150127	through the great fine we got this document that was debated in the cosy on january seventeen so the the council internal security committee and it states there that that member states actually do not exchange information with each other	/media/hugo/Seagate Expansion Drive/ALICE_BACKUP/voshpde/wav_files/zipfiles/20150127.wav
148	/media/hugo/Seagate Expansion Drive/ALICE_BACKUP/voshpde/pipeLine/segmentation_wavfiles/20150127/149_20150127.wav	3289.90335600907	145084738	3313.9533560090704	146145343	148_20150127	eighty of the data on europol on focal point travellers so travellers that we should be scared of is given in by four member states which means the rest does not provide that kind of information i really would have appreciated if the commission would have talked about that because there i can see serious improvements	/media/hugo/Seagate Expansion Drive/ALICE_BACKUP/voshpde/wav_files/zipfiles/20150127.wav
149	/media/hugo/Seagate Expansion Drive/ALICE_BACKUP/voshpde/pipeLine/segmentation_wavfiles/20150127/150_20150127.wav	3313.9533786848074	146145344	3329.6033786848075	146835509	149_20150127	i would like to know from the commission whether when the council invites you if i take this closely document serious the council invites you to look into ways to intercept	/media/hugo/Seagate Expansion Drive/ALICE_BACKUP/voshpde/wav_files/zipfiles/20150127.wav
150	/media/hugo/Seagate Expansion Drive/ALICE_BACKUP/voshpde/pipeLine/segmentation_wavfiles/20150127/151_20150127.wav	3329.603401360544	146835510	3347.753401360544	147635925	150_20150127	intercept decripted data that is now decripted at a lower level because as the council says that is the result of snowden well yes snowden warned us that we should protect ourself for nos people	/media/hugo/Seagate Expansion Drive/ALICE_BACKUP/voshpde/wav_files/zipfiles/20150127.wav
151	/media/hugo/Seagate Expansion Drive/ALICE_BACKUP/voshpde/pipeLine/segmentation_wavfiles/20150127/152_20150127.wav	3347.753424036281	147635926	3367.103424036281	148489261	151_20150127	so what is your response to that and i also like to know i have heard you say it is now i think i have heard timmermants say it last week we have been read in it everywhere pnr data should should be collected but in line with data retention what that	/media/hugo/Seagate Expansion Drive/ALICE_BACKUP/voshpde/wav_files/zipfiles/20150127.wav
152	/media/hugo/Seagate Expansion Drive/ALICE_BACKUP/voshpde/pipeLine/segmentation_wavfiles/20150127/153_20150127.wav	3367.103446712018	148489262	3385.753446712018	149311727	152_20150127	please it is not enough we have been hearing this for couple weeks now what is that give us an explanation of what it is to do pnr the collection of pnr data in line with data attention because i do not see it i do not understand it	/media/hugo/Seagate Expansion Drive/ALICE_BACKUP/voshpde/wav_files/zipfiles/20150127.wav
153	/media/hugo/Seagate Expansion Drive/ALICE_BACKUP/voshpde/pipeLine/segmentation_wavfiles/20150127/154_20150127.wav	3385.753469387755	149311728	3412.103469387755	150473763	153_20150127	schengen also there also there i hear that we should review how we work with schengen cast it might be protecting us these are home grown fighters with a european passport and they are not even necessarily travelling among member states but still doing harm where	/media/hugo/Seagate Expansion Drive/ALICE_BACKUP/voshpde/wav_files/zipfiles/20150127.wav
154	/media/hugo/Seagate Expansion Drive/ALICE_BACKUP/voshpde/pipeLine/segmentation_wavfiles/20150127/155_20150127.wav	3412.103492063492	150473764	3441.753492063492	151781329	154_20150127	can schengen were an making it more difficult to cross borders external borders and internal borders really help us president something hams like wat hams in palisvef	/media/hugo/Seagate Expansion Drive/ALICE_BACKUP/voshpde/wav_files/zipfiles/20150127.wav
155	/media/hugo/Seagate Expansion Drive/ALICE_BACKUP/voshpde/pipeLine/segmentation_wavfiles/20150127/156_20150127.wav	3441.753514739229	151781330	3458.303514739229	152511185	155_20150127	we have we decide to go for a zero tolerance policies and for unfortunate this is sometimes to the detriment of the basic rights and basic freedoms that we all enjoy so it is a paradox	/media/hugo/Seagate Expansion Drive/ALICE_BACKUP/voshpde/wav_files/zipfiles/20150127.wav
156	/media/hugo/Seagate Expansion Drive/ALICE_BACKUP/voshpde/pipeLine/segmentation_wavfiles/20150127/157_20150127.wav	3458.303537414966	152511186	3476.953537414966	153333651	156_20150127	it would be a paradox where we to find that our freedom of movement or freedom of opinion our right to protection of personal data our right have our own beliefs where to be damaged in order to give us more security	/media/hugo/Seagate Expansion Drive/ALICE_BACKUP/voshpde/wav_files/zipfiles/20150127.wav
157	/media/hugo/Seagate Expansion Drive/ALICE_BACKUP/voshpde/pipeLine/segmentation_wavfiles/20150127/158_20150127.wav	3476.953560090703	153333652	3498.4035600907027	154279597	157_20150127	i think that we have to try and strike the right balance between the two rights that are in play here basic freedoms there sis the right to protection we need to look at how we we are going to deal with us in the short term in the long term i am sure that in the short term	/media/hugo/Seagate Expansion Drive/ALICE_BACKUP/voshpde/wav_files/zipfiles/20150127.wav
158	/media/hugo/Seagate Expansion Drive/ALICE_BACKUP/voshpde/pipeLine/segmentation_wavfiles/20150127/159_20150127.wav	3498.4035827664397	154279598	3519.6535827664397	155216723	158_20150127	what needs to happen is better cooperation among police forces for example exchange of data in italy just a few days ago we had a problem at the french border and the national authorities did not know anything about it	/media/hugo/Seagate Expansion Drive/ALICE_BACKUP/voshpde/wav_files/zipfiles/20150127.wav
159	/media/hugo/Seagate Expansion Drive/ALICE_BACKUP/voshpde/pipeLine/segmentation_wavfiles/20150127/160_20150127.wav	3519.6536054421767	155216724	3535.4036054421767	155911299	159_20150127	until the operations were actually carried out so we have got to improve cooperation and exchange of information looking at the longer term we certainly need to improve	/media/hugo/Seagate Expansion Drive/ALICE_BACKUP/voshpde/wav_files/zipfiles/20150127.wav
160	/media/hugo/Seagate Expansion Drive/ALICE_BACKUP/voshpde/pipeLine/segmentation_wavfiles/20150127/161_20150127.wav	3535.4036281179137	155911300	3563.853628117914	157165945	160_20150127	our culture our information education we need to not we a ead have the instruments we have got to find the right use to make of them and these basic freedoms are of course our strength on internet that is of course a wonderful instrument for free movement of information exchange of opinions	/media/hugo/Seagate Expansion Drive/ALICE_BACKUP/voshpde/wav_files/zipfiles/20150127.wav
161	/media/hugo/Seagate Expansion Drive/ALICE_BACKUP/voshpde/pipeLine/segmentation_wavfiles/20150127/162_20150127.wav	3563.853650793651	157165946	3588.0036507936506	158230961	161_20150127	it is a virtue of greater security we should not take the risk of our citizens being deprived of the ability to exchange information we should be improving information about parallel networks anonomous communication systems	/media/hugo/Seagate Expansion Drive/ALICE_BACKUP/voshpde/wav_files/zipfiles/20150127.wav
162	/media/hugo/Seagate Expansion Drive/ALICE_BACKUP/voshpde/pipeLine/segmentation_wavfiles/20150127/163_20150127.wav	3588.0036734693876	158230962	3617.3536734693876	159525297	162_20150127	i sat of black market for the sale of arms or drugs these parallel anonomous information systems must be brought under better control so that we can get more information that will help us in the fight against terror i would like to ask for some information from you you spoke about debt analysis are you able to	/media/hugo/Seagate Expansion Drive/ALICE_BACKUP/voshpde/wav_files/zipfiles/20150127.wav
163	/media/hugo/Seagate Expansion Drive/ALICE_BACKUP/voshpde/pipeLine/segmentation_wavfiles/20150127/164_20150127.wav	3617.3536961451246	159525298	3636.203696145125	160356583	163_20150127	to give us any information about the time when this analysis will be completed and what activities does the commission intend to carry out for that purpose thank you	/media/hugo/Seagate Expansion Drive/ALICE_BACKUP/voshpde/wav_files/zipfiles/20150127.wav
164	/media/hugo/Seagate Expansion Drive/ALICE_BACKUP/voshpde/pipeLine/segmentation_wavfiles/20150127/165_20150127.wav	3636.2037188208615	160356584	3664.2537188208616	161593589	164_20150127	mr colleagues speaking to retye rita and we have we have a quit a long list most of all of the members present yet now all now all that is it just in case anyone had not indicated notes all of the members so these two ways we can do it if you could stick to one it is definitely now al	/media/hugo/Seagate Expansion Drive/ALICE_BACKUP/voshpde/wav_files/zipfiles/20150127.wav
165	/media/hugo/Seagate Expansion Drive/ALICE_BACKUP/voshpde/pipeLine/segmentation_wavfiles/20150127/166_20150127.wav	3664.2537414965986	161593590	3680.803741496599	162323445	165_20150127	if you could stick to wanted two minutes we can do it because otherwise it is going to be unfair to the rest of the speakers we have already had the kindness of mr diaz de mera and ms fa on in locking out their agenda item so we have already done that so	/media/hugo/Seagate Expansion Drive/ALICE_BACKUP/voshpde/wav_files/zipfiles/20150127.wav
166	/media/hugo/Seagate Expansion Drive/ALICE_BACKUP/voshpde/pipeLine/segmentation_wavfiles/20150127/167_20150127.wav	3680.8037641723354	162323446	3704.7537641723357	163379641	166_20150127	taking into account all of that if everyone does two to three minutes and four minutes we are finished and also remind you mr dikerkov his time as cut the last time he came as well it is okay you nodding do you agree respond the you agreement can you do it and know you can do it want to two minutes is it possible	/media/hugo/Seagate Expansion Drive/ALICE_BACKUP/voshpde/wav_files/zipfiles/20150127.wav
167	/media/hugo/Seagate Expansion Drive/ALICE_BACKUP/voshpde/pipeLine/segmentation_wavfiles/20150127/168_20150127.wav	3704.7537868480727	163379642	3733.7037868480725	164656337	167_20150127	okay i am cutting out the germans because they do not en more very much but the rest of you do you do you agree do you okee out r joke ok you agree want to two minutes ok let us do because i am also pleased direct it to the commission because we need to get a sense of you know what they are going to develop in their proposal so let us start w recede date data you first please	/media/hugo/Seagate Expansion Drive/ALICE_BACKUP/voshpde/wav_files/zipfiles/20150127.wav
168	/media/hugo/Seagate Expansion Drive/ALICE_BACKUP/voshpde/pipeLine/segmentation_wavfiles/20150127/169_20150127.wav	3733.7038095238095	164656338	3753.4538095238095	165527313	168_20150127	mr president direct general i was interested in fact somewhat surprised as you all tone which links into what happen tragically in paris but also in brussels but without talking about the	/media/hugo/Seagate Expansion Drive/ALICE_BACKUP/voshpde/wav_files/zipfiles/20150127.wav
169	/media/hugo/Seagate Expansion Drive/ALICE_BACKUP/voshpde/pipeLine/segmentation_wavfiles/20150127/170_20150127.wav	3753.4538321995465	165527314	3779.6038321995466	166680529	169_20150127	overall number of attacks elsewhere in europe a number of our colleagues have mentioned recent events and questions concerning the surveillance of individuals who considered suspects obviously topical issues mean that this is an urgent issue to act on but i am quite surprise that you are aware that these tragic events have happened	/media/hugo/Seagate Expansion Drive/ALICE_BACKUP/voshpde/wav_files/zipfiles/20150127.wav
170	/media/hugo/Seagate Expansion Drive/ALICE_BACKUP/voshpde/pipeLine/segmentation_wavfiles/20150127/171_20150127.wav	3779.6038548752836	166680530	3796.6538548752833	167432435	170_20150127	without moving into the new twenty first century you know internet schengen pnr ghadisen problem of education we have heard a good list from mr des mera	/media/hugo/Seagate Expansion Drive/ALICE_BACKUP/voshpde/wav_files/zipfiles/20150127.wav
171	/media/hugo/Seagate Expansion Drive/ALICE_BACKUP/voshpde/pipeLine/segmentation_wavfiles/20150127/172_20150127.wav	3796.6538775510203	167432436	3825.4038775510203	168700311	171_20150127	and what is your answer while you are going to think about this you are going to debate this you going to discuss it still wondering what to do so where is this action where the urgency in your action what is your time table because at the moment we know we are all too aware unfortunately if the reality of these attacks and the tragic events that we have seen the question today is no longer to know whether terrorists are going o commit atrocities the question is when at they are going to do this	/media/hugo/Seagate Expansion Drive/ALICE_BACKUP/voshpde/wav_files/zipfiles/20150127.wav
172	/media/hugo/Seagate Expansion Drive/ALICE_BACKUP/voshpde/pipeLine/segmentation_wavfiles/20150127/173_20150127.wav	3825.4039002267573	168700312	3843.253900226757	169487497	172_20150127	and i would echo the questions from previous colleagues on the one hand because you have a responsibility the commission has a responsibility to shoulder you have to react you have to respond what is your timetable today what of the specific and effective actions you have in the pipeline	/media/hugo/Seagate Expansion Drive/ALICE_BACKUP/voshpde/wav_files/zipfiles/20150127.wav
173	/media/hugo/Seagate Expansion Drive/ALICE_BACKUP/voshpde/pipeLine/segmentation_wavfiles/20150127/174_20150127.wav	3843.253922902494	169487498	3869.603922902494	170649533	173_20150127	i am picking up on what sofeinatfeltset what about the evaluation what is happen with the evaluation on the tools and instruments that we have been adopting from many along year now because the european citizens would be very surprised not to know what the reality of these evaluations are prsidethankyouvermchiwould like to thank you for your very clear analysis	/media/hugo/Seagate Expansion Drive/ALICE_BACKUP/voshpde/wav_files/zipfiles/20150127.wav
174	/media/hugo/Seagate Expansion Drive/ALICE_BACKUP/voshpde/pipeLine/segmentation_wavfiles/20150127/175_20150127.wav	3869.603945578231	170649534	3894.5539455782314	171749829	174_20150127	i think very level headed in what you said today and i think that is extremely important i share your opinion that we need action not activism again in the gain i get the feeling in this discussion that people are trying to get on the bandwagon trying to grab things that they could not get before they were countries	/media/hugo/Seagate Expansion Drive/ALICE_BACKUP/voshpde/wav_files/zipfiles/20150127.wav
175	/media/hugo/Seagate Expansion Drive/ALICE_BACKUP/voshpde/pipeLine/segmentation_wavfiles/20150127/176_20150127.wav	3894.5539682539684	171749830	3917.503968253968	172761925	175_20150127	who did not have armeredhellycopters and now they are getting them their colleagues who could not get their pnr legislation through now they going to get it there are people who did not want to accept parliaments decisions on data retention they wanted to try and loosen dem up	/media/hugo/Seagate Expansion Drive/ALICE_BACKUP/voshpde/wav_files/zipfiles/20150127.wav
176	/media/hugo/Seagate Expansion Drive/ALICE_BACKUP/voshpde/pipeLine/segmentation_wavfiles/20150127/177_20150127.wav	3917.503990929705	172761926	3936.753990929705	173610851	176_20150127	we do not want people jumping on the band wag and we want people who are looking at a clear analysis and approaching these problems and resolving them when they can be resolved so i would like to thank you for what you said by way of introduction because that is something has ben lacking in the debate you	/media/hugo/Seagate Expansion Drive/ALICE_BACKUP/voshpde/wav_files/zipfiles/20150127.wav
177	/media/hugo/Seagate Expansion Drive/ALICE_BACKUP/voshpde/pipeLine/segmentation_wavfiles/20150127/178_20150127.wav	3936.754013605442	173610852	3954.9040136054423	174411267	177_20150127	need to do existing things better i think that is an important message you now despite the threats that we are feeling the situation even here in belgium we need to be able to deal with these issues we do need point of action	/media/hugo/Seagate Expansion Drive/ALICE_BACKUP/voshpde/wav_files/zipfiles/20150127.wav
178	/media/hugo/Seagate Expansion Drive/ALICE_BACKUP/voshpde/pipeLine/segmentation_wavfiles/20150127/179_20150127.wav	3954.9040362811793	174411268	3983.554036281179	175674733	178_20150127	i do not have enough time to give you full analysis of what i think we should do but i have got a couple of questions i would like to put concerning your presentation i am the shadow rapporteur on europol you talked about left overs in europol legislation i would like to hear what you mean like that exactly secondly you talked about fire arms legislation and i think that is important as well because the terrorists in paris	/media/hugo/Seagate Expansion Drive/ALICE_BACKUP/voshpde/wav_files/zipfiles/20150127.wav
179	/media/hugo/Seagate Expansion Drive/ALICE_BACKUP/voshpde/pipeLine/segmentation_wavfiles/20150127/180_20150127.wav	3983.554058956916	175674734	4000.604058956916	176426639	179_20150127	could have bought their weapons at the galda midi here in belgium and if we start thinking about how this sort of cross border activity is going on and maybe we can put a stop it	/media/hugo/Seagate Expansion Drive/ALICE_BACKUP/voshpde/wav_files/zipfiles/20150127.wav
180	/media/hugo/Seagate Expansion Drive/ALICE_BACKUP/voshpde/pipeLine/segmentation_wavfiles/20150127/181_20150127.wav	4000.604081632653	176426640	4026.054081632653	177548985	180_20150127	mr president very quickly thank you very much director general initial remark we need to breproportionate in our response here l iwo agree with what you saying there we are in a democracy we have to remain in the democracy but a democracy has to reply in an effective manner so i think it is not just a proportionate response but an effective one	/media/hugo/Seagate Expansion Drive/ALICE_BACKUP/voshpde/wav_files/zipfiles/20150127.wav
181	/media/hugo/Seagate Expansion Drive/ALICE_BACKUP/voshpde/pipeLine/segmentation_wavfiles/20150127/182_20150127.wav	4026.05410430839	177548986	4045.50410430839	178406731	181_20150127	one point you said since two thousand and eleven there as have been an effective strategy put in place to combat radicalisation i heard you say that i have to say or was taken a back could you just tell us how effective and what the benchmarks for the effectiveness of these strategy has been	/media/hugo/Seagate Expansion Drive/ALICE_BACKUP/voshpde/wav_files/zipfiles/20150127.wav
182	/media/hugo/Seagate Expansion Drive/ALICE_BACKUP/voshpde/pipeLine/segmentation_wavfiles/20150127/183_20150127.wav	4045.504126984127	178406732	4060.754126984127	179079257	182_20150127	because weave got no several zero belgians who are going to syria to join the fight there i was very pleased to hear that	/media/hugo/Seagate Expansion Drive/ALICE_BACKUP/voshpde/wav_files/zipfiles/20150127.wav
183	/media/hugo/Seagate Expansion Drive/ALICE_BACKUP/voshpde/pipeLine/segmentation_wavfiles/20150127/184_20150127.wav	4060.7541496598637	179079258	4082.304149659864	180029613	183_20150127	there are issues concerning the court judgment on data retention us saying at to keep suffe in it felt happy happy but i think you talked about fire arms and the necesity for legislation there we had legislation in my country we forced every citizen to given their arms identify themselves	/media/hugo/Seagate Expansion Drive/ALICE_BACKUP/voshpde/wav_files/zipfiles/20150127.wav
184	/media/hugo/Seagate Expansion Drive/ALICE_BACKUP/voshpde/pipeLine/segmentation_wavfiles/20150127/185_20150127.wav	4082.304172335601	180029614	4103.354172335601	180957919	184_20150127	and then they could retain their weapons but the terrorists do not do that they are not honest lawer biding citizens how your going to deal with that through legislation so i find it surprising that that is a suggested response on schengen and borders is there something in need to be improved there we have got three questions are like to put	/media/hugo/Seagate Expansion Drive/ALICE_BACKUP/voshpde/wav_files/zipfiles/20150127.wav
185	/media/hugo/Seagate Expansion Drive/ALICE_BACKUP/voshpde/pipeLine/segmentation_wavfiles/20150127/186_20150127.wav	4103.354195011338	180957920	4123.704195011338	181855355	185_20150127	would you not agree that in the current state of play on sis two the member states can decide what they put into this who are noted as terrorists or suspects are not necessarily included in this have we looked at that secondly when it comes to	/media/hugo/Seagate Expansion Drive/ALICE_BACKUP/voshpde/wav_files/zipfiles/20150127.wav
186	/media/hugo/Seagate Expansion Drive/ALICE_BACKUP/voshpde/pipeLine/segmentation_wavfiles/20150127/187_20150127.wav	4123.704217687075	181855356	4147.954217687075	182924781	186_20150127	be eu territory these terrorists are europeans there people have been educated here and there is the r poor controls there they are really minimal controls now for entry and exit ar we are not asking ourselves what we are going to do now the same things when it same thing when it comes to minus there are minos leaving belgian territory ending up there	/media/hugo/Seagate Expansion Drive/ALICE_BACKUP/voshpde/wav_files/zipfiles/20150127.wav
