	wavfile	start_seconds	start_frames	end_seconds	end_frames	identifier	inferred_text_with_hotwords	inferred_text_without_hotwords	motherfile	dist
63	/media/hugo/Seagate Expansion Drive/ALICE_BACKUP/voshpde/pipeLine/segmentation_wavfiles/20150616/064_20150616.wav	1413.9514285714286	62355258	1439.3014285714285	63473193	063_20150616	ultimately there is we deselement growing in our society and very danger and we should not be afraid to tackle that but i do and tan your your concern and i really appreciate that also i think that although you have a chapter actually i lighting the link between internal and external security while fighting terrorism	ultimately there is we deselement growing in our society and very danger and we should not be afraid to tackle that but i do and tan your your concern and i really appreciate that also i think that although you have a chapter actually i lighting the link between internal and external security while fighting terrorism	/media/hugo/Seagate Expansion Drive/ALICE_BACKUP/voshpde/wav_files/zipfiles/20150616.wav	0
64	/media/hugo/Seagate Expansion Drive/ALICE_BACKUP/voshpde/pipeLine/segmentation_wavfiles/20150616/065_20150616.wav	1439.3014512471655	63473194	1459.1514512471656	64348579	064_20150616	maybe there we could somehow be more specific and i think we need actually building on what you just had about the financing the role of financing terrorism and a role being played by thirdain country ten actually financing terrorism financing them a draftly and on	maybe there we could somehow be more specific and i think we need actually building on what you just had about the financing the role of financing terrorism and a role being played by thirdain country ten actually financing terrorism financing them a draftly and on	/media/hugo/Seagate Expansion Drive/ALICE_BACKUP/voshpde/wav_files/zipfiles/20150616.wav	0
65	/media/hugo/Seagate Expansion Drive/ALICE_BACKUP/voshpde/pipeLine/segmentation_wavfiles/20150616/066_20150616.wav	1459.1514739229026	64348580	1488.4014739229026	65638505	065_20150616	we void lent in the ec pa area from number think the pal arabia as we hear yet prointmentinougfet by the way in auf yet yet today we have the coordinator the anti the european coordinator against terrorism i think more and more exactly to give this holistic approach we should have lima afet meetings when it comes to terrorism because of you highlighted this is both an internal security and external security challenge	we avoid ont in the a area from number think the paliarabia as we hear yet prointmentinougfet by the way in our yet yet today we have the coordinator the anti the european coordinator against terrorism i think more and more exactly to give this holistic approach we should have lima afet meetings when it comes to terrorism because of you highlighted this is both an internal security and external security challenge	/media/hugo/Seagate Expansion Drive/ALICE_BACKUP/voshpde/wav_files/zipfiles/20150616.wav	10
66	/media/hugo/Seagate Expansion Drive/ALICE_BACKUP/voshpde/pipeLine/segmentation_wavfiles/20150616/067_20150616.wav	1488.4014965986394	65638506	1509.1514965986394	66553581	066_20150616	but in that debate yesterday they was some one mentioning falyaravif the mother it country i am sorry to say have been the rapporteur for for the arabia follow the situation in save arab i do not think that pal arabia the moderate country and in particular when it comes to financing terrorism and all the network even eu	but in that debate yesterday they was some one mentioning falyaravif the mother it country i am sorry to say have been the rapporteur for for the arabia follow the situation in favaraba i do not think that fall arabia the moderate country and in particular when it comes to financing terrorism and all the network even	/media/hugo/Seagate Expansion Drive/ALICE_BACKUP/voshpde/wav_files/zipfiles/20150616.wav	9
67	/media/hugo/Seagate Expansion Drive/ALICE_BACKUP/voshpde/pipeLine/segmentation_wavfiles/20150616/068_20150616.wav	1509.1515192743764	66553582	1528.0015192743765	67384867	067_20150616	even if ultimately follow is going to be the victim of the thing eu the network of funding if we cant avoid it and that van area where i will be contributing to the your report	even if ultimately follow is going to be the victim of the thing hers the network of funding if we cant avoid it and that pan area where i will be contributing to the your report	/media/hugo/Seagate Expansion Drive/ALICE_BACKUP/voshpde/wav_files/zipfiles/20150616.wav	4
68	/media/hugo/Seagate Expansion Drive/ALICE_BACKUP/voshpde/pipeLine/segmentation_wavfiles/20150616/069_20150616.wav	1528.0015419501133	67384868	1552.2515419501133	68454293	068_20150616	also il eu to us and you call for a common definition of foreign fight but let me tell you i find you that this definition of foreign fight is is quite unacceptable because isreiculouslyyouphomitic we are talking about a national il joint terrorist organisations to fight	also i y to us and you call for a common definition of foreign fight but let me tell you i find you that this definition of foreign fight is is quite unacceptable because isreiculouslyyouphomitic we are talking about a rational while joing terrorist organisations to fight	/media/hugo/Seagate Expansion Drive/ALICE_BACKUP/voshpde/wav_files/zipfiles/20150616.wav	8
69	/media/hugo/Seagate Expansion Drive/ALICE_BACKUP/voshpde/pipeLine/segmentation_wavfiles/20150616/070_20150616.wav	1552.2515646258503	68454294	1570.9015646258504	69276759	069_20150616	and when i we linkinkin iraq exactly they after when the parish tax were going on the people in area but auf time what talk talk about men foreign fighter if they are your fit you european so why could should be indulged in de	and when i we linkinkiniraq exactly they after when the parish tax were going on the people in ereapbutautemewhitalk talk about mena foreign fighter if they are your fit you european so why could should be indulged in do	/media/hugo/Seagate Expansion Drive/ALICE_BACKUP/voshpde/wav_files/zipfiles/20150616.wav	13
70	/media/hugo/Seagate Expansion Drive/ALICE_BACKUP/voshpde/pipeLine/segmentation_wavfiles/20150616/071_20150616.wav	1570.9015873015874	69276760	1593.0515873015872	70253575	070_20150616	in the eu phomistic approach and not actually mentioned that we went to come a definition of the fighters european others there are joining terrorist organisation and we are indeed a threat and which we have to stop their action namely in terms of prelelativem in terms of getting more recruit	in the euphemistic approach and not actually mentioned that we went to come a definition of the fighters european others there are joining terrorist organisation and we are indeed a threat and which we have to stop their action namely in terms of prelelativem in terms of getting more recruit	/media/hugo/Seagate Expansion Drive/ALICE_BACKUP/voshpde/wav_files/zipfiles/20150616.wav	2
71	/media/hugo/Seagate Expansion Drive/ALICE_BACKUP/voshpde/pipeLine/segmentation_wavfiles/20150616/072_20150616.wav	1593.0516099773242	70253576	1618.2016099773243	71362691	071_20150616	i think the chapter in prison is is very important indeed we need probably as well to put their more on the efficiency of of joint operation of our agencying at the national level and at eu level for instance last fund that il lies the sitcen here in brussels in de uftermaf up the paris tax	i think the chapter in prison is is very important indeed we need probably as well to put their more on the efficiency of of joint operation of our agencying at the national level and at eu level for instance last fund that i liettheticenhereinbrusselsintheaftemafuptheparistax	/media/hugo/Seagate Expansion Drive/ALICE_BACKUP/voshpde/wav_files/zipfiles/20150616.wav	19
72	/media/hugo/Seagate Expansion Drive/ALICE_BACKUP/voshpde/pipeLine/segmentation_wavfiles/20150616/073_20150616.wav	1618.2016326530613	71362692	1641.1516326530611	72374787	072_20150616	you know what i found out that there was no one expect on arabic to actually follow the internet we deed a lot of job to do and il just dg like to highlight that you have a paragraph on family de i think a very crucial element to be supporting the family who have identified	you know what i found out that there was no one expect on arabic to actually follow the internet we deed a lot of job to do and i just i like to highlight that you have a paragraph on family i think a very crucial element to be supporting the family who have identified	/media/hugo/Seagate Expansion Drive/ALICE_BACKUP/voshpde/wav_files/zipfiles/20150616.wav	6
73	/media/hugo/Seagate Expansion Drive/ALICE_BACKUP/voshpde/pipeLine/segmentation_wavfiles/20150616/074_20150616.wav	1641.1516553287981	72374788	1670.5016553287983	73669123	073_20150616	member in graf and actually much better work interparkingafamiliinightefavouataccountiknowsandbytheway i agree with the tenttivityshowninthetheinitialcraftselecolleaguesa very long so if you could help and i did not start with my two minutes but if you could help with two minute reach that would be great eu eu have a very net	member in graf and actually much better work interparkingafamiliinightefavouataccountiknowsandbytheway i agree with the tenttivityshowninthetheinitialcraftselecolleaguesa very long so if you could help and i did not start with my two minutes but if you could help with two minute reach that would be great cas you have a very one	/media/hugo/Seagate Expansion Drive/ALICE_BACKUP/voshpde/wav_files/zipfiles/20150616.wav	7
74	/media/hugo/Seagate Expansion Drive/ALICE_BACKUP/voshpde/pipeLine/segmentation_wavfiles/20150616/075_20150616.wav	1670.501678004535	73669124	1692.1516780045351	74623889	074_20150616	cornextr shadow for the ecr group to ec il it try an to be as quick as possible chair but this is a very important matter as we have all identify it and i think we staff first all il lit to congratulate the rapporteur on a very comprehensive introduction and proposals or least approaches which seem to me to	cornextr shadow for the ecr group to i it try an to be as quick as possible chairman but this is a very important matter as we have all identify it and i think we staff first all i wold lit to congratulate the rapporteur on a very comprehensive introduction and proposals or least approaches which seem to me to	/media/hugo/Seagate Expansion Drive/ALICE_BACKUP/voshpde/wav_files/zipfiles/20150616.wav	11
75	/media/hugo/Seagate Expansion Drive/ALICE_BACKUP/voshpde/pipeLine/segmentation_wavfiles/20150616/076_20150616.wav	1692.1517006802721	74623890	1719.801700680272	75843255	075_20150616	probably tick all the riv box as here in terms of what is a very difficult thing i have to start on the basis of requestion of what is radicalisation we talk about de it comes treat up up tying at on works around talking eur radicalisation radicalisation what it could actaly is meant by this term are we talking about people who behave in a in a radical manner i eu a behave outside the accepted norms of human behaviour and acceptable behaviour	probably tick all the riv box as here in terms of what is a very difficult thing i have to start on the basis of requestion of what is radicalisation we talk about it comes treat up up tying at on works around talking eur radicalisation radicalisation what it could actaly is meant by this term are we talking about people who behave in a in a radical manner i a behave outside the accepted norms of human behaviour and acceptable behaviour	/media/hugo/Seagate Expansion Drive/ALICE_BACKUP/voshpde/wav_files/zipfiles/20150616.wav	6
76	/media/hugo/Seagate Expansion Drive/ALICE_BACKUP/voshpde/pipeLine/segmentation_wavfiles/20150616/077_20150616.wav	1719.801723356009	75843256	1738.451723356009	76665721	076_20150616	is it because of political ambition or is it because of religious differences or indeed extremism of certain in certain religions the way which they have practiced it this is very difficult and if we take a look at the situation outside of the eu	is it because of political ambition or is it because of religious differences or indeed extremism of certain in certain religions the way which they have practiced it this is very difficult and if we take a look at the situation outside of the eu	/media/hugo/Seagate Expansion Drive/ALICE_BACKUP/voshpde/wav_files/zipfiles/20150616.wav	0
77	/media/hugo/Seagate Expansion Drive/ALICE_BACKUP/voshpde/pipeLine/segmentation_wavfiles/20150616/078_20150616.wav	1738.451746031746	76665722	1759.601746031746	77598437	077_20150616	then the display of radical behaviour at the current time in certain middle eastern states for instance is actually the worst defences are being committed by one brand of a religion against another brand of the same religion and i think really our concerns must be the question of our own eu citizens	then the display of radical behaviour at the current time in certain middle eastern states for instance is actually the worst defences are being committed by one brand of a religion against another brand of the same religion and i think really our concerns must be the question of our own eu citizens	/media/hugo/Seagate Expansion Drive/ALICE_BACKUP/voshpde/wav_files/zipfiles/20150616.wav	0
78	/media/hugo/Seagate Expansion Drive/ALICE_BACKUP/voshpde/pipeLine/segmentation_wavfiles/20150616/079_20150616.wav	1759.601768707483	77598438	1779.951768707483	78495873	078_20150616	falling foul of this situation going and fighting for what they believe is an important cause but then returning often if they are still alive of course but the returning disillusioned and perhaps with that radical view still in their minds to perpetrate offences in the eu	falling foul of this situation going and fighting for what they believe is an important cause but then returning often if they are still alive of course but the returning disillusioned and perhaps with that radical view still in their minds to perpetrate offences in the eu	/media/hugo/Seagate Expansion Drive/ALICE_BACKUP/voshpde/wav_files/zipfiles/20150616.wav	0
79	/media/hugo/Seagate Expansion Drive/ALICE_BACKUP/voshpde/pipeLine/segmentation_wavfiles/20150616/080_20150616.wav	1779.9517913832199	78495874	1798.7017913832199	79322749	079_20150616	here we were mentioning cults before i had i had some experience as a minister over this matter where i refused entry into britain of a number of people who actually were practising certain forms of cult behaviour which was terribly dangerous to our young people	here we were mentioning cults before i had i had some experience as a minister over this matter where i refused entry into britain of a number of people who actually were practising certain forms of cult behaviour which was terribly dangerous to our young people	/media/hugo/Seagate Expansion Drive/ALICE_BACKUP/voshpde/wav_files/zipfiles/20150616.wav	0
80	/media/hugo/Seagate Expansion Drive/ALICE_BACKUP/voshpde/pipeLine/segmentation_wavfiles/20150616/081_20150616.wav	1798.7018140589569	79322750	1822.151814058957	80356895	080_20150616	it having a man of the fact that the internal radicalisation of young people was something which was going on dramatically net housandnehunredandeightneddand ninety as some extent that has been curtailed i believe and that has been curtailed because of a lot of education because of a lot of changes and use of resources to try and dissuade young people from going down that particular path itself	it having a man of the fact that the internal radicalisation of young people was something which was going on dramatically nthousandnehunredandeightneddand ninety as some extent that has been curtailed i believe and that has been curtailed because of a lot of education because of a lot of changes and use of resources to try and dissuade young people from going down that particular path itself	/media/hugo/Seagate Expansion Drive/ALICE_BACKUP/voshpde/wav_files/zipfiles/20150616.wav	2
81	/media/hugo/Seagate Expansion Drive/ALICE_BACKUP/voshpde/pipeLine/segmentation_wavfiles/20150616/082_20150616.wav	1822.151836734694	80356896	1843.7018367346939	81307251	081_20150616	what il be very quick now i have just pont to finally aid one of two quick points and that was first of all yes we must try and cut op funding to criminal organisations where their terrorists agus criminal we must of course is exchange information more between eu eu states i am always disappointed by the lack of exchange that takes place	what i be very quick now i have just pont to finally fa one of two quick points and that was first of all yes we must try and cut op funding to criminal organisations where their terrorists agus criminal we must of course is exchange information more between new eu states i am always disappointed by the lack of exchange that takes place	/media/hugo/Seagate Expansion Drive/ALICE_BACKUP/voshpde/wav_files/zipfiles/20150616.wav	6
82	/media/hugo/Seagate Expansion Drive/ALICE_BACKUP/voshpde/pipeLine/segmentation_wavfiles/20150616/083_20150616.wav	1843.7018594104309	81307252	1863.4518594104309	82178227	082_20150616	our information and helpful information we need to do that obviously i want think my pnr eupnr directive would be helpful i wo not go on about that now i think that exiting measures in place should be developed further and i think that certainly we should never assoon that this is all the fault of the internet	our information and helpful information we need to do that obviously i want think my pnr eupnr directive would be helpful i wo not go on about that now i think that exiting measures in place should be developed further and i think that certainly we should never assoon that this is all the fault of the internet	/media/hugo/Seagate Expansion Drive/ALICE_BACKUP/voshpde/wav_files/zipfiles/20150616.wav	0
83	/media/hugo/Seagate Expansion Drive/ALICE_BACKUP/voshpde/pipeLine/segmentation_wavfiles/20150616/084_20150616.wav	1863.4518820861679	82178228	1890.6018820861677	83375543	083_20150616	the internet is the contributory factor to this but as we have heard in one of two cases recently of people who have left britain to go in fight the families that they have left behind are clearly of the view that the radicalisation that has taken place of these people has been one of a face to face situation in our own country and not through the abuse abuse of the internet so let us not as soon that is the cure all if we can de with that	the internet is the contributory factor to this but as we have heard in one of two cases recently of people who have left britain to go in fight the families that they have left behind are clearly of the view that the radicalisation that has taken place of these people has been one of a face to face situation in our own country and not through the abuse abuse of the internet so let us not as soon that is the cure all if we can do with that	/media/hugo/Seagate Expansion Drive/ALICE_BACKUP/voshpde/wav_files/zipfiles/20150616.wav	1
84	/media/hugo/Seagate Expansion Drive/ALICE_BACKUP/voshpde/pipeLine/segmentation_wavfiles/20150616/085_20150616.wav	1890.6019047619047	83375544	1910.1519047619047	84237699	084_20150616	so so i think really it is a very excellent introduction excellent report we will obviously want to consider it more detail further but i am very grateful to the rapporteur for her initiative i think a lot of people externally looking at report another	so so i think really it is a very excellent introduction excellent report we will obviously want to consider it more detail further but i am very grateful to the rapporteur for her initiative think a lot of people externally looking at report another	/media/hugo/Seagate Expansion Drive/ALICE_BACKUP/voshpde/wav_files/zipfiles/20150616.wav	2
85	/media/hugo/Seagate Expansion Drive/ALICE_BACKUP/voshpde/pipeLine/segmentation_wavfiles/20150616/086_20150616.wav	1910.1519274376417	84237700	1935.9019274376417	85373275	085_20150616	we gon have a problem colleagues we are going to speak to of one problem will be that we probably want we il to take the next report which is mind you problem do not he that has no problem but anyway ok eu are alde shadow net mit mite her next de de altri for two minute not more than that	we re gon have a problem colleagues we are going to speak to of one problem will be that we probably want we are to take the next report which is mind you problem do not he that has no problem but anyway ok are alde shadow next mit mite her next ndeprelterifortwo minute not more than that	/media/hugo/Seagate Expansion Drive/ALICE_BACKUP/voshpde/wav_files/zipfiles/20150616.wav	18
86	/media/hugo/Seagate Expansion Drive/ALICE_BACKUP/voshpde/pipeLine/segmentation_wavfiles/20150616/087_20150616.wav	1935.9019501133787	85373276	1955.1519501133787	86222201	086_20150616	first of all thank you for the effort you put in you you have made a huge effort here about extraordinary and all you are tried to ask the commission for a global strategy which is what we need and i think the first thing we have to do if all except all the all the points that in this report that we have change it tit all	first of all thank you for the effort you put in you you have made a huge effort here about extraordinary and all you are tried to ask the commission for a global strategy which is what we need and i think the first thing we have to do if all except all the all the points that in this report the we have change it tit all	/media/hugo/Seagate Expansion Drive/ALICE_BACKUP/voshpde/wav_files/zipfiles/20150616.wav	2
87	/media/hugo/Seagate Expansion Drive/ALICE_BACKUP/voshpde/pipeLine/segmentation_wavfiles/20150616/088_20150616.wav	1955.1519727891157	86222202	1979.2019727891156	87282807	087_20150616	it should be a prevention and repression of radicalisation and recruitment of european citizens because either we add the repression part or we have to il to take out some of the paragraph in the report it il a look and what we are going to do basically is fend a very clear message to the commission what we are going to say is that from the point of view of action	it should be a prevention and repression of radicalisation and recruitment of european citizens because either we add the repression part or we have to tito take out some of the paragraph in the report it is a look and what we are going to do basically is fend a very clear message to the commission what we are going to say is that from the point of view of action	/media/hugo/Seagate Expansion Drive/ALICE_BACKUP/voshpde/wav_files/zipfiles/20150616.wav	4
88	/media/hugo/Seagate Expansion Drive/ALICE_BACKUP/voshpde/pipeLine/segmentation_wavfiles/20150616/089_20150616.wav	1979.2019954648526	87282808	2000.7519954648526	88233163	088_20150616	our strategy against terrorism and our defence of democracy that have to be a global strategy if all we have to do it kay up prevention and stops radicalisation and recruitment should we have to add also the prosecution of crimes eu we have to ensure that have vital tallied with the content	our strategy against terrorism and our defence of democracy that have to be a global strategy if all we have to do it kay up prevention and stops radicalisation and recruitment should we have to add also the prosecution of crimes we have to ensure that have vital tallied with the content	/media/hugo/Seagate Expansion Drive/ALICE_BACKUP/voshpde/wav_files/zipfiles/20150616.wav	3
89	/media/hugo/Seagate Expansion Drive/ALICE_BACKUP/voshpde/pipeLine/segmentation_wavfiles/20150616/090_20150616.wav	2000.7520181405896	88233164	2021.1020181405895	89130599	089_20150616	so i think we have to be consisted and there have to be consistently between the title and the content and the message we have to con day it is very clear whatever whatever a content on title of the report here is that is that we are asking for a global strategy its only in a global with a global approach that we can put an end to mutual life such a very serious phenomenon which threaten	so i think we have to be consisted and there have to be consistently between the title and the content and the message we have to con day it is very clear whatever whatever a content on title of the report here is that is that we are asking for a global strategy its only in a global with a global approach that we can put an end to mutual life such a very serious phenomenon which threaten	/media/hugo/Seagate Expansion Drive/ALICE_BACKUP/voshpde/wav_files/zipfiles/20150616.wav	0
90	/media/hugo/Seagate Expansion Drive/ALICE_BACKUP/voshpde/pipeLine/segmentation_wavfiles/20150616/091_20150616.wav	2021.1020408163265	89130600	2045.5520408163266	90208845	090_20150616	de democratic society in twenty five try so prevention of radicalisation and requitment integration integration of those who are vulnerable and likely to be radicalised and there also inter necessary de radicalisation programmes and then he i the whole question of the social response and the other message and i il try to just use of two minute is that in order to strengthen the part	a democratic society in twenty five try so prevention of radicalisation and requitment integration integration of those who are vulnerable and likely to be radicalised and there also inter necessary de radicalisation programmes and then he i the whole question of the social response and the other message and i are try to just use of two minute is that in order to strengthen the part	/media/hugo/Seagate Expansion Drive/ALICE_BACKUP/voshpde/wav_files/zipfiles/20150616.wav	5
