	wavfile	start_seconds	start_frames	end_seconds	end_frames	identifier	inferred_text	motherfile
48	/media/hugo/Seagate Expansion Drive/ALICE_BACKUP/voshpde/pipeLine/segmentation_wavfiles/20150608/049_20150608.wav	1084.101088435374	47808858	1108.0510884353741	48865053	048_20150608	this that mally coinfied with the feelings in i think we are going to have significant difficulty here and i am really curious that we at the member states are going to be acted that when increase in this area are actually broatedaftough when it comes to the mobilisation of the flexibility instrument that requires additional funding	/media/hugo/Seagate Expansion Drive/ALICE_BACKUP/voshpde/wav_files/zipfiles/20150608.wav
49	/media/hugo/Seagate Expansion Drive/ALICE_BACKUP/voshpde/pipeLine/segmentation_wavfiles/20150608/050_20150608.wav	1108.0511111111111	48865054	1128.201111111111	49753669	049_20150608	in her where we are ready offly close to the feeling fill i diswonding when it comes to the budget negotiations to have that is going to turn out then i did have one request for mr nida mina when it comes to security	/media/hugo/Seagate Expansion Drive/ALICE_BACKUP/voshpde/wav_files/zipfiles/20150608.wav
50	/media/hugo/Seagate Expansion Drive/ALICE_BACKUP/voshpde/pipeLine/segmentation_wavfiles/20150608/051_20150608.wav	1128.201133786848	49753670	1156.451133786848	50999495	050_20150608	we vote commented on that and when it comes to the different groups we voted had a consensus when it comes to fighting organised crime for instance and we voted agreed that on european territory it is not a matter of three four people europol but it frontex in ado we need a bit more than that to just hope to	/media/hugo/Seagate Expansion Drive/ALICE_BACKUP/voshpde/wav_files/zipfiles/20150608.wav
51	/media/hugo/Seagate Expansion Drive/ALICE_BACKUP/voshpde/pipeLine/segmentation_wavfiles/20150608/052_20150608.wav	1156.451156462585	50999496	1183.601156462585	52196811	051_20150608	yet something going in europe given the migrous staffing they have so like for ease and we have done a fir asylum migration fund when it comes to organised criminal organisations and human trafficking i think when should really be consistent when it comes to the figures given the situation on the ground	/media/hugo/Seagate Expansion Drive/ALICE_BACKUP/voshpde/wav_files/zipfiles/20150608.wav
52	/media/hugo/Seagate Expansion Drive/ALICE_BACKUP/voshpde/pipeLine/segmentation_wavfiles/20150608/053_20150608.wav	1183.601179138322	52196812	1208.751179138322	53305927	052_20150608	thank you very much lo to the commission the for come back to the rapporteur to president i will be very brief i thank you first everyone here for for those support for this draft amending budget i would want an one to react on two more points in the draft opinion	/media/hugo/Seagate Expansion Drive/ALICE_BACKUP/voshpde/wav_files/zipfiles/20150608.wav
53	/media/hugo/Seagate Expansion Drive/ALICE_BACKUP/voshpde/pipeLine/segmentation_wavfiles/20150608/054_20150608.wav	1208.751201814059	53305928	1231.701201814059	54318023	053_20150608	the need for the call the two diven cause for clarifications and query towards the commission first it on three you call for clarification of the costs of tritin given the diverging figure in fact the treeping i bated on the two thousand and fifteen budget and not un two thousand and fourteen to that is	/media/hugo/Seagate Expansion Drive/ALICE_BACKUP/voshpde/wav_files/zipfiles/20150608.wav
54	/media/hugo/Seagate Expansion Drive/ALICE_BACKUP/voshpde/pipeLine/segmentation_wavfiles/20150608/055_20150608.wav	1231.701224489796	54318024	1261.051224489796	55612359	054_20150608	we have been explaining that and we stand ready to extend it further in the next day there is obviously clearly atripping of the two thousand and fifteen month budget for both tripe and poteduanthenonfour also to clarify that de the exceptional relocation measures and the resettlement the recommendation of the commission on resettlement are not included in this draft amending budget	/media/hugo/Seagate Expansion Drive/ALICE_BACKUP/voshpde/wav_files/zipfiles/20150608.wav
55	/media/hugo/Seagate Expansion Drive/ALICE_BACKUP/voshpde/pipeLine/segmentation_wavfiles/20150608/056_20150608.wav	1261.051247165533	55612360	1284.7012471655328	56655325	055_20150608	mr president the have little impact on two thousand and fifteen but mainly on two thousand and sixteen and seventeen and that is why they are not hear technically there is a small impact that will be dealt with later but very small compared to this haftomending budget that all i wanted to clarify and we ten readyforeing clarifying further any other question thank you	/media/hugo/Seagate Expansion Drive/ALICE_BACKUP/voshpde/wav_files/zipfiles/20150608.wav
56	/media/hugo/Seagate Expansion Drive/ALICE_BACKUP/voshpde/pipeLine/segmentation_wavfiles/20150608/057_20150608.wav	1284.7012698412698	56655326	1301.05126984127	57376361	056_20150608	thank you very much i go back to people and you any because of the cite deadline amendments can only be tabled an english deadline of the tempt and the voters	/media/hugo/Seagate Expansion Drive/ALICE_BACKUP/voshpde/wav_files/zipfiles/20150608.wav
57	/media/hugo/Seagate Expansion Drive/ALICE_BACKUP/voshpde/pipeLine/segmentation_wavfiles/20150608/058_20150608.wav	1301.051292517007	57376362	1326.4012925170068	58494297	057_20150608	in le the on fifteen from seventeen to change we now one to beenectefiten there is be commissioner on his wayyopoltc	/media/hugo/Seagate Expansion Drive/ALICE_BACKUP/voshpde/wav_files/zipfiles/20150608.wav
58	/media/hugo/Seagate Expansion Drive/ALICE_BACKUP/voshpde/pipeLine/segmentation_wavfiles/20150608/059_20150608.wav	1326.4013151927438	58494298	1342.3513151927439	59197693	058_20150608	mr president thirty second do not get to pity and compansoble he just going to be here in a few takin	/media/hugo/Seagate Expansion Drive/ALICE_BACKUP/voshpde/wav_files/zipfiles/20150608.wav
59	/media/hugo/Seagate Expansion Drive/ALICE_BACKUP/voshpde/pipeLine/segmentation_wavfiles/20150608/060_20150608.wav	1342.3513378684806	59197694	1359.5013378684807	59954009	059_20150608	ooooooooo	/media/hugo/Seagate Expansion Drive/ALICE_BACKUP/voshpde/wav_files/zipfiles/20150608.wav
60	/media/hugo/Seagate Expansion Drive/ALICE_BACKUP/voshpde/pipeLine/segmentation_wavfiles/20150608/061_20150608.wav	1359.5013605442177	59954010	1385.4513605442178	61098405	060_20150608	o o o o oooooooooooooo	/media/hugo/Seagate Expansion Drive/ALICE_BACKUP/voshpde/wav_files/zipfiles/20150608.wav
61	/media/hugo/Seagate Expansion Drive/ALICE_BACKUP/voshpde/pipeLine/segmentation_wavfiles/20150608/062_20150608.wav	1385.4513832199546	61098406	1407.9013832199546	62088451	061_20150608	o o o o o	/media/hugo/Seagate Expansion Drive/ALICE_BACKUP/voshpde/wav_files/zipfiles/20150608.wav
62	/media/hugo/Seagate Expansion Drive/ALICE_BACKUP/voshpde/pipeLine/segmentation_wavfiles/20150608/063_20150608.wav	1407.9014058956916	62088452	1423.8514058956916	62791847	062_20150608	oooooooooo	/media/hugo/Seagate Expansion Drive/ALICE_BACKUP/voshpde/wav_files/zipfiles/20150608.wav
63	/media/hugo/Seagate Expansion Drive/ALICE_BACKUP/voshpde/pipeLine/segmentation_wavfiles/20150608/064_20150608.wav	1423.8514285714286	62791848	1444.4014285714286	63698103	063_20150608	o o o o ooooooooooo	/media/hugo/Seagate Expansion Drive/ALICE_BACKUP/voshpde/wav_files/zipfiles/20150608.wav
64	/media/hugo/Seagate Expansion Drive/ALICE_BACKUP/voshpde/pipeLine/segmentation_wavfiles/20150608/065_20150608.wav	1444.4014512471656	63698104	1464.6514512471656	64591129	064_20150608	o o o o o	/media/hugo/Seagate Expansion Drive/ALICE_BACKUP/voshpde/wav_files/zipfiles/20150608.wav
65	/media/hugo/Seagate Expansion Drive/ALICE_BACKUP/voshpde/pipeLine/segmentation_wavfiles/20150608/066_20150608.wav	1464.6514739229026	64591130	1481.1014739229024	65316575	065_20150608	ooooooooooooo	/media/hugo/Seagate Expansion Drive/ALICE_BACKUP/voshpde/wav_files/zipfiles/20150608.wav
66	/media/hugo/Seagate Expansion Drive/ALICE_BACKUP/voshpde/pipeLine/segmentation_wavfiles/20150608/067_20150608.wav	1481.1014965986394	65316576	1506.1514965986394	66421281	066_20150608	o o o o ooooooooo	/media/hugo/Seagate Expansion Drive/ALICE_BACKUP/voshpde/wav_files/zipfiles/20150608.wav
67	/media/hugo/Seagate Expansion Drive/ALICE_BACKUP/voshpde/pipeLine/segmentation_wavfiles/20150608/068_20150608.wav	1506.1515192743764	66421282	1522.4015192743764	67137907	067_20150608	o o o o o	/media/hugo/Seagate Expansion Drive/ALICE_BACKUP/voshpde/wav_files/zipfiles/20150608.wav
68	/media/hugo/Seagate Expansion Drive/ALICE_BACKUP/voshpde/pipeLine/segmentation_wavfiles/20150608/069_20150608.wav	1522.4015419501134	67137908	1542.2515419501133	68013293	068_20150608	ooooooooooooooo	/media/hugo/Seagate Expansion Drive/ALICE_BACKUP/voshpde/wav_files/zipfiles/20150608.wav
69	/media/hugo/Seagate Expansion Drive/ALICE_BACKUP/voshpde/pipeLine/segmentation_wavfiles/20150608/070_20150608.wav	1542.2515646258503	68013294	1570.0015646258503	69237069	069_20150608	o o o o ooooooooooo	/media/hugo/Seagate Expansion Drive/ALICE_BACKUP/voshpde/wav_files/zipfiles/20150608.wav
70	/media/hugo/Seagate Expansion Drive/ALICE_BACKUP/voshpde/pipeLine/segmentation_wavfiles/20150608/071_20150608.wav	1570.0015873015873	69237070	1588.5515873015872	70055125	070_20150608	mr prsdnreyofeucontenkakeyouspeak again man i apologies for their delays so pollogies to for colleagues who have standing and all the rest of it	/media/hugo/Seagate Expansion Drive/ALICE_BACKUP/voshpde/wav_files/zipfiles/20150608.wav
71	/media/hugo/Seagate Expansion Drive/ALICE_BACKUP/voshpde/pipeLine/segmentation_wavfiles/20150608/072_20150608.wav	1588.5516099773242	70055126	1610.3016099773242	71014301	071_20150608	we had to move rooms and al the est at because of the have are changed in timetable my cologies for all of that still we come to the structural dialogue with to me avermoplithour commissioner for migration home affairs and citizenship cg just to remind everyone is the second part of our structural dialogue we had	/media/hugo/Seagate Expansion Drive/ALICE_BACKUP/voshpde/wav_files/zipfiles/20150608.wav
72	/media/hugo/Seagate Expansion Drive/ALICE_BACKUP/voshpde/pipeLine/segmentation_wavfiles/20150608/073_20150608.wav	1610.3016326530612	71014302	1632.4516326530613	71991117	072_20150608	commissioner jourova in our meeting of the twenty six may so there is a formality for this meeting and part of that formal it he just to remind colleagues again is that cordinators only will be asking the questions but we are given youth about that if it gives us more time to hear the answers from the commissioner a bit most pat	/media/hugo/Seagate Expansion Drive/ALICE_BACKUP/voshpde/wav_files/zipfiles/20150608.wav
73	/media/hugo/Seagate Expansion Drive/ALICE_BACKUP/voshpde/pipeLine/segmentation_wavfiles/20150608/074_20150608.wav	1632.451655328798	71991118	1658.1016553287982	73122283	073_20150608	to her the debate which have been also helpful if it the first time we are hearing the commissioner sins to be important commission and council statements on migration to of course that issue top of every one mind but today is also about a structural dialogue on everything on the implementation of the two thousand and thirteen work programme and our lebed priorities for the	/media/hugo/Seagate Expansion Drive/ALICE_BACKUP/voshpde/wav_files/zipfiles/20150608.wav
74	/media/hugo/Seagate Expansion Drive/ALICE_BACKUP/voshpde/pipeLine/segmentation_wavfiles/20150608/075_20150608.wav	1658.1016780045352	73122284	1678.1516780045351	74006489	074_20150608	commission work programme for two thousand and fifteen what we are staying to the commissioner about our priorities across a whole work programme which of course is extremely btailed and very deep so first f are going to hear the commissioner and then coordinates will take the flow for a round of question which the commissioner will reply to	/media/hugo/Seagate Expansion Drive/ALICE_BACKUP/voshpde/wav_files/zipfiles/20150608.wav
75	/media/hugo/Seagate Expansion Drive/ALICE_BACKUP/voshpde/pipeLine/segmentation_wavfiles/20150608/076_20150608.wav	1678.1517006802721	74006490	1704.501700680272	75168525	075_20150608	so i am not going to speak for too long because we only have one or i explain to gain out d to commissioner jourovatitrather than the first find that the came we are going to get bat for depailedownifors so commissioner you have the lower think for a two thousand and fifteen minute ok fiftokyandijust been in a for poors you have come back get insert	/media/hugo/Seagate Expansion Drive/ALICE_BACKUP/voshpde/wav_files/zipfiles/20150608.wav
76	/media/hugo/Seagate Expansion Drive/ALICE_BACKUP/voshpde/pipeLine/segmentation_wavfiles/20150608/077_20150608.wav	1704.501723356009	75168526	1733.451723356009	76445221	076_20150608	for fiftmntetnokingankaboutthatiwaniwantkind of a relation move gather i i want questions from the cordinators and i want you to reply is wel tiftingminuteokfifteenminute fifteen twenty but no more than that and witheneateporetthinkivgtthebetterpoffition for interrupting now the external affairs people in not happy so no on new guiding happy go ahead	/media/hugo/Seagate Expansion Drive/ALICE_BACKUP/voshpde/wav_files/zipfiles/20150608.wav
77	/media/hugo/Seagate Expansion Drive/ALICE_BACKUP/voshpde/pipeLine/segmentation_wavfiles/20150608/078_20150608.wav	1733.451746031746	76445222	1751.9017460317461	77258867	077_20150608	mr president first of all before i start i will spill to me the stopologise as you remember i had to pospond the previous meeting given the fact what i here to ran al	/media/hugo/Seagate Expansion Drive/ALICE_BACKUP/voshpde/wav_files/zipfiles/20150608.wav
78	/media/hugo/Seagate Expansion Drive/ALICE_BACKUP/voshpde/pipeLine/segmentation_wavfiles/20150608/079_20150608.wav	1751.901768707483	77258868	1775.051768707483	78279783	078_20150608	capital cities of northern africa to convey message there and i could not be with you it was my priority for that time and understand it and i think you share this point of view with me nevertheless i am more than hapy to the back in my committee i my committed because nine month aleves since this	/media/hugo/Seagate Expansion Drive/ALICE_BACKUP/voshpde/wav_files/zipfiles/20150608.wav
79	/media/hugo/Seagate Expansion Drive/ALICE_BACKUP/voshpde/pipeLine/segmentation_wavfiles/20150608/080_20150608.wav	1775.05179138322	78279784	1800.00179138322	79380079	079_20150608	very family while approatbeascommissior ho e have not ergretsofarsincthena lot of thinskathappen terror attacks in paris and cope hagan and the migrant tragetin the menterrangly it is the reality of this protofoli	/media/hugo/Seagate Expansion Drive/ALICE_BACKUP/voshpde/wav_files/zipfiles/20150608.wav
80	/media/hugo/Seagate Expansion Drive/ALICE_BACKUP/voshpde/pipeLine/segmentation_wavfiles/20150608/081_20150608.wav	1800.0018140589568	79380080	1827.351814058957	80586215	080_20150608	streatein evolutions pound and forceable others are unexpected crisis requiring emergency responses the european agenda migration and the european agenda on security are our response to but they were as you remember among the first political priority	/media/hugo/Seagate Expansion Drive/ALICE_BACKUP/voshpde/wav_files/zipfiles/20150608.wav
81	/media/hugo/Seagate Expansion Drive/ALICE_BACKUP/voshpde/pipeLine/segmentation_wavfiles/20150608/082_20150608.wav	1827.351836734694	80586216	1847.0018367346938	81452781	081_20150608	for the junk commission but they are also linked to the events that are against our values the are swift adoption of this comprehensive agendas constitutes in itself a guninaccompesment	/media/hugo/Seagate Expansion Drive/ALICE_BACKUP/voshpde/wav_files/zipfiles/20150608.wav
82	/media/hugo/Seagate Expansion Drive/ALICE_BACKUP/voshpde/pipeLine/segmentation_wavfiles/20150608/083_20150608.wav	1847.0018594104308	81452782	1868.2518594104308	82389907	082_20150608	i will logically focus on this when reporting on the work the commission carried out over the last six months let me start by a general remark both agendas constitute a comprehensive package of measures	/media/hugo/Seagate Expansion Drive/ALICE_BACKUP/voshpde/wav_files/zipfiles/20150608.wav
83	/media/hugo/Seagate Expansion Drive/ALICE_BACKUP/voshpde/pipeLine/segmentation_wavfiles/20150608/084_20150608.wav	1868.2518820861678	82389908	1896.5018820861678	83635733	083_20150608	we cannot afford the pig and choose approach anymore we have presented a stead of proposals and actions in this field that should constitute the basis of our common work for the five years to come with common efforts compromises and mutual recessions	/media/hugo/Seagate Expansion Drive/ALICE_BACKUP/voshpde/wav_files/zipfiles/20150608.wav
84	/media/hugo/Seagate Expansion Drive/ALICE_BACKUP/voshpde/pipeLine/segmentation_wavfiles/20150608/085_20150608.wav	1896.5019047619048	83635734	1914.9519047619049	84449379	084_20150608	we cannot afford to continue working separately we need to keep working in a coordinated manner between the european unions institutions and with member states to enhance first of all our mutual trust	/media/hugo/Seagate Expansion Drive/ALICE_BACKUP/voshpde/wav_files/zipfiles/20150608.wav
85	/media/hugo/Seagate Expansion Drive/ALICE_BACKUP/voshpde/pipeLine/segmentation_wavfiles/20150608/086_20150608.wav	1914.9519274376416	84449380	1930.7019274376416	85143955	085_20150608	we need to enhance the exchange of information and multiply operational cooperation to apply solidarity and burden sharing in practice to adopt and implement	/media/hugo/Seagate Expansion Drive/ALICE_BACKUP/voshpde/wav_files/zipfiles/20150608.wav
86	/media/hugo/Seagate Expansion Drive/ALICE_BACKUP/voshpde/pipeLine/segmentation_wavfiles/20150608/087_20150608.wav	1930.7019501133786	85143956	1953.6519501133787	86156051	086_20150608	truly european policies in these weeks not only because it is a trade requirement most importantly because it is a real need and therefore demand our sis or on our sar of our citizens this committee nos well how difficult the transition has been and still is from the for	/media/hugo/Seagate Expansion Drive/ALICE_BACKUP/voshpde/wav_files/zipfiles/20150608.wav
87	/media/hugo/Seagate Expansion Drive/ALICE_BACKUP/voshpde/pipeLine/segmentation_wavfiles/20150608/088_20150608.wav	1953.6519727891157	86156052	1977.1019727891157	87190197	087_20150608	third pillar to the new reality of the lisbon treaty in particular in field that the traditional lim have been at the heart of national sovereignty three agendas are an important step forward and your support is therefore necessary and import	/media/hugo/Seagate Expansion Drive/ALICE_BACKUP/voshpde/wav_files/zipfiles/20150608.wav
88	/media/hugo/Seagate Expansion Drive/ALICE_BACKUP/voshpde/pipeLine/segmentation_wavfiles/20150608/089_20150608.wav	1977.1019954648525	87190198	2003.3519954648525	88347823	088_20150608	your political message to your respective countries is essential i am confident that this agendas will constitute the right basis for the commission parliament and the council to work together towards the achievement of an area of security and of migration policy based on solidarity and responsibility	/media/hugo/Seagate Expansion Drive/ALICE_BACKUP/voshpde/wav_files/zipfiles/20150608.wav
89	/media/hugo/Seagate Expansion Drive/ALICE_BACKUP/voshpde/pipeLine/segmentation_wavfiles/20150608/090_20150608.wav	2003.3520181405895	88347824	2027.3020181405896	89404019	089_20150608	to start le the agenda on security wards concivetly with the goal to consecute the basis for renewed security strategy for the next five years it addresses our main priorities for european security while making compliance with fundamental rights a principle for all actions	/media/hugo/Seagate Expansion Drive/ALICE_BACKUP/voshpde/wav_files/zipfiles/20150608.wav
90	/media/hugo/Seagate Expansion Drive/ALICE_BACKUP/voshpde/pipeLine/segmentation_wavfiles/20150608/091_20150608.wav	2027.3020408163266	89404020	2047.2520408163266	90283815	090_20150608	regarding its implementation from now on we will be reporting on our proposed actions to the co legislators to ice a year i believe this is a concrete answer to the calls for accountability and democratic control parliament has made	/media/hugo/Seagate Expansion Drive/ALICE_BACKUP/voshpde/wav_files/zipfiles/20150608.wav
91	/media/hugo/Seagate Expansion Drive/ALICE_BACKUP/voshpde/pipeLine/segmentation_wavfiles/20150608/092_20150608.wav	2047.2520634920636	90283816	2074.6020634920633	91489951	091_20150608	the agenda stresses the need for a quick response to the challenges we are confronted with as you know eu agencies are the best tool at our disposal to provide operational support it is now urgent to secure an agreement on the europol and seporal regulations at trilogue	/media/hugo/Seagate Expansion Drive/ALICE_BACKUP/voshpde/wav_files/zipfiles/20150608.wav
92	/media/hugo/Seagate Expansion Drive/ALICE_BACKUP/voshpde/pipeLine/segmentation_wavfiles/20150608/093_20150608.wav	2074.6020861678003	91489952	2091.7520861678004	92246267	092_20150608	to allow for the adoption of both regulations by the end of the year and it is important to give these agencies a legal basis that is in tune with the new institutional realities in the area of police cooperation	/media/hugo/Seagate Expansion Drive/ALICE_BACKUP/voshpde/wav_files/zipfiles/20150608.wav
93	/media/hugo/Seagate Expansion Drive/ALICE_BACKUP/voshpde/pipeLine/segmentation_wavfiles/20150608/094_20150608.wav	2091.7521088435374	92246268	2116.1021088435373	93320103	093_20150608	i count on your support for the one of the commissions manproccupations is the quick adoption of the eupnr directive and here i wish to thank the honourable members for committing to adopt the proposal by the end of the year the com	/media/hugo/Seagate Expansion Drive/ALICE_BACKUP/voshpde/wav_files/zipfiles/20150608.wav
94	/media/hugo/Seagate Expansion Drive/ALICE_BACKUP/voshpde/pipeLine/segmentation_wavfiles/20150608/095_20150608.wav	2116.1021315192743	93320104	2138.2521315192744	94296919	094_20150608	in response to parliaments resolution of eleven february two thousand and fifteen as we remember organised a meeting between independent experts from the law enforcement security and intelligence communities and representatives of the article twenty nine working	/media/hugo/Seagate Expansion Drive/ALICE_BACKUP/voshpde/wav_files/zipfiles/20150608.wav
95	/media/hugo/Seagate Expansion Drive/ALICE_BACKUP/voshpde/pipeLine/segmentation_wavfiles/20150608/096_20150608.wav	2138.2521541950114	94296920	2160.202154195011	95264915	095_20150608	you were also invited to attend the meeting after which we stand a short somemarus discussion the bat specifically addressed the concerns raised by a number of meps on the necessity and proportionality of pnr processing the	/media/hugo/Seagate Expansion Drive/ALICE_BACKUP/voshpde/wav_files/zipfiles/20150608.wav
96	/media/hugo/Seagate Expansion Drive/ALICE_BACKUP/voshpde/pipeLine/segmentation_wavfiles/20150608/097_20150608.wav	2160.202176870748	95264916	2181.3521768707483	96197631	096_20150608	do not have clearly define legal boundaries they are linked to the data protection safeguards which a pnr system will put in place and to sensitive information which combined to pnr data lead to the advancement of a criminal investigation concerning terrorism	/media/hugo/Seagate Expansion Drive/ALICE_BACKUP/voshpde/wav_files/zipfiles/20150608.wav
97	/media/hugo/Seagate Expansion Drive/ALICE_BACKUP/voshpde/pipeLine/segmentation_wavfiles/20150608/098_20150608.wav	2181.3521995464853	96197632	2208.702199546485	97403767	097_20150608	on other forms of serious transnational crimes the commission welcomes any amendment to align the directive with the course judgment on the data retention directive provided that the operational efficiency of the directive is not affected i reaffirm our willingness to work constructively with the legislators towards this objective	/media/hugo/Seagate Expansion Drive/ALICE_BACKUP/voshpde/wav_files/zipfiles/20150608.wav
98	/media/hugo/Seagate Expansion Drive/ALICE_BACKUP/voshpde/pipeLine/segmentation_wavfiles/20150608/099_20150608.wav	2208.702222222222	97403768	2233.052222222222	98477603	098_20150608	with regard now to the agenda migration i already explained its main elements last month during the plenary session since then we have taken further steps for its implementation through the adoption of the package on twenty seven may it encompasses as	/media/hugo/Seagate Expansion Drive/ALICE_BACKUP/voshpde/wav_files/zipfiles/20150608.wav
99	/media/hugo/Seagate Expansion Drive/ALICE_BACKUP/voshpde/pipeLine/segmentation_wavfiles/20150608/100_20150608.wav	2233.052244897959	98477604	2249.702244897959	99211869	099_20150608	provisional measure the relocation of forty zero asylum seekers within the european union through the activation of article seventy eight ph three of the treat it also includes a recommend	/media/hugo/Seagate Expansion Drive/ALICE_BACKUP/voshpde/wav_files/zipfiles/20150608.wav
100	/media/hugo/Seagate Expansion Drive/ALICE_BACKUP/voshpde/pipeLine/segmentation_wavfiles/20150608/101_20150608.wav	2249.702267573696	99211870	2275.3522675736963	100343035	100_20150608	to the member states to recep twenty zero people from third countries in need of the international protection moreover it includes an action plan or smuggling and guidelines on finger bringing procedures the two thousand and fifteen budget is also being amended to allow for the implementation of the measures announced in the agenda	/media/hugo/Seagate Expansion Drive/ALICE_BACKUP/voshpde/wav_files/zipfiles/20150608.wav
