	wavfile	start_seconds	start_frames	end_seconds	end_frames	identifier	inferred_text	motherfile
0	/media/hugo/Seagate Expansion Drive/ALICE_BACKUP/voshpde/pipeLine/segmentation_wavfiles/20150127/001_20150127.wav	0.0	0	29.05	1281105	000_20150127	i am going to begin the meeting because we have extremely tight agenda this morning so let me begin with the chairs announcements the linguistic profile interpretation if there are no objections id the agendas adopted	/media/hugo/Seagate Expansion Drive/ALICE_BACKUP/voshpde/wav_files/zipfiles/20150127.wav
1	/media/hugo/Seagate Expansion Drive/ALICE_BACKUP/voshpde/pipeLine/segmentation_wavfiles/20150127/002_20150127.wav	29.05002267573696	1281106	50.10002267573696	2209411	001_20150127	linguistic profile interpretation and danish maltese and creation is unfortunately not available during the meeting are just begin with the endorsement of coordinators recommendations first of all remarks by the ombudsman this is letter of the six october	/media/hugo/Seagate Expansion Drive/ALICE_BACKUP/voshpde/wav_files/zipfiles/20150127.wav
2	/media/hugo/Seagate Expansion Drive/ALICE_BACKUP/voshpde/pipeLine/segmentation_wavfiles/20150127/003_20150127.wav	50.10004535147392	2209412	68.45004535147392	3018647	002_20150127	on six october the ombudsman rot to president shulz regarding coordinators decisions which should be included in the register of documents and i am going to ask that these are approved by you secondly recommendation on dates for lib missions	/media/hugo/Seagate Expansion Drive/ALICE_BACKUP/voshpde/wav_files/zipfiles/20150127.wav
3	/media/hugo/Seagate Expansion Drive/ALICE_BACKUP/voshpde/pipeLine/segmentation_wavfiles/20150127/004_20150127.wav	68.45006802721089	3018648	93.50006802721089	4123353	003_20150127	levy coordinators recommended to organise the following leave emissions the first one is the mission to washington between the siteen is the twenty march a lab mission to the frontex agency between the sixteen to seventeen february le mission to europol on nineteen march levy mission to eurojust on the twenty march and the mission to see pall on hundninenendotwentymarch	/media/hugo/Seagate Expansion Drive/ALICE_BACKUP/voshpde/wav_files/zipfiles/20150127.wav
4	/media/hugo/Seagate Expansion Drive/ALICE_BACKUP/voshpde/pipeLine/segmentation_wavfiles/20150127/005_20150127.wav	93.50009070294784	4123354	110.05009070294784	4853209	004_20150127	mr president third point motions for resolutions we have a number of motions of resolutions under rue one they three for eurproval	/media/hugo/Seagate Expansion Drive/ALICE_BACKUP/voshpde/wav_files/zipfiles/20150127.wav
5	/media/hugo/Seagate Expansion Drive/ALICE_BACKUP/voshpde/pipeLine/segmentation_wavfiles/20150127/006_20150127.wav	110.05011337868481	4853210	137.0001133786848	6041705	005_20150127	ok on applications for asylum in italy rapporteur bizoto on harmonising national laws addressing football violence on the establishment of the european agency for inter eu adoption on harmonising national legislation and cyber billing all rapporteur patichelo on the abolition of the european union agency for fundamental rights the rapporteurs lapen and salvini	/media/hugo/Seagate Expansion Drive/ALICE_BACKUP/voshpde/wav_files/zipfiles/20150127.wav
6	/media/hugo/Seagate Expansion Drive/ALICE_BACKUP/voshpde/pipeLine/segmentation_wavfiles/20150127/007_20150127.wav	137.00013605442177	6041706	164.25013605442177	7243431	006_20150127	men none of these required follow up fourthly on petitions and we have four and as regards all of these petitions under sand in hundred and forty seven two thousand and thirteen coordinators agreed with the suggestion of the foreign affairs committee to transmit the petition to the ep margrob delegation to make diplomatic contacts regarding this case and also to refer the matter to vice president maginis	/media/hugo/Seagate Expansion Drive/ALICE_BACKUP/voshpde/wav_files/zipfiles/20150127.wav
7	/media/hugo/Seagate Expansion Drive/ALICE_BACKUP/voshpde/pipeLine/segmentation_wavfiles/20150127/008_20150127.wav	164.25015873015872	7243432	181.30015873015873	7995337	007_20150127	the ep mediator for international parental child adoption as regards the four petitions and i mentioned the earlier coordinangtohs decided that there would be no follow up required	/media/hugo/Seagate Expansion Drive/ALICE_BACKUP/voshpde/wav_files/zipfiles/20150127.wav
8	/media/hugo/Seagate Expansion Drive/ALICE_BACKUP/voshpde/pipeLine/segmentation_wavfiles/20150127/009_20150127.wav	181.3001814058957	7995338	208.6501814058957	9201473	008_20150127	mr president a fiffully on written procedures coordinators decided by written procedure on six the first that libya should draft an updated interim report and the european public prosecutors office to express its position in view of the ongoing negotiations in council in order to be able to influence the result of the next council under the latvian presidency which will take place in the twelve the march the draft interim report should be adopted before that date	/media/hugo/Seagate Expansion Drive/ALICE_BACKUP/voshpde/wav_files/zipfiles/20150127.wav
9	/media/hugo/Seagate Expansion Drive/ALICE_BACKUP/voshpde/pipeLine/segmentation_wavfiles/20150127/010_20150127.wav	208.65020408163267	9201474	225.30020408163264	9935739	009_20150127	to be able to comply with that tie timetable coordinators have exceptionally agreed to work only on the english version of that report does the committee endorse these coordinators recommendations pursued five	/media/hugo/Seagate Expansion Drive/ALICE_BACKUP/voshpde/wav_files/zipfiles/20150127.wav
10	/media/hugo/Seagate Expansion Drive/ALICE_BACKUP/voshpde/pipeLine/segmentation_wavfiles/20150127/011_20150127.wav	225.30022675736961	9935740	249.1502267573696	10987525	010_20150127	ok colleagues now we have the state of play on the ongoing negotiations with the council and we have the two files on money laundering we have our two rapporteurs judicargenteniantimithycarcope i wanted to ask if judith antimithy could update us briefly on the file	/media/hugo/Seagate Expansion Drive/ALICE_BACKUP/voshpde/wav_files/zipfiles/20150127.wav
11	/media/hugo/Seagate Expansion Drive/ALICE_BACKUP/voshpde/pipeLine/segmentation_wavfiles/20150127/012_20150127.wav	249.15024943310658	10987526	278.2002494331066	12268631	011_20150127	and just a reminder to colleagues that the vote on endorsing the agreement role seventy three the rules of procedure will take place this afternoon at the joint libya econ meeting at fifteen hundred and room jan vo to so please bring your voting cards and have judith and timithy could perhaps give us a a brief update on the state of play	/media/hugo/Seagate Expansion Drive/ALICE_BACKUP/voshpde/wav_files/zipfiles/20150127.wav
12	/media/hugo/Seagate Expansion Drive/ALICE_BACKUP/voshpde/pipeLine/segmentation_wavfiles/20150127/013_20150127.wav	278.20027210884354	12268632	298.75027210884355	13174887	012_20150127	yes indeed clout were voting on the outcome of the trilogue trilogues this afternoon the final trialogue took place in strasbourg just before christmas to the corapairhas at the moment green	/media/hugo/Seagate Expansion Drive/ALICE_BACKUP/voshpde/wav_files/zipfiles/20150127.wav
13	/media/hugo/Seagate Expansion Drive/ALICE_BACKUP/voshpde/pipeLine/segmentation_wavfiles/20150127/014_20150127.wav	298.7502947845805	13174888	314.8002947845805	13882693	013_20150127	with the outcome of the trilogue that was slightly delayed due to the attacks on sharli hebdo but today we expect eco find to sign off on it	/media/hugo/Seagate Expansion Drive/ALICE_BACKUP/voshpde/wav_files/zipfiles/20150127.wav
14	/media/hugo/Seagate Expansion Drive/ALICE_BACKUP/voshpde/pipeLine/segmentation_wavfiles/20150127/015_20150127.wav	314.80031746031744	13882694	338.05031746031744	14908019	014_20150127	on the anti money laundering directive it is the fort its the ford adaptation what parliament managed to get out of it i think it is quite revolutionary that is a public register it is a register open to everybody that has a legitimate interest	/media/hugo/Seagate Expansion Drive/ALICE_BACKUP/voshpde/wav_files/zipfiles/20150127.wav
15	/media/hugo/Seagate Expansion Drive/ALICE_BACKUP/voshpde/pipeLine/segmentation_wavfiles/20150127/016_20150127.wav	338.05034013605444	14908020	361.2003401360544	15928935	015_20150127	and we manage to praise it in such a way that it is not you that has to prove that you gutter legitimate interest that your interest is legitimate but it is the other side it is the state that has to argue that your interest might not lea not be legite this of course is up to twenty eight countries dat	/media/hugo/Seagate Expansion Drive/ALICE_BACKUP/voshpde/wav_files/zipfiles/20150127.wav
16	/media/hugo/Seagate Expansion Drive/ALICE_BACKUP/voshpde/pipeLine/segmentation_wavfiles/20150127/017_20150127.wav	361.20036281179136	15928936	382.5503628117914	16870471	016_20150127	we will adapt adapt to their own circumstances and it might lead to cases in member states where the state argus or the authority argues its not ligit and the citizen or the ngo or the journalists argue cities and will have to see what happens	/media/hugo/Seagate Expansion Drive/ALICE_BACKUP/voshpde/wav_files/zipfiles/20150127.wav
17	/media/hugo/Seagate Expansion Drive/ALICE_BACKUP/voshpde/pipeLine/segmentation_wavfiles/20150127/018_20150127.wav	382.55038548752833	16870472	400.20038548752837	17648837	017_20150127	in due time these twenty eight public registers or these twenty eight registers on ultimate beneficial owners will be interconnected which makes it possible both for authorities and obliged entities banks etc and the citizens too	/media/hugo/Seagate Expansion Drive/ALICE_BACKUP/voshpde/wav_files/zipfiles/20150127.wav
18	/media/hugo/Seagate Expansion Drive/ALICE_BACKUP/voshpde/pipeLine/segmentation_wavfiles/20150127/019_20150127.wav	400.2004081632653	17648838	428.6504081632653	18903483	018_20150127	to find to investigate a case cross cross border i think we need to thank the italian presidency because this was not in the commissions proposal in fact it took a long time before the commission embrace that register it was definitely not in the councils first negotiating mandate in fact there are only a couple of member states appreciative of it	/media/hugo/Seagate Expansion Drive/ALICE_BACKUP/voshpde/wav_files/zipfiles/20150127.wav
19	/media/hugo/Seagate Expansion Drive/ALICE_BACKUP/voshpde/pipeLine/segmentation_wavfiles/20150127/020_20150127.wav	428.65043083900224	18903484	451.40043083900224	19906759	019_20150127	and in in the end the result is still there also because parliament the negotiators the shadow rapporteurs sticked to there to their demands because parliament voted in favour of public register with six hundred and forty three votes in favour and thirty again so that was	/media/hugo/Seagate Expansion Drive/ALICE_BACKUP/voshpde/wav_files/zipfiles/20150127.wav
20	/media/hugo/Seagate Expansion Drive/ALICE_BACKUP/voshpde/pipeLine/segmentation_wavfiles/20150127/021_20150127.wav	451.40045351473924	19906760	470.35045351473923	20742455	020_20150127	real good and i hope this will lead in toto transparency in into businesses and who actually os what and it will be helpful in fighting tax evasion and tax avoidance and the second and last points i want to highlight chair if you allow me is	/media/hugo/Seagate Expansion Drive/ALICE_BACKUP/voshpde/wav_files/zipfiles/20150127.wav
21	/media/hugo/Seagate Expansion Drive/ALICE_BACKUP/voshpde/pipeLine/segmentation_wavfiles/20150127/022_20150127.wav	470.3504761904762	20742456	495.7004761904762	21860391	021_20150127	data protection although this was already the fourth review that the file really lacked data protection clarity and it has been demanded both by parliament but also by the obliged enterties to clarify how anti money laundering and data protection legislation how how to interpret than an	/media/hugo/Seagate Expansion Drive/ALICE_BACKUP/voshpde/wav_files/zipfiles/20150127.wav
22	/media/hugo/Seagate Expansion Drive/ALICE_BACKUP/voshpde/pipeLine/segmentation_wavfiles/20150127/023_20150127.wav	495.70049886621314	21860392	516.9504988662131	22797517	022_20150127	not to be stuck between a rock and a hard place and have to do the interpretation yourself ask this was always in the corner of eco fin and dg marked i must honestly say the understanding of data protection was seriously limited it was seen as a way to tip of the criminal	/media/hugo/Seagate Expansion Drive/ALICE_BACKUP/voshpde/wav_files/zipfiles/20150127.wav
23	/media/hugo/Seagate Expansion Drive/ALICE_BACKUP/voshpde/pipeLine/segmentation_wavfiles/20150127/024_20150127.wav	516.9505215419501	22797518	546.7005215419501	24109493	023_20150127	in the end we managed to get clear clear language in on the protection of the client of a bank for instance and his or her right to know why a service was refused without of course keeping of a criminal and might also have helped that after november when the new commission started the file moved from	/media/hugo/Seagate Expansion Drive/ALICE_BACKUP/voshpde/wav_files/zipfiles/20150127.wav
24	/media/hugo/Seagate Expansion Drive/ALICE_BACKUP/voshpde/pipeLine/segmentation_wavfiles/20150127/025_20150127.wav	546.700544217687	24109494	564.050544217687	24874629	024_20150127	for marked to justice and met with officials in the commission the had a different understanding on data protection and i think we can be happy with that as well	/media/hugo/Seagate Expansion Drive/ALICE_BACKUP/voshpde/wav_files/zipfiles/20150127.wav
25	/media/hugo/Seagate Expansion Drive/ALICE_BACKUP/voshpde/pipeLine/segmentation_wavfiles/20150127/026_20150127.wav	564.050566893424	24874630	587.5005668934241	25908775	025_20150127	mr president obviously i just following behind judith on this but i would like obviously to thank the commission and the council all the shadows my co rapporteur mr samon and of course mrs sautlantinia mr karens and of course answer from the secretaria particularly for their support in this	/media/hugo/Seagate Expansion Drive/ALICE_BACKUP/voshpde/wav_files/zipfiles/20150127.wav
26	/media/hugo/Seagate Expansion Drive/ALICE_BACKUP/voshpde/pipeLine/segmentation_wavfiles/20150127/027_20150127.wav	587.500589569161	25908776	608.350589569161	26828261	026_20150127	this regulation of course is one of the two instruments included in the package my report obviously the less extensive of the two reports it covers the information that has to accompany these transfers and here we tried to achieve a balance between the amount of data to be provided	/media/hugo/Seagate Expansion Drive/ALICE_BACKUP/voshpde/wav_files/zipfiles/20150127.wav
27	/media/hugo/Seagate Expansion Drive/ALICE_BACKUP/voshpde/pipeLine/segmentation_wavfiles/20150127/028_20150127.wav	608.350612244898	26828262	632.8006122448979	27906507	027_20150127	and the challenges posed by anamimity in the danger of money laundering in this spirit it was agreed the regulation does not cover certain transfers for example where the transfer of funds entails the par with drawing cash from his or her own account and member states can in certain cases apply a less stringent regime for example transfers below a ozan	/media/hugo/Seagate Expansion Drive/ALICE_BACKUP/voshpde/wav_files/zipfiles/20150127.wav
28	/media/hugo/Seagate Expansion Drive/ALICE_BACKUP/voshpde/pipeLine/segmentation_wavfiles/20150127/029_20150127.wav	632.8006349206349	27906508	659.7506349206349	29095003	028_20150127	euros if not connected we also differentiate between inside eu transfers and transfers coming from outside the eu proportionality is very important in this data protection has always been a priority for this committee as you know and therefore many of the original amendments that i have covered the issue and i hope that we have integrated the remarks from the european data protection supervisor	/media/hugo/Seagate Expansion Drive/ALICE_BACKUP/voshpde/wav_files/zipfiles/20150127.wav
29	/media/hugo/Seagate Expansion Drive/ALICE_BACKUP/voshpde/pipeLine/segmentation_wavfiles/20150127/030_20150127.wav	659.7506575963719	29095004	681.2006575963719	30040949	029_20150127	president is fully clarified within this regulation the directive ninety five forty six would fully apply so i hope between the home package as a close connection between these two instruments also that we have corrected many of the mistakes and burdens of previous money laundering legislation these harm to me every day frankly	/media/hugo/Seagate Expansion Drive/ALICE_BACKUP/voshpde/wav_files/zipfiles/20150127.wav
30	/media/hugo/Seagate Expansion Drive/ALICE_BACKUP/voshpde/pipeLine/segmentation_wavfiles/20150127/031_20150127.wav	681.2006802721088	30040950	697.9506802721088	30779625	030_20150127	on what we have done on previous attempts seem to me not to have been particularly balanced in all cases and i think we have now achieved a balanced package which addresses civil liberties concerns but also the need to fight serious and organised crime	/media/hugo/Seagate Expansion Drive/ALICE_BACKUP/voshpde/wav_files/zipfiles/20150127.wav
31	/media/hugo/Seagate Expansion Drive/ALICE_BACKUP/voshpde/pipeLine/segmentation_wavfiles/20150127/032_20150127.wav	697.9507029478458	30779626	726.0007029478458	32016631	031_20150127	a fewer places left now for criminals to hide money but also the simpler regime for those that are carrying out daily legitimate business that they wish to be involved in and i think that was an error in previous attempts on money laundering and i think this time we have now put that right so i hope the instrument demonstrates the use of personal data when used in a proportionate and protected way can be an essential area in the fight against serious crime and terrorism	/media/hugo/Seagate Expansion Drive/ALICE_BACKUP/voshpde/wav_files/zipfiles/20150127.wav
32	/media/hugo/Seagate Expansion Drive/ALICE_BACKUP/voshpde/pipeLine/segmentation_wavfiles/20150127/033_20150127.wav	726.0007256235828	32016632	749.2507256235828	33041957	032_20150127	i want to thank everybody involved i hope actually chairman that the committee can support the final position that we have reached rent thank both of you for your work on this for colleagues we have just joining us the votes going to be fifteen hundred today the libe con vote from your voting cards and thank you for this is good to at this elf in the	/media/hugo/Seagate Expansion Drive/ALICE_BACKUP/voshpde/wav_files/zipfiles/20150127.wav
33	/media/hugo/Seagate Expansion Drive/ALICE_BACKUP/voshpde/pipeLine/segmentation_wavfiles/20150127/034_20150127.wav	749.2507482993198	33041958	770.8007482993197	33992313	033_20150127	to as the end of the italian presidency i tend in some of the trialogues i know much work you put into so thank you for that colleagues can i also i just welcome some of my colleagues from taro hamlets in london some my constituency have just joined join the meeting or up at the back so war and welcome to all of you	/media/hugo/Seagate Expansion Drive/ALICE_BACKUP/voshpde/wav_files/zipfiles/20150127.wav
34	/media/hugo/Seagate Expansion Drive/ALICE_BACKUP/voshpde/pipeLine/segmentation_wavfiles/20150127/035_20150127.wav	770.8007709750567	33992314	794.4507709750567	35035279	034_20150127	this morning to colleagues we are going to begin our joint debate on counterterrorism deradicalisation and foreign fighters on twenty january we set out a timeline for year discussion of counterterrorism and deradicalisation measures following the paris attacks	/media/hugo/Seagate Expansion Drive/ALICE_BACKUP/voshpde/wav_files/zipfiles/20150127.wav
35	/media/hugo/Seagate Expansion Drive/ALICE_BACKUP/voshpde/pipeLine/segmentation_wavfiles/20150127/036_20150127.wav	794.4507936507937	35035280	824.0007936507936	36338435	035_20150127	on seven january and the discussions that we needed in the run up to the informal jha council on twenty nine january this week in riga we are not devoting enough time i feel this week to this but i wanted to ensure that we had all the key players together importantly for this week before the key decisions are made so that you have your opinions	/media/hugo/Seagate Expansion Drive/ALICE_BACKUP/voshpde/wav_files/zipfiles/20150127.wav
36	/media/hugo/Seagate Expansion Drive/ALICE_BACKUP/voshpde/pipeLine/segmentation_wavfiles/20150127/037_20150127.wav	824.0008163265306	36338436	848.3508163265307	37412271	036_20150127	i said at the right time so our exchange of views begin with view from the commissioner and will have an exchange of views with gieldicurk of the eu counterterrorism coordinator but they are good t have a presentation of the radicalisation awareness net work aran by omar ramadan	/media/hugo/Seagate Expansion Drive/ALICE_BACKUP/voshpde/wav_files/zipfiles/20150127.wav
37	/media/hugo/Seagate Expansion Drive/ALICE_BACKUP/voshpde/pipeLine/segmentation_wavfiles/20150127/038_20150127.wav	848.3508390022675	37412272	863.6008390022675	38084797	037_20150127	then will have presentations by morten car m the director of the fundamental rights agency and ye have any biterarlythe european data protection supervisor so first the presentation from the commission	/media/hugo/Seagate Expansion Drive/ALICE_BACKUP/voshpde/wav_files/zipfiles/20150127.wav
38	/media/hugo/Seagate Expansion Drive/ALICE_BACKUP/voshpde/pipeLine/segmentation_wavfiles/20150127/039_20150127.wav	863.6008616780045	38084798	881.5508616780045	38876393	038_20150127	now as colleagues just make colleagues aware that the commissioner for a very compelling reasons informly that he could not be here and the very good and compelling reasons simatiesrital	/media/hugo/Seagate Expansion Drive/ALICE_BACKUP/voshpde/wav_files/zipfiles/20150127.wav
39	/media/hugo/Seagate Expansion Drive/ALICE_BACKUP/voshpde/pipeLine/segmentation_wavfiles/20150127/040_20150127.wav	881.5508843537415	38876394	906.0008843537415	39954639	039_20150127	make a statement on his behalf and will talk about the much this he cant about the issues and the run up to the twelve fur bring european council and you will be able to immediately following that statement ask chime question so what ik questions immediately after is	/media/hugo/Seagate Expansion Drive/ALICE_BACKUP/voshpde/wav_files/zipfiles/20150127.wav
40	/media/hugo/Seagate Expansion Drive/ALICE_BACKUP/voshpde/pipeLine/segmentation_wavfiles/20150127/041_20150127.wav	906.0009070294784	39954640	933.4509070294785	41165185	040_20150127	i set out the commission state ply something because it time when as straight to you atise for your statement from the commission you very much president and good morning to all of you honourable members of parliament it is now twenty days since the horrible events chalyhado	/media/hugo/Seagate Expansion Drive/ALICE_BACKUP/voshpde/wav_files/zipfiles/20150127.wav
41	/media/hugo/Seagate Expansion Drive/ALICE_BACKUP/voshpde/pipeLine/segmentation_wavfiles/20150127/042_20150127.wav	933.4509297052155	41165186	963.1009297052154	42472751	041_20150127	madam hapsidentithinkwehave over the last days had a number of rather intensive series of meetings in terms of how to react to these horribly events and silthececotand i have been sitting and i do not know how many meetings together over the last few weeks the commission	/media/hugo/Seagate Expansion Drive/ALICE_BACKUP/voshpde/wav_files/zipfiles/20150127.wav
42	/media/hugo/Seagate Expansion Drive/ALICE_BACKUP/voshpde/pipeLine/segmentation_wavfiles/20150127/043_20150127.wav	963.1009523809524	42472752	982.7509523809524	43339317	042_20150127	immediately reacted but reacted also by saying very carefully time had come for action but not for actionism and i think this was the stear that we got from president juncker	/media/hugo/Seagate Expansion Drive/ALICE_BACKUP/voshpde/wav_files/zipfiles/20150127.wav
43	/media/hugo/Seagate Expansion Drive/ALICE_BACKUP/voshpde/pipeLine/segmentation_wavfiles/20150127/044_20150127.wav	982.7509750566893	43339318	999.8009750566894	44091223	043_20150127	pre in reaction to the events because we have been through a number of events and we have seen that very often there is a very quick reaction rather than measured reaction	/media/hugo/Seagate Expansion Drive/ALICE_BACKUP/voshpde/wav_files/zipfiles/20150127.wav
44	/media/hugo/Seagate Expansion Drive/ALICE_BACKUP/voshpde/pipeLine/segmentation_wavfiles/20150127/045_20150127.wav	999.8009977324263	44091224	1024.4509977324262	45178289	044_20150127	and i will try and give to you a few elements of how we have been working away through and will be working away through the measures reactions to these horrible events both in chardyhipdo and in the jewish star which the certain extent where an attack against everything that europe	/media/hugo/Seagate Expansion Drive/ALICE_BACKUP/voshpde/wav_files/zipfiles/20150127.wav
45	/media/hugo/Seagate Expansion Drive/ALICE_BACKUP/voshpde/pipeLine/segmentation_wavfiles/20150127/046_20150127.wav	1024.4510204081632	45178290	1040.4010204081633	45881685	045_20150127	stands for in terms of values and i must say that i had the privilege as some of you to participate in the silent march in paris and the way you could feel in this march	/media/hugo/Seagate Expansion Drive/ALICE_BACKUP/voshpde/wav_files/zipfiles/20150127.wav
46	/media/hugo/Seagate Expansion Drive/ALICE_BACKUP/voshpde/pipeLine/segmentation_wavfiles/20150127/047_20150127.wav	1040.4010430839003	45881686	1068.8510430839003	47136331	046_20150127	mr pre that the come but the resolve of all the people who are participating in this mar march all raises all ages in a very very dignified way i must say i made me proud to be e european i should perhaps in the introductory point also make the point that today s	/media/hugo/Seagate Expansion Drive/ALICE_BACKUP/voshpde/wav_files/zipfiles/20150127.wav
