	wavfile	start_seconds	start_frames	end_seconds	end_frames	identifier	inferred_text	motherfile
416	/media/hugo/Seagate Expansion Drive/ALICE_BACKUP/voshpde/pipeLine/segmentation_wavfiles/20150127/417_20150127.wav	9358.009433106576	412688216	9375.959433106576	413479811	416_20150127	social skill on behave your should be dealt with but very important as well is involving community members family perhaps even victims as you have well perhaps not seen because i have to speed up that we have a working group of victims	/media/hugo/Seagate Expansion Drive/ALICE_BACKUP/voshpde/wav_files/zipfiles/20150127.wav
417	/media/hugo/Seagate Expansion Drive/ALICE_BACKUP/voshpde/pipeLine/segmentation_wavfiles/20150127/418_20150127.wav	9375.959455782313	413479812	9393.509455782312	414253767	417_20150127	delivering tustomoniestestomonials i should say in classrooms for instance and deradicalis deradicalising youngsters in those classrooms by doing so many derat programmes	/media/hugo/Seagate Expansion Drive/ALICE_BACKUP/voshpde/wav_files/zipfiles/20150127.wav
418	/media/hugo/Seagate Expansion Drive/ALICE_BACKUP/voshpde/pipeLine/segmentation_wavfiles/20150127/419_20150127.wav	9393.50947845805	414253768	9423.15947845805	415561333	418_20150127	i think are successful by not tackling ideology as a prime issue but of course if ideology was kheeing radicalisation it should and formers should be involved the counternarratives are just referred to many of them are created by farmers as well and we should keep in mind that we do not only need statutary practitioner such as present staff on police officers that ngos as well	/media/hugo/Seagate Expansion Drive/ALICE_BACKUP/voshpde/wav_files/zipfiles/20150127.wav
419	/media/hugo/Seagate Expansion Drive/ALICE_BACKUP/voshpde/pipeLine/segmentation_wavfiles/20150127/420_20150127.wav	9423.159501133787	415561334	9446.109501133787	416573429	419_20150127	especially in cases where trust and authorities as low and prison staff etcetera are of course sons authorities i have tried to keep really appreciate this presentation number of members of been asking me about this issue and i think	/media/hugo/Seagate Expansion Drive/ALICE_BACKUP/voshpde/wav_files/zipfiles/20150127.wav
420	/media/hugo/Seagate Expansion Drive/ALICE_BACKUP/voshpde/pipeLine/segmentation_wavfiles/20150127/421_20150127.wav	9446.109523809524	416573430	9465.059523809523	417409125	420_20150127	i think one of the problems is the inconsistency amongst member states in the sense that it is not something which is highly developed in some member states but in one of two member states it is more highly developed strategy and of course is very different in different member states so now for us it is becoming an issue that	/media/hugo/Seagate Expansion Drive/ALICE_BACKUP/voshpde/wav_files/zipfiles/20150127.wav
421	/media/hugo/Seagate Expansion Drive/ALICE_BACKUP/voshpde/pipeLine/segmentation_wavfiles/20150127/422_20150127.wav	9465.059546485261	417409126	9490.309546485261	418522651	421_20150127	wants to be discussed at at eu level but how do you do it and suddenly when you make a presentation like this it feels at almost at of context but i think we need to get use to discussing it in the parliamentary setting here so i think that was a really good introduction i really thank you for that not everyone is used	/media/hugo/Seagate Expansion Drive/ALICE_BACKUP/voshpde/wav_files/zipfiles/20150127.wav
422	/media/hugo/Seagate Expansion Drive/ALICE_BACKUP/voshpde/pipeLine/segmentation_wavfiles/20150127/423_20150127.wav	9490.309569160998	418522652	9509.259569160999	419358347	422_20150127	seeing these issues presented in that way tha so thank you us think the commissioner are introducing some of these concepts and their proposals to come so again colleagues if you want to indicate any questions please indicate for the speakers less finally because we	/media/hugo/Seagate Expansion Drive/ALICE_BACKUP/voshpde/wav_files/zipfiles/20150127.wav
423	/media/hugo/Seagate Expansion Drive/ALICE_BACKUP/voshpde/pipeLine/segmentation_wavfiles/20150127/424_20150127.wav	9509.259591836735	419358348	9532.909591836735	420401313	423_20150127	now this is a marat in session colleagues i thank you again for your patients running up to twelve thirty we wanted to make sure that we kept this session comprehensive so for the fundamental rights agency and the data protection supervisor finally we wanted to get their perspective so first of all more tan karim from the fra morten again you are in put into	/media/hugo/Seagate Expansion Drive/ALICE_BACKUP/voshpde/wav_files/zipfiles/20150127.wav
424	/media/hugo/Seagate Expansion Drive/ALICE_BACKUP/voshpde/pipeLine/segmentation_wavfiles/20150127/425_20150127.wav	9532.909614512471	420401314	9559.159614512471	421558939	424_20150127	mr president the council meeting in february what the commissioner saying and you are perspective on that and how you see be vary in putting into that mr president thank youverymuch for the invitation to come here again to live and to have this very important exchange at a time where we an very complex discussions in europe i try to resort	/media/hugo/Seagate Expansion Drive/ALICE_BACKUP/voshpde/wav_files/zipfiles/20150127.wav
425	/media/hugo/Seagate Expansion Drive/ALICE_BACKUP/voshpde/pipeLine/segmentation_wavfiles/20150127/426_20150127.wav	9559.159637188208	421558940	9575.409637188208	422275565	425_20150127	of course we are having this discussion on the very day why we come emorate the international holocaust which so much illustrate to us so how careful we always have to be in europe and someone mentioned that earlier today there is along	/media/hugo/Seagate Expansion Drive/ALICE_BACKUP/voshpde/wav_files/zipfiles/20150127.wav
426	/media/hugo/Seagate Expansion Drive/ALICE_BACKUP/voshpde/pipeLine/segmentation_wavfiles/20150127/427_20150127.wav	9575.409659863946	422275566	9591.759659863945	422996601	426_20150127	long record in europe of not of not only of peace and prosperity as we have seen in the recent quite some years but also a passed or minorities religious conflicts it is always there we always have to be very careful	/media/hugo/Seagate Expansion Drive/ALICE_BACKUP/voshpde/wav_files/zipfiles/20150127.wav
427	/media/hugo/Seagate Expansion Drive/ALICE_BACKUP/voshpde/pipeLine/segmentation_wavfiles/20150127/428_20150127.wav	9591.759682539683	422996602	9612.709682539682	423920497	427_20150127	we saw immediately after the horificattax in paris we saw very quickly the security at lord levels raise throughout the twenty eight member states am and for good reason creates a scale it it is a horrific what we saw and after worging in belgium	/media/hugo/Seagate Expansion Drive/ALICE_BACKUP/voshpde/wav_files/zipfiles/20150127.wav
428	/media/hugo/Seagate Expansion Drive/ALICE_BACKUP/voshpde/pipeLine/segmentation_wavfiles/20150127/429_20150127.wav	9612.70970521542	423920498	9633.559705215419	424839983	428_20150127	but at the same time we also have to get into the backbones that we have a similar human rights or fundamental rights alert level raising when these issues occur and i think we are not there yet i think there is still not say lacking behind we are still captured in way too rapidly by	/media/hugo/Seagate Expansion Drive/ALICE_BACKUP/voshpde/wav_files/zipfiles/20150127.wav
429	/media/hugo/Seagate Expansion Drive/ALICE_BACKUP/voshpde/pipeLine/segmentation_wavfiles/20150127/430_20150127.wav	9633.559727891157	424839984	9658.809727891157	425953509	429_20150127	the law enforcement as several speakers have mentioned here as well and i think we need to strike that balance better and let me just try to raise a few issues where i would in particular say that here we need to be a learned first of all i think it is important when we talk about legislation and i know my colleague butsaibeleve will of course to well much more on the pnr and data protection issues	/media/hugo/Seagate Expansion Drive/ALICE_BACKUP/voshpde/wav_files/zipfiles/20150127.wav
430	/media/hugo/Seagate Expansion Drive/ALICE_BACKUP/voshpde/pipeLine/segmentation_wavfiles/20150127/431_20150127.wav	9658.809750566894	425953510	9683.259750566893	427031755	430_20150127	i think it is important when we discuss both pnr but also the confiscation of passports and other such issues that we build in the fundamental rights from the very beginning of fundamental rights by this sign that fundamental rights is not sort of an add on that is added towards the end of the process if all if we take the pnr	/media/hugo/Seagate Expansion Drive/ALICE_BACKUP/voshpde/wav_files/zipfiles/20150127.wav
431	/media/hugo/Seagate Expansion Drive/ALICE_BACKUP/voshpde/pipeLine/segmentation_wavfiles/20150127/432_20150127.wav	9683.259773242631	427031756	9709.20977324263	428176151	431_20150127	of course the data retention decision from the court was a wake upcord i think it raised very much some of the key concerns of proportionality and necessity that also need to be built into any pnr proposals the fundamental right agency made a set of guidance to eu member states when they were considering considered to set up	/media/hugo/Seagate Expansion Drive/ALICE_BACKUP/voshpde/wav_files/zipfiles/20150127.wav
432	/media/hugo/Seagate Expansion Drive/ALICE_BACKUP/voshpde/pipeLine/segmentation_wavfiles/20150127/433_20150127.wav	9709.209795918367	428176152	9728.759795918368	429038307	432_20150127	national pnr systems we alto made twelve does and domes introducing for example clear and strict limitations on the purpose why were using that s get it define we see very often with this sort of legislation that it lights gratuadely into two other areas as well	/media/hugo/Seagate Expansion Drive/ALICE_BACKUP/voshpde/wav_files/zipfiles/20150127.wav
433	/media/hugo/Seagate Expansion Drive/ALICE_BACKUP/voshpde/pipeLine/segmentation_wavfiles/20150127/434_20150127.wav	9728.759818594104	429038308	9751.509818594104	430041583	433_20150127	enhanced personal data safeguards but cause put a will say much more about that increased transparency of the system towards the passengers so they actually know what is it that they are confronted with so these are some of the minimum requirements that should be built into the thinking if at all the pnr	/media/hugo/Seagate Expansion Drive/ALICE_BACKUP/voshpde/wav_files/zipfiles/20150127.wav
434	/media/hugo/Seagate Expansion Drive/ALICE_BACKUP/voshpde/pipeLine/segmentation_wavfiles/20150127/435_20150127.wav	9751.50984126984	430041584	9776.859841269841	431159519	434_20150127	should be introduced the same could be said as i mentioned with the confiscation of passports and other initiatives let us get that fundamental rights as dimension in there from the beginning we have also heard throughout these weeks a call for increased monitoring of those who might have violent neon radicalisation and there is risk that the	/media/hugo/Seagate Expansion Drive/ALICE_BACKUP/voshpde/wav_files/zipfiles/20150127.wav
435	/media/hugo/Seagate Expansion Drive/ALICE_BACKUP/voshpde/pipeLine/segmentation_wavfiles/20150127/436_20150127.wav	9776.859863945578	431159520	9796.909863945579	432043725	435_20150127	inter into actual into actions of course monitoring individual suspect or of criminal criminal activity that is of course a totally legitimate police work law enforcement but we always have to strike the balance when is it legitimate	/media/hugo/Seagate Expansion Drive/ALICE_BACKUP/voshpde/wav_files/zipfiles/20150127.wav
436	/media/hugo/Seagate Expansion Drive/ALICE_BACKUP/voshpde/pipeLine/segmentation_wavfiles/20150127/437_20150127.wav	9796.909886621315	432043726	9819.059886621315	433020541	436_20150127	profiling of a particular personal repo persons and windersy become a broader profiling of an entire group primarily identified by religion and ethnicity so called discriminatory ethnic profiling it is very delicate balances and but it is necessary because	/media/hugo/Seagate Expansion Drive/ALICE_BACKUP/voshpde/wav_files/zipfiles/20150127.wav
437	/media/hugo/Seagate Expansion Drive/ALICE_BACKUP/voshpde/pipeLine/segmentation_wavfiles/20150127/438_20150127.wav	9819.059909297051	433020542	9841.209909297053	433997357	437_20150127	what we have learned throughout many years from many different crises also in europe is that if there is one thing that we can contribute to the radicalisation of youngsters then it is if they feel that they are in particular targeted by in particular law enforcement	/media/hugo/Seagate Expansion Drive/ALICE_BACKUP/voshpde/wav_files/zipfiles/20150127.wav
438	/media/hugo/Seagate Expansion Drive/ALICE_BACKUP/voshpde/pipeLine/segmentation_wavfiles/20150127/439_20150127.wav	9841.20993197279	433997358	9861.159931972788	434877153	438_20150127	when the go to school they are the ones being stopped a check points or by police a random search etc that does something to people in the mind of these youngsters and is what can really be a driver towards radicalisation	/media/hugo/Seagate Expansion Drive/ALICE_BACKUP/voshpde/wav_files/zipfiles/20150127.wav
439	/media/hugo/Seagate Expansion Drive/ALICE_BACKUP/voshpde/pipeLine/segmentation_wavfiles/20150127/440_20150127.wav	9861.159954648527	434877154	9887.209954648526	436025959	439_20150127	we saw that clearly in our big survey that we did in two thousand and nine on ethnic minorities where we interview something like twenty three zero ethnic minorities across the twenty eight or the twenty seven member states and here we saw that forty of the respondents who had been have had a stop police stop	/media/hugo/Seagate Expansion Drive/ALICE_BACKUP/voshpde/wav_files/zipfiles/20150127.wav
440	/media/hugo/Seagate Expansion Drive/ALICE_BACKUP/voshpde/pipeLine/segmentation_wavfiles/20150127/441_20150127.wav	9887.209977324263	436025960	9905.059977324263	436813145	440_20150127	i believed that the reason why they was stopped was caused by their immigrant or minority background that is serious so half of them actually perceived that this was because of who they were and not what they had done specifically in that situation	/media/hugo/Seagate Expansion Drive/ALICE_BACKUP/voshpde/wav_files/zipfiles/20150127.wav
441	/media/hugo/Seagate Expansion Drive/ALICE_BACKUP/voshpde/pipeLine/segmentation_wavfiles/20150127/442_20150127.wav	9905.06	436813146	9925.21	437701761	441_20150127	that creates a tremendous trust barrier to the authorities and very often to the police the very same police that needs the trust in order to alto be informed about the crime let us not forget a lot of the information police receives on these issues is not only by	/media/hugo/Seagate Expansion Drive/ALICE_BACKUP/voshpde/wav_files/zipfiles/20150127.wav
442	/media/hugo/Seagate Expansion Drive/ALICE_BACKUP/voshpde/pipeLine/segmentation_wavfiles/20150127/443_20150127.wav	9925.210022675737	437701762	9950.960022675737	438837337	442_20150127	cameras and all defence is stop very often by a neighbour family member calling the police and a listen i think there is a problem and if that trust is generally not there we actually lose a very important element in the fight against terrorism so i just urge that this is taken into consideration consideration clearly so therefore mr also	/media/hugo/Seagate Expansion Drive/ALICE_BACKUP/voshpde/wav_files/zipfiles/20150127.wav
443	/media/hugo/Seagate Expansion Drive/ALICE_BACKUP/voshpde/pipeLine/segmentation_wavfiles/20150127/444_20150127.wav	9950.960045351474	438837338	9978.110045351474	440034653	443_20150127	i very much sympathise with you your point when you say the counter radicalisation need to combine detection and repression but also prevention and protection and i think these four elements are so important to get those elements in a clear on it good balance the last point i want to raise is that immediately after the paris incidents the agency called on all our rapporteurs	/media/hugo/Seagate Expansion Drive/ALICE_BACKUP/voshpde/wav_files/zipfiles/20150127.wav
444	/media/hugo/Seagate Expansion Drive/ALICE_BACKUP/voshpde/pipeLine/segmentation_wavfiles/20150127/445_20150127.wav	9978.11006802721	440034654	10005.560068027211	441245199	444_20150127	no let me just say that the survey i referred to before on ethnic minorities where we saw on these profiling reactions we are repeating now that survey so we will actually see a follow up will be able to detect whether so say things are moving in the wrong or better direction and of course thereby also detect if policies what sort of impact policies right after the	/media/hugo/Seagate Expansion Drive/ALICE_BACKUP/voshpde/wav_files/zipfiles/20150127.wav
445	/media/hugo/Seagate Expansion Drive/ALICE_BACKUP/voshpde/pipeLine/segmentation_wavfiles/20150127/446_20150127.wav	10005.560090702947	441245200	10031.810090702947	442402825	445_20150127	incidents of the attacks in paris we launched our network of institutions in forming us and we ask them to give us a report on monitor for two weeks any incidents of anti semitic attacks incidents but also islamophobic and other attacks as well as monitor the policy responses and of course as you understand we are still	/media/hugo/Seagate Expansion Drive/ALICE_BACKUP/voshpde/wav_files/zipfiles/20150127.wav
446	/media/hugo/Seagate Expansion Drive/ALICE_BACKUP/voshpde/pipeLine/segmentation_wavfiles/20150127/447_20150127.wav	10031.810113378684	442402826	10047.560113378684	443097401	446_20150127	still analysing its a will not so in the end year toul of course receive report as soon as its there were now got all the data but if i when i look at it briefly ends or bit superficially but still i see two things coming out of the figures	/media/hugo/Seagate Expansion Drive/ALICE_BACKUP/voshpde/wav_files/zipfiles/20150127.wav
447	/media/hugo/Seagate Expansion Drive/ALICE_BACKUP/voshpde/pipeLine/segmentation_wavfiles/20150127/448_20150127.wav	10047.560136054422	443097402	10073.210136054422	444228567	447_20150127	first of all that there is no doubt that the fear level has raised to mendously both the jewish community as well as in the islamic communities we have seen attacks and would say what we have seen so far it is not say a very big obserch in attacks on the two groups what we have definitely we can de take a high level of fear	/media/hugo/Seagate Expansion Drive/ALICE_BACKUP/voshpde/wav_files/zipfiles/20150127.wav
448	/media/hugo/Seagate Expansion Drive/ALICE_BACKUP/voshpde/pipeLine/segmentation_wavfiles/20150127/449_20150127.wav	10073.210158730159	444228568	10088.860158730158	444918733	448_20150127	which is of course really undermining life quality and is a factor stronger call for protection by police in a number of the member states of sunegoksmosks schools etc	/media/hugo/Seagate Expansion Drive/ALICE_BACKUP/voshpde/wav_files/zipfiles/20150127.wav
449	/media/hugo/Seagate Expansion Drive/ALICE_BACKUP/voshpde/pipeLine/segmentation_wavfiles/20150127/450_20150127.wav	10088.860181405897	444918734	10116.610181405897	446142509	449_20150127	secondly another future we saw which abe on somewhat more positive note is that we have seen community and religious leaders throughout europe coming out stronger at least as fast we can assess compared to previous incidents that they have been more outspoken earlier in the process and maybe also in clear and firmer language	/media/hugo/Seagate Expansion Drive/ALICE_BACKUP/voshpde/wav_files/zipfiles/20150127.wav
450	/media/hugo/Seagate Expansion Drive/ALICE_BACKUP/voshpde/pipeLine/segmentation_wavfiles/20150127/451_20150127.wav	10116.610204081633	446142510	10142.860204081633	447300135	450_20150127	and i think that is there we have something to build on and it may also have helped to come down some of the incidents that otherwise we could have may be expected this is an opportunity for policy makers and others to use a momentum from the policy no sorry from the community and religious leaders to engage them more much more	/media/hugo/Seagate Expansion Drive/ALICE_BACKUP/voshpde/wav_files/zipfiles/20150127.wav
451	/media/hugo/Seagate Expansion Drive/ALICE_BACKUP/voshpde/pipeLine/segmentation_wavfiles/20150127/452_20150127.wav	10142.86022675737	447300136	10171.910226757369	448581241	451_20150127	just to wind up thank you very much so it is two issues it is the issue of fundamental rights by design that is get it into the legislation from the very outset and then of course much more advance strategies in the deradicalisation processes ensuring the inclusive society preside very much utan data protection supervisor be playing	/media/hugo/Seagate Expansion Drive/ALICE_BACKUP/voshpde/wav_files/zipfiles/20150127.wav
452	/media/hugo/Seagate Expansion Drive/ALICE_BACKUP/voshpde/pipeLine/segmentation_wavfiles/20150127/453_20150127.wav	10171.910249433107	448581242	10188.260249433106	449302277	452_20150127	a key role in analysing different aspects of the commission proposal pnr but not just pnr other aspects as well also to get his briefly his perspective and then will open up the floor against questions to all colleagues so ge have anipaturly you have the floor	/media/hugo/Seagate Expansion Drive/ALICE_BACKUP/voshpde/wav_files/zipfiles/20150127.wav
453	/media/hugo/Seagate Expansion Drive/ALICE_BACKUP/voshpde/pipeLine/segmentation_wavfiles/20150127/454_20150127.wav	10188.260272108844	449302278	10211.510272108844	450327603	453_20150127	mr pri honourable members of this committee thank you for your invitation to join that this extraordinary and and very inspiring meeting i am very honoured to have an opportunity to talk with you for the first time following my appointment as a european data protection supervisor	/media/hugo/Seagate Expansion Drive/ALICE_BACKUP/voshpde/wav_files/zipfiles/20150127.wav
454	/media/hugo/Seagate Expansion Drive/ALICE_BACKUP/voshpde/pipeLine/segmentation_wavfiles/20150127/455_20150127.wav	10211.51029478458	450327604	10228.56029478458	451079509	454_20150127	various speakers today say that europe is facing an unprecedented and serious terrorist threat i agree that there is a crucial moment for security and let me say that this is the first of such a making to the	/media/hugo/Seagate Expansion Drive/ALICE_BACKUP/voshpde/wav_files/zipfiles/20150127.wav
455	/media/hugo/Seagate Expansion Drive/ALICE_BACKUP/voshpde/pipeLine/segmentation_wavfiles/20150127/456_20150127.wav	10228.560317460317	451079510	10257.710317460318	452365025	455_20150127	since the attacks in madrid on london which prepaled the parliament and council towards a number of measures including the now anuwed data retention directive against the backdrop of the tragic and shocking terrorist incidents in in paris this month we too understand at the edps that the eu has to take meaningful action	/media/hugo/Seagate Expansion Drive/ALICE_BACKUP/voshpde/wav_files/zipfiles/20150127.wav
456	/media/hugo/Seagate Expansion Drive/ALICE_BACKUP/voshpde/pipeLine/segmentation_wavfiles/20150127/457_20150127.wav	10257.710340136055	452365026	10286.360340136054	453628491	456_20150127	and therefore be assured that you will have from us all the relevant institutional and proactive support you you need we will not be predicating the primacy of fundamental rights an eis aleded power we will like to be part of the process national governments and eu institutions are quite properly now considering what measures including legislative steps	/media/hugo/Seagate Expansion Drive/ALICE_BACKUP/voshpde/wav_files/zipfiles/20150127.wav
457	/media/hugo/Seagate Expansion Drive/ALICE_BACKUP/voshpde/pipeLine/segmentation_wavfiles/20150127/458_20150127.wav	10286.36036281179	453628492	10312.410362811792	454777297	457_20150127	are needed to prevent these months outages from recovering however as said europe immediate response to the brutal attacks and to the subsequent coordinated rates terror suspect here in belgium has also been to unite around our values and fundamental freedoms	/media/hugo/Seagate Expansion Drive/ALICE_BACKUP/voshpde/wav_files/zipfiles/20150127.wav
458	/media/hugo/Seagate Expansion Drive/ALICE_BACKUP/voshpde/pipeLine/segmentation_wavfiles/20150127/459_20150127.wav	10312.410385487528	454777298	10340.760385487529	456027533	458_20150127	let me say we must continue to do so my message to you today is that this moment is crucial because is an important test is a test of whether the eu legislators are able to learn the lessons of the past and to avoid investing energies on initiatives which are not fully effective or measures	/media/hugo/Seagate Expansion Drive/ALICE_BACKUP/voshpde/wav_files/zipfiles/20150127.wav
459	/media/hugo/Seagate Expansion Drive/ALICE_BACKUP/voshpde/pipeLine/segmentation_wavfiles/20150127/460_20150127.wav	10340.760408163265	456027534	10368.910408163265	457268949	459_20150127	whose legality will be questioned as member of the judiciary of a national judiciary sim i would be interested to be actively part this test on a basis of an oholistic approach by focusing on what is really needed and an super effective it means to have as mr zakoski said a clear strategy i also share the view point of dem	/media/hugo/Seagate Expansion Drive/ALICE_BACKUP/voshpde/wav_files/zipfiles/20150127.wav
460	/media/hugo/Seagate Expansion Drive/ALICE_BACKUP/voshpde/pipeLine/segmentation_wavfiles/20150127/461_20150127.wav	10368.910430839001	457268950	10392.360430839002	458303095	460_20150127	mr dike kv he has pressed in his document of january seventeen he said we need to focus on sustainable and long term policy but sustainability also mean being true to our values in terms of fundamental rights and freedoms and therefore for instance would be much more prudent	/media/hugo/Seagate Expansion Drive/ALICE_BACKUP/voshpde/wav_files/zipfiles/20150127.wav
