	wavfile	start_seconds	start_frames	end_seconds	end_frames	identifier	inferred_text_with_hotwords	inferred_text_without_hotwords	motherfile	dist
95	/media/hugo/Seagate Expansion Drive/ALICE_BACKUP/voshpde/pipeLine/segmentation_wavfiles/2016040702/096_2016040702.wav	2109.1521541950115	93013610	2130.3021541950116	93946325	095_2016040702	ecosystemitergovina distributia necateriadraga supervision as thespetresulteotrorginsopine to the scopine organisirancriminalla sudasigradeal no as a vasige time partners fer to the brecoediging in geographkifma	ecosystemitergovina distributia necateriadraga supervision as thespetresulteotrorginsopine to the scopine organisirancriminalla sudasigradeal no as a vasige time partners fer to the brecoediging in geographkifma	/media/hugo/Seagate Expansion Drive/ALICE_BACKUP/voshpde/wav_files/zipfiles/2016040702.wav	0
96	/media/hugo/Seagate Expansion Drive/ALICE_BACKUP/voshpde/pipeLine/segmentation_wavfiles/2016040702/097_2016040702.wav	2130.302176870748	93946326	2151.452176870748	94879041	096_2016040702	cutibilragopodaskutinicavitnovich with no whushiinattersinovitnastodrawkenikimetadviseianintrees at beyour milliard eu on a late but in qudruga	cutibilragopodaskutinicavitnovich with no whushiinattersinovitnastodrawkenikimetadviseianintreesatbeyourmilliarderonaltebutinqodruga	/media/hugo/Seagate Expansion Drive/ALICE_BACKUP/voshpde/wav_files/zipfiles/2016040702.wav	13
97	/media/hugo/Seagate Expansion Drive/ALICE_BACKUP/voshpde/pipeLine/segmentation_wavfiles/2016040702/098_2016040702.wav	2151.452199546485	94879042	2171.702199546485	95772067	097_2016040702	vino vat ye geographic rocacy who eropeinvinetotothe concentratiponecaterycanalicputimnapratothe presolvementzownasvidonozonponalao in preha is reslutioning couto sata	vino vat ye geographic rocacy who eropeinvinetotothe concentratiponecaterycanalicputimnapratothepresolvementzownasvidonozonponalao in prehaisereslutioning couto sata	/media/hugo/Seagate Expansion Drive/ALICE_BACKUP/voshpde/wav_files/zipfiles/2016040702.wav	3
98	/media/hugo/Seagate Expansion Drive/ALICE_BACKUP/voshpde/pipeLine/segmentation_wavfiles/2016040702/099_2016040702.wav	2171.702222222222	95772068	2194.152222222222	96762113	098_2016040702	to to the premereglobalisatia the tursneverigadragami protocolyasno the internet ets tall are no motinouslythe promotes you draw kimpasashiritosnaniatoquhoperablitytothepretydone	to to the premereglobalisatiathetursneverigadragami protocolyasno the internet etstallarenoemotinouslythepromotes you draw kimpasashiritosnaniatoquhoperablitytothepretydone	/media/hugo/Seagate Expansion Drive/ALICE_BACKUP/voshpde/wav_files/zipfiles/2016040702.wav	7
99	/media/hugo/Seagate Expansion Drive/ALICE_BACKUP/voshpde/pipeLine/segmentation_wavfiles/2016040702/100_2016040702.wav	2194.152244897959	96762114	2217.1022448979593	97774209	099_2016040702	to rate te internet o sins a took a vitmamproductiveen in potentionapramveralattostapronsitdraks loknovic dro in us tin substance he nikasalo problematic naga to the loch could live the wasputasedfortheinsasdravli	toreteteinternetosincyatookavitmamproductiveeninpotentionapramveralattostapronsitdraks loknovicdroindiskootinialsubstanceenikaalo problematic naga to the loch could live the wasputasedfortheinsasdravli	/media/hugo/Seagate Expansion Drive/ALICE_BACKUP/voshpde/wav_files/zipfiles/2016040702.wav	27
100	/media/hugo/Seagate Expansion Drive/ALICE_BACKUP/voshpde/pipeLine/segmentation_wavfiles/2016040702/101_2016040702.wav	2217.1022675736963	97774210	2240.052267573696	98786305	100_2016040702	at togtagropatsoprafitnonsartinoperavledrogatomanyshismilonoludi protocol to the radicaliziladortionateeperonaniaontorarchingthesavapratocosipilopofchinaletthetegailookstaaocas	at togtagropatsoprafitnonsartinoperavledrogatomany shismilonoludi protocol to the radicaliziladortionateeperonaniaontorarchingthesavapratocosipilopofchinaletthetegailookstaaocas	/media/hugo/Seagate Expansion Drive/ALICE_BACKUP/voshpde/wav_files/zipfiles/2016040702.wav	1
101	/media/hugo/Seagate Expansion Drive/ALICE_BACKUP/voshpde/pipeLine/segmentation_wavfiles/2016040702/102_2016040702.wav	2240.052290249433	98786306	2263.202290249433	99807221	101_2016040702	pa za met widna wage of loca drawking pa terrorism on drugasstranitoretolaco to the poveturefinansiraniaterrorismimpatroypodobnicthearnostytorachasessedagelmosvitinaton prepared in i politica we not akasitogyanpukacsionsogonilatrekalacostorima more mostosotorchetenansledne	poza met widna wage of loca drawking pa terrorism on drugasstranitoretolaco to the poveturefinansiraniaterrorismimpatroypodobnicthearnostytorachasessedagelmosvitinaton prepared in i politica we not akasitogyanpukacsionsogonilatrekalacostorima more mostosotorchetenansledne	/media/hugo/Seagate Expansion Drive/ALICE_BACKUP/voshpde/wav_files/zipfiles/2016040702.wav	2
102	/media/hugo/Seagate Expansion Drive/ALICE_BACKUP/voshpde/pipeLine/segmentation_wavfiles/2016040702/103_2016040702.wav	2263.20231292517	99807222	2291.15231292517	101039817	102_2016040702	could purbo systansconaliso imp napoedovaniatraintonotergooddrckpratacoudrgodwitic actions ton resorts operabedrockwhogiven a drawkterprocuctins o owe tragerzegityhadthedragassodrogaches a talnocotpray in toswelasalowpriboppotintotheoparabo in to put into uplivanreslitionotzive put in a pa partner stop men to some institute a mikis souctiveneeuropeskironing	could purbo systansconaliso imp napoedovaniatraintonotergooddrckpratacoudrgodwitic actions ton resorts operabedrockwhogiven a drawkterprocuctins o owe tragerzegityhadthedragassodrogaches a talnocotpray in toswelasalowpriboppotintotheoparabo in to put into uplivanreslitionotzive put in a pray partner stop men o some institute a mikis souctiveneeuropeskironing	/media/hugo/Seagate Expansion Drive/ALICE_BACKUP/voshpde/wav_files/zipfiles/2016040702.wav	3
103	/media/hugo/Seagate Expansion Drive/ALICE_BACKUP/voshpde/pipeLine/segmentation_wavfiles/2016040702/104_2016040702.wav	2291.152335600907	101039818	2317.002335600907	102179803	103_2016040702	year clucnotornaropski interetsonnaerouni put in a praof logefocusin torch pre the hanestic immets at thet are put im nap borshsodrvania met eu institution ampathershaanshainsameenicalnewlegajelimooccrepeating in resvity system as godnigopasaranarepration interventiaputimprepreditedo stop the rok	year clucnotornaropski interetsonnaerouni put in a praof loge focus in torch pre the hanestic immets at thet are put im nap borshsodrvania met institution ampathershaanshainsameenicalnewlegajelimooccrepeating in resvity system as godnigopasaranarepration interventiaputimprepreditedostopaterok	/media/hugo/Seagate Expansion Drive/ALICE_BACKUP/voshpde/wav_files/zipfiles/2016040702.wav	9
104	/media/hugo/Seagate Expansion Drive/ALICE_BACKUP/voshpde/pipeLine/segmentation_wavfiles/2016040702/105_2016040702.wav	2317.002358276644	102179804	2333.652358276644	102914069	104_2016040702	in potona vamo the ton iranonestano vietnam eu velicocriticintocsideterjaishanesathelosodrualrepravitdabriheshito	in potona vamo the ton iranonestano vietnam ye velicocriticintocsideterjaishanesathelosodrualrepravitdabriheshito	/media/hugo/Seagate Expansion Drive/ALICE_BACKUP/voshpde/wav_files/zipfiles/2016040702.wav	2
105	/media/hugo/Seagate Expansion Drive/ALICE_BACKUP/voshpde/pipeLine/segmentation_wavfiles/2016040702/106_2016040702.wav	2333.652380952381	102914070	2349.802380952381	103626285	105_2016040702	the lack of coordination can increase all kinds of risks and the third point balanced policies is needed for drug supply reduction and help for people experiencing	the lack of coordination can increase all kinds of risks and the third point balanced policies is needed for drug supply reduction and help for people experiencing	/media/hugo/Seagate Expansion Drive/ALICE_BACKUP/voshpde/wav_files/zipfiles/2016040702.wav	0
106	/media/hugo/Seagate Expansion Drive/ALICE_BACKUP/voshpde/pipeLine/segmentation_wavfiles/2016040702/107_2016040702.wav	2349.802403628118	103626286	2376.152403628118	104788321	106_2016040702	drugs problems which is the area for public health policies and i think it should be great from time to time to organise the common meeting between our committee and environment committee which is also in the competences of this committee is the health and public health in that context i want to ask mr us deal what kind of capacity	drugs problems which is the area for public health policies and i think it should be great from time to time to organise the common meeting between our committee and environment committee which is also in the competences of this committee is the health and public health in that context i want to ask mr gusdel what kind of capacity	/media/hugo/Seagate Expansion Drive/ALICE_BACKUP/voshpde/wav_files/zipfiles/2016040702.wav	3
107	/media/hugo/Seagate Expansion Drive/ALICE_BACKUP/voshpde/pipeLine/segmentation_wavfiles/2016040702/108_2016040702.wav	2376.152426303855	104788322	2392.502426303855	105509357	107_2016040702	emcdda need for fulfilling its role in creation of these policies is the new framework institutional legal for better cooperation and coordination	mcdda need for fulfilling its role in creation of these policies is the new framework institutional legal for better cooperation and coordination	/media/hugo/Seagate Expansion Drive/ALICE_BACKUP/voshpde/wav_files/zipfiles/2016040702.wav	1
108	/media/hugo/Seagate Expansion Drive/ALICE_BACKUP/voshpde/pipeLine/segmentation_wavfiles/2016040702/109_2016040702.wav	2392.502448979592	105509358	2409.4524489795917	106256853	108_2016040702	how can we better tackle the growing problem of new cycle active substances especially dangerous because of unknown and uncertain efforts of using those substances thank you	how can we better tackle the growing problem of new cycle active substances especially dangerous because of unknown and uncertain efforts of using those substances thank you	/media/hugo/Seagate Expansion Drive/ALICE_BACKUP/voshpde/wav_files/zipfiles/2016040702.wav	0
109	/media/hugo/Seagate Expansion Drive/ALICE_BACKUP/voshpde/pipeLine/segmentation_wavfiles/2016040702/110_2016040702.wav	2409.4524716553287	106256854	2427.002471655329	107030809	109_2016040702	mrentithinkit was not only a statement but a lot of questions raise and i am bit thinking about the numbers that we heard that you can make a profit of eur twenty four billion are remember that we have some problems to find eu	mrentithinkit was not only a statement but a lot of questions raise and i am bit thinking about the numbers that we heard that you can make a profit of eur twenty four billion are remember that we have some problems to find	/media/hugo/Seagate Expansion Drive/ALICE_BACKUP/voshpde/wav_files/zipfiles/2016040702.wav	3
110	/media/hugo/Seagate Expansion Drive/ALICE_BACKUP/voshpde/pipeLine/segmentation_wavfiles/2016040702/111_2016040702.wav	2427.002494331066	107030810	2454.252494331066	108232535	110_2016040702	eu six billion for the geal with turkey so maybe it is worse to think about if we can improve our work to stop money going into quite different ways but i think both our colleagues will be able to add something on the drugs itself i would like to add a question to europe or when nuclear under slight it seems that for different	eur six billion for the geal with turkey so maybe it is worse to think about if we can improve our work to stop money going into quite different ways but i think both our colleagues will be able to add something on the drugs itself i would like to add a question to europe or when nuclear under slight it seems that for different	/media/hugo/Seagate Expansion Drive/ALICE_BACKUP/voshpde/wav_files/zipfiles/2016040702.wav	1
111	/media/hugo/Seagate Expansion Drive/ALICE_BACKUP/voshpde/pipeLine/segmentation_wavfiles/2016040702/112_2016040702.wav	2454.252517006803	108232536	2478.7025170068027	109310781	111_2016040702	kind of drugs you have different ways of bringing drugs to europe and to distributing within the european union is it that clear or are the ways how drugs are coming to europe are very often changing which might make your work even more difficult kenya at is something on that so that i will first give the floor to mr us	kind of drugs you have different ways of bringing drugs to europe and to distributing within the european union is it that clear or are the ways how drugs are coming to europe are very often changing which might make your work even more difficult kenya at is something on that so that i will first give the floor to mr gue	/media/hugo/Seagate Expansion Drive/ALICE_BACKUP/voshpde/wav_files/zipfiles/2016040702.wav	2
112	/media/hugo/Seagate Expansion Drive/ALICE_BACKUP/voshpde/pipeLine/segmentation_wavfiles/2016040702/113_2016040702.wav	2478.7025396825397	109310782	2505.7525396825395	110503687	112_2016040702	mr president i would like to thank mr bony for for is a very positive comment i would like also to thank more generally the committee for is permanent and continuous support to the work of the emcdda i think for the moment referring to your question more specific about the means and the resources	mr president i would like to thank mr bony for for is a very positive comment i would like also to thank more generally the committee for is permanent and continuous support to the work of the mcdda i think for the moment referring to your question more specific about the means and the resources	/media/hugo/Seagate Expansion Drive/ALICE_BACKUP/voshpde/wav_files/zipfiles/2016040702.wav	1
113	/media/hugo/Seagate Expansion Drive/ALICE_BACKUP/voshpde/pipeLine/segmentation_wavfiles/2016040702/114_2016040702.wav	2505.7525623582765	110503688	2525.9025623582766	111392303	113_2016040702	i think what i can say is that as you know there is a new legislation that is under preparation regarding all the system the approach on new sacoactive substances which is encompassing for the moment three steps which are the early oneing system us	i think what i can say is that as you know there is a new legislation that is under preparation regarding all the system the approach on new sacoactive substances which is encompassing for the moment three steps which are the early oneing system per	/media/hugo/Seagate Expansion Drive/ALICE_BACKUP/voshpde/wav_files/zipfiles/2016040702.wav	3
114	/media/hugo/Seagate Expansion Drive/ALICE_BACKUP/voshpde/pipeLine/segmentation_wavfiles/2016040702/115_2016040702.wav	2525.9025850340136	111392304	2553.9525850340137	112629309	114_2016040702	then there are the risk assessments and then there are the measures that are being taken by the eu for controlling those substances i think one of the key points is if apparently there was a decision that the core par yesterday there will be a limited revision of the regulation of the mcdda the minimum that we need is that what makes the strength of the current system should be in the eu	then there are the risk assessments and then there are the measures that are being taken by the eu for controlling those substances i think one of the key points is if apparently there was a decision that the core par yesterday there will be a limited revision of the regulation of the mcdda the minimum that we need is that what makes the strength of the current system should be in the new	/media/hugo/Seagate Expansion Drive/ALICE_BACKUP/voshpde/wav_files/zipfiles/2016040702.wav	2
115	/media/hugo/Seagate Expansion Drive/ALICE_BACKUP/voshpde/pipeLine/segmentation_wavfiles/2016040702/116_2016040702.wav	2553.9526077097507	112629310	2572.6026077097504	113451775	115_2016040702	in the modification proposed for regulation that is the minimum but it will not be enough to deal with the new challenges and my hope and my wish and i know that on this basis we are on the same line with with your committee but also with the commission still	in the modification proposed for regulation that is the minimum but it will not be enough to deal with the new challenges and my hope and my wish and i know that on this basis we are on the same line with with your committee but also with the commission still	/media/hugo/Seagate Expansion Drive/ALICE_BACKUP/voshpde/wav_files/zipfiles/2016040702.wav	0
116	/media/hugo/Seagate Expansion Drive/ALICE_BACKUP/voshpde/pipeLine/segmentation_wavfiles/2016040702/117_2016040702.wav	2572.6026303854874	113451776	2594.5526303854876	114419771	116_2016040702	we are are the level of the ides i would like to see so the day we wellevethe concrete final result which should be also in terms of resources i think we would need in any case additional resources to deal which with also the impact of this huge increase over the last years	we are are the level of the ides i would like to see so the day we wellevethe concrete final result which should be also in terms of resources i think we would need in any case additional resources to deal which with also the impact of this huge increase over the last years	/media/hugo/Seagate Expansion Drive/ALICE_BACKUP/voshpde/wav_files/zipfiles/2016040702.wav	0
117	/media/hugo/Seagate Expansion Drive/ALICE_BACKUP/voshpde/pipeLine/segmentation_wavfiles/2016040702/118_2016040702.wav	2594.5526530612246	114419772	2619.2026530612243	115506837	117_2016040702	i am confident that there will be a solution i know there is a strong commitment from the commission but also from the member states at the level of the council and i know i can count on your committee to be vigilant that those those requirements to the mcdda hopefully will be also support to it additional resources	i am confident that there will be a solution i know there is a strong commitment from the commission but also from the member states at the level of the council and i know i can count on your committee to be vigilant that those those requirements to the mcdda hopefully will be also support to additional resources	/media/hugo/Seagate Expansion Drive/ALICE_BACKUP/voshpde/wav_files/zipfiles/2016040702.wav	3
118	/media/hugo/Seagate Expansion Drive/ALICE_BACKUP/voshpde/pipeLine/segmentation_wavfiles/2016040702/119_2016040702.wav	2619.2026757369613	115506838	2636.3526757369614	116263153	118_2016040702	man for the time being there are many groups and agencies that are asking for additional possibilities so let us help that we can find a solution for this also for your organisation mr s you have something eu	men for the time being there are many groups and agencies that are asking for additional possibilities so let us help that we can find a solution for this also for your organisation mr you have something euro	/media/hugo/Seagate Expansion Drive/ALICE_BACKUP/voshpde/wav_files/zipfiles/2016040702.wav	5
119	/media/hugo/Seagate Expansion Drive/ALICE_BACKUP/voshpde/pipeLine/segmentation_wavfiles/2016040702/120_2016040702.wav	2636.3526984126984	116263154	2656.9026984126986	117169409	119_2016040702	mr president on the change of rules or diversity well indeed these these slies or errows they they basically show the trends the indications which are originally from concrete cases from concrete investigations	mr president on the change of rules or diversity well indeed these these slies or errows they they basically show the trends the indications which are originally from concrete cases from concrete investigations	/media/hugo/Seagate Expansion Drive/ALICE_BACKUP/voshpde/wav_files/zipfiles/2016040702.wav	0
120	/media/hugo/Seagate Expansion Drive/ALICE_BACKUP/voshpde/pipeLine/segmentation_wavfiles/2016040702/121_2016040702.wav	2656.9027210884356	117169410	2677.4527210884353	118075665	120_2016040702	well they do emerge the new emerge the change the mode supariendy changes i mean the trafficking of drugs does not remain a stable asses so basically well it is a challenge for enforcement but again garassa means and possibilities acknowledge to be used and	well they do emerge the new emerge the change the mode supariendy changes i mean the trafficking of drugs does not remain a stable asses so basically well it is a challenge for enforcement but again garassa means and possibilities acknowledge to be used and to	/media/hugo/Seagate Expansion Drive/ALICE_BACKUP/voshpde/wav_files/zipfiles/2016040702.wav	3
121	/media/hugo/Seagate Expansion Drive/ALICE_BACKUP/voshpde/pipeLine/segmentation_wavfiles/2016040702/122_2016040702.wav	2677.4527437641723	118075666	2705.1027437641724	119295031	121_2016040702	eu support those cases the diversity of trafficking routes and methods this is nothing new changes and we have to follow in the good i see we are at the end of this debate i would like to thank both guys here in front of us because i think it was a very extend exchange in the sense that you presented the whole report and it became pa	to support those cases the diversity of trafficking routes and methods this is nothing new changes and we have to follow in the good i see we are at the end of this debate i would like to thank both guys here in front of us because i think it was a very extend exchange in the sense that you presented the whole report and it became	/media/hugo/Seagate Expansion Drive/ALICE_BACKUP/voshpde/wav_files/zipfiles/2016040702.wav	5
122	/media/hugo/Seagate Expansion Drive/ALICE_BACKUP/voshpde/pipeLine/segmentation_wavfiles/2016040702/123_2016040702.wav	2705.1027664399094	119295032	2730.552766439909	120417377	122_2016040702	that dealing with the drugs and with the situation is not an us job but has many many aspects so thanks for being here and giving us this overview about the situation coleaguesithinkwe can directly go to the next point on our agenda	that dealing with the drugs and with the situation is not an easy job but has many many aspects so thanks for being here and giving us this overview about the situation coleaguesithinkwe can directly go to the next point on our agenda	/media/hugo/Seagate Expansion Drive/ALICE_BACKUP/voshpde/wav_files/zipfiles/2016040702.wav	3
123	/media/hugo/Seagate Expansion Drive/ALICE_BACKUP/voshpde/pipeLine/segmentation_wavfiles/2016040702/124_2016040702.wav	2730.552789115646	120417378	2760.2027891156463	121724943	123_2016040702	which is the mechanism on democracy the rule of law and fundamental rights presentation of the interim european added value assessment and research peoples we will have three presentations all of them i think very helpful in the debate we will first eva presentation of the european added value assessment conducted by our own	which is the mechanism on democracy the rule of law and fundamental rights presentation of the interim european added value assessment and research peoples we will have three presentations all of them i think very helpful in the debate we will first eva presentation of the european added value assessment conducted by our own	/media/hugo/Seagate Expansion Drive/ALICE_BACKUP/voshpde/wav_files/zipfiles/2016040702.wav	0
124	/media/hugo/Seagate Expansion Drive/ALICE_BACKUP/voshpde/pipeLine/segmentation_wavfiles/2016040702/125_2016040702.wav	2760.2028117913833	121724944	2789.8528117913834	123032509	124_2016040702	pa research and studies department in parliament as well as the two expert studies commissioned in that regard all these studies have been carried out in order to support the work carried out by our committee in relation to the legislative own initiative report on the establishment of an eu mechanism on democracy the rule of law and fundamental rights the draft report by the rapporteur	research and studies department in parliament as well as the two expert studies commissioned in that regard all these studies have been carried out in order to support the work carried out by our committee in relation to the legislative own initiative report on the establishment of an eu mechanism on democracy the rule of law and fundamental rights the draft report by the rapporteur	/media/hugo/Seagate Expansion Drive/ALICE_BACKUP/voshpde/wav_files/zipfiles/2016040702.wav	3
125	/media/hugo/Seagate Expansion Drive/ALICE_BACKUP/voshpde/pipeLine/segmentation_wavfiles/2016040702/126_2016040702.wav	2789.8528344671204	123032510	2813.40283446712	124071065	125_2016040702	mr ms in fed is also available since yesterday and will be presented in the next lebour meeting without further introduction i will now give the floor to ms astridvorum from the dg prs to present interim european added value assessment	mr ms in fed is also available since yesterday and will be presented in the next lebour meeting without further introduction i will now give the floor to ms astridvorum from the dg prs to present interim european added value assessment	/media/hugo/Seagate Expansion Drive/ALICE_BACKUP/voshpde/wav_files/zipfiles/2016040702.wav	0
126	/media/hugo/Seagate Expansion Drive/ALICE_BACKUP/voshpde/pipeLine/segmentation_wavfiles/2016040702/127_2016040702.wav	2813.402857142857	124071066	2843.152857142857	125383041	126_2016040702	mr president thank for the opportunity to present the interim european added value assessment as an introduction i want to mention the background of the european added value assessment as i certainly know when parliament decides to prepare a legislative initiative report in accordance with article two hundred and twenty five of the treaty such a report is automatically accompanied by a european added value assessment	mr president thank for the opportunity to present the interim european added value assessment as an introduction i want to mention the background of the european added value assessment as i certainly know when parliament decides to prepare a legislative initiative report in accordance with article two hundred and twenty five of the treaty such a report is automatically accompanied by a european added value assessment	/media/hugo/Seagate Expansion Drive/ALICE_BACKUP/voshpde/wav_files/zipfiles/2016040702.wav	0
