	wavfile	start_seconds	start_frames	end_seconds	end_frames	identifier	inferred_text_with_hotwords	inferred_text_without_hotwords	motherfile	dist
94	/media/hugo/Seagate Expansion Drive/ALICE_BACKUP/voshpde/pipeLine/segmentation_wavfiles/2016120802/095_2016120802.wav	2165.9021315192745	95516284	2191.6521315192745	96651859	094_2016120802	that the fundamental rights agency issued two opinions related to our work in the field of the common european asylum system the first opinion related to especttherespect of fundamental rights in the hot sport set up an italy and greece and the second opinion was on the projected impact on children of the commission proposal of the dublin for regulation	that the fundamental rights agency issued two opinions related to our work in the field of the common european asylum system the first opinion related to especttherespect of fundamental rights in the hot sport set up an italy and greece and the second opinion was on the projected impact on children of the commission proposal of the dublin for regulation	/media/hugo/Seagate Expansion Drive/ALICE_BACKUP/voshpde/wav_files/zipfiles/2016120802.wav	0
95	/media/hugo/Seagate Expansion Drive/ALICE_BACKUP/voshpde/pipeLine/segmentation_wavfiles/2016120802/096_2016120802.wav	2191.6521541950115	96651860	2214.5021541950114	97659545	095_2016120802	so we are going to first hear for mr nespor who will present the first opinion on hotspots and then from mr molnar who will present the second opinion on dublin after the presentations i have going to then open the floor for members the opinions	so we are going to first hear for mr nespor who will present the first opinion on hotspots and then from mr molna who will present the second opinion on dublin after the presentations i have going to then open the floor for members the opinions	/media/hugo/Seagate Expansion Drive/ALICE_BACKUP/voshpde/wav_files/zipfiles/2016120802.wav	1
96	/media/hugo/Seagate Expansion Drive/ALICE_BACKUP/voshpde/pipeLine/segmentation_wavfiles/2016120802/097_2016120802.wav	2214.5021768707484	97659546	2241.8521768707483	98865681	096_2016120802	colleagues we eu setting up a slit presentation to mr ms	colleagues we or setting up a slit presentation to mr mespor	/media/hugo/Seagate Expansion Drive/ALICE_BACKUP/voshpde/wav_files/zipfiles/2016120802.wav	6
97	/media/hugo/Seagate Expansion Drive/ALICE_BACKUP/voshpde/pipeLine/segmentation_wavfiles/2016120802/098_2016120802.wav	2241.8521995464853	98865682	2260.4021995464855	99683737	097_2016120802	ms posing why we set up the slight	just posing why we set up the slight	/media/hugo/Seagate Expansion Drive/ALICE_BACKUP/voshpde/wav_files/zipfiles/2016120802.wav	3
98	/media/hugo/Seagate Expansion Drive/ALICE_BACKUP/voshpde/pipeLine/segmentation_wavfiles/2016120802/099_2016120802.wav	2260.402222222222	99683738	2277.552222222222	100440053	098_2016120802	ms	ms	/media/hugo/Seagate Expansion Drive/ALICE_BACKUP/voshpde/wav_files/zipfiles/2016120802.wav	0
99	/media/hugo/Seagate Expansion Drive/ALICE_BACKUP/voshpde/pipeLine/segmentation_wavfiles/2016120802/100_2016120802.wav	2277.552244897959	100440054	2296.6022448979593	101280159	099_2016120802	eu	o	/media/hugo/Seagate Expansion Drive/ALICE_BACKUP/voshpde/wav_files/zipfiles/2016120802.wav	2
100	/media/hugo/Seagate Expansion Drive/ALICE_BACKUP/voshpde/pipeLine/segmentation_wavfiles/2016120802/101_2016120802.wav	2296.6022675736963	101280160	2312.452267573696	101979145	100_2016120802	eu	or	/media/hugo/Seagate Expansion Drive/ALICE_BACKUP/voshpde/wav_files/zipfiles/2016120802.wav	2
101	/media/hugo/Seagate Expansion Drive/ALICE_BACKUP/voshpde/pipeLine/segmentation_wavfiles/2016120802/102_2016120802.wav	2312.452290249433	101979146	2330.802290249433	102788381	101_2016120802	colleagues de slight presentation is ready so are going to take the	colleagues esligt presentation is ready so are going to take the	/media/hugo/Seagate Expansion Drive/ALICE_BACKUP/voshpde/wav_files/zipfiles/2016120802.wav	3
102	/media/hugo/Seagate Expansion Drive/ALICE_BACKUP/voshpde/pipeLine/segmentation_wavfiles/2016120802/103_2016120802.wav	2330.80231292517	102788382	2346.75231292517	103491777	102_2016120802	first opinion presentation from mr nespor on the hotspots in italy an grease mr de	first opinion presentation from mr nespor on the hotspots in italy an grease mr d	/media/hugo/Seagate Expansion Drive/ALICE_BACKUP/voshpde/wav_files/zipfiles/2016120802.wav	1
103	/media/hugo/Seagate Expansion Drive/ALICE_BACKUP/voshpde/pipeLine/segmentation_wavfiles/2016120802/104_2016120802.wav	2346.752335600907	103491778	2363.602335600907	104234863	103_2016120802	thank you very much for the opportunity to present here in the libe committee the two most recent for opinions both them requested actually by the european parliament i have the pleasure to brief introduce to you the opinion on the fhomin rights situation in the hotspots in greece and italy	thank you very much for the opportunity to present here in the libya committee the two most recent for opinions both them requested actually by the european parliament i have the pleasure to brief introduce to you the opinion on the fhomin right situation in the hotspots in greece and italy	/media/hugo/Seagate Expansion Drive/ALICE_BACKUP/voshpde/wav_files/zipfiles/2016120802.wav	3
104	/media/hugo/Seagate Expansion Drive/ALICE_BACKUP/voshpde/pipeLine/segmentation_wavfiles/2016120802/105_2016120802.wav	2363.602358276644	104234864	2382.952358276644	105088199	104_2016120802	my colleague mr tomas mol now will then follow up with the presentation on the proposed revision of the dublin regulation with special focus on children i will not go in to detail on wall the hotspots are and how they function because you are very well aware of that i ave had a pleasure of meeting some of you	my colleague mr tamachmol now will then follow up with the presentation on the proposed revision of the dublin regulation with special focus on children i will not go in to detail on wall the hotspots are and how they function because you are very well aware of that i have had a pleasure of meeting some of you	/media/hugo/Seagate Expansion Drive/ALICE_BACKUP/voshpde/wav_files/zipfiles/2016120802.wav	4
105	/media/hugo/Seagate Expansion Drive/ALICE_BACKUP/voshpde/pipeLine/segmentation_wavfiles/2016120802/106_2016120802.wav	2382.9523809523807	105088200	2408.2023809523807	106201725	105_2016120802	in lessbus i think in june where parliamentary delegation visited visited the hotspot so i know that you are very well aware of the basic basic set up of the system i will just say if few words in terms of in terms of the overall philosophy of the opinion the nextslitelase	in lessbus i think in june where parliamentary delegation visited visited the hotspot so i know that you are very well aware of the basic basic set up of the system i will just say if few words in terms of in terms of the overall philosophy of the opinion the nextslitelase	/media/hugo/Seagate Expansion Drive/ALICE_BACKUP/voshpde/wav_files/zipfiles/2016120802.wav	0
106	/media/hugo/Seagate Expansion Drive/ALICE_BACKUP/voshpde/pipeLine/segmentation_wavfiles/2016120802/107_2016120802.wav	2408.2024036281177	106201726	2432.752403628118	107284381	106_2016120802	because the host pot approach is intended to be coordinated response to the to the iravus by sea especially to italy and to greece in several layers in two ways basically on the one hand it is coordinated in terms of focusing a number of procedures within one location	because the host pot approach is intended to be coordinated response to the to the iravus by sea especially to italy and to greece in several layers in two ways basically on the one hand it is coordinated in terms of focusing a number of procedures within one location	/media/hugo/Seagate Expansion Drive/ALICE_BACKUP/voshpde/wav_files/zipfiles/2016120802.wav	0
107	/media/hugo/Seagate Expansion Drive/ALICE_BACKUP/voshpde/pipeLine/segmentation_wavfiles/2016120802/108_2016120802.wav	2432.752426303855	107284382	2451.402426303855	108106847	107_2016120802	that is the initial reception antification and registration of asylum seekers and and other migrants and in this way channelling those people into the appropriate procedures be it an asylum procedure possibly combined with relocation or or a return procedure	that is the initial reception antification and registration of asylum seekers and and other migrants and in this way channelling those people into the appropriate procedures be it an asylum procedure possibly combined with relocation or or a return procedure	/media/hugo/Seagate Expansion Drive/ALICE_BACKUP/voshpde/wav_files/zipfiles/2016120802.wav	0
108	/media/hugo/Seagate Expansion Drive/ALICE_BACKUP/voshpde/pipeLine/segmentation_wavfiles/2016120802/109_2016120802.wav	2451.402448979592	108106848	2474.152448979592	109110123	108_2016120802	at the same time at the same time the hotspots are supposed to provide a coordinated again response also in terms of the actors involved there and in this way in this way we have seen an unprecedented level of eu presence in in the hotspots of course particularly of eaza and frontex to some extent europe on eurojust as well and	at the same time at the same time the hotspots are supposed to provide a coordinated again response also in terms of the actors involved there and in this way in this way we have seen an unprecedented level of eu presence in in the hotspots of course particularly of eaza and frontex to some extent europe on eurojust as well and	/media/hugo/Seagate Expansion Drive/ALICE_BACKUP/voshpde/wav_files/zipfiles/2016120802.wav	0
109	/media/hugo/Seagate Expansion Drive/ALICE_BACKUP/voshpde/pipeLine/segmentation_wavfiles/2016120802/110_2016120802.wav	2474.152471655329	109110124	2500.3024716553286	110263339	109_2016120802	the opinion response to that in some way so it acknowledges that these agencies play still only support law in helping national authorities but at the same time their activities have very strong impact in certain areas such as the processing of asylum applications or the conduct of readnitional operations so this is very much in our opinion in our opinion means join	the opinion response to that in some way so it acknowledges that these agencies play still only support law in helping national authorities but at the same time their activities have very strong impact in certain areas such as the processing of asylum applications or the conduct of readnitional operations so this is very much in our opinion in our opinion means join	/media/hugo/Seagate Expansion Drive/ALICE_BACKUP/voshpde/wav_files/zipfiles/2016120802.wav	0
110	/media/hugo/Seagate Expansion Drive/ALICE_BACKUP/voshpde/pipeLine/segmentation_wavfiles/2016120802/111_2016120802.wav	2500.3024943310656	110263340	2521.5524943310656	111200465	110_2016120802	eu member state responsibility for the situation in the hotspots and obviously even those fundamental rights caps where they exist that are not directly linked to the activities of the eu actors in te hotspots have an impact on the legitimacy of eu action in the hotspots as a whole	eu member state responsibility for the situation in the hotspots and obviously even those fundamental rights caps where they exist that are not directly linked to the activities of the eu actors in te hotspots have an impact on the legitimacy of eu action in the hotspots as a whole	/media/hugo/Seagate Expansion Drive/ALICE_BACKUP/voshpde/wav_files/zipfiles/2016120802.wav	0
111	/media/hugo/Seagate Expansion Drive/ALICE_BACKUP/voshpde/pipeLine/segmentation_wavfiles/2016120802/112_2016120802.wav	2521.5525170068026	111200466	2543.9025170068026	112186101	111_2016120802	between april and september two thousand and sixteen the fundamental rights agency was present in the greek hotspots to help identify gaps and advice eu bodies present on the ground as well as to some extent national bodies so this opinion is based largely on this hands on experience that we have collected there as well as on targeted visits to both greece and italy	between april and september two thousand and sixteen the fundamental rights agency was present in the greek hotspots to help identify gaps and advice eu bodies present on the ground as well as to some extent national bodies so this opinion is based largely on this hands on experience that we have collected there as well as on targeted visits to both greece and italy	/media/hugo/Seagate Expansion Drive/ALICE_BACKUP/voshpde/wav_files/zipfiles/2016120802.wav	0
112	/media/hugo/Seagate Expansion Drive/ALICE_BACKUP/voshpde/pipeLine/segmentation_wavfiles/2016120802/113_2016120802.wav	2543.9025396825396	112186102	2562.4525396825397	113004157	112_2016120802	perhaps one last one last point in general is that the opinion of course has to has to to la extend reflect the differences between situation and italy and greece both the overall situation in terms of the nature of the migration flows but also the way how the hotspots have been	perhaps one last one last point in general is that the opinion of course has to has to to allot extend reflect the differences between situation and italy and greece both the overall situation in terms of the nature of the migration flows but also the way how the hotspots have been	/media/hugo/Seagate Expansion Drive/ALICE_BACKUP/voshpde/wav_files/zipfiles/2016120802.wav	4
113	/media/hugo/Seagate Expansion Drive/ALICE_BACKUP/voshpde/pipeLine/segmentation_wavfiles/2016120802/114_2016120802.wav	2562.4525623582767	113004158	2581.7025623582767	113853083	113_2016120802	affected by by other developments and this is particularly the case of the eu turkish statement of march two thousand and sixteen would basically means that the greek hotspots are to a much larger extent focusing on return facilitating return particularly to turkey	affected by by other developments and this is particularly the case of the eu turkish statement of march two thousand and sixteen would basically means that the greek hotspots are to a much larger extent focusing on return facilitating return particularly to turkey	/media/hugo/Seagate Expansion Drive/ALICE_BACKUP/voshpde/wav_files/zipfiles/2016120802.wav	0
114	/media/hugo/Seagate Expansion Drive/ALICE_BACKUP/voshpde/pipeLine/segmentation_wavfiles/2016120802/115_2016120802.wav	2581.7025850340137	113853084	2610.7525850340135	115134189	114_2016120802	as well as the fact that asylum claims are registered and and islam seekers intrigue directly in the hotspots in greece which is not the case in italy so the opinion very much looks at looks at te hotspots as as a pilot or learning process knowing or acknowledging that the capacities and procedures could not necessarily be in place already at the outset when be hat what to are launched it takes into account that improvements have been made since then but	as well as the fact that asylum claims are registered and and islam seekers intrigue directly in the hotspots in greece which is not the case in italy so the opinion very much looks at looks at te hotspots as as a pilot or learning process knowing or acknowledging that the capacities and procedures could not necessarily be in place already at the outset when be hat what to are launched it takes into account that improvements have been made since then but	/media/hugo/Seagate Expansion Drive/ALICE_BACKUP/voshpde/wav_files/zipfiles/2016120802.wav	0
115	/media/hugo/Seagate Expansion Drive/ALICE_BACKUP/voshpde/pipeLine/segmentation_wavfiles/2016120802/116_2016120802.wav	2610.7526077097505	115134190	2634.7026077097507	116190385	115_2016120802	that serious gaps still precise in terms of fundamental rights compliance and presentation highlight some of the gaps which we have identified in the opinion the first of course is the issue of access to entermatur protection simply because because facilitating access to the asylum procedures one of the main goals of the hotspots	that serious gaps still precise in terms of fundamentary rights compliance and presentation highlight some of the gaps which we have identified in the opinion the first of course is the issue of access to entermatur protection simply because because facilitating access to the asylum procedures one of the main goals of the hotspots	/media/hugo/Seagate Expansion Drive/ALICE_BACKUP/voshpde/wav_files/zipfiles/2016120802.wav	2
116	/media/hugo/Seagate Expansion Drive/ALICE_BACKUP/voshpde/pipeLine/segmentation_wavfiles/2016120802/117_2016120802.wav	2634.7026303854877	116190386	2654.7526303854875	117074591	116_2016120802	and because al our chair of the people who arrive to italia and to greece by see actually do request asylum once they arrive so in this way in this way the immediate registration chanling into asylum asylum procedures and detecting and and possible addressing vulnerabilities is a potential	and because al our chair of the people who arrive to italia and to greece by see actually do request asylum once they arrive so in this way in this way the immediate registration chanling into asylum asylum procedures and detecting and and possible addressing vulnerabilities is a potential	/media/hugo/Seagate Expansion Drive/ALICE_BACKUP/voshpde/wav_files/zipfiles/2016120802.wav	0
117	/media/hugo/Seagate Expansion Drive/ALICE_BACKUP/voshpde/pipeLine/segmentation_wavfiles/2016120802/118_2016120802.wav	2654.7526530612245	117074592	2674.4026530612246	117941157	117_2016120802	positive contribution of the hotspot at the same time particular in greece and this is one of the very fundamental fundamental views that we defend in the opinion the hotspot have to some extent become a bottleneck in accessing international protection	positive contribution of hotspot at the same time particular in greece and this is one of the very fundamental fundamental views that we defend in the opinion the hotspot have to some extent become a bottleneck in accessing international protection	/media/hugo/Seagate Expansion Drive/ALICE_BACKUP/voshpde/wav_files/zipfiles/2016120802.wav	4
118	/media/hugo/Seagate Expansion Drive/ALICE_BACKUP/voshpde/pipeLine/segmentation_wavfiles/2016120802/119_2016120802.wav	2674.4026757369616	117941158	2698.7526757369615	119014993	118_2016120802	particularly because of the delays in processing of asylum aplications what started as delays in the registration which has been to some extent we have to some extent improved also thanks to thanks to the work of eaza ta has increasingly become an issue because of the prioritisation of different nationalities in the greek hotspot	particularly because of the delays in processing of asylum aplications what started as delays in the registration which has been to some extent we have to some extent improved also thanks to thanks to the work of eaza ta has increasingly become an issue because of the prioritisation of different nationalities in the greek hotspot	/media/hugo/Seagate Expansion Drive/ALICE_BACKUP/voshpde/wav_files/zipfiles/2016120802.wav	0
119	/media/hugo/Seagate Expansion Drive/ALICE_BACKUP/voshpde/pipeLine/segmentation_wavfiles/2016120802/120_2016120802.wav	2698.7526984126985	119014994	2724.302698412698	120141749	119_2016120802	we know that originally the syrian nationals were processed first in order to decide on the admissibility or their potential return return to turkey in the light of the eu turkish statement and only then after at low rate nationalities so nationalities with general low rate of asylum asylum application success have been taken such as the pakistani nationals	we know that originally the syrian nationals were processed first in order to decide on the admissibility or their potential return return to turkey in the light of the eu turkish statement and only then after at low rate nationalities so nationalities with general low rate of asylum asylum application success have been taken such as the pakistani nationals	/media/hugo/Seagate Expansion Drive/ALICE_BACKUP/voshpde/wav_files/zipfiles/2016120802.wav	0
120	/media/hugo/Seagate Expansion Drive/ALICE_BACKUP/voshpde/pipeLine/segmentation_wavfiles/2016120802/121_2016120802.wav	2724.302721088435	120141750	2743.4527210884353	120986265	120_2016120802	of course this has led to a situation where other nationalities which were not prioritised in this way have been waiting in the hotspots for as long as six months for example some of them basically since the eu turkey statement sill waiting for their intuvies this has multiple multiple effects	of course this has led to a situation where other nationalities which were not prioritised in this way have been waiting in the hotspots for as long as six months for example some of them basically since the eu turkey statement sill waiting for their intuvies this has multiple multiple effects	/media/hugo/Seagate Expansion Drive/ALICE_BACKUP/voshpde/wav_files/zipfiles/2016120802.wav	0
121	/media/hugo/Seagate Expansion Drive/ALICE_BACKUP/voshpde/pipeLine/segmentation_wavfiles/2016120802/122_2016120802.wav	2743.4527437641723	120986266	2771.5027437641725	122223271	121_2016120802	of course one of them is the overcrowding of the hotspots in greece the other is the effect on the rights of children where particular an accompany children are facing problems in in processing on words as well as for example family rinification because people whose asylum claims have not been fully registered and processed are facing of course problems in terms of in terms of family hernification procedures	of course one of them is the overcrowding of the hotspots in greece the other is the effect on the rights of children where particular an accompany children are facing problems in in processing on words as well as for example family rinification because people whose asylum claims have not been fully registered and processed are facing of course problems in terms of in terms of family hernification procedures	/media/hugo/Seagate Expansion Drive/ALICE_BACKUP/voshpde/wav_files/zipfiles/2016120802.wav	0
122	/media/hugo/Seagate Expansion Drive/ALICE_BACKUP/voshpde/pipeLine/segmentation_wavfiles/2016120802/123_2016120802.wav	2771.5027664399095	122223272	2799.152766439909	123442637	122_2016120802	and the last but to some extent most serious most serious point to act to this is that it has of course greatly contributed to the growing tensions and frustration among some nationalities and and to some extent to the violence that we have been witnessing in in some of the hotspots so in this way one of the opinions of the agency that i would like to highlight here is that the hotspots will need to ensure onward movement as a priority rather than to block it	and the last but to some extent most serious most serious point to act to this is that it has of course greatly contributed to the growing tensions and frustration among some nationalities and and to some extent to the violence that we have been witnessing in in some of the hotspots so in this way one of the opinions of the agency that i would like to highlight here is that the hotspots will need to ensure onward movement as a priority rather than to block it	/media/hugo/Seagate Expansion Drive/ALICE_BACKUP/voshpde/wav_files/zipfiles/2016120802.wav	0
123	/media/hugo/Seagate Expansion Drive/ALICE_BACKUP/voshpde/pipeLine/segmentation_wavfiles/2016120802/124_2016120802.wav	2799.152789115646	123442638	2818.5027891156465	124295973	123_2016120802	next like pleas coming to the issue of children hotspots a detailed chapter of the opinion is devoted to that issue just just some statistics here some thirty seven of all two thousand and sixteen arrivals to greece children	next like pleas coming to the issue of children hotspots a detailed chapter of the opinion is devoted to that issue just just some statistics here some thirty seven of all two thousand and sixteen arrivals to greece children	/media/hugo/Seagate Expansion Drive/ALICE_BACKUP/voshpde/wav_files/zipfiles/2016120802.wav	0
124	/media/hugo/Seagate Expansion Drive/ALICE_BACKUP/voshpde/pipeLine/segmentation_wavfiles/2016120802/125_2016120802.wav	2818.502811791383	124295974	2839.052811791383	125202229	124_2016120802	now there we are talking about families or children around with their families as well as on accompany children and separated children so children who are accompanied by persons other than their parents al de ge representatives so the situation of children is a general concern and the helspots indeed but	now there we are talking about families or children around with their families as well as on accompany children and separated children so children who are accompanied by persons other than their parents allegre representatives so the situation of children is a general concern and the helspots indeed but	/media/hugo/Seagate Expansion Drive/ALICE_BACKUP/voshpde/wav_files/zipfiles/2016120802.wav	4
125	/media/hugo/Seagate Expansion Drive/ALICE_BACKUP/voshpde/pipeLine/segmentation_wavfiles/2016120802/126_2016120802.wav	2839.05283446712	125202230	2854.7028344671203	125892395	125_2016120802	a particularly burning issue a situation of unaccompanied children just again some numbers only in the first nine months of two thousand and sixteen just estimated that some some nineteen zero on accompanied children arrived to italy	a particularly burning issue a situation of unaccompanied children just again some numbers only in the first nine months of two thousand and sixteen just estimated that some some nineteen zero on accompanied children arrived to italy	/media/hugo/Seagate Expansion Drive/ALICE_BACKUP/voshpde/wav_files/zipfiles/2016120802.wav	0
