	wavfile	start_seconds	start_frames	end_seconds	end_frames	identifier	inferred_text_with_hotwords	inferred_text_without_hotwords	motherfile	dist
144	/media/hugo/Seagate Expansion Drive/ALICE_BACKUP/voshpde/pipeLine/segmentation_wavfiles/20160118/145_20160118.wav	3262.2032653061224	143863164	3279.3532653061225	144619479	144_20160118	set up a permanent roba system over a part from search and rescue also the situation of the european union having an overall approach and we also need to look at the directive two thousand and one in order to establish eu	set up a permanent roba system over a part from search and rescue also the situation of the european union having an overall approach and we also need to look at the directive two thousand and one in order to establish a	/media/hugo/Seagate Expansion Drive/ALICE_BACKUP/voshpde/wav_files/zipfiles/20160118.wav	2
145	/media/hugo/Seagate Expansion Drive/ALICE_BACKUP/voshpde/pipeLine/segmentation_wavfiles/20160118/146_20160118.wav	3279.3532879818595	144619480	3298.903287981859	145481635	145_20160118	lo true humanitarian corridors to have the situation to have binding agreement on resettlement ad i think that you are quite right to a pointed out how the different measures with different measures and forms of humanitarian aid should not	lo true humanitarian corridors to have the situation to have binding agreement on resettlement and i think that you are quite right to a pointed out how the different measures with different measures and forms of humanitarian aid should not	/media/hugo/Seagate Expansion Drive/ALICE_BACKUP/voshpde/wav_files/zipfiles/20160118.wav	1
146	/media/hugo/Seagate Expansion Drive/ALICE_BACKUP/voshpde/pipeLine/segmentation_wavfiles/20160118/147_20160118.wav	3298.903310657596	145481636	3314.5533106575963	146171801	146_20160118	be criminalised and i think that i do not really agree with the fact that smuggling smuggling is perhaps dealt with in a rather summary way is being a negative factor	be criminalised and i think that i do not really agree with the fact that smuggling smuggling is perhaps dealt with in a rather summary way is being a negative factor	/media/hugo/Seagate Expansion Drive/ALICE_BACKUP/voshpde/wav_files/zipfiles/20160118.wav	0
147	/media/hugo/Seagate Expansion Drive/ALICE_BACKUP/voshpde/pipeLine/segmentation_wavfiles/20160118/148_20160118.wav	3314.5533333333333	146171802	3335.3033333333333	147086877	147_20160118	and the quist of the lack of solidarity be eu member states we i must say that i would strengthen functions on that i sanction i thank then the functions against members which do not apply the prod european law and also on the basis of resettlement agreements i think	and the quist of the lack of solidarity be or member states we i must say that i would strengthen functions on that i sanction i thank then the functions against members which do not apply the prod european law and also on the basis of resettlement agreements i think	/media/hugo/Seagate Expansion Drive/ALICE_BACKUP/voshpde/wav_files/zipfiles/20160118.wav	2
148	/media/hugo/Seagate Expansion Drive/ALICE_BACKUP/voshpde/pipeLine/segmentation_wavfiles/20160118/149_20160118.wav	3335.3033560090703	147086878	3362.0533560090703	148266553	148_20160118	but have to say the question of settlement or reful more also i think we need to say more about agreement with turkey and also the list of countries of secure countries the hot s hotspots and frontex as well i think that you ave been nl to critical on the commission attitude thank	but have to say the question of settlement or reful more also i think we need to say more about agreement with turkey and also the list of countries of secure countries the hot s hotspots and frontex as well i think that you ave been it to critical on the commissions attitude thank	/media/hugo/Seagate Expansion Drive/ALICE_BACKUP/voshpde/wav_files/zipfiles/20160118.wav	3
149	/media/hugo/Seagate Expansion Drive/ALICE_BACKUP/voshpde/pipeLine/segmentation_wavfiles/20160118/150_20160118.wav	3362.0533786848073	148266554	3386.8033786848073	149358029	149_20160118	thank you very much ad now pa the green shadow was a critic charging teneqret thank you but a gin ask for the floor our path ok thank then for the td ad mr cor a de loro if you want to no ok and for the enf ad mr anna	thank you very much and now at the green shadow was a critic charging teneqret thank you but a gin ask for the floor our path ok thank then for the td ad mr korroadonlorrow if you want to no ok and for the enfamrntana	/media/hugo/Seagate Expansion Drive/ALICE_BACKUP/voshpde/wav_files/zipfiles/20160118.wav	17
150	/media/hugo/Seagate Expansion Drive/ALICE_BACKUP/voshpde/pipeLine/segmentation_wavfiles/20160118/151_20160118.wav	3386.8034013605443	149358030	3406.153401360544	150211365	150_20160118	mr president i would just like to be brief for because at the moment i think we have got to look further at this document and i think what we particularly need to look at it is important point we would like to be able to have more time to	mr president i would just like to be brief for because at the moment i think we have got to look further at this document and i think what we particularly need to look at it is important point we would like to be able to have more time to	/media/hugo/Seagate Expansion Drive/ALICE_BACKUP/voshpde/wav_files/zipfiles/20160118.wav	0
151	/media/hugo/Seagate Expansion Drive/ALICE_BACKUP/voshpde/pipeLine/segmentation_wavfiles/20160118/152_20160118.wav	3406.153424036281	150211366	3435.903424036281	151523341	151_20160118	look at all the point i am sure the very important point ad i would also like to say ad congratulate the rapporteurs but of course the rapporteur had to work very quickly and it was a tremendous job he work wichase been done and very heavy job ad work as well for the shadow rapporteurs as well ad there some things which we find coniting other things as we find a little it less persuastife i think i would like to be lit it clear about the situation when we are talking about sending people back home	look at all the points i am sure the a very important point and i would also like to say congratulate the rapporteurs but of course the rapporteur had to work very quickly and it was a tremendous job he work wichase been done and very heavy job an work as well for the shadow rapporteurs as well and there some things which we find coniting other things as we find a little it less persuastife i think i would like to be lit it clear about the situation when we are talking about sending people back home	/media/hugo/Seagate Expansion Drive/ALICE_BACKUP/voshpde/wav_files/zipfiles/20160118.wav	9
152	/media/hugo/Seagate Expansion Drive/ALICE_BACKUP/voshpde/pipeLine/segmentation_wavfiles/20160118/153_20160118.wav	3435.903446712018	151523342	3459.653446712018	152570717	152_20160118	re full more because i think that there are some people in the situation who what do not have the right of as filend but done thelesti think we need to look at something more stronger language on that ad also i would like to think confirtiton the fact that sens at they can be	re full more because i think that there are some people in the situation who what do not have the right of as filend but done thelesti think we need to look at something more stronger language on that and also i would like to think confirtiton the fact that sens t they can be	/media/hugo/Seagate Expansion Drive/ALICE_BACKUP/voshpde/wav_files/zipfiles/20160118.wav	2
153	/media/hugo/Seagate Expansion Drive/ALICE_BACKUP/voshpde/pipeLine/segmentation_wavfiles/20160118/154_20160118.wav	3459.653469387755	152570718	3489.003469387755	153865053	153_20160118	some situation we might need a labour force but in force but not necessarily in all member countries ad i think not all member states are the same and as far as labour force was concerned it would be rather difficult to find a situation for people some people have been let for a long time and they might have lost their job as well ad so it we de rate difficult to have new people coming in so i think we have got to look at our contribution in terms of a members which we can table to this ad i think that	some situation we might need a labour force but in force but not necessarily in all member countries i think not all member states are the same and as far as labour force was concerned it would be rather difficult to find a situation for people some people have been let for a long time and they might have lost their job as well and so it we be rather difficult to have new people coming in so i think we have got to look at our contribution in terms of a members which we can table to this and i think that	/media/hugo/Seagate Expansion Drive/ALICE_BACKUP/voshpde/wav_files/zipfiles/20160118.wav	8
154	/media/hugo/Seagate Expansion Drive/ALICE_BACKUP/voshpde/pipeLine/segmentation_wavfiles/20160118/155_20160118.wav	3489.003492063492	153865054	3508.853492063492	154740439	154_20160118	perhaps i think that a various points and which i would like to thank we men thank your president of course all try to make it short so first take it for granted that we all	perhaps i think that a various points and which i would like to thank we men thank your president of course all try to make it short so first take it for granted that we all	/media/hugo/Seagate Expansion Drive/ALICE_BACKUP/voshpde/wav_files/zipfiles/20160118.wav	0
155	/media/hugo/Seagate Expansion Drive/ALICE_BACKUP/voshpde/pipeLine/segmentation_wavfiles/20160118/156_20160118.wav	3508.853514739229	154740440	3533.803514739229	155840735	155_20160118	some up to de grading to mera berthe and of course we all commend the piece of work that has been carried out by our colleagues omertamesola and kashetukiengi of course it it is to be appreciated but trying to summarise what is to be	some up to degrading to omerta berthe and of course we all commend the piece of work that has been carried out by our colleagues omertamesola and kashetukiengi of course it it is to be appreciated but trying to summarise what is to be	/media/hugo/Seagate Expansion Drive/ALICE_BACKUP/voshpde/wav_files/zipfiles/20160118.wav	3
156	/media/hugo/Seagate Expansion Drive/ALICE_BACKUP/voshpde/pipeLine/segmentation_wavfiles/20160118/157_20160118.wav	3533.803537414966	155840736	3551.553537414966	156623511	156_20160118	alled when there comes a time for amendments i would say that beyond the holistic comprehensive and thorough analysis of all the elements involved it is still missing	alled when there comes a time for amendments i would say that beyond the holistic comprehensive and thorough analysis of all the elements involved it is still missing	/media/hugo/Seagate Expansion Drive/ALICE_BACKUP/voshpde/wav_files/zipfiles/20160118.wav	0
157	/media/hugo/Seagate Expansion Drive/ALICE_BACKUP/voshpde/pipeLine/segmentation_wavfiles/20160118/158_20160118.wav	3551.553560090703	156623512	3569.103560090703	157397467	157_20160118	a certain level of criticystem of member states and auf the council failing to comply with the binding law it is not that we are aiming to be a dictature the stature of international humanitarian law it is that we are	a certain level of criticystem of member states and the council failing to comply with the binding law it is not that we are aiming to be a dictature the stature of international humanitarian law it is that we are	/media/hugo/Seagate Expansion Drive/ALICE_BACKUP/voshpde/wav_files/zipfiles/20160118.wav	4
158	/media/hugo/Seagate Expansion Drive/ALICE_BACKUP/voshpde/pipeLine/segmentation_wavfiles/20160118/159_20160118.wav	3569.10358276644	157397468	3585.25358276644	158109683	158_20160118	we are calling for the member states at least at least to honour the existing binding law when it comes to relocation and resettlement there have been a number of schemes and decisions being made by the council itself that have been failed	we are calling for the member states at least at least to honour the existing binding law when it comes to relocation and resettlement there have been a number of schemes and decisions being made by the council itself that have been failed	/media/hugo/Seagate Expansion Drive/ALICE_BACKUP/voshpde/wav_files/zipfiles/20160118.wav	0
159	/media/hugo/Seagate Expansion Drive/ALICE_BACKUP/voshpde/pipeLine/segmentation_wavfiles/20160118/160_20160118.wav	3585.2536054421766	158109684	3606.303605442177	159037989	159_20160118	in practice by most of member states and for the time being the response by the commission when it comes to infringement procedures is less banfarifactury the second point i want to make this why we should be aiming to review not only dublin regulation but also humanitarian ad mission	in practice by most of member states and for the time being the response by the commission when it comes to infringement procedures is less banfarifactury the second point i want to make this why we should be aiming to review not only dublin regulation but also humanitarian and mission	/media/hugo/Seagate Expansion Drive/ALICE_BACKUP/voshpde/wav_files/zipfiles/20160118.wav	1
160	/media/hugo/Seagate Expansion Drive/ALICE_BACKUP/voshpde/pipeLine/segmentation_wavfiles/20160118/161_20160118.wav	3606.303628117914	159037990	3631.953628117914	160169155	160_20160118	procedures and humanitarian visies vies rules at are disposal because they are first ambigules third secondary equivocal and third they are poorly applied or ineffective if any application at all so i think there must be a review	procedures and humanitarian visies vies rules at are disposal because they are first ambigules third secondary equivocal and third they are poorly applied or ineffective if any application at all so i think there must be a review	/media/hugo/Seagate Expansion Drive/ALICE_BACKUP/voshpde/wav_files/zipfiles/20160118.wav	0
161	/media/hugo/Seagate Expansion Drive/ALICE_BACKUP/voshpde/pipeLine/segmentation_wavfiles/20160118/162_20160118.wav	3631.953650793651	160169156	3648.5036507936506	160899011	161_20160118	with the occasion of the recast version of the humanitarian visa code that is why i am calling for the members to affisk this rapporteur in the visa cod precisely to open a	with the occasion of the recast version of the humanitarian visa code that is why i am calling for the members to affisk this rapporteur in the visa cod precisely to open a	/media/hugo/Seagate Expansion Drive/ALICE_BACKUP/voshpde/wav_files/zipfiles/20160118.wav	0
162	/media/hugo/Seagate Expansion Drive/ALICE_BACKUP/voshpde/pipeLine/segmentation_wavfiles/20160118/163_20160118.wav	3648.5036734693876	160899012	3677.8536734693876	162193347	162_20160118	to the so called legal avenues that are still missing that are still missing and this is precisely why so many asylum seekers and refugees are compelled to risk their lives or lose their lives in their desperate in the desperate of effort to nok european doors which for them are of course not having stores	to the so called legal avenues that are still missing that are still missing and this is precisely why so many asylum seekers and refugees are compelled to risk their lives or lose their lives in their desperate in the desperate of effort to nok european doors which for them are of course not having stores	/media/hugo/Seagate Expansion Drive/ALICE_BACKUP/voshpde/wav_files/zipfiles/20160118.wav	0
163	/media/hugo/Seagate Expansion Drive/ALICE_BACKUP/voshpde/pipeLine/segmentation_wavfiles/20160118/164_20160118.wav	3677.8536961451246	162193348	3699.4036961451247	163143703	163_20160118	mr president i want to thank obos the rapporteurs here for all their work it has obviously not been an easy task this but i must i think it also agree with my colleague helga stevens and many of the observation she has made	mr president i want to thank obos the rapporteurs here for all their work it has obviously not been an easy task this but i must i think it also agree with my colleague helga stevens and many of the observation she has made	/media/hugo/Seagate Expansion Drive/ALICE_BACKUP/voshpde/wav_files/zipfiles/20160118.wav	0
164	/media/hugo/Seagate Expansion Drive/ALICE_BACKUP/voshpde/pipeLine/segmentation_wavfiles/20160118/165_20160118.wav	3699.4037188208617	163143704	3719.3537188208616	164023499	164_20160118	i also see this report through the eyes of the rapporteur on the permanent relocation system and in that capacity i do not believe the focus should ever be on ensuring the preferences of the applicant the were they should go when being relocated europe is made up of the safe country as far as i am aware	i also see this report through the eyes of the rapporteur on the permanent relocation system and in that capacity i do not believe the focus should ever be on ensuring the preferences of the applicant the were they should go when being relocated europe is made up of the safe country as far as i am aware	/media/hugo/Seagate Expansion Drive/ALICE_BACKUP/voshpde/wav_files/zipfiles/20160118.wav	0
165	/media/hugo/Seagate Expansion Drive/ALICE_BACKUP/voshpde/pipeLine/segmentation_wavfiles/20160118/166_20160118.wav	3719.3537414965986	164023500	3736.6037414965986	164784225	165_20160118	when you are fleeing for your life and seeking sanctury individuals need to know that their first choice cannot always be v choice ad it may solve the problem with secondary movement but it will not help these member states already overburdened or indeed help with integration in our communities eu	when you are fleeing for your life and seeking sanctury individuals need to know that their first choice cannot always be v choice and it may solve the problem with secondary movement but it will not help these member states already overburdened or indeed help with integration in our communities	/media/hugo/Seagate Expansion Drive/ALICE_BACKUP/voshpde/wav_files/zipfiles/20160118.wav	4
166	/media/hugo/Seagate Expansion Drive/ALICE_BACKUP/voshpde/pipeLine/segmentation_wavfiles/20160118/167_20160118.wav	3736.6037641723356	164784226	3759.3537641723356	165787501	166_20160118	the report mentions that relocation from one member state to another is a practical example of solidarity within the union and this is a move in the right direction and yet the commissioner set on our committee just last week and we all heard him say that the system has been a failure ad of course he attributed this to a lack of solidarity but solidarity is not something you can force some people leaders or countries	the report mentions that relocation from one member state to another is a practical example of solidarity within the union and this is a move in the right direction and yet the commissioner set on our committee just last week and we all heard him say that the system has been a failure and of course he attributed this to a lack of solidarity but solidarity is not something you can force some people leaders or countries	/media/hugo/Seagate Expansion Drive/ALICE_BACKUP/voshpde/wav_files/zipfiles/20160118.wav	1
167	/media/hugo/Seagate Expansion Drive/ALICE_BACKUP/voshpde/pipeLine/segmentation_wavfiles/20160118/168_20160118.wav	3759.3537868480726	165787502	3775.1037868480726	166482077	167_20160118	it got to have the support of the electorate the suggestion is made in the report to see all asylum application is applications to the eu as a whole when linked to individuals being able to choose their preference as far as possible and we do not have a sustainable or a practical system	it got to have the support of the electorate the suggestion is made in the report to see all asylum application is applications to the eu as a whole when linked to individuals being able to choose their preference as far as possible and we do not have a sustainable or a practical system	/media/hugo/Seagate Expansion Drive/ALICE_BACKUP/voshpde/wav_files/zipfiles/20160118.wav	0
168	/media/hugo/Seagate Expansion Drive/ALICE_BACKUP/voshpde/pipeLine/segmentation_wavfiles/20160118/169_20160118.wav	3775.1038095238096	166482078	3799.9538095238095	167577963	168_20160118	the things in the report i do agree with include the need to focus on resettlement under the supervision of the un hcr the need to look at protection on a temporary basis so i hope we can develop those ideas and the report all safe that we should prioritise voluntary returns but certainly my own experience as a minister in immigration in a different crisis i have to say this most time simply does not work	the things in the report i do agree with include the need to focus on resettlement under the supervision of the un hcr the need to look at protection on a temporary basis so i hope we can develop those ideas and the report all safe that we should prioritise voluntary returns but certainly my own experience as a minister in immigration in a different crisis i have to say this most time simply does not work	/media/hugo/Seagate Expansion Drive/ALICE_BACKUP/voshpde/wav_files/zipfiles/20160118.wav	0
169	/media/hugo/Seagate Expansion Drive/ALICE_BACKUP/voshpde/pipeLine/segmentation_wavfiles/20160118/170_20160118.wav	3799.9538321995465	167577964	3815.6038321995466	168268129	169_20160118	that is my colleague has already said creating such a report is bog down with political complexity and compromise but we must as a political body strive for more and i think we have to aim to be more ambitious in the coming months	that is my colleague has already said creating such a report is bog down with political complexity and compromise but we must as a political body strive for more and i think we have to aim to be more ambitious in the coming months	/media/hugo/Seagate Expansion Drive/ALICE_BACKUP/voshpde/wav_files/zipfiles/20160118.wav	0
170	/media/hugo/Seagate Expansion Drive/ALICE_BACKUP/voshpde/pipeLine/segmentation_wavfiles/20160118/171_20160118.wav	3815.6038548752836	168268130	3835.1538548752833	169130285	170_20160118	ms mini i have to say i would like to thank to colleague ad would like to thank form for this work because if the very complicated job war that they done because if the platform the platform on which they had to work which is	ms mini i have to say i would like to thank to colleague and would like to thank form for this work because if the very complicated job war that they done because if the platform the platform on which they had to work which is	/media/hugo/Seagate Expansion Drive/ALICE_BACKUP/voshpde/wav_files/zipfiles/20160118.wav	1
171	/media/hugo/Seagate Expansion Drive/ALICE_BACKUP/voshpde/pipeLine/segmentation_wavfiles/20160118/172_20160118.wav	3835.1538775510203	169130286	3861.4038775510203	170287911	171_20160118	this approach it will the s e gone of a lack of an overall holistic approach in europe that is not one ad so it is very difficult for them to start from nothing ad putting into the different to cover this particular issue because there are so many different item element rob it which are changing as we speak am in various walls are being have been	this approach it will the s e gone of a lack of an overall holistic approach in europe that is not one and so it is very difficult for them to start from nothing in putting into the different to cover this particular issue because there are so many different item element rob it which are changing as we speak am in various walls are being have been	/media/hugo/Seagate Expansion Drive/ALICE_BACKUP/voshpde/wav_files/zipfiles/20160118.wav	3
172	/media/hugo/Seagate Expansion Drive/ALICE_BACKUP/voshpde/pipeLine/segmentation_wavfiles/20160118/173_20160118.wav	3861.4039002267573	170287912	3878.1539002267573	171026587	172_20160118	put up being irreacted the schengen agreement has sometime has been suspended it is an extremely complicated the situation because t change it has we speak ad so therefore finding a holistic approach is a very difficult thing to do it is a good basis i think for those ad i have heard	put up being irreacted the schengen agreement has sometime has been suspended it is an extremely complicated the situation because t change it has we speak and so therefore finding a holistic approach is a very difficult thing to do it is a good basis i think for those and i have heard	/media/hugo/Seagate Expansion Drive/ALICE_BACKUP/voshpde/wav_files/zipfiles/20160118.wav	2
173	/media/hugo/Seagate Expansion Drive/ALICE_BACKUP/voshpde/pipeLine/segmentation_wavfiles/20160118/174_20160118.wav	3878.1539229024943	171026588	3896.8039229024944	171849053	173_20160118	some statements made made by mr kengo on the walk nd the way in which very items we have got to be included but i have to say that on such a cridic situation if we are developing these projects and to say well within	some statements made made by mr kengo on the walk nd the way in which very items we have got to be included but i have to say that on such a cridic situation if we are developing these projects and to say well within	/media/hugo/Seagate Expansion Drive/ALICE_BACKUP/voshpde/wav_files/zipfiles/20160118.wav	0
174	/media/hugo/Seagate Expansion Drive/ALICE_BACKUP/voshpde/pipeLine/segmentation_wavfiles/20160118/175_20160118.wav	3896.8039455782314	171849054	3922.9539455782315	173002269	174_20160118	nine month period we want to find a jobs for the migrants well ad mean if we look at the situation of the silt of italy for example i myself ad migrant as well i mean i remember but the project for young people in italy and in europe did not actually produced any jove the toll for young people so i mean this is a very good initiative but for	a nine month period we want to find a jobs for the migrants well mean if we look at the situation of the silt of italy for example i am myself a migrant as well i mean i remember but the project for young people in italy and in europe did not actually produced any jove the toll for young people so i mean this is a very good initiative but for	/media/hugo/Seagate Expansion Drive/ALICE_BACKUP/voshpde/wav_files/zipfiles/20160118.wav	9
