	wavfile	start_seconds	start_frames	end_seconds	end_frames	identifier	inferred_text_with_hotwords	inferred_text_without_hotwords	motherfile	dist
358	/media/hugo/Seagate Expansion Drive/ALICE_BACKUP/voshpde/pipeLine/segmentation_wavfiles/2016061602/359_2016061602.wav	8017.608117913832	353576518	8047.358117913832	354888493	358_2016061602	the effect of the current pesolisisation of intersex bodies begins in childhood but it does not end here let me now speak of intersexual dults the majority of which have been subjected to medical and sychologica interventions in the past five decades intersex people and the eu face stigma structural and wermal discrimination harassment lack of adequate medical care lack of access to need it medication lack of legal recognition and the invisibility of their bodies in our society in	the effect of the current pesolisisation of intersex bodies begins in childhood but it does not end here let me now speak of intersexual dults the majority of which have been subjected to medical and sychologica interventions in the past five decades intersex people and the eus face stigma structural and wermal discrimination harassment lack of adequate medical care lack of access to need it medication lack of legal recognition and the invisibility of their bodies in our society in	/media/hugo/Seagate Expansion Drive/ALICE_BACKUP/voshpde/wav_files/zipfiles/2016061602.wav	1
359	/media/hugo/Seagate Expansion Drive/ALICE_BACKUP/voshpde/pipeLine/segmentation_wavfiles/2016061602/360_2016061602.wav	8047.358140589569	354888494	8073.4081405895695	356037299	359_2016061602	there is a reported risk of poverty due to lack of education as a result of dropping out of school and or physical and sychological imparements due to treatments or lagafstep of self as steam caused by social stigma intersect eu do not find themselves positively represented anywhere as variations of sex characteristics are not included in school or university curricula unless as a disorder already seas	there is a reported risk of poverty due to lack of education as a result of dropping out of school and or physical and sychological imparements due to treatments or lagafstep of self a steam caused by social stigma intersect eu do not find themselves positively represented anywhere as variations of sex characteristics are not included in school or university curricula unless as a disorder already seas	/media/hugo/Seagate Expansion Drive/ALICE_BACKUP/voshpde/wav_files/zipfiles/2016061602.wav	1
360	/media/hugo/Seagate Expansion Drive/ALICE_BACKUP/voshpde/pipeLine/segmentation_wavfiles/2016061602/361_2016061602.wav	8073.408163265306	356037300	8095.058163265307	356992065	360_2016061602	when growing older just like anyone else intersex people need to rely on the health factor much more access to general health care is often impaired by prejudices of healthcare professionals and the refund policies of health insurance companies thus whilligting intersex people rights to health as enshrined in article thirty five of the eu charter of fundamental rights	when growing older just like anyone else intersex people need to rely on the health factor much more access to general health care is often impaired by prejudices of healthcare professionals and the refund policies of health insurance companies thus whilligting intersex people rights to health as enshrined in article thirty five of the eu charter of fundamental rights	/media/hugo/Seagate Expansion Drive/ALICE_BACKUP/voshpde/wav_files/zipfiles/2016061602.wav	0
361	/media/hugo/Seagate Expansion Drive/ALICE_BACKUP/voshpde/pipeLine/segmentation_wavfiles/2016061602/362_2016061602.wav	8095.058185941043	356992066	8123.308185941043	358237891	361_2016061602	this is particular through their accessibility to particular services example given availability of preventive checkups for certain conditions for general health services is related to the sex grenear of the individual seeking the service other common issues faced by intersex people in the eu are a lack of access to homn substitution or a homon substitution which does not fit the real needs of the persons body and again instead aims to enforce a science sex of feman on male	this is particular through their accessibility to particular services example given availability of preventive checkups for certain conditions for general health services is related to the sex grenear of the individual seeking the service other common issues faced by enter sex people in the eu are a lack of access to homn substitution or a homon substitution which does not fit the real needs of the persons body and again instead aims to enforce a science sex of feman on male	/media/hugo/Seagate Expansion Drive/ALICE_BACKUP/voshpde/wav_files/zipfiles/2016061602.wav	2
362	/media/hugo/Seagate Expansion Drive/ALICE_BACKUP/voshpde/pipeLine/segmentation_wavfiles/2016061602/363_2016061602.wav	8123.30820861678	358237892	8148.65820861678	359355827	362_2016061602	since two thousand and eight eu member states have been repeatedly called on by different un bodies including the cd cat cpid and cc to take a necessary legislative administrative and other measures to guarantee respect for the physical integrity and autonomy of intersex persons and ensure that no one is subjected during infancy or child to to unnecessary medical oucergical procedures	since two thousand and eight eu member states have been repeatedly called on by different un bodies including the cd cat cpid and cc to take a necessary legislative administrative and other measures to guarantee respect for the physical integrity and autonomy of intersex persons and ensure that no one is subjected during infancy or child to to unnecessary medical oucergical procedures	/media/hugo/Seagate Expansion Drive/ALICE_BACKUP/voshpde/wav_files/zipfiles/2016061602.wav	0
363	/media/hugo/Seagate Expansion Drive/ALICE_BACKUP/voshpde/pipeLine/segmentation_wavfiles/2016061602/364_2016061602.wav	8148.658231292517	359355828	8166.208231292517	360129783	363_2016061602	in two thousand and fifteen the commissioner for human rights of the council of europe published an issue paper on human rights and intersex people the un bodies as well as the commissioner for human rights urge the member states to guarantee councilling services for all intersex children and their parents	in two thousand and fifteen the commissioner for human rights of the council of europe published an issue paper on human rights and intersex people the un bodies as well as the commissioner for human rights urge the member states to guarantee councilling services for all intersex children and their parents	/media/hugo/Seagate Expansion Drive/ALICE_BACKUP/voshpde/wav_files/zipfiles/2016061602.wav	0
364	/media/hugo/Seagate Expansion Drive/ALICE_BACKUP/voshpde/pipeLine/segmentation_wavfiles/2016061602/365_2016061602.wav	8166.208253968254	360129784	8190.958253968254	361221259	364_2016061602	so as to inform them of the consequences of unnecessary surgery and other medical treatment to ensure that full free and informed consent is respected in connection with medical and surgical treatments for intersex people and that non urgent irreversible medical interventions are postponed until the child a sufficiently mature to participate in decision making and give full free and informed consent and to provide	so as to inform them of the consequences of unnecessary surgery and other medical treatment to ensure that full free and informed consent is respected in connection with medical and surgical treatments for intersex people and that non urgent irreversible medical interventions are postponed until the child a sufficiently mature to participate in decision making and give full free and informed consent and to provide	/media/hugo/Seagate Expansion Drive/ALICE_BACKUP/voshpde/wav_files/zipfiles/2016061602.wav	0
365	/media/hugo/Seagate Expansion Drive/ALICE_BACKUP/voshpde/pipeLine/segmentation_wavfiles/2016061602/366_2016061602.wav	8190.958276643991	361221260	8216.10827664399	362330375	365_2016061602	adequate redress for the physical and psychological suffering cast by such practices to intersex persons and guarantee intersex peoples access to justice but until now malte the only eu eu member state to have band unconcerneded medical intervention and have provided joint by greece in december two thousand and fifteen an anti discrimination framework on the explicit ground of sex characteristics	adequate redress for the physical and psychological suffering cast by such practices to intersex persons and guarantee inter sex peoples access to justice but until now malte the only eu eu member state to have band unconcerned medical intervention and have provided joint by greece in december two thousand and fifteen an anti discrimination framework on the explicit ground of sex characteristics	/media/hugo/Seagate Expansion Drive/ALICE_BACKUP/voshpde/wav_files/zipfiles/2016061602.wav	3
366	/media/hugo/Seagate Expansion Drive/ALICE_BACKUP/voshpde/pipeLine/segmentation_wavfiles/2016061602/367_2016061602.wav	8216.108299319729	362330376	8239.858299319729	363377751	366_2016061602	this is highly unfortunate to stay at least while europe would like to urge the committee on civil liberties justice and home affairs to use the momentum and raise awareness on intersex issues the key priorities are to prohibit medical treatments on intersex people without their prosmal free and fully and formed consent this includes to prohibit medical treatment on intersex children that is not lifesaving but merely cosmetic	this is highly unfortunate to stay at least while europe would like to urge the committee on civil liberties trustice and home affairs to use the momentum and raise awareness on intersex issues the key priorities are to prohibit medical treatments on intersex people without their prosmal free and fully and formed consent this includes to prohibit medical treatment on intersex children that is not lifesaving but merely cosmetic	/media/hugo/Seagate Expansion Drive/ALICE_BACKUP/voshpde/wav_files/zipfiles/2016061602.wav	2
367	/media/hugo/Seagate Expansion Drive/ALICE_BACKUP/voshpde/pipeLine/segmentation_wavfiles/2016061602/368_2016061602.wav	8239.858321995465	363377752	8263.108321995465	364403077	367_2016061602	anti discrimination legislation that explicitly includes individuals with variations of sex characteristics is important to guarantee intersex peoples access to justice and employment of their rights at european level a competirative study on how the current eu legislation on sex and gender equality can also cover sex characteristics would be key	anti discrimination legislation that explicitly includes individuals with variations of sex characteristics is important to guarantee intersex peoples access to justice and employment of their rights at european level a competirative study on how the current eu legislation on sex and gender equality can also cover sex characteristics would be key	/media/hugo/Seagate Expansion Drive/ALICE_BACKUP/voshpde/wav_files/zipfiles/2016061602.wav	0
368	/media/hugo/Seagate Expansion Drive/ALICE_BACKUP/voshpde/pipeLine/segmentation_wavfiles/2016061602/369_2016061602.wav	8263.108344671202	364403078	8283.058344671203	365282873	368_2016061602	initiative report issued by the european parliament providing a first office european parliament position on intersex would be very welcome too we urge you to take the responsibility in your hands and to actively work for the betterment of intersex peoples lives within the european union pr	initiative report issued by the european parliament providing a first official european parliament position on intersex would be very welcome too we urge you to take the responsibility in your hands and to actively work for the betterment of intersex peoples lives within the european union	/media/hugo/Seagate Expansion Drive/ALICE_BACKUP/voshpde/wav_files/zipfiles/2016061602.wav	6
369	/media/hugo/Seagate Expansion Drive/ALICE_BACKUP/voshpde/pipeLine/segmentation_wavfiles/2016061602/370_2016061602.wav	8283.05836734694	365282874	8304.008367346938	366206769	369_2016061602	mr president mr gats our next speaker is mr pat clark member of the executive committee european disability forum since two thousand and five currently his involved in independent living initiatives for people with down sindrum in ireland	mr president mr gats our next speaker is mr pat clark member of the executive committee european disability forum since two thousand and five currently his involved in independent living initiatives for people with down sindrum in ireland	/media/hugo/Seagate Expansion Drive/ALICE_BACKUP/voshpde/wav_files/zipfiles/2016061602.wav	0
370	/media/hugo/Seagate Expansion Drive/ALICE_BACKUP/voshpde/pipeLine/segmentation_wavfiles/2016061602/371_2016061602.wav	8304.008390022676	366206770	8325.958390022675	367174765	370_2016061602	he is also leading a campaign my opinion my vote to ensure that people we down sen rom and people with an intellectual disability can have access to the political system including easy to read manifestors mr clark the floris	he is also leading a campaign my opinion my vote to ensure that people we down sen rom and people with an intellectual disability can have access to the political system including easy to read manifestors mr clark the floris	/media/hugo/Seagate Expansion Drive/ALICE_BACKUP/voshpde/wav_files/zipfiles/2016061602.wav	0
371	/media/hugo/Seagate Expansion Drive/ALICE_BACKUP/voshpde/pipeLine/segmentation_wavfiles/2016061602/372_2016061602.wav	8325.958412698412	367174766	8355.208412698412	368464691	371_2016061602	mr president i am delighted to be here today to address this very important meeting on behalf of the european disability forum the edf is an umbrella body representing persons with disabilities in europe we have a wide range of mrs national counsels of persons with disabilities european wide ngos and a range of european international and national associate members some of whom are the room today	mr president i am delighted to be here today to address this very important meeting on behalf of the european disability forum the edf is an umbrella body representing persons with disabilities in europe we have a wide range of members national counsels of persons with disabilities european wide ngos and a range of european international and national associate members some of whom are the room today	/media/hugo/Seagate Expansion Drive/ALICE_BACKUP/voshpde/wav_files/zipfiles/2016061602.wav	4
372	/media/hugo/Seagate Expansion Drive/ALICE_BACKUP/voshpde/pipeLine/segmentation_wavfiles/2016061602/373_2016061602.wav	8355.20843537415	368464692	8372.75843537415	369238647	372_2016061602	we are the strong united voice of persons with disabilities in europe we are happy to have this opportunity to discuss the rights of persons with disabilities in this public hearing on fundamental rights disability has to be approached from a human rights perspective	we are the strong united voice of persons with disabilities in europe we are happy to have this opportunity to discuss the rights of persons with disabilities in this public hearing on fundamental rights disability has to be approached from a human rights perspective	/media/hugo/Seagate Expansion Drive/ALICE_BACKUP/voshpde/wav_files/zipfiles/2016061602.wav	0
373	/media/hugo/Seagate Expansion Drive/ALICE_BACKUP/voshpde/pipeLine/segmentation_wavfiles/2016061602/374_2016061602.wav	8372.758458049886	369238648	8396.608458049886	370290433	373_2016061602	the human rights of persons with disabilities are recalled in the un convention on the rights of persons with disabilities which has now been ratified by both the european union itself and by almost all the eu member states unfortunately my country ireland is still found wanting in this regard but we expect to rectify this situation by the year end years hoping	the human rights of persons with disabilities are recalled in the un convention on the rights of persons with disabilities which has now been ratified by both the european union itself and by almost all the eu member states unfortunately my country ireland is still found wanting in this regard but we expect to rectify this situation by the year end years hoping	/media/hugo/Seagate Expansion Drive/ALICE_BACKUP/voshpde/wav_files/zipfiles/2016061602.wav	0
374	/media/hugo/Seagate Expansion Drive/ALICE_BACKUP/voshpde/pipeLine/segmentation_wavfiles/2016061602/375_2016061602.wav	8396.608480725623	370290434	8418.158480725624	371240789	374_2016061602	this however is the first time in european union history that the eu has committed to a human rights convention it means that all eu legislations policies and programmes must comply with the un convention and that the human rights of persons with disabilities have to be mainstreamed in all eu action	this however is the first time in european union history that the eu has committed to a human rights convention it means that all eu legislations policies and programmes must comply with the un convention and that the human rights of persons with disabilities have to be mainstreamed in all eu actions	/media/hugo/Seagate Expansion Drive/ALICE_BACKUP/voshpde/wav_files/zipfiles/2016061602.wav	1
375	/media/hugo/Seagate Expansion Drive/ALICE_BACKUP/voshpde/pipeLine/segmentation_wavfiles/2016061602/376_2016061602.wav	8418.15850340136	371240790	8443.90850340136	372376365	375_2016061602	and strategies on human rights it therefore follows that a new approach is required to disability policy mating within the european union last year the eu was examined for the first time in its history by the un human rights body the un committee on the rights of persons with disabilities and has received recommendations from this committee in september two thousand and fifteen	and strategies on human rights it therefore follows that a new approach is required to disability policy mating within the european union last year the eu was examined for the first time in its history by the un human rights body the un committee on the rights of persons with disabilities and has received recommendations from this committee in september two thousand and fifteen	/media/hugo/Seagate Expansion Drive/ALICE_BACKUP/voshpde/wav_files/zipfiles/2016061602.wav	0
376	/media/hugo/Seagate Expansion Drive/ALICE_BACKUP/voshpde/pipeLine/segmentation_wavfiles/2016061602/377_2016061602.wav	8443.908526077097	372376366	8464.158526077097	373269391	376_2016061602	these concluding observations give clear guidance to the european union on how to better promote protect and ensure the rights of persons with disabilities within the union they include a detailed list of actions and measures to be taken by the eu within a given time frame	these concluding observations give clear guidance to the european union on how to better promote protect and ensure the rights of persons with disabilities within the union they include a detailed list of actions and measures to be taken by the eu within a given time frame	/media/hugo/Seagate Expansion Drive/ALICE_BACKUP/voshpde/wav_files/zipfiles/2016061602.wav	0
377	/media/hugo/Seagate Expansion Drive/ALICE_BACKUP/voshpde/pipeLine/segmentation_wavfiles/2016061602/378_2016061602.wav	8464.158548752834	373269392	8485.908548752834	374228567	377_2016061602	the recommendations provide a clear set of priorities even a roadmap for eu action in the coming years in order to implement properly the copd and to promote and respect the rights of persons with disabilities within the union these recommendations should serve as as the main point of reference going forward	the recommendations provide a clear set of priorities even a roadmap for eu actions in the coming years in order to implement properly the copd and to promote and respect the rights of persons with disabilities within the union these recommendations should serve as as the main point of reference going forward	/media/hugo/Seagate Expansion Drive/ALICE_BACKUP/voshpde/wav_files/zipfiles/2016061602.wav	1
378	/media/hugo/Seagate Expansion Drive/ALICE_BACKUP/voshpde/pipeLine/segmentation_wavfiles/2016061602/379_2016061602.wav	8485.908571428572	374228568	8510.75857142857	375324453	378_2016061602	the european parliament will adopt next month a resolution on these concluding observations and parliament will be the first institution in the eu to react we want to express our gratitude of parliament and in particular to the rapporteur mep ms helgistevans for having closely involved organisations of persons with disabilities in full respect of article four three of the convention	the european parliament will adopt next month a resolution on these concluding observations and parliament will be the first institution in the eu to react we want to express our gratitude of parliament and in particular to the rapporteur mep ms helgistevans for having closely involved organisations of persons with disabilities in full respect of article four three of the convention	/media/hugo/Seagate Expansion Drive/ALICE_BACKUP/voshpde/wav_files/zipfiles/2016061602.wav	0
379	/media/hugo/Seagate Expansion Drive/ALICE_BACKUP/voshpde/pipeLine/segmentation_wavfiles/2016061602/380_2016061602.wav	8510.758594104309	375324454	8537.508594104309	376504129	379_2016061602	in de concluding observations the un committee asked the european union to set up a structured dialogue with persons with disabilities and the representative organisations so as to ensure their constant participation in all eu policy and decision making processes related to the convention in other words to go beyond the ad hoc involvement and participation of pos	in the concluding observations the un committee asked the european union to set up a structured dialogue with persons with disabilities and the representative organisations so as to ensure their constant participation in all eu policy and decision making processes related to the convention in other words to go beyond the ad hoc involvement and participation of pos	/media/hugo/Seagate Expansion Drive/ALICE_BACKUP/voshpde/wav_files/zipfiles/2016061602.wav	2
380	/media/hugo/Seagate Expansion Drive/ALICE_BACKUP/voshpde/pipeLine/segmentation_wavfiles/2016061602/381_2016061602.wav	8537.508616780045	376504130	8559.558616780045	377476535	380_2016061602	the eu has been a leader in the world by being the first regional organisation to ratify the convention but now it needs to be a leader in the implementation of the convention a poor implementation would greatly weaken the human rights framework and the eu needs to have a dedicated strategy to implementing the copd	the eu has been a leader in the world by being the first regional organisation to ratify the convention but now it needs to be a leader in the implementation of the convention a poor implementation would greatly weaken the human rights framework and the eu needs to have a dedicated strategy to implementing the copd	/media/hugo/Seagate Expansion Drive/ALICE_BACKUP/voshpde/wav_files/zipfiles/2016061602.wav	0
381	/media/hugo/Seagate Expansion Drive/ALICE_BACKUP/voshpde/pipeLine/segmentation_wavfiles/2016061602/382_2016061602.wav	8559.558639455783	377476536	8582.208639455783	378475401	381_2016061602	eu european disability strategy two thousand and ten to two thousand and twenty was adopted before the eu conclusion of the copd and this year we have only a review instead of a real action plan to further the un copd implementation and i have concerns about that	the european disability strategy two thousand and ten to two thousand and twenty was adopted before the eu conclusion of the copd and this year we have only a review instead of a real action plan to further the un copd implementation and i have concerns about that	/media/hugo/Seagate Expansion Drive/ALICE_BACKUP/voshpde/wav_files/zipfiles/2016061602.wav	3
382	/media/hugo/Seagate Expansion Drive/ALICE_BACKUP/voshpde/pipeLine/segmentation_wavfiles/2016061602/383_2016061602.wav	8582.20866213152	378475402	8600.65866213152	379289047	382_2016061602	there is a worrying trend of not taking human rights obligations seriously the eu took a step backward by moving the crpd vocal point from dg justice back to dg employment and social affairs the horizontal equal treatment directive is still on the table of the council	there is a worrying trend of not taking human rights obligations seriously the eu took a step backward by moving the crpd vocal point from dg justice back to dg employment and social affairs the horizontal equal treatment directive is still on the table of the council	/media/hugo/Seagate Expansion Drive/ALICE_BACKUP/voshpde/wav_files/zipfiles/2016061602.wav	0
383	/media/hugo/Seagate Expansion Drive/ALICE_BACKUP/voshpde/pipeLine/segmentation_wavfiles/2016061602/384_2016061602.wav	8600.658684807257	379289048	8619.608684807255	380124743	383_2016061602	leaving eighty million people with disabilities and persons discriminated on the basis of religion age sexual orientation and without the protection in all areas of life the concluding observations called for the swift adoption of the proposed directive in line with the convention	leaving eighty million people with disabilities and persons discriminated on the basis of religion age sexual orientation and without the protection in all areas of life the concluding observations called for the swift adoption of the proposed directive in line with the convention	/media/hugo/Seagate Expansion Drive/ALICE_BACKUP/voshpde/wav_files/zipfiles/2016061602.wav	0
