	wavfile	start_seconds	start_frames	end_seconds	end_frames	identifier	inferred_text_with_hotwords	inferred_text_without_hotwords	motherfile	dist
0	/media/hugo/Seagate Expansion Drive/ALICE_BACKUP/voshpde/pipeLine/segmentation_wavfiles/20160118/001_20160118.wav	0.0	0	24.75	1091475	000_20160118	de lage peta you steep you are going to make a quick start we only have one an auf ours to this icm pa take you see the rapporteurs mr	ecllagepeftayousteepyoare going to make a quick start we only have one an out ours to this icm pes take you see the rapporteurs ms	/media/hugo/Seagate Expansion Drive/ALICE_BACKUP/voshpde/wav_files/zipfiles/20160118.wav	15
1	/media/hugo/Seagate Expansion Drive/ALICE_BACKUP/voshpde/pipeLine/segmentation_wavfiles/20160118/002_20160118.wav	24.75002267573696	1091476	49.500022675736965	2182951	001_20160118	mr president uk to point one the adoption of the agenda if there are no objections to the agenda adopted and we begin colleagues with the situation in the mediterranean and the need for a holistic eu approach to migration we have before as the draft report i should just mention that in one of the	mr president wolcletopintonethe adoption of the agenda if there are no objections to the agenda adopted and we begin colleagues with the situation in the mediterranean and the need for a holistic eu approach to migration we have before as the draft report i should just mention that in one of the	/media/hugo/Seagate Expansion Drive/ALICE_BACKUP/voshpde/wav_files/zipfiles/20160118.wav	10
2	/media/hugo/Seagate Expansion Drive/ALICE_BACKUP/voshpde/pipeLine/segmentation_wavfiles/20160118/003_20160118.wav	49.50004535147392	2182952	65.45004535147392	2886347	002_20160118	agenda ad the meeting is from ad nine hundred and thirty to twenty one hundred that is in act europe this meeting in eu nineteen hundred ano thousand and thirty i respect of of what anyone cars that is what it can be	agenda for the meeting is from und nine hundred and thirty to twenty one hundred that is in act europe this meeting in nineteen hundred ano thousand and thirty i respect of of what anyone cars that is what it can be	/media/hugo/Seagate Expansion Drive/ALICE_BACKUP/voshpde/wav_files/zipfiles/20160118.wav	8
3	/media/hugo/Seagate Expansion Drive/ALICE_BACKUP/voshpde/pipeLine/segmentation_wavfiles/20160118/004_20160118.wav	65.45006802721089	2886348	91.70006802721089	4043973	003_20160118	we have the draft report and thank you to the both rapporteurs for getting that ready to substantial piece of work we only have one on a half hours sounds like a long time but it ad for something to substantial a report for which the deadline for tabling amendments will be the eip of february not not a long time again for a very substantial and complex and important own initiative report	we have the draft report and thank you to the both rapporteurs for getting that ready to substantial piece of work we only have one on a half hours sounds like a long time but it is for something to substantial a report for which the deadline for tabling amendments will be the eip of february not not a long time again for a very substantial and complex and important own initiative report	/media/hugo/Seagate Expansion Drive/ALICE_BACKUP/voshpde/wav_files/zipfiles/20160118.wav	2
4	/media/hugo/Seagate Expansion Drive/ALICE_BACKUP/voshpde/pipeLine/segmentation_wavfiles/20160118/005_20160118.wav	91.70009070294785	4043974	109.35009070294785	4822339	004_20160118	so we have that one and a half hours are indicate timing first speakers stilmpleasecollingsto make your contribution panchi and that includes of course ar rapporteurs who will be doing their presentations in the context of the own initiative report	so we have that one and a half hours are indicate timing first speakers stilmpleasecollingsto make your contribution panchi and that includes of course ar rapporteurs who will be doing their presentations in the context of the own initiative report	/media/hugo/Seagate Expansion Drive/ALICE_BACKUP/voshpde/wav_files/zipfiles/20160118.wav	0
5	/media/hugo/Seagate Expansion Drive/ALICE_BACKUP/voshpde/pipeLine/segmentation_wavfiles/20160118/006_20160118.wav	109.35011337868481	4822340	126.7001133786848	5587475	005_20160118	we are gline to proceed to the presentation first by the co rapporteurs after that we going to hear from the commission representative marta age directive of strategy in general affairs from dg home bend from the council presidency representative mr peter de	we are gline to proceed to the presentation first by the co rapporteurs after that we going to hear from the commission representative martefagan directive of strategy in general affairs from dg home bend from the council presidency representative mr pit d	/media/hugo/Seagate Expansion Drive/ALICE_BACKUP/voshpde/wav_files/zipfiles/20160118.wav	8
6	/media/hugo/Seagate Expansion Drive/ALICE_BACKUP/voshpde/pipeLine/segmentation_wavfiles/20160118/007_20160118.wav	126.70013605442176	5587476	144.75013605442177	6383481	006_20160118	he has the deption directive of migration quality at the ministry of security and justice then we are going to listeny to profectio danual time from the contetand university in germany he was invited to specifically by the two rapporteurs and i must put to briefly just before the meeting	he has the deption directive of migration quality at the ministry of security and justice then we are going to listeny to profectio danual time from the contetand university in germany he was invited to specifically by the two rapporteurs and i must put to briefly just before the meeting	/media/hugo/Seagate Expansion Drive/ALICE_BACKUP/voshpde/wav_files/zipfiles/20160118.wav	0
7	/media/hugo/Seagate Expansion Drive/ALICE_BACKUP/voshpde/pipeLine/segmentation_wavfiles/20160118/008_20160118.wav	144.75015873015872	6383482	170.20015873015873	7505827	007_20160118	he will give his views having discussed these issues in des with the rapporteurs so because we have such a short period of time and i want an intensive discussion ad going to begin immediately with our two rapporteurs and i begin with giving before to describe the main point from the draft report to rebertamexshowrapters	he will give his views having discussed these issues in debts with the rapporteurs so because we have such a short period of time and i want an intensive discussion in going to begin immediately with our two rapporteurs and i begin with giving before to describe the main point from the draft report to rebertamexshowrapters	/media/hugo/Seagate Expansion Drive/ALICE_BACKUP/voshpde/wav_files/zipfiles/20160118.wav	4
8	/media/hugo/Seagate Expansion Drive/ALICE_BACKUP/voshpde/pipeLine/segmentation_wavfiles/20160118/009_20160118.wav	170.2001814058957	7505828	199.1501814058957	8782523	008_20160118	peter thank you very much cloud i will be a panta as possible but keep a low mic to cacealitibisoftimtopeidenocastoajsfafeyowworkinjustfifwehaveshaldationeverywhereadd not any indication de any	teportankyou very much cloud i will be a panta as possible but keep a low mic to cacealitibisoftitopeidenocastoajsfafeyowworkinjustfifwehaveshaldationeverywhereadd not any indication to any	/media/hugo/Seagate Expansion Drive/ALICE_BACKUP/voshpde/wav_files/zipfiles/20160118.wav	9
9	/media/hugo/Seagate Expansion Drive/ALICE_BACKUP/voshpde/pipeLine/segmentation_wavfiles/20160118/010_20160118.wav	199.15020408163267	8782524	221.90020408163267	9785799	009_20160118	translations that were not available so can is everyone hearing their translation german wid obvious we be offer to have to increase germ ad	translations that were not available so can is everyone hearing their translation german wid obvious we be offer to have to increase german	/media/hugo/Seagate Expansion Drive/ALICE_BACKUP/voshpde/wav_files/zipfiles/20160118.wav	2
10	/media/hugo/Seagate Expansion Drive/ALICE_BACKUP/voshpde/pipeLine/segmentation_wavfiles/20160118/011_20160118.wav	221.9002267573696	9785800	240.7502267573696	10617085	010_20160118	just checking again colleagues everyone getting yet feus check ad otersteepyou get the garlnifcalling out fas we know yet your getting the german becanswerekiking yet ad jus looking at the german des working al there	just checking again colleagues everyone getting yet feus check and otersteepyougetthegarlnifcalling out fas we know yet your getting the german becanswerekiking yet and just looking at the german vid is working al there	/media/hugo/Seagate Expansion Drive/ALICE_BACKUP/voshpde/wav_files/zipfiles/20160118.wav	10
11	/media/hugo/Seagate Expansion Drive/ALICE_BACKUP/voshpde/pipeLine/segmentation_wavfiles/20160118/012_20160118.wav	240.75024943310657	10617086	269.2002494331066	11871731	011_20160118	it does also can i just same colleague my my mitpace the interpretation on maltine will be available passively ad i should also mention interpretation of french german italian dutch english greek spanish buch gives we the hungarian polish spill bat bulgarian and romanian will be available today cape from that list what will not be available ad the no right riten in that way but	it does also can i just same colleague my my mitpace the interpretation on maltine will be available passively and i should also mention interpretation of french german italian dutch english greek spanish buch gives we the hungarian polish spill bat bulgarian and romanian will be available today cape from that list what will not be available a the no right riten on that way but	/media/hugo/Seagate Expansion Drive/ALICE_BACKUP/voshpde/wav_files/zipfiles/20160118.wav	3
12	/media/hugo/Seagate Expansion Drive/ALICE_BACKUP/voshpde/pipeLine/segmentation_wavfiles/20160118/013_20160118.wav	269.20027210884354	11871732	296.75027210884355	13086687	012_20160118	ok so at as thing pleas to hic your presentationmr president i would peak a liibitof lenkacuse i would like to give a litlebit of an overview to what the peat of work that we have twenty seven page long report we have sent some hours ago to the members of the committee for their consideration when last year we were tasked with preparing a by partit an approach to the european parliament	ok so bet as thing pleas to hic your presentationmr president i would peak a liibitof lenktacuse i would like to give a litlebit of an overview to what the peat of work that we have twenty seven page long report we have sent some hours ago to the members of the committee for their consideration when last year we were tasked with preparing a by partit an approach to the european parliament	/media/hugo/Seagate Expansion Drive/ALICE_BACKUP/voshpde/wav_files/zipfiles/20160118.wav	3
13	/media/hugo/Seagate Expansion Drive/ALICE_BACKUP/voshpde/pipeLine/segmentation_wavfiles/20160118/014_20160118.wav	296.7502947845805	13086688	318.4002947845805	14041453	013_20160118	response to migration we knew that it would be challenging what we did not know however is that we would be doing this in the mit of the worst refugee crisis since the second world war we were exaperated by the rise of popular movement across the continent and we were hampered by the security challenges that we face ad a continent at	response to migration we knew that it would be challenging what we did not know however is that we would be doing this in the mit of the worst refugee crisis since the second world war we were exaperated by the rise of popular movement across the continent and we were hampered by the security challenges that we face as a continent at	/media/hugo/Seagate Expansion Drive/ALICE_BACKUP/voshpde/wav_files/zipfiles/20160118.wav	1
14	/media/hugo/Seagate Expansion Drive/ALICE_BACKUP/voshpde/pipeLine/segmentation_wavfiles/20160118/015_20160118.wav	318.40031746031747	14041454	345.85031746031746	15251999	014_20160118	so it has not been easy we are perhaps to use to preaching from our entrench the ideological towers in this parliament but today if we stand any chance of getting something concrete through we know that we all have to move away from scoring partes than point and come up with the holistic response to our citizens demand and in this respect i very much would like to thank madam kenger at co rapporteur and all the shadows who are involved with out	so it has not been easy we are perhaps to use to preaching from our entrench the ideological towers in this parliament but today if we stand any chance of getting something concrete through we know that we all have to move away from scoring partes than point and come up with the holistic response to our citizens demand and in this respect i very much would like to thank madam kenger at co rapporteur and all the shadows who are involved with out	/media/hugo/Seagate Expansion Drive/ALICE_BACKUP/voshpde/wav_files/zipfiles/20160118.wav	0
15	/media/hugo/Seagate Expansion Drive/ALICE_BACKUP/voshpde/pipeLine/segmentation_wavfiles/20160118/016_20160118.wav	345.8503401360544	15252000	362.50034013605443	15986265	015_20160118	throughout this arguith the process i think what we have all learned is that there is no quick fi to migration and we need to look at every single aspect and come up with an all encompathing plan ad in our report is exactly what we have tried to do it	throughout this arguith the process i think what we have all learned is that there is no quick fi to migration and we need to look at every single aspect and come up with an all encompathing plan and in our report is exactly what we have tried to do it	/media/hugo/Seagate Expansion Drive/ALICE_BACKUP/voshpde/wav_files/zipfiles/20160118.wav	1
16	/media/hugo/Seagate Expansion Drive/ALICE_BACKUP/voshpde/pipeLine/segmentation_wavfiles/20160118/017_20160118.wav	362.5003628117914	15986266	390.6503628117914	17227681	016_20160118	the first line of the operative part of the fact is that solidarity must be the principle upon which any action on migration is bated this must remain at the forefront of our discussions going forward i know we wanted to send out the report sooner but i have no doubt that we will be able to analyse every detail in the coming week and it is based on the working document that we are discussed at length between agh and in the committee	the first line of the operative part of the fact is that solidarity must be the principle upon which any action on migration is bated this must remain at the forefront of our discussions going forward i know we wanted to send out the report sooner but i have no doubt that we will be able to analyse every detail in the coming week and it is based on the working document that we are discussed at length between agh and in the committee	/media/hugo/Seagate Expansion Drive/ALICE_BACKUP/voshpde/wav_files/zipfiles/20160118.wav	0
17	/media/hugo/Seagate Expansion Drive/ALICE_BACKUP/voshpde/pipeLine/segmentation_wavfiles/20160118/018_20160118.wav	390.65038548752835	17227682	414.20038548752837	18266237	017_20160118	the events of the last date have shown ut again that we still need to do more to prevent loss of life at fee people are fill drowning we are calling for a permanent union response in search and rescue operation we acknowledged that frontex and mary operations such as operation sophia have played their part in faving life but we need to go further	the events of the last date have shown ut again that we still need to do more to prevent loss of life at fee people are fill drowning we are calling for a permanent union response in search and rescue operation we acknowledged that frontex and navy operations such as operation sophia have played their part in faving life but we need to go further	/media/hugo/Seagate Expansion Drive/ALICE_BACKUP/voshpde/wav_files/zipfiles/20160118.wav	2
18	/media/hugo/Seagate Expansion Drive/ALICE_BACKUP/voshpde/pipeLine/segmentation_wavfiles/20160118/019_20160118.wav	414.2004081632653	18266238	439.7504081632653	19392993	018_20160118	we also underscore that anyone genuinely helping people in this threat at pa should not be criminalised when it comes to frontex the recently proposed european border and coastguard aimed at replacing the agency and it meant to ensure integrated border management at the external borders with a view to managing migration effectively and ensuring a high level of internal security	we also underscore that anyone genuinely helping people in this threat at pea should not be criminalised when it comes to frontex the recently proposed european border and coastguard aimed at replacing the agency and it meant to ensure integrated border management at the external borders with a view to managing migration effectively and ensuring a high level of internal security	/media/hugo/Seagate Expansion Drive/ALICE_BACKUP/voshpde/wav_files/zipfiles/20160118.wav	1
19	/media/hugo/Seagate Expansion Drive/ALICE_BACKUP/voshpde/pipeLine/segmentation_wavfiles/20160118/020_20160118.wav	439.75043083900226	19392994	457.6004308390023	20180179	019_20160118	any holistic approach to migration must necessarily contain measures aimed at disrupting re activities of criminal networks this is crucial and must be coupled with increased imputansealso to financial investigation tracking and quamflifcating profits	any holistic approach to migration must necessarily contain measures aimed at disrupting re activities of criminal networks this is crucial and must be coupled with increased imputansealso to financial investigation tracking and quamflifcating profits	/media/hugo/Seagate Expansion Drive/ALICE_BACKUP/voshpde/wav_files/zipfiles/20160118.wav	0
20	/media/hugo/Seagate Expansion Drive/ALICE_BACKUP/voshpde/pipeLine/segmentation_wavfiles/20160118/021_20160118.wav	457.60045351473923	20180180	487.15045351473924	21483335	020_20160118	on relocation this is a point we have come back to time and time again if we are a union of shared values we must now become a union of shared responsibility every member state must play its part the establishment of urgent relocation measures if the move in the right direction but the numbers we have ten so far are disappointing state must fulfil their obligations which they agreed to as soon as possible when it comes to resettlement	on relocation this is a point we have come back to time and time again if we are a union of shared values we must now become a union of shared responsibility every member state must play its part the establishment of urgent relocation measures if the move in the right direction but the numbers we have ten so far are disappointing state must fulfil their obligations which they agreed to as soon as possible when it comes to resettlement	/media/hugo/Seagate Expansion Drive/ALICE_BACKUP/voshpde/wav_files/zipfiles/20160118.wav	0
21	/media/hugo/Seagate Expansion Drive/ALICE_BACKUP/voshpde/pipeLine/segmentation_wavfiles/20160118/022_20160118.wav	487.1504761904762	21483336	509.6004761904762	22473381	021_20160118	given the unprecedented flows of migrants that have reached and continue to reach our borders we know that we need a binding legislative approach to resettlement ad in be set out in the commission agenda for migration other legal routes for people in need of protection should also be looked at these include humanitarian vita and humanitarian admission	given the unprecedented flows of migrants that have reached and continue to reach our borders we know that we need a binding legislative approach to resettlement has in be set out in the commissions agenda for migration other legal routes for people in need of protection should also be looked at these include humanitarian vita and humanitarian admission	/media/hugo/Seagate Expansion Drive/ALICE_BACKUP/voshpde/wav_files/zipfiles/20160118.wav	3
22	/media/hugo/Seagate Expansion Drive/ALICE_BACKUP/voshpde/pipeLine/segmentation_wavfiles/20160118/023_20160118.wav	509.6004988662132	22473382	531.4504988662131	23436967	022_20160118	we need these routes if we are to stop people being forth into the hands of traffickers and fating an almost certain debt on our short on border the abolition of internal border controls and schengen has to go hand in hand with strengthening our external borders this is a prerequitet for schengen to be able to function properly	we need these routes if we are to stop people being forth into the hands of traffickers and fating an almost certain debt on our short on border the abolition of internal border controls and schengen has to go hand in hand with strengthening our external borders this is a prerequitet for schengen to be able to function properly	/media/hugo/Seagate Expansion Drive/ALICE_BACKUP/voshpde/wav_files/zipfiles/20160118.wav	0
23	/media/hugo/Seagate Expansion Drive/ALICE_BACKUP/voshpde/pipeLine/segmentation_wavfiles/20160118/024_20160118.wav	531.4505215419501	23436968	548.8005215419502	24202103	023_20160118	in fact the eu need to strengthen its border protection further develop the fee and that more measures are necessary to enhance the capacity of the schengen area in order to address the new challenges path in europe and preserve the fundamental principles of security and free movement of persons	in fact the eu need to strengthen its border protection further develop the fee and that more measures are necessary to enhance the capacity of the schengen area in order to address the new challenges path in europe and preserve the fundamental principles of security and free movement of persons	/media/hugo/Seagate Expansion Drive/ALICE_BACKUP/voshpde/wav_files/zipfiles/20160118.wav	0
24	/media/hugo/Seagate Expansion Drive/ALICE_BACKUP/voshpde/pipeLine/segmentation_wavfiles/20160118/025_20160118.wav	548.800544217687	24202104	567.8505442176871	25042209	024_20160118	everybody must feel safe in aurtity beaten berlin london rome or valetta security feared called by an influx of people exist and fate must fulfil their obligations at the external border if be feared are to be in any way a lad when it comes to integration	everybody must feel safe in aurtity beaten berlin london rome or valetta security feared called by an influx of people exist and fate must fulfil their obligations at the external border if be feared are to be in any way a lad when it comes to integration	/media/hugo/Seagate Expansion Drive/ALICE_BACKUP/voshpde/wav_files/zipfiles/20160118.wav	0
25	/media/hugo/Seagate Expansion Drive/ALICE_BACKUP/voshpde/pipeLine/segmentation_wavfiles/20160118/026_20160118.wav	567.850566893424	25042210	587.4005668934241	25904365	025_20160118	the way forward it thing it at the two way process of course it almost goes without thaying that people granted protection must be given all the right they are entitled to and yet we must do more to keep families together but at the same time it is also fair to expect respect for the values up on which our union is built	the way forward it thing it at the two way process of course it almost goes without thaying that people granted protection must be given all the right they are entitled to and yet we must do more to keep families together but at the same time it is also fair to expect respect for the values up on which our union is built	/media/hugo/Seagate Expansion Drive/ALICE_BACKUP/voshpde/wav_files/zipfiles/20160118.wav	0
26	/media/hugo/Seagate Expansion Drive/ALICE_BACKUP/voshpde/pipeLine/segmentation_wavfiles/20160118/027_20160118.wav	587.400589569161	25904366	611.550589569161	26969381	026_20160118	we go in the report into a lot of detail on the dublin system which i think we can all tape ly they have failed to reach its goals we outline some options which i am hopeful will be useful in the steps of discussions to come not everyone who arrived in europe is eligible for protection we understand that and we understand that the fate return of those who are not eligible must be carried out	we go in the report into a lot of detail on the dublin system which i think we can all tape ly they have failed to reach its goals we outline some options which i am hopeful will be useful in the steps of discussions to come not everyone who arrived in europe is eligible for protection we understand that and we understand that the fate return of those who are not eligible must be carried out	/media/hugo/Seagate Expansion Drive/ALICE_BACKUP/voshpde/wav_files/zipfiles/20160118.wav	0
27	/media/hugo/Seagate Expansion Drive/ALICE_BACKUP/voshpde/pipeLine/segmentation_wavfiles/20160118/028_20160118.wav	611.5506122448979	26969382	639.400612244898	28197567	027_20160118	only thirty six of those who are order to leave the union were actually returned in two thousand and fourteen there is therefore clear need to improve the effectiveness of the unions return system and this is something that simply must be done we acknowledge the recent commission proposed of safe countries of origin if such a union live would become obligatory for member states it could be an important tool to facilitate the asylums process including the return	only thirty six of those who are order to leave the union were actually returned in two thousand and fourteen there is therefore clear need to improve the effectiveness of the unions return system and this is something that simply must be done we acknowledge the recent commission proposed of safe countries of origin if such a union live would become obligatory for member states it could be an important tool to facilitate the asylums process including the return	/media/hugo/Seagate Expansion Drive/ALICE_BACKUP/voshpde/wav_files/zipfiles/20160118.wav	0
