	wavfile	start_seconds	start_frames	end_seconds	end_frames	identifier	inferred_text_with_hotwords	inferred_text_without_hotwords	motherfile	dist
114	/media/hugo/Seagate Expansion Drive/ALICE_BACKUP/voshpde/pipeLine/segmentation_wavfiles/20160118/115_20160118.wav	2535.8025850340136	111828894	2559.0525850340136	112854219	114_20160118	we have still the highly complex body of legislation covering fever hundred pa jet in the official journals around this idea individual life examination and cropedur both for refugees and both in need of peer protection yet one can argue that the very idea of an individual life affectment inadequate to revolve met influx scenario	we have still the highly complex body of legislation covering fever hundred pages in the official journals around this idea individual life examination and cropedur both for refugees and both in need of eri protection yet one can argue that the very idea of an individual life affectment inadequate to revolve met influx scenario	/media/hugo/Seagate Expansion Drive/ALICE_BACKUP/voshpde/wav_files/zipfiles/20160118.wav	6
115	/media/hugo/Seagate Expansion Drive/ALICE_BACKUP/voshpde/pipeLine/segmentation_wavfiles/20160118/116_20160118.wav	2559.0526077097506	112854220	2580.3026077097506	113791345	115_20160118	pofedure to take a lot of time and then require a lot of administrative we thought it at a moment there domestic de are very much and of threat ad if that is correct one way of attracting the current crisis might be to suspend or complement temporary temporarily at least the idea of an individualised affettment	pofedureto take a lot of time and then require a lot of administrative we thought it at a moment there domestic em are very much and of threat and if that is correct one way of attracting the current crisis might be too to spent or complement temporary temporarily at least the idea of an individualised affettment	/media/hugo/Seagate Expansion Drive/ALICE_BACKUP/voshpde/wav_files/zipfiles/20160118.wav	9
116	/media/hugo/Seagate Expansion Drive/ALICE_BACKUP/voshpde/pipeLine/segmentation_wavfiles/20160118/117_20160118.wav	2580.3026303854876	113791346	2607.4526303854877	114988661	116_20160118	by a general life procedure along the lines of the temporary protection directive this solution would be quite radical of course from a legislative ppe point of view and i and than perfectly the doing so would require prire agreement on the dublin problem to any general life out theffment cannot work with without domestic burden sharing	by a general life procedure along the lines of the temporary protection directive this solution would be quite radical of course from a legislative point of view and i and than perfectly the doing so would require prire agreement on the dublin problem to any general life out theffment cannot work with without domestic burden sharing	/media/hugo/Seagate Expansion Drive/ALICE_BACKUP/voshpde/wav_files/zipfiles/20160118.wav	4
117	/media/hugo/Seagate Expansion Drive/ALICE_BACKUP/voshpde/pipeLine/segmentation_wavfiles/20160118/118_20160118.wav	2607.4526530612243	114988662	2629.2026530612243	115947837	117_20160118	eu is very interesting ad thank you fir competing this point as well that its very intestant thank you to colleagues we have twelve colleagues he wish to take a fori i could greatly appreciate if you could to two minutes for a debate that will inform the amendments which again it a tight deadline for the eight eu	is very interesting and thank you fir compreting this point as well that its very intestant thank you to colleagues we have twelve colleagues he wish to take a fori i could greatly appreciate if you could to two minutes for a debate that will inform the amendments which again it a tight deadline for the eight	/media/hugo/Seagate Expansion Drive/ALICE_BACKUP/voshpde/wav_files/zipfiles/20160118.wav	8
118	/media/hugo/Seagate Expansion Drive/ALICE_BACKUP/voshpde/pipeLine/segmentation_wavfiles/20160118/119_20160118.wav	2629.2026757369613	115947838	2648.4526757369613	116796763	118_20160118	tob and eu beginning with our shadows ad the firs shadow is in de speakers ms kilantofrrpresiden	tob and e beginning with our shadows and the firs shadow is in the speakers ms kilantofrrpresiden	/media/hugo/Seagate Expansion Drive/ALICE_BACKUP/voshpde/wav_files/zipfiles/20160118.wav	4
119	/media/hugo/Seagate Expansion Drive/ALICE_BACKUP/voshpde/pipeLine/segmentation_wavfiles/20160118/120_20160118.wav	2648.4526984126983	116796764	2672.2026984126983	117844139	119_20160118	eu first i would like to thank the rapporteur rapporteurs for their report obviously this has been a lot of hard work and a long process to be honest like i have said in the past my first reaction to the report is that it is a missed opportunity in	lage first i would like to thank the rapporteur rapporteurs for their report obviously this has been a lot of hard work and a long process to be honest like i have said in the past my first reaction to the report is that it is a missed opportunity in	/media/hugo/Seagate Expansion Drive/ALICE_BACKUP/voshpde/wav_files/zipfiles/20160118.wav	4
120	/media/hugo/Seagate Expansion Drive/ALICE_BACKUP/voshpde/pipeLine/segmentation_wavfiles/20160118/121_20160118.wav	2672.2027210884353	117844140	2691.7527210884355	118706295	120_20160118	the report duly lift the important principles and makes a number of observations but what this crisis really need is a willingness to do something different and to think a different ree	the report duly lift the important principles and makes a number of observations but what this crisis really need is a willingness to do something different and to think a different ree	/media/hugo/Seagate Expansion Drive/ALICE_BACKUP/voshpde/wav_files/zipfiles/20160118.wav	0
121	/media/hugo/Seagate Expansion Drive/ALICE_BACKUP/voshpde/pipeLine/segmentation_wavfiles/20160118/122_20160118.wav	2691.7527437641725	118706296	2718.9027437641726	119903611	121_20160118	there is very little in this report that is new or that offers alternatives to the problems that are posed to us it is repeating the status quo does not really tackle the problem and the political issues of the day i was hoping to see idea that i could agree or disagree with but i have seen neither actually	there is very little in this report that is new or that offers alternatives to the problems that are posed to us it is repeating the status quo does not really tackle the problem and the political issues of the day i was hoping to see idea that i could agree or disagree with but i have seen neither actually	/media/hugo/Seagate Expansion Drive/ALICE_BACKUP/voshpde/wav_files/zipfiles/20160118.wav	0
122	/media/hugo/Seagate Expansion Drive/ALICE_BACKUP/voshpde/pipeLine/segmentation_wavfiles/20160118/123_20160118.wav	2718.902766439909	119903612	2744.152766439909	121017137	122_20160118	however i hope that the amendment and compromise process going forward between the different political groups will help to add some values and from me de it into this process within the content of this report the politically ad as a union we need to be clear about what we really want	however i hope that the amendment and compromise process going forward between the different political groups will help to add some values and from me idea it into this process within the content of this report the politically and as a union we need to be clear about what we really want	/media/hugo/Seagate Expansion Drive/ALICE_BACKUP/voshpde/wav_files/zipfiles/20160118.wav	3
123	/media/hugo/Seagate Expansion Drive/ALICE_BACKUP/voshpde/pipeLine/segmentation_wavfiles/20160118/124_20160118.wav	2744.152789115646	121017138	2770.1027891156464	122161533	123_20160118	what will the next steps be and how will we achieve them and how will we pay for them now we understand that with with so many political groups involved we need to have a little bit of creativity in compromise and policy making but this is the time that the electorate is looking at us to solve problems and work together in a positive way	what will the next steps be and how will we achieve them and how will we pay for them now we understand that with with so many political groups involved we need to have a little bit of creativity in compromise and policy making but this is the time that the electorate is looking at us to solve problems and work together in a positive way	/media/hugo/Seagate Expansion Drive/ALICE_BACKUP/voshpde/wav_files/zipfiles/20160118.wav	0
124	/media/hugo/Seagate Expansion Drive/ALICE_BACKUP/voshpde/pipeLine/segmentation_wavfiles/20160118/125_20160118.wav	2770.1028117913834	122161534	2799.652811791383	123464689	124_20160118	the report also discuss is legal migration and something that we should see as part of a whole on the discussion on migration of course foreign qualifications and issues related to employment are very important but the crisis that we find ourselves in is not going to be solved through economic or demographic challenges of kader tomorrow	the report also discuss is legal migration and something that we should see as part of a whole on the discussion on migration of course foreign qualifications and issues related to employment are very important but the crisis that we find ourselves in is not going to be solved through economic or demographic challenges of kader tomorrow	/media/hugo/Seagate Expansion Drive/ALICE_BACKUP/voshpde/wav_files/zipfiles/20160118.wav	0
125	/media/hugo/Seagate Expansion Drive/ALICE_BACKUP/voshpde/pipeLine/segmentation_wavfiles/20160118/126_20160118.wav	2799.65283446712	123464690	2816.6028344671204	124212185	125_20160118	the challenge of the migration crisis so legal tools like humanitarian veces and the reaps a code and revision of the blue card system are not the answers that we are looking for i believe that we need to talk about	the challenge of the migration crisis so legal tools like humanitarian veces and the reaps a code and revision of the blue card system are not the answers that we are looking for i believe that we need to talk about	/media/hugo/Seagate Expansion Drive/ALICE_BACKUP/voshpde/wav_files/zipfiles/20160118.wav	0
126	/media/hugo/Seagate Expansion Drive/ALICE_BACKUP/voshpde/pipeLine/segmentation_wavfiles/20160118/127_20160118.wav	2816.602857142857	124212186	2836.152857142857	125074341	126_20160118	asylum in legal migration at two different in separate things when we speak about the blue card and the humanitarian vetos in this context were not really helping that many people were simply rearranging the front chair while the house is un fire	asylum in legal migration at two different in separate things when we speak about the blue card and the humanitarian vetos in this context were not really helping that many people were simply rearranging the front share while the house is un fire	/media/hugo/Seagate Expansion Drive/ALICE_BACKUP/voshpde/wav_files/zipfiles/20160118.wav	3
127	/media/hugo/Seagate Expansion Drive/ALICE_BACKUP/voshpde/pipeLine/segmentation_wavfiles/20160118/128_20160118.wav	2836.152879818594	125074342	2862.7028798185943	126245197	127_20160118	the report does does not look favour a at all forms of push fact but we need to look at a framework for the returns process and how we can help control the flow of afalum seekers in the uk ad in turn we can help the process	the report does does not look favour al at all forms of push fact but we need to look at a framework for the returns process and how we can help control the flow of afalum seekers in the uk and in turn we can help the process	/media/hugo/Seagate Expansion Drive/ALICE_BACKUP/voshpde/wav_files/zipfiles/20160118.wav	2
128	/media/hugo/Seagate Expansion Drive/ALICE_BACKUP/voshpde/pipeLine/segmentation_wavfiles/20160118/129_20160118.wav	2862.7029024943313	126245198	2891.752902494331	127526303	128_20160118	function properly and not have people fall to the correct we need to strengthen our external borders and protect schengen the schengen area ad thin is the concept that i think we all can agree on but it to how that need to be discussed and i have not really found that enter in the report the report talks about the doublinsystem and how in many many ways it does not work but how do we want to change it	function properly and not have people fall to the correct we need to strengthen our external borders and protect schengen the schengen area thin is the concept that i think we all can agree on but it to how that need to be discussed and i have not really found that enter in the report the report talks about the doublinsystem and how in many many ways it does not work but how do we want to change it	/media/hugo/Seagate Expansion Drive/ALICE_BACKUP/voshpde/wav_files/zipfiles/20160118.wav	3
129	/media/hugo/Seagate Expansion Drive/ALICE_BACKUP/voshpde/pipeLine/segmentation_wavfiles/20160118/130_20160118.wav	2891.752925170068	127526304	2913.402925170068	128481069	129_20160118	the how can we change dublin for the better the dublin proposal will will be revived and we need to start to look at alternatives but we cant fee any of that in the report it also says algenalstarttococteletak	the how can we change dublin for the better the dublin proposal will will be revived and we need to start to look at alternatives but we cant fee any of that in the report it also says algenalstarttococlteletak	/media/hugo/Seagate Expansion Drive/ALICE_BACKUP/voshpde/wav_files/zipfiles/20160118.wav	1
130	/media/hugo/Seagate Expansion Drive/ALICE_BACKUP/voshpde/pipeLine/segmentation_wavfiles/20160118/131_20160118.wav	2913.402947845805	128481070	2941.352947845805	129713665	130_20160118	yet we need to cooperate with third countries but let us be honest with ourselves we keep walking away and empty handed ad in all deals with third third countries we cant keep just dishing out money and resources ad without without readmission and agree readmission agreements as i said this	yes we need to cooperate with third countries but let us be honest with ourselves we keep walking away and empty handed and in all deals with third third countries we cant keep just bishing out money and resources and without without readmission and agree readmission agreements as i said this	/media/hugo/Seagate Expansion Drive/ALICE_BACKUP/voshpde/wav_files/zipfiles/20160118.wav	4
131	/media/hugo/Seagate Expansion Drive/ALICE_BACKUP/voshpde/pipeLine/segmentation_wavfiles/20160118/132_20160118.wav	2941.352970521542	129713666	2963.602970521542	130694891	131_20160118	this is a report that i look forward to working with with you all the rapporteurs in the different political groups to see how we can add more meet on the bone and come up with new ideas and new proposals to help shape ad more efficient asylum policy in the eu over the next two years	this is a report that i look forward to working with with you all the rapporteurs in the different political groups to see how we can add more meet on the bone and come up with new ideas and new proposals to help shape a more efficient asylum policy in the eu over the next two years	/media/hugo/Seagate Expansion Drive/ALICE_BACKUP/voshpde/wav_files/zipfiles/20160118.wav	1
132	/media/hugo/Seagate Expansion Drive/ALICE_BACKUP/voshpde/pipeLine/segmentation_wavfiles/20160118/133_20160118.wav	2963.602993197279	130694892	2991.152993197279	131909847	132_20160118	i know i was a bet long but ms very important topic and we have not been able to discuss it in debt really in this committee so thank you for listening thank you very much i do no think anyone is going to be able to discuss in debt but unfortunately we have more more colleagues ad to the list relistivelow close but unfortunately everyone does want to speak understandably ad cat u coming eu just	i know i was a bet long but ms very important topic and we have not been able to discuss it in debt really in this committee so thank you for listening thank you very much i do no think anyone is going to be able to discuss in debt but unfortunately we have more more colleagues adi to the list relistivelow close but unfortunately everyone does want to speak understandably and cap ucomingyetjsjustef	/media/hugo/Seagate Expansion Drive/ALICE_BACKUP/voshpde/wav_files/zipfiles/20160118.wav	10
133	/media/hugo/Seagate Expansion Drive/ALICE_BACKUP/voshpde/pipeLine/segmentation_wavfiles/20160118/134_20160118.wav	2991.1530158730156	131909848	3019.203015873016	133146853	133_20160118	the position were on is that the report s uk about everything and i know multi conscious people have not seen at until now so the position we are in is that in the two minutes so have gard chine tick to the key point that you will be amending a report on i think that is the way to probably approach things everyone knows but everyone want to come it ad every aspect of the report but it just wat t be possible so	the position were on is that the report s ups about everything and i know multi conscious people have not seen at until now so the position we are in is that in the two minutes so have gard chine tick to the key point that you will be amending a report on i think that is the way to probably approach things everyone knows but everyone want to come it and every aspect of the report but it just wat t be possible so	/media/hugo/Seagate Expansion Drive/ALICE_BACKUP/voshpde/wav_files/zipfiles/20160118.wav	3
134	/media/hugo/Seagate Expansion Drive/ALICE_BACKUP/voshpde/pipeLine/segmentation_wavfiles/20160118/135_20160118.wav	3019.203038548753	133146854	3037.5530385487527	133956089	134_20160118	lifted likes the next speaker for the alde group the shadow ismsmsbrekpsmpresident and first of all let me the congratulation to roberta who have her burtdaytoda	lifted likes the next speaker for the alde group the shadow ismsmsbrekpsmpresident and first of all let me the congratulation to roberta who have her burtdaytoda	/media/hugo/Seagate Expansion Drive/ALICE_BACKUP/voshpde/wav_files/zipfiles/20160118.wav	0
135	/media/hugo/Seagate Expansion Drive/ALICE_BACKUP/voshpde/pipeLine/segmentation_wavfiles/20160118/136_20160118.wav	3037.5530612244897	133956090	3065.8030612244897	135201915	135_20160118	being a rapporteur of tac an important file mean that you have accomplished a lot it not a present but i will not give you i will not give you anything difficult today we but i congratulation to the work that you you have done together with with deal kenya if have been	being a rapporteur of tac an important file mean that you have accomplished a lot it not a present but i will not give you i will not give you anything difficult today we but i congratulation to the work that you you have done together with with deal kenya if have been	/media/hugo/Seagate Expansion Drive/ALICE_BACKUP/voshpde/wav_files/zipfiles/20160118.wav	0
136	/media/hugo/Seagate Expansion Drive/ALICE_BACKUP/voshpde/pipeLine/segmentation_wavfiles/20160118/137_20160118.wav	3065.8030839002267	135201916	3090.1530839002266	136275751	136_20160118	ad un eu which o adventure ad unusual ectorsie to actually have this comprehensive report the holistic perspective if not always there but the intention is good and the intention is very good from the both of the rapporteur and i think that what is not there can seem to be be amended into the text and we can have the comprehensive	an unyouwhishyo adventure and unusual ectorsie to actually have this comprehensive report the holistic perspective if not always there but the intention is good and the intention is very good from the both of the rapporteur and i think that what is not there can seem to be be amended into the text and we can have the comprehensive	/media/hugo/Seagate Expansion Drive/ALICE_BACKUP/voshpde/wav_files/zipfiles/20160118.wav	7
137	/media/hugo/Seagate Expansion Drive/ALICE_BACKUP/voshpde/pipeLine/segmentation_wavfiles/20160118/138_20160118.wav	3090.1531065759636	136275752	3108.203106575964	137071757	137_20160118	debate that even is asking for at a later stage but today let be happy that have been a report that is very important that we can discuss and have it at the point of departure also for the future i believe	debate that even is asking for at a later stage but today let be happy that have been a report that is very important that we can discuss and have it at the point of departure also for the future i believe	/media/hugo/Seagate Expansion Drive/ALICE_BACKUP/voshpde/wav_files/zipfiles/20160118.wav	0
138	/media/hugo/Seagate Expansion Drive/ALICE_BACKUP/voshpde/pipeLine/segmentation_wavfiles/20160118/139_20160118.wav	3108.203129251701	137071758	3134.6531292517006	138238203	138_20160118	that we need to address migration as such it is both asylum migration and legal migration and as the situation is so difficult in europe today we tend only to speak about asylum and refugees but we also need to have the other perspective of legal migration and i am happy that that has been included into the text	that we need to address migration as such it is both asylum migration and legal migration and as the situation is so difficult in europe today we tend only to speak about asylum and refugees but we also need to have the other perspective of legal migration and i am happy that that has been included into the text	/media/hugo/Seagate Expansion Drive/ALICE_BACKUP/voshpde/wav_files/zipfiles/20160118.wav	0
139	/media/hugo/Seagate Expansion Drive/ALICE_BACKUP/voshpde/pipeLine/segmentation_wavfiles/20160118/140_20160118.wav	3134.6531519274376	138238204	3162.203151927438	139453159	139_20160118	some one said a union of shared values must be a union or fair responsibility and this is our shortcoming and failure are until now that is why it is so important that the full revision of the dublin that is tended in country of te country let us put it frankly dublin has collapsed completely and need to be replaced it is an instrument for the twenty century	some one said a union of shared values must be a union or fair responsibility and this is our shortcoming and failure are until now that is why it is so important that the full revision of the dublin that is tended in country of te country let us put it frankly dublin has collapsed completely and need to be replaced it is an instrument for the twenty century	/media/hugo/Seagate Expansion Drive/ALICE_BACKUP/voshpde/wav_files/zipfiles/20160118.wav	0
140	/media/hugo/Seagate Expansion Drive/ALICE_BACKUP/voshpde/pipeLine/segmentation_wavfiles/20160118/141_20160118.wav	3162.203174603175	139453160	3187.1531746031746	140553455	140_20160118	we are now in the twenty first century and we need to have a modern flexible instrument that can actually live up to what is demanded in this situation well an enhanced cooperation although if what need to be added into the text an enhanced cooperation not only between member states but also between the eu agencies and the member state	we are now in the twenty first century and we need to have a modern flexible instrument that can actually live up to what is demanded in this situation well an enhanced cooperation although if what need to be added into the text an enhanced cooperation not only between member states but also between the eu agencies and the member state	/media/hugo/Seagate Expansion Drive/ALICE_BACKUP/voshpde/wav_files/zipfiles/20160118.wav	0
141	/media/hugo/Seagate Expansion Drive/ALICE_BACKUP/voshpde/pipeLine/segmentation_wavfiles/20160118/142_20160118.wav	3187.1531972789116	140553456	3216.8031972789117	141861021	141_20160118	where i think they auf to play the key role in to petty building and also when it comes to this care distribution thank you claude for reminding me that my time limit it i think this has been a good exaciseit not by any means he nishl continue and keep up the good work and rebork i have anigtperttheyevening	where i think they out to play the key role in to petty building and also when it comes to this care distribution thank you close for reminding me that my time limit it i think this has been a good exaciseit not by any means he nishl continue and keep up the good work and rebork i have anigtperttheyevening	/media/hugo/Seagate Expansion Drive/ALICE_BACKUP/voshpde/wav_files/zipfiles/20160118.wav	5
142	/media/hugo/Seagate Expansion Drive/ALICE_BACKUP/voshpde/pipeLine/segmentation_wavfiles/20160118/143_20160118.wav	3216.8032199546487	141861022	3232.9532199546484	142573237	142_20160118	m de nl de ignormif you want to ok bit next for the going regueshadowswibenellybarbrm president i would like to thank	madenrydiftinormifyouwanttookvitnext for the going regueshadowswibenellybarbrm president i would like to thank	/media/hugo/Seagate Expansion Drive/ALICE_BACKUP/voshpde/wav_files/zipfiles/20160118.wav	15
143	/media/hugo/Seagate Expansion Drive/ALICE_BACKUP/voshpde/pipeLine/segmentation_wavfiles/20160118/144_20160118.wav	3232.9532426303854	142573238	3262.2032426303854	143863163	143_20160118	i would like to thank start by thanking the po rapporteur ad i would like to thank them for the de b that the have done have to say have read the draft report hugh got it rather late and i would like to say that i have got the certainly partial opinion to certain points i am sure that there is a solid basis from which we can begin and i think that there are very important point ad i think for example the need that you said at you underscore this fact to	i would like to thank start by thanking the po rapporteur and i would like to thank them for the goal that the have done have to say have read the draft report hugh i got it rather late and i would like to say that i have got the certainly partial opinion to certain points i am sure that there is a solid basis from which we can begin and i think that there are very important point i think for example the need that you said at you underscore this fact to	/media/hugo/Seagate Expansion Drive/ALICE_BACKUP/voshpde/wav_files/zipfiles/20160118.wav	10
