	wavfile	start_seconds	start_frames	end_seconds	end_frames	identifier	inferred_text_with_hotwords	inferred_text_without_hotwords	motherfile	dist
183	/media/hugo/Seagate Expansion Drive/ALICE_BACKUP/voshpde/pipeLine/segmentation_wavfiles/2016120802/184_2016120802.wav	4139.854149659864	182567568	4166.304149659864	183734013	183_2016120802	in terms of persons whom they who they meet directly after arrival at disembarkation or when they come to the hotspots aid assessments are being conducted if a person declares to be a child and they are reasons not to not to believe that statement by the authorities they do conductinate assessment but the thirty seven is still prior to the at assessment	in terms of persons whom they who they meet directly after arrival at disembarkation or when they come to the hotspots aid assessments are being conducted if a person declares to be a child and they are reasons not to not to believe that statement by the authorities they do conductinate assessment but the thirty seven is still prior to the at assessment	/media/hugo/Seagate Expansion Drive/ALICE_BACKUP/voshpde/wav_files/zipfiles/2016120802.wav	0
184	/media/hugo/Seagate Expansion Drive/ALICE_BACKUP/voshpde/pipeLine/segmentation_wavfiles/2016120802/185_2016120802.wav	4166.304172335601	183734014	4182.654172335601	184455049	184_2016120802	but i would not say that a number would be significantly lower for the reason that that i stated at the beginning but as i said it it is a bat it point now to the question of ms ms trim regarding regarding	but i would not say that a number would be significantly lower for the reason that that i stated at the beginning but as i said it it is a bat it point now to the question of ms mikstrom regarding regarding	/media/hugo/Seagate Expansion Drive/ALICE_BACKUP/voshpde/wav_files/zipfiles/2016120802.wav	4
185	/media/hugo/Seagate Expansion Drive/ALICE_BACKUP/voshpde/pipeLine/segmentation_wavfiles/2016120802/186_2016120802.wav	4182.654195011338	184455050	4209.904195011338	185656775	185_2016120802	children are men in a way all the questions that you have asked relate to the situation of children which really shows that that you feel a very much you feel very strongly about about the gravity of this issue first all thank you for the support for the work for for the work of the agency in this regard and as the ongoing missing i just had the opportunity not so long ago to speak to europe or colleagues on this issue and they said that ten zero is a very conservative estimate	children are men in a way all the questions that you have asked relate to the situation of children which really shows that that you feel a very much you feel very strongly about about the gravity of this issue first all thank you for the support for the work for for the work of the agency in this regard and as the ongoing missing i just had the opportunity not so long ago to speak to europe or colleagues on this issue and they said that ten zero is a very conservative estimate	/media/hugo/Seagate Expansion Drive/ALICE_BACKUP/voshpde/wav_files/zipfiles/2016120802.wav	0
186	/media/hugo/Seagate Expansion Drive/ALICE_BACKUP/voshpde/pipeLine/segmentation_wavfiles/2016120802/187_2016120802.wav	4209.904217687074	185656776	4227.054217687075	186413091	186_2016120802	the number is in fact mit higher it is a multiple of that but the figures simply are not an of there they do not exist eu so that it soul addetainefor no reason that that nobody is taken into account their vulnerabilities well	the number is in fact mit higher it is a multiple of that but the figures simply are not an of there they do not exist so that it soul addetainefor no reason that that nobody is taken into account their vulnerabilities well	/media/hugo/Seagate Expansion Drive/ALICE_BACKUP/voshpde/wav_files/zipfiles/2016120802.wav	3
187	/media/hugo/Seagate Expansion Drive/ALICE_BACKUP/voshpde/pipeLine/segmentation_wavfiles/2016120802/188_2016120802.wav	4227.0542403628115	186413092	4248.204240362812	187345807	187_2016120802	one of the sad points is of course that the authorities believe that they are detaining which child for a good reason for their protection because they do not have other tools at their disposal at that give the moment so it is not necessarily an issue related to the management of individual hotspots	one of the sad points is of course that the authorities believe that they are detaining which child for a good reason for their protection because they do not have other tools at their disposal at that give the moment so it is not necessarily an issue related to the management of individual hotspots	/media/hugo/Seagate Expansion Drive/ALICE_BACKUP/voshpde/wav_files/zipfiles/2016120802.wav	0
188	/media/hugo/Seagate Expansion Drive/ALICE_BACKUP/voshpde/pipeLine/segmentation_wavfiles/2016120802/189_2016120802.wav	4248.204263038549	187345808	4271.054263038549	188353493	188_2016120802	but more of the capacity at the national level to transfer the children somewhere else of course whether the camp commander the head of the authority running running the huts put decides to impose protective custody on the children or not it is in a way a risk that they take on their own they are wang wang the risks of risking the children from going missing or risking the child going missing on the one hand	but more of the capacity at the national level to transfer the children somewhere else of course whether the camp commander the head of the authority running running the huts put decides to impose protective custody on the children or not it is in a way a risk that they take on their own they are wang wang the risks of risking the children from going missing or risking the child going missing on the one hand	/media/hugo/Seagate Expansion Drive/ALICE_BACKUP/voshpde/wav_files/zipfiles/2016120802.wav	0
189	/media/hugo/Seagate Expansion Drive/ALICE_BACKUP/voshpde/pipeLine/segmentation_wavfiles/2016120802/190_2016120802.wav	4271.0542857142855	188353494	4296.604285714286	189480249	189_2016120802	and depriving them of their depriving them of their liberty so this is a very much a balancing act than unfortunately should not should not take place at all under ideal conditions now of course the reason why as you said may should not try to escape ii that they do not want to face these conditions and they also want to move onwards per have not just within greece or italy but but to other member states as we know	and depriving them of their depriving them of their liberty so this is a very much a balancing act than unfortunately should not should not take place at all under ideal conditions now of course the reason why as you said may should not try to escape is that they do not want to face these conditions and they also want to move onwards per have not just within greece or italy but but to other member states as we know	/media/hugo/Seagate Expansion Drive/ALICE_BACKUP/voshpde/wav_files/zipfiles/2016120802.wav	1
190	/media/hugo/Seagate Expansion Drive/ALICE_BACKUP/voshpde/pipeLine/segmentation_wavfiles/2016120802/191_2016120802.wav	4296.604308390023	189480250	4316.254308390023	190346815	190_2016120802	but this is not something that should be resolved in this manner and of course as you said it is very much an issue of the reception standards in some of the hotspots the standards are not sufficient to ensure to ensure the wellbeing of the children and certainly not for a period of several months	but this is not something that should be resolved in this manner and of course as you said it is very much an issue of the reception standards in some of the hotspots the standards are not sufficient to ensure to ensure the wellbeing of the children and certainly not for a period of several months	/media/hugo/Seagate Expansion Drive/ALICE_BACKUP/voshpde/wav_files/zipfiles/2016120802.wav	0
191	/media/hugo/Seagate Expansion Drive/ALICE_BACKUP/voshpde/pipeLine/segmentation_wavfiles/2016120802/192_2016120802.wav	4316.254331065759	190346816	4333.60433106576	191111951	191_2016120802	which is an issue that several of you have flaged here so enhancing reception standards leads to an am getting getting party to the questions asked by by ms la esta increasing the reception standards needs to be one of the one of the steps of course the other step	which is an issue that several of you have flaged here so enhancing reception standards leads to an am getting getting party to the questions asked by by milawestan increasing the reception standards needs to be one of the one of the steps of course the other step	/media/hugo/Seagate Expansion Drive/ALICE_BACKUP/voshpde/wav_files/zipfiles/2016120802.wav	4
192	/media/hugo/Seagate Expansion Drive/ALICE_BACKUP/voshpde/pipeLine/segmentation_wavfiles/2016120802/193_2016120802.wav	4333.604353741496	191111952	4356.854353741496	192137277	192_2016120802	by the way this includes of course of course deploying sufficient child protection staff which is something that i repeat again is just not not given some of the hotspots and then outside of the hotspot so at the national level but also supported by by of course the eu as much as possible is the question of on the one hand ensuring that	by the way this includes of course of course deploying sufficient child protection staff which is something that i repeat again is just not not given some of the hotspots and then outside of the hotspot so at the national level but also supported by by of course the eu as much as possible is the question of on the one hand ensuring that	/media/hugo/Seagate Expansion Drive/ALICE_BACKUP/voshpde/wav_files/zipfiles/2016120802.wav	0
193	/media/hugo/Seagate Expansion Drive/ALICE_BACKUP/voshpde/pipeLine/segmentation_wavfiles/2016120802/194_2016120802.wav	4356.854376417234	192137278	4373.904376417234	192889183	193_2016120802	the children do not stay in the hotspotforlonger are necessary so that so that children especially unaccompanied on our prioritised when it comes to the asylum procedures so that they have an opportunity to move out of he hotspot as well as making sure that the currently	the children do not stay in the hotspotforlonger are necessary so that so that children especially unaccompanied on our prioritised when it comes to the asylum procedures so that they have an opportunity to move out of he hotspot as well as making sure that the currently	/media/hugo/Seagate Expansion Drive/ALICE_BACKUP/voshpde/wav_files/zipfiles/2016120802.wav	0
194	/media/hugo/Seagate Expansion Drive/ALICE_BACKUP/voshpde/pipeLine/segmentation_wavfiles/2016120802/195_2016120802.wav	4373.90439909297	192889184	4390.554399092971	193623449	194_2016120802	in efficient systems transferring the children to appropriate facilities on the mainline or out of the hotspots basically that these systems are implimate more robust that they are supported that their capacities increased	in efficient systems transferring the children to appropriate facilities on the mainline or out of the hotspots basically that these systems are implimate more robust that they are supported that their capacities increased	/media/hugo/Seagate Expansion Drive/ALICE_BACKUP/voshpde/wav_files/zipfiles/2016120802.wav	0
195	/media/hugo/Seagate Expansion Drive/ALICE_BACKUP/voshpde/pipeLine/segmentation_wavfiles/2016120802/196_2016120802.wav	4390.5544217687075	193623450	4418.404421768708	194851635	195_2016120802	of course and that is something that always has to be added not at the expense of the quality of the care they offer you can always place twice as many children in the same building if you ally try but the point is to create the capacities in a way that that it is not at the detriment of there well big and the best interest of the child now you said that child rights are universal de you said that what is happening what is happening needs to be somehow	of course and that is something that always has to be added not at the expense of the quality of the care they offer you can always place twice as many children in the same building if you ally try but the point is to create the capacities in a way that that it is not at the detriment of there well being and the best interest of the child now you said that child rights are universal indeed you said that what is happening what is happening needs to be somehow	/media/hugo/Seagate Expansion Drive/ALICE_BACKUP/voshpde/wav_files/zipfiles/2016120802.wav	6
196	/media/hugo/Seagate Expansion Drive/ALICE_BACKUP/voshpde/pipeLine/segmentation_wavfiles/2016120802/197_2016120802.wav	4418.404444444444	194851636	4443.054444444444	195938701	196_2016120802	qualified a quantyfitrather in terms of how how urgent were the response needs to be well in this case as soon as possible is for have the most appropriate answer ii can give you sme of the issues are more burning some of them can be taken care off directly at the hotspots level some of them cannot some of them rely require a considered action at the level of individual hotspots at the national level so about the governments	qualified a quantyfitrather in terms of how how urgent were the response needs to be well in this case as soon as possible is for have the most appropriate answer i can give you some of the issues are more burning some of them can be taken care off directly at the hotspots level some of them cannot some of them rely require a considered action at the level of individual hotspots at the national level so about the governments	/media/hugo/Seagate Expansion Drive/ALICE_BACKUP/voshpde/wav_files/zipfiles/2016120802.wav	2
197	/media/hugo/Seagate Expansion Drive/ALICE_BACKUP/voshpde/pipeLine/segmentation_wavfiles/2016120802/198_2016120802.wav	4443.0544671201815	195938702	4463.3044671201815	196831727	197_2016120802	and by the support that the european union is giving giving to that there is no ideal solution but when it comes to children rights and of course this needs to be a priority because because we are indeed seeing people young people children in the hot puts who have been	and by the support that the european union is giving giving to that there is no ideal solution but when it comes to children rights and of course this needs to be a priority because because we are indeed seeing people young people children in the hot puts who have been	/media/hugo/Seagate Expansion Drive/ALICE_BACKUP/voshpde/wav_files/zipfiles/2016120802.wav	0
198	/media/hugo/Seagate Expansion Drive/ALICE_BACKUP/voshpde/pipeLine/segmentation_wavfiles/2016120802/199_2016120802.wav	4463.304489795918	196831728	4485.954489795919	197830593	198_2016120802	fleeing we have been fleeing war we have been out of the education system have been town out of a family environment often four years and what they encounter in europe is than perhaps not exactly the way that europe wants to be and it is very very statement but i think i can i can i can say here is perhaps not the way that europe wants to be rembered in the future	fleeing we have been fleeing war we have been out of the education system have been town out of a family environment often four years and what they encounter in europe is than perhaps not exactly the way that europe wants to be and it is very very statement but i think i can i can i can say here is perhaps not the way that europe wants to be rembered in the future	/media/hugo/Seagate Expansion Drive/ALICE_BACKUP/voshpde/wav_files/zipfiles/2016120802.wav	0
199	/media/hugo/Seagate Expansion Drive/ALICE_BACKUP/voshpde/pipeLine/segmentation_wavfiles/2016120802/200_2016120802.wav	4485.954512471655	197830594	4515.504512471655	199133749	199_2016120802	not for the treatment like this offer two people fleeing war and persecution so very in mind the limitations which are of course there we very much we very much urge all the actors involved to try to do more and do it better knowing that a lot of positive for has been already done and taken but more should more should follow and as to the question as the question of the victims directed before i get back to your question	not for the treatment like this offer two people fleeing war and persecution so very in mind the limitations which are of course there we very much we very much urge all the actors involved to try to do more and do it better knowing that a lot of positive for has been already done and taken but more should more should follow and as to the question as the question of the victims directed before i get back to your question	/media/hugo/Seagate Expansion Drive/ALICE_BACKUP/voshpde/wav_files/zipfiles/2016120802.wav	0
200	/media/hugo/Seagate Expansion Drive/ALICE_BACKUP/voshpde/pipeLine/segmentation_wavfiles/2016120802/201_2016120802.wav	4515.504535147393	199133750	4542.654535147392	200331065	200_2016120802	and to ms la just we are dealing to that you know that fra has de what a lot of work on victims rights we have looked in detail the implementation of the vctims directive as well in the last in the recent years but this is of course something that is quite difficult to judge in the context of the hotspots and quite honestly this is a stage to which most of the procedures do not even get to	and to ms just we are dealing to that you know that far has don what a lot of work on victims rights we have looked in detail the implementation of the vctims directive as well in the last in the recent years but this is of course something that is quite difficult to judge in the context of the hotspots and quite honestly this is a stage to which most of the procedures do not even get to	/media/hugo/Seagate Expansion Drive/ALICE_BACKUP/voshpde/wav_files/zipfiles/2016120802.wav	7
201	/media/hugo/Seagate Expansion Drive/ALICE_BACKUP/voshpde/pipeLine/segmentation_wavfiles/2016120802/202_2016120802.wav	4542.654557823129	200331066	4560.404557823129	201113841	201_2016120802	because either the people do not report to any any violence or ana crime that has been inflicted upon them or there are sud groaning protection issues that these these things if at or would be dealt with after the persons la the host put because	because either the people do not report to any any violence or an a crime that has been inflicted upon them or there are sud groaning protection issues that these these things if at or would be dealt with after the persons ly the hosputbecause	/media/hugo/Seagate Expansion Drive/ALICE_BACKUP/voshpde/wav_files/zipfiles/2016120802.wav	5
202	/media/hugo/Seagate Expansion Drive/ALICE_BACKUP/voshpde/pipeLine/segmentation_wavfiles/2016120802/203_2016120802.wav	4560.404580498866	201113842	4587.254580498866	202297927	202_2016120802	this is simply not the priority helping victims is a priority to some extent but it is a very much work of nongovernmental actors la voluntary s voluntary organisations and at present despite the efforts of national bodies as well as the eu bodies this is something that simply does not necessarily come first	this is simply not the priority helping victims is a priority to some extent but it is a very much work of nongovernmental actors v volunteres voluntary organisations and at present despite the efforts of national bodies as well as the eu bodies this is something that simply does not necessarily come first	/media/hugo/Seagate Expansion Drive/ALICE_BACKUP/voshpde/wav_files/zipfiles/2016120802.wav	5
203	/media/hugo/Seagate Expansion Drive/ALICE_BACKUP/voshpde/pipeLine/segmentation_wavfiles/2016120802/204_2016120802.wav	4587.254603174603	202297928	4610.404603174603	203318843	203_2016120802	and now to to the questions regarding regarding the trafficking and the violence coming about traffickers ms we are aware of of these reports we have not look in detail into them because because this is something that	and now to to the questions regarding regarding the trafficking and the violence coming about traffickers mr we are aware of of these reports we have not look in detail into them because because this is something that	/media/hugo/Seagate Expansion Drive/ALICE_BACKUP/voshpde/wav_files/zipfiles/2016120802.wav	1
204	/media/hugo/Seagate Expansion Drive/ALICE_BACKUP/voshpde/pipeLine/segmentation_wavfiles/2016120802/205_2016120802.wav	4610.40462585034	203318844	4630.454625850341	204203049	204_2016120802	requires more than just a simple le briefly go analysis and and simply saying that the situation is appalling which of course this we understand that combating trafficking human beings needs to be	requires more than just a simple le breeflygo analysis and and simply saying that the situation is appalling which of course this we understand that combating trafficking human beings needs to be	/media/hugo/Seagate Expansion Drive/ALICE_BACKUP/voshpde/wav_files/zipfiles/2016120802.wav	2
205	/media/hugo/Seagate Expansion Drive/ALICE_BACKUP/voshpde/pipeLine/segmentation_wavfiles/2016120802/206_2016120802.wav	4630.454648526077	204203050	4659.404648526077	205479745	205_2016120802	one of the priorities coming hand in hand with resolving the other tears of the migration situation as to as to whether we have seen evidence directly in the hotspots of this we have not but but indeed europol would eu be better better body to better but it to respond to that your por is to our knowledge trying to allow the national authorities the cooperation depends very much on	one of the priorities coming hand in hand with resolving the other tears of the migration situation as to as to whether we have seen evidence directly in the hotspots of this we have not but but indeed europol would be be better better body to better but it to respond to that your por is to our knowledge trying to allow the national authorities the cooperation depends very much on	/media/hugo/Seagate Expansion Drive/ALICE_BACKUP/voshpde/wav_files/zipfiles/2016120802.wav	2
206	/media/hugo/Seagate Expansion Drive/ALICE_BACKUP/voshpde/pipeLine/segmentation_wavfiles/2016120802/207_2016120802.wav	4659.404671201814	205479746	4685.654671201814	206637371	206_2016120802	the ability of national authorities to respond quickly enough because what we have seen is that people who are obviously vulnerable and addetected as such in the hotspots sadinly disappear from the hotspot and they are no longer to be found i mention the cases of the nigerians for example of women traffic inter op specifically for the purposes of sexual exploitation but the s audo the only ones	the ability of national authorities to respond quickly enough because what we have seen is that people who are obviously vulnerable and addetected as such in the hotspots sadinly disappear from the hotspot and they are no longer to be found i mention the cases of the nigerians for example of women traffic inter op specifically for the purposes of sexual exploitation but the s ondo the only ones	/media/hugo/Seagate Expansion Drive/ALICE_BACKUP/voshpde/wav_files/zipfiles/2016120802.wav	2
207	/media/hugo/Seagate Expansion Drive/ALICE_BACKUP/voshpde/pipeLine/segmentation_wavfiles/2016120802/208_2016120802.wav	4685.654693877551	206637372	4709.604693877551	207693567	207_2016120802	as we have a report of of other situations like that but we have no specfic evidence of our selves on that and now to the question ms sippel this really goes partly into the direction of my colleagues presentation on on the dublin at the same time i trust that i can still say that	as we have a report of of other situations like that but we have no specfic evidence of our selves on that and now to the question is cipplewell this really goes partly into the direction of my colleagues presentation on on the dublin at the same time i trust that i can still say that	/media/hugo/Seagate Expansion Drive/ALICE_BACKUP/voshpde/wav_files/zipfiles/2016120802.wav	6
208	/media/hugo/Seagate Expansion Drive/ALICE_BACKUP/voshpde/pipeLine/segmentation_wavfiles/2016120802/209_2016120802.wav	4709.604716553288	207693568	4739.354716553288	209005543	208_2016120802	most eu member states still consider dublin returns to greece something in light of the past rulings of the court and so on of something that should be avoided and we hope that until situation in greece changes and until indeed the burden which we is currently facing is reduced this would not hopefully become become practice	most eu member states still consider dublin returns to greece something in light of the past rulings of the court and so on of something that should be avoided and we hope that until situation in greece changes and until indeed the burden which we is currently facing is reduced this would not hopefully become become practice	/media/hugo/Seagate Expansion Drive/ALICE_BACKUP/voshpde/wav_files/zipfiles/2016120802.wav	0
209	/media/hugo/Seagate Expansion Drive/ALICE_BACKUP/voshpde/pipeLine/segmentation_wavfiles/2016120802/210_2016120802.wav	4739.354739229025	209005544	4765.304739229025	210149939	209_2016120802	mr president i can only speak from the foment fits points of agency holds in this regard but of course you la very much thank you very much i think ms sippel question also go into the next the report i think we we do have time and ms winberg has asked for the fors so please go ahead	mr preside i can only speak from the foment fits points of agency holds in this regard but of course you wlfmetnverymucthank you very much i think mrs sipls question also go into the next the report i think we we do have time and mrs winberg has asked for the fors so please go ahead	/media/hugo/Seagate Expansion Drive/ALICE_BACKUP/voshpde/wav_files/zipfiles/2016120802.wav	16
