	wavfile	start_seconds	start_frames	end_seconds	end_frames	identifier	inferred_text_with_hotwords	inferred_text_without_hotwords	motherfile	dist
301	/media/hugo/Seagate Expansion Drive/ALICE_BACKUP/voshpde/pipeLine/segmentation_wavfiles/2016120802/302_2016120802.wav	6812.356825396825	300424936	6836.806825396826	301503181	301_2016120802	and again i repeat we ask for this and i think i want to thank you both for the very high quality response but also your engagement with the committee following what was a very good two big pieces of work obviously of a very different nature because in the second when you had a text here you are working to a text and i think the rapporteur will really benefit also in the second one	and again i repeat we ask for this and i think i want to thank you both for the very high quality response but also your engagement with the committee following what was a very good two bid pieces of work obviously of a very different nature because in the second when you had a text here you are working to a text and i think the rapporteur will really benefit also in the second one	/media/hugo/Seagate Expansion Drive/ALICE_BACKUP/voshpde/wav_files/zipfiles/2016120802.wav	1
302	/media/hugo/Seagate Expansion Drive/ALICE_BACKUP/voshpde/pipeLine/segmentation_wavfiles/2016120802/303_2016120802.wav	6836.806848072562	301503182	6864.156848072563	302709317	302_2016120802	so i want to really thank the members who were here and who engaged with these really important opinions we ask for them and with end we should be here to to engage so thank you very much to both of our colleagues from the fundamental rights agency and we look forward to make eu some use of these reports these opinions thank you very much thank you colleagues	so i want to really thank the members who were here and who engaged with these really important opinions we ask for them and with end we should be here to to engage so thank you very much to both of our colleagues from the fundamental rights agency and we look forward to make it some use of these reports these opinions thank you very much thank you colleagues	/media/hugo/Seagate Expansion Drive/ALICE_BACKUP/voshpde/wav_files/zipfiles/2016120802.wav	2
303	/media/hugo/Seagate Expansion Drive/ALICE_BACKUP/voshpde/pipeLine/segmentation_wavfiles/2016120802/304_2016120802.wav	6864.156870748299	302709318	6881.606870748299	303478863	303_2016120802	de colleagues will have the vote set it leben	colleagues will have the vote set it leben	/media/hugo/Seagate Expansion Drive/ALICE_BACKUP/voshpde/wav_files/zipfiles/2016120802.wav	3
304	/media/hugo/Seagate Expansion Drive/ALICE_BACKUP/voshpde/pipeLine/segmentation_wavfiles/2016120802/305_2016120802.wav	6881.606893424037	303478864	6909.656893424036	304715869	304_2016120802	ii		/media/hugo/Seagate Expansion Drive/ALICE_BACKUP/voshpde/wav_files/zipfiles/2016120802.wav	2
305	/media/hugo/Seagate Expansion Drive/ALICE_BACKUP/voshpde/pipeLine/segmentation_wavfiles/2016120802/306_2016120802.wav	6909.656916099773	304715870	6925.006916099774	305392805	305_2016120802			/media/hugo/Seagate Expansion Drive/ALICE_BACKUP/voshpde/wav_files/zipfiles/2016120802.wav	0
306	/media/hugo/Seagate Expansion Drive/ALICE_BACKUP/voshpde/pipeLine/segmentation_wavfiles/2016120802/307_2016120802.wav	6925.00693877551	305392806	6946.356938775511	306334341	306_2016120802	eu		/media/hugo/Seagate Expansion Drive/ALICE_BACKUP/voshpde/wav_files/zipfiles/2016120802.wav	2
307	/media/hugo/Seagate Expansion Drive/ALICE_BACKUP/voshpde/pipeLine/segmentation_wavfiles/2016120802/308_2016120802.wav	6946.356961451247	306334342	6974.906961451247	307593397	307_2016120802	ana	a	/media/hugo/Seagate Expansion Drive/ALICE_BACKUP/voshpde/wav_files/zipfiles/2016120802.wav	2
308	/media/hugo/Seagate Expansion Drive/ALICE_BACKUP/voshpde/pipeLine/segmentation_wavfiles/2016120802/309_2016120802.wav	6974.906984126984	307593398	6990.556984126984	308283563	308_2016120802	eu		/media/hugo/Seagate Expansion Drive/ALICE_BACKUP/voshpde/wav_files/zipfiles/2016120802.wav	2
309	/media/hugo/Seagate Expansion Drive/ALICE_BACKUP/voshpde/pipeLine/segmentation_wavfiles/2016120802/310_2016120802.wav	6990.557006802721	308283564	7007.2070068027215	309017829	309_2016120802	eu eu		/media/hugo/Seagate Expansion Drive/ALICE_BACKUP/voshpde/wav_files/zipfiles/2016120802.wav	5
310	/media/hugo/Seagate Expansion Drive/ALICE_BACKUP/voshpde/pipeLine/segmentation_wavfiles/2016120802/311_2016120802.wav	7007.207029478458	309017830	7028.257029478458	309946135	310_2016120802	eu eu eu eu eu la eu eu ii la	o o o o on o o i	/media/hugo/Seagate Expansion Drive/ALICE_BACKUP/voshpde/wav_files/zipfiles/2016120802.wav	21
311	/media/hugo/Seagate Expansion Drive/ALICE_BACKUP/voshpde/pipeLine/segmentation_wavfiles/2016120802/312_2016120802.wav	7028.257052154195	309946136	7043.507052154195	310618661	311_2016120802	eu		/media/hugo/Seagate Expansion Drive/ALICE_BACKUP/voshpde/wav_files/zipfiles/2016120802.wav	2
312	/media/hugo/Seagate Expansion Drive/ALICE_BACKUP/voshpde/pipeLine/segmentation_wavfiles/2016120802/313_2016120802.wav	7043.507074829932	310618662	7073.157074829932	311926227	312_2016120802	eu eu	e	/media/hugo/Seagate Expansion Drive/ALICE_BACKUP/voshpde/wav_files/zipfiles/2016120802.wav	4
313	/media/hugo/Seagate Expansion Drive/ALICE_BACKUP/voshpde/pipeLine/segmentation_wavfiles/2016120802/314_2016120802.wav	7073.157097505669	311926228	7099.907097505669	313105903	313_2016120802	eu eu eu eu ms eu eu la eu eu there eu eu la la la	i e e there e e	/media/hugo/Seagate Expansion Drive/ALICE_BACKUP/voshpde/wav_files/zipfiles/2016120802.wav	36
314	/media/hugo/Seagate Expansion Drive/ALICE_BACKUP/voshpde/pipeLine/segmentation_wavfiles/2016120802/315_2016120802.wav	7099.907120181406	313105904	7129.257120181406	314400239	314_2016120802	your stet	yoursntteei	/media/hugo/Seagate Expansion Drive/ALICE_BACKUP/voshpde/wav_files/zipfiles/2016120802.wav	5
315	/media/hugo/Seagate Expansion Drive/ALICE_BACKUP/voshpde/pipeLine/segmentation_wavfiles/2016120802/316_2016120802.wav	7129.257142857143	314400240	7156.407142857143	315597555	315_2016120802	mpreseeages begins to take your seeks please we want to begin on time	mpreseeages begins to take your seeks please we want to begin on time	/media/hugo/Seagate Expansion Drive/ALICE_BACKUP/voshpde/wav_files/zipfiles/2016120802.wav	0
316	/media/hugo/Seagate Expansion Drive/ALICE_BACKUP/voshpde/pipeLine/segmentation_wavfiles/2016120802/317_2016120802.wav	7156.40716553288	315597556	7175.65716553288	316446481	316_2016120802	eu eu	or	/media/hugo/Seagate Expansion Drive/ALICE_BACKUP/voshpde/wav_files/zipfiles/2016120802.wav	5
317	/media/hugo/Seagate Expansion Drive/ALICE_BACKUP/voshpde/pipeLine/segmentation_wavfiles/2016120802/318_2016120802.wav	7175.657188208616	316446482	7203.107188208617	317657027	317_2016120802	eu eu eu eu la eu	i	/media/hugo/Seagate Expansion Drive/ALICE_BACKUP/voshpde/wav_files/zipfiles/2016120802.wav	17
318	/media/hugo/Seagate Expansion Drive/ALICE_BACKUP/voshpde/pipeLine/segmentation_wavfiles/2016120802/319_2016120802.wav	7203.107210884354	317657028	7224.757210884353	318611793	318_2016120802	colleagues please take your seats we can begin	colleagues please take your seats we can begin	/media/hugo/Seagate Expansion Drive/ALICE_BACKUP/voshpde/wav_files/zipfiles/2016120802.wav	0
319	/media/hugo/Seagate Expansion Drive/ALICE_BACKUP/voshpde/pipeLine/segmentation_wavfiles/2016120802/320_2016120802.wav	7224.757233560091	318611794	7253.90723356009	319897309	319_2016120802	ms de la we begin with seven the european union agency for asylum the vote on the opening of the interinstitutional negotiations and the negotiating team	mr identoleswe begin with seven the european union agency for asylum the vote on the opening of the interinstitutional negotiations and the negotiating team	/media/hugo/Seagate Expansion Drive/ALICE_BACKUP/voshpde/wav_files/zipfiles/2016120802.wav	7
320	/media/hugo/Seagate Expansion Drive/ALICE_BACKUP/voshpde/pipeLine/segmentation_wavfiles/2016120802/321_2016120802.wav	7253.907256235828	319897310	7280.257256235827	321059345	320_2016120802	mr president that got your attention president la the voting this morning will be roughly for your planning transport arrangements would be roughly about one hour fifteen minutes but if we are careful we can go faster has everyone got their voting cards has anyone not got their voting card if the want to indicate now	mr president that got your attention president the voting this morning will be roughly for your planning transport arrangements would be roughly about one hour fifteen minutes but if we are careful we can go faster has everyone got their voting cards has anyone not got their voting card if the want to indicate now	/media/hugo/Seagate Expansion Drive/ALICE_BACKUP/voshpde/wav_files/zipfiles/2016120802.wav	3
321	/media/hugo/Seagate Expansion Drive/ALICE_BACKUP/voshpde/pipeLine/segmentation_wavfiles/2016120802/322_2016120802.wav	7280.257278911565	321059346	7303.307278911565	322075851	321_2016120802	ok so everyone has to has their voting card we begin on the first file the european union agency for asylum just make two quick allouncements before we move to the vote and i call on mr niedermuller first of all that ms matera with through her co signature from amendment five seven two and ms vusemberg	ok so everyone has to has their voting card we begin on the first file the european union agency for asylum just make two quick allouncements before we move to the vote and i call on mr nider miller first of all that ms matera with through her co signature from amendment five seven two and ms vusemberg	/media/hugo/Seagate Expansion Drive/ALICE_BACKUP/voshpde/wav_files/zipfiles/2016120802.wav	3
322	/media/hugo/Seagate Expansion Drive/ALICE_BACKUP/voshpde/pipeLine/segmentation_wavfiles/2016120802/323_2016120802.wav	7303.3073015873015	322075852	7330.0573015873015	323255527	322_2016120802	cost signed the following amendments i need to read this out two three nine to six one to seven four three five five four of seven forty six for three eight for for three fo for six six for ato for three four nine o for nine three five year for five to two five to eight five to nine five seven eight five nine nine six for six or five six five three six five for six seven seven six eight four	cost signed the following amendments i need to read this out two three nine to six one to seven four three five five four of seven forty six for three eight for for three foufor six six for ato for three four nine o for nine three five year for five to two five to eight five to nine five seven eight five nine nine six for six or five six five three six five for six seven seven six eight four	/media/hugo/Seagate Expansion Drive/ALICE_BACKUP/voshpde/wav_files/zipfiles/2016120802.wav	1
323	/media/hugo/Seagate Expansion Drive/ALICE_BACKUP/voshpde/pipeLine/segmentation_wavfiles/2016120802/324_2016120802.wav	7330.057324263039	323255528	7354.307324263039	324324953	323_2016120802	des the rapporteur ms nile miller wish to take before before we move to the van mr president or to s all amour first of all i would like to thank really really thank to my shadow colleagues because we had i think so a really cooperative at friendly atmosphere to work on this report and it was really a pleasure to to work together with my colleagues	as the rapporteur mr nile miller wish to take before before we move to the vote ankr president or to s all amour first of all i would like to thank really really thank to my shadow colleagues because we had i think so a really cooperative at friendly atmosphere to work on this report and it was really a pleasure to to work together with my colleagues	/media/hugo/Seagate Expansion Drive/ALICE_BACKUP/voshpde/wav_files/zipfiles/2016120802.wav	9
324	/media/hugo/Seagate Expansion Drive/ALICE_BACKUP/voshpde/pipeLine/segmentation_wavfiles/2016120802/325_2016120802.wav	7354.3073469387755	324324954	7377.5573469387755	325350279	324_2016120802	at the same time i have to thank really to my assistance and to the secretary ad because they were des who who really made the hard and excellent job thank you so much for all of you lo me to make a technical remark there is a technical adjustment on compromise twenty six article thirty five	at the same time i have to thank really to my assistance and to the secretary ad because they were these who who really made the hard and excellent job thank you so much for all of you lo me to make a technical remark there is a technical adjustment on compromise twenty six article thirty five	/media/hugo/Seagate Expansion Drive/ALICE_BACKUP/voshpde/wav_files/zipfiles/2016120802.wav	3
325	/media/hugo/Seagate Expansion Drive/ALICE_BACKUP/voshpde/pipeLine/segmentation_wavfiles/2016120802/326_2016120802.wav	7377.557369614512	325350280	7396.807369614512	326199205	325_2016120802	which was agreed among the shadows and was accidentally not reflected in the latest compromise version on paragraph four on article thirty five the last sentence should be delated for treaty understanding this sentence is the following	which was agreed among the shadows and was accidentally not reflected in the latest compromise version on paragraph four on article thirty five the last sentence should be delated for treaty understanding this sentence is the following	/media/hugo/Seagate Expansion Drive/ALICE_BACKUP/voshpde/wav_files/zipfiles/2016120802.wav	0
326	/media/hugo/Seagate Expansion Drive/ALICE_BACKUP/voshpde/pipeLine/segmentation_wavfiles/2016120802/327_2016120802.wav	7396.8073922902495	326199206	7421.65739229025	327295091	326_2016120802	the agency may also subject to the agreement of the third country and in agreement with the commission coordinate any such exchange of information or other action between member states and the third country in the territory of that third country so the compromise twenty six should be without this sentence thank you	the agency may also subject to the agreement of the third country and in agreement with the commission coordinate any such exchange of information or other action between member states and the third country in the territory of that third country so the compromise twenty six should be without this sentence thank you	/media/hugo/Seagate Expansion Drive/ALICE_BACKUP/voshpde/wav_files/zipfiles/2016120802.wav	0
327	/media/hugo/Seagate Expansion Drive/ALICE_BACKUP/voshpde/pipeLine/segmentation_wavfiles/2016120802/328_2016120802.wav	7421.657414965986	327295092	7438.607414965986	328042587	327_2016120802	thank you president ok there are number interventions we move straight to the vote and we begin with the rejection of the commission proposal amendment one o three the voters open	thank you president ok there are number interventions we move straight to the vote and we begin with the rejection of the commission proposal amendment one o three the voters open	/media/hugo/Seagate Expansion Drive/ALICE_BACKUP/voshpde/wav_files/zipfiles/2016120802.wav	0
328	/media/hugo/Seagate Expansion Drive/ALICE_BACKUP/voshpde/pipeLine/segmentation_wavfiles/2016120802/329_2016120802.wav	7438.607437641724	328042588	7457.757437641723	328887103	328_2016120802	is everyone voted the vote is closed and that is rejected amendment one of six and want to want to eight block vote the voters open	is everyone voted the vote is closed and that is rejected amendment one of six and want to want to eight block vote the voters open	/media/hugo/Seagate Expansion Drive/ALICE_BACKUP/voshpde/wav_files/zipfiles/2016120802.wav	0
329	/media/hugo/Seagate Expansion Drive/ALICE_BACKUP/voshpde/pipeLine/segmentation_wavfiles/2016120802/330_2016120802.wav	7457.757460317461	328887104	7478.507460317461	329802179	329_2016120802	the vote is closed that is rejected so we move to articles compromise one on article one the votes open vote is closed	the vote is closed that is rejected so we move to articles compromise one on article one the votes open vote is closed	/media/hugo/Seagate Expansion Drive/ALICE_BACKUP/voshpde/wav_files/zipfiles/2016120802.wav	0
330	/media/hugo/Seagate Expansion Drive/ALICE_BACKUP/voshpde/pipeLine/segmentation_wavfiles/2016120802/331_2016120802.wav	7478.507482993197	329802180	7502.257482993197	330849555	330_2016120802	that is rent we move to compromise one the vote is open votes closed compromise one a votes closed that is carriat compromise too the vote is open	that is rent we move to compromise one the vote is open votes closed compromise one a votes closed that is carriat compromise too the vote is open	/media/hugo/Seagate Expansion Drive/ALICE_BACKUP/voshpde/wav_files/zipfiles/2016120802.wav	0
331	/media/hugo/Seagate Expansion Drive/ALICE_BACKUP/voshpde/pipeLine/segmentation_wavfiles/2016120802/332_2016120802.wav	7502.257505668934	330849556	7532.007505668934	332161531	331_2016120802	closed that is carried compromise three the voters open votes closed that is carried compromise for the voters open	closed that is carried compromise three the voters open votes closed that is carried compromise for the voters open	/media/hugo/Seagate Expansion Drive/ALICE_BACKUP/voshpde/wav_files/zipfiles/2016120802.wav	0
332	/media/hugo/Seagate Expansion Drive/ALICE_BACKUP/voshpde/pipeLine/segmentation_wavfiles/2016120802/333_2016120802.wav	7532.007528344671	332161532	7553.757528344671	333120707	332_2016120802	carry compromise i votesoftil	carry compromise i votesoftil	/media/hugo/Seagate Expansion Drive/ALICE_BACKUP/voshpde/wav_files/zipfiles/2016120802.wav	0
333	/media/hugo/Seagate Expansion Drive/ALICE_BACKUP/voshpde/pipeLine/segmentation_wavfiles/2016120802/334_2016120802.wav	7553.757551020408	333120708	7583.207551020409	334419453	333_2016120802	carried compromise six voters open closed carried compromise seven voters open close carried amendment three five four the voters open	carried compromise six voters open closed carried compromise seven voters open close carried amendment three five four the voters open	/media/hugo/Seagate Expansion Drive/ALICE_BACKUP/voshpde/wav_files/zipfiles/2016120802.wav	0
334	/media/hugo/Seagate Expansion Drive/ALICE_BACKUP/voshpde/pipeLine/segmentation_wavfiles/2016120802/335_2016120802.wav	7583.207573696145	334419454	7602.757573696145	335281609	334_2016120802	le rejected compromise eight votes open la	le rejected compromise eight votes open closdari	/media/hugo/Seagate Expansion Drive/ALICE_BACKUP/voshpde/wav_files/zipfiles/2016120802.wav	6
335	/media/hugo/Seagate Expansion Drive/ALICE_BACKUP/voshpde/pipeLine/segmentation_wavfiles/2016120802/336_2016120802.wav	7602.757596371882	335281610	7622.507596371882	336152585	335_2016120802	compromise nine votes open closed carry to compromise ten votes open closed	compromise nine votes open closed carry to compromise ten votes open closed	/media/hugo/Seagate Expansion Drive/ALICE_BACKUP/voshpde/wav_files/zipfiles/2016120802.wav	0
336	/media/hugo/Seagate Expansion Drive/ALICE_BACKUP/voshpde/pipeLine/segmentation_wavfiles/2016120802/337_2016120802.wav	7622.507619047619	336152586	7648.757619047619	337310211	336_2016120802	arie compromise eleven votes open arid and then we go to compromise twelve thirteen and fast first part of compromise fifteen the vote is open	arie compromise eleven votes open arie then we go to compromise twelve thirteen and fast first part of compromise fifteen the vote is open	/media/hugo/Seagate Expansion Drive/ALICE_BACKUP/voshpde/wav_files/zipfiles/2016120802.wav	5
337	/media/hugo/Seagate Expansion Drive/ALICE_BACKUP/voshpde/pipeLine/segmentation_wavfiles/2016120802/338_2016120802.wav	7648.757641723356	337310212	7667.107641723356	338119447	337_2016120802	carried second part of compromise fifteen voters open closed carried third part of compromise fifteen voters open	carried second part of compromise fifteen voters open closed carried third part of compromise fifteen voters open	/media/hugo/Seagate Expansion Drive/ALICE_BACKUP/voshpde/wav_files/zipfiles/2016120802.wav	0
338	/media/hugo/Seagate Expansion Drive/ALICE_BACKUP/voshpde/pipeLine/segmentation_wavfiles/2016120802/339_2016120802.wav	7667.107664399093	338119448	7687.257664399093	339008063	338_2016120802	police fourteen votes open	coprolisefourteen votes open	/media/hugo/Seagate Expansion Drive/ALICE_BACKUP/voshpde/wav_files/zipfiles/2016120802.wav	5
339	/media/hugo/Seagate Expansion Drive/ALICE_BACKUP/voshpde/pipeLine/segmentation_wavfiles/2016120802/340_2016120802.wav	7687.25768707483	339008064	7716.60768707483	340302399	339_2016120802	just keep turning your pages compromise fourteen just keep trning your pages there are no page numbers on most of euro la compromise fourteen ii voters open votes closed arid compromise sixteen voters open	just keep turning your pages compromise fourteen just keep trning your pages there are no page numbers on most of europe this compromise fourteen i voters open votes closed arid compromise sixteen voters open	/media/hugo/Seagate Expansion Drive/ALICE_BACKUP/voshpde/wav_files/zipfiles/2016120802.wav	7
340	/media/hugo/Seagate Expansion Drive/ALICE_BACKUP/voshpde/pipeLine/segmentation_wavfiles/2016120802/341_2016120802.wav	7716.607709750567	340302400	7741.357709750567	341393875	340_2016120802	votes close carried amendment five zero eight the voters open five zero eight votes close	votes close carried amendment five zero eight the voters open five zero eight votes close	/media/hugo/Seagate Expansion Drive/ALICE_BACKUP/voshpde/wav_files/zipfiles/2016120802.wav	0
341	/media/hugo/Seagate Expansion Drive/ALICE_BACKUP/voshpde/pipeLine/segmentation_wavfiles/2016120802/342_2016120802.wav	7741.357732426304	341393876	7761.307732426304	342273671	341_2016120802	that is rejected la care from my seventeen voters opens	that is rejected a care from my seventeen voters open	/media/hugo/Seagate Expansion Drive/ALICE_BACKUP/voshpde/wav_files/zipfiles/2016120802.wav	2
342	/media/hugo/Seagate Expansion Drive/ALICE_BACKUP/voshpde/pipeLine/segmentation_wavfiles/2016120802/343_2016120802.wav	7761.307755102041	342273672	7788.75775510204	343484217	342_2016120802	carried compromise eighteen votes open close carried compromsed nineteen votes open led carried compromise twenty votes open	carried compromise eighteen votes open close carried compromsed nineteen votes open led carried compromise twenty votes open	/media/hugo/Seagate Expansion Drive/ALICE_BACKUP/voshpde/wav_files/zipfiles/2016120802.wav	0
343	/media/hugo/Seagate Expansion Drive/ALICE_BACKUP/voshpde/pipeLine/segmentation_wavfiles/2016120802/344_2016120802.wav	7788.757777777778	343484218	7804.007777777778	344156743	343_2016120802	carried compromise twenty one voters often	carried compromise twenty one voters often	/media/hugo/Seagate Expansion Drive/ALICE_BACKUP/voshpde/wav_files/zipfiles/2016120802.wav	0
344	/media/hugo/Seagate Expansion Drive/ALICE_BACKUP/voshpde/pipeLine/segmentation_wavfiles/2016120802/345_2016120802.wav	7804.007800453514	344156744	7833.057800453515	345437849	344_2016120802	carried compromse twenty two voters close carried compromise twenty two a voters open carried compromise twenty three voters open	carried compromse twenty two voters close carried compromise twenty two a voters open carried compromise twenty three voters open	/media/hugo/Seagate Expansion Drive/ALICE_BACKUP/voshpde/wav_files/zipfiles/2016120802.wav	0
345	/media/hugo/Seagate Expansion Drive/ALICE_BACKUP/voshpde/pipeLine/segmentation_wavfiles/2016120802/346_2016120802.wav	7833.057823129252	345437850	7860.107823129251	346630755	345_2016120802	mr present carried compromise twenty three eight voters open cared amendment seventy one voters open le	mr present carried compromise twenty three eight voters open cared amendment seventy one voters open le	/media/hugo/Seagate Expansion Drive/ALICE_BACKUP/voshpde/wav_files/zipfiles/2016120802.wav	0
346	/media/hugo/Seagate Expansion Drive/ALICE_BACKUP/voshpde/pipeLine/segmentation_wavfiles/2016120802/347_2016120802.wav	7860.107845804989	346630756	7884.357845804989	347700181	346_2016120802	carried amendments seventy two voters open closed carried amendments seventy three voters open closed carried amendment seventy four voters open	carried amendments seventy two voters open closed carried amendments seventy three voters open closed carried amendment seventy four voters open	/media/hugo/Seagate Expansion Drive/ALICE_BACKUP/voshpde/wav_files/zipfiles/2016120802.wav	0
347	/media/hugo/Seagate Expansion Drive/ALICE_BACKUP/voshpde/pipeLine/segmentation_wavfiles/2016120802/348_2016120802.wav	7884.357868480725	347700182	7910.007868480726	348831347	347_2016120802	ms closed carried amendment five eight three voters open votes closed that is rejected compromise twenty three be voters open	m closed carried amendment five eight three voters open votes closed that is rejected compromise twenty three be voters open	/media/hugo/Seagate Expansion Drive/ALICE_BACKUP/voshpde/wav_files/zipfiles/2016120802.wav	1
348	/media/hugo/Seagate Expansion Drive/ALICE_BACKUP/voshpde/pipeLine/segmentation_wavfiles/2016120802/349_2016120802.wav	7910.007891156462	348831348	7938.457891156462	350085993	348_2016120802	ms cared compromise twenty four votes open carried compromise twenty five votes	cared compromise twenty four votes open carried compromise twenty five votes	/media/hugo/Seagate Expansion Drive/ALICE_BACKUP/voshpde/wav_files/zipfiles/2016120802.wav	3
349	/media/hugo/Seagate Expansion Drive/ALICE_BACKUP/voshpde/pipeLine/segmentation_wavfiles/2016120802/350_2016120802.wav	7938.4579138322	350085994	7964.9079138321995	351252439	349_2016120802	carried compromise twenty six voters open close carried compromise twenty seven votes open close carried compromise twenty eight votes open	carried compromise twenty six voters open close carried compromise twenty seven votes open close carried compromise twenty eight votes open	/media/hugo/Seagate Expansion Drive/ALICE_BACKUP/voshpde/wav_files/zipfiles/2016120802.wav	0
