	wavfile	start_seconds	start_frames	end_seconds	end_frames	identifier	inferred_text_with_hotwords	inferred_text_without_hotwords	motherfile	dist
182	/media/hugo/Seagate Expansion Drive/ALICE_BACKUP/voshpde/pipeLine/segmentation_wavfiles/2016040702/183_2016040702.wav	4080.204126984127	179937002	4099.554126984127	180790337	182_2016040702	nevertheless we should never we should resist the temptation to use tick the box approaches in order to stepped up the process there will always be some compromises necessary to have these relationship rite between sped and quality but we argue against tick the box approaches	nevertheless we should never we should resist the temptation to use tick the box approaches in order to stepped up the process there will always be some compromises necessary to have these relationship rite between sped and quality but we argue against tick the box approaches	/media/hugo/Seagate Expansion Drive/ALICE_BACKUP/voshpde/wav_files/zipfiles/2016040702.wav	0
183	/media/hugo/Seagate Expansion Drive/ALICE_BACKUP/voshpde/pipeLine/segmentation_wavfiles/2016040702/184_2016040702.wav	4099.554149659864	180790338	4126.104149659864	181961193	183_2016040702	also by many pieces of information can be gathered by existing mechanisms there might be additional information and data needed and we argue for solicitating information from a wide range of sources beyond beyond state act civil society actors the media having official body representing and protecting fundamental rights	also by many pieces of information can be gathered by existing mechanisms there might be additional information and data needed and we argue for solicitating information from a wide range of sources beyond beyond state act civil society actors the media having official body representing and protecting fundamental rights	/media/hugo/Seagate Expansion Drive/ALICE_BACKUP/voshpde/wav_files/zipfiles/2016040702.wav	0
184	/media/hugo/Seagate Expansion Drive/ALICE_BACKUP/voshpde/pipeLine/segmentation_wavfiles/2016040702/185_2016040702.wav	4126.104172335601	181961194	4146.654172335601	182867449	184_2016040702	these include ombudspersons mediators fundamental rights protection supervisors who should act the sources and of course the fundamental rights agency the eu ombudspersons office the european data protection supervisor article twenty nine working party should all have a decisive place in this area	these include ombudspersons mediators fundamental rights protection supervisors who should act the sources and of course the fundamental rights agency the eu ombudspersons office the european data protection supervisor article twenty nine working party should all have a decisive place in this area	/media/hugo/Seagate Expansion Drive/ALICE_BACKUP/voshpde/wav_files/zipfiles/2016040702.wav	0
185	/media/hugo/Seagate Expansion Drive/ALICE_BACKUP/voshpde/pipeLine/segmentation_wavfiles/2016040702/186_2016040702.wav	4146.654195011338	182867450	4166.104195011338	183725195	185_2016040702	the burden of proof in establishing the relevant facts in respect of any other concerning democracy the rule of law and fundamental rights must be spat out and as soon as there is reasonable doubt that the requirements have been fulfilled and that the information provided accurator rebuills the correct situation the burden of proof cia shift	the burden of proof in establishing the relevant facts in respect of any other concerning democracy the rule of law and fundamental rights must be spat out and as soon as there is reasonable doubt that the requirements have been fulfilled and that the information provided accurator rebuills the correct situation the burden of proof sia shift	/media/hugo/Seagate Expansion Drive/ALICE_BACKUP/voshpde/wav_files/zipfiles/2016040702.wav	1
186	/media/hugo/Seagate Expansion Drive/ALICE_BACKUP/voshpde/pipeLine/segmentation_wavfiles/2016040702/187_2016040702.wav	4166.104217687075	183725196	4193.754217687075	184944561	186_2016040702	on the member state authorities in question to satisfy the european unions institution that their actions are actually consistent with eu values next light please the research paper systemised possible stages of respect for european values and identified three scenarios in the first scenarios member states are the eu because we also argue that the european union	on the member state authorities in question to satisfy the european unions institution that their actions are actually consistent with eu values next light please the research paper systemised possible stages of respect for european values and identified three scenarios in the first scenarios member states are the eu because we also argue that the european union	/media/hugo/Seagate Expansion Drive/ALICE_BACKUP/voshpde/wav_files/zipfiles/2016040702.wav	0
187	/media/hugo/Seagate Expansion Drive/ALICE_BACKUP/voshpde/pipeLine/segmentation_wavfiles/2016040702/188_2016040702.wav	4193.754240362812	184944562	4212.8042403628115	185784667	187_2016040702	and the member states should should both be scrutinised in order to enhance the legitimacy of the european union as well so in the first scenario the member states are on the track of the rule of law so to say meaning that there are no substantial problems	and the member states should should both be scrutinised in order to enhance the legitimacy of the european union as well so in the first scenario the member states are on the track of the rule of law so to say meaning that there are no substantial problems	/media/hugo/Seagate Expansion Drive/ALICE_BACKUP/voshpde/wav_files/zipfiles/2016040702.wav	0
188	/media/hugo/Seagate Expansion Drive/ALICE_BACKUP/voshpde/pipeLine/segmentation_wavfiles/2016040702/189_2016040702.wav	4212.804263038549	185784668	4230.754263038549	186576263	188_2016040702	in the second scenario there are certain elements which are problematic with regard to the stubb elements of the rule of law for example one can imagine a country which is on the track of the rule of law but for example	in the second scenario there are certain elements which are problematic with regard to the stubb elements of the rule of law for example one can imagine a country which is on the track of the rule of law but for example	/media/hugo/Seagate Expansion Drive/ALICE_BACKUP/voshpde/wav_files/zipfiles/2016040702.wav	0
189	/media/hugo/Seagate Expansion Drive/ALICE_BACKUP/voshpde/pipeLine/segmentation_wavfiles/2016040702/190_2016040702.wav	4230.754285714285	186576264	4249.104285714286	187385499	189_2016040702	has very severe human rights violations like depriving all prisoners in discriminately of their voting rights or having cage beds in their mental institutions now if this country is overall on track of the rule of law and it will take recommendations	has very severe human rights violations like depriving all prisoners in discriminately of their voting rights or having cage beds in their mental institutions now if this country is overall on track of the rule of law and it will take recommendations	/media/hugo/Seagate Expansion Drive/ALICE_BACKUP/voshpde/wav_files/zipfiles/2016040702.wav	0
190	/media/hugo/Seagate Expansion Drive/ALICE_BACKUP/voshpde/pipeLine/segmentation_wavfiles/2016040702/191_2016040702.wav	4249.104308390023	187385500	4278.754308390023	188693065	190_2016040702	by international organisations and as eu would not eu rule of law evaluations into consideration the third scenario however that we highlighted with withdrandis qualitatively different from the previous too without going into the details this is the state of a constitutional capture with a systemic breach of separation of powers constitutional adjudication failure of ordinary judiciary and the ombudsman system civil society and the media	by international organisations and as would not eu rule of law evaluations into consideration the third scenario however that we highlighted with withdrandis qualitatively different from the previous too without going into the details this is the state of a constitutional capture with a systemic breach of separation of powers constitutional adjudication failure of ordinary judiciary and the ombudsman system civil society and the media	/media/hugo/Seagate Expansion Drive/ALICE_BACKUP/voshpde/wav_files/zipfiles/2016040702.wav	3
191	/media/hugo/Seagate Expansion Drive/ALICE_BACKUP/voshpde/pipeLine/segmentation_wavfiles/2016040702/192_2016040702.wav	4278.754331065759	188693066	4304.8043310657595	189841871	191_2016040702	in both the first and the second scenarios we will promote a sunshine policy on behalf of the eu which engages and involves member states rather than paralyses and excludes and very value control is equally owned by the member states and the european union institutions be third scenario however as i said is fundamentally different from the first two	in both the first and the second scenarios we will promote a sunshine policy on behalf of the eu which engages and involves member states rather than paralyses and excludes and very value control is equally owned by the member states and the european union institutions be third scenario however as i said is fundamentally different from the first two	/media/hugo/Seagate Expansion Drive/ALICE_BACKUP/voshpde/wav_files/zipfiles/2016040702.wav	0
192	/media/hugo/Seagate Expansion Drive/ALICE_BACKUP/voshpde/pipeLine/segmentation_wavfiles/2016040702/193_2016040702.wav	4304.804353741497	189841872	4321.454353741497	190576137	192_2016040702	do and therefore the methodology of the scoreboard shall introduce a second prong for the ret circle for the third scenario and a state systematically undermines democracy deconstruct the rule of law and engages in massive human rights violations	do and therefore the methodology of the scoreboard shall introduce a second prong for the ret circle for the third scenario and a state systematically undermines democracy deconstruct the rule of law and engages in massive human rights violations	/media/hugo/Seagate Expansion Drive/ALICE_BACKUP/voshpde/wav_files/zipfiles/2016040702.wav	0
193	/media/hugo/Seagate Expansion Drive/ALICE_BACKUP/voshpde/pipeLine/segmentation_wavfiles/2016040702/194_2016040702.wav	4321.454376417233	190576138	4347.704376417233	191733763	193_2016040702	there are no reasons to presume the good intentions of those in power to engage in a sunshine approach involving a dialogue and soft measures in order to make the entity return to the concept of limited government and notion that those that those in power wish to abandon in the first place so it is under the scenario that the systemic infringement procedures next lite place	there are no reasons to presume the good intentions of those in power to engage in a sunshine approach involving a dialogue and soft measures in order to make the entity return to the concept of limited government and notion that those that those in power wish to abandon in the first place so it is under the scenario that the systemic infringement procedures next lite place	/media/hugo/Seagate Expansion Drive/ALICE_BACKUP/voshpde/wav_files/zipfiles/2016040702.wav	0
194	/media/hugo/Seagate Expansion Drive/ALICE_BACKUP/voshpde/pipeLine/segmentation_wavfiles/2016040702/195_2016040702.wav	4347.704399092971	191733764	4367.454399092971	192604739	194_2016040702	the eu rule of law mechanism or article seventy eu would come in the scoreboard could guide the discussion and make the process for sable and transparent the discussion could still be led by an interinstitutional arrangement agreement with the frau and or commission taking the lead	the eu rule of law mechanism or article seventy eu would come in the scoreboard could guide the discussion and make the process for sable and transparent the discussion could still be led by an interinstitutional arrangement agreement with the frau and or commission taking the lead	/media/hugo/Seagate Expansion Drive/ALICE_BACKUP/voshpde/wav_files/zipfiles/2016040702.wav	0
195	/media/hugo/Seagate Expansion Drive/ALICE_BACKUP/voshpde/pipeLine/segmentation_wavfiles/2016040702/196_2016040702.wav	4367.454421768707	192604740	4387.104421768708	193471305	195_2016040702	we also propose the establishment of an eu rule of law commission entirely independent from institutions and bodies that could be placed at the centre of the rule of law scoreboard and the selection and organisation and model could follow the one currently utilised by actors like the venice commission or se pa	we also propose the establishment of an eu rule of law commission entirely independent from institutions and bodies that could be placed at the centre of the rule of law scoreboard and the selection and organisation and model could follow the one currently utilised by actors like the venice commission or sea	/media/hugo/Seagate Expansion Drive/ALICE_BACKUP/voshpde/wav_files/zipfiles/2016040702.wav	2
196	/media/hugo/Seagate Expansion Drive/ALICE_BACKUP/voshpde/pipeLine/segmentation_wavfiles/2016040702/197_2016040702.wav	4387.104444444444	193471306	4411.454444444445	194545141	196_2016040702	now what the remedy should be goes beyond the scope of our research paper but let me just add that the proposals which are adding a bar bite to the bark they typically point to the power of the person that is they operate with quasi economic sanctions such as suspension with holding ratreduction of eu funds	now what the remedy should be goes beyond the scope of our research paper but let me just add that the proposals which are adding a bar bite to the bark they typically point to the power of the person that is they operate with quasi economic sanctions such as suspension with holding ratreduction of eu funds	/media/hugo/Seagate Expansion Drive/ALICE_BACKUP/voshpde/wav_files/zipfiles/2016040702.wav	0
197	/media/hugo/Seagate Expansion Drive/ALICE_BACKUP/voshpde/pipeLine/segmentation_wavfiles/2016040702/198_2016040702.wav	4411.454467120181	194545142	4430.104467120182	195367607	197_2016040702	now there as pecuniary sanctions may not be affected with regard to all the member states for the time being the power of the purse could be particularly strong as paradoxically the main rule of law backsliders or countries which had net beneficiaries of european integration	now there as pecuniary sanctions may not be affected with regard to all the member states for the time being the power of the purse could be particularly strong as paradoxically the main rule of law backsliders or countries which had net beneficiaries of european integration	/media/hugo/Seagate Expansion Drive/ALICE_BACKUP/voshpde/wav_files/zipfiles/2016040702.wav	0
198	/media/hugo/Seagate Expansion Drive/ALICE_BACKUP/voshpde/pipeLine/segmentation_wavfiles/2016040702/199_2016040702.wav	4430.104489795918	195367608	4453.454489795919	196397343	198_2016040702	freezing eu funds in their case would put an end to the paradox of using eu money to build and maintain crazy authoritarian regimes in denial of eu values at before i give the floor to the colleagues of parliament i would like to give the floor to professilohongpesh from middle sex university in london	freezing eu funds in their case would put an end to the paradox of using eu money to build and maintain crazy authoritarian regimes in denial of eu values at before i give the floor to the colleagues of parliament i would like to give the floor to professilohongpesh from middle sex university in london	/media/hugo/Seagate Expansion Drive/ALICE_BACKUP/voshpde/wav_files/zipfiles/2016040702.wav	0
199	/media/hugo/Seagate Expansion Drive/ALICE_BACKUP/voshpde/pipeLine/segmentation_wavfiles/2016040702/200_2016040702.wav	4453.454512471655	196397344	4472.3045124716555	197228629	199_2016040702	who will present the research paper done by mile called on the establishment of the eu mechanism on democracy the rule of law and fundamental rights so i am going have stand heist to present the key findings of the report	who will present the research paper done by mile called on the establishment of the eu mechanism on democracy the rule of law and fundamental rights so i am going have stand heist to present the key findings of the report	/media/hugo/Seagate Expansion Drive/ALICE_BACKUP/voshpde/wav_files/zipfiles/2016040702.wav	0
200	/media/hugo/Seagate Expansion Drive/ALICE_BACKUP/voshpde/pipeLine/segmentation_wavfiles/2016040702/201_2016040702.wav	4472.304535147392	197228630	4488.154535147392	197927615	200_2016040702	mr president an essential main mission was slightly different essentially we were asked to look at the overall framework and identify gaps and shortcoming before offering a number of suggestions solutions options if you could move to the next lie please	mr president an essential main mission was slightly different essentially we were asked to look at the overall framework and identify gaps and shortcoming before offering a number of suggestions solutions options if you could move to the next lie please	/media/hugo/Seagate Expansion Drive/ALICE_BACKUP/voshpde/wav_files/zipfiles/2016040702.wav	0
201	/media/hugo/Seagate Expansion Drive/ALICE_BACKUP/voshpde/pipeLine/segmentation_wavfiles/2016040702/202_2016040702.wav	4488.154557823129	197927616	4507.3045578231295	198772131	201_2016040702	and so essentially the objectives where perhaps more a more micro dimension we were not i us to look simply at the specific monitoring scoreboard before however we decide that before essentially looking at the identifying gaps in shortcoming ly be useful to	and so essentially the objectives where perhaps more a more micro dimension we were not supposed to look simply at the specific monitoring scoreboard before however we decide that before essentially looking at the identifying gaps in shortcoming ly be useful to	/media/hugo/Seagate Expansion Drive/ALICE_BACKUP/voshpde/wav_files/zipfiles/2016040702.wav	7
202	/media/hugo/Seagate Expansion Drive/ALICE_BACKUP/voshpde/pipeLine/segmentation_wavfiles/2016040702/203_2016040702.wav	4507.304580498866	198772132	4527.954580498867	199682797	202_2016040702	deal with a number of recurrent issues such as where there the values lay than in article two t eu can be define whether the eu had or did not have the competence to actually monitor member states so this is essentially the first part of the report where we deal with a number of recurrent issues and just to summarise because lack of time	deal with a number of recurrent issues such as where there the values lay than in article two t can be define whether the eu had or did not have the competence to actually monitor member states so this is essentially the first part of the report where we deal with a number of recurrent issues and just to summarise because lack of time	/media/hugo/Seagate Expansion Drive/ALICE_BACKUP/voshpde/wav_files/zipfiles/2016040702.wav	3
203	/media/hugo/Seagate Expansion Drive/ALICE_BACKUP/voshpde/pipeLine/segmentation_wavfiles/2016040702/204_2016040702.wav	4527.954603174603	199682798	4553.604603174603	200813963	203_2016040702	al main position we respect to this question is that the eu does have the confidence to monitor member states posed eu accession on the basis of the current existing framework and as far as values laden in article twetyyou are concerned we also believe that the meaning and scope of these values can be de rock not only from national case law but also european case of international case law in a number of eu	al main position we respect to this question is that the eu does have the confidence to monitor member states posed eu accession on the basis of the current existing framework and as far as values laden in article twetyyou are concerned we also believe that the meaning and scope of these values can be de rock not only from national case law but also european case of international case law in a number of	/media/hugo/Seagate Expansion Drive/ALICE_BACKUP/voshpde/wav_files/zipfiles/2016040702.wav	3
204	/media/hugo/Seagate Expansion Drive/ALICE_BACKUP/voshpde/pipeLine/segmentation_wavfiles/2016040702/205_2016040702.wav	4553.60462585034	200813964	4574.35462585034	201729039	204_2016040702	the european international legal instruments so as far as this question is concerned we also do believe that eu member states can be subject to an e monitoring as far these values of concern so essentially these values are not open ended concepts there are not beg there can be subject to monitoring	the european international legal instruments so as far as this question is concerned we also do believe that eu member states can be subject to an e monitoring as far these values of concern so essentially these values are not open ended concepts there are not beg there can be subject to monitoring	/media/hugo/Seagate Expansion Drive/ALICE_BACKUP/voshpde/wav_files/zipfiles/2016040702.wav	0
205	/media/hugo/Seagate Expansion Drive/ALICE_BACKUP/voshpde/pipeLine/segmentation_wavfiles/2016040702/206_2016040702.wav	4574.354648526077	201729040	4591.704648526077	202494175	205_2016040702	regarding moving on two essentially the part two of the report is the gaps and shortcomings of the existing framework we look first of all at the framework in a transversal ways so essentially we identified a number of shortcomings from a transversal point of view	regarding moving on two essentially the part two of the report is the gaps and shortcomings of the existing framework we look first of all at the framework in a transversal ways so essentially we identified a number of shortcomings from a transversal point of view	/media/hugo/Seagate Expansion Drive/ALICE_BACKUP/voshpde/wav_files/zipfiles/2016040702.wav	0
206	/media/hugo/Seagate Expansion Drive/ALICE_BACKUP/voshpde/pipeLine/segmentation_wavfiles/2016040702/207_2016040702.wav	4591.704671201814	202494176	4616.054671201814	203568011	206_2016040702	and among the shortcomings we identify was perhaps the poliferation of specific instruments and the lack of coordination between the main eu institutions essentially it is as if instruments where essentially accumulate establish one after the next with that having essentially being in the absence of any coordination between the eu institutions and	and among the shortcomings we identify was perhaps the poliferation of specific instruments and the lack of coordination between the main eu institutions essentially it is as if instruments where essentially accumulate establish one after the next with that having essentially being in the absence of any coordination between the eu institutions and	/media/hugo/Seagate Expansion Drive/ALICE_BACKUP/voshpde/wav_files/zipfiles/2016040702.wav	0
207	/media/hugo/Seagate Expansion Drive/ALICE_BACKUP/voshpde/pipeLine/segmentation_wavfiles/2016040702/208_2016040702.wav	4616.0546938775515	203568012	4631.704693877551	204258177	207_2016040702	to to be fair to the eu institutions i believe that this lack of coordination is simply due to the fact that the eu project has been based on the assumption that once you join the eu essentially eu compliance with article two values is no longer an issue or should not have been an issue	to to be fair to the eu institutions i believe that this lack of coordination is simply due to the fact that the eu project has been based on the assumption that once you join the eu essentially eu compliance with article two values is no longer an issue or should not have been an issue	/media/hugo/Seagate Expansion Drive/ALICE_BACKUP/voshpde/wav_files/zipfiles/2016040702.wav	0
208	/media/hugo/Seagate Expansion Drive/ALICE_BACKUP/voshpde/pipeLine/segmentation_wavfiles/2016040702/209_2016040702.wav	4631.704716553288	204258178	4660.254716553288	205517233	208_2016040702	and to that extend this explain why perhaps the framework as some transversal shortcomings because of this long held assumption that this should not be an issue that we should be discussing today this assuption no longer old true but we also identify shortcomings with specific instrument which have been adopted to established by if and eu institutions i am not going to least all the shortcomings pa instrument the report is rather long but son today we look at	and to that extend this explain why perhaps the framework as some transversal shortcomings because of this long held assumption that this should not be an issue that we should be discussing today this assuption no longer old true but we also identify shortcomings with specific instrument which have been adopted to established by if and eu institutions i am not going to least all the shortcomings pair instrument the report is rather long but son today we look at	/media/hugo/Seagate Expansion Drive/ALICE_BACKUP/voshpde/wav_files/zipfiles/2016040702.wav	2
209	/media/hugo/Seagate Expansion Drive/ALICE_BACKUP/voshpde/pipeLine/segmentation_wavfiles/2016040702/210_2016040702.wav	4660.254739229025	205517234	4685.204739229025	206617529	209_2016040702	the rule of law framework we look but also before looking at new instruments adopted in to us and fourteen we look at existing instruments such art article seventeen eu so the so alled nuclear option which perhaps is not the right way to describe it but let me move on to article two five eight and central the enforcement procedure we also looked at the way he has been applied understroed by the commission and whether perhaps there was room for improvement we respect to article two	the rule of law framework we look but also before looking at new instruments adopted in thousand and fourteen we look at existing instruments such art article seventeen eu so the so alled nuclear option which perhaps is not the right way to describe it but let me move on to article two five eight an sentially the enforcement procedure we also looked at the way he has been applied understroed by the commission and whether perhaps there was room for improvement we respect to article two	/media/hugo/Seagate Expansion Drive/ALICE_BACKUP/voshpde/wav_files/zipfiles/2016040702.wav	10
