	wavfile	start_seconds	start_frames	end_seconds	end_frames	identifier	inferred_text_with_hotwords	inferred_text_without_hotwords	motherfile	dist
0	/media/hugo/Seagate Expansion Drive/ALICE_BACKUP/voshpde/pipeLine/segmentation_wavfiles/2016120802/001_2016120802.wav	0.0	0	26.75	1179675	000_2016120802	mr presielguesiflibya colleagues are ready and know some people have to have transport and other arrangement so if colleagues are ready in want to do the announcement on them we can muvestratto the vote of ms macovei so f he cont colleagues could leave fairly quitely we will move on	mr presielguesiflibyacolleagues are ready and know some people have to have transport and other arrangement so if colleagues are ready in want to do the announcement on them we can muvestratto the vote of mrs markovi so f he cont colleagues could leave fairly quitely we will move on	/media/hugo/Seagate Expansion Drive/ALICE_BACKUP/voshpde/wav_files/zipfiles/2016120802.wav	5
1	/media/hugo/Seagate Expansion Drive/ALICE_BACKUP/voshpde/pipeLine/segmentation_wavfiles/2016120802/002_2016120802.wav	26.75002267573696	1179676	48.80002267573696	2152081	001_2016120802	so for the i would just to announce ii quickly than we will move to our our single vote so please now that on the adoption of the agenda two one has been added to the agenda the vote on the text great during interinstitutional negotiations on the reinforcement of checks against relevant data basis of external borders	so for the i would just to announce is quickly than we will move to our our single vote so please now that on the adoption of the agenda two one has been added to the agenda the vote on the text great during interinstitutional negotiations on the reinforcement of checks against relevant data basis of external borders	/media/hugo/Seagate Expansion Drive/ALICE_BACKUP/voshpde/wav_files/zipfiles/2016120802.wav	1
2	/media/hugo/Seagate Expansion Drive/ALICE_BACKUP/voshpde/pipeLine/segmentation_wavfiles/2016120802/003_2016120802.wav	48.800045351473926	2152082	65.95004535147392	2908397	002_2016120802	for the rapporteur ms macovei if there are no objections to that agenda as adopted it is modified just on the linguistic profile as usual croatian maltese and galit will not be available today throughout the meeting and slovak will not be available just for this morning	for the rapporteur ms makove if there are no objections to that agenda as adopted it is modified just on the linguistic profile as usual croatian maltese and galit will not be available today throughout the meeting and slovak will not be available just for this morning	/media/hugo/Seagate Expansion Drive/ALICE_BACKUP/voshpde/wav_files/zipfiles/2016120802.wav	2
3	/media/hugo/Seagate Expansion Drive/ALICE_BACKUP/voshpde/pipeLine/segmentation_wavfiles/2016120802/004_2016120802.wav	65.95006802721089	2908398	82.30006802721088	3629433	003_2016120802	just quickly on the point on delegated acts colleagues before we move to the vote we received three delegated acts on addition to the annexes to regulation eu number ninety eight two thousand and thirteen on the marketing and use of explosive precursors	just quickly on the point on delegated acts colleagues before we move to the vote we received three delegated acts on addition to the annexes to regulation eu number ninety eight two thousand and thirteen on the marketing and use of explosive precursors	/media/hugo/Seagate Expansion Drive/ALICE_BACKUP/voshpde/wav_files/zipfiles/2016120802.wav	0
4	/media/hugo/Seagate Expansion Drive/ALICE_BACKUP/voshpde/pipeLine/segmentation_wavfiles/2016120802/005_2016120802.wav	82.30009070294784	3629434	103.65009070294785	4570969	004_2016120802	ii pursuant to ro one o five paragraph three in accordance with the provisions of the basic legislative act and if the committee responsible considers it appropriate to do so the committee responsible mee table a reasoned motion for resolution the deadline is set for fourteen december six pm libe members wanting to object to the delegated act	pursuant to ro one o five paragraph three in accordance with the provisions of the basic legislative act and if the committee responsible considers it appropriate to do so the committee responsible mee table a reasoned motion for resolution the deadline is set for fourteen december six pm levi members wanting to object to the delegated act	/media/hugo/Seagate Expansion Drive/ALICE_BACKUP/voshpde/wav_files/zipfiles/2016120802.wav	6
5	/media/hugo/Seagate Expansion Drive/ALICE_BACKUP/voshpde/pipeLine/segmentation_wavfiles/2016120802/006_2016120802.wav	103.65011337868481	4570970	131.6001133786848	5803565	005_2016120802	should inform the chair and secretariat by email before the deadline and the objection to take the form of a reason draft motion for rejection the three delegated act ser as follows the commission delegated regulation eu of the thirty eighth of the eleven two thousand and sixteen amending regulation eu nineutyeigh two thousand and thirteen of the parliament and the council as regards adding aleminiumpouded to the list of explosive precursors	should inform the chair and secretariat by email before the deadline and the objection to take the form of a reason draft motion for rejection the three delegated act ser as follows the commission delegated regulation eu of the thirty eighth of the eleven two thousand and sixteen amending regulation eu nineutyeigh two thousand and thirteen of the parliament and the council as regards adding aleminiumpouded to the list of explosive precursors	/media/hugo/Seagate Expansion Drive/ALICE_BACKUP/voshpde/wav_files/zipfiles/2016120802.wav	0
6	/media/hugo/Seagate Expansion Drive/ALICE_BACKUP/voshpde/pipeLine/segmentation_wavfiles/2016120802/007_2016120802.wav	131.60013605442177	5803566	151.95013605442176	6701001	006_2016120802	secondly commission delegated regulation of the thirty november again adding magnesiampoude to the list of expos iv precursors and finally a commission delegated regulation of the thirty november adding magnisiam nitrateexhexahidrate cite list of explosive precursors	secondly commission delegated regulation of the thirty november again adding magnesiampoude to the list of expos iv precursors and finally a commission delegated regulation of the thirty november adding magnisiam nitrateexhexahidratecivhelist of explosive precursors	/media/hugo/Seagate Expansion Drive/ALICE_BACKUP/voshpde/wav_files/zipfiles/2016120802.wav	4
7	/media/hugo/Seagate Expansion Drive/ALICE_BACKUP/voshpde/pipeLine/segmentation_wavfiles/2016120802/008_2016120802.wav	151.95015873015873	6701002	176.70015873015873	7792477	007_2016120802	with that announcement colleagues we can move to the vote a proposal for a regulation of the parliament and the council amending regulation five six to two thousand and six as regards the reinfursement of checks against relevant data bases at external borders the rapporteur s ms macovei if you de wish to take the floor briefly	with that announcement colleagues we can move to the vote a proposal for a regulation of the parliament and the council amending regulation five six to two thousand and six as regards the reinfursement of checks against relevant databases at external borders the rapporteurs ms makove if you do wish to take the floor briefly	/media/hugo/Seagate Expansion Drive/ALICE_BACKUP/voshpde/wav_files/zipfiles/2016120802.wav	5
8	/media/hugo/Seagate Expansion Drive/ALICE_BACKUP/voshpde/pipeLine/segmentation_wavfiles/2016120802/009_2016120802.wav	176.7001814058957	7792478	192.35018140589568	8482643	008_2016120802	de ing everyone i would like to thank my colleagues for the excellent cooperation we have had we have been through	sing everyone i would like to thank my colleagues for the excellent cooperation we have had we have been through	/media/hugo/Seagate Expansion Drive/ALICE_BACKUP/voshpde/wav_files/zipfiles/2016120802.wav	3
9	/media/hugo/Seagate Expansion Drive/ALICE_BACKUP/voshpde/pipeLine/segmentation_wavfiles/2016120802/010_2016120802.wav	192.35020408163265	8482644	221.40020408163267	9763749	009_2016120802	mr presigodandmaybe less good moment but at the end of the day we have reached a good compromise solution i hope for this regulation to allow us to have a more secure europe while ensuring all our freedoms than again thank ms macovei we vote now on the text agreed during inter institutional negotiations a single vote by electronic vote to vote is open	mr presigodandmaybe less good moment but at the end of the day we have reached a good compromise solution i hope for this regulation to allow us to have a more secure europe while ensuring all our freedoms than again thank ms marcoveswek vote now on the text agreed during inter institutional negotiations a single vote by electronic vote to vote is open	/media/hugo/Seagate Expansion Drive/ALICE_BACKUP/voshpde/wav_files/zipfiles/2016120802.wav	4
10	/media/hugo/Seagate Expansion Drive/ALICE_BACKUP/voshpde/pipeLine/segmentation_wavfiles/2016120802/011_2016120802.wav	221.4002267573696	9763750	248.1502267573696	10943425	010_2016120802	and the vote is closed that is courage forty five vote it against with no abstentions congratulations to the rapporteur colleges that is the end of voting time thank you for your	and the vote is closed that is courage forty five vote it against with no abstentions congratulations to the rapporteur colleges that is the end of voting time thank you for your	/media/hugo/Seagate Expansion Drive/ALICE_BACKUP/voshpde/wav_files/zipfiles/2016120802.wav	0
11	/media/hugo/Seagate Expansion Drive/ALICE_BACKUP/voshpde/pipeLine/segmentation_wavfiles/2016120802/012_2016120802.wav	248.15024943310658	10943426	273.10024943310657	12043721	011_2016120802	cooperation and now we move to the agenda if you are not involved in that please please leave quite ly thank you you please leave quitely thank you we moved to point three and four	cooperation and now we move to the agenda if you are not involved in that please please leave quite ly thank you you please leave quitely thank you we moved to point three and four	/media/hugo/Seagate Expansion Drive/ALICE_BACKUP/voshpde/wav_files/zipfiles/2016120802.wav	0
12	/media/hugo/Seagate Expansion Drive/ALICE_BACKUP/voshpde/pipeLine/segmentation_wavfiles/2016120802/013_2016120802.wav	273.1002721088435	12043722	301.6502721088435	13302777	012_2016120802	mr president the point on the entry in exit system to register entry an exit data and smart borders points we the consideration colleagues have draft reports an decision of deadline per tabling amendments on smart borders package you if you are not involved in this i com please leave quitely thank you	present the point on the entry in exit system to register entry an exit data and smart borders points we the consideration colleagues have draft reports an decision of deadline per tabling amendments on smart borders package you if you are not involved in this i com please leave quitely thank you	/media/hugo/Seagate Expansion Drive/ALICE_BACKUP/voshpde/wav_files/zipfiles/2016120802.wav	5
13	/media/hugo/Seagate Expansion Drive/ALICE_BACKUP/voshpde/pipeLine/segmentation_wavfiles/2016120802/014_2016120802.wav	301.6502947845805	13302778	324.2002947845805	14297233	013_2016120802	the first point to be discussed will be the revised proposal for the smart borders package on six april the commission adopted the revised legislative proposal firstly on the regulation for the establishment of the entry exit system and then secondly for the proposed amendment to the schengen borders code to integrate the technical changes needed for the entry and exit	the first point to be discussed will be the revised proposal for the smart border package on six april the commission adopted the revised legislative proposal firstly on the regulation for the establishment of the entry exit system and then secondly for the proposed amendment to the schengen borders code to integrate the technical changes needed for the entry and exit	/media/hugo/Seagate Expansion Drive/ALICE_BACKUP/voshpde/wav_files/zipfiles/2016120802.wav	1
14	/media/hugo/Seagate Expansion Drive/ALICE_BACKUP/voshpde/pipeLine/segmentation_wavfiles/2016120802/015_2016120802.wav	324.2003174603175	14297234	342.65031746031747	15110879	014_2016120802	some going see immediately give the floor to mr de as de mera who was the rapporteur for both files and to present his draft to report so mr des de mera you have the very much mr president ladies and every	some going see immediately give the floor to mr diasdemera who was the rapporteur for both files and to present his draft to report so mr diasdemera you have the very much mr president ladies and every	/media/hugo/Seagate Expansion Drive/ALICE_BACKUP/voshpde/wav_files/zipfiles/2016120802.wav	8
15	/media/hugo/Seagate Expansion Drive/ALICE_BACKUP/voshpde/pipeLine/segmentation_wavfiles/2016120802/016_2016120802.wav	342.6503401360544	15110880	362.4003401360544	15981855	015_2016120802	ii would like to present two draft reports as the chair mentioned that refer to the smart borders package the proposal for regulation establishing an entry exit system determining the conditions for access to the ees for law enforcement purposes	i would like to present two draft reports as the chairmen mentioned that refer to the smart borders package the proposal for regulation establishing an entry exit system determining the conditions for access to the ees for law enforcement purposes	/media/hugo/Seagate Expansion Drive/ALICE_BACKUP/voshpde/wav_files/zipfiles/2016120802.wav	4
16	/media/hugo/Seagate Expansion Drive/ALICE_BACKUP/voshpde/pipeLine/segmentation_wavfiles/2016120802/017_2016120802.wav	362.4003628117914	15981856	386.3503628117914	17038051	016_2016120802	an one hundred and forty two amendments have been tabled that is the first report and the second one is a proposal for regulation amending the schengen code with regard to the use of the entry exit system and here there are seventeen amendments tabled as you know both reports are inextricably linked	an one hundred and forty two amendments have been tabled that is the first report and the second one is a proposal for regulation amending the schengen code with regard to the use of the entry exit system and here there are seventeen amendments tabled as you know both reports are inextricably linked	/media/hugo/Seagate Expansion Drive/ALICE_BACKUP/voshpde/wav_files/zipfiles/2016120802.wav	0
17	/media/hugo/Seagate Expansion Drive/ALICE_BACKUP/voshpde/pipeLine/segmentation_wavfiles/2016120802/018_2016120802.wav	386.35038548752834	17038052	407.90038548752835	17988407	017_2016120802	so that means that the amendments tabled to table to both reports has an impact on both over the last few years the flows over the borders has shown that the current border control of border check system is inefficient	so that means that the amendments tabled to table to both reports has an impact on both over the last few years the flows over the borders has shown that the current border control of border check system is inefficient	/media/hugo/Seagate Expansion Drive/ALICE_BACKUP/voshpde/wav_files/zipfiles/2016120802.wav	0
18	/media/hugo/Seagate Expansion Drive/ALICE_BACKUP/voshpde/pipeLine/segmentation_wavfiles/2016120802/019_2016120802.wav	407.9004081632653	17988408	428.9504081632653	18916713	018_2016120802	and this could become worse given that given the flow estimates and forecasts for the next few years so therefore it is necessary to overhall the crossing system and traveller system in order to make the system more efficient	and this could become worse given that given the flow estimates and forecasts for the next few years so therefore it is necessary to overhall the crossing system and traveller system in order to make the system more efficient	/media/hugo/Seagate Expansion Drive/ALICE_BACKUP/voshpde/wav_files/zipfiles/2016120802.wav	0
19	/media/hugo/Seagate Expansion Drive/ALICE_BACKUP/voshpde/pipeLine/segmentation_wavfiles/2016120802/020_2016120802.wav	428.95043083900225	18916714	446.00043083900226	19668619	019_2016120802	safer more secure if we do not do that our border posts and the whole system will just crumbol and it will is also necessary to invest in infrastructure and staff in order to manage these flows	safer more secure if we do not do that our border posts and the whole system will just crumbol and it will is also necessary to invest in infrastructure and staff in order to manage these flows	/media/hugo/Seagate Expansion Drive/ALICE_BACKUP/voshpde/wav_files/zipfiles/2016120802.wav	0
20	/media/hugo/Seagate Expansion Drive/ALICE_BACKUP/voshpde/pipeLine/segmentation_wavfiles/2016120802/021_2016120802.wav	446.0004535147392	19668620	468.0504535147392	20641025	020_2016120802	setting up a european entry in exit system will be benefit travellers because it means that they will spend less time it border crossings would also help member states because they will be able to process those who are travelling in good faith and it will also boost border security in	setting up a european entry in exit system will be benefit travellers because it means that they will spend less time it border crossings would also help member states because they will be able to process those who are travelling in good faith and it will also boost border security in	/media/hugo/Seagate Expansion Drive/ALICE_BACKUP/voshpde/wav_files/zipfiles/2016120802.wav	0
21	/media/hugo/Seagate Expansion Drive/ALICE_BACKUP/voshpde/pipeLine/segmentation_wavfiles/2016120802/022_2016120802.wav	468.0504761904762	20641026	492.4004761904762	21714861	021_2016120802	i think that we can strike a balance between speeding up the whole process but also making sure the there is security i also think that the infrastructure operators will benefit because transit areas will see the whole process speeded up and there will be direct and indirect benefits stemming from this	i think that we can strike a balance between speeding up the whole process but also making sure the there is security i also think that the infrastructure operators will benefit because transit areas will see the whole process speeded up and there will be direct and indirect benefits stemming from this	/media/hugo/Seagate Expansion Drive/ALICE_BACKUP/voshpde/wav_files/zipfiles/2016120802.wav	0
22	/media/hugo/Seagate Expansion Drive/ALICE_BACKUP/voshpde/pipeLine/segmentation_wavfiles/2016120802/023_2016120802.wav	492.4004988662131	21714862	518.9504988662131	22885717	022_2016120802	border post and border crossing managers and carriers will also benefit because it will be easier for them to carry out their tasks and all of this will occur while at the same time we protect fundamental rights and freedoms and we will also be protecting the data in the system this has been one of my major concerns and you will see this reflected in my report	border post and border crossing managers and carriers will also benefit because it will be easier for them to carry out their tasks and all of this will occur while at the same time we protect fundamental rights and freedoms and we will also be protecting the data in the system this has been one of my major concerns and you will see this reflected in my report	/media/hugo/Seagate Expansion Drive/ALICE_BACKUP/voshpde/wav_files/zipfiles/2016120802.wav	0
23	/media/hugo/Seagate Expansion Drive/ALICE_BACKUP/voshpde/pipeLine/segmentation_wavfiles/2016120802/024_2016120802.wav	518.9505215419501	22885718	548.1005215419501	24171233	023_2016120802	ii many of the amendments that i have tabled have been tabled in order to protect the data in the system in both draft reports i have analysed the following aspects the objectives structure and interoperability with the vis budget biometrics protecting data and fundamental rights the data conservation period	many of the amendments that i have tabled have been tabled in order to protect the data in the system in both draft reports i have analysed the following aspects the objectives structure and interoperability with the vis budget biometrics protecting data and fundamental rights the data conservation period	/media/hugo/Seagate Expansion Drive/ALICE_BACKUP/voshpde/wav_files/zipfiles/2016120802.wav	3
24	/media/hugo/Seagate Expansion Drive/ALICE_BACKUP/voshpde/pipeLine/segmentation_wavfiles/2016120802/025_2016120802.wav	548.1005442176871	24171234	576.550544217687	25425879	024_2016120802	law enforcement access to data travellers and governance the objectives that i am striving to achieve with a draft reports are the following i want to boost legal certainty and data protection especially when it comes to the right to access modify or delete information	law enforcement access to data travellers and governance the objectives that i am striving to achieve with a draft reports are the following i want to boost legal certainty and data protection especially when it comes to the right to access modify or delete information	/media/hugo/Seagate Expansion Drive/ALICE_BACKUP/voshpde/wav_files/zipfiles/2016120802.wav	0
25	/media/hugo/Seagate Expansion Drive/ALICE_BACKUP/voshpde/pipeLine/segmentation_wavfiles/2016120802/026_2016120802.wav	576.550566893424	25425880	604.700566893424	26667295	025_2016120802	the amendments that i have tabled aim to boost the role of the european data protection supervisor the edps as well as the national data protection supervisors and the procedure that travellers have to follow when they want their file or the individual file to be changed thinking about the issue of finger prints and the need	the amendments that i have tabled aim to boost the role of the european data protection supervisor the edps as well as the national data protection supervisors and the procedure that travellers have to follow when they want their file or the individual file to be changed thinking about the issue of finger prints and the need	/media/hugo/Seagate Expansion Drive/ALICE_BACKUP/voshpde/wav_files/zipfiles/2016120802.wav	0
26	/media/hugo/Seagate Expansion Drive/ALICE_BACKUP/voshpde/pipeLine/segmentation_wavfiles/2016120802/027_2016120802.wav	604.700589569161	26667296	630.250589569161	27794051	026_2016120802	to look at that i also want to boost the role of law enforcement agencies they need to be able to access the system from the outset but at the same time we have to make sure that there are legal safeguards and that it is only those who are legally authorised that can access the information the data and for only	to look at that i also want to boost the role of law enforcement agencies they need to be able to access the system from the outset but at the same time we have to make sure that there are legal safeguards and that it is only those who are legally authorised that can access the information the data and for only	/media/hugo/Seagate Expansion Drive/ALICE_BACKUP/voshpde/wav_files/zipfiles/2016120802.wav	0
27	/media/hugo/Seagate Expansion Drive/ALICE_BACKUP/voshpde/pipeLine/segmentation_wavfiles/2016120802/028_2016120802.wav	630.250612244898	27794052	645.500612244898	28466577	027_2016120802	legal purposes and of course i have followed the indications given by mr butadeli the edps	legal purposes and of course i have followed the indications given by mr butadeli the edps	/media/hugo/Seagate Expansion Drive/ALICE_BACKUP/voshpde/wav_files/zipfiles/2016120802.wav	0
28	/media/hugo/Seagate Expansion Drive/ALICE_BACKUP/voshpde/pipeLine/segmentation_wavfiles/2016120802/029_2016120802.wav	645.5006349206349	28466578	669.5506349206349	29527183	028_2016120802	another objective is more technical certainty and safeguards we have to make sure we now exactly whom and under what circumstances will have access to the system and i am also looking at the procedures that have to be followed if there are temporary technical there is temporary technical failure or if there are problems which means that data has to be entered manually eu	another objective is more technical certainty and safeguards we have to make sure we now exactly whom and under what circumstances will have access to the system and i am also looking at the procedures that have to be followed if there are temporary technical there is temporary technical failure or if there are problems which means that data has to be entered manually	/media/hugo/Seagate Expansion Drive/ALICE_BACKUP/voshpde/wav_files/zipfiles/2016120802.wav	3
29	/media/hugo/Seagate Expansion Drive/ALICE_BACKUP/voshpde/pipeLine/segmentation_wavfiles/2016120802/030_2016120802.wav	669.5506575963719	29527184	691.9006575963718	30512819	029_2016120802	now the entry and exit system also has to reflect current legislation on data protection and any other legislative packages that are currently being worked on or that might exist in the future i am thinking about eurodac or ets	now the entry and exit system also has to reflect current legislation on data protection and any other legislative packages that are currently being worked on or that might exist in the future i am thinking about eurodac or ets	/media/hugo/Seagate Expansion Drive/ALICE_BACKUP/voshpde/wav_files/zipfiles/2016120802.wav	0
30	/media/hugo/Seagate Expansion Drive/ALICE_BACKUP/voshpde/pipeLine/segmentation_wavfiles/2016120802/031_2016120802.wav	691.9006802721088	30512820	714.7506802721089	31520505	030_2016120802	i also want to make sure that there is legislative consistency i want all articles and definitions to data perfectly i am going to make sure that when fingerprints are taken and facial images are taken very high standards are met so that in both cases data	i also want to make sure that there is legislative consistency i want all articles and definitions to dovetail perfectly i am going to make sure that when fingerprints are taken and facial images are taken very high standards are met so that in both cases data	/media/hugo/Seagate Expansion Drive/ALICE_BACKUP/voshpde/wav_files/zipfiles/2016120802.wav	5
