	wavfile	start_seconds	start_frames	end_seconds	end_frames	identifier	inferred_text_with_hotwords	inferred_text_without_hotwords	motherfile	dist
0	/media/hugo/Seagate Expansion Drive/ALICE_BACKUP/voshpde/pipeLine/segmentation_wavfiles/2016061602/001_2016061602.wav	0.0	0	24.75	1091475	000_2016061602	mrs le welcome to the after mon session before starting with the public hearing we will proceed to the presentation of the report on the libe mission to the agency for fundamental rights in vienna which took place on seventeen eighteen m two thousand and sixteen	mr welcome to the after mon session before starting with the public hearing we will proceed to the presentation of the report on the libya mission to the agency for fundamental rights in vienna which took place on seventeen eighteen m two thousand and sixteen	/media/hugo/Seagate Expansion Drive/ALICE_BACKUP/voshpde/wav_files/zipfiles/2016061602.wav	6
1	/media/hugo/Seagate Expansion Drive/ALICE_BACKUP/voshpde/pipeLine/segmentation_wavfiles/2016061602/002_2016061602.wav	24.75002267573696	1091476	50.30002267573696	2218231	001_2016061602	the presentation was ceduledforthfor this morning but du to last minute changes in the agenda had to be postponed mr nagy head of delegation and reporter for the fundamental rights report two thousand and fifteen will present the outcome of this visit please mr nagy you have flood	the presentation was scheduled for the for this morning but due to last minute changes in the agenda had to be postponed mr nagui head of delegation and reporter for the fundamental rights report two thousand and fifteen will present the outcome of this visit please mr nagiyouhavflored	/media/hugo/Seagate Expansion Drive/ALICE_BACKUP/voshpde/wav_files/zipfiles/2016061602.wav	16
2	/media/hugo/Seagate Expansion Drive/ALICE_BACKUP/voshpde/pipeLine/segmentation_wavfiles/2016061602/003_2016061602.wav	50.300045351473926	2218232	66.25004535147393	2921627	002_2016061602	thank you very much so we had two weeks ago very pleasant with it in vienna the participants we had been three madmchiniktuniqiand	thank you very much so we had two weeks ago very pleasant with it in vienna the participants we had been three madmchiniktuniqiand	/media/hugo/Seagate Expansion Drive/ALICE_BACKUP/voshpde/wav_files/zipfiles/2016061602.wav	0
3	/media/hugo/Seagate Expansion Drive/ALICE_BACKUP/voshpde/pipeLine/segmentation_wavfiles/2016061602/004_2016061602.wav	66.25006802721089	2921628	84.40006802721088	3722043	003_2016061602	and the karens back and the staff members of the libe secretariat the director mic offlaty welcomed us and intoaduce thus the agency the work of the agency the multiannual framework	and the karens back and the staff members of the libel secretariat the director mic offlaty welcomed us and intoaduce thus the agency the work of the agency the multiannual framework	/media/hugo/Seagate Expansion Drive/ALICE_BACKUP/voshpde/wav_files/zipfiles/2016061602.wav	1
4	/media/hugo/Seagate Expansion Drive/ALICE_BACKUP/voshpde/pipeLine/segmentation_wavfiles/2016061602/005_2016061602.wav	84.40009070294785	3722044	106.35009070294785	4690039	004_2016061602	and the agency is a key departments we can we could learn about working methods research serves and events and we were also invited and i would like to invite all our colleagues to the next week fundamental rights forum in vienna	and the agency is a key departments we can we could learn about working methods research serves and events and we were also invited and i would like to invite all our colleagues to the next week fundamental rights forum in vienna	/media/hugo/Seagate Expansion Drive/ALICE_BACKUP/voshpde/wav_files/zipfiles/2016061602.wav	0
5	/media/hugo/Seagate Expansion Drive/ALICE_BACKUP/voshpde/pipeLine/segmentation_wavfiles/2016061602/006_2016061602.wav	106.35011337868481	4690040	128.4001133786848	5662445	005_2016061602	we also had information about fra s fundamental rights agency work in greece in the hatsparts and we met also different stakeholders national lives on officer national human rights institutions and ngos as well	we also had information about fra s fundamental rights agency work in greece in the hatsparts and we met also different stakeholders national lives on officers national human rights institutions and ngos as well	/media/hugo/Seagate Expansion Drive/ALICE_BACKUP/voshpde/wav_files/zipfiles/2016061602.wav	1
6	/media/hugo/Seagate Expansion Drive/ALICE_BACKUP/voshpde/pipeLine/segmentation_wavfiles/2016061602/007_2016061602.wav	128.40013605442178	5662446	147.85013605442177	6520191	006_2016061602	the fra preparing a report this year special focus on is asylum and migration and it will be discussed more detailed in the fundamental rights forum the delegation stressed that	the fra preparing a report this year special focus on is asylome and migration and it will be discussed more detailed in the fundamental rights forum the delegation stressed that	/media/hugo/Seagate Expansion Drive/ALICE_BACKUP/voshpde/wav_files/zipfiles/2016061602.wav	2
7	/media/hugo/Seagate Expansion Drive/ALICE_BACKUP/voshpde/pipeLine/segmentation_wavfiles/2016061602/008_2016061602.wav	147.85015873015874	6520192	176.30015873015873	7774837	007_2016061602	there is a need for the fra to continue the strengthening of the role of the civil society organisation and national also the national parliament cooperation the report on promising practices in the member states keep an active role in increases crises such as a recent migration crises crisis entual protection of vulnerable people in the eu especially children	there is a need for the fra to continue the strengthening of the role of the civil society organisation and national also the national parliaments cooperation the report on promising practices in the member states keep an active role in increases crises such as a recent migration crises crisis entual protection of vulnerable people in the eu especially children	/media/hugo/Seagate Expansion Drive/ALICE_BACKUP/voshpde/wav_files/zipfiles/2016061602.wav	1
8	/media/hugo/Seagate Expansion Drive/ALICE_BACKUP/voshpde/pipeLine/segmentation_wavfiles/2016061602/009_2016061602.wav	176.3001814058957	7774838	204.35018140589568	9011843	008_2016061602	and continue the will continue high quality surveys de reports which can give us reliable data for or work and in this case we asked the fra to make much proactively to offer us special reports and special help in our work so that in	and continue they will continue high quality surveys and the reports which can give us reliable data for or work and in this case we asked the fra to make much proactively to offer us special reports and special help in our work so that in	/media/hugo/Seagate Expansion Drive/ALICE_BACKUP/voshpde/wav_files/zipfiles/2016061602.wav	6
9	/media/hugo/Seagate Expansion Drive/ALICE_BACKUP/voshpde/pipeLine/segmentation_wavfiles/2016061602/010_2016061602.wav	204.35020408163265	9011844	231.90020408163267	10226799	009_2016061602	mr de i would like to ask mrs if would like to take president yes de was part of the commission and i would confirm	mr i would like to ask ms if would like to take president yes was part of the commission and i would confirm	/media/hugo/Seagate Expansion Drive/ALICE_BACKUP/voshpde/wav_files/zipfiles/2016061602.wav	7
10	/media/hugo/Seagate Expansion Drive/ALICE_BACKUP/voshpde/pipeLine/segmentation_wavfiles/2016061602/011_2016061602.wav	231.9002267573696	10226800	252.6502267573696	11141875	010_2016061602	but the head of mission has just said at the meeting in from got as we were able to make ot quentes with the work done by the agency in the context of protecting human rights they were thing working methods and the	but the head of mission has just said at the meeting in from goutes we were able to make ot quentes with the work done by the agency in the context of protecting human rights they were thing marking methods and the	/media/hugo/Seagate Expansion Drive/ALICE_BACKUP/voshpde/wav_files/zipfiles/2016061602.wav	5
11	/media/hugo/Seagate Expansion Drive/ALICE_BACKUP/voshpde/pipeLine/segmentation_wavfiles/2016061602/012_2016061602.wav	252.65024943310658	11141876	281.60024943310657	12418571	011_2016061602	inquiry the survey leading to the findings and than the fine kings and the important contribution that this is represents to national governments of us for us to it is an important contribution in the european institutions a number of issues were looked at in terms of the agencies were can now ana wen probably what	inquiry the survey leading to the findings and than the fine nings and the important contribution that this is is represents to national governments of us for us to it is an important contribution in the european institutions a number of issues were looked at in terms of the agencies were can now on of wen probably what	/media/hugo/Seagate Expansion Drive/ALICE_BACKUP/voshpde/wav_files/zipfiles/2016061602.wav	8
12	/media/hugo/Seagate Expansion Drive/ALICE_BACKUP/voshpde/pipeLine/segmentation_wavfiles/2016061602/013_2016061602.wav	281.6002721088435	12418572	298.95027210884354	13183707	012_2016061602	was after most interest towards was attention to the protection of human rights in the context of the migration phenomenon so very complex phenomenon and i think of course we can ever forget the need to protect	was after most interest towards was attention to the protection of human rights in the context of the migration phenomenon so very complex phenomenon and i think of course we can ever forget the need to protect	/media/hugo/Seagate Expansion Drive/ALICE_BACKUP/voshpde/wav_files/zipfiles/2016061602.wav	0
13	/media/hugo/Seagate Expansion Drive/ALICE_BACKUP/voshpde/pipeLine/segmentation_wavfiles/2016061602/014_2016061602.wav	298.9502947845805	13183708	320.3002947845805	14125243	013_2016061602	people who are forced to leave their countries and seek better was better life in europe and what was particularly struck me was the fact that for a number of months now fra has detached expertcy sort of task force sent to greece	people who are forced to leave their countries and seek better was better life in europe and what was particularly struck me was the fact that for a number of months now fra has detached expertcy sort of task force sent to greece	/media/hugo/Seagate Expansion Drive/ALICE_BACKUP/voshpde/wav_files/zipfiles/2016061602.wav	0
14	/media/hugo/Seagate Expansion Drive/ALICE_BACKUP/voshpde/pipeLine/segmentation_wavfiles/2016061602/015_2016061602.wav	320.30031746031744	14125244	343.05031746031744	15128519	014_2016061602	as we know in greece where some extremely complex situations involving migrants and migrals i believe that the fra work is valuable in two ways it gives specific support to member states and it also is a witness to the need to	as we know in greece where some extremely complex situations involving migrants and migrals i believe that the fra work is valuable in two ways it gives specific support to member states and it also is a witness to the need to	/media/hugo/Seagate Expansion Drive/ALICE_BACKUP/voshpde/wav_files/zipfiles/2016061602.wav	0
15	/media/hugo/Seagate Expansion Drive/ALICE_BACKUP/voshpde/pipeLine/segmentation_wavfiles/2016061602/016_2016061602.wav	343.05034013605444	15128520	366.6003401360544	16167075	015_2016061602	look into the human rights conditions of migrants and verify that they are complied with the idea of be the end book for operators dealing with migration and asylum issues is a good at de at is an important	look into the human rights conditions of migrants and verify that they are complied with the idea of be the end book for operators dealing with migration and asylum issues is a good age at is an important	/media/hugo/Seagate Expansion Drive/ALICE_BACKUP/voshpde/wav_files/zipfiles/2016061602.wav	3
16	/media/hugo/Seagate Expansion Drive/ALICE_BACKUP/voshpde/pipeLine/segmentation_wavfiles/2016061602/017_2016061602.wav	366.6003628117914	16167076	390.95036281179136	17240911	016_2016061602	and interesting as you indeed i self suggested something seminar in january i was thinking of course of unaccompany it miners so of correction aimed at identifying or producing a manual who explaining what eu be done for migrants especially for the more vulnerable de	and interesting as you indeed i self suggested something seminar in january i was thinking of course of unaccompany it miners so of correction aimed at identifying or producing a manual who explaining what i be done for migrants especially for the more vulnerable	/media/hugo/Seagate Expansion Drive/ALICE_BACKUP/voshpde/wav_files/zipfiles/2016061602.wav	5
17	/media/hugo/Seagate Expansion Drive/ALICE_BACKUP/voshpde/pipeLine/segmentation_wavfiles/2016061602/018_2016061602.wav	390.95038548752837	17240912	412.70038548752837	18200087	017_2016061602	minors kind of handbook to deal with the m migration phenomenon i think would be an important support for our work and for the work of those who work in this field	minors kind of handbook to deal with the m migration phenomenon i think would be an important support for our work and for the work of those who work in this field	/media/hugo/Seagate Expansion Drive/ALICE_BACKUP/voshpde/wav_files/zipfiles/2016061602.wav	0
18	/media/hugo/Seagate Expansion Drive/ALICE_BACKUP/voshpde/pipeLine/segmentation_wavfiles/2016061602/019_2016061602.wav	412.7004081632653	18200088	432.7504081632653	19084293	018_2016061602	so this mission i think confirm how important the work come by the agency is and confound the importance of parliament and all institutions helping the institute of the tran	so this mission i think confirm how important the work come by the agency is and confound the importance of parliament and all institutions helping the institute of the fora	/media/hugo/Seagate Expansion Drive/ALICE_BACKUP/voshpde/wav_files/zipfiles/2016061602.wav	3
19	/media/hugo/Seagate Expansion Drive/ALICE_BACKUP/voshpde/pipeLine/segmentation_wavfiles/2016061602/020_2016061602.wav	432.75043083900226	19084294	461.40043083900224	20347759	019_2016061602	thank you very much i think your recommendations as well as the recommendation of mr nagy will be very fruitful for our future debate now their members de speakers ladies and gentlemen it is a pleasure to welcome you to this hearing on the situation of fundamental rights in the european union in two thousand and fifteen on behalf of mrs	thank you very much i think your recommendations as well as the recommendation of mr nagui will be very fruitful for our future debate now their members der speakers ladies and gentlemen it is a pleasure to welcome you to this hearing on the situation of fundamental rights in the european union in two thousand and fifteen on behalf of mr	/media/hugo/Seagate Expansion Drive/ALICE_BACKUP/voshpde/wav_files/zipfiles/2016061602.wav	4
20	/media/hugo/Seagate Expansion Drive/ALICE_BACKUP/voshpde/pipeLine/segmentation_wavfiles/2016061602/021_2016061602.wav	461.40045351473924	20347760	478.5504535147392	21104075	020_2016061602	clod maras who has asked mere as a vice chair of the libe committee to represent him this afternoon it has now become a tradition to libe to organise this hearing excuse being	clod maras who has asked mere as a vice chair of the libe committee to represent him this afternoon it has now become a tradition to libe to organise this hearing excuse being	/media/hugo/Seagate Expansion Drive/ALICE_BACKUP/voshpde/wav_files/zipfiles/2016061602.wav	0
21	/media/hugo/Seagate Expansion Drive/ALICE_BACKUP/voshpde/pipeLine/segmentation_wavfiles/2016061602/022_2016061602.wav	478.5504761904762	21104076	499.5004761904762	22027971	021_2016061602	to organise this hearing in the context of our works on the annual report on the situation of fundamental rights in the european union and we are very pleased to welcome the representatives of the eu institutions and to present the members the work that is being done in this field	to organise this hearing in the context of our works on the annual report on the situation of fundamental rights in the european union and we are very pleased to welcome the representatives of the eu institutions and to present the members the work that is being done in this field	/media/hugo/Seagate Expansion Drive/ALICE_BACKUP/voshpde/wav_files/zipfiles/2016061602.wav	0
22	/media/hugo/Seagate Expansion Drive/ALICE_BACKUP/voshpde/pipeLine/segmentation_wavfiles/2016061602/023_2016061602.wav	499.50049886621315	22027972	526.1504988662132	23203237	022_2016061602	mr pr in this resolution of eight september two thousand and fifteen on the situation of fundamental rights in the european union the european parliament rated that it is essential for the european union its institutions and the member states to guarantee the respect and the promotion of the common european values listed in article two	mr preen in this resolution of eight september two thousand and fifteen on the situation of fundamental rights in the european union the european parliament rated that it is essential for the european union its institutions and the member states to guarantee the respect and the promotion of the common european values listed in article two	/media/hugo/Seagate Expansion Drive/ALICE_BACKUP/voshpde/wav_files/zipfiles/2016061602.wav	3
23	/media/hugo/Seagate Expansion Drive/ALICE_BACKUP/voshpde/pipeLine/segmentation_wavfiles/2016061602/024_2016061602.wav	526.1505215419501	23203238	554.9005215419501	24471113	023_2016061602	of the eu and in the eu charter of fundamental rights this should be done in european and national legislation in public policies and in the implementation why fully representing the principle of subsidiarity i am happy to give mr nagy the flow again for his introductory remarks please mr nagy you have a floor	of the eu and in the eu charter of fundamental rights this should be done in european and national legislation in public policies and in the implementation why fully representing the principle of subsidiarity i am happy to give mr nagy the flow again for his introductory remarks please mr nagui you have a floor	/media/hugo/Seagate Expansion Drive/ALICE_BACKUP/voshpde/wav_files/zipfiles/2016061602.wav	2
24	/media/hugo/Seagate Expansion Drive/ALICE_BACKUP/voshpde/pipeLine/segmentation_wavfiles/2016061602/025_2016061602.wav	554.9005442176871	24471114	576.1505442176871	25408239	024_2016061602	thank you very much so as the repot rapporteur of the the rapporteur on the situation of the fundamental rights in the european union of this year i am pleased to be here in this peace hearing and	thank you very much so as the repot rapporteur of the the rapporteur on the situation of the fundamental rights in the european union of this year i am pleased to be here in this peace hearing and	/media/hugo/Seagate Expansion Drive/ALICE_BACKUP/voshpde/wav_files/zipfiles/2016061602.wav	0
25	/media/hugo/Seagate Expansion Drive/ALICE_BACKUP/voshpde/pipeLine/segmentation_wavfiles/2016061602/026_2016061602.wav	576.1505668934241	25408240	591.600566893424	26089585	025_2016061602	get are really fruitful discussion about fundamental rights these rights are very important in all everyday lives and they are protecting us as individuals and also us as members groups	get are really fruitful discussion about fundamental rights these rights are very important in all everyday lives and they are protecting us as individuals and also us as members groups	/media/hugo/Seagate Expansion Drive/ALICE_BACKUP/voshpde/wav_files/zipfiles/2016061602.wav	0
26	/media/hugo/Seagate Expansion Drive/ALICE_BACKUP/voshpde/pipeLine/segmentation_wavfiles/2016061602/027_2016061602.wav	591.600589569161	26089586	617.250589569161	27220751	026_2016061602	nobody of us may or everybody of us belongs to a group which may be could need this protection if body of us belongs to a minority any kind which need protection of the law and these these rights are really really legally guaranteed	nobody of us may or everybody of us belongs to a group which may be could need this protection if body of us belongs to a minority any kind which need protection of the law and these these rights are really really legally guaranteed	/media/hugo/Seagate Expansion Drive/ALICE_BACKUP/voshpde/wav_files/zipfiles/2016061602.wav	0
27	/media/hugo/Seagate Expansion Drive/ALICE_BACKUP/voshpde/pipeLine/segmentation_wavfiles/2016061602/028_2016061602.wav	617.250612244898	27220752	637.400612244898	28109367	027_2016061602	but but many times they are not implemented so i think it is we we have to use any any possibility to stress the imo importance of the fundamental rights and if the european union is a leading	but but many times they are not implemented so i think it is we we have to use any any possibility to stress the imo importance of the fundamental rights and if the european union is a leading	/media/hugo/Seagate Expansion Drive/ALICE_BACKUP/voshpde/wav_files/zipfiles/2016061602.wav	0
28	/media/hugo/Seagate Expansion Drive/ALICE_BACKUP/voshpde/pipeLine/segmentation_wavfiles/2016061602/029_2016061602.wav	637.400634920635	28109368	664.4506349206349	29302273	028_2016061602	leading part the whole de word in the fundamental rights we have to know what is the situation in side of europe and if we stress the countries which would like to enter our union we have to now also about the situation inside because it is sometimes very very problematic that we have sometimes much more	leading part the whole the word in the fundamental rights we have to know what is the situation in side of europe and if we stress the countries which would like to enter our union we have to now also about the situation inside because it is sometimes very very problematic that we have sometimes much more	/media/hugo/Seagate Expansion Drive/ALICE_BACKUP/voshpde/wav_files/zipfiles/2016061602.wav	2
29	/media/hugo/Seagate Expansion Drive/ALICE_BACKUP/voshpde/pipeLine/segmentation_wavfiles/2016061602/030_2016061602.wav	664.4506575963719	29302274	688.1006575963719	30345239	029_2016061602	much more demand on fundamental rights issues in other countries than than in our home so i i am happy that could talk here in different topics also about roma rights the rights of des disabled lgbti rights and i am very happy	a much more demand on fundamental rights issues in other countries than than in or ham so i i am happy that could talk here in different topics also about roma rights the rights of this disabled lgbti rights and i am very happy	/media/hugo/Seagate Expansion Drive/ALICE_BACKUP/voshpde/wav_files/zipfiles/2016061602.wav	8
30	/media/hugo/Seagate Expansion Drive/ALICE_BACKUP/voshpde/pipeLine/segmentation_wavfiles/2016061602/031_2016061602.wav	688.1006802721089	30345240	704.3506802721089	31061865	030_2016061602	that as i am belonging to a national minority in europe which is forty forty million people in europe belonging to national minorities that also we have speaker here about national minority situation	that as i am belonging to a national minority in europe which is forty forty million people in europe belonging to national minorities that also we have speaker here about national minority situation	/media/hugo/Seagate Expansion Drive/ALICE_BACKUP/voshpde/wav_files/zipfiles/2016061602.wav	0
31	/media/hugo/Seagate Expansion Drive/ALICE_BACKUP/voshpde/pipeLine/segmentation_wavfiles/2016061602/032_2016061602.wav	704.3507029478458	31061866	730.7007029478458	32223901	031_2016061602	and i would i am very happy that in the last years these topic also get its own importance in european parliament and that or we members are more and more open to talk about their rights in a constructive way and and i believe that also here and also in the	and i would i am very happy that in the last years these topic also get its own importance in european parliament and that or we members are more and more open to talk about their rights in a constructive way and and i believe that also here and also in the	/media/hugo/Seagate Expansion Drive/ALICE_BACKUP/voshpde/wav_files/zipfiles/2016061602.wav	0
32	/media/hugo/Seagate Expansion Drive/ALICE_BACKUP/voshpde/pipeLine/segmentation_wavfiles/2016061602/033_2016061602.wav	730.7007256235828	32223902	751.9507256235828	33161027	032_2016061602	report we can support also some issues in this way so thank you very much and i am happy to her your presentations thank you thank you for your chair presentation now i will give the floor to our guest speacovers and at the end of each of the two sertions	report we can support also some issues in this way so thank you very much and i am happy to her your presentations thank you thank you for your share presentation now i will give the floor to our guest speacovers and at the end of each of the two sertions	/media/hugo/Seagate Expansion Drive/ALICE_BACKUP/voshpde/wav_files/zipfiles/2016061602.wav	3
33	/media/hugo/Seagate Expansion Drive/ALICE_BACKUP/voshpde/pipeLine/segmentation_wavfiles/2016061602/034_2016061602.wav	751.9507482993197	33161028	767.2007482993197	33833553	033_2016061602	there will be a time for a questions and answer please know that this hearing is webstreamed and that the interventions of speakers and participants will be recordered	there will be a time for a questions and answer please know that this hearing is webstreamed and that the interventions of speakers and participants will be recordered	/media/hugo/Seagate Expansion Drive/ALICE_BACKUP/voshpde/wav_files/zipfiles/2016061602.wav	0
