	wavfile	start_seconds	start_frames	end_seconds	end_frames	identifier	inferred_text_with_hotwords	inferred_text_without_hotwords	motherfile	dist
239	/media/hugo/Seagate Expansion Drive/ALICE_BACKUP/voshpde/pipeLine/segmentation_wavfiles/2016040702/240_2016040702.wav	5307.7554195011335	234072014	5334.905419501134	235269329	239_2016040702	with our citizens and we need to work together not only for political fighting is for citizens sits for democracy and this is for the future so again this is like political statement now but i think that it is important that we need to work on that and have much more adjust to the real situation and real possibilities of assessment of the situations tools and	with our citizens and we need to work together not only for political fighting is for citizens sits for democracy and this is for the future so again this is like political statement now but i think that it is important that we need to work on that and have much more adjust to the real situation and real possibilities of assessment of the situations tools and	/media/hugo/Seagate Expansion Drive/ALICE_BACKUP/voshpde/wav_files/zipfiles/2016040702.wav	0
240	/media/hugo/Seagate Expansion Drive/ALICE_BACKUP/voshpde/pipeLine/segmentation_wavfiles/2016040702/241_2016040702.wav	5334.905442176871	235269330	5362.155442176871	236471055	240_2016040702	thank you very much soffiforyour initiative yes because i think that it is important and if i remember of eu first discussion it was also the idea presented by eu of the pact on democracy because the question is this is not only for european institutions to have some tools for assessment mechanisms of democracy this is also the question how to involve	thank you very much soffiforyour initiative yes because i think that it is important and if i remember of a first discussion it was also the idea presented by you of the pact on democracy because the question is this is not only for european institutions to have some tools for assessment mechanisms of democracy this is also the question how to involve	/media/hugo/Seagate Expansion Drive/ALICE_BACKUP/voshpde/wav_files/zipfiles/2016040702.wav	4
241	/media/hugo/Seagate Expansion Drive/ALICE_BACKUP/voshpde/pipeLine/segmentation_wavfiles/2016040702/242_2016040702.wav	5362.155464852608	236471056	5382.5054648526075	237368491	241_2016040702	countries and how to evolve citizens from the countries to that process of assessing mechanism of democracy pa an think so fenfeldalsowant to come i do not really have a question because of course i have been in touch with the the	countries and how to evolve citizens from the countries to that process of assessing mechanism of democracy otanitinksofenfeldalsowanttocomei do not really have a question because of course i have been in touch with the the	/media/hugo/Seagate Expansion Drive/ALICE_BACKUP/voshpde/wav_files/zipfiles/2016040702.wav	10
242	/media/hugo/Seagate Expansion Drive/ALICE_BACKUP/voshpde/pipeLine/segmentation_wavfiles/2016040702/243_2016040702.wav	5382.505487528345	237368492	5409.655487528345	238565807	242_2016040702	the researchers and the authors of the report already us that what struck me s mit what you also sid that we we do not actually man article two is is basically the real opening article of the treaties article one as i always say only says a low and then article two what it is all about and then you find and i have been reading all the reports and an other reports as well that i got	the researchers and the authors of the report already is that what struck me s mit what you also sid that we we do not actually man article two is is basically the real opening article of the treaties article one as i always say only says a low and then article two what it is all about and then you find and i have been reading all the reports and an other reports as well that i got	/media/hugo/Seagate Expansion Drive/ALICE_BACKUP/voshpde/wav_files/zipfiles/2016040702.wav	1
243	/media/hugo/Seagate Expansion Drive/ALICE_BACKUP/voshpde/pipeLine/segmentation_wavfiles/2016040702/244_2016040702.wav	5409.655510204082	238565808	5439.405510204082	239877783	243_2016040702	it is impossible to find a proper legal base for the actual putting into practice of the values so in the end i have opted for the instrument of an interinstitutional agreement for one of something better and i have been peacingly together a little bit like the like to monster frankanch time but is very strange that there is not a	it is impossible to find a proper legal base for the actual putting into practice of the values so in the end i have opted for the instrument of an interinstitutional agreement for one of something better and i have been peacingly together a little bit like the like to monster frankanch time but is very strange that there is not a	/media/hugo/Seagate Expansion Drive/ALICE_BACKUP/voshpde/wav_files/zipfiles/2016040702.wav	0
244	/media/hugo/Seagate Expansion Drive/ALICE_BACKUP/voshpde/pipeLine/segmentation_wavfiles/2016040702/245_2016040702.wav	5439.405532879819	239877784	5464.755532879819	240995719	244_2016040702	coherent set of rules in the treaties and i think we need to consider that as well because it is not only about finding ways to penalise countries which are which are out of lining this is also about how do you create a cycle which is which is positive where you actually as european citizens	coherent set of rules in the treaties and i think we need to consider that as well because it is not only about finding ways to penalise countries which are which are out of lining this is also about how do you create a cycle which is which is positive where you actually as european citizens	/media/hugo/Seagate Expansion Drive/ALICE_BACKUP/voshpde/wav_files/zipfiles/2016040702.wav	0
245	/media/hugo/Seagate Expansion Drive/ALICE_BACKUP/voshpde/pipeLine/segmentation_wavfiles/2016040702/246_2016040702.wav	5464.7555555555555	240995720	5484.605555555556	241871105	245_2016040702	together define what the values are because that may also differ over time when we are talking about the rule of law i actually do not think that the rule of law is venoyouyoucannot put it into mathematics but i think it is clear but still within certain margins the idea of what is	together define what the values are because that may also differ over time when we are talking about the rule of law i actually do not think that the rule of law is venoyouyoucannot put it into mathematics but i think it is clear but still within certain margins the idea of what is	/media/hugo/Seagate Expansion Drive/ALICE_BACKUP/voshpde/wav_files/zipfiles/2016040702.wav	0
246	/media/hugo/Seagate Expansion Drive/ALICE_BACKUP/voshpde/pipeLine/segmentation_wavfiles/2016040702/247_2016040702.wav	5484.605578231292	241871106	5512.255578231293	243090471	246_2016040702	what is the rule of law what is just whether how is the judiciary supposed to function that may that may change and you can only define that in a dialogue and there is basically in the treaty does not for see anything of that of that kind so but i am very grateful for all the work that has been done because bit by bit i think we have been peacing it all together and we get the outlines of something that that might hopefully work	what is the rule of law what is just whether how is the judiciary supposed to function that may that may change and you can only define that in a dialogue and there is basically in the treaty does not for see anything of that of that kind so but i am very grateful for all the work that has been done because bit by bit i think we have been peacing it all together and we get the outlines of something that that might hopefully work	/media/hugo/Seagate Expansion Drive/ALICE_BACKUP/voshpde/wav_files/zipfiles/2016040702.wav	0
247	/media/hugo/Seagate Expansion Drive/ALICE_BACKUP/voshpde/pipeLine/segmentation_wavfiles/2016040702/248_2016040702.wav	5512.2556009070295	243090472	5532.5056009070295	243983497	247_2016040702	so and i will be grateful for your continued input and for information of people present here the text is available as of today for time being only you all find it on trater but i am sure it will be on the parliament website soon but i am happy to send it to you if you want to have it	so and i will be grateful for your continued input and for information of people present here the text is available as of today for time being only you all find it on trater but i am sure it will be on the parliament website soon but i am happy to send it to you if you want to have it	/media/hugo/Seagate Expansion Drive/ALICE_BACKUP/voshpde/wav_files/zipfiles/2016040702.wav	0
248	/media/hugo/Seagate Expansion Drive/ALICE_BACKUP/voshpde/pipeLine/segmentation_wavfiles/2016040702/249_2016040702.wav	5532.505623582766	243983498	5559.855623582766	245189633	248_2016040702	mr prsidsfmnsurifoneofour speakers want to commend on some comments that we heard otherwise very briefly because i just forgot to mention i si cia the report we did not look at treaty solution which would imply to treaty revision just impassing regarding the the lack of early warning mechanism i would slightly disagree perhaps with this description	mr prsidsfmnsurifoneofour speakers want to commend on some comments that we heard otherwise very briefly because i just forgot to mention i since the report we did not look at treaty solution which would imply to treaty revision just impassing regarding the the lack of early warning mechanism i would slightly disagree perhaps with this description	/media/hugo/Seagate Expansion Drive/ALICE_BACKUP/voshpde/wav_files/zipfiles/2016040702.wav	3
249	/media/hugo/Seagate Expansion Drive/ALICE_BACKUP/voshpde/pipeLine/segmentation_wavfiles/2016040702/250_2016040702.wav	5559.855646258504	245189634	5586.805646258504	246378129	249_2016040702	to the extent that we have in fact too the existing one which we do not want to use which is article seven paragraph one it can be triggered when there is a potential risk of a systemic bridge of eu values and in fact it was uncertain in the eu treaty is posed your guide n ehohousandniehnrdandninety nine this has never been triggered but this is in a sense and early oneing mechanism because there is no actual bridge yet and this is what this provision was inserted	to the extent that we have in fact too the existing one which we do not want to use which is article seven paragraph one it can be triggered when there is a potential risk of a systemic bridge of eu values and in fact it was uncertain in the eu treaty is posed your guide n ehohohousandniehnrdandninety nine this has never been triggered but this is in a sense and early oneing mechanism because there is no actual bridge yet and this is what this provision was inserted	/media/hugo/Seagate Expansion Drive/ALICE_BACKUP/voshpde/wav_files/zipfiles/2016040702.wav	2
250	/media/hugo/Seagate Expansion Drive/ALICE_BACKUP/voshpde/pipeLine/segmentation_wavfiles/2016040702/251_2016040702.wav	5586.80566893424	246378130	5612.05566893424	247491655	250_2016040702	to deal with in the first place and you could also argue perhaps that the commissions rule of law framework is in effect another rule early wanting mechanism because we are now as far as put an is concerned in face one of the mechanism which issentially consist of gathering evidence to determine whether there is an actual system in bridge of of the rule of law so to that externo think we already perhaps eu	to deal with in the first place and you could also argue perhaps that the commissions rule of law framework is in effect another rule early wanting mechanism because we are now as far as put an is concerned in face one of the mechanism which issentially consist of gathering evidence to determine whether there is an actual system in bridge of of the rule of law so to that externo think we already perhaps	/media/hugo/Seagate Expansion Drive/ALICE_BACKUP/voshpde/wav_files/zipfiles/2016040702.wav	3
251	/media/hugo/Seagate Expansion Drive/ALICE_BACKUP/voshpde/pipeLine/segmentation_wavfiles/2016040702/252_2016040702.wav	5612.055691609978	247491656	5639.705691609977	248711021	251_2016040702	eu ant to many if i were so bold and regarding the notion of less comment and i am done thank you regarding the the bag ness of the rule of law i would have to concur with the mep i would say the rule of law can certainly we can agree on in fact inter most international orientations have already agreed working definition and of the rule of law a number of components are very consensual in nature the independence of the judiciary	an to many if i were so bold and regarding the notion of less comment and i am done thank you regarding the the bag ness of the rule of law i would have to concur with the mep i would say the rule of law can certainly we can agree on in fact inter most international orientations have already agreed working definition and of the rule of law a number of components are very consensual in nature the independence of the judiciary	/media/hugo/Seagate Expansion Drive/ALICE_BACKUP/voshpde/wav_files/zipfiles/2016040702.wav	4
252	/media/hugo/Seagate Expansion Drive/ALICE_BACKUP/voshpde/pipeLine/segmentation_wavfiles/2016040702/253_2016040702.wav	5639.705714285714	248711022	5667.455714285714	249934797	252_2016040702	what is perhaps true to say wever is that compliance with the rule of law compliance with sub competence of the rule of law is a matter of the green is not the concept itself which perhaps is vehicle too open end it is compliance on a case by case with sub companents then you cannot have absolute judgments you have to look at the fact and see assess whether in fact yes this sub component of the rule of law has been brice eve so on the basis of which which facts so i would say	what is perhaps true to say wever is that compliance with the rule of law compliance with sub competence of the rule of law is a matter of the green is not the concept itself which perhaps is vehicle too open end it is compliance on a case by case with sub companents then you cannot have absolute judgments you have to look at the fact and see assess whether in fact yes this sub component of the rule of law has been brice eve so on the basis of which which facts so i would say	/media/hugo/Seagate Expansion Drive/ALICE_BACKUP/voshpde/wav_files/zipfiles/2016040702.wav	0
253	/media/hugo/Seagate Expansion Drive/ALICE_BACKUP/voshpde/pipeLine/segmentation_wavfiles/2016040702/254_2016040702.wav	5667.455736961451	249934798	5690.905736961451	250968943	253_2016040702	the rule of law personally speak in my personal capacity i would describe it as a very open and it concept or even non justiciable concept president i think it will always be a challenging task because even having clear measures and i am so you also want to come in pa	the rule of law personally speak in my personal capacity i would describe it as a very open and it concept or even non justiciable concept president i think it will always be a challenging task because even having clear measures and i am so you also want to come in	/media/hugo/Seagate Expansion Drive/ALICE_BACKUP/voshpde/wav_files/zipfiles/2016040702.wav	3
254	/media/hugo/Seagate Expansion Drive/ALICE_BACKUP/voshpde/pipeLine/segmentation_wavfiles/2016040702/255_2016040702.wav	5690.905759637189	250968944	5718.655759637189	252192719	254_2016040702	mr thank you very much for your comment we did take the copenhagen criteria into consideration than drafting the report of course i could present the whole comprehensive one hundred and eighty pa report but you are absolutely rightly at here to what you just said with a slight modification perhaps a slight amendment not to call it copenhagen criteria for future member states because it is not a central european issue and i would again like to emphasise the equal treatment	mr thank you very much for your comment we did take the copenhagen criteria into consideration than drafting the report of course i could present the whole comprehensive one hundred and eighty pace report but you are absolutely rightly at here to what you just said with a slight modification perhaps a slight amendment not to call it copenhagen criteria for future member states because it is not a central european issue and i would again like to emphasise the equal treatment	/media/hugo/Seagate Expansion Drive/ALICE_BACKUP/voshpde/wav_files/zipfiles/2016040702.wav	2
255	/media/hugo/Seagate Expansion Drive/ALICE_BACKUP/voshpde/pipeLine/segmentation_wavfiles/2016040702/256_2016040702.wav	5718.655782312925	252192720	5733.905782312925	252865245	255_2016040702	of all the member states it respectively of when they acceded to the european union as to the elements of the rule of law i do agree with the rapporteur indeed everyone sees when there is depart	of all the member states it respectively of when they acceded to the european union as to the elements of the rule of law i do agree with the rapporteur indeed everyone sees when there is depart	/media/hugo/Seagate Expansion Drive/ALICE_BACKUP/voshpde/wav_files/zipfiles/2016040702.wav	0
256	/media/hugo/Seagate Expansion Drive/ALICE_BACKUP/voshpde/pipeLine/segmentation_wavfiles/2016040702/257_2016040702.wav	5733.905804988663	252865246	5749.655804988663	253559821	256_2016040702	the rule of law however i know it when i see it approach is substanded and it is not viable of course there are very good indicators lists of indicators the venice commission recently came up with a brilliant list and numeration of indicators	the rule of law however i know it when i see it approach is substanded and it is not viable of course there are very good indicators lists of indicators the venice commission recently came up with a brilliant list and numeration of indicators	/media/hugo/Seagate Expansion Drive/ALICE_BACKUP/voshpde/wav_files/zipfiles/2016040702.wav	0
257	/media/hugo/Seagate Expansion Drive/ALICE_BACKUP/voshpde/pipeLine/segmentation_wavfiles/2016040702/258_2016040702.wav	5749.655827664399	253559822	5773.405827664399	254607197	257_2016040702	or list sum elements of the rule of law i think where the slight this agreement with the professor pech and rapporteur of been tel is very emphasis should be with regard to standards indicators and the qualitative case by case assessment of member states and eu scrutiny	or list sum elements of the rule of law i think where the slight this agreement with the professor pes and rapporteurs have been tel is very emphasis should be with regard to standards indicators and the qualitative case by case assessment of member states and eu scrutiny	/media/hugo/Seagate Expansion Drive/ALICE_BACKUP/voshpde/wav_files/zipfiles/2016040702.wav	7
258	/media/hugo/Seagate Expansion Drive/ALICE_BACKUP/voshpde/pipeLine/segmentation_wavfiles/2016040702/259_2016040702.wav	5773.405850340136	254607198	5799.155850340136	255742773	258_2016040702	mrresidentthankslthanks for your support that is very valuable for creating our own report here in parliament and i think we will have additional interesting debates in oncoming weeks and months on this issue here in parliament and even more together with the council than to have at the end a good decision on this important	mrresidentthankslthanks for your support that is very valuable for creating our own report here in parliament and i think we will have additional interesting debates in oncoming weeks and months on this issue here in parliament and even more together with the council than to have at the end a good decision on this important	/media/hugo/Seagate Expansion Drive/ALICE_BACKUP/voshpde/wav_files/zipfiles/2016040702.wav	0
259	/media/hugo/Seagate Expansion Drive/ALICE_BACKUP/voshpde/pipeLine/segmentation_wavfiles/2016040702/260_2016040702.wav	5799.155873015873	255742774	5827.005873015873	256970959	259_2016040702	issue so thanks for being here and i hope that our cooperation will continue colleagues as our next point is only envisaged for four clock and some colleagues might be prepared only to come to that point we have to interrupt our meeting and i would like to ask you to come back directly at fora clock	issue so thanks for being here and i hope that our cooperation will continue colleagues as our next point is only envisaged for four clock and some colleagues might be prepared only to come to that point we have to interrupt our meeting and i would like to ask you to come back directly at fora clock	/media/hugo/Seagate Expansion Drive/ALICE_BACKUP/voshpde/wav_files/zipfiles/2016040702.wav	0
260	/media/hugo/Seagate Expansion Drive/ALICE_BACKUP/voshpde/pipeLine/segmentation_wavfiles/2016040702/261_2016040702.wav	5827.00589569161	256970960	5854.45589569161	258181505	260_2016040702			/media/hugo/Seagate Expansion Drive/ALICE_BACKUP/voshpde/wav_files/zipfiles/2016040702.wav	0
261	/media/hugo/Seagate Expansion Drive/ALICE_BACKUP/voshpde/pipeLine/segmentation_wavfiles/2016040702/262_2016040702.wav	5854.455918367347	258181506	5870.105918367347	258871671	261_2016040702	eu		/media/hugo/Seagate Expansion Drive/ALICE_BACKUP/voshpde/wav_files/zipfiles/2016040702.wav	2
262	/media/hugo/Seagate Expansion Drive/ALICE_BACKUP/voshpde/pipeLine/segmentation_wavfiles/2016040702/263_2016040702.wav	5870.1059410430835	258871672	5895.255941043084	259980787	262_2016040702	eu eu	a	/media/hugo/Seagate Expansion Drive/ALICE_BACKUP/voshpde/wav_files/zipfiles/2016040702.wav	5
263	/media/hugo/Seagate Expansion Drive/ALICE_BACKUP/voshpde/pipeLine/segmentation_wavfiles/2016040702/264_2016040702.wav	5895.255963718821	259980788	5914.705963718821	260838533	263_2016040702	eu new peaseepetearlyeiteaefosellossofeicogtei	maenewfpeaseepetearlyeiteaefosellossofeicogtei	/media/hugo/Seagate Expansion Drive/ALICE_BACKUP/voshpde/wav_files/zipfiles/2016040702.wav	4
264	/media/hugo/Seagate Expansion Drive/ALICE_BACKUP/voshpde/pipeLine/segmentation_wavfiles/2016040702/265_2016040702.wav	5914.705986394558	260838534	5940.555986394558	261978519	264_2016040702	you lokonoeiieportasandthecomlecttartofaldeinintersiittomoeenorgasoutofthe pa us amotnoepor	you lokonoeiieportasandthecomlecttartofaldeinintersiittomoeenorgasoutoftheglaecyamotnoepor	/media/hugo/Seagate Expansion Drive/ALICE_BACKUP/voshpde/wav_files/zipfiles/2016040702.wav	6
265	/media/hugo/Seagate Expansion Drive/ALICE_BACKUP/voshpde/pipeLine/segmentation_wavfiles/2016040702/266_2016040702.wav	5940.556009070295	261978520	5960.406009070295	262853905	265_2016040702	eu eu eu eu otoutareoftaradaafcm	a red otoutareoftaradaafcm	/media/hugo/Seagate Expansion Drive/ALICE_BACKUP/voshpde/wav_files/zipfiles/2016040702.wav	9
266	/media/hugo/Seagate Expansion Drive/ALICE_BACKUP/voshpde/pipeLine/segmentation_wavfiles/2016040702/267_2016040702.wav	5960.406031746032	262853906	5975.756031746032	263530841	266_2016040702	mr president we eu wane elated by the name eu elepleteltaisisiceseacoennparticular	mr president we are elated by the name eweelepleteltaisisiceseacoennparticular	/media/hugo/Seagate Expansion Drive/ALICE_BACKUP/voshpde/wav_files/zipfiles/2016040702.wav	7
267	/media/hugo/Seagate Expansion Drive/ALICE_BACKUP/voshpde/pipeLine/segmentation_wavfiles/2016040702/268_2016040702.wav	5975.756054421769	263530842	6004.606054421769	264803127	267_2016040702	as	as	/media/hugo/Seagate Expansion Drive/ALICE_BACKUP/voshpde/wav_files/zipfiles/2016040702.wav	0
268	/media/hugo/Seagate Expansion Drive/ALICE_BACKUP/voshpde/pipeLine/segmentation_wavfiles/2016040702/269_2016040702.wav	6004.6060770975055	264803128	6019.8560770975055	265475653	268_2016040702	menmensaeweseverarwecanhoocl	menmensaeweseverarwecanhoocl	/media/hugo/Seagate Expansion Drive/ALICE_BACKUP/voshpde/wav_files/zipfiles/2016040702.wav	0
269	/media/hugo/Seagate Expansion Drive/ALICE_BACKUP/voshpde/pipeLine/segmentation_wavfiles/2016040702/270_2016040702.wav	6019.856099773243	265475654	6043.306099773243	266509799	269_2016040702			/media/hugo/Seagate Expansion Drive/ALICE_BACKUP/voshpde/wav_files/zipfiles/2016040702.wav	0
270	/media/hugo/Seagate Expansion Drive/ALICE_BACKUP/voshpde/pipeLine/segmentation_wavfiles/2016040702/271_2016040702.wav	6043.306122448979	266509800	6061.15612244898	267296985	270_2016040702	us ifoaasaaeveforeiiote	i coseifoaasaatevefortiite	/media/hugo/Seagate Expansion Drive/ALICE_BACKUP/voshpde/wav_files/zipfiles/2016040702.wav	8
271	/media/hugo/Seagate Expansion Drive/ALICE_BACKUP/voshpde/pipeLine/segmentation_wavfiles/2016040702/272_2016040702.wav	6061.156145124716	267296986	6089.006145124717	268525171	271_2016040702	eu aftebeenoeoorommooptictobeoosdolidarityr	aftebeenoeoorommooptictobeoosdolidarityr	/media/hugo/Seagate Expansion Drive/ALICE_BACKUP/voshpde/wav_files/zipfiles/2016040702.wav	3
272	/media/hugo/Seagate Expansion Drive/ALICE_BACKUP/voshpde/pipeLine/segmentation_wavfiles/2016040702/273_2016040702.wav	6089.006167800453	268525172	6104.556167800453	269210927	272_2016040702	the tante	thethanothep	/media/hugo/Seagate Expansion Drive/ALICE_BACKUP/voshpde/wav_files/zipfiles/2016040702.wav	5
273	/media/hugo/Seagate Expansion Drive/ALICE_BACKUP/voshpde/pipeLine/segmentation_wavfiles/2016040702/274_2016040702.wav	6104.556190476191	269210928	6132.70619047619	270452343	273_2016040702	us us	otsior	/media/hugo/Seagate Expansion Drive/ALICE_BACKUP/voshpde/wav_files/zipfiles/2016040702.wav	5
274	/media/hugo/Seagate Expansion Drive/ALICE_BACKUP/voshpde/pipeLine/segmentation_wavfiles/2016040702/275_2016040702.wav	6132.706213151928	270452344	6153.8562131519275	271385059	274_2016040702	eu		/media/hugo/Seagate Expansion Drive/ALICE_BACKUP/voshpde/wav_files/zipfiles/2016040702.wav	2
275	/media/hugo/Seagate Expansion Drive/ALICE_BACKUP/voshpde/pipeLine/segmentation_wavfiles/2016040702/276_2016040702.wav	6153.856235827664	271385060	6171.106235827664	272145785	275_2016040702	eu eu eu eu eu	i eaweha	/media/hugo/Seagate Expansion Drive/ALICE_BACKUP/voshpde/wav_files/zipfiles/2016040702.wav	11
