	wavfile	start_seconds	start_frames	end_seconds	end_frames	identifier	inferred_text_with_hotwords	inferred_text_without_hotwords	motherfile	dist
242	/media/hugo/Seagate Expansion Drive/ALICE_BACKUP/voshpde/pipeLine/segmentation_wavfiles/2016061602/243_2016061602.wav	5389.305487528345	237668372	5416.555487528345	238870097	242_2016061602	madam president it is my statutory right to respond because i have been mentioned by name so this is a principle this is not a privilege very many of the member states want to defend the family as a social standards social norm and we have the right to defend the family against the literal	madam president it is my statutory right to respond because i have been mentioned by name so this is a principle this is not a privilege very many of the member states want to defend the family as a social standards social norm and we have the right to defend the family against the literal	/media/hugo/Seagate Expansion Drive/ALICE_BACKUP/voshpde/wav_files/zipfiles/2016061602.wav	0
243	/media/hugo/Seagate Expansion Drive/ALICE_BACKUP/voshpde/pipeLine/segmentation_wavfiles/2016061602/244_2016061602.wav	5416.555510204082	238870098	5443.105510204082	240040953	243_2016061602	the application of the islamic ethics which allows for colleague me and different forms of relationships between the husband and wife and we also have the rights to defend this in case of other forms of questioning monogamous and societies we adhere to the principles of purity temporary or permanent and i would like to remind you that there are universal standards which need to be	the application of the islamic ethics which allows for colleague me and different forms of relationships between the husband and wife and we also have the rights to defend this in case of other forms of questioning monogamous and societies we adhere to the principles of purity temporary or permanent and i would like to remind you that there are universal standards which need to be	/media/hugo/Seagate Expansion Drive/ALICE_BACKUP/voshpde/wav_files/zipfiles/2016061602.wav	0
244	/media/hugo/Seagate Expansion Drive/ALICE_BACKUP/voshpde/pipeLine/segmentation_wavfiles/2016061602/245_2016061602.wav	5443.105532879818	240040954	5465.555532879818	241030999	244_2016061602	le must be understo it we were le defend it lithuania and we will continue to do that this is a minority country so we need to give some respect to those over which we can have the advantage le speech and the debate about the rights of the minorities than it will be	must be understo it we were defend it lithuania and we will continue to do that this is a minority country so we need to give some respect to those over which we can have the advantage speech and the debate about the rights of the minorities than it will be	/media/hugo/Seagate Expansion Drive/ALICE_BACKUP/voshpde/wav_files/zipfiles/2016061602.wav	9
245	/media/hugo/Seagate Expansion Drive/ALICE_BACKUP/voshpde/pipeLine/segmentation_wavfiles/2016061602/246_2016061602.wav	5465.555555555556	241031000	5480.805555555556	241703525	245_2016061602	platform for such debate thank you very much i do not want to conclude this discussion i only would like to mention that may be	platform for such debate thank you very much i do not want to conclude this discussion i only would like to mention that may be	/media/hugo/Seagate Expansion Drive/ALICE_BACKUP/voshpde/wav_files/zipfiles/2016061602.wav	0
246	/media/hugo/Seagate Expansion Drive/ALICE_BACKUP/voshpde/pipeLine/segmentation_wavfiles/2016061602/247_2016061602.wav	5480.805578231292	241703526	5507.555578231292	242883201	246_2016061602	maybe it will be really good for us to invite personally mrs timmermans for the debate of the libe committee as a main conclusion for our our discussion now i would like to give a flow vershor time two minutes please our speakerthers	maybe it will be really good for us to invite personally mr timmermans for the debate of the libe committee as a main conclusion for our our discussion now i would like to give a flow vershor time two minutes please our speakerthers	/media/hugo/Seagate Expansion Drive/ALICE_BACKUP/voshpde/wav_files/zipfiles/2016061602.wav	1
247	/media/hugo/Seagate Expansion Drive/ALICE_BACKUP/voshpde/pipeLine/segmentation_wavfiles/2016061602/248_2016061602.wav	5507.55560090703	242883202	5530.905600907029	243912937	247_2016061602	first mrs le will your permission in order to to answer mr solo concerning the linguagic diversity i on goingingtoii will go to one sort all the question in french as in order to preserve the linguistic diversity no de	first mr pleas will your permission in order to to answer mr solo concerning the linguagic diversity i on goingingtoii will go to one sort all the question in french as in order to preserve the linguistic diversity no	/media/hugo/Seagate Expansion Drive/ALICE_BACKUP/voshpde/wav_files/zipfiles/2016061602.wav	7
248	/media/hugo/Seagate Expansion Drive/ALICE_BACKUP/voshpde/pipeLine/segmentation_wavfiles/2016061602/249_2016061602.wav	5530.905623582767	243912938	5554.955623582767	244973543	248_2016061602	well firstly i will puss on what you have said to mr den alan certainly but let me get that to my office first now secondly i would like to tus address the questions i ret r solo that you find that	well firstly i will puss on what you have said to mr tenalan certainly but let me get that to my office first now secondly i would like to tus address the questions i ret r solo that you find that	/media/hugo/Seagate Expansion Drive/ALICE_BACKUP/voshpde/wav_files/zipfiles/2016061602.wav	2
249	/media/hugo/Seagate Expansion Drive/ALICE_BACKUP/voshpde/pipeLine/segmentation_wavfiles/2016061602/250_2016061602.wav	5554.955646258503	244973544	5576.805646258504	245937129	249_2016061602	linguistic diversity occubuts a very small place only in the report what we thought that it was important in this report to focus on the principle points in the political context of fundamental rights europe that is all i would say then	linguistic diversity occubuts a very small place only in the report what we thought that it was important in this report to focus on the principle points in the political context of fundamental rights europe that is all i would say then	/media/hugo/Seagate Expansion Drive/ALICE_BACKUP/voshpde/wav_files/zipfiles/2016061602.wav	0
250	/media/hugo/Seagate Expansion Drive/ALICE_BACKUP/voshpde/pipeLine/segmentation_wavfiles/2016061602/251_2016061602.wav	5576.80566893424	245937130	5600.85566893424	246997735	250_2016061602	on the questions on the situation of christians and dialogue with the religions at the end of this month there will form a meeting will take place with the religious and le communities for secular communities with mr timmermans this subject will be on the agenda	on the questions on the situation of christians and dialogue with the religions at the end of this month there will form a meeting will take place with the religious and lay communities for secular communities with mr timmermans this subject will be on the agenda	/media/hugo/Seagate Expansion Drive/ALICE_BACKUP/voshpde/wav_files/zipfiles/2016061602.wav	2
251	/media/hugo/Seagate Expansion Drive/ALICE_BACKUP/voshpde/pipeLine/segmentation_wavfiles/2016061602/252_2016061602.wav	5600.855691609977	246997736	5621.405691609977	247903991	251_2016061602	i will pass on what you have said the commission does take article seventeen very seriously and the dialogue with religious and non religious play communities now for mrs zine do not worry i do not feel	i will pass on what you have said the commission does take article seventeen very seriously and the dialogue with religious and non religious play communities now for ms in do not worry i do not feel	/media/hugo/Seagate Expansion Drive/ALICE_BACKUP/voshpde/wav_files/zipfiles/2016061602.wav	3
252	/media/hugo/Seagate Expansion Drive/ALICE_BACKUP/voshpde/pipeLine/segmentation_wavfiles/2016061602/253_2016061602.wav	5621.405714285715	247903992	5644.955714285714	248942547	252_2016061602	attack am happy to de answer you it is it is a challenge can i give you my apology is i know great expert i row than not weing to the police policy debate but i believe i reflect the commissions view in relation to what happened last week in or on orlando how	attack am happy to do answer you it is it is a challenge can i give you my apology is i know great expert i row than not weingtoith the police policy debate but i believe i reflect the commissions view in relation to what happened last week in or on orlando how	/media/hugo/Seagate Expansion Drive/ALICE_BACKUP/voshpde/wav_files/zipfiles/2016061602.wav	5
253	/media/hugo/Seagate Expansion Drive/ALICE_BACKUP/voshpde/pipeLine/segmentation_wavfiles/2016061602/254_2016061602.wav	5644.955736961451	248942548	5671.905736961451	250131043	253_2016061602	uphold we all are but the question of differences in particular families ecr i would not go into your political discussions on that mrs in veld president i do realise that we going to agree but	uphold we all are but the question of differences in particular families etc i would not go into your political discussions on that ms inrellar president i do realise that we going to agree but	/media/hugo/Seagate Expansion Drive/ALICE_BACKUP/voshpde/wav_files/zipfiles/2016061602.wav	8
254	/media/hugo/Seagate Expansion Drive/ALICE_BACKUP/voshpde/pipeLine/segmentation_wavfiles/2016061602/255_2016061602.wav	5671.905759637189	250131044	5698.155759637189	251288669	254_2016061602	article sixteen data protection has to be respected and it is thanks partly thanks to the european parliament and the data protection committee that we continues to have very lively discussions on how after the americans how we can deal with this question but that is as much as i can say now turning to the situation in lithelvania	article sixteen data protection has to be respected and it is thanks partly thanks to the european parliament and the data protection committee that we continues to have very lively discussions on how after the americans how we can deal with this question but that is as much as i can say now turning to the situation in lithelvania	/media/hugo/Seagate Expansion Drive/ALICE_BACKUP/voshpde/wav_files/zipfiles/2016061602.wav	0
255	/media/hugo/Seagate Expansion Drive/ALICE_BACKUP/voshpde/pipeLine/segmentation_wavfiles/2016061602/256_2016061602.wav	5698.155782312925	251288670	5718.0057823129255	252164055	255_2016061602	we are monitoring this question very closely we are working actively in order to match if you lithuanian legislation with non discrimination and to eas	we are monitoring this question very closely we are working actively in order to match if you lithuanian legislation with non discrimination and to eas	/media/hugo/Seagate Expansion Drive/ALICE_BACKUP/voshpde/wav_files/zipfiles/2016061602.wav	0
256	/media/hugo/Seagate Expansion Drive/ALICE_BACKUP/voshpde/pipeLine/segmentation_wavfiles/2016061602/257_2016061602.wav	5718.005804988662	252164056	5742.455804988662	253242301	256_2016061602	i get the two to square are we moving slowly are we moving fast i gan say but we certainly haven for got is now on the written question al justice and consumer questions are dealt with quite qikelly but i shall in any case do mig level best to continue the work on these matters	i get the two to square are we moving slowly are we moving fast i gan say but we certainly haven for got is now on the written question al justice and consumer questions are dealt with quite qikelly but i shall in any case do mig level best to continue the work on these matters	/media/hugo/Seagate Expansion Drive/ALICE_BACKUP/voshpde/wav_files/zipfiles/2016061602.wav	0
257	/media/hugo/Seagate Expansion Drive/ALICE_BACKUP/voshpde/pipeLine/segmentation_wavfiles/2016061602/258_2016061602.wav	5742.455827664399	253242302	5772.0058276643995	254545457	257_2016061602	does the commission respect the fundamental rights in the economic adjustment programme we are fully aware of the serious very serious problems fully aware of the situation so i to say that it is not correct to say that there was no legal discussion on this there are at least two decisions by the court of human rights i	does the commission respect the fundamental rights in the economic adjustment programme we are fully aware of the serious very serious problems fully aware of the situation so i to say that it is not correct to say that there was no legal discussion on this there are at least two decisions by the court of human rights i	/media/hugo/Seagate Expansion Drive/ALICE_BACKUP/voshpde/wav_files/zipfiles/2016061602.wav	0
258	/media/hugo/Seagate Expansion Drive/ALICE_BACKUP/voshpde/pipeLine/segmentation_wavfiles/2016061602/259_2016061602.wav	5772.005850340136	254545458	5787.355850340136	255222393	258_2016061602	arguing that the measures adopted bank national authorities there is proportion with fundamental rights	arguing that the measures adopted bang national authorities there is proportion with fundamental rights	/media/hugo/Seagate Expansion Drive/ALICE_BACKUP/voshpde/wav_files/zipfiles/2016061602.wav	1
259	/media/hugo/Seagate Expansion Drive/ALICE_BACKUP/voshpde/pipeLine/segmentation_wavfiles/2016061602/260_2016061602.wav	5787.355873015873	255222394	5814.805873015873	256432939	259_2016061602	but not in greece forty of the population lives under poverty and we have one five million unemployed although greece has got two hundred and eu forty billion as alone where have this money gone this is a huge marcal plan which should have help the greek economy and have no unemployment	but not in greece forty of the population lives under poverty and we have one five million unemployed although greece has got two hundred and eur forty billion as alone where have this money gone this is a huge marcal plan which should have help the greek economy and have no unemployment	/media/hugo/Seagate Expansion Drive/ALICE_BACKUP/voshpde/wav_files/zipfiles/2016061602.wav	1
260	/media/hugo/Seagate Expansion Drive/ALICE_BACKUP/voshpde/pipeLine/segmentation_wavfiles/2016061602/261_2016061602.wav	5814.80589569161	256432940	5830.45589569161	257123105	260_2016061602	that is a big problem we can discuss it another de de thank you thank you very much a just because there was a direct question addess to me and i would like to	that is a big problem we can discuss it another s thank you thank you very much a just because there was a direct question addess to me and i would like to	/media/hugo/Seagate Expansion Drive/ALICE_BACKUP/voshpde/wav_files/zipfiles/2016061602.wav	5
261	/media/hugo/Seagate Expansion Drive/ALICE_BACKUP/voshpde/pipeLine/segmentation_wavfiles/2016061602/262_2016061602.wav	5830.455918367347	257123106	5854.805918367347	258196941	261_2016061602	mrs de respond to mr scripecs and his concerns that the prospects that his right of freedom of religion are rights to freedom of expression are going to be trenspressed in any way by the council of europe very short answer to this is no you are and fully are entitled to exercise the of freedom to religion your freedom to expression freedom expression under article ten	i respond to mr scripecs and his concerns that the prospects that his right of freedom of religion are right to freedom of expression are going to be trenspressed in any way by the council of europe very short answer to this is no you are and fully are entitled to exercise the of freedom to religion your freedom to expression freedom expression under article ten	/media/hugo/Seagate Expansion Drive/ALICE_BACKUP/voshpde/wav_files/zipfiles/2016061602.wav	7
262	/media/hugo/Seagate Expansion Drive/ALICE_BACKUP/voshpde/pipeLine/segmentation_wavfiles/2016061602/263_2016061602.wav	5854.805941043084	258196942	5882.655941043084	259425127	262_2016061602	it is being said article ten of the european convention of human rights is the only one which has a reference to responsibilities in the exercise of these rights and there are the possibility of the right of the freedom of expression to be limited restricted is envisaged in the convention itself how this is done is being decided on the basis of very restrictive and very clear criteria primarily	it is being said article ten of the european convention of human rights is the only one which has a reference to responsibilities in the exercise of these rights and there are the possibility of the right of the freedom of expression to be limited restricted is envisaged in the convention itself how this is done is being decided on the basis of very restrictive and very clear criteria primarily	/media/hugo/Seagate Expansion Drive/ALICE_BACKUP/voshpde/wav_files/zipfiles/2016061602.wav	0
263	/media/hugo/Seagate Expansion Drive/ALICE_BACKUP/voshpde/pipeLine/segmentation_wavfiles/2016061602/264_2016061602.wav	5882.655963718821	259425128	5898.105963718821	260106473	263_2016061602	on what is necessary democratic society and what is proportionate so absolutely yes you are able to exercise the freedomof expression you are able and entitles to say things that offend that shock and disturbed	on what is necessary democratic society and what is proportionate so absolutely yes you are able to exercise the freedomof expression you are able and entitles to say things that offend that shock and disturbed	/media/hugo/Seagate Expansion Drive/ALICE_BACKUP/voshpde/wav_files/zipfiles/2016061602.wav	0
264	/media/hugo/Seagate Expansion Drive/ALICE_BACKUP/voshpde/pipeLine/segmentation_wavfiles/2016061602/265_2016061602.wav	5898.1059863945575	260106474	5921.755986394558	261149439	264_2016061602	but there is a line at which the european court of human rights has said and at which authorities of our member states are not only allowed but are expected and requested to intervene so there is a limit to the freedom of expression if eu just a low me on a little bit more personal note i would personally think that	but there is a line at which the european court of human rights has said and at which authorities of our member states are not only allowed but are expected and requested to intervene so there is a limit to the freedom of expression if you just allow me on a little bit more personal note i would personally think that	/media/hugo/Seagate Expansion Drive/ALICE_BACKUP/voshpde/wav_files/zipfiles/2016061602.wav	3
265	/media/hugo/Seagate Expansion Drive/ALICE_BACKUP/voshpde/pipeLine/segmentation_wavfiles/2016061602/266_2016061602.wav	5921.756009070295	261149440	5941.006009070295	261998365	265_2016061602	that legal sanctions and punitive sanctions are a part of the answer but they think personal thing should become very restricted and left for a very serious cases what is most important in fighting hate speech is really the attitudes in a society is whether we have a robust response	that legal sanctions and punitive sanctions are a part of the answer but they think personal thing should become very restricted and left for a very serious cases what is most important in fighting hate speech is really the attitudes in a society is whether we have a robust response	/media/hugo/Seagate Expansion Drive/ALICE_BACKUP/voshpde/wav_files/zipfiles/2016061602.wav	0
266	/media/hugo/Seagate Expansion Drive/ALICE_BACKUP/voshpde/pipeLine/segmentation_wavfiles/2016061602/267_2016061602.wav	5941.006031746032	261998366	5967.3560317460315	263160401	266_2016061602	to speech is that try to negate the rights of others that are attacking the dignity of other human beings and i think it is in particular the responsibilities of politicians and they are attitudes with regard of this kind of speech that really can make the difference whether they are taking a clear stand against this kind of speech or whether they tolerate it or even propagated and on even more personal i also come from a post communist society so this is also pat of my experience	to speech is that try to negate the rights of others that are attacking the dignity of other human beings and i think it is in particular the responsibilities of politicians and they are attitudes with regard of this kind of speech that really can make the difference whether they are taking a clear stand against this kind of speech or whether they tolerate it or even propagated and on even more personal i also come from a post communist society so this is also but of my experience	/media/hugo/Seagate Expansion Drive/ALICE_BACKUP/voshpde/wav_files/zipfiles/2016061602.wav	2
267	/media/hugo/Seagate Expansion Drive/ALICE_BACKUP/voshpde/pipeLine/segmentation_wavfiles/2016061602/268_2016061602.wav	5967.356054421769	263160402	5987.306054421769	264040197	267_2016061602	mr president and it is indeed a great pressure to see again sofentelt i my or your memory yes there are other proposals being discussed within the european parliament to enhanced monitoring of the values on which the eu	mr president and it is indeed a great pressure to see again sofentelt i my or your memory yes there are other proposals being discussed within the european parliament to enhanced monitoring of the values on which the	/media/hugo/Seagate Expansion Drive/ALICE_BACKUP/voshpde/wav_files/zipfiles/2016061602.wav	3
268	/media/hugo/Seagate Expansion Drive/ALICE_BACKUP/voshpde/pipeLine/segmentation_wavfiles/2016061602/269_2016061602.wav	5987.306077097505	264040198	6003.3560770975055	264748003	268_2016061602	the union is built and to a certain extent the study that was commission by the libe committee is a contribution to this ongoing debate i suspect there shall be four areas that shall be the most contentious one	the union is built and to a certain extent the study that was commission by the libe committee is a contribution to this ongoing debate i suspect there shall be four areas that shall be the most contentious one	/media/hugo/Seagate Expansion Drive/ALICE_BACKUP/voshpde/wav_files/zipfiles/2016061602.wav	0
269	/media/hugo/Seagate Expansion Drive/ALICE_BACKUP/voshpde/pipeLine/segmentation_wavfiles/2016061602/270_2016061602.wav	6003.356099773243	264748004	6031.506099773243	265989419	269_2016061602	how shad fundamental rights be integrated in the european semester and in the measures that are imposed on on countries benefiting from alone under the european stability mechanism and thus subject to enhance civillance that is a first contentious area and actually there there is a report on de prepriation by babraspineli	how shad fundamental rights be integrated in the european semester and in the measures that are imposed on on countries benefiting from alone under the european stability mechanism and thus subject to enhance civillance that is a first contentious area and actually there there is a report on the prepriation by babraspineli	/media/hugo/Seagate Expansion Drive/ALICE_BACKUP/voshpde/wav_files/zipfiles/2016061602.wav	2
270	/media/hugo/Seagate Expansion Drive/ALICE_BACKUP/voshpde/pipeLine/segmentation_wavfiles/2016061602/271_2016061602.wav	6031.50612244898	265989420	6058.45612244898	267177915	270_2016061602	who will also look at this since the report will beyond the role of the charter of fundamental rights in the working methods of the institutions second the second contentious issue is what role for the fundamental rights agency that is an open question thirdly what role for social rights beyond those that are integrated in the charter of fundamental rights we should not forget that the charter is a provisional and partial le	who will also look at this since the report will beyond the role of the charter of fundamental rights in the working methods of the institutions second the second contentious issue is what role for the fundamentalrights agency that is an open question thirdly what role for social rights beyond those that are integrated in the charter of fundamental rights we should not forget that the charter is a provisional and partial	/media/hugo/Seagate Expansion Drive/ALICE_BACKUP/voshpde/wav_files/zipfiles/2016061602.wav	4
271	/media/hugo/Seagate Expansion Drive/ALICE_BACKUP/voshpde/pipeLine/segmentation_wavfiles/2016061602/272_2016061602.wav	6058.456145124716	267177916	6074.706145124716	267894541	271_2016061602	qualification of fundamental rights and does not include by far all the social rights at are part of the values of the fundamental rights aqui in the eu fourthly shall in the future of	qualification of fundamental rights and does not include by far all the social rights at are part of the values of the fundamental rights aqui in the eu fourthly shall in the future of	/media/hugo/Seagate Expansion Drive/ALICE_BACKUP/voshpde/wav_files/zipfiles/2016061602.wav	0
272	/media/hugo/Seagate Expansion Drive/ALICE_BACKUP/voshpde/pipeLine/segmentation_wavfiles/2016061602/273_2016061602.wav	6074.706167800454	267894542	6096.656167800454	268862537	272_2016061602	sha we move towards a fundamental rights policy in which the studies the reports shall stimulate action stimulate legislative policy proposals and not simply look backwards to react to potential violations that may have taken place and if i may close with one final remark after the intervention of mr marek i	sha we move towards a fundamental rights policy in which the studies the reports shall stimulate action stimulate legislative policy proposals and not simply look backwards to react to potential violations that may have taken place and if i may close with one final remark after the intervention of mr mariks i	/media/hugo/Seagate Expansion Drive/ALICE_BACKUP/voshpde/wav_files/zipfiles/2016061602.wav	2
