	wavfile	start_seconds	start_frames	end_seconds	end_frames	identifier	inferred_text_with_hotwords	inferred_text_without_hotwords	motherfile	dist
59	/media/hugo/Seagate Expansion Drive/ALICE_BACKUP/voshpde/pipeLine/segmentation_wavfiles/20160118/060_20160118.wav	1326.6513378684808	58505324	1346.6013378684806	59385119	059_20160118	trafficking of human beings that we should encourage member states the european union and the agencies to put in place all necessary measures to face up to this ad one of the final the deep causes which cause the migrants to risk account to european	trafficking of human beings that we should encourage member states the european union and the agencies to put in place all necessary measures to face up to this and one of the final the deep causes which cause the migrants to risk account to european	/media/hugo/Seagate Expansion Drive/ALICE_BACKUP/voshpde/wav_files/zipfiles/20160118.wav	1
60	/media/hugo/Seagate Expansion Drive/ALICE_BACKUP/voshpde/pipeLine/segmentation_wavfiles/20160118/061_20160118.wav	1346.6013605442176	59385120	1372.6513605442176	60533925	060_20160118	union must be combated by fining a way of putting an end to the wars to the conflict and to the warfare in the country there are international agreements they should be properly implemented with full involvement of all the parties concerned we should strengthen areas of regional cooperation and also the right of asylum is a right it is a recognised right	union must be combated by fining a way of putting an end to the wars to the conflict and to the warfare in the country there are international agreements they should be properly implemented with full involvement of all the parties concerned we should strengthen areas of regional cooperation and also the right of asylum is a right it is a recognised right	/media/hugo/Seagate Expansion Drive/ALICE_BACKUP/voshpde/wav_files/zipfiles/20160118.wav	0
61	/media/hugo/Seagate Expansion Drive/ALICE_BACKUP/voshpde/pipeLine/segmentation_wavfiles/20160118/062_20160118.wav	1372.6513832199546	60533926	1399.8013832199547	61731241	061_20160118	it is recognised by european law and by international conventions any attempt from by the member states to reject migrants that should not give them a possibility of putting a requestferusylum if country to law and should therefore be punished ad so therefore the policies should be carried out in full respect for human rights in order to conclude i think that we are far from having found	it is recognised by european law and by international conventions any attempt from by the member states to reject migrants that should not give them a possibility of putting a requestferusylum if country to law and should therefore be punished and so therefore the policies should be carried out in full respect for human rights in order to conclude i think that we are far from having found	/media/hugo/Seagate Expansion Drive/ALICE_BACKUP/voshpde/wav_files/zipfiles/20160118.wav	1
62	/media/hugo/Seagate Expansion Drive/ALICE_BACKUP/voshpde/pipeLine/segmentation_wavfiles/20160118/063_20160118.wav	1399.8014058956917	61731242	1425.3514058956916	62857997	062_20160118	shared respond to ones which are shared by those involved and by the institutions but i think that we have adopted a very optimistic approach and we are getting together in our work and i think that we need to know that we are phenomenon are facing up to a very major phenomenon and deep causes behind it thank you both of you mentioned	shared respond to ones which are shared by those involved and by the institutions but i think that we have adopted a very optimistic approach and we are getting together in our work and i think that we need to know that we are phenomenon are facing up to a very major phenomenon and deep causes behind it thank you both of you mentioned	/media/hugo/Seagate Expansion Drive/ALICE_BACKUP/voshpde/wav_files/zipfiles/20160118.wav	0
63	/media/hugo/Seagate Expansion Drive/ALICE_BACKUP/voshpde/pipeLine/segmentation_wavfiles/20160118/064_20160118.wav	1425.3514285714286	62857998	1449.2014285714286	63909783	063_20160118	what you would like the commission to do so and i will hear from the commission i should mention that from the commission presidency and our external academic speaker if you ask all of you to come ar de your point in five minutes an only clear huge about more ad really want the members to be able to pa something i think the first time we seem of cours the draft report	what you would like the commission to do so and i will hear from the commission i should mention that from the commission presidency and our external academic speaker if you ask all of you to come around you point in five minutes an only clear huge about more really want the members to be able to pay something i think the first time we seem of cours the draft report	/media/hugo/Seagate Expansion Drive/ALICE_BACKUP/voshpde/wav_files/zipfiles/20160118.wav	9
64	/media/hugo/Seagate Expansion Drive/ALICE_BACKUP/voshpde/pipeLine/segmentation_wavfiles/20160118/065_20160118.wav	1449.2014512471656	63909784	1469.9514512471656	64824859	064_20160118	exception we have you coedictifiveufivsimoesihbegratefulsomegenfrom the commission pa president goeveningonhourable members of the european parliament i am particularly happy to join you because i had also a pleasure to participate in some of your hearing	exception we have you coedictifiveufivsimoesihbegratefulsomegenfrom the commissionhkpresidentgoeveningonhourable members of the european parliament i am particularly happy to join you because i had also a pleasure to participate in some of your hearing	/media/hugo/Seagate Expansion Drive/ALICE_BACKUP/voshpde/wav_files/zipfiles/20160118.wav	5
65	/media/hugo/Seagate Expansion Drive/ALICE_BACKUP/voshpde/pipeLine/segmentation_wavfiles/20160118/066_20160118.wav	1469.9514739229026	64824860	1489.4014739229026	65682605	065_20160118	let me first congratulate the co rapporteur toll and king for the presentation of the draft report on the situation in the mediterranean the need for a politic approach to migration and let me mextswelvwatofapplutiation application for ernst	let me first congratulate the co rapporteur toll and king for the presentation of the draft report on the situation in the mediterranean the need for a politic approach to migration and let me mextswelvwatofapplutiation application for frermot	/media/hugo/Seagate Expansion Drive/ALICE_BACKUP/voshpde/wav_files/zipfiles/20160118.wav	4
66	/media/hugo/Seagate Expansion Drive/ALICE_BACKUP/voshpde/pipeLine/segmentation_wavfiles/20160118/067_20160118.wav	1489.4014965986394	65682606	1504.7514965986395	66359541	066_20160118	first the methodology ob work the preparation of the report in libya wat a really comprehensive porters which included the presentation of value studied mission report hearing toth national parliaments politicians experts	first the methodology ob work the preparation of the report in libya wat a really comprehensive porters which included the presentation of value studied mission report hearing toth national parliaments politicians experts	/media/hugo/Seagate Expansion Drive/ALICE_BACKUP/voshpde/wav_files/zipfiles/20160118.wav	0
67	/media/hugo/Seagate Expansion Drive/ALICE_BACKUP/voshpde/pipeLine/segmentation_wavfiles/20160118/068_20160118.wav	1504.7515192743765	66359542	1525.9015192743764	67292257	067_20160118	actationar and academic and several working documents will present ad in preparation of the final report so this is indeed a very very solid background and the promotion of the debate on migration in the pluralistic way helping also to increase understanding of various component of migration phenomenon	actationar and academic and several working documents will present at in preparation of the final report so this is indeed a very very solid background and the promotion of the debate on migration in the pluralistic way helping also to increase understanding of various component of migration phenomenon	/media/hugo/Seagate Expansion Drive/ALICE_BACKUP/voshpde/wav_files/zipfiles/20160118.wav	1
68	/media/hugo/Seagate Expansion Drive/ALICE_BACKUP/voshpde/pipeLine/segmentation_wavfiles/20160118/069_20160118.wav	1525.9015419501134	67292258	1547.9515419501133	68264663	068_20160118	second in the preparation of the valued policies all of them actually it is a comprehensive report it is not only about holistic approach it a comprehensive in terms of covering all areas which are important for migration so it experts your strategic view in a very timely moment	second in the preparation of the valued policies all of them actually it is a comprehensive report it is not only about holistic approach it a comprehensive in terms of covering all areas which are important for migration so it experts your strategic view in a very timely moment	/media/hugo/Seagate Expansion Drive/ALICE_BACKUP/voshpde/wav_files/zipfiles/20160118.wav	0
69	/media/hugo/Seagate Expansion Drive/ALICE_BACKUP/voshpde/pipeLine/segmentation_wavfiles/20160118/070_20160118.wav	1547.9515646258503	68264664	1569.0015646258503	69192969	069_20160118	showing that there is no one key no one tool to manage migration but there is all range of them to be used and third timing as i ad you decided to prevent this report in december two thousand and fourteen today we are in january and you are going to adopt the report in april	showing that there is no one key no one tool to manage migration but there is all range of them to be used and third timing as i set you decided to prevent this report in december two thousand and fourteen today we are in january and you are going to adopt the report in april	/media/hugo/Seagate Expansion Drive/ALICE_BACKUP/voshpde/wav_files/zipfiles/20160118.wav	3
70	/media/hugo/Seagate Expansion Drive/ALICE_BACKUP/voshpde/pipeLine/segmentation_wavfiles/20160118/071_20160118.wav	1569.0015873015873	69192970	1592.1515873015874	70213885	070_20160118	all all over if months how the work change and how the phenomenon of migration was touched by event i am an it is incredible because you have also an opportunity to dynamically develop your strategic view the commission of the president juncker prevent ad at the beginning the political guidelines of migration as the top priority	all all over if months how the work change and how the phenomenon of migration was touched by event i am an it is incredible because you have also an opportunity to dynamically develop your strategic view the commission of the president juncker prevent ad at the beginning the political guidelines of migration as the top priority	/media/hugo/Seagate Expansion Drive/ALICE_BACKUP/voshpde/wav_files/zipfiles/20160118.wav	0
71	/media/hugo/Seagate Expansion Drive/ALICE_BACKUP/voshpde/pipeLine/segmentation_wavfiles/20160118/072_20160118.wav	1592.1516099773244	70213886	1607.9016099773244	70908461	071_20160118	but done in what we planned for the next working programme particularly for the work programme of the commission two thousand and sixteen many of de ping many of legislative proposals we are also mentioning in the report are already at the table	but done in what we planned for the next working programme particularly for the work programme of the commission two thousand and sixteen many of the ping many of legislative proposals we are also mentioning in the report are already at the table	/media/hugo/Seagate Expansion Drive/ALICE_BACKUP/voshpde/wav_files/zipfiles/20160118.wav	2
72	/media/hugo/Seagate Expansion Drive/ALICE_BACKUP/voshpde/pipeLine/segmentation_wavfiles/20160118/073_20160118.wav	1607.9016326530611	70908462	1630.9516326530613	71924967	072_20160118	and there is no de there is no de it not trange that the work programme two thousand ad fifteen have a very specific title no time for business of usual indeed we put at the table manner of the proposal and i am certain that with the common debate we are going to have continue on the report	and there is no there is no indeed it not trange that the work programme two thousand and fifteen have a very specific title no time for business of usual indeed we put at the table manner of the proposal and i am certain that with the common debate we are going to have continue on the report	/media/hugo/Seagate Expansion Drive/ALICE_BACKUP/voshpde/wav_files/zipfiles/20160118.wav	8
73	/media/hugo/Seagate Expansion Drive/ALICE_BACKUP/voshpde/pipeLine/segmentation_wavfiles/20160118/074_20160118.wav	1630.951655328798	71924968	1656.201655328798	73038493	073_20160118	we are going you are going to accompany ad and we are going all together to be able to adopt the proposals that we compete the picture of the instruments necessary to were manage migration because migration will remain the key issue for the eu frogdout this parliamentary term and the mandate of the commission and you know that the year of two thousand and fifteen has been the year of manner records	we are going you are going to accompany at and we are going all together to be able to adopt the proposals that we compete the picture of the instruments necessary to were manage migration because migration will remain the key issue for the eu frogdout this parliamentary term and the mandate of the commission and you know that the year of two thousand and fifteen has been the year of manner records	/media/hugo/Seagate Expansion Drive/ALICE_BACKUP/voshpde/wav_files/zipfiles/20160118.wav	1
74	/media/hugo/Seagate Expansion Drive/ALICE_BACKUP/voshpde/pipeLine/segmentation_wavfiles/20160118/075_20160118.wav	1656.201678004535	73038494	1676.3516780045352	73927109	074_20160118	we talking about the number of asylum applications one two million and the number of irregular border crossing one eight were during the first health of two thousand and fifteen when you started your debate and your preparation for the report everything was focused on the central mediterranean de	we talking about the number of asylum applications one two million and the number of irregular border crossing one eight were during the first health of two thousand and fifteen when you started your debate and your preparation for the report everything was focused on the central mediterranean then	/media/hugo/Seagate Expansion Drive/ALICE_BACKUP/voshpde/wav_files/zipfiles/20160118.wav	3
75	/media/hugo/Seagate Expansion Drive/ALICE_BACKUP/voshpde/pipeLine/segmentation_wavfiles/20160118/076_20160118.wav	1676.3517006802722	73927110	1698.801700680272	74917155	075_20160118	in july august on what we started to rapidly ship to another part of the mediterranean to the eastern mediterranean it shows how the scope is comprehensive and in terms of strength and the context there are equally complex because the continues increased in the numbers arriving de	in july august on what we started to rapidly ship to another part of the mediterranean to the eastern mediterranean it shows how the scope is comprehensive and in terms of strength and the context there are equally complex because the continues increased in the numbers arriving	/media/hugo/Seagate Expansion Drive/ALICE_BACKUP/voshpde/wav_files/zipfiles/20160118.wav	3
76	/media/hugo/Seagate Expansion Drive/ALICE_BACKUP/voshpde/pipeLine/segmentation_wavfiles/20160118/077_20160118.wav	1698.801723356009	74917156	1719.351723356009	75823411	076_20160118	great difficulties of the front light countries to control the situation as of september resulted in member states taking the last resort measures such as building tenses and temporary reintroducing internal borders and the situation is border complicated by unprecedented terrorism tep ad attack	great difficulties of the front light countries to control the situation as of september resulted in member states taking the last resort measures such as building tenses and temporary reintroducing internal borders and the situation is border complicated by unprecedented terrorism tep and attack	/media/hugo/Seagate Expansion Drive/ALICE_BACKUP/voshpde/wav_files/zipfiles/20160118.wav	1
77	/media/hugo/Seagate Expansion Drive/ALICE_BACKUP/voshpde/pipeLine/segmentation_wavfiles/20160118/078_20160118.wav	1719.351746031746	75823412	1745.201746031746	76963397	077_20160118	so what we have now a comprehensive agenda on migration ad framework for the vision and long term perspective we have in deed agenda of migration at i have many times in this committee eu measures to deal with a crisis ad temporary and more permanent crisis we continue to implement the agenda on migration on all the pillars so all the pillars also covered by your report	so what we have now a comprehensive agenda on migration a framework for the vision and long term perspective we have in deed agenda of migration at i have many times in this committee measures to deal with a crisis and temporary and more permanent crisis we continue to implement the agenda on migration on all the pillars so all the pillars also covered by your report	/media/hugo/Seagate Expansion Drive/ALICE_BACKUP/voshpde/wav_files/zipfiles/20160118.wav	5
78	/media/hugo/Seagate Expansion Drive/ALICE_BACKUP/voshpde/pipeLine/segmentation_wavfiles/20160118/079_20160118.wav	1745.201768707483	76963398	1762.751768707483	77737353	078_20160118	eu what we have to first now a focus is kill to operationalise to immediate measures which if ostend the flow of migrants reaching the europe for ereguratthoneres and then we need to continue to put in place and more sustainable system for the future	but what we have to first now a focus is kill to operationalise to immediate measures which if ostend the flow of migrants reaching the europe for ereguratthoneres and then we need to continue to put in place and more sustainable system for the future	/media/hugo/Seagate Expansion Drive/ALICE_BACKUP/voshpde/wav_files/zipfiles/20160118.wav	2
79	/media/hugo/Seagate Expansion Drive/ALICE_BACKUP/voshpde/pipeLine/segmentation_wavfiles/20160118/080_20160118.wav	1762.75179138322	77737354	1780.60179138322	78524539	079_20160118	obgotly money it is important you mentioned in your report and a midterm review will be an excellent opportunity meet them review of the multiannual financial framework to provide the additional budgetary means for the implementation of the agenda	obgotly money it is important you mentioned in your report and a midterm review will be an excellent opportunity meet them review of the multiannual financial framework to provide the additional budgetary means for the implementation of the agenda	/media/hugo/Seagate Expansion Drive/ALICE_BACKUP/voshpde/wav_files/zipfiles/20160118.wav	0
80	/media/hugo/Seagate Expansion Drive/ALICE_BACKUP/voshpde/pipeLine/segmentation_wavfiles/20160118/081_20160118.wav	1780.601814058957	78524540	1808.2518140589568	79743905	080_20160118	only priorities two thousand and fifteen specifically operationally relocation refetimen resetliment hotspot returns schengen have mentioned by the european border and cost gard proposal the commission intends also to prevent very soon the reform the proposals for the reform of the asylum sistan particular dublin system and prevent measures concerning legal migration and integration	only priorities two thousand and fifteen specifically operationally relocation refetimen resetliment hotspot returns schengen have mentioned by the european border and cost gard proposal the commission intends also to prevent very soon the reform the proposals for the reform of the asylum sistan particular dublin system and prevent measures concerning legal migration and integration	/media/hugo/Seagate Expansion Drive/ALICE_BACKUP/voshpde/wav_files/zipfiles/20160118.wav	0
81	/media/hugo/Seagate Expansion Drive/ALICE_BACKUP/voshpde/pipeLine/segmentation_wavfiles/20160118/082_20160118.wav	1808.2518367346938	79743906	1827.901836734694	80610471	081_20160118	and last but not least i would mention fill aspect external dimension of migration you know it very where the post valital family post bud ap as post leader statement a processes which are there and working and should continue rabat and catomasbuda	and last but not least i would mention fill aspect external dimension of migration you know it very where the post valital family post budapas post leader statement a processes which are there and working and should continue rabat and catomasbuda	/media/hugo/Seagate Expansion Drive/ALICE_BACKUP/voshpde/wav_files/zipfiles/20160118.wav	2
82	/media/hugo/Seagate Expansion Drive/ALICE_BACKUP/voshpde/pipeLine/segmentation_wavfiles/20160118/083_20160118.wav	1827.901859410431	80610472	1856.9518594104309	81891577	082_20160118	just the last work bit draft report is an excellent contribution to what we are going to do next if an excellent contribution to continue to work on the agenda on migration for the future and to try to use all instruments in the agenda of migration in the light of your proposals to contain the biggest crisis migratory crisis in the world as we experience as it was the very beginning of the presentation	just the last work bit draft report is an excellent contribution to what we are going to do next if an excellent contribution to continue to work on the agenda on migration for the future and to try to use all instruments in the agenda of migration in the light of your proposals to contain the biggest crisis migratory crisis in the world as we experience as it was the very beginning of the presentation	/media/hugo/Seagate Expansion Drive/ALICE_BACKUP/voshpde/wav_files/zipfiles/20160118.wav	0
83	/media/hugo/Seagate Expansion Drive/ALICE_BACKUP/voshpde/pipeLine/segmentation_wavfiles/20160118/084_20160118.wav	1856.9518820861679	81891578	1880.0018820861678	82908083	083_20160118	i try to eu binksheanshortenkow you have not wore you pa when we are eri not to eu report get ad ad you il be crucial that you de but i really want to hear from members here today as well and again mr de des welcome to the committee and if you today home arriving a out five milli	i try to binksheanshortenkow you have not wore you pay when we are eri not to yeu report get a you il be crucial that you day but i really want to hear from members here today as well and again mr de welcome to the committee and if you today have arriving a out five million	/media/hugo/Seagate Expansion Drive/ALICE_BACKUP/voshpde/wav_files/zipfiles/20160118.wav	19
84	/media/hugo/Seagate Expansion Drive/ALICE_BACKUP/voshpde/pipeLine/segmentation_wavfiles/20160118/085_20160118.wav	1880.0019047619048	82908084	1898.9519047619049	83743779	084_20160118	your respond is but again i hear from you know tout again and may costunction reports packagethnyoumrpresidentsandechasintodeagreejispedb	your respond is but again i hear from you know tout again and may costunction reports packagethnyoumrpresidentsandechasintodeagreejispedb	/media/hugo/Seagate Expansion Drive/ALICE_BACKUP/voshpde/wav_files/zipfiles/20160118.wav	0
85	/media/hugo/Seagate Expansion Drive/ALICE_BACKUP/voshpde/pipeLine/segmentation_wavfiles/20160118/086_20160118.wav	1898.9519274376416	83743780	1919.2019274376416	84636805	085_20160118	mr president indeed it a challenge to be brief on a on a report of twenty seven pages but ill do my best the council would like to thank both rapporteurs for their expensive work and i believe i also have to congratulate ms metsola with her gird but they today	mr president indeed it a challenge to be brief on a on a report of twenty seven pages but ill do my best the council would like to thank both rapporteurs for their expensive work and i believe i also have to congratulate ms mitsola with her girdbutthey today	/media/hugo/Seagate Expansion Drive/ALICE_BACKUP/voshpde/wav_files/zipfiles/20160118.wav	3
86	/media/hugo/Seagate Expansion Drive/ALICE_BACKUP/voshpde/pipeLine/segmentation_wavfiles/20160118/087_20160118.wav	1919.2019501133786	84636806	1940.4519501133786	85573931	086_20160118	the presidency of the council horthardedly supports your position that a holistic approach to todays migration challenges is key in finding satisfying answers the council could not agree more with the rapporteurs and with your parliaments resolution of eighteen december two thousand and fourteen that the eu needs a holistic approach to migration schengen is under pressure	the presidency of the council horthardedly supports your position that a holistic approach to todays migration challenges is key in finding satisfying answers the council could not agree more with the rapporteurs and with your parliaments resolution of eighteen december two thousand and fourteen that the eu needs a holistic approach to migration schengen is under pressure	/media/hugo/Seagate Expansion Drive/ALICE_BACKUP/voshpde/wav_files/zipfiles/20160118.wav	0
87	/media/hugo/Seagate Expansion Drive/ALICE_BACKUP/voshpde/pipeLine/segmentation_wavfiles/20160118/088_20160118.wav	1940.4519727891156	85573932	1963.1019727891157	86572797	087_20160118	this does not only affect the free movement of persons but this has it is effect on a broader rage of the acquis to preserve schengen and find a solution to this crisis we need a holistic approach progress needs to be booked in the field of mor de management asylum legal migration fight against human smuggling improve the return rate and effectively implement measures such as on relocation and hotspots	this does not only affect the free movement of persons but this has it is effect on a broader rage of the acquis to preserve schengen and find a solution to this crisis we need a holistic approach progress needs to be booked in the field of mor der management asylum legal migration fight against human smuggling improve the return rate and effectively implement measures such as on relocation and hotspots	/media/hugo/Seagate Expansion Drive/ALICE_BACKUP/voshpde/wav_files/zipfiles/20160118.wav	1
