	wavfile	start_seconds	start_frames	end_seconds	end_frames	identifier	inferred_text_with_hotwords	inferred_text_without_hotwords	motherfile	dist
118	/media/hugo/Seagate Expansion Drive/ALICE_BACKUP/voshpde/pipeLine/segmentation_wavfiles/2016061602/119_2016061602.wav	2669.9026757369616	117742708	2694.0526757369616	118807723	118_2016061602	but in the situation where we are actually we witnessing a gear shift in insecurity and where des insecurities are being often exploited by those who want to extract political benefits and who are often arguing that the only way to reply respond and to guarantee security to our citizens is to default	but in the situation where we are actually we witnessing a gear shift in insecurity and where this insecurities are being often exploited by those who want to extract political benefits and who are often arguing that the only way to reply respond and to guarantee security to our citizens is to default	/media/hugo/Seagate Expansion Drive/ALICE_BACKUP/voshpde/wav_files/zipfiles/2016061602.wav	3
119	/media/hugo/Seagate Expansion Drive/ALICE_BACKUP/voshpde/pipeLine/segmentation_wavfiles/2016061602/120_2016061602.wav	2694.052698412698	118807724	2716.2026984126983	119784539	119_2016061602	on these agreed standards of conduct on democracy human rights and the rule of law the secretarygional through this report is sending the opposite message it is by abiding to the commonly agreed standards of conduct that we are going to be able to work together better and to find	on these agreed standards of conduct on democracy human rights and the rule of law the secretarygional through this report is sending the opposite message it is by abiding to the commonly agreed standards of conduct that we are going to be able to work together better and to find	/media/hugo/Seagate Expansion Drive/ALICE_BACKUP/voshpde/wav_files/zipfiles/2016061602.wav	0
120	/media/hugo/Seagate Expansion Drive/ALICE_BACKUP/voshpde/pipeLine/segmentation_wavfiles/2016061602/121_2016061602.wav	2716.2027210884353	119784540	2731.6527210884356	120465885	120_2016061602	effective rational solutions that are the only way to really deter and improve and and respond to the insecurities that our citizens of course feel at this moment thank you very	effective rational solutions that are the only way to really deter and improve and and respond to the insecurities that our citizens of course feel at this moment thank you very	/media/hugo/Seagate Expansion Drive/ALICE_BACKUP/voshpde/wav_files/zipfiles/2016061602.wav	0
121	/media/hugo/Seagate Expansion Drive/ALICE_BACKUP/voshpde/pipeLine/segmentation_wavfiles/2016061602/122_2016061602.wav	2731.6527437641726	120465886	2756.802743764172	121575001	121_2016061602	mrs thank you very much the last presentation this panel will be made by professor oliver their shuter mrs de schutter is professor the catholic university of loven in belgium former coordinator of the eu network of independent experts on fundamental rights and member of the scientific committee of the fundamental rights agencies	men thank you very much the last presentation this panel will be made by professor oliver their shuter mr ershuter is professor the catholic university of loven in belgium former coordinator of the eu network of independent experts on fundamental rights and member of the scientific committee of the fundamental rights agencies	/media/hugo/Seagate Expansion Drive/ALICE_BACKUP/voshpde/wav_files/zipfiles/2016061602.wav	7
122	/media/hugo/Seagate Expansion Drive/ALICE_BACKUP/voshpde/pipeLine/segmentation_wavfiles/2016061602/123_2016061602.wav	2756.802766439909	121575002	2784.4527664399093	122794367	122_2016061602	mrs he will discuss the study on follow up to the european parliament resolution of eight september two thousand and fifteen on the situation on fundamental rights in the european union commission by the policy department for citizens sweets and constitutional efforts at the request of the libe committee pr eu	he will discuss the study on follow up to the european parliaments resolution of eight september two thousand and fifteen on the situation on fundamental rights in the european union commission by the policy department for citizens sweets and constitutional efforts at the request of the libe committee pre	/media/hugo/Seagate Expansion Drive/ALICE_BACKUP/voshpde/wav_files/zipfiles/2016061602.wav	7
123	/media/hugo/Seagate Expansion Drive/ALICE_BACKUP/voshpde/pipeLine/segmentation_wavfiles/2016061602/124_2016061602.wav	2784.4527891156463	122794368	2806.902789115646	123784413	123_2016061602	mr madam president perhaps i should say vice de it is a great pleasure to be here and it is ironic that almost exactly ten years ago in september two thousand and six was presenting before this very same committee on civil liberties justice and home affairs	mr madam president perhaps i should say vice it is a great pleasure to be here and it is ironic that almost exactly ten years ago in september two thousand and six was presenting before this very same committee on civil liberties justice and home affairs	/media/hugo/Seagate Expansion Drive/ALICE_BACKUP/voshpde/wav_files/zipfiles/2016061602.wav	3
124	/media/hugo/Seagate Expansion Drive/ALICE_BACKUP/voshpde/pipeLine/segmentation_wavfiles/2016061602/125_2016061602.wav	2806.902811791383	123784414	2825.752811791383	124615699	124_2016061602	the annual review on the situation of fundamental rights in the eu that was prepared by the eu network of independent experts on fundamental rights some of you may recall that this group of experts have been established by the european commission in two thousand and two at the request of the european parliament	the annual review on the situation of fundamental rights in the eu that was prepared by the eu network of independent experts on fundamental rights some of you may recall that this group of experts have been established by the european commission in two thousand and two at the request of the european parliament	/media/hugo/Seagate Expansion Drive/ALICE_BACKUP/voshpde/wav_files/zipfiles/2016061602.wav	0
125	/media/hugo/Seagate Expansion Drive/ALICE_BACKUP/voshpde/pipeLine/segmentation_wavfiles/2016061602/126_2016061602.wav	2825.75283446712	124615700	2842.80283446712	125367605	125_2016061602	the european parliament was convinced that it needed to ask such a group of experts to be set up in order to benefit from the expertise of independent jurists in preparing its annual bepought on the situation of fundamental rights in the union	the european parliament was convinced that it needed to ask such a group of experts to be set up in order to benefit from the expertise of independent jurists in preparing its annual bepought on the situation of fundamental rights in the union	/media/hugo/Seagate Expansion Drive/ALICE_BACKUP/voshpde/wav_files/zipfiles/2016061602.wav	0
126	/media/hugo/Seagate Expansion Drive/ALICE_BACKUP/voshpde/pipeLine/segmentation_wavfiles/2016061602/127_2016061602.wav	2842.802857142857	125367606	2861.052857142857	126172431	126_2016061602	the study that madam chair referred to which is distributed here commission by the policy department for citizens rights and constitutional affairs at the request of the libe committee reflects on	the study that madam referred to which is distributed here commission by the policy department for citizens rights and constitutional affairs at the request of the libe committee reflects on	/media/hugo/Seagate Expansion Drive/ALICE_BACKUP/voshpde/wav_files/zipfiles/2016061602.wav	6
127	/media/hugo/Seagate Expansion Drive/ALICE_BACKUP/voshpde/pipeLine/segmentation_wavfiles/2016061602/128_2016061602.wav	2861.052879818594	126172432	2889.7028798185943	127435897	127_2016061602	the general architecture through which fundamental rights are being protected in the eu and building on the work done by the eu network of indepentexferts on fundamental rights between two thousand and two and two thousand and seven building on the communication presented by the commission on fifteen october two thousand and three on the values on which the eu is founded it proposes primarily to	the general architecture through which fundamental rights are being protected in the eu and building on the work done by the eu network of indepentexferts on fundamental rights between two thousand and two and two thousand and seven building on the communication presented by the commission on fifteen october two thousand and three on the values on which the eu is founded it proposes primarily to	/media/hugo/Seagate Expansion Drive/ALICE_BACKUP/voshpde/wav_files/zipfiles/2016061602.wav	0
128	/media/hugo/Seagate Expansion Drive/ALICE_BACKUP/voshpde/pipeLine/segmentation_wavfiles/2016061602/129_2016061602.wav	2889.7029024943313	127435898	2917.052902494331	128642033	128_2016061602	request from the fundamental rights agency an annual report that could cover not only fundamental rights in the scope of application of union law but also the situation of fundamental rights the rule of law and democracy in in the eu the study argues in fact that the presentation of such a report on an annual basis but the fundamental rights agency could allow the commission parliament to fulfil their duties on the article seven the	request from the fundamental rights agency an annual report that could cover not only fundamental rights in the scope of application of union law but also the situation of fundamental rights the rule of law and democracy in in the eu the study argues in fact that the presentation of such a report on an annual basis but the fundamentalrights agency could allow the commission parliament to fulfil their duties on the article seven the	/media/hugo/Seagate Expansion Drive/ALICE_BACKUP/voshpde/wav_files/zipfiles/2016061602.wav	1
129	/media/hugo/Seagate Expansion Drive/ALICE_BACKUP/voshpde/pipeLine/segmentation_wavfiles/2016061602/130_2016061602.wav	2917.052925170068	128642034	2936.302925170068	129490959	129_2016061602	eu treaty in a way that would guarantee a consistent objective impartial non selective assessment of the situation of member states and could also perhaps more importantly even allow the development of a fundamental rights policy of the eu that could be proactive not simply reactive eu	eu treaty in a way that would guarantee a consistent objective impartial non selective assessment of the situation of member states and could also perhaps more importantly even allow the development of a fundamental rights policy of the eu that could be proactive not simply reactive	/media/hugo/Seagate Expansion Drive/ALICE_BACKUP/voshpde/wav_files/zipfiles/2016061602.wav	3
130	/media/hugo/Seagate Expansion Drive/ALICE_BACKUP/voshpde/pipeLine/segmentation_wavfiles/2016061602/131_2016061602.wav	2936.302947845805	129490960	2954.052947845805	130273735	130_2016061602	ensuring that the powers attributed to the eu can be exercised to improve mutual trust based on full compliance with fundamental rights in the establishment of the internal market and of the area of freedom security and justice the study puts forward three major advantages to this shift eu	ensuring that the powers attributed to the eu can be exercised to improve mutual trust based on full compliance with fundamental rights in the establishment of the internal market and of the area of freedom security and justice the study puts forward three major advantages to this shift	/media/hugo/Seagate Expansion Drive/ALICE_BACKUP/voshpde/wav_files/zipfiles/2016061602.wav	3
131	/media/hugo/Seagate Expansion Drive/ALICE_BACKUP/voshpde/pipeLine/segmentation_wavfiles/2016061602/132_2016061602.wav	2954.0529705215417	130273736	2981.8029705215417	131497511	131_2016061602	and to the introduction of what might be called a policy rights fundamental rights policy cycle first it would ensure greater coherence with council of europe standards and un standards many atters today call for stronger synergies between developments in the eu and the standards of the council of europe and in fact in may two thousand and fourteen the council of europe and the eu have restated	and to the introduction of what might be called a policy rights fundamental rights policy cycle first it would ensure greater coherence with council of europe standards and un standards many atters today call for stronger synergies between developments in the eu and the standards of the council of europe and in fact in may two thousand and fourteen the council of europe and the eu have restated	/media/hugo/Seagate Expansion Drive/ALICE_BACKUP/voshpde/wav_files/zipfiles/2016061602.wav	0
132	/media/hugo/Seagate Expansion Drive/ALICE_BACKUP/voshpde/pipeLine/segmentation_wavfiles/2016061602/133_2016061602.wav	2981.8029931972787	131497512	2999.352993197279	132271467	132_2016061602	they are long standing commitment to furthering synergies between the eu and the council of europe monitoring and advisory bodies and between council of europe standards and eu legislation on the basis of the two thousand and seven memorandum of understanding between the two organisations the	they are long standing commitment to furthering synergies between the eu and the council of europe monitoring and advisory bodies and between council of europe standards and eu legislation on the basis of the two thousand and seven memorandum of understanding between the two organisations the	/media/hugo/Seagate Expansion Drive/ALICE_BACKUP/voshpde/wav_files/zipfiles/2016061602.wav	0
133	/media/hugo/Seagate Expansion Drive/ALICE_BACKUP/voshpde/pipeLine/segmentation_wavfiles/2016061602/134_2016061602.wav	2999.353015873016	132271468	3023.3030158730157	133327663	133_2016061602	le reliance on the council of europe standards and monitoring mechanisms is particularly relevant in my view in the area of social rights where the need for synergies is most evident the commitment of the european commission today towards building a european pillar of social rights could usefully take as theparturpoint the provisions of the revised european social charter of the council of europe	reliance on the council of europe standards and monitoring mechanisms is particularly relevant in my view in the area of social rights where the need for synergies is most evident the commitment of the european commission today towards building a european pillar of social rights could usefully take as theparturpoint the provisions of the revised european social charter of the council of europe	/media/hugo/Seagate Expansion Drive/ALICE_BACKUP/voshpde/wav_files/zipfiles/2016061602.wav	3
134	/media/hugo/Seagate Expansion Drive/ALICE_BACKUP/voshpde/pipeLine/segmentation_wavfiles/2016061602/135_2016061602.wav	3023.3030385487527	133327664	3049.353038548753	134476469	134_2016061602	which either are already part of eu aqui in this area or have been accepted by all eu member states such fundamental social rights must be seen as fundamental rights that are recognised as general principles of eu law beyond even those social rights that are included in the charter of fundamental rights those provisions of the revised european social charter and turn could be red	which either are already part of eu aqui in this area or have been accepted by all eu member states such fundamental social rights must be seen as fundamental rights that are recognised as general principles of eu law beyond even those social rights that are included in the charter of fundamental rights those provisions of the revised european social charter and turn could be red	/media/hugo/Seagate Expansion Drive/ALICE_BACKUP/voshpde/wav_files/zipfiles/2016061602.wav	0
135	/media/hugo/Seagate Expansion Drive/ALICE_BACKUP/voshpde/pipeLine/segmentation_wavfiles/2016061602/136_2016061602.wav	3049.35306122449	134476470	3065.20306122449	135175455	135_2016061602	taking into account the findings of the european comittee of social rights as they appear in the conclusions or decisions adopted by this body the fundamentalrights agency could be ideally placed to collect the results of the monitoring performed by the council of your bodies	taking into account the findings of the european comittee of social rights as they appear in the conclusions or decisions adopted by this body the fundamentalrights agency could be ideally placed to collect the results of the monitoring performed by the council of your bodies	/media/hugo/Seagate Expansion Drive/ALICE_BACKUP/voshpde/wav_files/zipfiles/2016061602.wav	0
136	/media/hugo/Seagate Expansion Drive/ALICE_BACKUP/voshpde/pipeLine/segmentation_wavfiles/2016061602/137_2016061602.wav	3065.203083900227	135175456	3083.2530839002266	135971461	136_2016061602	as well as other international human rights monitoring bodies and to process such information in order to allow the commission and parliament to rely on an uncontestible source of information allowing both to fully contribute to ensuring compliance with article two of the eu treaty	as well as other international human rights monitoring bodies and to process such information in order to allow the commission and parliament to rely on an uncontestible source of information allowing both to fully contribute to ensuring compliance with article two of the eu treaty	/media/hugo/Seagate Expansion Drive/ALICE_BACKUP/voshpde/wav_files/zipfiles/2016061602.wav	0
137	/media/hugo/Seagate Expansion Drive/ALICE_BACKUP/voshpde/pipeLine/segmentation_wavfiles/2016061602/138_2016061602.wav	3083.2531065759636	135971462	3108.703106575964	137093807	137_2016061602	a far from weakening the monitoring about the council of europe or from undermining the role of the united nations monitoring system this would strengthen the findings of such bodies increasing the weight and the relevance of their findings by feeding these findings into the procedures provided for by article seven of the eu treaty as well as in legislative and policy making in the eu	a far from weakening the monitoring about the council of europe or from undermining the role of the united nations monitoring system this would strengthen the findings of such bodies increasing the weight and the relevance of their findings by feeding these findings into the procedures provided for by article seven of the eu treaty as well as in legislative and policy making in the eu	/media/hugo/Seagate Expansion Drive/ALICE_BACKUP/voshpde/wav_files/zipfiles/2016061602.wav	0
138	/media/hugo/Seagate Expansion Drive/ALICE_BACKUP/voshpde/pipeLine/segmentation_wavfiles/2016061602/139_2016061602.wav	3108.703129251701	137093808	3137.8531292517005	138379323	138_2016061602	second the advantage of such a demarche would be to allow for cross country comparisons on the situation of fundamental rights this would be extremely useful to allow proactive fundamental rights policy to emerge not only by reacting to breaches as they may occur but identifying which competences the union could use eu	second the advantage of such a demarche would be to allow for cross country comparisons on the situation of fundamental rights this would be extremely useful to allow proactive fundamental rights policy to emerge not only by reacting to breaches as they may occur but identifying which competences the union could use	/media/hugo/Seagate Expansion Drive/ALICE_BACKUP/voshpde/wav_files/zipfiles/2016061602.wav	3
139	/media/hugo/Seagate Expansion Drive/ALICE_BACKUP/voshpde/pipeLine/segmentation_wavfiles/2016061602/140_2016061602.wav	3137.8531519274375	138379324	3157.9031519274376	139263529	139_2016061602	and rely on in order to strengthen mutual trust within the eu twenty eight member states this is not a new idea in its communication of fifteen october two thousand and three referring to the work of the eu network of inibentexperts on fundamental rights the commission took the view that the commission that the information collected by the network and i	and rely on in order to strengthen mutual trust within the eu twenty eight member states this is not a new idea in its communication of fifteen october two thousand and three referring to the work of the eu network of inibentexperts on fundamental rights the commission took the view that the commission that the information collected by the network and i	/media/hugo/Seagate Expansion Drive/ALICE_BACKUP/voshpde/wav_files/zipfiles/2016061602.wav	0
140	/media/hugo/Seagate Expansion Drive/ALICE_BACKUP/voshpde/pipeLine/segmentation_wavfiles/2016061602/141_2016061602.wav	3157.9031746031746	139263530	3181.3531746031745	140297675	140_2016061602	should make it possible to detect fundamental rights anomalies or situations where there might be a breach or the risk of breach of these rights falling within article seven of the treaty of the european union through its analysis the network can also help in finding solutions to remedy confirmed anomalies or to prevent potential breaches	should make it possible to detect fundamental rights anomalies or situations where there might be a breach or the risk of breach of these rights falling within article seven of the treaty of the european union through its analysis the network can also help in finding solutions to remedy confirmed anomalies or to prevent potential breaches	/media/hugo/Seagate Expansion Drive/ALICE_BACKUP/voshpde/wav_files/zipfiles/2016061602.wav	0
141	/media/hugo/Seagate Expansion Drive/ALICE_BACKUP/voshpde/pipeLine/segmentation_wavfiles/2016061602/142_2016061602.wav	3181.3531972789115	140297676	3210.7031972789114	141592011	141_2016061602	monitoring has also an essentially preventive role in that it can provide ideas for achieving the area of freedom security and justice or alerting the institutions to divergent trends and standards of protection between the member states which could imperil humutual trust on which union policies are founded you see generally the charter of fundamental rights and other fundamental rights binding in the eu legal order are seen as imposing limits as disempowering eu	monitoring has also an essentially preventive role in that it can provide ideas for achieving the area of freedom security and justice or alerting the institutions to divergent trends and standards of protection between the member states which could imperil humutual trust on which union policies are founded you see generally the charter of fundamental rights and other fundamental rights binding in the eu legal order are seen as imposing limits as disempowering	/media/hugo/Seagate Expansion Drive/ALICE_BACKUP/voshpde/wav_files/zipfiles/2016061602.wav	3
142	/media/hugo/Seagate Expansion Drive/ALICE_BACKUP/voshpde/pipeLine/segmentation_wavfiles/2016061602/143_2016061602.wav	3210.7032199546484	141592012	3232.9532199546484	142573237	142_2016061602	eu they could be seen as also guiding action as impowing the eu has a charter of fundamental rights it has fundamental rights tools it has no fundamental rights policy for such a policy to emerge we must first see fundamental rights not simply as prohibiting certain actions but also a stimulating the presentation of legislative proposals	they could be seen as also guiding action as impowing the eu has a charter of fundamental rights it has fundamental rights tools it has no fundamental rights policy for such a policy to emerge we must first see fundamental rights not simply as prohibiting certain actions but also a stimulating the presentation of legislative proposals	/media/hugo/Seagate Expansion Drive/ALICE_BACKUP/voshpde/wav_files/zipfiles/2016061602.wav	3
143	/media/hugo/Seagate Expansion Drive/ALICE_BACKUP/voshpde/pipeLine/segmentation_wavfiles/2016061602/144_2016061602.wav	3232.9532426303854	142573238	3255.1032426303855	143550053	143_2016061602	guiding policy initiatives providing a focal point for interinstitutional dialogue as well as for negotiations between the eu member states within the council the preparation by far the fundamentarighs agency of an annual report on the situation of fundamental rights on the rule of law and democracy in the union could serve as a departure point for this	guiding policy initiatives providing a focal point for interinstitutional dialogue as well as for negotiations between the eu member states within the council the preparation by far the fundamentarighs agency of an annual report on the situation of fundamental rights on the rule of law and democracy in the union could serve as a departure point for this	/media/hugo/Seagate Expansion Drive/ALICE_BACKUP/voshpde/wav_files/zipfiles/2016061602.wav	0
144	/media/hugo/Seagate Expansion Drive/ALICE_BACKUP/voshpde/pipeLine/segmentation_wavfiles/2016061602/145_2016061602.wav	3255.1032653061225	143550054	3276.6532653061226	144500409	144_2016061602	provided it feed into a fundamental rights policy cycle this means that this report should form the basis on which the commission and parliament under article seven of the eu can have a debate and it also means that this report could guide the commission in identifying the potential initiatives it could take	provided it feed into a fundamental rights policy cycle this means that this report should form the basis on which the commission and parliament under article seven of the eu can have a debate and it also means that this report could guide the commission in identifying the potential initiatives it could take	/media/hugo/Seagate Expansion Drive/ALICE_BACKUP/voshpde/wav_files/zipfiles/2016061602.wav	0
