	wavfile	start_seconds	start_frames	end_seconds	end_frames	identifier	inferred_text_with_hotwords	inferred_text_without_hotwords	motherfile	dist
0	/media/hugo/Seagate Expansion Drive/ALICE_BACKUP/voshpde/pipeLine/segmentation_wavfiles/2016040702/001_2016040702.wav	0.0	0	23.95	1056195	000_2016040702	de good after non everybody you know very often we are missing times so we should start quickly having in mind all the questions that might come up	de good after non everybody you know very often we are missing times so we should start quickly having in mind all the questions that might come up	/media/hugo/Seagate Expansion Drive/ALICE_BACKUP/voshpde/wav_files/zipfiles/2016040702.wav	0
1	/media/hugo/Seagate Expansion Drive/ALICE_BACKUP/voshpde/pipeLine/segmentation_wavfiles/2016040702/002_2016040702.wav	23.95002267573696	1056196	39.20002267573696	1728721	001_2016040702	this morning we change the agenda of our committee meeting so we will now start with point fourteen the internet and drug markets report and it will be presentation	this morning we change the agenda of our committee meeting so we will now start with point fourteen the internet and drug markets report and it will be presentation	/media/hugo/Seagate Expansion Drive/ALICE_BACKUP/voshpde/wav_files/zipfiles/2016040702.wav	0
2	/media/hugo/Seagate Expansion Drive/ALICE_BACKUP/voshpde/pipeLine/segmentation_wavfiles/2016040702/003_2016040702.wav	39.200045351473925	1728722	55.75004535147392	2458577	002_2016040702	avi mr gusde the director of the emcdda and by mr vasilaskas from europol and we will also ask after that the commission to come up with some additional	avi mr gusde the director of the emcdda and by mr vasilaskas from europol and we will also ask after that the commission to come up with some additional	/media/hugo/Seagate Expansion Drive/ALICE_BACKUP/voshpde/wav_files/zipfiles/2016040702.wav	0
3	/media/hugo/Seagate Expansion Drive/ALICE_BACKUP/voshpde/pipeLine/segmentation_wavfiles/2016040702/004_2016040702.wav	55.75006802721089	2458578	71.20006802721089	3139923	003_2016040702	point you might remember that on fifth apl both organisations were joining forces to launch their second eu drug markets report and they will present it today	point you might remember that on fifth apl both organisations were joining forces to launch their second eu drug markets report and they will present it today	/media/hugo/Seagate Expansion Drive/ALICE_BACKUP/voshpde/wav_files/zipfiles/2016040702.wav	0
4	/media/hugo/Seagate Expansion Drive/ALICE_BACKUP/voshpde/pipeLine/segmentation_wavfiles/2016040702/005_2016040702.wav	71.20009070294785	3139924	96.15009070294785	4240219	004_2016040702	how to tackle the online drug trade and options for common action is a major challenge for the union as well as third country researches in representatives from civil society industry and the relevant eu agencies and international organisations so to see what currently is taking place i will first give the floor to mr us you have the floor	how to tackle the online drug trade and options for common action is a major challenge for the union as well as third country researches in representatives from civil society industry and the relevant eu agencies and international organisations so to see what currently is taking place i will first give the floor to mr gusdie you have the floor	/media/hugo/Seagate Expansion Drive/ALICE_BACKUP/voshpde/wav_files/zipfiles/2016040702.wav	4
5	/media/hugo/Seagate Expansion Drive/ALICE_BACKUP/voshpde/pipeLine/segmentation_wavfiles/2016040702/006_2016040702.wav	96.15011337868481	4240220	120.0001133786848	5292005	005_2016040702	mr president the honouraber members of the european parliament and of the libe committee ladies and gentlemen it is a great pleasure to present you today the second european drug market report that was launched last tes day with commissioner avramopulos and with my colleague robrainwite director of europol	mr president the honouraber members of the european parliament and of the deb committee ladies and gentlemen it is a great pleasure to present you today the second european drug market report that was launched last tes day with commissioner avramopulos and with my colleague robrainwite director of europol	/media/hugo/Seagate Expansion Drive/ALICE_BACKUP/voshpde/wav_files/zipfiles/2016040702.wav	3
6	/media/hugo/Seagate Expansion Drive/ALICE_BACKUP/voshpde/pipeLine/segmentation_wavfiles/2016040702/007_2016040702.wav	120.00013605442177	5292006	149.45013605442176	6590751	006_2016040702	this report is built on the synthesis of operational intelligence and expertise provided by europol together with research data statistics and information available from the ongoing monitoring of the drug situation by the emcdda and its retox network of national focal points this is what makes this report unique us it provides a strategic an	this report is built on the synthesis of operational intelligence and expertise provided by europol together with research data statistics and information available from the ongoing monitoring of the drug situation by the mcdda and its retox network of national focal points this is what makes this report unique as it provides a strategic an	/media/hugo/Seagate Expansion Drive/ALICE_BACKUP/voshpde/wav_files/zipfiles/2016040702.wav	2
7	/media/hugo/Seagate Expansion Drive/ALICE_BACKUP/voshpde/pipeLine/segmentation_wavfiles/2016040702/008_2016040702.wav	149.45015873015873	6590752	174.40015873015872	7691047	007_2016040702	that is only possible by integrating data intelligence and context you our information that come from two different words that usually do not work very closely sometimes do not speak rely with each other demand and supply reduction what us changed since the publication of the first truck markets report three years ago what is eu	that is only possible by integrating data intelligence and context you our information that come from two different words that usually do not work very closely sometimes do not speak rely with each other demand and supply reduction what has changed since the publication of the first truck markets report three years ago what is new	/media/hugo/Seagate Expansion Drive/ALICE_BACKUP/voshpde/wav_files/zipfiles/2016040702.wav	4
8	/media/hugo/Seagate Expansion Drive/ALICE_BACKUP/voshpde/pipeLine/segmentation_wavfiles/2016040702/009_2016040702.wav	174.4001814058957	7691048	190.7501814058957	8412083	008_2016040702	what is the new knowledge that working together with europol and with our partners we are presenting to you today first of all we have for the first time produced an estimate of the size of the illicit drug market in the eu	what is the new knowledge that working together with europol and with our partners we are presenting to you today first of all we have for the first time produced an estimate of the size of the illicit drug market in the eu	/media/hugo/Seagate Expansion Drive/ALICE_BACKUP/voshpde/wav_files/zipfiles/2016040702.wav	0
9	/media/hugo/Seagate Expansion Drive/ALICE_BACKUP/voshpde/pipeLine/segmentation_wavfiles/2016040702/010_2016040702.wav	190.75020408163266	8412084	212.10020408163265	9353619	009_2016040702	this is worth at least eu twenty four billion euro per year and the range of the estimates between eu twenty one two eu thirty one billion just ave methodological remark to make about this amount it is the first time that we based the amount on existing the estimation of the amount	this is worth at least twenty four billion euro per year and the range of the estimates between twenty one to eur thirty one billion just ave methodological remark to make about this amount it is the first time that we based the amount on existing the estimation of the amount	/media/hugo/Seagate Expansion Drive/ALICE_BACKUP/voshpde/wav_files/zipfiles/2016040702.wav	8
10	/media/hugo/Seagate Expansion Drive/ALICE_BACKUP/voshpde/pipeLine/segmentation_wavfiles/2016040702/011_2016040702.wav	212.10022675736963	9353620	240.05022675736961	10586215	010_2016040702	on existing data being collected in the whole european union starting the data we have about people in treatment what we know about the consumption so it is a low estimate we think that most probably over the years by continuing to further developed the estimate we will refine the instrument most probably deamount closer from the real amount	on existing data being collected in the whole european union starting the data we have about people in treatment what we know about the consumption so it is a low estimate we think that most probably over the years by continuing to further developed the estimate we will refine the instrument most probably deamount closer from the real amount	/media/hugo/Seagate Expansion Drive/ALICE_BACKUP/voshpde/wav_files/zipfiles/2016040702.wav	0
11	/media/hugo/Seagate Expansion Drive/ALICE_BACKUP/voshpde/pipeLine/segmentation_wavfiles/2016040702/012_2016040702.wav	240.0502494331066	10586216	262.9002494331066	11593901	011_2016040702	is settingly higher probably around the upper part of the range may be even but today as far as we can say more sorliis a robust estimate is eu twenty four billion pa year the market share for each of the main drorks being used in europe is as follows thirty eight for kanabis	is settingly higher probably around the upper part of the range may be even but today as far as we can say more sorliis a robust estimate is twenty four billion per year the market share for each of the main drorks being used in europe is as follows thirty eight for kanabis	/media/hugo/Seagate Expansion Drive/ALICE_BACKUP/voshpde/wav_files/zipfiles/2016040702.wav	5
12	/media/hugo/Seagate Expansion Drive/ALICE_BACKUP/voshpde/pipeLine/segmentation_wavfiles/2016040702/013_2016040702.wav	262.9002721088435	11593902	284.95027210884354	12566307	012_2016040702	twenty eight for erin twenty four for cocaine and then we change bit the category with the drugs that are that have a lower share of the market with approximately eight for anfitaminenanfitamin and three for extaca or mdm	twenty eight for erin twenty four for cocaine and then we change bit the category with the drugs that are that have a lower share of the market with approximately eight for anfitaminenanfitamin and three for extaca or mdme	/media/hugo/Seagate Expansion Drive/ALICE_BACKUP/voshpde/wav_files/zipfiles/2016040702.wav	1
13	/media/hugo/Seagate Expansion Drive/ALICE_BACKUP/voshpde/pipeLine/segmentation_wavfiles/2016040702/014_2016040702.wav	284.9502947845805	12566308	305.7002947845805	13481383	013_2016040702	you will tell me yes but what about the mps emcdda and europol talk towards frequently about the increase of those mps the new sacoactive substances which include the large number of substances that are sold openly as legal replacement for idictrorkswedonotgive	you will tell me yes but what about the mps emcdd and europe or talk towards frequently about the increase of those mps the new sacoactive substances which include the large number of substances that are sold openly as legal replacement for idictrorkswedonotgive	/media/hugo/Seagate Expansion Drive/ALICE_BACKUP/voshpde/wav_files/zipfiles/2016040702.wav	4
14	/media/hugo/Seagate Expansion Drive/ALICE_BACKUP/voshpde/pipeLine/segmentation_wavfiles/2016040702/015_2016040702.wav	305.7003174603175	13481384	324.65031746031747	14317079	014_2016040702	we do not yet ever estimate but what is true is that the number the type and the availability of these substances are showing no signs of slowing down and last year i remind you that we have identified together with europe or one hundred new substances	we do not yet ever estimate but what is true is that the number the type and the availability of these substances are showing no signs of slowing down and last year i remind you that we have identified together with europe or one hundred new substances	/media/hugo/Seagate Expansion Drive/ALICE_BACKUP/voshpde/wav_files/zipfiles/2016040702.wav	0
15	/media/hugo/Seagate Expansion Drive/ALICE_BACKUP/voshpde/pipeLine/segmentation_wavfiles/2016040702/016_2016040702.wav	324.6503401360544	14317080	347.9003401360544	15342405	015_2016040702	that were reported to us for the first time and the european early warning system which is coordinated by emcdda is currently monitoring more than five hundred and sixty those substances of which seventy eight have been have appeared over the last five years and here again a small remark regarding	that were reported to was for the first time and the european early warning system which is coordinated by mcdd is currently monitoring more than five hundred and sixty those substances of which seventy eight have been have appeared over the last five years and here again a small remark regarding	/media/hugo/Seagate Expansion Drive/ALICE_BACKUP/voshpde/wav_files/zipfiles/2016040702.wav	4
16	/media/hugo/Seagate Expansion Drive/ALICE_BACKUP/voshpde/pipeLine/segmentation_wavfiles/2016040702/017_2016040702.wav	347.9003628117914	15342406	377.6503628117914	16654381	016_2016040702	what it means what is the impact and what is the workload and the importance of this early warning system the work is not only about detecting the new substances but also is to continue to control if there appear appear again disappear what is happening with those substances on the european market this is why on the long term implies a very heavy workload for all agencies that are involved in this process	what it means what is the impact and what is the workload and the importance of this early warning system the work is not only about detecting the new substances but also is to continue to control if there appear appear again disappear what is happening with those substances on the european market this is why on the long term implies a very heavy workload for all agencies that are involved in this process	/media/hugo/Seagate Expansion Drive/ALICE_BACKUP/voshpde/wav_files/zipfiles/2016040702.wav	0
17	/media/hugo/Seagate Expansion Drive/ALICE_BACKUP/voshpde/pipeLine/segmentation_wavfiles/2016040702/018_2016040702.wav	377.65038548752835	16654382	403.80038548752833	17807597	017_2016040702	for each of the substances of the groups of substances that i have mentioned the report gives a comprehensive analysis of the situation and proposes points for action following already the initiative taken by europol lenders in the first truck market report the report also describes four main ways in which drug markets impact society	for each of the substances of the groups of substances that i have mentioned the report gives a comprehensive analysis of the situation and proposes points for action following already the initiative taken by europol lenders in the first truck market report the report also describes four main ways in which drug markets impact society	/media/hugo/Seagate Expansion Drive/ALICE_BACKUP/voshpde/wav_files/zipfiles/2016040702.wav	0
18	/media/hugo/Seagate Expansion Drive/ALICE_BACKUP/voshpde/pipeLine/segmentation_wavfiles/2016040702/019_2016040702.wav	403.80040816326533	17807598	420.6504081632653	18550683	018_2016040702	the first is the link with other types of criminal activity and terrorism second is the impact on legal businesses and the wider economy third is the strain on and the corruption of government institutions	the first is the link with other types of criminal activity and terrorism second is the impact on legal businesses and the wider economy third is the strain on and the corruption of government institutions	/media/hugo/Seagate Expansion Drive/ALICE_BACKUP/voshpde/wav_files/zipfiles/2016040702.wav	0
19	/media/hugo/Seagate Expansion Drive/ALICE_BACKUP/voshpde/pipeLine/segmentation_wavfiles/2016040702/020_2016040702.wav	420.65043083900224	18550684	437.50043083900226	19293769	019_2016040702	the fourth one which is not the least one is the negative effects they have on society more broadly for instance through drug related crime and violence but also environmental damage and harms to users families and communities	the fourth one which is not the least one is the negative effects they have on society more broadly for instance through drug related crime and violence but also environmental damage and harms to users families and communities	/media/hugo/Seagate Expansion Drive/ALICE_BACKUP/voshpde/wav_files/zipfiles/2016040702.wav	0
20	/media/hugo/Seagate Expansion Drive/ALICE_BACKUP/voshpde/pipeLine/segmentation_wavfiles/2016040702/021_2016040702.wav	437.5004535147392	19293770	458.0504535147392	20200025	020_2016040702	we go on to analyse the main drivers of drug market change showing out the developments associated with globalisation i key drivers also for change and innovation in drug markets as mentioned by the chair it was also highlighted by mr ramos	we go on to analyse the main drivers of drug market change showing out the developments associated with globalisation i key drivers also for change and innovation in drug markets as mentioned by the chair it was also highlighted by mr ramos	/media/hugo/Seagate Expansion Drive/ALICE_BACKUP/voshpde/wav_files/zipfiles/2016040702.wav	0
21	/media/hugo/Seagate Expansion Drive/ALICE_BACKUP/voshpde/pipeLine/segmentation_wavfiles/2016040702/022_2016040702.wav	458.0504761904762	20200026	487.1004761904762	21481131	021_2016040702	the influential role of the internet the rule that internet place in the drug business providing both sales outlets and opportunities to shortterm the supply chain while reducing opportunities for low enforcement intervention so it certainly one of the biggest challenges not the only one but one of the biggest challenges we are facing the european drug market is driven by two simple motives profit and power	the influential role of the internet the rule that internet place in the drug business providing both sales outlets and opportunities to shortterm the supply chain while reducing opportunities for low enforcement intervention so it certainly one of the biggest challenges not the only one but one of the biggest challenges we are facing the european drug market is driven by two simple motives profit and power	/media/hugo/Seagate Expansion Drive/ALICE_BACKUP/voshpde/wav_files/zipfiles/2016040702.wav	0
22	/media/hugo/Seagate Expansion Drive/ALICE_BACKUP/voshpde/pipeLine/segmentation_wavfiles/2016040702/023_2016040702.wav	487.1004988662132	21481132	504.3504988662132	22241857	022_2016040702	understanding the and the wider impact that drug markets have on society is critical if we are to reduce drug related harm this knowledge is essential for the development of new strategies for tackling crime and safeguarding the el	understanding the and the wider impact that drug markets have on society is critical if we are to reduce drug related harm this knowledge is essential for the development of new strategies for tackling crime and safeguarding the el	/media/hugo/Seagate Expansion Drive/ALICE_BACKUP/voshpde/wav_files/zipfiles/2016040702.wav	0
23	/media/hugo/Seagate Expansion Drive/ALICE_BACKUP/voshpde/pipeLine/segmentation_wavfiles/2016040702/024_2016040702.wav	504.3505215419501	22241858	523.5005215419501	23086373	023_2016040702	the security and the prosperity of our citizens lastly but of considerable importance is the recognition that the drug market concept as we have defined ed is one where the supply of drugs interact with the demand for these substances	the security and the prosperity of our citizens lastly but of considerable importance is the recognition that the drug market concept as we have defined ed is one where the supply of drugs interact with the demand for these substances	/media/hugo/Seagate Expansion Drive/ALICE_BACKUP/voshpde/wav_files/zipfiles/2016040702.wav	0
24	/media/hugo/Seagate Expansion Drive/ALICE_BACKUP/voshpde/pipeLine/segmentation_wavfiles/2016040702/025_2016040702.wav	523.5005442176871	23086374	545.550544217687	24058779	024_2016040702	in order to adequately address the negative consequences of the drug market both for individuals and for society as a whole effective drug prevention treatment harm reduction interventions social rehabilitation are us important as interventions aimed at reducing the supply	in order to adequately address the negative consequences of the drug market both for individuals and for society as a whole effective drug prevention treatment harm reduction interventions social rehabilitation are as important as interventions aimed at reducing the supply	/media/hugo/Seagate Expansion Drive/ALICE_BACKUP/voshpde/wav_files/zipfiles/2016040702.wav	1
25	/media/hugo/Seagate Expansion Drive/ALICE_BACKUP/voshpde/pipeLine/segmentation_wavfiles/2016040702/026_2016040702.wav	545.550566893424	24058780	564.0005668934241	24872425	025_2016040702	lad is and gentlemen eu since we last published this report just three years ago we have witnessed an acceleration in the rate at which the drug market is changing associating shifting patents of drug us	lad is and gentlemen since we last published this report just three years ago we have witnessed an acceleration in the rate at which the drug market is changing associating shifting patents of drug	/media/hugo/Seagate Expansion Drive/ALICE_BACKUP/voshpde/wav_files/zipfiles/2016040702.wav	6
26	/media/hugo/Seagate Expansion Drive/ALICE_BACKUP/voshpde/pipeLine/segmentation_wavfiles/2016040702/027_2016040702.wav	564.000589569161	24872426	581.250589569161	25633151	026_2016040702	cultural and social changes wider criminal activities and an increased complexity and interactivedness of the activities of organised crime groups in europe new aggressive marketing strategies	cultural and social changes wider criminal activities and an increased complexity and interactivedness of the activities of organised crime groups in europe new aggressive marketing strategies	/media/hugo/Seagate Expansion Drive/ALICE_BACKUP/voshpde/wav_files/zipfiles/2016040702.wav	0
27	/media/hugo/Seagate Expansion Drive/ALICE_BACKUP/voshpde/pipeLine/segmentation_wavfiles/2016040702/028_2016040702.wav	581.250612244898	25633152	602.400612244898	26565867	027_2016040702	and the use of the internet for increased production but also for reaching or creating new consumers markets have also played a significant in the last years today we are facing competing priorities terrorism in the heart of europe member states coping with mass migration	and the use of the internet for increased production but also for reaching or creating new consumers markets have also played a significant in the last years today we are facing competing priorities terrorism in the heart of europe member states coping with mass migration	/media/hugo/Seagate Expansion Drive/ALICE_BACKUP/voshpde/wav_files/zipfiles/2016040702.wav	0
28	/media/hugo/Seagate Expansion Drive/ALICE_BACKUP/voshpde/pipeLine/segmentation_wavfiles/2016040702/029_2016040702.wav	602.400634920635	26565868	618.9506349206349	27295723	028_2016040702	increasing instability and conflict in zones near the eu look at what happened the last three four years in ukraine in syria but also more recently the southern co cases of the subsarian region	increasing instability and conflict in zones near the eu look at what happened the last three four years in ukraine in syria but also more recently the southern co cases of the subsarian region	/media/hugo/Seagate Expansion Drive/ALICE_BACKUP/voshpde/wav_files/zipfiles/2016040702.wav	0
29	/media/hugo/Seagate Expansion Drive/ALICE_BACKUP/voshpde/pipeLine/segmentation_wavfiles/2016040702/030_2016040702.wav	618.9506575963719	27295724	637.3006575963719	28104959	029_2016040702	these factors create a perfect stone that reatens to undermine the success fold drug policies in place in europe and that is why this report is unimportant and timely reminder that we cannot and we will not lose focus of the drug situation	these factors create a perfect stone that reatens to undermine the success fold drug policies in place in europe and that is why this report is unimportant and timely reminder that we cannot and we will not lose focus of the drug situation	/media/hugo/Seagate Expansion Drive/ALICE_BACKUP/voshpde/wav_files/zipfiles/2016040702.wav	0
30	/media/hugo/Seagate Expansion Drive/ALICE_BACKUP/voshpde/pipeLine/segmentation_wavfiles/2016040702/031_2016040702.wav	637.3006802721088	28104960	660.0506802721088	29108235	030_2016040702	but we will continue to work to provide better strategic analysis and added value to all stakeholders you can count on the commitment of the emcdda to cooperate together with europol with the other european agencies the european institutions and the eu member states on this important challenge thank you very	but we will continue to work to provide better strategic analysis and added value to all stakeholders you can count on the commitment of the emcdda to cooperate together with europol with the other european agencies the european institutions and the eu member states on this important challenge thank you very	/media/hugo/Seagate Expansion Drive/ALICE_BACKUP/voshpde/wav_files/zipfiles/2016040702.wav	0
31	/media/hugo/Seagate Expansion Drive/ALICE_BACKUP/voshpde/pipeLine/segmentation_wavfiles/2016040702/032_2016040702.wav	660.0507029478458	29108236	687.0007029478458	30296731	031_2016040702	mr president it did not only mention the impact of using drugs on individuals and on society on the whole you also mention the link to other forms of crimes but also the criminal aspect within the drugs area and that is why directly give the floor to our next speak mr z	mr president it did not only mention the impact of using drugs on individuals and on society on the whole you also mention the link to other forms of crimes but also the criminal aspect within the drugs area and that is why directly give the floor to our next speak mr z	/media/hugo/Seagate Expansion Drive/ALICE_BACKUP/voshpde/wav_files/zipfiles/2016040702.wav	0
