	wavfile	start_seconds	start_frames	end_seconds	end_frames	identifier	inferred_text	motherfile
95	/media/hugo/Seagate Expansion Drive/ALICE_BACKUP/voshpde/pipeLine/segmentation_wavfiles/2017011202/096_2017011202.wav	2142.2521541950114	94473320	2164.202154195011	95441315	095_2017011202	lastly let me underline however that we had very conciblat progress even in the last day so i think for example the issue of free ports it is now covered in some way i also think it is good dat the exemptions that are herein legislation can be challenged in front of courts	/media/hugo/Seagate Expansion Drive/ALICE_BACKUP/voshpde/wav_files/zipfiles/2017011202.wav
96	/media/hugo/Seagate Expansion Drive/ALICE_BACKUP/voshpde/pipeLine/segmentation_wavfiles/2017011202/097_2017011202.wav	2164.202176870748	95441316	2188.1521768707485	96497511	096_2017011202	that is also a very important point that was brought to the table by different political groups so i think also there is a strong consensus here and last leas also very good that we got to tackle the issue of a real state and i agree with pit sem on that we need to ensure that these real state registrates can be better connected	/media/hugo/Seagate Expansion Drive/ALICE_BACKUP/voshpde/wav_files/zipfiles/2017011202.wav
97	/media/hugo/Seagate Expansion Drive/ALICE_BACKUP/voshpde/pipeLine/segmentation_wavfiles/2017011202/098_2017011202.wav	2188.1521995464855	96497512	2204.4021995464855	97214137	097_2017011202	lastly let me just lose two words on the list of highrisk countries for money laundering the plenary will vote next week on the rejection of the list and i know that there is some groups in this house it are still	/media/hugo/Seagate Expansion Drive/ALICE_BACKUP/voshpde/wav_files/zipfiles/2017011202.wav
98	/media/hugo/Seagate Expansion Drive/ALICE_BACKUP/voshpde/pipeLine/segmentation_wavfiles/2017011202/099_2017011202.wav	2204.402222222222	97214138	2231.7522222222224	98420273	098_2017011202	not finished with the decision making process and i just want to ask these colleagues that that i know from our common work and i know they are very serious about tackling these problems to support the decision that was taken by the econ and the libe committee to reject this list because financial action task force could not just could not reasonably argue in the panama committee why they have not included countries like	/media/hugo/Seagate Expansion Drive/ALICE_BACKUP/voshpde/wav_files/zipfiles/2017011202.wav
99	/media/hugo/Seagate Expansion Drive/ALICE_BACKUP/voshpde/pipeLine/segmentation_wavfiles/2017011202/100_2017011202.wav	2231.7522448979594	98420274	2257.802244897959	99569079	099_2017011202	for example behamus where i have a detailed report that i will release in few weeks how legislation that has been enacted is not for through properly and i think we cannot explain one year after the panama papers that countries like panama by hamas are not on this list it can to and so i kindly ask you to consider to support the position by parliament thank you very much	/media/hugo/Seagate Expansion Drive/ALICE_BACKUP/voshpde/wav_files/zipfiles/2017011202.wav
100	/media/hugo/Seagate Expansion Drive/ALICE_BACKUP/voshpde/pipeLine/segmentation_wavfiles/2017011202/101_2017011202.wav	2257.802267573696	99569080	2273.952267573696	100281295	100_2017011202	thank you i do not see spiagers from other groups nor i received request from catch for catch the eye so i can give for back to to corrupt orteurschristianis carrients yes i would just really like to	/media/hugo/Seagate Expansion Drive/ALICE_BACKUP/voshpde/wav_files/zipfiles/2017011202.wav
101	/media/hugo/Seagate Expansion Drive/ALICE_BACKUP/voshpde/pipeLine/segmentation_wavfiles/2017011202/102_2017011202.wav	2273.952290249433	100281296	2294.802290249433	101200781	101_2017011202	express my gratitude in enjoyment of working with all the shadows the meetings that we have had inspite of being very many in the roma actually productive in interesting in house i say on topic which does not always happen in all reports especially when there are so many of us	/media/hugo/Seagate Expansion Drive/ALICE_BACKUP/voshpde/wav_files/zipfiles/2017011202.wav
102	/media/hugo/Seagate Expansion Drive/ALICE_BACKUP/voshpde/pipeLine/segmentation_wavfiles/2017011202/103_2017011202.wav	2294.80231292517	101200782	2310.55231292517	101895357	102_2017011202	so i think that will continue working i am quite positive will find a good solution coming from parliament in terms of the voted legislation as always there will be individual points where one group at the other may not agree	/media/hugo/Seagate Expansion Drive/ALICE_BACKUP/voshpde/wav_files/zipfiles/2017011202.wav
103	/media/hugo/Seagate Expansion Drive/ALICE_BACKUP/voshpde/pipeLine/segmentation_wavfiles/2017011202/104_2017011202.wav	2310.552335600907	101895358	2331.602335600907	102823663	103_2017011202	but certainly where we are agreed is that we need this kind of legislation we need the tool against terrorism financing and the differences that we have between us are on the whole some at new ones and i think that we just have to appreciate one an others differences of opinion but understand that we are all aiming for the same goal	/media/hugo/Seagate Expansion Drive/ALICE_BACKUP/voshpde/wav_files/zipfiles/2017011202.wav
104	/media/hugo/Seagate Expansion Drive/ALICE_BACKUP/voshpde/pipeLine/segmentation_wavfiles/2017011202/105_2017011202.wav	2331.602358276644	102823664	2351.252358276644	103690229	104_2017011202	mr president we there was a is understanding in the reading on the body language of the commission representative which will she did did not want to take before but she does so we play your we give you the frau which just ask you to be very brief and then other co rapporteur for that	/media/hugo/Seagate Expansion Drive/ALICE_BACKUP/voshpde/wav_files/zipfiles/2017011202.wav
105	/media/hugo/Seagate Expansion Drive/ALICE_BACKUP/voshpde/pipeLine/segmentation_wavfiles/2017011202/106_2017011202.wav	2351.252380952381	103690230	2374.2023809523807	104702325	105_2017011202	mr thank y very muident i am callinasimionoverybriflyteamleader of the anti money laundering team of digit justice while we are very grateful for for all what we heard now and also what we saw in the amendments we think there is a lot of good material we can work with and we really want to thank the corapporteurs and the shadows for the constructive work	/media/hugo/Seagate Expansion Drive/ALICE_BACKUP/voshpde/wav_files/zipfiles/2017011202.wav
106	/media/hugo/Seagate Expansion Drive/ALICE_BACKUP/voshpde/pipeLine/segmentation_wavfiles/2017011202/107_2017011202.wav	2374.2024036281177	104702326	2392.552403628118	105511561	106_2017011202	of course in there number of points which i could intervene but and like the explain the retinal behind the appointment of the seniod manager for instance where the idea has always been not to circumvent the rules but actually to allow us to allow businesses to continue why when they are legitimate while we can still have a hook	/media/hugo/Seagate Expansion Drive/ALICE_BACKUP/voshpde/wav_files/zipfiles/2017011202.wav
107	/media/hugo/Seagate Expansion Drive/ALICE_BACKUP/voshpde/pipeLine/segmentation_wavfiles/2017011202/108_2017011202.wav	2392.552426303855	105511562	2408.502426303855	106214957	107_2017011202	because the idea there was to actually have somebody to touch upon but all these are newances and i think we can we can work to find a good solution there may be only just one word because i heard the last intervention of mr damasi on the high risk third country list	/media/hugo/Seagate Expansion Drive/ALICE_BACKUP/voshpde/wav_files/zipfiles/2017011202.wav
108	/media/hugo/Seagate Expansion Drive/ALICE_BACKUP/voshpde/pipeLine/segmentation_wavfiles/2017011202/109_2017011202.wav	2408.502448979592	106214958	2435.352448979592	107399043	108_2017011202	we do here what you said many understand where parliament comes from and we do recognise that there is a real need for a robust methodology to create this approperly and do it rightly at eu level this is something whih we already committed to work om however it will take time and for the time being we need to be very constructive and work with do on that but at the same time also continue allow the system cot opricorte	/media/hugo/Seagate Expansion Drive/ALICE_BACKUP/voshpde/wav_files/zipfiles/2017011202.wav
109	/media/hugo/Seagate Expansion Drive/ALICE_BACKUP/voshpde/pipeLine/segmentation_wavfiles/2017011202/110_2017011202.wav	2435.352471655329	107399044	2453.3024716553286	108190639	109_2017011202	i well soy about that just wanted to say that you know what there will be a next siterration they we have to work on the minutes have already the cook and taken their position on and we will vote in the plenary resident thank you very much to this such anti	/media/hugo/Seagate Expansion Drive/ALICE_BACKUP/voshpde/wav_files/zipfiles/2017011202.wav
110	/media/hugo/Seagate Expansion Drive/ALICE_BACKUP/voshpde/pipeLine/segmentation_wavfiles/2017011202/111_2017011202.wav	2453.3024943310656	108190640	2478.9524943310657	109321805	110_2017011202	mr president let me eco anicomespear to semonsanandfairthe masse on the wish that we would have a good vote next week where parliament actually shows the commission will all du respect this is not what we think is high risk third countries in the way the european union should look at it but will see what happens tomorrow	/media/hugo/Seagate Expansion Drive/ALICE_BACKUP/voshpde/wav_files/zipfiles/2017011202.wav
111	/media/hugo/Seagate Expansion Drive/ALICE_BACKUP/voshpde/pipeLine/segmentation_wavfiles/2017011202/112_2017011202.wav	2478.9525170068027	109321806	2494.9025170068026	110025201	111_2017011202	i were talking econ on libya here but i also am a member of the development committee and my motivation for this file has to do with illicit money flows out of africa and other developing countries where one is not paying their taxes	/media/hugo/Seagate Expansion Drive/ALICE_BACKUP/voshpde/wav_files/zipfiles/2017011202.wav
112	/media/hugo/Seagate Expansion Drive/ALICE_BACKUP/voshpde/pipeLine/segmentation_wavfiles/2017011202/113_2017011202.wav	2494.9025396825396	110025202	2524.1525396825396	111315127	112_2017011202	a big multinationals trying to find ways to not pay taxes whether work is being done that is my ultimate motivation and for that i need transparency so that is where where i am going and where i am continue to fight for i would suggest to the ecr that the two go rapporteurs figure out where they stand when it comes on transparency but i do feel that there is a majority that follows that follows the intention of being asked	/media/hugo/Seagate Expansion Drive/ALICE_BACKUP/voshpde/wav_files/zipfiles/2017011202.wav
113	/media/hugo/Seagate Expansion Drive/ALICE_BACKUP/voshpde/pipeLine/segmentation_wavfiles/2017011202/114_2017011202.wav	2524.1525623582766	111315128	2547.0025623582765	112322813	113_2017011202	i transparent as possible next week we have got on other shadow meeting there is an offer lot of work still to be done if we want to respect the deadline if we want to respect the voting intended for the twenty five january that it starts to be very challenging that is what i wanted to say thank you	/media/hugo/Seagate Expansion Drive/ALICE_BACKUP/voshpde/wav_files/zipfiles/2017011202.wav
114	/media/hugo/Seagate Expansion Drive/ALICE_BACKUP/voshpde/pipeLine/segmentation_wavfiles/2017011202/115_2017011202.wav	2547.0025850340135	112322814	2563.5525850340136	113052669	114_2017011202	thank you very much the vote is chaduled for twenty fit january thank you very much the meeting is close	/media/hugo/Seagate Expansion Drive/ALICE_BACKUP/voshpde/wav_files/zipfiles/2017011202.wav
115	/media/hugo/Seagate Expansion Drive/ALICE_BACKUP/voshpde/pipeLine/segmentation_wavfiles/2017011202/116_2017011202.wav	2563.5526077097506	113052670	2568.335963718821	113263616	115_2017011202	o	/media/hugo/Seagate Expansion Drive/ALICE_BACKUP/voshpde/wav_files/zipfiles/2017011202.wav
