	wavfile	start_seconds	start_frames	end_seconds	end_frames	identifier	inferred_text	motherfile
48	/media/hugo/Seagate Expansion Drive/ALICE_BACKUP/voshpde/pipeLine/segmentation_wavfiles/2017011202/049_2017011202.wav	1065.5010884353742	46988598	1081.4510884353742	47691993	048_2017011202	mr preside we introduced amendments to ensure a public register of beneficial owners of companies and trusts with a minimum mount of information publicly accessible	/media/hugo/Seagate Expansion Drive/ALICE_BACKUP/voshpde/wav_files/zipfiles/2017011202.wav
49	/media/hugo/Seagate Expansion Drive/ALICE_BACKUP/voshpde/pipeLine/segmentation_wavfiles/2017011202/050_2017011202.wav	1081.451111111111	47691994	1101.601111111111	48580609	049_2017011202	and i would like to actually eco what our co rapporteurs have said that we have very very good track to achieve this agreement on this and and i thank the work than by the co rapporteurs	/media/hugo/Seagate Expansion Drive/ALICE_BACKUP/voshpde/wav_files/zipfiles/2017011202.wav
50	/media/hugo/Seagate Expansion Drive/ALICE_BACKUP/voshpde/pipeLine/segmentation_wavfiles/2017011202/051_2017011202.wav	1101.601133786848	48580610	1125.451133786848	49632395	050_2017011202	we also introduced an amendment i personally introduced an ansictuitan amendment extending the scope of the register to foreign corporate entities who engage in the eu in certain business relationships which already requires some formalities like by real state and opening a manka con	/media/hugo/Seagate Expansion Drive/ALICE_BACKUP/voshpde/wav_files/zipfiles/2017011202.wav
51	/media/hugo/Seagate Expansion Drive/ALICE_BACKUP/voshpde/pipeLine/segmentation_wavfiles/2017011202/052_2017011202.wav	1125.451156462585	49632396	1149.101156462585	50675361	051_2017011202	i think if this amendment is passed it will truly create a global impact in the level of transparency of corporate structures and monica omar just mentioned and i lighted duly how this is so important not just to fight corruption to fight tax evasion and money laundering but actually to prevent organised crime transnational crime and terrorism	/media/hugo/Seagate Expansion Drive/ALICE_BACKUP/voshpde/wav_files/zipfiles/2017011202.wav
52	/media/hugo/Seagate Expansion Drive/ALICE_BACKUP/voshpde/pipeLine/segmentation_wavfiles/2017011202/053_2017011202.wav	1149.101179138322	50675362	1169.451179138322	51572797	052_2017011202	from taking advantage and of course we know that it is not only through tress it is through corporations fake corporations or or even very real corporations we actually bio property in the eu by assets in the eu and then this is a system to launder the money if we demand a high level of	/media/hugo/Seagate Expansion Drive/ALICE_BACKUP/voshpde/wav_files/zipfiles/2017011202.wav
53	/media/hugo/Seagate Expansion Drive/ALICE_BACKUP/voshpde/pipeLine/segmentation_wavfiles/2017011202/054_2017011202.wav	1169.451201814059	51572798	1198.001201814059	52831853	053_2017011202	details or some level of detest for the trusts then we need to do it as well for corporations we engage in these business activities in the eu it is doable and we should and i count on the epp to support that we introduced as well amendments to close a loophole in the current directive in the forth directive whereby a sna senior manager can be stated	/media/hugo/Seagate Expansion Drive/ALICE_BACKUP/voshpde/wav_files/zipfiles/2017011202.wav
54	/media/hugo/Seagate Expansion Drive/ALICE_BACKUP/voshpde/pipeLine/segmentation_wavfiles/2017011202/055_2017011202.wav	1198.001224489796	52831854	1226.451224489796	54086499	054_2017011202	a beneficial owner where the beneficial londer cannot be found i ask commissioner jerabobout this or could his happen she said it was a recommendation of the the fatf i do not think this is acceptable i see this already being very perversely used in the framework of force in my own country the only	/media/hugo/Seagate Expansion Drive/ALICE_BACKUP/voshpde/wav_files/zipfiles/2017011202.wav
55	/media/hugo/Seagate Expansion Drive/ALICE_BACKUP/voshpde/pipeLine/segmentation_wavfiles/2017011202/056_2017011202.wav	1226.4512471655328	54086500	1251.501247165533	55191205	055_2017011202	part of the first anti money laundering directive that has been enacted by the last government in two thousand and fifteen was a exactly this loophole and itslaff for good reasons i can assure you we have to close that gap and we should not follow the advice of the fits in this respect	/media/hugo/Seagate Expansion Drive/ALICE_BACKUP/voshpde/wav_files/zipfiles/2017011202.wav
56	/media/hugo/Seagate Expansion Drive/ALICE_BACKUP/voshpde/pipeLine/segmentation_wavfiles/2017011202/057_2017011202.wav	1251.5012698412697	55191206	1280.6512698412698	56476721	056_2017011202	we believe that the obliged entities shall not be able to engage in business relationship with entities whose beneficial owners are not known to them because this prevents them from properly assessing risk the same goes to the registers registers of beneficial owners should not accept registration of companies where only the senior manager is willing to be identified only other hand	/media/hugo/Seagate Expansion Drive/ALICE_BACKUP/voshpde/wav_files/zipfiles/2017011202.wav
57	/media/hugo/Seagate Expansion Drive/ALICE_BACKUP/voshpde/pipeLine/segmentation_wavfiles/2017011202/058_2017011202.wav	1280.6512925170068	56476722	1302.801292517007	57453537	057_2017011202	ten of the shareholding shall be in our view and indication of beneficial ownership of a company regardless of its character with regard to the entities which have to carry out due diligence we wish to broaden the scope to include anyone providing wealth management and tax advice	/media/hugo/Seagate Expansion Drive/ALICE_BACKUP/voshpde/wav_files/zipfiles/2017011202.wav
58	/media/hugo/Seagate Expansion Drive/ALICE_BACKUP/voshpde/pipeLine/segmentation_wavfiles/2017011202/059_2017011202.wav	1302.8013151927437	57453538	1322.9513151927438	58342153	058_2017011202	and also natural or legal persons trading in works of art arttealoristsoction houses and platforms for storing servicing and trading in works of art and other values like free ports we should not foll ourselves this is becoming more and more a way	/media/hugo/Seagate Expansion Drive/ALICE_BACKUP/voshpde/wav_files/zipfiles/2017011202.wav
59	/media/hugo/Seagate Expansion Drive/ALICE_BACKUP/voshpde/pipeLine/segmentation_wavfiles/2017011202/060_2017011202.wav	1322.9513378684808	58342154	1339.6013378684806	59076419	059_2017011202	to actually counter the financial controls with regard to politically exposed persons we think that the eu should have its own official list to be prepared and updated by the member states and assemble together by the commission	/media/hugo/Seagate Expansion Drive/ALICE_BACKUP/voshpde/wav_files/zipfiles/2017011202.wav
60	/media/hugo/Seagate Expansion Drive/ALICE_BACKUP/voshpde/pipeLine/segmentation_wavfiles/2017011202/061_2017011202.wav	1339.6013605442176	59076420	1364.2513605442177	60163485	060_2017011202	i do or if you know that the obliged entities like banks in clan at the moment they by these services from american companies like thor jones and often the data are totally nicurate starting with the spelling of the names so i we want to make sure that the commission has peter has just said will be ambitious in the list of i risk jurisdictions and not merely transpose the fatf	/media/hugo/Seagate Expansion Drive/ALICE_BACKUP/voshpde/wav_files/zipfiles/2017011202.wav
61	/media/hugo/Seagate Expansion Drive/ALICE_BACKUP/voshpde/pipeLine/segmentation_wavfiles/2017011202/062_2017011202.wav	1364.2513832199547	60163486	1392.1013832199546	61391671	061_2017011202	and i would just old end think that we introduce an amendment to ensure that member states national authorities perform customer due diligence measures regarding to third country nationals who apply for residence rights of citizenship in member states we just had malta here this is for ipp investor programmes boden visas we cannot continue to allow them the	/media/hugo/Seagate Expansion Drive/ALICE_BACKUP/voshpde/wav_files/zipfiles/2017011202.wav
62	/media/hugo/Seagate Expansion Drive/ALICE_BACKUP/voshpde/pipeLine/segmentation_wavfiles/2017011202/063_2017011202.wav	1392.1014058956916	61391672	1413.5514058956917	62337617	062_2017011202	mr president as the epp rapporteur has already said is not really that controversial we all agree on the objectives that is that we should prevent criminal activities	/media/hugo/Seagate Expansion Drive/ALICE_BACKUP/voshpde/wav_files/zipfiles/2017011202.wav
63	/media/hugo/Seagate Expansion Drive/ALICE_BACKUP/voshpde/pipeLine/segmentation_wavfiles/2017011202/064_2017011202.wav	1413.5514285714285	62337618	1429.0014285714285	63018963	063_2017011202	financing of terrorism money laundering make all of this binding and get rid of this unanimity shield which is being abused to carry out these activities so	/media/hugo/Seagate Expansion Drive/ALICE_BACKUP/voshpde/wav_files/zipfiles/2017011202.wav
64	/media/hugo/Seagate Expansion Drive/ALICE_BACKUP/voshpde/pipeLine/segmentation_wavfiles/2017011202/065_2017011202.wav	1429.0014512471655	63018964	1454.7514512471655	64154539	064_2017011202	the full consensus so far in my comments met much has already been said but are just concentrate on two aspects where there is not yet full consensus with the ecr first of all the public nature of the registers in containing information on beneficial owners	/media/hugo/Seagate Expansion Drive/ALICE_BACKUP/voshpde/wav_files/zipfiles/2017011202.wav
65	/media/hugo/Seagate Expansion Drive/ALICE_BACKUP/voshpde/pipeLine/segmentation_wavfiles/2017011202/066_2017011202.wav	1454.7514739229025	64154540	1471.8014739229025	64906445	065_2017011202	the greens rapporteur said that there is a progressive wing in this parliament that has made this request and bringing pressure to ba for everything to be made public and accessible to	/media/hugo/Seagate Expansion Drive/ALICE_BACKUP/voshpde/wav_files/zipfiles/2017011202.wav
66	/media/hugo/Seagate Expansion Drive/ALICE_BACKUP/voshpde/pipeLine/segmentation_wavfiles/2017011202/067_2017011202.wav	1471.8014965986395	64906446	1488.0514965986395	65623071	066_2017011202	all citizens that that came from the progressive forces that earlier had called for data protection privacy and the right to self determination that seems to have been forgotten	/media/hugo/Seagate Expansion Drive/ALICE_BACKUP/voshpde/wav_files/zipfiles/2017011202.wav
67	/media/hugo/Seagate Expansion Drive/ALICE_BACKUP/voshpde/pipeLine/segmentation_wavfiles/2017011202/068_2017011202.wav	1488.0515192743765	65623072	1515.0015192743765	66811567	067_2017011202	i would point out however that there are people who put their property in trusts or different organisations and they have justified claim to protecting that privacy name date of birth and contact address they are not necessarily need to be made fully public my position is that the	/media/hugo/Seagate Expansion Drive/ALICE_BACKUP/voshpde/wav_files/zipfiles/2017011202.wav
68	/media/hugo/Seagate Expansion Drive/ALICE_BACKUP/voshpde/pipeLine/segmentation_wavfiles/2017011202/069_2017011202.wav	1515.0015419501133	66811568	1537.7515419501133	67814843	068_2017011202	the financial intelligence units should have access to the information and at the authorities that are nominated in each member state in anyone who has a legitimate interest and can claim atimate interest of that information but that should be the end of it i do not really see why that data would be made available to people who do not have	/media/hugo/Seagate Expansion Drive/ALICE_BACKUP/voshpde/wav_files/zipfiles/2017011202.wav
69	/media/hugo/Seagate Expansion Drive/ALICE_BACKUP/voshpde/pipeLine/segmentation_wavfiles/2017011202/070_2017011202.wav	1537.7515646258503	67814844	1554.6015646258504	68557929	069_2017011202	any demonstrated legitimate interest at a lot of people who do not have a legitimate interest in the data starting with the financial service providers that could poach customers	/media/hugo/Seagate Expansion Drive/ALICE_BACKUP/voshpde/wav_files/zipfiles/2017011202.wav
70	/media/hugo/Seagate Expansion Drive/ALICE_BACKUP/voshpde/pipeLine/segmentation_wavfiles/2017011202/071_2017011202.wav	1554.6015873015874	68557930	1578.7515873015873	69622945	070_2017011202	by taking people from these registers all the way up to criminals that could be involved in black may or bringing pressure to be so starting to operate with exemptions if someone can demonstrate that it could be a victim of black	/media/hugo/Seagate Expansion Drive/ALICE_BACKUP/voshpde/wav_files/zipfiles/2017011202.wav
71	/media/hugo/Seagate Expansion Drive/ALICE_BACKUP/voshpde/pipeLine/segmentation_wavfiles/2017011202/072_2017011202.wav	1578.7516099773243	69622946	1607.1016099773242	70873181	071_2017011202	i shows how sensitive this area is but someone who is not a victim and if the addresses has been made public he would have to demonstrate that he could be a victim but how how could that be possible so it does not look like this has been well thought through i think we need to think again about the public nature of these registers we have heard from the pp that this is a proposal will probably not get through council	/media/hugo/Seagate Expansion Drive/ALICE_BACKUP/voshpde/wav_files/zipfiles/2017011202.wav
72	/media/hugo/Seagate Expansion Drive/ALICE_BACKUP/voshpde/pipeLine/segmentation_wavfiles/2017011202/073_2017011202.wav	1607.1016326530612	70873182	1634.6516326530611	72088137	072_2017011202	another point i want to make is the one of the definition of trusts and similar structures it is true that we do not have a definition of them we say the directive is going to refer to trust without defining what a trust is and then we say it is averting similar to a trust but what does that mean similar similar is also a very vague term which is not defined	/media/hugo/Seagate Expansion Drive/ALICE_BACKUP/voshpde/wav_files/zipfiles/2017011202.wav
73	/media/hugo/Seagate Expansion Drive/ALICE_BACKUP/voshpde/pipeLine/segmentation_wavfiles/2017011202/074_2017011202.wav	1634.6516553287981	72088138	1657.5016553287983	73095823	073_2017011202	a spend gigolk said yesterday that according to german legislation it is not just foundations that would be seen as similar structures but also associations a large number of all associations would be covered by that kind of requirement that were not really designed for them	/media/hugo/Seagate Expansion Drive/ALICE_BACKUP/voshpde/wav_files/zipfiles/2017011202.wav
74	/media/hugo/Seagate Expansion Drive/ALICE_BACKUP/voshpde/pipeLine/segmentation_wavfiles/2017011202/075_2017011202.wav	1657.501678004535	73095824	1684.8516780045352	74301959	074_2017011202	so we have this over precautious provision which could make it difficult to open an account in a normal financial institution without having to make up data public in a public register so i think we need to have a clear definition in the directive about who is affected by this directive and who is not a leave it at that	/media/hugo/Seagate Expansion Drive/ALICE_BACKUP/voshpde/wav_files/zipfiles/2017011202.wav
75	/media/hugo/Seagate Expansion Drive/ALICE_BACKUP/voshpde/pipeLine/segmentation_wavfiles/2017011202/076_2017011202.wav	1684.8517006802722	74301960	1711.6017006802722	75481635	075_2017011202	mraprthecrpresdeas a ecr rapporteur for the lib committee and i just wanted to say a couple of things first of all it is very important	/media/hugo/Seagate Expansion Drive/ALICE_BACKUP/voshpde/wav_files/zipfiles/2017011202.wav
76	/media/hugo/Seagate Expansion Drive/ALICE_BACKUP/voshpde/pipeLine/segmentation_wavfiles/2017011202/077_2017011202.wav	1711.601723356009	75481636	1739.251723356009	76701001	076_2017011202	to support amendments that increased transparency in particular those amendments that call for identification and verification of true beneficiaries and traceability of financial transactions i have submitted amendments to that effect i also agree that we need public access	/media/hugo/Seagate Expansion Drive/ALICE_BACKUP/voshpde/wav_files/zipfiles/2017011202.wav
77	/media/hugo/Seagate Expansion Drive/ALICE_BACKUP/voshpde/pipeLine/segmentation_wavfiles/2017011202/078_2017011202.wav	1739.251746031746	76701002	1763.201746031746	77757197	077_2017011202	to information on beneficial owners we need to ensure true protection for whistle blowers at the same time both of these go hand in hand and then on prepaid cards the use	/media/hugo/Seagate Expansion Drive/ALICE_BACKUP/voshpde/wav_files/zipfiles/2017011202.wav
78	/media/hugo/Seagate Expansion Drive/ALICE_BACKUP/voshpde/pipeLine/segmentation_wavfiles/2017011202/079_2017011202.wav	1763.201768707483	77757198	1784.751768707483	78707553	078_2017011202	on the internet is a true threat to our security that is why i support getting rid of the exception in the precautionary measures for customers that use prepaid cards on the internet	/media/hugo/Seagate Expansion Drive/ALICE_BACKUP/voshpde/wav_files/zipfiles/2017011202.wav
79	/media/hugo/Seagate Expansion Drive/ALICE_BACKUP/voshpde/pipeLine/segmentation_wavfiles/2017011202/080_2017011202.wav	1784.75179138322	78707554	1802.00179138322	79468279	079_2017011202	i propose that following entry into force of the directive the commission should create a platform for public access for granting access to a database on persons groups and entities that have suffered sanctions	/media/hugo/Seagate Expansion Drive/ALICE_BACKUP/voshpde/wav_files/zipfiles/2017011202.wav
80	/media/hugo/Seagate Expansion Drive/ALICE_BACKUP/voshpde/pipeLine/segmentation_wavfiles/2017011202/081_2017011202.wav	1802.0018140589568	79468280	1831.7518140589568	80780255	080_2017011202	m and to relevant information in that field alde group mr president usually speaking on is we will use the opportunity to speak my wold swedish first thank you first of all to the co rapporteurs for the excellent work	/media/hugo/Seagate Expansion Drive/ALICE_BACKUP/voshpde/wav_files/zipfiles/2017011202.wav
81	/media/hugo/Seagate Expansion Drive/ALICE_BACKUP/voshpde/pipeLine/segmentation_wavfiles/2017011202/082_2017011202.wav	1831.7518367346938	80780256	1854.401836734694	81779121	081_2017011202	repetitia est matedistodia i would say in latin it is true that these are matters to do with money laundering where we have not been going far enough so far we have been	/media/hugo/Seagate Expansion Drive/ALICE_BACKUP/voshpde/wav_files/zipfiles/2017011202.wav
82	/media/hugo/Seagate Expansion Drive/ALICE_BACKUP/voshpde/pipeLine/segmentation_wavfiles/2017011202/083_2017011202.wav	1854.401859410431	81779122	1879.651859410431	82892647	082_2017011202	fighting hard for these issues over the last couple of years and i am glad that we have these two very experienced rapporteurs that have done an excellent job these are many issues that we were already familiar with from earlier but we were ontable to get them pass the other side of the table that time	/media/hugo/Seagate Expansion Drive/ALICE_BACKUP/voshpde/wav_files/zipfiles/2017011202.wav
83	/media/hugo/Seagate Expansion Drive/ALICE_BACKUP/voshpde/pipeLine/segmentation_wavfiles/2017011202/084_2017011202.wav	1879.6518820861677	82892648	1908.7018820861679	84173753	083_2017011202	the first point was the point about trust funds foundations extra fido commisses as they were called where we still have certain structures say in the uk that are often used to conceal what is really going on the other point was about anhonomous	/media/hugo/Seagate Expansion Drive/ALICE_BACKUP/voshpde/wav_files/zipfiles/2017011202.wav
84	/media/hugo/Seagate Expansion Drive/ALICE_BACKUP/voshpde/pipeLine/segmentation_wavfiles/2017011202/085_2017011202.wav	1908.7019047619049	84173754	1924.1519047619047	84855099	084_2017011202	credit cards and anonymous sim cards that allow people to carry out in criminal activities we have een that with panama papers as well as the third big issue is	/media/hugo/Seagate Expansion Drive/ALICE_BACKUP/voshpde/wav_files/zipfiles/2017011202.wav
85	/media/hugo/Seagate Expansion Drive/ALICE_BACKUP/voshpde/pipeLine/segmentation_wavfiles/2017011202/086_2017011202.wav	1924.1519274376417	84855100	1953.6019274376417	86153845	085_2017011202	what we call beneficial owners where the true main man has been concealed and many times we have tried to get open registers up an running to facilitate monitoring now it is looking as i like we have got a well functioning register very glad about that but there are still some problems we have seen with the panama papers that	/media/hugo/Seagate Expansion Drive/ALICE_BACKUP/voshpde/wav_files/zipfiles/2017011202.wav
86	/media/hugo/Seagate Expansion Drive/ALICE_BACKUP/voshpde/pipeLine/segmentation_wavfiles/2017011202/087_2017011202.wav	1953.6019501133787	86153846	1980.2519501133786	87329111	086_2017011202	you can still have an account in a particular country and get into the european market with that money and then it is very difficult to solve that kind of problem the most recent discussion on this shows that there is some willingness to find a solution	/media/hugo/Seagate Expansion Drive/ALICE_BACKUP/voshpde/wav_files/zipfiles/2017011202.wav
87	/media/hugo/Seagate Expansion Drive/ALICE_BACKUP/voshpde/pipeLine/segmentation_wavfiles/2017011202/088_2017011202.wav	1980.2519727891156	87329112	1997.6019727891157	88094247	087_2017011202	so if work continues as it started i think we will manage to get a good result on this and i would like once again to thank the rapporteurs for the job done so for	/media/hugo/Seagate Expansion Drive/ALICE_BACKUP/voshpde/wav_files/zipfiles/2017011202.wav
88	/media/hugo/Seagate Expansion Drive/ALICE_BACKUP/voshpde/pipeLine/segmentation_wavfiles/2017011202/089_2017011202.wav	1997.6019954648525	88094248	2019.3519954648525	89053423	088_2017011202	mr president on the control overs between politicians and footpolplayers i am a politician i play footpols or me adly sime covered i can insure you thanks to the rapporteurs for the good compromises i also think we are having in a good direction this overall	/media/hugo/Seagate Expansion Drive/ALICE_BACKUP/voshpde/wav_files/zipfiles/2017011202.wav
89	/media/hugo/Seagate Expansion Drive/ALICE_BACKUP/voshpde/pipeLine/segmentation_wavfiles/2017011202/090_2017011202.wav	2019.3520181405895	89053424	2041.7020181405896	90039059	089_2017011202	an agreement what the job is at other hand let me also stress that this is not about pro control business this is really about abiding by the laws and we have seen by europol for example in the panama papers committee at a balkan	/media/hugo/Seagate Expansion Drive/ALICE_BACKUP/voshpde/wav_files/zipfiles/2017011202.wav
90	/media/hugo/Seagate Expansion Drive/ALICE_BACKUP/voshpde/pipeLine/segmentation_wavfiles/2017011202/091_2017011202.wav	2041.7020408163266	90039060	2061.9520408163266	90932085	090_2017011202	of the panmapaper transactions that they have put in their database was linked to terrorist finance and so i think it is very important that we close those loopholes and that we can argue reasonably even towards european citizens that we have done what we can	/media/hugo/Seagate Expansion Drive/ALICE_BACKUP/voshpde/wav_files/zipfiles/2017011202.wav
91	/media/hugo/Seagate Expansion Drive/ALICE_BACKUP/voshpde/pipeLine/segmentation_wavfiles/2017011202/092_2017011202.wav	2061.9520634920636	90932086	2083.0020634920634	91860391	091_2017011202	let me say that i enjoy very much the work with mena langan and others and panmapapers committee nevertheless i do not want to have such an inquiry committee again and this is why i want to focus on the three points where i think we still should be more ambitious in this file first of all	/media/hugo/Seagate Expansion Drive/ALICE_BACKUP/voshpde/wav_files/zipfiles/2017011202.wav
92	/media/hugo/Seagate Expansion Drive/ALICE_BACKUP/voshpde/pipeLine/segmentation_wavfiles/2017011202/093_2017011202.wav	2083.0020861678004	91860392	2105.5520861678006	92854847	092_2017011202	many of our experts on a panama papers committee from just stiglits two the financial intelligence units were very clear on one issue that we need to close the loophole on nomeny directors that ana already spalke about it is there is no reason why a company should not be able to say who is the beneficial owner and if they do not	/media/hugo/Seagate Expansion Drive/ALICE_BACKUP/voshpde/wav_files/zipfiles/2017011202.wav
93	/media/hugo/Seagate Expansion Drive/ALICE_BACKUP/voshpde/pipeLine/segmentation_wavfiles/2017011202/094_2017011202.wav	2105.5521088435376	92854848	2126.0021088435374	93756693	093_2017011202	corporate sufficiently then they cannot do business in the european union i also share the view of sd that we should also legislation that carves entities that are not incorporated within the european union a second point that is important for us the thresholds	/media/hugo/Seagate Expansion Drive/ALICE_BACKUP/voshpde/wav_files/zipfiles/2017011202.wav
94	/media/hugo/Seagate Expansion Drive/ALICE_BACKUP/voshpde/pipeLine/segmentation_wavfiles/2017011202/095_2017011202.wav	2126.0021315192744	93756694	2142.2521315192744	94473319	094_2017011202	i think we have to be more ambitious with the thresholds otherwise you can just select three a four friends or brothers to circumvantal legislation and even dear just of stegles was very clear in our committee	/media/hugo/Seagate Expansion Drive/ALICE_BACKUP/voshpde/wav_files/zipfiles/2017011202.wav
