	wavfile	start_seconds	start_frames	end_seconds	end_frames	identifier	inferred_text_with_hotwords	inferred_text_without_hotwords	motherfile	dist
177	/media/hugo/Seagate Expansion Drive/ALICE_BACKUP/voshpde/pipeLine/segmentation_wavfiles/2018012501/178_2018012501.wav	4010.254013605442	176852202	4026.704013605442	177577647	177_2018012501	mr president good morning ladies and gentlemen honourable members of the european parliament it is a previdage for me to present you the main conclusions of the work of the network of the justice and home affairs agencies for two thousand and seventeen	mr president good morning ladies and gentlemen honourable members of the european parliament it is a previdage for me to present you the main conclusions of the work of the network of the justice and home affairs agencies for two thousand and seventeen	/media/hugo/Seagate Expansion Drive/ALICE_BACKUP/voshpde/wav_files/zipfiles/2018012501.wav	0
178	/media/hugo/Seagate Expansion Drive/ALICE_BACKUP/voshpde/pipeLine/segmentation_wavfiles/2018012501/179_2018012501.wav	4026.704036281179	177577648	4050.054036281179	178607383	178_2018012501	i used to say and i say i am proud to say that first it was a privilege to chair the network last year for the emcdda it is also important to underline the fact that the network exist because of the needs for pragmatic cooperation and therefore it is the function that creates the organ and not the opposite	i used to say and i say i am proud to say that first it was a privilege to chair the network last year for the mcdda it is also important to underline the fact that the network exist because of the needs for pragmatic cooperation and therefore it is the function that creates the organ and not the opposite	/media/hugo/Seagate Expansion Drive/ALICE_BACKUP/voshpde/wav_files/zipfiles/2018012501.wav	1
179	/media/hugo/Seagate Expansion Drive/ALICE_BACKUP/voshpde/pipeLine/segmentation_wavfiles/2018012501/180_2018012501.wav	4050.054058956916	178607384	4066.704058956916	179341649	179_2018012501	an in our case we have been extremely active and the role of the chairmanship of the network is to foster cooperation but also to propose som some transversal topics one of them will introduce to you briefly in the few minutes	an in our case we have been extremely active and the role of the chairmanship of the network is to foster cooperation but also to propose som some transversal topics one of them will introduce to you briefly in the few minutes	/media/hugo/Seagate Expansion Drive/ALICE_BACKUP/voshpde/wav_files/zipfiles/2018012501.wav	0
180	/media/hugo/Seagate Expansion Drive/ALICE_BACKUP/voshpde/pipeLine/segmentation_wavfiles/2018012501/181_2018012501.wav	4066.704081632653	179341650	4091.754081632653	180446355	180_2018012501	so the first thing i would like to come vey to you as a message from the directors of the justice and home affairs agencies is that we know and we really appreciate that this committee in particular is keeping always ni night to strike a balance between the available resources and constantly increasing expectations to the agencies	so the first thing i would like to come vey to you as a message from the directors of the justice and home affairs agencies is that we know and we really appreciate that this committee in particular is keeping always and i night to strike a balance between the available resources and constantly increasing expectations to the agencies	/media/hugo/Seagate Expansion Drive/ALICE_BACKUP/voshpde/wav_files/zipfiles/2018012501.wav	3
181	/media/hugo/Seagate Expansion Drive/ALICE_BACKUP/voshpde/pipeLine/segmentation_wavfiles/2018012501/182_2018012501.wav	4091.75410430839	180446356	4119.60410430839	181674541	181_2018012501	and we trust that the importance of all rules will be duly taken into account in the preparation of the next multiannual financial framework that will be extremely important for the eu in the the post brexic situation but that we will be even more important in the area of justice and home affairs given the pressure on the eu for some of the specific topics i am sharing with doing the few minutes	and we trust that the importance of all rules will be duly taken into account in the preparation of the next multiannual financial framework that will be extremely important for the eu in the the post brexic situation but that we will be even more important in the area of justice and home affairs given the pressure on the eu for some of the specific topics i am sharing with doing the few minutes	/media/hugo/Seagate Expansion Drive/ALICE_BACKUP/voshpde/wav_files/zipfiles/2018012501.wav	0
182	/media/hugo/Seagate Expansion Drive/ALICE_BACKUP/voshpde/pipeLine/segmentation_wavfiles/2018012501/183_2018012501.wav	4119.604126984127	181674542	4141.554126984127	182642537	182_2018012501	the the second thing i would like to inform you is that of course one of the key issues and challenges for all the agencies together with the european commission is to strengthen the interoperability and the exchange of data of course within the limits of the mandate of each agencies but also taking into account	the the second thing i would like to inform you is that of course one of the key issues and challenges for all the agencies together with the european commission is to strengthen the interoperability and the exchange of data of course within the limits of the mandate of each agencies but also taking into account	/media/hugo/Seagate Expansion Drive/ALICE_BACKUP/voshpde/wav_files/zipfiles/2018012501.wav	0
183	/media/hugo/Seagate Expansion Drive/ALICE_BACKUP/voshpde/pipeLine/segmentation_wavfiles/2018012501/184_2018012501.wav	4141.554149659864	182642538	4159.104149659864	183416493	183_2018012501	the entry into force of the new legislation on the protection of personal data however it is clear that there there is still work in front of us we made some important technical achievements last year together with de other agencies	the entry into force of the new legislation on the protection of personal data however it is clear that there there is still work in front of us we made some important technical achievements last year together with the other agencies	/media/hugo/Seagate Expansion Drive/ALICE_BACKUP/voshpde/wav_files/zipfiles/2018012501.wav	2
184	/media/hugo/Seagate Expansion Drive/ALICE_BACKUP/voshpde/pipeLine/segmentation_wavfiles/2018012501/185_2018012501.wav	4159.104172335601	183416494	4185.954172335601	184600579	184_2018012501	the third point that is more transversal nature is that in order to address the new developments in migration but also in security areas and the links between the internal and external threats the international cooperation with non eu country sven is even becoming more important than before and the agencies have organised for the first time meeting	the third point that is more transversal nature is that in order to address the new developments in migration but also in security areas and the links between the internal and external threats the international cooperation with non eu country is even is even becoming more important than before and the agencies have organised for the first time meeting	/media/hugo/Seagate Expansion Drive/ALICE_BACKUP/voshpde/wav_files/zipfiles/2018012501.wav	3
185	/media/hugo/Seagate Expansion Drive/ALICE_BACKUP/voshpde/pipeLine/segmentation_wavfiles/2018012501/186_2018012501.wav	4185.954195011338	184600580	4202.404195011338	185326025	185_2018012501	of their respective responsible for international cooperation to see an identified the areas where there could be an opportunity for more close cooperation and contribution from the different agency so this was for the three main comments us	of their respective responsible for international cooperation to see an identified the areas where there could be an opportunity for more close cooperation and contribution from the different agencies so this was for the three main comments	/media/hugo/Seagate Expansion Drive/ALICE_BACKUP/voshpde/wav_files/zipfiles/2018012501.wav	6
186	/media/hugo/Seagate Expansion Drive/ALICE_BACKUP/voshpde/pipeLine/segmentation_wavfiles/2018012501/187_2018012501.wav	4202.404217687074	185326026	4231.854217687075	186624771	186_2018012501	our mean messages and thn a few few more fresh information about transversal operational issues for the justice and home affairs agency and then a few few mr fresh information about transversal operational issues for the justice and home affairs agencies the first us to do with the use of cyberspace for criminal purpose and the other of course is migration and health	our mean messages and thn a few few more fresh information about transversal operational issues for the justice and home affairs agency and then a few few mr fresh information about transversal operational issues for the justice and home affairs agencies the first as to do with the use of cyberspace for criminal purpose and the other of course is migration and health	/media/hugo/Seagate Expansion Drive/ALICE_BACKUP/voshpde/wav_files/zipfiles/2018012501.wav	1
187	/media/hugo/Seagate Expansion Drive/ALICE_BACKUP/voshpde/pipeLine/segmentation_wavfiles/2018012501/188_2018012501.wav	4231.854240362812	186624772	4249.604240362812	187407547	187_2018012501	so for as far as the internet and cyber the legislative framework to digital age i give you an example when agencies eu agencies and national agencies are fighting against cybercrime which is by nature transnational it is extremely difficult	so for as far as the internet and cyber the legislative framework to digital age i give you an example when agencies eu agencies and national agencies are fighting against cybercrime which is by nature transnational it is extremely difficult	/media/hugo/Seagate Expansion Drive/ALICE_BACKUP/voshpde/wav_files/zipfiles/2018012501.wav	0
188	/media/hugo/Seagate Expansion Drive/ALICE_BACKUP/voshpde/pipeLine/segmentation_wavfiles/2018012501/189_2018012501.wav	4249.604263038549	187407548	4269.654263038548	188291753	188_2018012501	to be able to identify which will be the jurisdiction there have been some progresses the agencies are are ready to offer their their technical expertise to the legislator to ep identify some of those gaps and while trying to assess out to address them	to be able to identify which will be the jurisdiction there have been some progresses the agencies are are ready to offer their their technical expertise to the legislator to help identify some of those gaps and while trying to assess out to address them	/media/hugo/Seagate Expansion Drive/ALICE_BACKUP/voshpde/wav_files/zipfiles/2018012501.wav	2
189	/media/hugo/Seagate Expansion Drive/ALICE_BACKUP/voshpde/pipeLine/segmentation_wavfiles/2018012501/190_2018012501.wav	4269.654285714286	188291754	4298.904285714286	189581679	189_2018012501	having say that it is clear that we need new tools to address cyber need to be equipped with the necessary tools there have been important investment in the member states in the recent years but certain leeds and effort that we need to continue the importance of enhancing a public partnership public private partnership through reinforce dialogue is one of the ways or the paths the meeting technical meeting with the industry to the oder agencies eu	having say that it is clear that we need new tools to address cyber need to be equipped with the necessary tools there have been important investment in the member states in the recent years but certain leeds and effort that we need to continue the importance of enhancing a public partnership public private partnership through reinforce dialogue is one of the ways or the paths the meeting technical meeting with the industry to the other agencies	/media/hugo/Seagate Expansion Drive/ALICE_BACKUP/voshpde/wav_files/zipfiles/2018012501.wav	5
190	/media/hugo/Seagate Expansion Drive/ALICE_BACKUP/voshpde/pipeLine/segmentation_wavfiles/2018012501/191_2018012501.wav	4298.904308390022	189581680	4328.654308390022	190893655	190_2018012501	the issue of new specialised and multidisciplinary training was raised because we have we have increased cremendously the number of training activities and the cor rage of low enforcement of as very important challenge which is that we need even more people trained and again not only train in terms of tools and medologies but also having the access to the equipment that would be needed for them to do their work	the issue of new specialised and multidisciplinary training was raised because we have we have increased cremendously the number of training activities and the co rage of low enforcement of as very important challenge which is that we need even more people trained and again not only train in terms of tools and medologies but also having the access to the equipment that would be needed for them to do their work	/media/hugo/Seagate Expansion Drive/ALICE_BACKUP/voshpde/wav_files/zipfiles/2018012501.wav	1
191	/media/hugo/Seagate Expansion Drive/ALICE_BACKUP/voshpde/pipeLine/segmentation_wavfiles/2018012501/192_2018012501.wav	4328.65433106576	190893656	4343.90433106576	191566181	191_2018012501	an for got one which is the last one which is also the fact that we need to continue to rin last year together with europol its a joint report on darknate which is for the first time presenting a comprehensive analysis	an for got one which is the last one which is also the fact that we need to continue to rin last year together with europol its a joint report on darknate which is for the first time presenting a comprehensive analysis	/media/hugo/Seagate Expansion Drive/ALICE_BACKUP/voshpde/wav_files/zipfiles/2018012501.wav	0
192	/media/hugo/Seagate Expansion Drive/ALICE_BACKUP/voshpde/pipeLine/segmentation_wavfiles/2018012501/193_2018012501.wav	4343.904353741496	191566182	4365.354353741496	192512127	192_2018012501	are of the life cycle of of one of the most important dagnet that were that was shot down de th co first is frontex that has been taking the initiative to build a toolbox on migration in order to allow us to identify the gaps	are of the life cycle of of one of the most important dagnet that were that was shot down the th coferst is frontex that has been taking the initiative to build a toolbox on migration in order to allow us to identify the gaps	/media/hugo/Seagate Expansion Drive/ALICE_BACKUP/voshpde/wav_files/zipfiles/2018012501.wav	4
193	/media/hugo/Seagate Expansion Drive/ALICE_BACKUP/voshpde/pipeLine/segmentation_wavfiles/2018012501/194_2018012501.wav	4365.354376417234	192512128	4392.604376417234	193713853	193_2018012501	for information and for interventions one new topic that was brought by the emcdda in its role of chair of the network a topic of growing importance for some of the camps or some of the places of course we do it all of us and de mcd is the one was the least involved obviously as we are not acting on the field with the migrants still for instance the there have been some some issues related to drackuse	for information and for interventions one new topic that was brought by the emcdda in its role of chair of the network a topic of growing importance for some of the camps or some of the places of course we do it all of us and mcd is the one was the least involved obviously as we are not acting on the field with the migrants still for instance the there have been some some issues related to drackuse	/media/hugo/Seagate Expansion Drive/ALICE_BACKUP/voshpde/wav_files/zipfiles/2018012501.wav	3
194	/media/hugo/Seagate Expansion Drive/ALICE_BACKUP/voshpde/pipeLine/segmentation_wavfiles/2018012501/195_2018012501.wav	4392.60439909297	193713854	4417.554399092971	194814149	194_2018012501	but before all what is importers from the discussions with the agencies was the fact that this duty of care and this responsibility is also to be extended to the staff working for the agencies i know have to conclude a very soon so awigemto the last point which is the inventory of standards and guidelines on of infectious diseases for screening for	but before all what is importers from the discussions with the agencies was the fact that this duty of care and this responsibility is also to be extended to the staff working for the agencies i know have to conclude a very soon so awigemto the last point which is the inventory of standards and guidelines on of infectious diseases for screening for	/media/hugo/Seagate Expansion Drive/ALICE_BACKUP/voshpde/wav_files/zipfiles/2018012501.wav	0
195	/media/hugo/Seagate Expansion Drive/ALICE_BACKUP/voshpde/pipeLine/segmentation_wavfiles/2018012501/196_2018012501.wav	4417.5544217687075	194814150	4445.8044217687075	196059975	195_2018012501	a treatment and for other issues those and there are also internal guidelines and those are not necessarily available in the outsports or in the camps when the training is given to the staff deployed by the agency so that is one of the areas where we are going to ip des the picture with all the group of the directors i would like also to highlight that we at general director of the go and the general director of dg justice	a treatment and for other issues those and there are also internal guidelines and those are not necessarily available in the outsports or in the camps when the training is given to the staff deployed by the agencies so that is one of the areas where we are going to igpdisarthe picture with all the group of the directors i would like also to highlight that we at general director of the go and the general director of dg justice	/media/hugo/Seagate Expansion Drive/ALICE_BACKUP/voshpde/wav_files/zipfiles/2018012501.wav	8
196	/media/hugo/Seagate Expansion Drive/ALICE_BACKUP/voshpde/pipeLine/segmentation_wavfiles/2018012501/197_2018012501.wav	4445.804444444444	196059976	4474.054444444444	197305801	196_2018012501	and that was extremely important and useful and i think that the message i can convey to you is we are really a te rows that the network are street maturity and that it is focused essentially on the concrete task the agencies have to do to fulfil their mandate and better serve people who are leaving in europe and i am also very proud and happy to pass	and that was extremely important and useful and i think that the message i can convey to you is we are really a te rows that the network are street maturity and that it is focused essentially on the concrete task the agencies have to do to fulfil their mandate and better serve people who are leaving in europe and i am also very proud and happy to pass	/media/hugo/Seagate Expansion Drive/ALICE_BACKUP/voshpde/wav_files/zipfiles/2018012501.wav	0
197	/media/hugo/Seagate Expansion Drive/ALICE_BACKUP/voshpde/pipeLine/segmentation_wavfiles/2018012501/198_2018012501.wav	4474.0544671201815	197305802	4498.904467120182	198401687	197_2018012501	the responsibility and the responsibility the chair of the network to viginia lang back with the director of the european institute for gender equality i have no doubt that she us all the skills and the energy and the ids to push forward the network and also to keep in mind such an important issue as the one that is the responsibility of or agency thank you very much	the responsibility and the responsibility the chair of the network to viginia lang back with the director of the european institute for gender equality i have no doubt that she as all the skills and the energy and the ids to push forward the network and also to keep in mind such an important issue as the one that is the responsibility of or agency thank you very much	/media/hugo/Seagate Expansion Drive/ALICE_BACKUP/voshpde/wav_files/zipfiles/2018012501.wav	1
198	/media/hugo/Seagate Expansion Drive/ALICE_BACKUP/voshpde/pipeLine/segmentation_wavfiles/2018012501/199_2018012501.wav	4498.904489795918	198401688	4521.754489795919	199409373	198_2018012501	thank you very much mr us thank you for your presentation the time frame you cat and thank you for the work you have done as during the last year in this network now i give the floor of mrs lang back please the floor is yours try to keep the seven minute thank you	thank you very much mr use thank you for your presentation the time frame you cat and thank you for the work you have done as during the last year in this network now i give the floor of mrs lang back please the floor is yours try to keep the seven minute thank you	/media/hugo/Seagate Expansion Drive/ALICE_BACKUP/voshpde/wav_files/zipfiles/2018012501.wav	1
199	/media/hugo/Seagate Expansion Drive/ALICE_BACKUP/voshpde/pipeLine/segmentation_wavfiles/2018012501/200_2018012501.wav	4521.754512471655	199409374	4551.404512471655	200716939	199_2018012501	us ask you to think about the last picture alex was showing and in relation to gender equality we were discussing ali among that last meeting than that when you see that if we take from the agency nine agency directive for the moment time the only women so you see how much our work is needed may be to discuss at libe committee as well eu ali europe yes soon soon we will be too so	just ask you to think about the last picture alex was showing and in relation to gender equality we were discussing also among that last meeting than that when you see that if we take from the agency nine agencies directives for the moment time the only women so you see how much our work is needed may be to discuss at libe committee as well a europe yes soon soon we will be too so	/media/hugo/Seagate Expansion Drive/ALICE_BACKUP/voshpde/wav_files/zipfiles/2018012501.wav	13
200	/media/hugo/Seagate Expansion Drive/ALICE_BACKUP/voshpde/pipeLine/segmentation_wavfiles/2018012501/201_2018012501.wav	4551.404535147392	200716940	4571.154535147392	201587915	200_2018012501	i will tell you a bit in a moment of what new things we will bring to the work of the nine eu agencsgand but as you might know we are the only agency after those nine which is not under libya which is under the home committee and that is why it also shows now us sharing this	i will tell you a bit in a moment of what new things we will bring to the work of the nine eu agencsgand but as you might know we are the only agency after those nine which is not under libya which is under the fume committee and that is why it also shows now as sharing this	/media/hugo/Seagate Expansion Drive/ALICE_BACKUP/voshpde/wav_files/zipfiles/2018012501.wav	3
201	/media/hugo/Seagate Expansion Drive/ALICE_BACKUP/voshpde/pipeLine/segmentation_wavfiles/2018012501/202_2018012501.wav	4571.154557823129	201587916	4590.8045578231295	202454481	201_2018012501	network all so brings new synergies even if you have the meetings with the home committee as well but now the home committee will be also a part at least during our sharing of the g agencies meeting now alex he was telling also about what the agencies have been doing and of course the main thing is that we try to get	network all so brings new synergies even if you have the meetings with the form committee as well but now the fame committee will be also a part at least during our sharing of the g agencies meeting now a lex he was telling also about what the agencies have been doing and of course the main thing is that we try to get	/media/hugo/Seagate Expansion Drive/ALICE_BACKUP/voshpde/wav_files/zipfiles/2018012501.wav	6
202	/media/hugo/Seagate Expansion Drive/ALICE_BACKUP/voshpde/pipeLine/segmentation_wavfiles/2018012501/203_2018012501.wav	4590.804580498866	202454482	4616.854580498866	203603287	202_2018012501	to increase the added value not only for parliament not only for the commission but very much for the users and as you know the specific for the citizens especially and the specific focus of the g agencies is security and justice where of course the majority of the agencies are the ones who really work on migration to work on security we	to increase the added value not only for parliament not only for the commission but very much for the users and as you know the specific for the citizens especially and the specific focus of the g agencies is security and justice where of course the majority of the agencies are the ones who really work on migration to work on security we	/media/hugo/Seagate Expansion Drive/ALICE_BACKUP/voshpde/wav_files/zipfiles/2018012501.wav	0
203	/media/hugo/Seagate Expansion Drive/ALICE_BACKUP/voshpde/pipeLine/segmentation_wavfiles/2018012501/204_2018012501.wav	4616.854603174603	203603288	4632.104603174603	204275813	203_2018012501	mostly focus our institute mostly focuses on supporting the european union work inside so of course we are not we will not be able to bring let say like support the other agencies so much on migration or security but	mostly focus our institute mostly focuses on supporting the european union work inside so of course we are not we will not be able to bring let say like support the other agencies so much on migration or security but	/media/hugo/Seagate Expansion Drive/ALICE_BACKUP/voshpde/wav_files/zipfiles/2018012501.wav	0
204	/media/hugo/Seagate Expansion Drive/ALICE_BACKUP/voshpde/pipeLine/segmentation_wavfiles/2018012501/205_2018012501.wav	4632.10462585034	204275814	4648.454625850341	204996849	204_2018012501	we will first of all we will continue the work which already started and it was mentioned by also the agency like alex before the hear before we will also work because there are because of our very small size we are the smallest	we will first of all we will continue the work which already started and it was mentioned by also the agency like alex before the hear before we will also work because there are because of our very small size we are the smallest	/media/hugo/Seagate Expansion Drive/ALICE_BACKUP/voshpde/wav_files/zipfiles/2018012501.wav	0
