	wavfile	start_seconds	start_frames	end_seconds	end_frames	identifier	inferred_text_with_hotwords	inferred_text_without_hotwords	motherfile	dist
0	/media/hugo/Seagate Expansion Drive/ALICE_BACKUP/voshpde/pipeLine/segmentation_wavfiles/2018012501/001_2018012501.wav	0.0	0	17.75	782775	000_2018012501	good morning everybody good morning de are colleagues as we have a very type schedule and	m good morning everybody good morning bear colleagues as we have a very type schedule and	/media/hugo/Seagate Expansion Drive/ALICE_BACKUP/voshpde/wav_files/zipfiles/2018012501.wav	5
1	/media/hugo/Seagate Expansion Drive/ALICE_BACKUP/voshpde/pipeLine/segmentation_wavfiles/2018012501/002_2018012501.wav	17.75002267573696	782776	44.500022675736965	1962451	001_2018012501	a very short time frame for an interesting first point on the agenda i would like to start immediately as as i see all those members who are have to be here are here for the first pal that the agenda let me announce the linguistic profile of our meeting today unfortunately we do not have interpretation in danish maltese croatian and gal ing	a very short time frame for an interesting first point on the agenda i would like to start immediately as as i see all those members who are have to be here are here for the first pil that the agenda let me announce the linguistic profile of our meeting today unfortunately we do not have interpretation in danish multis croatian and galling	/media/hugo/Seagate Expansion Drive/ALICE_BACKUP/voshpde/wav_files/zipfiles/2018012501.wav	5
2	/media/hugo/Seagate Expansion Drive/ALICE_BACKUP/voshpde/pipeLine/segmentation_wavfiles/2018012501/003_2018012501.wav	44.50004535147392	1962452	62.950045351473925	2776097	002_2018012501	we have to endorse the coordinator recommendation on nomination of rapporteurs mr cor efdd has been appointed rapporteur for the draft report on automatic data exchange with regard to vehicle registration data in portugal	we have to endorse the coordinators recommendation on nomination of rapporteurs mr korahe efdd has been appointed rapporteur for the draft report on automatic data exchange with regard to vehicle registration data in portugal	/media/hugo/Seagate Expansion Drive/ALICE_BACKUP/voshpde/wav_files/zipfiles/2018012501.wav	5
3	/media/hugo/Seagate Expansion Drive/ALICE_BACKUP/voshpde/pipeLine/segmentation_wavfiles/2018012501/004_2018012501.wav	62.95006802721088	2776098	79.40006802721088	3501543	003_2018012501	does the committee endorsed the coordinator recommendation i do not see any objections i take it yes than un delegated and implementing acts i have new on three dossiers on delegated regulation of thirteen december two thousand and seventeen	does the committee endorsed the coordinators recommendation i do not see any objections i take it yes than on delegated and implementing acts i have new on three dossiers on delegated regulation of thirteen december two thousand and seventeen	/media/hugo/Seagate Expansion Drive/ALICE_BACKUP/voshpde/wav_files/zipfiles/2018012501.wav	2
4	/media/hugo/Seagate Expansion Drive/ALICE_BACKUP/voshpde/pipeLine/segmentation_wavfiles/2018012501/005_2018012501.wav	79.40009070294785	3501544	99.95009070294785	4407799	004_2018012501	as regards adding sri lanka trintad and tobago en tunisia to the table in point one of the annex after having extended the scrutiny deadline and having received a request to object by three members of econ and libe a joint econ libe coordinators written procedure was laundered on twelve january	as regards adding srulankartrintadandtobegoen tunisia to the table in point one of the annex after having extended the scrutiny deadline and having received a request to object by three members of econ and libe a joint econ libe coordinators written procedure was laundered on twelve january	/media/hugo/Seagate Expansion Drive/ALICE_BACKUP/voshpde/wav_files/zipfiles/2018012501.wav	7
5	/media/hugo/Seagate Expansion Drive/ALICE_BACKUP/voshpde/pipeLine/segmentation_wavfiles/2018012501/006_2018012501.wav	99.9501133786848	4407800	120.0001133786848	5292005	005_2018012501	a majority to object us found among libe and econ coordinators and they agreed to working english only the deadline to amend was set on twenty january by five clock pm a joint econ libe committee meeting will take place on ten twenty nine january	a majority to object was found among libe and econ coordinators and they agreed to working english only the deadline to amend was set on twenty january by five clock pm a joint econ libe committee meeting will take place on ten twenty nine january	/media/hugo/Seagate Expansion Drive/ALICE_BACKUP/voshpde/wav_files/zipfiles/2018012501.wav	2
6	/media/hugo/Seagate Expansion Drive/ALICE_BACKUP/voshpde/pipeLine/segmentation_wavfiles/2018012501/007_2018012501.wav	120.00013605442177	5292006	142.65013605442178	6290871	006_2018012501	from six thirty two eight ec pm a possible vote on the motion to object would also take place that they as to ensure a plenary vote in february the first first partsession on sixteen january the european parliament received the commission implementing regulation	from six thirty two eight pm a possible vote on the motion to object would also take place that they as to ensure a plenary vote in february the first first partsession on sixteen january the european parliament received the commission implementing regulation	/media/hugo/Seagate Expansion Drive/ALICE_BACKUP/voshpde/wav_files/zipfiles/2018012501.wav	3
7	/media/hugo/Seagate Expansion Drive/ALICE_BACKUP/voshpde/pipeLine/segmentation_wavfiles/2018012501/008_2018012501.wav	142.65015873015872	6290872	165.70015873015873	7307377	007_2018012501	law laying down rules for application of directive two thousand and sixteen eleven forty eight as regards further specification of the elements to be taken into account by digital service providers for managing the risk posed to the security of network and information systems the basic act concerning measures for a high common level security of network and information system across the union	law laying down rules for application of directive two thousand and sixteen eleven forty eight as regards further specification of the elements to be taken into account by digital service providers for managing the risk posed to the security of network and information systems the basic act concerning measures for a high common level security of network and information system across the union	/media/hugo/Seagate Expansion Drive/ALICE_BACKUP/voshpde/wav_files/zipfiles/2018012501.wav	0
8	/media/hugo/Seagate Expansion Drive/ALICE_BACKUP/voshpde/pipeLine/segmentation_wavfiles/2018012501/009_2018012501.wav	165.7001814058957	7307378	191.85018140589568	8460593	008_2018012501	and then again one announcement i have to make on sixteen january the european parliament received the commission implementing decision establishing the list of supporting documents to be submitted by applicants for short stake visas in australia bangladishatopean south africa thailand and zambia so the reception of these implementing ets was communicated all libe members were the libya commitiliginnewletr	and then again one announcement i have to make on sixteen january the european parliament received the commission implementing decision establishing the list of supporting documents to be submitted by applicants for short stake visas in australia bangladishatopean south africa tiland and zembia so the reception of these implementing ets was communicated all libe members were the libya commitiliginnewletr	/media/hugo/Seagate Expansion Drive/ALICE_BACKUP/voshpde/wav_files/zipfiles/2018012501.wav	3
9	/media/hugo/Seagate Expansion Drive/ALICE_BACKUP/voshpde/pipeLine/segmentation_wavfiles/2018012501/010_2018012501.wav	191.85020408163265	8460594	221.60020408163265	9772569	009_2018012501	and what as it is important we have an electronic vote today at eleven a clock and please make sure that your card you will have your card with you and now if there are no objections to the minutes they are all approved the minutes of six and a six november and a december and i jump immediately to the first point on our agenda we will hear the presentation of the draft delegation report	and what as it is important we have an electronic vote today at eleven a clock and please make sure that your card you will have your card with you and now if there are no objections to the minutes they are all approved the minutes of six and a six november and a december and i jump immediately to the first point on our agenda we will hear the presentation of the draft delegation report	/media/hugo/Seagate Expansion Drive/ALICE_BACKUP/voshpde/wav_files/zipfiles/2018012501.wav	0
10	/media/hugo/Seagate Expansion Drive/ALICE_BACKUP/voshpde/pipeLine/segmentation_wavfiles/2018012501/011_2018012501.wav	221.60022675736963	9772570	246.95022675736962	10890505	010_2018012501	of the libe anna athop delegation to malta which has taken place on thirteen november first december two thousand and seventeen allow me to welcome also members of the former pena committee who are present in the exchange of views i also welcome the malta minister for justice docterovanbonichi which is requested to take part in this debate and i have just learned that also eu	of the libeurpanna athop delegation to malta which has taken place on thirteen november first december two thousand and seventeen allow me to welcome also members of the former pena committee who are present in the exchange of views i also welcome the molter minister for jusicicedocterovanbonichi which is requested to take part in this debate and i have just learned that also the	/media/hugo/Seagate Expansion Drive/ALICE_BACKUP/voshpde/wav_files/zipfiles/2018012501.wav	12
11	/media/hugo/Seagate Expansion Drive/ALICE_BACKUP/voshpde/pipeLine/segmentation_wavfiles/2018012501/012_2018012501.wav	246.95024943310656	10890506	273.30024943310656	12052541	011_2018012501	the sense of the la daphne kron caruana are among us so i welcome most so them on our libe meeting and i would like to express my deepest condolences to you now let us go to to the work as you know	the sense of the la dapnekranakauana are among us so i welcome most so them on our riba meeting and i would like to express my deepest condolences to you now let us go to to the work as you know	/media/hugo/Seagate Expansion Drive/ALICE_BACKUP/voshpde/wav_files/zipfiles/2018012501.wav	8
12	/media/hugo/Seagate Expansion Drive/ALICE_BACKUP/voshpde/pipeLine/segmentation_wavfiles/2018012501/013_2018012501.wav	273.30027210884356	12052542	297.05027210884356	13099917	012_2018012501	this mission was organised as a follow up to a decision of the coordinators and the request of the conference of presidents the conference of presidents decided that that earn eight member atoc delegation composed one member from each political group and preferably drawn from the committee of civil liberties and the committee of inquiry into money laundering tax avoidance and tax evasion be sent to malta	this mission was organised as a follow up to a decision of the coordinators and the request of the conference of presidents the conference of presidents decided that that earn eight member atoc delegation composed one member from each political group and preferably drawn from the committee of civil liberties and the committee of inquiry into money laundering tax avoidance and tax evasion be sent to malta	/media/hugo/Seagate Expansion Drive/ALICE_BACKUP/voshpde/wav_files/zipfiles/2018012501.wav	0
13	/media/hugo/Seagate Expansion Drive/ALICE_BACKUP/voshpde/pipeLine/segmentation_wavfiles/2018012501/014_2018012501.wav	297.0502947845805	13099918	324.2002947845805	14297233	013_2018012501	the i will give immediately the floor to mrs ana gomes as chair of the delegation to present the main findings of this mission report as we have a very short time frame i will really ask mrs gomes to try to keep ten minutes and than all other colleagues the coordinators and other members two minutes please i will be very strict with the time in order to everybody could speak this morning mrs gomes please	the i will give immediately the floor to mrs anagomas as chair of the delegation to present the main findings of this mission report as we have a very short time frame i will really ask mrs gomes to try to keep ten minutes and than all other colleagues the coordinators and other members two minutes please i will be very strict with the time in order to everybody could speak this morning mrs gomes please	/media/hugo/Seagate Expansion Drive/ALICE_BACKUP/voshpde/wav_files/zipfiles/2018012501.wav	2
14	/media/hugo/Seagate Expansion Drive/ALICE_BACKUP/voshpde/pipeLine/segmentation_wavfiles/2018012501/015_2018012501.wav	324.2003174603175	14297234	353.55031746031744	15591569	014_2018012501	madam person ana first of all let me also welcome the minister here that is exactly what we want to continue engaged with the authorities and to stakeholders in malta to indeed clarify many of the matters that need to be clarified as anyone reading the report that we made of this mission can see the report is fairly de descriptive	madam persoentandfirst of all let me also welcome the minister here that is exactly what we want to continue engaged with the authorities and to stakeholders in malta to indeed clarify many of the matters that need to be clarified as anyone reading the report that we made of this mission can see the report is fairly de descriptive	/media/hugo/Seagate Expansion Drive/ALICE_BACKUP/voshpde/wav_files/zipfiles/2018012501.wav	4
15	/media/hugo/Seagate Expansion Drive/ALICE_BACKUP/voshpde/pipeLine/segmentation_wavfiles/2018012501/016_2018012501.wav	353.55034013605444	15591570	381.80034013605444	16837395	015_2018012501	of what we went through and let me also welcome of course the three sons of late ms daphne caruana galizia and i share as all of us your condolences addressed to the family the report as i said its freely descriptive we know of the contacts what what we made what we were told in malta	of what we went through and let me also welcome of course the three sons of late ms daphne caruana galizia and i share as all of us your condolences addressed to the family the report as i said its freely descriptive we know of the contacts what what we made what we were told in malta	/media/hugo/Seagate Expansion Drive/ALICE_BACKUP/voshpde/wav_files/zipfiles/2018012501.wav	0
16	/media/hugo/Seagate Expansion Drive/ALICE_BACKUP/voshpde/pipeLine/segmentation_wavfiles/2018012501/017_2018012501.wav	381.8003628117914	16837396	407.8503628117914	17986201	016_2018012501	of course members prepare themselves got information ask questions and got answers and what is also important the report is the second part where we take our main findings so i will fare you from reading them now and we make recommendations recommendations to the authorities of mate recommendations to the european authorities because of course	of course members prepare themselves got information ask questions and got answers and what is also important the report is the second part where we take our main findings so i will fare you from reading them now and we make recommendations recommendations to the authorities of mate recommendations to the european authorities because of course	/media/hugo/Seagate Expansion Drive/ALICE_BACKUP/voshpde/wav_files/zipfiles/2018012501.wav	0
17	/media/hugo/Seagate Expansion Drive/ALICE_BACKUP/voshpde/pipeLine/segmentation_wavfiles/2018012501/018_2018012501.wav	407.85038548752834	17986202	432.70038548752837	19082087	017_2018012501	what we are dealing with in malta is is not just concerning out concerns us all it is about the european union as a whole ni affect us all in the sense that it has implications for indeed for instance mon antimoney laundering or money laundering corruption and so and so it is a matter of general concern and even i would say of our own security	what we are dealing with in malta is is not just concerning out concerns as all it is about the european union as a whole it affect us all in the sense that it has implications for indeed for instance antimoney laundering or money laundering corruption and so and so it is a matter of general concern and even i would say of our own security	/media/hugo/Seagate Expansion Drive/ALICE_BACKUP/voshpde/wav_files/zipfiles/2018012501.wav	7
18	/media/hugo/Seagate Expansion Drive/ALICE_BACKUP/voshpde/pipeLine/segmentation_wavfiles/2018012501/019_2018012501.wav	432.7004081632653	19082088	462.3504081632653	20389653	018_2018012501	i think my statement now at the stage is probably more useful if i state the facts the facts that came out of these contacts we had in malta first of all that there are two people that were exposed in the panama papers and that were subject that they were object of own maltese fi reports peps so politically exposed persons members of government	i think my statement now at the stage is probably more useful if i state the facts the facts that came out of these contacts we had in malta first of all that there are two people that were exposed in the panama papers and that were subject that they were object of own malts fi reports peps so politically exposed persons members of government	/media/hugo/Seagate Expansion Drive/ALICE_BACKUP/voshpde/wav_files/zipfiles/2018012501.wav	2
19	/media/hugo/Seagate Expansion Drive/ALICE_BACKUP/voshpde/pipeLine/segmentation_wavfiles/2018012501/020_2018012501.wav	462.3504308390023	20389654	483.50043083900226	21322369	019_2018012501	hu state in government one of them is a minister mr misi another one is the chief of cabinet of the prime minister mr scemberi that is a fact they are people seen as corrupt throughout malta there are fu reports that have been licked in to the public that document that and there was no	who state in government one of them is a minister mr misi another one is the chief of cabinet of the prime minister mr scemberithat is a fact they are people seen as corrupt throughout malta there are fu reports that have been licked in to the public that document that and there was no	/media/hugo/Seagate Expansion Drive/ALICE_BACKUP/voshpde/wav_files/zipfiles/2018012501.wav	3
20	/media/hugo/Seagate Expansion Drive/ALICE_BACKUP/voshpde/pipeLine/segmentation_wavfiles/2018012501/021_2018012501.wav	483.5004535147392	21322370	501.35045351473923	22109555	020_2018012501	action on that at list from the police the police and the aterne general did not act on these fi reports that some of them are public and there are nevertheless five ongoing judicial inquiries which i point out	action on that at list from the police the police and the aterne general did not act on these fi reports that some of them are public and there are nevertheless five ongoing judicial inquiries which i point out	/media/hugo/Seagate Expansion Drive/ALICE_BACKUP/voshpde/wav_files/zipfiles/2018012501.wav	0
21	/media/hugo/Seagate Expansion Drive/ALICE_BACKUP/voshpde/pipeLine/segmentation_wavfiles/2018012501/022_2018012501.wav	501.3504761904762	22109556	517.7004761904761	22830591	021_2018012501	if they conclude that there is elements will need to be follow at by some police action in these five judicial inquiries one has been blocked by the government exactly it was initiated by	if they conclude that there is elements will need to be follow at by some police action in these five judicial inquiries one has been blocked by the government exactly it was initiated by	/media/hugo/Seagate Expansion Drive/ALICE_BACKUP/voshpde/wav_files/zipfiles/2018012501.wav	0
22	/media/hugo/Seagate Expansion Drive/ALICE_BACKUP/voshpde/pipeLine/segmentation_wavfiles/2018012501/023_2018012501.wav	517.7004988662131	22830592	536.7504988662132	23670697	022_2018012501	the then leader of the opposition is been blocked by the government it is exactly on these politically exposed persons that were exposed by the panama papers and by the fi reports of course another very tragic fact is that	the then leader of the opposition is been blocked by the government it is exactly on these politically exposed persons that were exposed by the panama papers and by the fi reports of course another very tragic fact is that	/media/hugo/Seagate Expansion Drive/ALICE_BACKUP/voshpde/wav_files/zipfiles/2018012501.wav	0
23	/media/hugo/Seagate Expansion Drive/ALICE_BACKUP/voshpde/pipeLine/segmentation_wavfiles/2018012501/024_2018012501.wav	536.7505215419501	23670698	560.4005215419501	24713663	023_2018012501	ms daphne caruana galizia was assassinated and she was a main blogger journalists exposing corruption and in particular exposing some of these people that were also exposed by panama papers in the meantime two days after we left malta actually	ms daphne caruana galizia was assassinated and she was a main blogger journalists exposing corruption and in particular exposing some of these people that were also exposed by panama papers in the meantime two days after we left malta actually	/media/hugo/Seagate Expansion Drive/ALICE_BACKUP/voshpde/wav_files/zipfiles/2018012501.wav	0
24	/media/hugo/Seagate Expansion Drive/ALICE_BACKUP/voshpde/pipeLine/segmentation_wavfiles/2018012501/025_2018012501.wav	560.4005442176871	24713664	580.450544217687	25597869	024_2018012501	the the material latters or suspects of being the materialigies of a assassination were found they are un their arrests if nothing happens to them they will be brought to trial and i hope they will be able to clarify who order the murder because it is obvious that people from the criminal world	the the material latters or suspects of being the materialigies of a assassination were found they are un the arrests if nothing happens to them they will be brought to trial and i hope they will be able to clarify who order the murder because it is obvious that people from the criminal world	/media/hugo/Seagate Expansion Drive/ALICE_BACKUP/voshpde/wav_files/zipfiles/2018012501.wav	2
25	/media/hugo/Seagate Expansion Drive/ALICE_BACKUP/voshpde/pipeLine/segmentation_wavfiles/2018012501/026_2018012501.wav	580.450566893424	25597870	610.100566893424	26905435	025_2018012501	were behind this bombing the question is who order bombing and what was the purpose is disturbing that the family complaints that they have never been informed they were not inform namely that these material actors have been court and even certain aspects related to the natural interaction between the family and investigative	were behind this bombing the question is who order bombing and what was the purpose is disturbing that the family complaints that they have never been informed they were not inform namely that these material actors have been cot and even certain aspects related to the natural interaction between the family and investigative	/media/hugo/Seagate Expansion Drive/ALICE_BACKUP/voshpde/wav_files/zipfiles/2018012501.wav	2
26	/media/hugo/Seagate Expansion Drive/ALICE_BACKUP/voshpde/pipeLine/segmentation_wavfiles/2018012501/027_2018012501.wav	610.100589569161	26905436	639.850589569161	28217411	026_2018012501	authorities has not occurred another fact is that a former maltese commissioner mr john dalli that was forced to resign for very serious corruption bribery allegations despite the fact that it was the object of a very serious and detailed olaf investigation and also of own maltese fi report	authorities has not occurred another fact is that a former maltese commissioner mr john dalli that was forced to resign for very serious corruption bribery allegations despite the fact that it was the object of a very serious and detailed olaf investigation and also of own maltese fi report	/media/hugo/Seagate Expansion Drive/ALICE_BACKUP/voshpde/wav_files/zipfiles/2018012501.wav	0
27	/media/hugo/Seagate Expansion Drive/ALICE_BACKUP/voshpde/pipeLine/segmentation_wavfiles/2018012501/028_2018012501.wav	639.850612244898	28217412	659.400612244898	29079567	027_2018012501	was nothing happen to in was never charged and indeed eu was made an advisor to the prime minister and it is particularly important because often in malta we hear interpretations that there is a titfortat political dispute between the	i was nothing happen to in was never charged and indeed e was made an advisor to the prime minister and it is particularly important because often in malta we hear interpretations that there is a titfortat political dispute between the	/media/hugo/Seagate Expansion Drive/ALICE_BACKUP/voshpde/wav_files/zipfiles/2018012501.wav	3
28	/media/hugo/Seagate Expansion Drive/ALICE_BACKUP/voshpde/pipeLine/segmentation_wavfiles/2018012501/029_2018012501.wav	659.400634920635	29079568	680.2506349206349	29999053	028_2018012501	the two main parties but actually this person belong to the nationalist party and became an adviser to the prime minister of the other party so establishing why there was no action what the connection is really very important and this has never been done	the two main parties but actually this person belong to the nationalist party and became an adviser to the prime minister of the other party so establishing why there was no action what the connection is really very important and this has never been done	/media/hugo/Seagate Expansion Drive/ALICE_BACKUP/voshpde/wav_files/zipfiles/2018012501.wav	0
