	wavfile	start_seconds	start_frames	end_seconds	end_frames	identifier	inferred_text_with_hotwords	inferred_text_without_hotwords	motherfile	dist
326	/media/hugo/Seagate Expansion Drive/ALICE_BACKUP/voshpde/pipeLine/segmentation_wavfiles/20181015/327_20181015.wav	7374.7067916666665	353985926	7396.256791666667	355020326	326_20181015	eu in eu eu eu eu eu tom eu eu eu pa in osetonto	in a eeototeeooeeainouetonto	/media/hugo/Seagate Expansion Drive/ALICE_BACKUP/voshpde/wav_files/zipfiles/20181015.wav	27
327	/media/hugo/Seagate Expansion Drive/ALICE_BACKUP/voshpde/pipeLine/segmentation_wavfiles/20181015/328_20181015.wav	7396.2568125	355020327	7413.4068125	355843527	327_20181015	de eu pa eu eu eu	reforeiananoo	/media/hugo/Seagate Expansion Drive/ALICE_BACKUP/voshpde/wav_files/zipfiles/20181015.wav	15
328	/media/hugo/Seagate Expansion Drive/ALICE_BACKUP/voshpde/pipeLine/segmentation_wavfiles/20181015/329_20181015.wav	7413.406833333333	355843528	7441.856833333333	357209128	328_20181015	eu pa eu eva eu taetheooooooeeeeamoloe	i euroanoveltaitheoaeeamoloe	/media/hugo/Seagate Expansion Drive/ALICE_BACKUP/voshpde/wav_files/zipfiles/20181015.wav	21
329	/media/hugo/Seagate Expansion Drive/ALICE_BACKUP/voshpde/pipeLine/segmentation_wavfiles/20181015/330_20181015.wav	7441.856854166666	357209129	7469.806854166667	358550729	329_20181015	eu eu eu tom pa is eu beteyobetefoteleoeostorioe	of refeotepitisobeeyobetefoteleeoetoori	/media/hugo/Seagate Expansion Drive/ALICE_BACKUP/voshpde/wav_files/zipfiles/20181015.wav	22
330	/media/hugo/Seagate Expansion Drive/ALICE_BACKUP/voshpde/pipeLine/segmentation_wavfiles/20181015/331_20181015.wav	7469.806875	358550730	7499.056875	359954730	330_20181015	eu eu de eu fetritiinordeeeoetinteoeeisoeteoearoiotitee	i ofteafetritinordeeeoetinteoeeisoeteoearoiotitee	/media/hugo/Seagate Expansion Drive/ALICE_BACKUP/voshpde/wav_files/zipfiles/20181015.wav	11
331	/media/hugo/Seagate Expansion Drive/ALICE_BACKUP/voshpde/pipeLine/segmentation_wavfiles/20181015/332_20181015.wav	7499.056895833333	359954731	7524.706895833333	361185931	331_20181015	eu eu lo eu tinglivnmysmeepotofthisnooteoseritei	i loooraotinglivnmymeepotofthisnooteoserite	/media/hugo/Seagate Expansion Drive/ALICE_BACKUP/voshpde/wav_files/zipfiles/20181015.wav	12
332	/media/hugo/Seagate Expansion Drive/ALICE_BACKUP/voshpde/pipeLine/segmentation_wavfiles/20181015/333_20181015.wav	7524.706916666667	361185932	7554.156916666667	362599532	332_20181015	eu eu de pa eu eu tom eu eu eu pa of eu every igleveensyouothftis	a ogoiteosoroftefeemetatesaoofyeveryigleveenseyouothftis	/media/hugo/Seagate Expansion Drive/ALICE_BACKUP/voshpde/wav_files/zipfiles/20181015.wav	34
333	/media/hugo/Seagate Expansion Drive/ALICE_BACKUP/voshpde/pipeLine/segmentation_wavfiles/20181015/334_20181015.wav	7554.1569375	362599533	7583.8069375	364022733	333_20181015	rent de we will be voting at seventeen fifteen can especially ensure that substitutes could i especially ensure that substitutes have their voting cards colleagues who are not used to the voting in libe	mrdentdewe will be voting at seventeen fifteen can especially ensure that substitutes could i especially ensure that substitutes have their voting cards colleagues who are not used to the voting in lib	/media/hugo/Seagate Expansion Drive/ALICE_BACKUP/voshpde/wav_files/zipfiles/20181015.wav	5
334	/media/hugo/Seagate Expansion Drive/ALICE_BACKUP/voshpde/pipeLine/segmentation_wavfiles/20181015/335_20181015.wav	7583.806958333334	364022734	7604.156958333333	364999534	334_20181015	so coordinators just make sure that coordinators and staff make sure that everyone has their voting card so we are du to vote it seventeen fifteen i just make sure everyone is present president	so coordinators just make sure that coordinators and staff make sure that everyone has their voting card so we are due to vote it seventeen fifteen i just make sure everyone is present president	/media/hugo/Seagate Expansion Drive/ALICE_BACKUP/voshpde/wav_files/zipfiles/20181015.wav	1
335	/media/hugo/Seagate Expansion Drive/ALICE_BACKUP/voshpde/pipeLine/segmentation_wavfiles/20181015/336_20181015.wav	7604.156979166667	364999535	7625.706979166666	366033935	335_20181015	ana eu as thteyouoino	no cause thteyouoino	/media/hugo/Seagate Expansion Drive/ALICE_BACKUP/voshpde/wav_files/zipfiles/20181015.wav	7
336	/media/hugo/Seagate Expansion Drive/ALICE_BACKUP/voshpde/pipeLine/segmentation_wavfiles/20181015/337_20181015.wav	7625.707	366033936	7648.557	367130736	336_20181015	eu eu	i	/media/hugo/Seagate Expansion Drive/ALICE_BACKUP/voshpde/wav_files/zipfiles/20181015.wav	5
337	/media/hugo/Seagate Expansion Drive/ALICE_BACKUP/voshpde/pipeLine/segmentation_wavfiles/20181015/338_20181015.wav	7648.557020833333	367130737	7676.107020833333	368453137	337_20181015	eu asteeetiidedysooateeo	i asteeteidedysooateeo	/media/hugo/Seagate Expansion Drive/ALICE_BACKUP/voshpde/wav_files/zipfiles/20181015.wav	4
338	/media/hugo/Seagate Expansion Drive/ALICE_BACKUP/voshpde/pipeLine/segmentation_wavfiles/20181015/339_20181015.wav	7676.107041666667	368453138	7695.357041666667	369377138	338_20181015	eu	i	/media/hugo/Seagate Expansion Drive/ALICE_BACKUP/voshpde/wav_files/zipfiles/20181015.wav	2
339	/media/hugo/Seagate Expansion Drive/ALICE_BACKUP/voshpde/pipeLine/segmentation_wavfiles/20181015/340_20181015.wav	7695.3570625	369377139	7712.9070625	370219539	339_20181015	eu	a	/media/hugo/Seagate Expansion Drive/ALICE_BACKUP/voshpde/wav_files/zipfiles/20181015.wav	2
340	/media/hugo/Seagate Expansion Drive/ALICE_BACKUP/voshpde/pipeLine/segmentation_wavfiles/20181015/341_20181015.wav	7712.9070833333335	370219540	7738.257083333333	371436340	340_20181015	de eu eu de eu pa louis	to a eeeeloina	/media/hugo/Seagate Expansion Drive/ALICE_BACKUP/voshpde/wav_files/zipfiles/20181015.wav	16
341	/media/hugo/Seagate Expansion Drive/ALICE_BACKUP/voshpde/pipeLine/segmentation_wavfiles/20181015/342_20181015.wav	7738.257104166667	371436341	7754.207104166667	372201941	341_20181015	eu eu eu de de port or eu european eu	a efoanteteortoreeoeurooeaao	/media/hugo/Seagate Expansion Drive/ALICE_BACKUP/voshpde/wav_files/zipfiles/20181015.wav	21
342	/media/hugo/Seagate Expansion Drive/ALICE_BACKUP/voshpde/pipeLine/segmentation_wavfiles/20181015/343_20181015.wav	7754.207125	372201942	7782.457125	373557942	342_20181015	de redentwemissing members from just more than one group so am posing until we get everyone a sensitive close vote so i am just posing until everyone arrives it is more than one group to members if you could just be patient for another couple of	dent redentwemissing members from just more than one group so am posing until we get everyone a sensitive close vote so i am just posing until everyone arrives it is more than one group to members if you could just be patient for another couple of	/media/hugo/Seagate Expansion Drive/ALICE_BACKUP/voshpde/wav_files/zipfiles/20181015.wav	2
343	/media/hugo/Seagate Expansion Drive/ALICE_BACKUP/voshpde/pipeLine/segmentation_wavfiles/20181015/344_20181015.wav	7782.457145833333	373557943	7805.607145833334	374669143	343_20181015	eu		/media/hugo/Seagate Expansion Drive/ALICE_BACKUP/voshpde/wav_files/zipfiles/20181015.wav	2
344	/media/hugo/Seagate Expansion Drive/ALICE_BACKUP/voshpde/pipeLine/segmentation_wavfiles/20181015/345_20181015.wav	7805.607166666667	374669144	7833.857166666667	376025144	344_20181015	nearly du have a point of order mr ernst i do not have my card has asmalrealy my hand ana somebody get this card for you from the third can somebody from the go group get mrs ernst	nearly you have a point of order mr erst i do not have my card has asmalrealy my hand and somebody get this card for you from the third can somebody from the go group get ms ernsard	/media/hugo/Seagate Expansion Drive/ALICE_BACKUP/voshpde/wav_files/zipfiles/20181015.wav	8
345	/media/hugo/Seagate Expansion Drive/ALICE_BACKUP/voshpde/pipeLine/segmentation_wavfiles/20181015/346_20181015.wav	7833.8571875	376025145	7860.5071875	377304345	345_20181015	because we are posing to wait for a various members tom please we do need de just let me make a check please that everyone who is present has their electronic voting card does everyone who is present and voting have it including members who are not le bay members but substitutes	because we are posing to wait for various members to please we do need just let me make a check please that everyone who is present has their electronic voting card does everyone who is present and voting have it including members who are not le bay members but substitutes	/media/hugo/Seagate Expansion Drive/ALICE_BACKUP/voshpde/wav_files/zipfiles/20181015.wav	6
346	/media/hugo/Seagate Expansion Drive/ALICE_BACKUP/voshpde/pipeLine/segmentation_wavfiles/20181015/347_20181015.wav	7860.507208333333	377304346	7881.757208333333	378324346	346_20181015	yes i think that as a yes so only one mrs earns but she is going to get our card i do not want to count votes which are not on the card so you can get the voting card on third floor now that yes so someone is going to get your card we will make an arrangement if we cant get up on time	yes i think that as a yes so only one mrs earns but she is going to get our card i do not want to count votes which are not on the card so you can get the voting card on third floor now that yes so someone is going to get your card we will make an arrangement if we cant get up on time	/media/hugo/Seagate Expansion Drive/ALICE_BACKUP/voshpde/wav_files/zipfiles/20181015.wav	0
347	/media/hugo/Seagate Expansion Drive/ALICE_BACKUP/voshpde/pipeLine/segmentation_wavfiles/20181015/348_20181015.wav	7881.757229166667	378324347	7909.807229166667	379670747	347_20181015	mr president i do not have my card in my colleague will bring my card in this room but until now i need my sign to worry curneallywel work something i we are going to get your card and if we start voting before your cardcomes will record the votes up to that point with every ones permission i make that an incepentefore i am just checking that there is no one else in this position	mr president i do not have my card in my colleague will bring my card in this room but until now i need my sign to worry curneallywel work something i we are going to get your card and if we start voting before your cardcomes will record the votes up to that point with every ones permission i make that an incepentefore i am just checking that there is no one else in this position	/media/hugo/Seagate Expansion Drive/ALICE_BACKUP/voshpde/wav_files/zipfiles/20181015.wav	0
348	/media/hugo/Seagate Expansion Drive/ALICE_BACKUP/voshpde/pipeLine/segmentation_wavfiles/20181015/349_20181015.wav	7909.80725	379670748	7933.55725	380810748	348_20181015	no one else cole what i am doing now is i am just waiting a moment because more than one group has some members missing who are on the way so they are on their way and for this reason if you support my decision which just wait for those members	no one else cole what i am doing now is i am just waiting a moment because more than one group has some members missing who are on the way so they are on their way and for this reason if you support my decision which just wait for those members	/media/hugo/Seagate Expansion Drive/ALICE_BACKUP/voshpde/wav_files/zipfiles/20181015.wav	0
349	/media/hugo/Seagate Expansion Drive/ALICE_BACKUP/voshpde/pipeLine/segmentation_wavfiles/20181015/350_20181015.wav	7933.557270833333	380810749	7962.007270833334	382176349	349_20181015	it is not just one group its more than one group so please your patient thank you there is only des one vote so	it is not just one group its more than one group so please your patient thank you there is only thus one vote so	/media/hugo/Seagate Expansion Drive/ALICE_BACKUP/voshpde/wav_files/zipfiles/20181015.wav	3
350	/media/hugo/Seagate Expansion Drive/ALICE_BACKUP/voshpde/pipeLine/segmentation_wavfiles/20181015/351_20181015.wav	7962.007291666667	382176350	7989.257291666667	383484350	350_20181015	mon eu elevertelos	mr eleveretelos	/media/hugo/Seagate Expansion Drive/ALICE_BACKUP/voshpde/wav_files/zipfiles/20181015.wav	6
351	/media/hugo/Seagate Expansion Drive/ALICE_BACKUP/voshpde/pipeLine/segmentation_wavfiles/20181015/352_20181015.wav	7989.2573125	383484351	8008.7073125	384417951	351_20181015			/media/hugo/Seagate Expansion Drive/ALICE_BACKUP/voshpde/wav_files/zipfiles/20181015.wav	0
352	/media/hugo/Seagate Expansion Drive/ALICE_BACKUP/voshpde/pipeLine/segmentation_wavfiles/20181015/353_20181015.wav	8008.707333333334	384417952	8032.057333333333	385538752	352_20181015	eu	eur	/media/hugo/Seagate Expansion Drive/ALICE_BACKUP/voshpde/wav_files/zipfiles/20181015.wav	1
353	/media/hugo/Seagate Expansion Drive/ALICE_BACKUP/voshpde/pipeLine/segmentation_wavfiles/20181015/354_20181015.wav	8032.057354166666	385538753	8049.207354166667	386361953	353_20181015	i speak to someone from the group	i speak to someone from the group	/media/hugo/Seagate Expansion Drive/ALICE_BACKUP/voshpde/wav_files/zipfiles/20181015.wav	0
354	/media/hugo/Seagate Expansion Drive/ALICE_BACKUP/voshpde/pipeLine/segmentation_wavfiles/20181015/355_20181015.wav	8049.207375	386361954	8065.357375	387137154	354_20181015	rather less publicly that i am doing now i think it is in the interest of everyone because the vote will be distorted i look look their cards president is there another card missing i did ask for full disclosure	rather less publicly that i am doing now i think it is in the interest of everyone because the vote will be distorted i look look their cards president is there another card missing i did ask for full disclosure	/media/hugo/Seagate Expansion Drive/ALICE_BACKUP/voshpde/wav_files/zipfiles/20181015.wav	0
355	/media/hugo/Seagate Expansion Drive/ALICE_BACKUP/voshpde/pipeLine/segmentation_wavfiles/20181015/356_20181015.wav	8065.357395833334	387137155	8094.807395833333	388550755	355_20181015	is it coming is coming ok i do not want to enviris anyone i just want to make sure that we have a full electronic vote i do not want any doubts i am just going quickly turn to our coordinators just check everyone is present and correct eu epp uk alde group who s coordinating for us today	is it coming is coming ok i do not want to enviris anyone i just want to make sure that we have a full electronic vote i do not want any doubts i am just going quickly turn to our coordinators just check everyone is present and correct your epp uk alde group who s coordinating for us today	/media/hugo/Seagate Expansion Drive/ALICE_BACKUP/voshpde/wav_files/zipfiles/20181015.wav	3
356	/media/hugo/Seagate Expansion Drive/ALICE_BACKUP/voshpde/pipeLine/segmentation_wavfiles/20181015/357_20181015.wav	8094.8074166666665	388550756	8123.457416666667	389925956	356_20181015	who deputising today is so f are you deputising who jag your our coordinating is everything ok for the alde group your happy everyone present ok i take that geneo chuckle that everything is fine ok lat s find go greens everything find ecr group	who deputising today is so f are you deputising who jag your our coordinating is everything ok for the alde group your happy everyone present ok i take that geneo chuckle that everything is fine ok lat s find go greens everything find ecr group	/media/hugo/Seagate Expansion Drive/ALICE_BACKUP/voshpde/wav_files/zipfiles/20181015.wav	0
357	/media/hugo/Seagate Expansion Drive/ALICE_BACKUP/voshpde/pipeLine/segmentation_wavfiles/20181015/358_20181015.wav	8123.4574375	389925957	8151.9074375	391291557	357_20181015	is no problems efdd i am just going through everyone for fairtitsenf and sd	is no problems fdd i am just going through everyone for fairtitsenf and sd	/media/hugo/Seagate Expansion Drive/ALICE_BACKUP/voshpde/wav_files/zipfiles/20181015.wav	1
358	/media/hugo/Seagate Expansion Drive/ALICE_BACKUP/voshpde/pipeLine/segmentation_wavfiles/20181015/359_20181015.wav	8151.907458333333	391291558	8177.857458333333	392537158	358_20181015	molwerejustwere waiting for one one card and new that was going to start okay mrs vero the pressure is now increasing your card us on the way right	molwerejustwere waiting for one one card and new that was going to start okay mrs vero the pressure is now increasing your card us on the way right	/media/hugo/Seagate Expansion Drive/ALICE_BACKUP/voshpde/wav_files/zipfiles/20181015.wav	0
359	/media/hugo/Seagate Expansion Drive/ALICE_BACKUP/voshpde/pipeLine/segmentation_wavfiles/20181015/360_20181015.wav	8177.857479166667	392537159	8194.907479166666	393355559	359_20181015	i make that announcement i ak the anocemensoilmakean announcement for the one voting card that is not here and i am sure it is on the way	i make that announcement i ak the anocemensoilmakean announcement for the one voting card that is not here and i am sure it is on the way	/media/hugo/Seagate Expansion Drive/ALICE_BACKUP/voshpde/wav_files/zipfiles/20181015.wav	0
360	/media/hugo/Seagate Expansion Drive/ALICE_BACKUP/voshpde/pipeLine/segmentation_wavfiles/20181015/361_20181015.wav	8194.9075	393355560	8221.6575	394639560	360_20181015	before we start voting thank you colleagues for your patients i say likely ironically ok interoperability between eu information systems borders and visa our two rapporteurs mr lenars and mr melo	before we start voting thank you colleagues for your patients i say likely ironically ok interoperability between eu information systems borders and visa our two rapporteurs mr lenars and mr melo	/media/hugo/Seagate Expansion Drive/ALICE_BACKUP/voshpde/wav_files/zipfiles/20181015.wav	0
361	/media/hugo/Seagate Expansion Drive/ALICE_BACKUP/voshpde/pipeLine/segmentation_wavfiles/20181015/362_20181015.wav	8221.657520833332	394639561	8250.007520833333	396000361	361_20181015	to the rapporteurs wish to take the floor before the vote ok let us proceed with the vote on the vote colleagues i would obviously i go to the first colom and indicate the amendments on the first colom when we vote o cas so the first vote amendment one nine five the votes open	to the rapporteurs wish to take the floor before the vote ok let us proceed with the vote on the vote colleagues i would obviously i go to the first colom and indicate the amendments on the first colom when we vote o cas so the first vote amendment one nine five the votes open	/media/hugo/Seagate Expansion Drive/ALICE_BACKUP/voshpde/wav_files/zipfiles/20181015.wav	0
362	/media/hugo/Seagate Expansion Drive/ALICE_BACKUP/voshpde/pipeLine/segmentation_wavfiles/20181015/363_20181015.wav	8250.007541666666	396000362	8272.557541666667	397082762	362_20181015	mr eu the epp has two plus so if two withdraw than we will countlfirstokwereinwerefindnow	mr league the epp has two plus so if two withdraw than we will countlfirstokwereinwerefindnow	/media/hugo/Seagate Expansion Drive/ALICE_BACKUP/voshpde/wav_files/zipfiles/20181015.wav	4
363	/media/hugo/Seagate Expansion Drive/ALICE_BACKUP/voshpde/pipeLine/segmentation_wavfiles/20181015/364_20181015.wav	8272.5575625	397082763	8301.3075625	398462763	363_20181015	the vote is closed and that cart sis rejected president that was in a good start was at one nine one nine six the voters open	the vote is closed and that caritasise rejected president that was in a good start was at one nine one nine six the voters open	/media/hugo/Seagate Expansion Drive/ALICE_BACKUP/voshpde/wav_files/zipfiles/20181015.wav	3
364	/media/hugo/Seagate Expansion Drive/ALICE_BACKUP/voshpde/pipeLine/segmentation_wavfiles/20181015/365_20181015.wav	8301.307583333333	398462764	8323.557583333333	399530764	364_20181015	and that is rejected president one nine even the voters open nine seven is everything okay i am taking this vote slower is everything o okee the vote open	and that is rejected president one nine even the voters open nine seven is everything okay i am taking this vote slower is everything o okee the vote open	/media/hugo/Seagate Expansion Drive/ALICE_BACKUP/voshpde/wav_files/zipfiles/20181015.wav	0
365	/media/hugo/Seagate Expansion Drive/ALICE_BACKUP/voshpde/pipeLine/segmentation_wavfiles/20181015/366_20181015.wav	8323.557604166666	399530765	8348.407604166667	400723565	365_20181015	m present as everyone voted a votes closed and that is rejected de as someone left the room i am just going to pause a coordinator seems several left de room i do opolgobutafter you mentioned that we are two too many mathematically something one wrong and three left so are somebody a	m present as everyone voted a votes closed and that is rejected president as someone left the room i am just going to pause a coordinator seems several left e room i do opolgobutafter you mentioned that we are two too many mathematically something one wrong and three left so are somebody a	/media/hugo/Seagate Expansion Drive/ALICE_BACKUP/voshpde/wav_files/zipfiles/20181015.wav	8
366	/media/hugo/Seagate Expansion Drive/ALICE_BACKUP/voshpde/pipeLine/segmentation_wavfiles/20181015/367_20181015.wav	8348.407625	400723566	8373.457625	401925966	366_20181015	coming back now i apologise for the unconvunionsokweyoulikemitopaus will that firs and comes back it is not in any ones interest to ok you find again ok that is in now we got to compromise amendment one the voters	coming back now i apologise for the unconvunionsokweyoulikemitopaus will that firs and comes back it is not in any ones interest to ok you find again ok that is in now we got to compromise amendment one the voters	/media/hugo/Seagate Expansion Drive/ALICE_BACKUP/voshpde/wav_files/zipfiles/20181015.wav	0
367	/media/hugo/Seagate Expansion Drive/ALICE_BACKUP/voshpde/pipeLine/segmentation_wavfiles/20181015/368_20181015.wav	8373.457645833334	401925967	8396.707645833334	403041967	367_20181015	the vote is closed that is carried and new re mon now we come to compromise amendment one eig as everyone voted the vote is closed	the vote is closed that is carried and niremonynow we come to compromise amendment one eig as everyone voted the vote is closed	/media/hugo/Seagate Expansion Drive/ALICE_BACKUP/voshpde/wav_files/zipfiles/20181015.wav	5
368	/media/hugo/Seagate Expansion Drive/ALICE_BACKUP/voshpde/pipeLine/segmentation_wavfiles/20181015/369_20181015.wav	8396.707666666667	403041968	8413.057666666668	403826768	368_20181015	and that is cared now we go to compromise amendment to	and that is cared now we go to compromise amendment to	/media/hugo/Seagate Expansion Drive/ALICE_BACKUP/voshpde/wav_files/zipfiles/20181015.wav	0
369	/media/hugo/Seagate Expansion Drive/ALICE_BACKUP/voshpde/pipeLine/segmentation_wavfiles/20181015/370_20181015.wav	8413.0576875	403826769	8437.6076875	405005169	369_20181015	mr het s card i go to amendment three eight six voters open three eight six always on the firs colom on page five and it is always the first call on three eight six as everyone voted to voters closed	mr het s card i go to amendment three eight six voters open three eight six always on the firs colom on page five and it is always the first call on three eight six as everyone voted to voters closed	/media/hugo/Seagate Expansion Drive/ALICE_BACKUP/voshpde/wav_files/zipfiles/20181015.wav	0
370	/media/hugo/Seagate Expansion Drive/ALICE_BACKUP/voshpde/pipeLine/segmentation_wavfiles/20181015/371_20181015.wav	8437.607708333333	405005170	8453.357708333333	405761170	370_20181015	and that is card we come to article three and amendment three nine nine sorry three nine one that is in the second colom	and that is card we come to article three and amendment three nine nine sorry three nine one that is in the second colom	/media/hugo/Seagate Expansion Drive/ALICE_BACKUP/voshpde/wav_files/zipfiles/20181015.wav	0
371	/media/hugo/Seagate Expansion Drive/ALICE_BACKUP/voshpde/pipeLine/segmentation_wavfiles/20181015/372_20181015.wav	8453.357729166666	405761171	8469.507729166668	406536371	371_20181015	article there the nine one amendment the votes open as every on got it three nine one so that is on page six its article three	article there the nine one amendment the votes open as every on got it three nine one so that is on page six its article three	/media/hugo/Seagate Expansion Drive/ALICE_BACKUP/voshpde/wav_files/zipfiles/20181015.wav	0
372	/media/hugo/Seagate Expansion Drive/ALICE_BACKUP/voshpde/pipeLine/segmentation_wavfiles/20181015/373_20181015.wav	8469.50775	406536372	8496.45775	407829972	372_20181015	ok when i say it again its article article three oil keep et open it is article three amendment three nine one mrs ernst everyone got it the vote is closed in that is reject	ok when i say it again its article article three oil keep et open it is article three amendment three nine one mrs as everyone got it the vote is closed in that is reject	/media/hugo/Seagate Expansion Drive/ALICE_BACKUP/voshpde/wav_files/zipfiles/20181015.wav	4
373	/media/hugo/Seagate Expansion Drive/ALICE_BACKUP/voshpde/pipeLine/segmentation_wavfiles/20181015/374_20181015.wav	8496.457770833333	407829973	8521.907770833333	409051573	373_20181015	and then we go to amendment three nine nine again on article three cornelia earns deletion the votes open eu voted the vote is closed and that is rejected and then we go to amendment four hundred mr	and then we go to amendment three nine nine again on article three cornelia earns deletion the votes open en voted the vote is closed and that is rejected and then we go to amendment four hundred mr	/media/hugo/Seagate Expansion Drive/ALICE_BACKUP/voshpde/wav_files/zipfiles/20181015.wav	1
374	/media/hugo/Seagate Expansion Drive/ALICE_BACKUP/voshpde/pipeLine/segmentation_wavfiles/20181015/375_20181015.wav	8521.907791666667	409051574	8543.257791666667	410076374	374_20181015	m have one voted the votes closed that is rise now were got to compromise three amendment three compromise amendment three voters open votes closed	m have one voted the votes closed that is rise now were got to compromise three amendment three compromise amendment three voters open votes closed	/media/hugo/Seagate Expansion Drive/ALICE_BACKUP/voshpde/wav_files/zipfiles/20181015.wav	0
