	wavfile	start_seconds	start_frames	end_seconds	end_frames	identifier	inferred_text_with_hotwords	inferred_text_without_hotwords	motherfile	dist
90	/media/hugo/Seagate Expansion Drive/ALICE_BACKUP/voshpde/pipeLine/segmentation_wavfiles/20181011/091_20181011.wav	2089.601875	100300890	2111.251875	101340090	090_20181011	i think the previous speakers have already brought it is up but there needs to be bat a knowledge of the situation in different countries base at the moment this could be something in an obstacle i have got to couple a comments and a few questions i think big it said it very well	i think the previous speakers have already brought it is up but there needs to be bat a knowledge of the situation in different countries base at the moment this could be something in an obstacle i have got to couple a comments and a few questions i think big it said it very well	/media/hugo/Seagate Expansion Drive/ALICE_BACKUP/voshpde/wav_files/zipfiles/20181011.wav	0
91	/media/hugo/Seagate Expansion Drive/ALICE_BACKUP/voshpde/pipeLine/segmentation_wavfiles/20181011/092_20181011.wav	2111.2518958333335	101340091	2129.0018958333335	102192091	091_20181011	i think getting the word out about these kinds of studies could be very useful so that it is not just the experts that the read about it but one of the key aspects as was mentioned is to get	i think getting the word out about these kinds of studies could be very useful so that it is not just the experts that the read about it but one of the key aspects as was mentioned is to get	/media/hugo/Seagate Expansion Drive/ALICE_BACKUP/voshpde/wav_files/zipfiles/20181011.wav	0
92	/media/hugo/Seagate Expansion Drive/ALICE_BACKUP/voshpde/pipeLine/segmentation_wavfiles/20181011/093_20181011.wav	2129.0019166666666	102192092	2157.7519166666666	103572092	092_20181011	better cooperation ad that means that all have to be considered on an equal footing ad i think the only way to do this across all the different legal systems is through training training is the key thing training at european level is certainly an important necessary instrument any way i have a couple of questions the first want is more technical the second on is more general so first of all more specifically	better cooperation and that means that all have to be considered on an equal footing and i think the only way to do this across all the different legal systems is through training training is the key thing training at european level is certainly an important necessary instrument anyway i have a couple of questions the first want is more technical the second on is more general so first of all more specifically	/media/hugo/Seagate Expansion Drive/ALICE_BACKUP/voshpde/wav_files/zipfiles/20181011.wav	3
93	/media/hugo/Seagate Expansion Drive/ALICE_BACKUP/voshpde/pipeLine/segmentation_wavfiles/20181011/094_20181011.wav	2157.7519375	103572093	2175.5019375	104424093	093_20181011	that is the admissibility of evidence the rules for admissibility of evidence on the basis of your study to what extent you think that the different approach is in the different member states on the rules of admissibility of evidence	that is the admissibility of evidence the rules for admissibility of evidence on the basis of your study to what extent you think that the different approach is in the different member states on the rules of admissibility of evidence	/media/hugo/Seagate Expansion Drive/ALICE_BACKUP/voshpde/wav_files/zipfiles/20181011.wav	0
94	/media/hugo/Seagate Expansion Drive/ALICE_BACKUP/voshpde/pipeLine/segmentation_wavfiles/20181011/095_20181011.wav	2175.5019583333333	104424094	2200.851958333333	105640894	094_20181011	of course you are talking about whether these are basically considered to be admissible or to what extent con these different rules have an influence on transnational investigations carried out by the european public prosecutor now that we have this new body the european public prosecutor how is that going to affect their work then i wanted	of course you are talking about whether these are basically considered to be admissible or to what extent con these different rules have an influence on transnational investigations carried out by the european public prosecutor now that we have this new body the european public prosecutor how is that going to affect their work then i wanted	/media/hugo/Seagate Expansion Drive/ALICE_BACKUP/voshpde/wav_files/zipfiles/20181011.wav	0
95	/media/hugo/Seagate Expansion Drive/ALICE_BACKUP/voshpde/pipeLine/segmentation_wavfiles/20181011/096_20181011.wav	2200.8519791666668	105640895	2230.6019791666668	107068895	095_20181011	come back to the subject of minors but maybe save some time ad jumpstrait onto the subject of victims rights i am a member of the special lised committee on terrorism we are coming three to our conclusions now ad among them measures that are being envisaged is the setting up of a coordinating body at european level in order to guarantee that all victims	come back to the subject of minors but maybe save some time an jumpstraite onto the subject of victims rights i am a member of the special lised committee on terrorism we are coming three to our conclusions now among them measures that are being envisaged is the setting up of a coordinating body at european level in order to guarantee that all victims	/media/hugo/Seagate Expansion Drive/ALICE_BACKUP/voshpde/wav_files/zipfiles/20181011.wav	5
96	/media/hugo/Seagate Expansion Drive/ALICE_BACKUP/voshpde/pipeLine/segmentation_wavfiles/20181011/097_20181011.wav	2230.602	107068896	2245.952	107805696	096_20181011	well in this case victims of terrorist attacks or might be victims of transnational terrorism would get the same kind of compensation and support	well in this case victims of terrorist attacks or might be victims of transnational terrorism would get the same kind of compensation and support	/media/hugo/Seagate Expansion Drive/ALICE_BACKUP/voshpde/wav_files/zipfiles/20181011.wav	0
97	/media/hugo/Seagate Expansion Drive/ALICE_BACKUP/voshpde/pipeLine/segmentation_wavfiles/20181011/098_20181011.wav	2245.9520208333333	107805697	2267.402020833333	108835297	097_20181011	so it should not matter what country your from depending they should not depend on what your country of origin is president could i ask a question about when you de study like this just the core issues of un mutual recognition and the issue of	so it should not matter what country your from depending they should not depend on what your country of origin is president could i ask a question about when you do study like this just the core issues of un mutual recognition and the issue of	/media/hugo/Seagate Expansion Drive/ALICE_BACKUP/voshpde/wav_files/zipfiles/20181011.wav	1
98	/media/hugo/Seagate Expansion Drive/ALICE_BACKUP/voshpde/pipeLine/segmentation_wavfiles/20181011/099_20181011.wav	2267.4020416666667	108835298	2293.9520416666664	110109698	098_20181011	the passage of different instruments how how they are maturing to take take for example an instrument like the european arrest warrant there there is a king a maturing of different tools in the box of eu like so take take the european arrest warnt there are problems at the beginning with proportionality minor offences and so on eu	the passage of different instruments how how they are maturing to take take for example an instrument like the european arrest warrant there there is a kind a maturing of different tools in the box of you like so take take the european arrest warnt there are problems at the beginning with proportionality minor offences and so on	/media/hugo/Seagate Expansion Drive/ALICE_BACKUP/voshpde/wav_files/zipfiles/20181011.wav	6
99	/media/hugo/Seagate Expansion Drive/ALICE_BACKUP/voshpde/pipeLine/segmentation_wavfiles/20181011/100_20181011.wav	2293.9520625	110109699	2315.6020625	111148899	099_20181011	now many of these reforms of such a major tool in the box of of our criminal procedure here in the eu were were reformed and we did that so you could say that was done here externally then we so that	now many of these reforms of such a major tool in the box of of our criminal procedure here in the eu were were reformed and we did that so you could say that was done here externally then we so that	/media/hugo/Seagate Expansion Drive/ALICE_BACKUP/voshpde/wav_files/zipfiles/20181011.wav	0
100	/media/hugo/Seagate Expansion Drive/ALICE_BACKUP/voshpde/pipeLine/segmentation_wavfiles/20181011/101_20181011.wav	2315.602083333333	111148900	2342.1520833333334	112423300	100_20181011	the improvement or the respect that the arrest warrant now has started to emerge through as mrs tinto a sank training of judges better decisions and now you see a much wider respect of globally it seen as one of the best extradition tools globally so how eu do you get from a position	the improvement or the respect that the arrest warrant now has started to emerge through as mrs tinto a sank training of judges better decisions and now you see a much wider respect of globally it seen as one of the best extradition tools globally so how ou do you get from a position	/media/hugo/Seagate Expansion Drive/ALICE_BACKUP/voshpde/wav_files/zipfiles/20181011.wav	1
101	/media/hugo/Seagate Expansion Drive/ALICE_BACKUP/voshpde/pipeLine/segmentation_wavfiles/20181011/102_20181011.wav	2342.1521041666665	112423301	2370.002104166667	113760101	101_20181011	in other areas ad this is goods to the point mrs ipolseing about you want to publicise how harmonisation and better systems can work how do you get to point where the e ad wer you was much criticised for the prosecution of trivily offences to this position ad is there an issue a wider issue you talk about for example detention conditions eu	in other areas and this is goods to the point mrs ipolseing about you want to publicise how harmonisation and better systems can work how do you get to point where the ead wer you was much criticised for the prosecution of trivily offences to this position and is there an issue a wider issue you talk about for example detention conditions	/media/hugo/Seagate Expansion Drive/ALICE_BACKUP/voshpde/wav_files/zipfiles/20181011.wav	6
102	/media/hugo/Seagate Expansion Drive/ALICE_BACKUP/voshpde/pipeLine/segmentation_wavfiles/20181011/103_20181011.wav	2370.002125	113760102	2392.552125	114842502	102_20181011	it is in the end there a big external factor here for example delays if you germany you have done country positions if if i was if i was a german court ad german procedure where detention conditions we be going to be better than an say some other countries	it is in the end there a big external factor here for example delays if you germany you have done country positions if if i was if i was a german court an german procedure where detention conditions we be going to be better than an say some other countries	/media/hugo/Seagate Expansion Drive/ALICE_BACKUP/voshpde/wav_files/zipfiles/20181011.wav	1
103	/media/hugo/Seagate Expansion Drive/ALICE_BACKUP/voshpde/pipeLine/segmentation_wavfiles/20181011/104_20181011.wav	2392.5521458333333	114842503	2419.0021458333335	116112103	103_20181011	is it the case you would have more delays or more reluctance to extol under the european arrest warnt because of this particular issue and is it the case that you just that you would be advocating just a practical improvement a very basic improvement in detention conditions around the european union and should not me really be publicising that this is the improvement we want	is it the case you would have more delays or more reluctance to extol under the european arrest warnt because of this particular issue and is it the case that you just that you would be advocating just a practical improvement a very basic improvement in detention conditions around the european union and should not me really be publicising that this is the improvement we want	/media/hugo/Seagate Expansion Drive/ALICE_BACKUP/voshpde/wav_files/zipfiles/20181011.wav	0
104	/media/hugo/Seagate Expansion Drive/ALICE_BACKUP/voshpde/pipeLine/segmentation_wavfiles/20181011/105_20181011.wav	2419.0021666666667	116112104	2438.4521666666665	117045704	104_20181011	and not really blame the tool if you like so so there us to be king of a holistic approach here training detention kat this is part of a bigger picture ad not ad not go through this process of where we attack the european arrest warrant to become the poster child of	and not really blame the tool if you like so so there us to be kin of a holistic approach here training detention kat this is part of a bigger picture and not and not go through this process of where we attack the european arrest warrant to become the poster child of	/media/hugo/Seagate Expansion Drive/ALICE_BACKUP/voshpde/wav_files/zipfiles/20181011.wav	3
105	/media/hugo/Seagate Expansion Drive/ALICE_BACKUP/voshpde/pipeLine/segmentation_wavfiles/20181011/106_20181011.wav	2438.4521875	117045705	2457.9021875	117979305	105_20181011	of of know euroscepticism and all the rest of it that we went through here in our institutions the easo now ask this question is that you talk about many issues here about harmonisation ad so ad i think many of them are very basic there to do with standards in different countries	of of know euroscepticism and all the rest of it that we went through here in our institutions the res now ask this question is that you talk about many issues here about harmonisation and so i think many of them are very basic there to do with standards in different countries	/media/hugo/Seagate Expansion Drive/ALICE_BACKUP/voshpde/wav_files/zipfiles/20181011.wav	7
106	/media/hugo/Seagate Expansion Drive/ALICE_BACKUP/voshpde/pipeLine/segmentation_wavfiles/20181011/107_20181011.wav	2457.9022083333334	117979306	2479.8522083333332	119032906	106_20181011	when in fact really it is about good harmonisation which can work the european rest war ad night works very well the alternative is very bad so the alternative is following back on what fifty seven convention you know very bad people take years to	when in fact really it is about good harmonisation which can work the european rest war night works very well the alternative is very bad so the alternative is following back on what fifty seven convention you know very bad people take years to	/media/hugo/Seagate Expansion Drive/ALICE_BACKUP/voshpde/wav_files/zipfiles/20181011.wav	3
107	/media/hugo/Seagate Expansion Drive/ALICE_BACKUP/voshpde/pipeLine/segmentation_wavfiles/20181011/108_20181011.wav	2479.852229166667	119032907	2507.602229166667	120364907	107_20181011	the extradited from one country to the other so i am just wanting to understand from your point of view is there are not a gap and i good back to beget cipples point should we not be doing a massive publicity drive rather than being defensive ensuring that good harmonise criminal procedure has huge benefits for people you know in terms of human	the extradited from one country to the other so i am just wanting to understand from your point of view is there are not a gap and i good back to beget cipples point should we not be doing a massive publicity drive rather than being defensive ensuring that good harmonise criminal procedure has huge benefits for people you know in terms of human	/media/hugo/Seagate Expansion Drive/ALICE_BACKUP/voshpde/wav_files/zipfiles/20181011.wav	0
108	/media/hugo/Seagate Expansion Drive/ALICE_BACKUP/voshpde/pipeLine/segmentation_wavfiles/20181011/109_20181011.wav	2507.60225	120364908	2529.25225	121404108	108_20181011	life ad eu are get a position where you know you solve problems much more quickly but but this has been a feel day for you know politicians to attack specific instruments ye de we you probably the biggest example but i can imagine there are other areas	life and you are get a position where you know you solve problems much more quickly but but this has been a feel day for you know politicians to attack specific instruments eid we you probably the biggest example but i can imagine there are other areas	/media/hugo/Seagate Expansion Drive/ALICE_BACKUP/voshpde/wav_files/zipfiles/20181011.wav	6
109	/media/hugo/Seagate Expansion Drive/ALICE_BACKUP/voshpde/pipeLine/segmentation_wavfiles/20181011/110_20181011.wav	2529.252270833333	121404109	2556.502270833333	122712109	109_20181011	when in fact your study shows that you know we can get the basics right the other thing is i notice that if again i look at germany is s a constitutional provision in germany you cant extradite to third countries now your suspect of third countries so there is probably the same on were lit slovakia probe ave to have a referendum if you are to do that so	when in fact your study shows that you know we can get the basics right the other thing is i notice that if again i look at germany is s a constitutional provision in germany you cant extradite to third countries now your suspect of third countries so there is probably the same on werelitslovakiaprolyhaveto have a referendum if you are to do that so	/media/hugo/Seagate Expansion Drive/ALICE_BACKUP/voshpde/wav_files/zipfiles/20181011.wav	7
110	/media/hugo/Seagate Expansion Drive/ALICE_BACKUP/voshpde/pipeLine/segmentation_wavfiles/20181011/111_20181011.wav	2556.5022916666667	122712110	2572.6522916666668	123487310	110_20181011	it goes on the heart of the idea of sovereignty so should not there be as ciple as saying a very significant publicity drive behind many of the measures that we talk about in criminal procedure	it goes on the heart of the idea of sovereignty so should not there be as cipleissaying a very significant publicity drive behind many of the measures that we talk about in criminal procedure	/media/hugo/Seagate Expansion Drive/ALICE_BACKUP/voshpde/wav_files/zipfiles/20181011.wav	3
111	/media/hugo/Seagate Expansion Drive/ALICE_BACKUP/voshpde/pipeLine/segmentation_wavfiles/20181011/112_20181011.wav	2572.6523125	123487311	2594.1023125	124516911	111_20181011	to ensure that people understand what is being happen ana what is being talked about when we try to harmonise or go for mutual recognition ad i say detention detention conditions is probably one of the critical ones so i just say that because it constantly in your report you talk about these delays why	to ensure that people understand what is being happen what is being talked about when we try to harmonise or go for mutual recognition i say detention detention conditions is probably one of the critical ones so i just say that because it constantly in your report you talk about these delays why	/media/hugo/Seagate Expansion Drive/ALICE_BACKUP/voshpde/wav_files/zipfiles/20181011.wav	7
112	/media/hugo/Seagate Expansion Drive/ALICE_BACKUP/voshpde/pipeLine/segmentation_wavfiles/20181011/113_20181011.wav	2594.1023333333333	124516912	2615.952333333333	125565712	112_20181011	the tending conditions eit comes back to all of these points comes back to very simple points i think so i am just interested in that and it is the same for children so when ms chico is doing her report it is the same you want to detain children that mean know you do not want to do that anywhere but you particularly do not want to do in some particular countries so	the tending conditions he it comes back to all of these points comes back to very simple points i think so i am just interested in that and it is the same for children so when ms cinecyouwis doing her report it is the same you want to detain children that mean know you do not want to do that anywhere but you particularly do not want to do in some particular countries so	/media/hugo/Seagate Expansion Drive/ALICE_BACKUP/voshpde/wav_files/zipfiles/20181011.wav	8
113	/media/hugo/Seagate Expansion Drive/ALICE_BACKUP/voshpde/pipeLine/segmentation_wavfiles/20181011/114_20181011.wav	2615.9523541666667	125565713	2642.5023541666665	126840113	113_20181011	again do you get this impression that we need to really go for a bot v a drive here because i think it is a success story for the eu if we get these things right so that us my my so i am being about overly in thesyasteconatursicmornoing but but i just du think this is a great area for us but we are very defensive because we feel	again do you get this impression that we need to really go for a bot v a drive here because i think it is a success story for the eu if we get these things right so that us my my so i am being about overly in thesyasteconatursicmornoing but but i just i do think this is a great area for us but we are very defensive because we feel	/media/hugo/Seagate Expansion Drive/ALICE_BACKUP/voshpde/wav_files/zipfiles/20181011.wav	3
114	/media/hugo/Seagate Expansion Drive/ALICE_BACKUP/voshpde/pipeLine/segmentation_wavfiles/20181011/115_20181011.wav	2642.502375	126840114	2671.352375	128224914	114_20181011	it is an area of so call sovereignty but we need to share sovereignty and get it done and i think mstunetiespoint my training judges and so on it is not soft area judges want to be trained and use eu law and it pains me when the european arrest warrant was attack the way it was and we reform that here and i look at it it is the gold standard around the world soryjusmentioning	it is an area of so call sovereignty but we need to share sovereignty and get it done and i think mstunetiespoint my training judges and so on it is not soft area judges want to be trained and use eu law and it pains me when the european arrest warrant was attack the way it was and we reform that here and i look at it it is the gold standard around the world soryjusmentioning	/media/hugo/Seagate Expansion Drive/ALICE_BACKUP/voshpde/wav_files/zipfiles/20181011.wav	0
115	/media/hugo/Seagate Expansion Drive/ALICE_BACKUP/voshpde/pipeLine/segmentation_wavfiles/20181011/116_20181011.wav	2671.3523958333335	128224915	2689.4023958333332	129091315	115_20181011	mrsidantyoudontdusliketheeuropeanso thank you very much for your interventions comments ad ad questions	mrsidantyoudontdusliketheeuropeanso thank you very much for your interventions comments and questions	/media/hugo/Seagate Expansion Drive/ALICE_BACKUP/voshpde/wav_files/zipfiles/20181011.wav	3
116	/media/hugo/Seagate Expansion Drive/ALICE_BACKUP/voshpde/pipeLine/segmentation_wavfiles/20181011/117_20181011.wav	2689.402416666667	129091316	2706.152416666667	129895316	116_20181011	maybe we will try to answer a react all of them so if if we do not a first reaction i would like to make to your observations madam	maybe we will try to answer a react all of them so if if we do not a first reaction i would like to make to your observations madam	/media/hugo/Seagate Expansion Drive/ALICE_BACKUP/voshpde/wav_files/zipfiles/20181011.wav	0
117	/media/hugo/Seagate Expansion Drive/ALICE_BACKUP/voshpde/pipeLine/segmentation_wavfiles/20181011/118_20181011.wav	2706.1524375	129895317	2724.5024375	130776117	117_20181011	mr president especially in terms of compensation for unjustified detention in transonational ad transnational procedures we we have insistent on this since many years in fact and unfortunately it did not come really to the agenda	mr president especially in terms of compensation for unjustified detention in transonational and transnational procedures we we have insistent on this since many years in fact and unfortunately it did not come really to the agenda	/media/hugo/Seagate Expansion Drive/ALICE_BACKUP/voshpde/wav_files/zipfiles/20181011.wav	1
118	/media/hugo/Seagate Expansion Drive/ALICE_BACKUP/voshpde/pipeLine/segmentation_wavfiles/20181011/119_20181011.wav	2724.5024583333334	130776118	2752.1524583333335	132103318	118_20181011	so there was a very interesting study made by gtnsegnsory european judicial network in this regard really identifying the major differences between the different national systems and identifying also while gaps in terms of transnational proceedings and we provide for different examples where person	so there was a very interesting study made by gtnsegnsory european judicial network in this regard really identifying the major differences between the different national systems and identifying also while gaps in terms of transnational proceedings and we provide for different examples where person	/media/hugo/Seagate Expansion Drive/ALICE_BACKUP/voshpde/wav_files/zipfiles/20181011.wav	0
119	/media/hugo/Seagate Expansion Drive/ALICE_BACKUP/voshpde/pipeLine/segmentation_wavfiles/20181011/120_20181011.wav	2752.1524791666666	132103319	2771.2024791666668	133017719	119_20181011	suspected persons were not able to receive compensation in spite of the fact that they had been unjustified detain during long periods of time or at least cases where it was very difficult for them to gets	suspected persons were not able to receive compensation in spite of the fact that they had been unjustified detain during long periods of time or at least cases where it was very difficult for them to gets	/media/hugo/Seagate Expansion Drive/ALICE_BACKUP/voshpde/wav_files/zipfiles/20181011.wav	0
120	/media/hugo/Seagate Expansion Drive/ALICE_BACKUP/voshpde/pipeLine/segmentation_wavfiles/20181011/121_20181011.wav	2771.2025	133017720	2800.0525	134402520	120_20181011	compensation from the issuing or the executing member states so i think that this to main even if we did not have the time now to to go into the details were during our speech deserves really attention in a way it is not a needed accompanying measure to mutual trust and to mutual recognition	compensation from the issuing or the executing member states so i think that this to main even if we did not have the time now to to go into the details were during our speech deserves really attention in a way it is not a needed accompanying measure to mutual trust and to mutual recognition	/media/hugo/Seagate Expansion Drive/ALICE_BACKUP/voshpde/wav_files/zipfiles/20181011.wav	0
