	wavfile	start_seconds	start_frames	end_seconds	end_frames	identifier	inferred_text_with_hotwords	inferred_text_without_hotwords	motherfile	dist
238	/media/hugo/Seagate Expansion Drive/ALICE_BACKUP/voshpde/pipeLine/segmentation_wavfiles/2018012501/239_2018012501.wav	5420.705396825397	239053108	5442.555396825397	240016693	238_2018012501	eu eu eu eu eu iii	i oroureeotea	/media/hugo/Seagate Expansion Drive/ALICE_BACKUP/voshpde/wav_files/zipfiles/2018012501.wav	14
239	/media/hugo/Seagate Expansion Drive/ALICE_BACKUP/voshpde/pipeLine/segmentation_wavfiles/2018012501/240_2018012501.wav	5442.555419501134	240016694	5469.705419501134	241214009	239_2018012501	ask us adforoepessoniwontetheoofsisteadeoiedoistilokoraoteoeeceavoclerispectteiftheywe	ask adforeoepessoniwontetheoofsisteadaoiedoistilokoraoteoeeceavoclerispectteiftheywe	/media/hugo/Seagate Expansion Drive/ALICE_BACKUP/voshpde/wav_files/zipfiles/2018012501.wav	5
240	/media/hugo/Seagate Expansion Drive/ALICE_BACKUP/voshpde/pipeLine/segmentation_wavfiles/2018012501/241_2018012501.wav	5469.705442176871	241214010	5495.255442176871	242340765	240_2018012501	eu eu voigt libe us un iii eeas eu ana un	i eevoinlieersooeeioreaeeoofnat	/media/hugo/Seagate Expansion Drive/ALICE_BACKUP/voshpde/wav_files/zipfiles/2018012501.wav	26
241	/media/hugo/Seagate Expansion Drive/ALICE_BACKUP/voshpde/pipeLine/segmentation_wavfiles/2018012501/242_2018012501.wav	5495.2554648526075	242340766	5518.605464852608	243370501	241_2018012501	eu mon colleagues let us continue our meeting today with the votes for the first we have	cot morning colleagues let us continue our meeting today with the votes for the first we have	/media/hugo/Seagate Expansion Drive/ALICE_BACKUP/voshpde/wav_files/zipfiles/2018012501.wav	7
242	/media/hugo/Seagate Expansion Drive/ALICE_BACKUP/voshpde/pipeLine/segmentation_wavfiles/2018012501/243_2018012501.wav	5518.605487528344	243370502	5540.155487528345	244320857	242_2018012501	a file which is under simplified procedure so the libe coordinators have decided in their meeting of the eleven of january that this should be that and in automatic data exchange with regard to vehicle registration data in portugal	a file which is under simplified procedure so the libe coordinators have decided in their meeting of the eleven of january that this should be that and in automatic data exchange with regard to vehicle registration data in port to gal	/media/hugo/Seagate Expansion Drive/ALICE_BACKUP/voshpde/wav_files/zipfiles/2018012501.wav	4
243	/media/hugo/Seagate Expansion Drive/ALICE_BACKUP/voshpde/pipeLine/segmentation_wavfiles/2018012501/244_2018012501.wav	5540.155510204082	244320858	5560.205510204081	245205063	243_2018012501	based on the so called prom decision the council is ready to adopt an implementation decision on the launch of automated data exchange with regard to vehicle registration data in portugal so that should be done with in simplified procedures and i will give immediately de ford to mr cor	based on the so called prom decision the council is ready to adopt an implementation decision on the launch of automated data exchange with regard to vehicle registration data in portugal so that should be done with in simplified procedures and i will give immediately the ford to mr koran	/media/hugo/Seagate Expansion Drive/ALICE_BACKUP/voshpde/wav_files/zipfiles/2018012501.wav	5
244	/media/hugo/Seagate Expansion Drive/ALICE_BACKUP/voshpde/pipeLine/segmentation_wavfiles/2018012501/245_2018012501.wav	5560.205532879819	245205064	5582.955532879819	246208339	244_2018012501	maraplsrrrenvemmadmresintjsvery briefly with this decision the council implements the so called pro decision but also maintains cooperation between member states in the area of	maraplsrrrenvemmadmresintjsvery briefly with this decision the council implements the so called pro decision but also maintains cooperation between member states in the area of	/media/hugo/Seagate Expansion Drive/ALICE_BACKUP/voshpde/wav_files/zipfiles/2018012501.wav	0
245	/media/hugo/Seagate Expansion Drive/ALICE_BACKUP/voshpde/pipeLine/segmentation_wavfiles/2018012501/246_2018012501.wav	5582.955555555555	246208340	5605.805555555556	247216025	245_2018012501	dealing with organised crime and terrorism the idea is to ensure that portugal can have personal data for carrying out investigations and here we are talking about number plate data portugal has implemented data protection requirements in its legislation in called including chapter six of the	dealing with organised crime and terrorism the idea is to ensure that portugal can have personal data for carrying out investigations and here we are talking about number plate data portugal has implemented data protection requirements in its legislation in called including chapter six of the	/media/hugo/Seagate Expansion Drive/ALICE_BACKUP/voshpde/wav_files/zipfiles/2018012501.wav	0
246	/media/hugo/Seagate Expansion Drive/ALICE_BACKUP/voshpde/pipeLine/segmentation_wavfiles/2018012501/247_2018012501.wav	5605.805578231292	247216026	5624.255578231293	248029671	246_2018012501	i full mentioned proom now previously they have three months to react and in order to achieve the deadline the libe committee decided to work exclusively in english to ensure that parliament will be able to vote on this in plenary in february	i full mentioned proom now previously they have three months to react and in order to achieve the deadline the libe committee decided to work exclusively in english to ensure that parliament will be able to vote on this in plenary in february	/media/hugo/Seagate Expansion Drive/ALICE_BACKUP/voshpde/wav_files/zipfiles/2018012501.wav	0
247	/media/hugo/Seagate Expansion Drive/ALICE_BACKUP/voshpde/pipeLine/segmentation_wavfiles/2018012501/248_2018012501.wav	5624.2556009070295	248029672	5643.30560090703	248869777	247_2018012501	i hope that parliament will provide its consensus to this report and will therefore ensure that the ec data exchange mechanism created by anybody object this if it is not the case that the proposed procedure is deem to have been approved	i hope that parliament will provide its consensus to this report and will therefore ensure that the ec data exchange mechanism created by anybody object this if it is not the case that the proposed procedure is deem to have been approved	/media/hugo/Seagate Expansion Drive/ALICE_BACKUP/voshpde/wav_files/zipfiles/2018012501.wav	0
248	/media/hugo/Seagate Expansion Drive/ALICE_BACKUP/voshpde/pipeLine/segmentation_wavfiles/2018012501/249_2018012501.wav	5643.305623582766	248869778	5666.055623582766	249873053	248_2018012501	mr de and now we go to the vote on the establishing a centralised system for the identification of member states holding conviction information on third khan system i am asking the rapporteur whether wish us to take the fro mr dalton pleas	mr pena now we go to the vote on the establishing a centralised system for the identification of member states holding conviction information on third system i am asking the rapporteur whether wishes to take the frormrdeltonepleas	/media/hugo/Seagate Expansion Drive/ALICE_BACKUP/voshpde/wav_files/zipfiles/2018012501.wav	15
249	/media/hugo/Seagate Expansion Drive/ALICE_BACKUP/voshpde/pipeLine/segmentation_wavfiles/2018012501/250_2018012501.wav	5666.055646258504	249873054	5693.405646258503	251079189	249_2018012501	i would justly very quick chair because i know ever one wants the out to vote just to thank all the shadows for the work they have done on this file i think all the groups have moved a little bit from their initial positions and i think we have got quite a good package of compromises here now so thank you for the work you ave all done and i lookowardmrdetennowletusstagawoldfirst	i hold justly very quick chair because i know ever one wants the out to vote just to thank all the shadows for the work they have done on this file i think all the groups have moved a little bit from their initial positions and i think we have got quite a good package of compromises here now so thank you for the work you ave all done and i lookowardmrdetennowletusstagawoldfirst	/media/hugo/Seagate Expansion Drive/ALICE_BACKUP/voshpde/wav_files/zipfiles/2018012501.wav	2
250	/media/hugo/Seagate Expansion Drive/ALICE_BACKUP/voshpde/pipeLine/segmentation_wavfiles/2018012501/251_2018012501.wav	5693.405668934241	251079190	5719.35566893424	252223585	250_2018012501	on amendment forty seven the vote is open we vote electronically it is easier so please vote the vote is closed it is a de sorry it s rejected i had different amendment hundred and seventeen the vote is open	on amendment forty seven the vote is open we vote electronically it is easier so please vote the vote is closed it is adoplesorry its rejected i had different amendment hundred and seventeen the vote is open	/media/hugo/Seagate Expansion Drive/ALICE_BACKUP/voshpde/wav_files/zipfiles/2018012501.wav	6
251	/media/hugo/Seagate Expansion Drive/ALICE_BACKUP/voshpde/pipeLine/segmentation_wavfiles/2018012501/252_2018012501.wav	5719.355691609977	252223586	5746.805691609978	253434131	251_2018012501	closed de it is rejected ec des it work is there a problem amendment hundred and eighteen the vote is open	lsedpeitsrejectedgetdesit work is there a problem amendment hundred and eighteen the vote is open	/media/hugo/Seagate Expansion Drive/ALICE_BACKUP/voshpde/wav_files/zipfiles/2018012501.wav	12
252	/media/hugo/Seagate Expansion Drive/ALICE_BACKUP/voshpde/pipeLine/segmentation_wavfiles/2018012501/253_2018012501.wav	5746.805714285714	253434132	5773.855714285714	254627037	252_2018012501	rejected amendment hundred and nineteen the votes opened rejected compromise stan the vote is open	rejected amendment hundred and nineteen the votes opened rejected compromise stan the vote is open	/media/hugo/Seagate Expansion Drive/ALICE_BACKUP/voshpde/wav_files/zipfiles/2018012501.wav	0
253	/media/hugo/Seagate Expansion Drive/ALICE_BACKUP/voshpde/pipeLine/segmentation_wavfiles/2018012501/254_2018012501.wav	5773.855736961451	254627038	5793.0057369614515	255471553	253_2018012501	adopted amendment one hundred and twenty one the vote is open rejected amendment one hundred and twenty two the votes open	adopted amendment one hundred and twenty one the vote is open rejected amendment one hundred and twenty two the votes open	/media/hugo/Seagate Expansion Drive/ALICE_BACKUP/voshpde/wav_files/zipfiles/2018012501.wav	0
254	/media/hugo/Seagate Expansion Drive/ALICE_BACKUP/voshpde/pipeLine/segmentation_wavfiles/2018012501/255_2018012501.wav	5793.005759637188	255471554	5818.655759637189	256602719	254_2018012501	us rejected then we go to amendment one hundred and twenty seven the vote is open rejected amendments sixteen the vote is open us	rejected then we go to amendment one hundred and twenty seven the vote is open rejected amendments sixteen the vote is opens	/media/hugo/Seagate Expansion Drive/ALICE_BACKUP/voshpde/wav_files/zipfiles/2018012501.wav	5
255	/media/hugo/Seagate Expansion Drive/ALICE_BACKUP/voshpde/pipeLine/segmentation_wavfiles/2018012501/256_2018012501.wav	5818.655782312925	256602720	5838.205782312925	257464875	255_2018012501	ec compromise on the vote is openledopted we go to amendment seventeen the vote is open	reject compromise on the vote is openledopted we go to amendment seventeen the vote is open	/media/hugo/Seagate Expansion Drive/ALICE_BACKUP/voshpde/wav_files/zipfiles/2018012501.wav	4
256	/media/hugo/Seagate Expansion Drive/ALICE_BACKUP/voshpde/pipeLine/segmentation_wavfiles/2018012501/257_2018012501.wav	5838.205804988662	257464876	5853.555804988662	258141811	256_2018012501	m its rejected amendment hundred and thirty four the vote is open	m its rejected amendment hundred and thirty four the vote is open	/media/hugo/Seagate Expansion Drive/ALICE_BACKUP/voshpde/wav_files/zipfiles/2018012501.wav	0
257	/media/hugo/Seagate Expansion Drive/ALICE_BACKUP/voshpde/pipeLine/segmentation_wavfiles/2018012501/258_2018012501.wav	5853.555827664399	258141812	5876.405827664399	259149497	257_2018012501	rejected amendment hundred and thirty five the vote is open rejected amendment hundred and thirty six the vote is open	rejected amendment hundred and thirty five the vote is open rejected amendment hundred and thirty six the vote is open	/media/hugo/Seagate Expansion Drive/ALICE_BACKUP/voshpde/wav_files/zipfiles/2018012501.wav	0
258	/media/hugo/Seagate Expansion Drive/ALICE_BACKUP/voshpde/pipeLine/segmentation_wavfiles/2018012501/259_2018012501.wav	5876.405850340136	259149498	5897.255850340136	260068983	258_2018012501	rejected amendment eighteen the vote is open lose adopted amendment hundred and thirty seven the vote is opened	rejected amendment eighteen the vote is open adopted amendment hundred and thirty seven the vote is opened	/media/hugo/Seagate Expansion Drive/ALICE_BACKUP/voshpde/wav_files/zipfiles/2018012501.wav	5
259	/media/hugo/Seagate Expansion Drive/ALICE_BACKUP/voshpde/pipeLine/segmentation_wavfiles/2018012501/260_2018012501.wav	5897.255873015873	260068984	5926.905873015873	261376549	259_2018012501	reject amendment hundred and thirty eight the vote is open closed rejected amendment hundred and thirty nine the vote is open closed rjected amendment hundred and forty the vote is open closed	reject amendment hundred and thirty eight the vote is open closed rejected amendment hundred and thirty nine the vote is open closed rjected amendment hundred and forty the vote is open closed	/media/hugo/Seagate Expansion Drive/ALICE_BACKUP/voshpde/wav_files/zipfiles/2018012501.wav	0
260	/media/hugo/Seagate Expansion Drive/ALICE_BACKUP/voshpde/pipeLine/segmentation_wavfiles/2018012501/261_2018012501.wav	5926.90589569161	261376550	5955.65589569161	262644425	260_2018012501	it is adopted amendment one hundred and forty one one hundred and forty two and one hundred and forty three are identical the vote is open us it is adopted amended hundred forty four and one hundred and forty five the vote is open	it is adopted amendment one hundred and forty one one hundred and forty two and one hundred and forty three are identical the vote is open it is adopted amended hundred forty four and one hundred and forty five the vote is open	/media/hugo/Seagate Expansion Drive/ALICE_BACKUP/voshpde/wav_files/zipfiles/2018012501.wav	3
261	/media/hugo/Seagate Expansion Drive/ALICE_BACKUP/voshpde/pipeLine/segmentation_wavfiles/2018012501/262_2018012501.wav	5955.655918367347	262644426	5984.205918367347	263903481	261_2018012501	it adopted then we go we go to amendment compromise two the votes open it adopted amendment hundred and fifty three the votes open	it adopted then we we go to amendment compromise two the votes open it adopted amendment hundred and fifty three the votes open	/media/hugo/Seagate Expansion Drive/ALICE_BACKUP/voshpde/wav_files/zipfiles/2018012501.wav	3
262	/media/hugo/Seagate Expansion Drive/ALICE_BACKUP/voshpde/pipeLine/segmentation_wavfiles/2018012501/263_2018012501.wav	5984.205941043084	263903482	6003.8559410430835	264770047	262_2018012501	it is rejected amendment twenty one the vote is open closed it is adopted we go to amendment one hundred and fifty five the vote is open	it is rejected amendment twenty one the vote is open closed it is adopted we go to amendment one hundred and fifty five the vote is open	/media/hugo/Seagate Expansion Drive/ALICE_BACKUP/voshpde/wav_files/zipfiles/2018012501.wav	0
263	/media/hugo/Seagate Expansion Drive/ALICE_BACKUP/voshpde/pipeLine/segmentation_wavfiles/2018012501/264_2018012501.wav	6003.855963718821	264770048	6030.505963718821	265945313	263_2018012501	vote it is adopted then er sri rejected ec sri i am was looking what falls for the next compromise so we go to amendment one hundred and sixty six the vote is open	vote it is adopted then er sari rejected re ory i am was looking what falls for the next compromise so we go to amendment one hundred and sixty six the vote is open	/media/hugo/Seagate Expansion Drive/ALICE_BACKUP/voshpde/wav_files/zipfiles/2018012501.wav	5
264	/media/hugo/Seagate Expansion Drive/ALICE_BACKUP/voshpde/pipeLine/segmentation_wavfiles/2018012501/265_2018012501.wav	6030.505986394558	265945314	6058.255986394558	267169089	264_2018012501	as they are a de to gal with one hundred and sixty seven your right so we are voting together the vote is open and now closed while we have one more epp voting somebody from the epp hu de i open the vote again please vote amendments one hundred and sixty six and one hundred and sixty seven the vote is open	as they are aditogewithne hundred and sixty seven your right so we are voting together the vote is open and now closed while we have one more epp voting somebody from the epp i open the vote again please vote amendments one hundred and sixty six and one hundred and sixty seven the vote is open	/media/hugo/Seagate Expansion Drive/ALICE_BACKUP/voshpde/wav_files/zipfiles/2018012501.wav	15
265	/media/hugo/Seagate Expansion Drive/ALICE_BACKUP/voshpde/pipeLine/segmentation_wavfiles/2018012501/266_2018012501.wav	6058.256009070295	267169090	6077.806009070295	268031245	265_2018012501	the vote is closed it is adopted ep then we go to amendment hundred and sixty nine the vote is open	the vote is closed it is adopted then we go to amendment hundred and sixty nine the vote is open	/media/hugo/Seagate Expansion Drive/ALICE_BACKUP/voshpde/wav_files/zipfiles/2018012501.wav	3
266	/media/hugo/Seagate Expansion Drive/ALICE_BACKUP/voshpde/pipeLine/segmentation_wavfiles/2018012501/267_2018012501.wav	6077.806031746031	268031246	6103.556031746031	269166821	266_2018012501	leo its rejected compromise eleven the vote is open adopted amendment hundred and seventy two the vote is open	its rejected compromise eleven the vote is open adopted amendment hundred and seventy two the vote is open	/media/hugo/Seagate Expansion Drive/ALICE_BACKUP/voshpde/wav_files/zipfiles/2018012501.wav	4
267	/media/hugo/Seagate Expansion Drive/ALICE_BACKUP/voshpde/pipeLine/segmentation_wavfiles/2018012501/268_2018012501.wav	6103.556054421769	269166822	6125.906054421769	270152457	267_2018012501	it is rejected we go to amendments one hundred and seventy eight the vote is open closeditut and let us rejected amendment twenty five the vote is open	it is rejected we go to amendments one hundred and seventy eight the vote is open closeditut and lit s rejected amendment twenty five the vote is open	/media/hugo/Seagate Expansion Drive/ALICE_BACKUP/voshpde/wav_files/zipfiles/2018012501.wav	2
268	/media/hugo/Seagate Expansion Drive/ALICE_BACKUP/voshpde/pipeLine/segmentation_wavfiles/2018012501/269_2018012501.wav	6125.906077097506	270152458	6154.256077097506	271402693	268_2018012501	it is adopted compromise for the votes opened its adopted we go to amendment one hundred and eighty five the vote is open	it is adopted compromise for the votes opened its adopted we go to amendment one hundred and eighty five the vote is open	/media/hugo/Seagate Expansion Drive/ALICE_BACKUP/voshpde/wav_files/zipfiles/2018012501.wav	0
269	/media/hugo/Seagate Expansion Drive/ALICE_BACKUP/voshpde/pipeLine/segmentation_wavfiles/2018012501/270_2018012501.wav	6154.256099773243	271402694	6179.806099773243	272529449	269_2018012501	reject mon mon hundred and eighty six the votes open closed rejected amendment hundred and eighty seven the votes open closed	reject amondamend hundred and eighty six the votes open closed rejected amendment hundred and eighty seven the votes open closed	/media/hugo/Seagate Expansion Drive/ALICE_BACKUP/voshpde/wav_files/zipfiles/2018012501.wav	5
270	/media/hugo/Seagate Expansion Drive/ALICE_BACKUP/voshpde/pipeLine/segmentation_wavfiles/2018012501/271_2018012501.wav	6179.806122448979	272529450	6200.056122448979	273422475	270_2018012501	its rejected we go to eight hundred and eighty eight the votes open closed it is adopted compromise five the vote is open	its rejected we go to eight hundred and eighty eight the votes open closed it is adopted compromise five the vote is open	/media/hugo/Seagate Expansion Drive/ALICE_BACKUP/voshpde/wav_files/zipfiles/2018012501.wav	0
271	/media/hugo/Seagate Expansion Drive/ALICE_BACKUP/voshpde/pipeLine/segmentation_wavfiles/2018012501/272_2018012501.wav	6200.056145124717	273422476	6227.906145124716	274650661	271_2018012501	ec its adopted amendment hundred and ninety three the votes open its rejected amendment hundred and ninety four the ote is open	it is adopted amendment hundred and ninety three the votes open its rejected amendment hundred and ninety four the ote is open	/media/hugo/Seagate Expansion Drive/ALICE_BACKUP/voshpde/wav_files/zipfiles/2018012501.wav	3
272	/media/hugo/Seagate Expansion Drive/ALICE_BACKUP/voshpde/pipeLine/segmentation_wavfiles/2018012501/273_2018012501.wav	6227.906167800454	274650662	6243.956167800454	275358467	272_2018012501	it is adopted then we go to amendment hundred and ninety nine and two hundred they are identical the votes open leo	it is adopted then we go to amendment hundred and ninety nine and two hundred they are identical the votes open led	/media/hugo/Seagate Expansion Drive/ALICE_BACKUP/voshpde/wav_files/zipfiles/2018012501.wav	1
273	/media/hugo/Seagate Expansion Drive/ALICE_BACKUP/voshpde/pipeLine/segmentation_wavfiles/2018012501/274_2018012501.wav	6243.95619047619	275358468	6264.40619047619	276260313	273_2018012501	adopted amendment two hundred one the vote is open its rejected amendment two hundred and two and two hundred and three the vote is open	adopted amendment two hundred one the vote is open its rejected amendment two hundred and two and two hundred and three the vote is open	/media/hugo/Seagate Expansion Drive/ALICE_BACKUP/voshpde/wav_files/zipfiles/2018012501.wav	0
274	/media/hugo/Seagate Expansion Drive/ALICE_BACKUP/voshpde/pipeLine/segmentation_wavfiles/2018012501/275_2018012501.wav	6264.406213151928	276260314	6289.3562131519275	277360609	274_2018012501	it is adopted amendments two hundred and four and two hundred and five identical the vote is open adopted amendments two hundred and six and two hundred and seven the vote is open	it is adopted amendments two hundred and four and two hundred and five identical the vote is open adopted amendments two hundred and six and two hundred and seven the vote is open	/media/hugo/Seagate Expansion Drive/ALICE_BACKUP/voshpde/wav_files/zipfiles/2018012501.wav	0
275	/media/hugo/Seagate Expansion Drive/ALICE_BACKUP/voshpde/pipeLine/segmentation_wavfiles/2018012501/276_2018012501.wav	6289.356235827664	277360610	6313.206235827664	278412395	275_2018012501	adopted amendment two hundred and eight and two hundred and nine they are identical the votes open adopted amenjer two hundred and ten the votes open	adopted amendment two hundred and eight and two hundred and nine they are identical the votes open adopted amenjer two hundred and ten the votes open	/media/hugo/Seagate Expansion Drive/ALICE_BACKUP/voshpde/wav_files/zipfiles/2018012501.wav	0
276	/media/hugo/Seagate Expansion Drive/ALICE_BACKUP/voshpde/pipeLine/segmentation_wavfiles/2018012501/277_2018012501.wav	6313.206258503401	278412396	6332.656258503402	279270141	276_2018012501	it is adopted amender two hundred and eleven the votes open closed adopted amendment two hundred and twelve the votes open closed	it is adopted amender two hundred and eleven the votes open closed adopted amendment two hundred and twelve the votes open closed	/media/hugo/Seagate Expansion Drive/ALICE_BACKUP/voshpde/wav_files/zipfiles/2018012501.wav	0
277	/media/hugo/Seagate Expansion Drive/ALICE_BACKUP/voshpde/pipeLine/segmentation_wavfiles/2018012501/278_2018012501.wav	6332.656281179138	279270142	6348.306281179139	279960307	277_2018012501	it is rejected we go to amendment two hundred and thirteen the vote is opened	it is rejected we go to amendment two hundred and thirteen the vote is open	/media/hugo/Seagate Expansion Drive/ALICE_BACKUP/voshpde/wav_files/zipfiles/2018012501.wav	2
278	/media/hugo/Seagate Expansion Drive/ALICE_BACKUP/voshpde/pipeLine/segmentation_wavfiles/2018012501/279_2018012501.wav	6348.306303854875	279960308	6373.256303854875	281060603	278_2018012501	it is rejected eu we go to amendment two hundred and fourteen the vote is open lose adopted compromise six be the vote is open closed	it is rejected out we go to amendment two hundred and fourteen the vote is open lose adopted compromise six be the vote is open closed	/media/hugo/Seagate Expansion Drive/ALICE_BACKUP/voshpde/wav_files/zipfiles/2018012501.wav	2
279	/media/hugo/Seagate Expansion Drive/ALICE_BACKUP/voshpde/pipeLine/segmentation_wavfiles/2018012501/280_2018012501.wav	6373.256326530613	281060604	6395.106326530612	282024189	279_2018012501	de compromise six the vote is open de compromise six de the vote is open	compromise six the vote is open compromise six d the vote is open	/media/hugo/Seagate Expansion Drive/ALICE_BACKUP/voshpde/wav_files/zipfiles/2018012501.wav	7
280	/media/hugo/Seagate Expansion Drive/ALICE_BACKUP/voshpde/pipeLine/segmentation_wavfiles/2018012501/281_2018012501.wav	6395.1063492063495	282024190	6415.756349206349	282934855	280_2018012501	closed adopted amendment two hundred and thirty four the vote is open closed it is its rejected amendment two hundred and thirty five the votes open	closed adopted amendment two hundred and thirty four the vote is open closed it is its rejected amendment two hundred and thirty five the votes open	/media/hugo/Seagate Expansion Drive/ALICE_BACKUP/voshpde/wav_files/zipfiles/2018012501.wav	0
