	wavfile	start_seconds	start_frames	end_seconds	end_frames	identifier	inferred_text_with_hotwords	inferred_text_without_hotwords	motherfile	dist
0	/media/hugo/Seagate Expansion Drive/ALICE_BACKUP/voshpde/pipeLine/segmentation_wavfiles/20181011/001_20181011.wav	0.0	0	19.15	919200	000_20181011	and apologies for malateness this morning ad we begin this morning with fifteen on our agenda which is the presentation on the study on criminal procedural law across the union	and apologies for malateness this morning and we begin this morning with fifteen on our agenda which is the presentation on the study on criminal procedural law across the union	/media/hugo/Seagate Expansion Drive/ALICE_BACKUP/voshpde/wav_files/zipfiles/20181011.wav	1
1	/media/hugo/Seagate Expansion Drive/ALICE_BACKUP/voshpde/pipeLine/segmentation_wavfiles/20181011/002_20181011.wav	19.150020833333333	919201	43.10002083333333	2068801	001_20181011	prientascoleaguesmaybe aware article eighty two of the treaty on mutual recognition in criminal matters introduce a legal basis for harmonising certain criminal procedural aspects namely the rights of suspects victims and evidence with the possibility of further expansion this was seen is important for the principle of mutual recognition in criminal matters to drunsmodely	prientascoleaguesmaybe aware article eighty two of the treaty on mutual recognition in criminal matters introduce a legal basis for harmonising certain criminal procedural aspects namely the rights of suspects victims and evidence with the possibility of further expansion this was seen is important for the principle of mutual recognition in criminal matters to drunsmodely	/media/hugo/Seagate Expansion Drive/ALICE_BACKUP/voshpde/wav_files/zipfiles/20181011.wav	0
2	/media/hugo/Seagate Expansion Drive/ALICE_BACKUP/voshpde/pipeLine/segmentation_wavfiles/20181011/003_20181011.wav	43.10004166666667	2068802	70.65004166666667	3391202	002_20181011	this dries mainly with experience of course of the arrest warrant and it shown that certain harmonisation was necessary and that the common ecr minimum minimum was not really enough so the areas as we know is a sensitive one it is criminal procedural rights are often also a national constitutional issue and a matter for eu charter rights	this dries mainly with experience of course of the arrest warrant and it shown that certain harmonisation was necessary and that the common echr minimum minimum was not really enough so the areas as we know is a sensitive one it is criminal procedural rights are often also a national constitutional issue and a matter for eu charter rights	/media/hugo/Seagate Expansion Drive/ALICE_BACKUP/voshpde/wav_files/zipfiles/20181011.wav	1
3	/media/hugo/Seagate Expansion Drive/ALICE_BACKUP/voshpde/pipeLine/segmentation_wavfiles/20181011/004_20181011.wav	70.6500625	3391203	94.3000625	4526403	003_20181011	particularly interesting here is the miloni court of justice case and we will hear more about this and about the directive on information and criminal proceedings introduced on an eu wide basis which is a warning system for suspects	particularly interesting here is the miloni court of justice case and we will hear more about this and about the directive on information and criminal proceedings introduced on an eu wide basis which is a warning system for suspects	/media/hugo/Seagate Expansion Drive/ALICE_BACKUP/voshpde/wav_files/zipfiles/20181011.wav	0
4	/media/hugo/Seagate Expansion Drive/ALICE_BACKUP/voshpde/pipeLine/segmentation_wavfiles/20181011/005_20181011.wav	94.30008333333333	4526404	111.95008333333334	5373604	004_20181011	de we are still in a situation where no harmonisation is taken place in relation to the admissibility of evidence for certain investigative measures and on all of these issues we are going to hear from	we are still in a situation where no harmonisation is taken place in relation to the admissibility of evidence for certain investigative measures and on all of these issues we are going to hear from	/media/hugo/Seagate Expansion Drive/ALICE_BACKUP/voshpde/wav_files/zipfiles/20181011.wav	3
5	/media/hugo/Seagate Expansion Drive/ALICE_BACKUP/voshpde/pipeLine/segmentation_wavfiles/20181011/006_20181011.wav	111.95010416666666	5373605	141.20010416666668	6777605	005_20181011	de to distinguished experts before we give the floor to our members so first we have professor and way em berg and mr eledi seller or two experts and a very warn welcome to both of them to the committee so let us hear first from our our experts ad ad then well open the floor to debate on these important points so first of all professor	to distinguished experts before we give the floor to our members so first we have professor and we em berg and mr eledisellarsour two experts and a very warn welcome to both of them to the committee so let us hear first from our our experts and and then well open the floor to debate on these important points so first of all professor	/media/hugo/Seagate Expansion Drive/ALICE_BACKUP/voshpde/wav_files/zipfiles/20181011.wav	11
6	/media/hugo/Seagate Expansion Drive/ALICE_BACKUP/voshpde/pipeLine/segmentation_wavfiles/20181011/007_20181011.wav	141.200125	6777606	160.450125	7701606	006_20181011	thank you very mr president it is an on an pleasure for elodcl and myself to present briefly our study	thank you very mr president it is an on an pleasure for elodcl and myself to present briefly our study	/media/hugo/Seagate Expansion Drive/ALICE_BACKUP/voshpde/wav_files/zipfiles/20181011.wav	0
7	/media/hugo/Seagate Expansion Drive/ALICE_BACKUP/voshpde/pipeLine/segmentation_wavfiles/20181011/008_20181011.wav	160.45014583333332	7701607	186.90014583333334	8971207	007_20181011	a few words if you allow us to remind you about the background of the study as you know since early nearly twenty years now the process of mutual recognition has been launched in criminal matters process that is based on mutual trust between the various legal systems of the member states	a few words if you allow us to remind you about the background of the study as you know since early nearly twenty years now the process of mutual recognition has been launched in criminal matters process that is based on mutual trust between the various legal systems of the member states	/media/hugo/Seagate Expansion Drive/ALICE_BACKUP/voshpde/wav_files/zipfiles/20181011.wav	0
8	/media/hugo/Seagate Expansion Drive/ALICE_BACKUP/voshpde/pipeLine/segmentation_wavfiles/20181011/009_20181011.wav	186.90016666666668	8971208	204.55016666666666	9818408	008_20181011	much has been written and said about mutual trust multiple goals have been made for eu action to approximate criminal procedures especially the rights of suspects and accused persons	much has been written and said about mutual trust multiple goals have been made for eu action to approximate criminal procedures especially the rights of suspects and accused persons	/media/hugo/Seagate Expansion Drive/ALICE_BACKUP/voshpde/wav_files/zipfiles/20181011.wav	0
9	/media/hugo/Seagate Expansion Drive/ALICE_BACKUP/voshpde/pipeLine/segmentation_wavfiles/20181011/010_20181011.wav	204.5501875	9818409	219.8001875	10550409	009_20181011	the entry into force of the lisbon treaty constituted a real turning point in this respect it aradatamove towards a values based approach	the entry into force of the lisbon treaty constituted a real turning point in this respect it aradatamove towards a values based approach	/media/hugo/Seagate Expansion Drive/ALICE_BACKUP/voshpde/wav_files/zipfiles/20181011.wav	0
10	/media/hugo/Seagate Expansion Drive/ALICE_BACKUP/voshpde/pipeLine/segmentation_wavfiles/20181011/011_20181011.wav	219.80020833333333	10550410	242.55020833333333	11642410	010_20181011	and in this respect the adoption of seven directives was particularly symptomatic namely those adopted in the field of translation and interpretation letter of rights access to a lawyer presumption of innocence legal aid safeguards for children right support and protection of victims of crime	and in this respect the adoption of seven directives was particularly symptomatic namely those adopted in the field of translation and interpretation letter of rights access to a lawyer presumption of innocence legal aid safeguards for children right support and protection of victims of crime	/media/hugo/Seagate Expansion Drive/ALICE_BACKUP/voshpde/wav_files/zipfiles/20181011.wav	0
11	/media/hugo/Seagate Expansion Drive/ALICE_BACKUP/voshpde/pipeLine/segmentation_wavfiles/20181011/012_20181011.wav	242.55022916666667	11642411	263.80022916666667	12662411	011_20181011	in this context the purpose of the study was to go beyond the reom of procedural rights where approximation had been launched we considered it indeed premature to recommend a revision of the seven directives we just mentioned	in this context the purpose of the study was to go beyond the reom of procedural rights where approximation had been launched we considered it indeed premature to recommend a revision of the seven directives we just mentioned	/media/hugo/Seagate Expansion Drive/ALICE_BACKUP/voshpde/wav_files/zipfiles/20181011.wav	0
12	/media/hugo/Seagate Expansion Drive/ALICE_BACKUP/voshpde/pipeLine/segmentation_wavfiles/20181011/013_20181011.wav	263.80025	12662412	291.25025	13980012	012_20181011	the study aimed at identifying de areas of criminal procedure in which differences between national laws affect cross border cooperation on the ground or the negotiation or adoption of eu instruments aiming at strengthening cooperation in cross border cases	the study aimed at identifying the areas of criminal procedure in which differences between national laws affect cross border cooperation on the ground or the negotiation or adoption of eu instruments aiming at strengthening cooperation in cross border cases	/media/hugo/Seagate Expansion Drive/ALICE_BACKUP/voshpde/wav_files/zipfiles/20181011.wav	2
13	/media/hugo/Seagate Expansion Drive/ALICE_BACKUP/voshpde/pipeLine/segmentation_wavfiles/20181011/014_20181011.wav	291.25027083333333	13980013	320.80027083333334	15398413	013_20181011	in terms of methodology we followed a comparative legal approach on the basis of a representative sample of nine member states belonging to tree different legal traditions namely inquisitorial accusatorial and mixed and geographically diverse these nine member states selected where france spain stinland	in terms of methodology we followed a comparative legal approach on the basis of a representative sample of nine member states belonging to tree different legal traditions namely inquisitorial accusatorial and mixed and geographically diverse these nine member states selected where france spain stinland	/media/hugo/Seagate Expansion Drive/ALICE_BACKUP/voshpde/wav_files/zipfiles/20181011.wav	0
14	/media/hugo/Seagate Expansion Drive/ALICE_BACKUP/voshpde/pipeLine/segmentation_wavfiles/20181011/015_20181011.wav	320.8002916666667	15398414	349.65029166666665	16783214	014_20181011	ireland the netherlands italy germany romania and hungary the analysis was based on de research on nine national reports and on interviews of experts in eu institutions in eu agencies and bodies as well as interviews of national officials	ireland the netherlands italy germany romania and hungary the analysis was based on des research on nine national reports and on interviews of experts in eu institutions in eu agencies and bodies as well as interviews of national officials	/media/hugo/Seagate Expansion Drive/ALICE_BACKUP/voshpde/wav_files/zipfiles/20181011.wav	1
15	/media/hugo/Seagate Expansion Drive/ALICE_BACKUP/voshpde/pipeLine/segmentation_wavfiles/20181011/016_20181011.wav	349.6503125	16783215	376.4003125	18067215	015_20181011	as a result we identified nine de mains where differences between national criminal procedures hinder the negotiations and operation of cross border cooperation instruments in criminal matters including the european public prosecution office we understood broadly the term hindrance	as a result we identified nine domains where differences between national criminal procedures hinder the negotiations and operation of cross border cooperation instruments in criminal matters including the european public prosecution office we understood broadly the term hindrance	/media/hugo/Seagate Expansion Drive/ALICE_BACKUP/voshpde/wav_files/zipfiles/20181011.wav	2
16	/media/hugo/Seagate Expansion Drive/ALICE_BACKUP/voshpde/pipeLine/segmentation_wavfiles/20181011/017_20181011.wav	376.4003333333333	18067216	402.95033333333333	19341616	016_20181011	we indeed examined impaments to effective operation of cooperation mechanisms but also impments to the protection of human rights and consequently to mutual trust de nine the mains identify are the following investigative measures admissibility of unlawfully gathered evidence	we indeed examined impaments to effective operation of cooperation mechanisms but also impments to the protection of human rights and consequently to mutual trust de nine the mains identify are the following investigative measures admissibility of unlawfully gathered evidence	/media/hugo/Seagate Expansion Drive/ALICE_BACKUP/voshpde/wav_files/zipfiles/20181011.wav	0
17	/media/hugo/Seagate Expansion Drive/ALICE_BACKUP/voshpde/pipeLine/segmentation_wavfiles/20181011/018_20181011.wav	402.95035416666667	19341617	430.8003541666667	20678417	017_20181011	the quality of arms during transnational investigations pretrial detention detention conditions after these well know decision by the court of justice is the arhanusi and kaldahahucase inabsentat trials compensation for unjustified detention compensation for victims and protection measures for victims	the quality of arms during transnational investigations pretrial detention detention conditions after these well know decision by the court of justice is the arhanusi and kaldahahucase inabsentat trials compensation for unjustified detention compensation for victims and protection measures for victims	/media/hugo/Seagate Expansion Drive/ALICE_BACKUP/voshpde/wav_files/zipfiles/20181011.wav	0
18	/media/hugo/Seagate Expansion Drive/ALICE_BACKUP/voshpde/pipeLine/segmentation_wavfiles/20181011/019_20181011.wav	430.800375	20678418	457.950375	21981618	018_20181011	before going briefly true nearly each of these domains we would like to stress that the study was quite challenging in terms of its ambitions scope and time frame this explain that it is of course not to be considered as exalted	before going briefly true nearly each of these domains we would like to stress that the study was quite challenging in terms of its ambitions scope and time frame this explain that it is of course not to be considered as exalted	/media/hugo/Seagate Expansion Drive/ALICE_BACKUP/voshpde/wav_files/zipfiles/20181011.wav	0
19	/media/hugo/Seagate Expansion Drive/ALICE_BACKUP/voshpde/pipeLine/segmentation_wavfiles/20181011/020_20181011.wav	457.95039583333335	21981619	484.3003958333333	23246419	019_20181011	now continue with the three first domains we identify thank you very much mr president morning to you or to the first area of tension that we a dontifoind is investigative measures we focused quite a lot on evidence law because of the intense legislative activity in this field over the past few years and also the negotiation on the e evidence regulation	now continue with the three first domains we identify thank you very much mr president morning to you or to the first area of tension that we a dontifoind is investigative measures we focused quite a lot on evidence law because of the intense legislative activity in this field over the past few years and also the negotiation on the e evidence regulation	/media/hugo/Seagate Expansion Drive/ALICE_BACKUP/voshpde/wav_files/zipfiles/20181011.wav	0
20	/media/hugo/Seagate Expansion Drive/ALICE_BACKUP/voshpde/pipeLine/segmentation_wavfiles/20181011/021_20181011.wav	484.30041666666665	23246420	502.05041666666665	24098420	020_20181011	so the first difference that we the first set of differences that we are identified as regards investigative measure is the degree of involvement of administrative authorities in some cases for example member states rely on intelligence agencies during the investigation	so the first difference that we the first set of differences that we are identified as regards investigative measure is the degree of involvement of administrative authorities in some cases for example member states rely on intelligence agencies during the investigation	/media/hugo/Seagate Expansion Drive/ALICE_BACKUP/voshpde/wav_files/zipfiles/20181011.wav	0
21	/media/hugo/Seagate Expansion Drive/ALICE_BACKUP/voshpde/pipeLine/segmentation_wavfiles/20181011/022_20181011.wav	502.0504375	24098421	522.8004375	25094421	021_20181011	then comes the question of who takes to lead in the investigation in some countries it is the police that take centre stage in in other country as it is a prosecutor and in eu third batch of cantrys it is the judge ad then comes the issue of gorsiv investigative measures there is no common definition of what constitutes accorsive investigative measures	then comes the question of who takes to lead in the investigation in some countries it is the police that take centre stage in in other country as it is a prosecutor and in a third batch of cantrys it is the judge and then comes the issue of gorsiv investigative measures there is no common definition of what constitutes accorsive investigative measures	/media/hugo/Seagate Expansion Drive/ALICE_BACKUP/voshpde/wav_files/zipfiles/20181011.wav	3
22	/media/hugo/Seagate Expansion Drive/ALICE_BACKUP/voshpde/pipeLine/segmentation_wavfiles/20181011/023_20181011.wav	522.8004583333334	25094422	549.5504583333334	26378422	022_20181011	mr president there is no common threshold to to deploy an investigation and there is no come on procedures for the requirement of judicial authorisation in terms of impact the fact that we have a lot of different competent authorities to be involved in investigations prepared the eu legislature to burden the number of actors involved in investigation so as to inclearalso non judicial actors	mr president there is no common threshold to to deploy an investigation and there is no come on procedures for the requirement of judicial authorisation in terms of impact the fact that we have a lot of different competent authorities to be involved in investigations prepared the eu legislature to burden the number of actors involved in investigation so as to inclearalso non judicial actors	/media/hugo/Seagate Expansion Drive/ALICE_BACKUP/voshpde/wav_files/zipfiles/20181011.wav	0
23	/media/hugo/Seagate Expansion Drive/ALICE_BACKUP/voshpde/pipeLine/segmentation_wavfiles/20181011/024_20181011.wav	549.5504791666667	26378423	571.2004791666667	27417623	023_20181011	but even there even to get there negotiations were quite complex and some of the originally ambition ambitious measures foreseen in the proposals were watered down after a couple of years of negotiations this is a case in the ep for example we moved from a single investigation office through a very decentralised structure	but even there even to get there negotiations were quite complex and some of the originally ambition ambitious measures foreseen in the proposals were watered down after a couple of years of negotiations this is a case in the ep for example we moved from a single investigation office through a very decentralised structure	/media/hugo/Seagate Expansion Drive/ALICE_BACKUP/voshpde/wav_files/zipfiles/20181011.wav	0
24	/media/hugo/Seagate Expansion Drive/ALICE_BACKUP/voshpde/pipeLine/segmentation_wavfiles/20181011/025_20181011.wav	571.2005	27417624	598.2505	28716024	024_20181011	in practical terms the fact that we have a multiplicity of authorities involved also create home issues for the member states to identify the competent authority to address an invexitiation request in terms of in terms of fundamental rights the fact that we have both administrative and criminal law actors involved in the same cooperation framework also creates a blur	in practical terms the fact that we have a multiplicity of authorities involved also create em issues for the member states to identify the competent authority to address an invexitiation request in terms of in terms of fundamental rights the fact that we have both administrative and criminal law actors involved in the same cooperation framework also creates a blur	/media/hugo/Seagate Expansion Drive/ALICE_BACKUP/voshpde/wav_files/zipfiles/20181011.wav	3
25	/media/hugo/Seagate Expansion Drive/ALICE_BACKUP/voshpde/pipeLine/segmentation_wavfiles/20181011/026_20181011.wav	598.2505208333333	28716025	626.5005208333333	30072025	025_20181011	between administrative law and criminal law which is extremely damaging can be extremely damaging to fundamental rights be cars individuals do not really know which coind of safeguards may apply or these are the administrative law safeguards applying or a the criminal law safeguards applying bearing in mind that procedural safeguards in criminal law are much more robbers and much more solid than in administrative law	between administrative law and criminal law which is extremely damaging can be extremely damaging to fundamental rights be cars individuals do not really know which coind of safeguards may apply or these are the administrative law safeguards applying or a the criminal law safeguards applying bearing in mind that procedural safeguards in criminal law are much more robbers and much more solid than in administrative law	/media/hugo/Seagate Expansion Drive/ALICE_BACKUP/voshpde/wav_files/zipfiles/20181011.wav	0
26	/media/hugo/Seagate Expansion Drive/ALICE_BACKUP/voshpde/pipeLine/segmentation_wavfiles/20181011/027_20181011.wav	626.5005416666667	30072026	644.1505416666666	30919226	026_20181011	de the secondary of concern is evidence admissibility refocused exclusively on an lawfully gavered evidence for which there is no overarching eu rule which also means that admissibility regimes are extremely different among the member states	the secondary of concern is evidence admissibility refocused exclusively on an lawfully gavered evidence for which there is no overarching eu rule which also means that admissibility regimes are extremely different among the member states	/media/hugo/Seagate Expansion Drive/ALICE_BACKUP/voshpde/wav_files/zipfiles/20181011.wav	3
27	/media/hugo/Seagate Expansion Drive/ALICE_BACKUP/voshpde/pipeLine/segmentation_wavfiles/20181011/028_20181011.wav	644.1505625	30919227	671.5005625	32232027	027_20181011	some member states have exclusionary rules so for example evidence gathered through torture will be automatically excluded from the case file and some other member states rely on the discretion of the judge so it is up ted a judge to decide whether evidence will be kept or not in the case file in terms of legislative impact because we have no eu rule the eu relies on a two two level system	some member states have exclusionary rules so for example evidence gathered through torture will be automatically excluded from the case file and some other member states rely on the discretion of the judge so it is up ted a judge to decide whether evidence will be kept or not in the case file in terms of legislative impact because we have no eu rule the eu relies on a two two level system	/media/hugo/Seagate Expansion Drive/ALICE_BACKUP/voshpde/wav_files/zipfiles/20181011.wav	0
28	/media/hugo/Seagate Expansion Drive/ALICE_BACKUP/voshpde/pipeLine/segmentation_wavfiles/20181011/029_20181011.wav	671.5005833333333	32232028	687.9505833333334	33021628	028_20181011	depending on the instruments at stake so for example for joint investigation teams and for the epp it is the law of the requested slash executing states that applies meaning it is the state of investigation	depending on the instruments at stake so for example for joint investigation teams and for the ep it is the law of the requested slash executing states that applies meaning it is the state of investigation	/media/hugo/Seagate Expansion Drive/ALICE_BACKUP/voshpde/wav_files/zipfiles/20181011.wav	1
29	/media/hugo/Seagate Expansion Drive/ALICE_BACKUP/voshpde/pipeLine/segmentation_wavfiles/20181011/030_20181011.wav	687.9506041666667	33021629	716.8006041666666	34406429	029_20181011	and for the eu directive for example it is the law of the requesting slash issuing state that apployes which is also the trial state which makes it extremely complicated for example if your in the eu directive and your conduct eu investigation to understand the formalities and the procedures to be followed which exists in the trial state and if you are the trial state it is very difficult to check how the investigation was gathered so what did the member states do they simply decided not to check eu	and for the eia directive for example it is the law of the requesting slash issuing state that apployes which is also the trial state which makes it extremely complicated for example if your in the eu directive and your conductecuninvestigation tounderstand the formalities and the procedures to be followed which exists in the trial state and if you are the trial state it is very difficult to check how the investigation was gathered so what did the member states do they simply decided not to check you	/media/hugo/Seagate Expansion Drive/ALICE_BACKUP/voshpde/wav_files/zipfiles/20181011.wav	8
