	wavfile	start_seconds	start_frames	end_seconds	end_frames	identifier	inferred_text_with_hotwords	inferred_text_without_hotwords	motherfile	dist
244	/media/hugo/Seagate Expansion Drive/ALICE_BACKUP/voshpde/pipeLine/segmentation_wavfiles/20181015/245_20181015.wav	5500.205083333333	264009844	5516.455083333333	264789844	244_20181015	last but not least the rapporteur aligns the data protection regime with existing legislation in order to avoid the creation of new regimes these was the statement that mr rato prepared and he just wanted to mee to share as well that any common eu	last but not least the rapporteur aligns the data protection regime with existing legislation in order to avoid the creation of new regimes these was the statement that mr rato prepared and he just wanted to mee to share as well that any common	/media/hugo/Seagate Expansion Drive/ALICE_BACKUP/voshpde/wav_files/zipfiles/20181015.wav	3
245	/media/hugo/Seagate Expansion Drive/ALICE_BACKUP/voshpde/pipeLine/segmentation_wavfiles/20181015/246_20181015.wav	5516.455104166666	264789845	5544.205104166666	266121845	245_20181015	that colleagues may have will of course be passed on to him and he is looking forward to working with all the shadows and colleagues on this file and the deadline for the amendments has been set on the nineteen october so thank you very much for your attention next speak is on behalf of	that colleagues may have will of course be passed on to him and he is looking forward to working with all the shadows and colleagues on this file and the deadline for the amendments has been set on the nineteen october so thank you very much for your attention next speak is on behalf of	/media/hugo/Seagate Expansion Drive/ALICE_BACKUP/voshpde/wav_files/zipfiles/20181015.wav	0
246	/media/hugo/Seagate Expansion Drive/ALICE_BACKUP/voshpde/pipeLine/segmentation_wavfiles/20181015/247_20181015.wav	5544.205125	266121846	5568.655125	267295446	246_20181015	mr president first of all on behalf of miskinichi allow me to apologise for her absence because she she has been hand back by previously sheduled institutional commitments in italy but i would like to thank the rapporteur for the excellent report presented and she expresses also her appreciation to the ideas that have been introduced in the text	mr president first of all on behalf of miskinichi allow me to apologise for her absence because she she has been hand back by previously sheduled institutional commitments in italy but i would like to thank the rapporteur for the excellent report presented and she expresses also her appreciation to the ideas that have been introduced in the text	/media/hugo/Seagate Expansion Drive/ALICE_BACKUP/voshpde/wav_files/zipfiles/20181015.wav	0
247	/media/hugo/Seagate Expansion Drive/ALICE_BACKUP/voshpde/pipeLine/segmentation_wavfiles/20181015/248_20181015.wav	5568.655145833333	267295447	5586.605145833333	268157047	247_20181015	like the majority of the colleagues she fully agrees with the objectives of the proposal and in particular the aim of facilitating and easier exchange of information between national financial intelligence units law enforcement authorities and also europol	like the majority of the colleagues she fully agrees with the objectives of the proposal and in particular the aim of facilitating and easier exchange of information between national financial intelligence units law enforcement authorities and also europol	/media/hugo/Seagate Expansion Drive/ALICE_BACKUP/voshpde/wav_files/zipfiles/20181015.wav	0
248	/media/hugo/Seagate Expansion Drive/ALICE_BACKUP/voshpde/pipeLine/segmentation_wavfiles/20181015/249_20181015.wav	5586.605166666666	268157048	5614.355166666666	269489048	248_20181015	indeed given the transnational nature of many crimes it is key to ensure timely access to information on bank accounts of individuals suspected of having committed serious crimes during the coming weeks mskinichi will commit herself to find the right balance between the responsibilities of each agency and institution in order to achieve a more effective prosecution of such offences	indeed given the transnational nature of many crimes it is key to ensure timely access to information on bank accounts of individuals suspected of having committed serious crimes during the coming weeks mskinichi will commit herself to find the right balance between the responsibilities of each agency and institution in order to achieve a more effective prosecution of such offences	/media/hugo/Seagate Expansion Drive/ALICE_BACKUP/voshpde/wav_files/zipfiles/20181015.wav	0
249	/media/hugo/Seagate Expansion Drive/ALICE_BACKUP/voshpde/pipeLine/segmentation_wavfiles/20181015/250_20181015.wav	5614.3551875	269489049	5631.9051875	270331449	249_20181015	in this context miskinichi appreciates that the rapporteur introduced some provisions aimed at protecting and guaranteeing the independence of a fi use by proposing that files should receive adequate feedback on the financial information exchange	in this context miskinichi appreciates that the rapporteur introduced some provisions aimed at protecting and guaranteeing the independence of a fi use by proposing that files should receive adequate feedback on the financial information exchange	/media/hugo/Seagate Expansion Drive/ALICE_BACKUP/voshpde/wav_files/zipfiles/20181015.wav	0
250	/media/hugo/Seagate Expansion Drive/ALICE_BACKUP/voshpde/pipeLine/segmentation_wavfiles/20181015/251_20181015.wav	5631.905208333334	270331450	5651.055208333333	271250650	250_20181015	she intends to present several amendments aimed at strengthening guarantees to protect the protection of personal data as suggested by the european data protection supervisor in particular she believes that is fundamental to provide adequate training for staff dealing with sensitive personal data	she intends to present several amendments aimed at strengthening guarantees to protect the protection of personal data as suggested by the european data protection supervisor in particular she believes that is fundamental to provide adequate training for staff dealing with sensitive personal data	/media/hugo/Seagate Expansion Drive/ALICE_BACKUP/voshpde/wav_files/zipfiles/20181015.wav	0
251	/media/hugo/Seagate Expansion Drive/ALICE_BACKUP/voshpde/pipeLine/segmentation_wavfiles/20181015/252_20181015.wav	5651.055229166666	271250651	5679.205229166667	272601851	251_20181015	miskinecua will also amend the paragraph concerning the terms under which the fis will have to respond to requests for information as well as the provisions that will regulate relations with europol she believes that ius independence and autonomy must be fully protected as provided by the fifth antimoney laundering directive at the same time she shares the idea that exchange of information with europol and fuse of other member states must be strengthened	miskinecua will also amend the paragraph concerning the terms under which the fis will have to respond to requests for information as well as the provisions that will regulate relations with europol she believes that ius independence and autonomy must be fully protected as provided by the fifth antimoney laundering directive at the same time she shares the idea that exchange of information with europol and fuse of other member states must be strengthened	/media/hugo/Seagate Expansion Drive/ALICE_BACKUP/voshpde/wav_files/zipfiles/20181015.wav	0
252	/media/hugo/Seagate Expansion Drive/ALICE_BACKUP/voshpde/pipeLine/segmentation_wavfiles/20181015/253_20181015.wav	5679.20525	272601852	5696.15525	273415452	252_20181015	in particular miskinechi believes that the purpose according to ach europol may request information from fius should be clearly defined there should be rules listing appropriate exceptions to this requirement especially in case a request could jeopardise ongoing investigation	in particular miskinechi believes that the purpose according to ach europol may request information from fius should be clearly defined there should be rules listing appropriate exceptions to this requirement especially in case a request could jeopardise ongoing investigation	/media/hugo/Seagate Expansion Drive/ALICE_BACKUP/voshpde/wav_files/zipfiles/20181015.wav	0
253	/media/hugo/Seagate Expansion Drive/ALICE_BACKUP/voshpde/pipeLine/segmentation_wavfiles/20181015/254_20181015.wav	5696.155270833333	273415453	5718.105270833334	274469053	253_20181015	in the framework of the exchange of information which europol it is also necessary to ensure appropriate coordination with the national authorities responsible for public security to notify any request for information in particular miskineio believes that the deadlines said by the commission for fa used respond to requests for information	in the framework of the exchange of information which europol it is also necessary to ensure appropriate coordination with the national authorities responsible for public security to notify any request for information in particular miskineio believes that the deadlines said by the commission for fa used respond to requests for information	/media/hugo/Seagate Expansion Drive/ALICE_BACKUP/voshpde/wav_files/zipfiles/20181015.wav	0
254	/media/hugo/Seagate Expansion Drive/ALICE_BACKUP/voshpde/pipeLine/segmentation_wavfiles/20181015/255_20181015.wav	5718.105291666667	274469054	5747.155291666667	275863454	254_20181015	should be slightly extended in order not to create bureaucratic burdens for national values or negatively affect the quality of the information exchanged and lastly eu wants to underline that a reflection must be made about the definitions of the crimes according to a europol can request information with a view to optimising the resources available within the fauesthankslot	should be slightly extended in order not to create bureaucratic burdens for national efaues or negatively affect the quality of the information exchanged and lastly she wants to underline that a reflection must be made about the definitions of the crimes according to a europol can request information with a view to optimising the resources available within the fauesthankslot	/media/hugo/Seagate Expansion Drive/ALICE_BACKUP/voshpde/wav_files/zipfiles/20181015.wav	6
255	/media/hugo/Seagate Expansion Drive/ALICE_BACKUP/voshpde/pipeLine/segmentation_wavfiles/20181015/256_20181015.wav	5747.1553125	275863455	5774.5053125	277176255	255_20181015	mr president colleagues i would like to first thank the rapporteur for the draft report on this very important issue at first sight i believe this report is well balanced and acknowledges the fius reality as that exist today	mr president colleagues i would like to first thank the rapporteur for the draft report on this very important issue at first sight i believe this report is well balanced and acknowledges the fius reality as that exist today	/media/hugo/Seagate Expansion Drive/ALICE_BACKUP/voshpde/wav_files/zipfiles/20181015.wav	0
256	/media/hugo/Seagate Expansion Drive/ALICE_BACKUP/voshpde/pipeLine/segmentation_wavfiles/20181015/257_20181015.wav	5774.5053333333335	277176256	5802.455333333333	278517856	256_20181015	the criminal groups and terrorists operate across different member states and also locate their assets including bank accounts across the eu and even outside of it the use modern technology to transfer money between several bank accounts and between different currencies an extremely fast pace in the fight against financial crimes fis have in tremendously important role	the criminal groups and terrorists operate across different member states and also locate their assets including bank accounts across the eu and even outside of it the use modern technology to transfer money between several bank accounts and between different currencies an extremely fast pace in the fight against financial crimes fis have in tremendously important role	/media/hugo/Seagate Expansion Drive/ALICE_BACKUP/voshpde/wav_files/zipfiles/20181015.wav	0
257	/media/hugo/Seagate Expansion Drive/ALICE_BACKUP/voshpde/pipeLine/segmentation_wavfiles/20181015/258_20181015.wav	5802.455354166666	278517857	5827.105354166667	279701057	257_20181015	it is therefore essential that their role is not altered unless it is necessary i believe that we must not affect the operational independence and autonomy of the fis they must be able to maintain the capacity to carry out their functions freely this includes taking autonomous decisions to analyse request and disseminate specific information	it is therefore essential that their role is not altered unless it is necessary i believe that we must not affect the operational independence and autonomy of the fis they must be able to maintain the capacity to carry out their functions freely this includes taking autonomous decisions to analyse request and disseminate specific information	/media/hugo/Seagate Expansion Drive/ALICE_BACKUP/voshpde/wav_files/zipfiles/20181015.wav	0
258	/media/hugo/Seagate Expansion Drive/ALICE_BACKUP/voshpde/pipeLine/segmentation_wavfiles/20181015/259_20181015.wav	5827.105375	279701058	5855.855375	281081058	258_20181015	additionally i believe that in obligation for cooperation between the fius does contribute to a more timely response to financial information requests finally i acknowledge the strong band between europol and the fius but have doubt on a compulsory response for the fius when this good hamper an ongoing investigation as you can see we have a lot to discuss and i am looking forward to doing so ana	additionally i believe that in obligation for cooperation between the fius does contribute to a more timely response to financial information requests finally i acknowledge the strong band between europol and the fius but have doubt on a compulsory response for the fius when this good hamper an ongoing investigation as you can see we have a lot to discuss and i am looking forward to doing so	/media/hugo/Seagate Expansion Drive/ALICE_BACKUP/voshpde/wav_files/zipfiles/20181015.wav	4
259	/media/hugo/Seagate Expansion Drive/ALICE_BACKUP/voshpde/pipeLine/segmentation_wavfiles/20181015/260_20181015.wav	5855.855395833333	281081059	5876.805395833333	282086659	259_20181015	mr president i am first of all welcoming this proposal as it is in line with our group priority or better exchanging information to fight terrorism and organised crime	mr president i am first of all welcoming this proposal as it is in line with our group priority or better exchanging information to fight terrorism and organised crime	/media/hugo/Seagate Expansion Drive/ALICE_BACKUP/voshpde/wav_files/zipfiles/20181015.wav	0
260	/media/hugo/Seagate Expansion Drive/ALICE_BACKUP/voshpde/pipeLine/segmentation_wavfiles/20181015/261_20181015.wav	5876.805416666667	282086660	5902.855416666666	283337060	260_20181015	mr president the proposal improved information a change at national level only the change at european level is still dealt with through the eu network managed by europol we think that this directive should be the occasion to establish the european fu along standing green efa request	mr president the proposal improved information a change at national level only the change at european level is still dealt with through the network managed by europol we think that this directive should be the occasion to establish the european fu along standing green efa request	/media/hugo/Seagate Expansion Drive/ALICE_BACKUP/voshpde/wav_files/zipfiles/20181015.wav	3
261	/media/hugo/Seagate Expansion Drive/ALICE_BACKUP/voshpde/pipeLine/segmentation_wavfiles/20181015/262_20181015.wav	5902.8554375	283337061	5929.0054375	284592261	261_20181015	and we should transform the fu net into a more ambitious eu fu with more resources to better coordinate a change of information between us we do not believe that the european fu should receive the suspicious transaction messages but that we should be an organ of control and coordination	and we should transform the fu net into a more ambitious eu fu with more resources to better coordinate a change of information between us we do not believe that the european fu should receive the suspicious transaction messages but that we should be an organ of control and coordination	/media/hugo/Seagate Expansion Drive/ALICE_BACKUP/voshpde/wav_files/zipfiles/20181015.wav	0
262	/media/hugo/Seagate Expansion Drive/ALICE_BACKUP/voshpde/pipeLine/segmentation_wavfiles/20181015/263_20181015.wav	5929.005458333333	284592262	5946.855458333333	285449062	262_20181015	there is an issue of data protection in this proposal several articles or the proposal authorise the processing of sensitive data raise sexual orientation religusebuwse under specific circumstances	there is an issue of data protection in this proposal several articles or the proposal authorise the processing of sensitive data raise sexual orientation religusebuwse under specific circumstances	/media/hugo/Seagate Expansion Drive/ALICE_BACKUP/voshpde/wav_files/zipfiles/20181015.wav	0
263	/media/hugo/Seagate Expansion Drive/ALICE_BACKUP/voshpde/pipeLine/segmentation_wavfiles/20181015/264_20181015.wav	5946.855479166667	285449063	5976.605479166667	286877063	263_20181015	we do not want a lix specialis law here that would derogate from the general data protection regulation and the police directive directive two thousand and sixteen six hundred and eighty already provide the relevant safeguards for processing sensitive data and the proposal should refer to it it welcome i also welcome the changes in this direction in the draft report of the rapporteur	we do not want a lix specialis law here that would derogate from the general data protection regulation and the police directive directive two thousand and sixteen six hundred and eighty already provide the relevant safeguards for processing sensitive data and the proposal should refer to it it welcome i also welcome the changes in this direction in the draft report of the rapporteur	/media/hugo/Seagate Expansion Drive/ALICE_BACKUP/voshpde/wav_files/zipfiles/20181015.wav	0
264	/media/hugo/Seagate Expansion Drive/ALICE_BACKUP/voshpde/pipeLine/segmentation_wavfiles/20181015/265_20181015.wav	5976.6055	286877064	6001.6555	288079464	264_20181015	on the new obligation for the eva use to reply to request for information here we need to have an open discussion we should push for the swiftest exchange of information as possible between eva use and competent authorities without giopadising the fuse functioning and independent	on the new obligation for the fuse to reply to request for information here we need to have an open discussion we should push for the swiftest exchange of information as possible between fuse and competent authorities without giopadising the fuse functioning and independence	/media/hugo/Seagate Expansion Drive/ALICE_BACKUP/voshpde/wav_files/zipfiles/20181015.wav	10
265	/media/hugo/Seagate Expansion Drive/ALICE_BACKUP/voshpde/pipeLine/segmentation_wavfiles/20181015/266_20181015.wav	6001.655520833333	288079465	6022.005520833333	289056265	265_20181015	several fas are not in favour of this new obligation because it could threaten their independence and hamper their current functioning we could think of an alternative that could be to oblige the fuse to proper properly motivate a eu	several fas are not in favour of this new obligation because it could threaten their independence and hamper their current functioning we could think of an alternative that could be to oblige the fuse to proper properly motivate a refuel	/media/hugo/Seagate Expansion Drive/ALICE_BACKUP/voshpde/wav_files/zipfiles/20181015.wav	4
266	/media/hugo/Seagate Expansion Drive/ALICE_BACKUP/voshpde/pipeLine/segmentation_wavfiles/20181015/267_20181015.wav	6022.005541666666	289056266	6045.155541666667	290167466	266_20181015	instead of obliging them to exchange information in all cases but we need to access all the options carefully so i am looking forward to continue working on this important proposal and to find the best possible solution for improving the fight against criminal offences and terrorist financing	instead of obliging them to exchange information in all cases but we need to access all the options carefully so i am looking forward to continue working on this important proposal and to find the best possible solution for improving the fight against criminal offences and terrorist financing	/media/hugo/Seagate Expansion Drive/ALICE_BACKUP/voshpde/wav_files/zipfiles/20181015.wav	0
267	/media/hugo/Seagate Expansion Drive/ALICE_BACKUP/voshpde/pipeLine/segmentation_wavfiles/20181015/268_20181015.wav	6045.1555625	290167467	6067.4055625	291235467	267_20181015	for the id group replacing mor timpatesanrr president first of all apologies for mr	for the id group replacing mor timpatesanrr president first of all apologies for mr	/media/hugo/Seagate Expansion Drive/ALICE_BACKUP/voshpde/wav_files/zipfiles/20181015.wav	0
268	/media/hugo/Seagate Expansion Drive/ALICE_BACKUP/voshpde/pipeLine/segmentation_wavfiles/20181015/269_20181015.wav	6067.405583333333	291235468	6087.255583333334	292188268	268_20181015	being here today unfortunately his asked to send apologies eu first of all like to thank the rapporteur for the work done he states that de satisfied that the conflict of competence between the committees has been	being here today unfortunately his asked to send apologies he first of all like to thank the rapporteur for the work done he states that de satisfied that the conflict of competence between the committees has been	/media/hugo/Seagate Expansion Drive/ALICE_BACKUP/voshpde/wav_files/zipfiles/20181015.wav	2
269	/media/hugo/Seagate Expansion Drive/ALICE_BACKUP/voshpde/pipeLine/segmentation_wavfiles/20181015/270_20181015.wav	6087.255604166667	292188269	6115.405604166666	293539469	269_20181015	settled now that we can get to work he underlines that the use of financial information to fight against certain times of crimes is essential and we have to ensure that cooperation and exchange of information between the member states is possible whilst ensuring full respect of personal data or shadow	settled now that we can get to work he underlines that the use of financial information to fight against certain times of crimes is essential and we have to ensure that cooperation and exchange of information between the member states is possible whilst ensuring full respect of personal data or shadow	/media/hugo/Seagate Expansion Drive/ALICE_BACKUP/voshpde/wav_files/zipfiles/20181015.wav	0
270	/media/hugo/Seagate Expansion Drive/ALICE_BACKUP/voshpde/pipeLine/segmentation_wavfiles/20181015/271_20181015.wav	6115.405625	293539470	6135.255625	294492270	270_20181015	expresses however a desire he says that the deadline for amendments is very brief and even though he is prepared to work as quickly as possible he would be very grateful if the deadline could be somewhat extended so i suned up the message for mashadopeid	expresses however a desire he says that the deadline for amendments is very brief and even though he is prepared to work as quickly as possible he would be very grateful if the deadline could be somewhat extended so i suned up the message for mashadopeid	/media/hugo/Seagate Expansion Drive/ALICE_BACKUP/voshpde/wav_files/zipfiles/20181015.wav	0
271	/media/hugo/Seagate Expansion Drive/ALICE_BACKUP/voshpde/pipeLine/segmentation_wavfiles/20181015/272_20181015.wav	6135.255645833333	294492271	6152.505645833333	295320271	271_20181015	thank you very much just looking pa that their other members want to take the floor i do not think this is the case i would ask the commission with the commission bones to intervene yes	thank you very much just looking a that their other members want to take the floor i do not think this is the case i would ask the commission with the commission bones to intervene yes	/media/hugo/Seagate Expansion Drive/ALICE_BACKUP/voshpde/wav_files/zipfiles/20181015.wav	1
272	/media/hugo/Seagate Expansion Drive/ALICE_BACKUP/voshpde/pipeLine/segmentation_wavfiles/20181015/273_20181015.wav	6152.505666666667	295320272	6168.355666666666	296081072	272_20181015	mr president good afternoon utistiglime the deputy head of unit from the organised crime and drugs policy unit in de ge home and we have been working on this proposal together with to colleagues in de try jranstis who are also here to joint	mr president good afternoon utistiglime the deputy head of unit from the organised crime and drugs policy unit ind ge home and we have been working on this proposal together with to colleagues in d try jranstis who are also here to joint	/media/hugo/Seagate Expansion Drive/ALICE_BACKUP/voshpde/wav_files/zipfiles/20181015.wav	3
273	/media/hugo/Seagate Expansion Drive/ALICE_BACKUP/voshpde/pipeLine/segmentation_wavfiles/20181015/274_20181015.wav	6168.3556875	296081073	6191.6056875	297197073	273_20181015	proposal i would like first of all to thank the european parliament and you for moving the file now forward rather rather quickly we have tabled this proposal in april of this year with the aim to achieve an adoption still before the european elections next year and i think we can	proposal i would like first of all to thank the european parliament and you for moving the file now forward rather rather quickly we have tabled this proposal in april of this year with the aim to achieve an adoption still before the european elections next year and i think we can	/media/hugo/Seagate Expansion Drive/ALICE_BACKUP/voshpde/wav_files/zipfiles/20181015.wav	0
