	wavfile	start_seconds	start_frames	end_seconds	end_frames	identifier	inferred_text_with_hotwords	inferred_text_without_hotwords	motherfile	dist
181	/media/hugo/Seagate Expansion Drive/ALICE_BACKUP/voshpde/pipeLine/segmentation_wavfiles/20181011/182_20181011.wav	4208.6537708333335	202015381	4238.103770833333	203428981	181_20181011	mrs you mentioned at this proposal in spart of the package of course september you also mentioned that it was a response to the conclusions of the european council in june late earlier this year from all point of view this proposal is also very much a build up to the experience that we have gained over the last three years looking at the return systems of member states	mrs you mentioned at this proposal in spart of the package of course september you also mentioned that it was a response to the conclusions of the european council in june late earlier this year from all point of view this proposal is also very much a build up to the experience that we have gained over the last three years looking at the return systems of member states	/media/hugo/Seagate Expansion Drive/ALICE_BACKUP/voshpde/wav_files/zipfiles/20181011.wav	0
182	/media/hugo/Seagate Expansion Drive/ALICE_BACKUP/voshpde/pipeLine/segmentation_wavfiles/20181011/183_20181011.wav	4238.103791666666	203428982	4258.853791666666	204424982	182_20181011	in fact over the last three years since wo thousand and fifteen we have conducted schengen evaluation missions on the return systems of twenty two of our twenty eight member states and based on that information based on the findings on the conclusions on the technical information that we have the	in fact over the last three years since wo thousand and fifteen we have conducted schengen evaluation missions on the return systems of twenty two of our twenty eight member states and based on that information based on the findings on the conclusions on the technical information that we have the	/media/hugo/Seagate Expansion Drive/ALICE_BACKUP/voshpde/wav_files/zipfiles/20181011.wav	0
183	/media/hugo/Seagate Expansion Drive/ALICE_BACKUP/voshpde/pipeLine/segmentation_wavfiles/20181011/184_20181011.wav	4258.8538125	204424983	4284.4038125	205651383	183_20181011	during these missions we started building some conclusions and some operational follow ups that we sught were relevant to be translated into legislation we had a first analysis that we have done of that information that we had yethered last year when we adopted the recommendation which we sought would be a step	during these missions we started building some conclusions and some operational follow ups that we sught were relevant to be translated into legislation we had a first analysis that we have done of that information that we had yethered last year when we adopted the recommendation which we sought would be a step	/media/hugo/Seagate Expansion Drive/ALICE_BACKUP/voshpde/wav_files/zipfiles/20181011.wav	0
184	/media/hugo/Seagate Expansion Drive/ALICE_BACKUP/voshpde/pipeLine/segmentation_wavfiles/20181011/185_20181011.wav	4284.403833333334	205651384	4301.953833333333	206493784	184_20181011	towards bringing some softer tools to convince the authorities of the member states to conduct the type of adaptations of the return systems at national level that we thought where necessary to improve efficiency	towards bringing some softer tools to convince the authorities of the member states to conduct the type of adaptations of the return systems at national level that we thought where necessary to improve efficiency	/media/hugo/Seagate Expansion Drive/ALICE_BACKUP/voshpde/wav_files/zipfiles/20181011.wav	0
185	/media/hugo/Seagate Expansion Drive/ALICE_BACKUP/voshpde/pipeLine/segmentation_wavfiles/20181011/186_20181011.wav	4301.953854166667	206493785	4322.603854166667	207484985	185_20181011	that recommendation was followed by intense work done in the contact group with member states for the amendment of the return handbook which was also completed in september last year and in terms of soft measures that was as far as we could go	that recommendation was followed by intense work done in the contact group with member states for the amendment of the return handbook which was also completed in september last year and in terms of soft measures that was as far as we could go	/media/hugo/Seagate Expansion Drive/ALICE_BACKUP/voshpde/wav_files/zipfiles/20181011.wav	0
186	/media/hugo/Seagate Expansion Drive/ALICE_BACKUP/voshpde/pipeLine/segmentation_wavfiles/20181011/187_20181011.wav	4322.603875	207484986	4350.253875	208812186	186_20181011	looking further into the actual numbers ad the returnerate and the evolution over the last years this year we draw the conclusion that we had to proceed with adaptations of the directive itself in order to streamline also in terms of legislation at european level those measures that wat thought necessary to again	looking further into the actual numbers and to the returnerate and the evolution over the last years this year we draw the conclusion that we had to proceed with adaptations of the directive itself in order to streamline also in terms of legislation at european level those measures that wat thought necessary to again	/media/hugo/Seagate Expansion Drive/ALICE_BACKUP/voshpde/wav_files/zipfiles/20181011.wav	4
187	/media/hugo/Seagate Expansion Drive/ALICE_BACKUP/voshpde/pipeLine/segmentation_wavfiles/20181011/188_20181011.wav	4350.253895833333	208812187	4375.303895833334	210014587	187_20181011	improve their efficiency at national level but also create the necessary connections between the national levels and the central level at frontex in order to bring about better results in return management i am now mentioned very quickly the seven big categories of changes that we have operated to the directive and that of course based on your interests we can go	improve their efficiency at national level but also create the necessary connections between the national levels and the central level at frontex in order to bring about better results in return management i am now mentioned very quickly the seven big categories of changes that we have operated to the directive and that of course based on your interests we can go	/media/hugo/Seagate Expansion Drive/ALICE_BACKUP/voshpde/wav_files/zipfiles/20181011.wav	0
188	/media/hugo/Seagate Expansion Drive/ALICE_BACKUP/voshpde/pipeLine/segmentation_wavfiles/20181011/189_20181011.wav	4375.303916666667	210014588	4400.753916666667	211236188	188_20181011	deeper into those aspects that are of relevance to you the first category of changes links to the nexus that we try to build between asylum and return procedures we have strengthened that link and we have introduced more effective rules on the issuing of return decisions notably following termination of legal ad	deeper into those aspects that are of relevance to you the first category of changes links to the nexus that we try to build between asylum and return procedures we have strengthened that link and we have introduced more effective rules on the issuing of return decisions notably following termination of legal ta	/media/hugo/Seagate Expansion Drive/ALICE_BACKUP/voshpde/wav_files/zipfiles/20181011.wav	2
189	/media/hugo/Seagate Expansion Drive/ALICE_BACKUP/voshpde/pipeLine/segmentation_wavfiles/20181011/190_20181011.wav	4400.7539375	211236189	4429.3039375	212606589	189_20181011	ad when i say termination of legal stay this is mainly asylum procedures but not only it can also link to atabination of a residence permit of other nature we also introduce clearer rules on appeals against decisions following negative asylum decision again in order to have a clear ad more direct consequence of that negative asylum decision into the immediate start of a return procedure and therefore	and when i say termination of legal stay this is mainly asylum procedures but not only it can also link to atabination of a residence permit of other nature we also introduce clearer rules on appeals against decisions following negative asylum decision again in order to have a clear a more direct consequence of that negative asylum decision into the immediate start of a return procedure and therefore	/media/hugo/Seagate Expansion Drive/ALICE_BACKUP/voshpde/wav_files/zipfiles/20181011.wav	2
190	/media/hugo/Seagate Expansion Drive/ALICE_BACKUP/voshpde/pipeLine/segmentation_wavfiles/20181011/191_20181011.wav	4429.303958333333	212606590	4452.053958333333	213698590	190_20181011	increasing efficiency the second category of changes links to remedies we have introduced what we believe are clearer rules on appeals against return decisions and on suspensive effects looking at the practice and jurisprudence in many member states we noted big variables in home	increasing efficiency the second category of changes links to remedies we have introduced what we believe are clearer rules on appeals against return decisions and on suspensive effects looking at the practice and jurisprudence in many member states we noted big variables in how	/media/hugo/Seagate Expansion Drive/ALICE_BACKUP/voshpde/wav_files/zipfiles/20181011.wav	2
191	/media/hugo/Seagate Expansion Drive/ALICE_BACKUP/voshpde/pipeLine/segmentation_wavfiles/20181011/192_20181011.wav	4452.053979166667	213698591	4467.903979166666	214459391	191_20181011	appeal procedures and a number of appeal instances are organised in various member states and we believe that bringing about clarity and certainty would help	appeal procedures and a number of appeal instances are organised in various member states and we believe that bringing about clarity and certainty would help	/media/hugo/Seagate Expansion Drive/ALICE_BACKUP/voshpde/wav_files/zipfiles/20181011.wav	0
192	/media/hugo/Seagate Expansion Drive/ALICE_BACKUP/voshpde/pipeLine/segmentation_wavfiles/20181011/193_20181011.wav	4467.904	214459392	4490.854	215560992	192_20181011	the third category of changes links to a new a newly introduced provision on a duty to cooperate between the third country nationals and the competent national authorities we are also providing in that article the concrete areas in which cooperation is expected on the part of the third country national	the third category of changes links to a new a newly introduced provision on a duty to cooperate between the third country nationals and the competent national authorities we are also providing in that article the concrete areas in which cooperation is expected on the part of the third country national	/media/hugo/Seagate Expansion Drive/ALICE_BACKUP/voshpde/wav_files/zipfiles/20181011.wav	0
193	/media/hugo/Seagate Expansion Drive/ALICE_BACKUP/voshpde/pipeLine/segmentation_wavfiles/20181011/194_20181011.wav	4490.854020833333	215560993	4520.104020833333	216964993	193_20181011	and also a duty on the part of the member state authorities themselves to provide information to the third country nationals us to how that cooperation is about to take place what is expected of the third country nationals and what will be the consequences of the lack of cooperation a forth category links to changes that we operated to the system voluntary depart	and also a duty on the part of the member state authorities themselves to provide information to the third country nationals us to how that cooperation is about to take place what is expected of the third country nationals and what will be the consequences of the lack of cooperation a forth category links to changes that we operated to the system voluntary depart	/media/hugo/Seagate Expansion Drive/ALICE_BACKUP/voshpde/wav_files/zipfiles/20181011.wav	0
194	/media/hugo/Seagate Expansion Drive/ALICE_BACKUP/voshpde/pipeLine/segmentation_wavfiles/20181011/195_20181011.wav	4520.1040416666665	216964994	4542.054041666666	218018594	194_20181011	we have streamlined the rules on granting the period of voluntary departure we believed and again based on the practice and on looking into the systems of member states we believe there was a grey zone between the conditions in which voluntary departure was granted and those situations which it was not we wanted to make it clear	we have streamlined the rules on granting the period of voluntary departure we believed and again based on the practice and on looking into the systems of member states we believe there was a grey zone between the conditions in which voluntary departure was granted and those situations which it was not we wanted to make it clear	/media/hugo/Seagate Expansion Drive/ALICE_BACKUP/voshpde/wav_files/zipfiles/20181011.wav	0
195	/media/hugo/Seagate Expansion Drive/ALICE_BACKUP/voshpde/pipeLine/segmentation_wavfiles/20181011/196_20181011.wav	4542.0540625	218018595	4560.7040625	218913795	195_20181011	and we believe that with the changes that we operated that is achieved we also introduce an obligation to set up assisted voluntary return ad integration programmes for the member states up to now it was a recommendation most member states had such programmes but we thought eu	and we believe that with the changes that we operated that is achieved we also introduce an obligation to set up assisted voluntary return and integration programmes for the member states up to now it was a recommendation most member states had such programmes but we thought	/media/hugo/Seagate Expansion Drive/ALICE_BACKUP/voshpde/wav_files/zipfiles/20181011.wav	4
196	/media/hugo/Seagate Expansion Drive/ALICE_BACKUP/voshpde/pipeLine/segmentation_wavfiles/20181011/197_20181011.wav	4560.704083333333	218913796	4584.854083333334	220072996	196_20181011	it would be gain if we introduce it as a positive obligation on member states to have such voluntary return programmes because we believe that this should be the most preferred way of returning migrants the fifs category links to again an obligation that we have introduced in the in the directive which was not there before	it would be gain if we introduce it as a positive obligation on member states to have such voluntary return programmes because we believe that this should be the most preferred way of returning migrants the fifs category links to again an obligation that we have introduced in the in the directive which was not there before	/media/hugo/Seagate Expansion Drive/ALICE_BACKUP/voshpde/wav_files/zipfiles/20181011.wav	0
197	/media/hugo/Seagate Expansion Drive/ALICE_BACKUP/voshpde/pipeLine/segmentation_wavfiles/20181011/198_20181011.wav	4584.854104166667	220072997	4608.104104166667	221188997	197_20181011	for the member states to develop systems that would allow them to process return better and to also be able to communicate important data to frontex in order to facilitate the the work that we are	for the member states to develop systems that would allow them to process return better and to also be able to communicate important data to frontex in order to facilitate the the work that we are	/media/hugo/Seagate Expansion Drive/ALICE_BACKUP/voshpde/wav_files/zipfiles/20181011.wav	0
198	/media/hugo/Seagate Expansion Drive/ALICE_BACKUP/voshpde/pipeLine/segmentation_wavfiles/20181011/199_20181011.wav	4608.104125	221188998	4632.654125	222367398	198_20181011	granting to frontex as you know we are also in the same package trying to increase the role of frontex in return operations even further and we think that one of the backbone of this cooperation is streamline information exchange between the member states and frontex and this provision that we introduced is meant to achieve that	granting to frontex as you know we are also in the same package trying to increase the role of frontex in return operations even further and we think that one of the backbone of this cooperation is streamline information exchange between the member states and frontex and this provision that we introduced is meant to achieve that	/media/hugo/Seagate Expansion Drive/ALICE_BACKUP/voshpde/wav_files/zipfiles/20181011.wav	0
199	/media/hugo/Seagate Expansion Drive/ALICE_BACKUP/voshpde/pipeLine/segmentation_wavfiles/20181011/200_20181011.wav	4632.654145833333	222367399	4652.304145833334	223310599	199_20181011	the six category of changes links to detention we have revised the rules on detention we have introduced a minimum threshold which was not there before we have not touched the upper limits of detention they remain the same as they were	the six category of changes links to detention we have revised the rules on detention we have introduced a minimum threshold which was not there before we have not touched the upper limits of detention they remain the same as they were	/media/hugo/Seagate Expansion Drive/ALICE_BACKUP/voshpde/wav_files/zipfiles/20181011.wav	0
200	/media/hugo/Seagate Expansion Drive/ALICE_BACKUP/voshpde/pipeLine/segmentation_wavfiles/20181011/201_20181011.wav	4652.304166666667	223310600	4680.454166666666	224661800	200_20181011	as they are today in the current version of the directive but we have introduced a minimum threshold of three months why did we do that because looking at the time frames that member states need to proceed with a force return to obtain the documents to be able to organise the readmission procedure which is not an easy process ad looking at the practices of member states in this respect	as they are today in the current version of the directive but we have introduced a minimum threshold of three months why did we do that because looking at the time frames that member states need to proceed with a force return to obtain the documents to be able to organise the readmission procedure which is not an easy process and looking at the practices of member states in this respect	/media/hugo/Seagate Expansion Drive/ALICE_BACKUP/voshpde/wav_files/zipfiles/20181011.wav	1
201	/media/hugo/Seagate Expansion Drive/ALICE_BACKUP/voshpde/pipeLine/segmentation_wavfiles/20181011/202_20181011.wav	4680.4541875	224661801	4708.5041875	226008201	201_20181011	we believe that the three months would be the time frame necessary to give authorities the time they need to organise such returns this period can of course be less than that if the shetcutenational would choose to depart voluntarily the seventh ad last category of changes that i wanted to mention now the beginning links to a newly introduce border procedure	we believe that the three months would be the time frame necessary to give authorities the time they need to organise such returns this period can of course be less than that if the shetcutenational would choose to depart voluntarily the seventh and last category of changes that i wanted to mention now the beginning links to a newly introduce border procedure	/media/hugo/Seagate Expansion Drive/ALICE_BACKUP/voshpde/wav_files/zipfiles/20181011.wav	1
202	/media/hugo/Seagate Expansion Drive/ALICE_BACKUP/voshpde/pipeLine/segmentation_wavfiles/20181011/203_20181011.wav	4708.504208333334	226008202	4724.054208333333	226754602	202_20181011	a procedure that we see as complementary to the asylum border procedure which as you well know is also being discussed as part of the revisions of the asylum procedure regulation and therefore	a procedure that we see as complementary to the asylum border procedure which as you well know is also being discussed as part of the revisions of the asylum procedure regulation and therefore	/media/hugo/Seagate Expansion Drive/ALICE_BACKUP/voshpde/wav_files/zipfiles/20181011.wav	0
203	/media/hugo/Seagate Expansion Drive/ALICE_BACKUP/voshpde/pipeLine/segmentation_wavfiles/20181011/204_20181011.wav	4724.054229166667	226754603	4746.9042291666665	227851403	203_20181011	that ad ad the final shape and form of this new procedure on borders that we are introducing in the return directive would be very much linked to the faith and to the evolution of the negotiations on the asylum border procedure but for the time being we have conceived it linked to what the current proposal looks like in the pa	that and the final shape and form of this new procedure on borders that we are introducing in the return directive would be very much linked to the faith and to the evolution of the negotiations on the asylum border procedure but for the time being we have conceived it linked to what the current proposal looks like in the apr	/media/hugo/Seagate Expansion Drive/ALICE_BACKUP/voshpde/wav_files/zipfiles/20181011.wav	5
204	/media/hugo/Seagate Expansion Drive/ALICE_BACKUP/voshpde/pipeLine/segmentation_wavfiles/20181011/205_20181011.wav	4746.90425	227851404	4765.95425	228765804	204_20181011	and is meant to bridge or to leave no gap in fact in between the finalisation of the asylum border procedure and the immediate start of of an effective return procedure in order to allow authorities to proceed	and is meant to bridge or to leave no gap in fact in between the finalisation of the asylum border procedure and the immediate start of of an effective return procedure in order to allow authorities to proceed	/media/hugo/Seagate Expansion Drive/ALICE_BACKUP/voshpde/wav_files/zipfiles/20181011.wav	0
205	/media/hugo/Seagate Expansion Drive/ALICE_BACKUP/voshpde/pipeLine/segmentation_wavfiles/20181011/206_20181011.wav	4765.954270833333	228765805	4786.804270833333	229766605	205_20181011	with the return of set cat nationals that i held at the border in the context of such an asylum border procedure as fast as possible i will stop here and of course i look forward to answer questions eu ad o rapporteur	with the return of set cat nationals that i held at the border in the context of such an asylum border procedure as fast as possible i will stop here and of course i look forward to answer questions as cato rapporteur	/media/hugo/Seagate Expansion Drive/ALICE_BACKUP/voshpde/wav_files/zipfiles/20181011.wav	5
206	/media/hugo/Seagate Expansion Drive/ALICE_BACKUP/voshpde/pipeLine/segmentation_wavfiles/20181011/207_20181011.wav	4786.804291666666	229766606	4803.054291666666	230546606	206_20181011	now i decided volunteer for this return directive cause i that returns this part of an asylum procedure no doubt about ad and i have been saying that year after year but it really depends on how you formully	now i decided volunteer for this return directive cause i that returns this part of an asylum procedure no doubt about ed and i have been saying that year after year but it really depends on how you formully	/media/hugo/Seagate Expansion Drive/ALICE_BACKUP/voshpde/wav_files/zipfiles/20181011.wav	1
207	/media/hugo/Seagate Expansion Drive/ALICE_BACKUP/voshpde/pipeLine/segmentation_wavfiles/20181011/208_20181011.wav	4803.0543125	230546607	4820.2043125	231369807	207_20181011	de where you see is that we are not really successful when it comes to returning irregular ad migrants to their home countries and i would like to talk about that and not trying to return people to place as they never lift ad why are we not so successful	what you see is that we are not really successful when it comes to returning irregular migrants to their home countries and i would like to talk about that and not trying to return people to place as they never lift and why are we not so successful	/media/hugo/Seagate Expansion Drive/ALICE_BACKUP/voshpde/wav_files/zipfiles/20181011.wav	10
208	/media/hugo/Seagate Expansion Drive/ALICE_BACKUP/voshpde/pipeLine/segmentation_wavfiles/20181011/209_20181011.wav	4820.204333333333	231369808	4843.954333333333	232509808	208_20181011	it has to do with the fact that the other side very often does not want to take their citizens back ad that has also to do with the fact that we do not provide for instance legal pathways for people so part of the problem we are having it is a problem that we cannot solve in the returns directive it is a problem that we have that you see illustrated in the difficult	it has to do with the fact that the other side very often does not want to take their citizens back and that has also to do with the fact that we do not provide for instance legal pathways for people so part of the problem we are having it is a problem that we cannot solve in the returns directive it is a problem that we have that you see illustrated in the difficult	/media/hugo/Seagate Expansion Drive/ALICE_BACKUP/voshpde/wav_files/zipfiles/20181011.wav	1
209	/media/hugo/Seagate Expansion Drive/ALICE_BACKUP/voshpde/pipeLine/segmentation_wavfiles/20181011/210_20181011.wav	4843.954354166666	232509809	4868.404354166667	233683409	209_20181011	ad negotiations around readmission agreements where third countries say we are willing to take our citizens back but we would like to see legal path way is opened so i would not like to see a returns directive that suggests that that our problem with return is that we have a detained people long and of	the negotiations around readmission agreements where third countries say we are willing to take our citizens back but we would like to see legal pathways opened so i would not like to see a returns directive that suggests that that our problem with return is that we have a detained people long and of	/media/hugo/Seagate Expansion Drive/ALICE_BACKUP/voshpde/wav_files/zipfiles/20181011.wav	6
210	/media/hugo/Seagate Expansion Drive/ALICE_BACKUP/voshpde/pipeLine/segmentation_wavfiles/20181011/211_20181011.wav	4868.404375	233683410	4885.554375	234506610	210_20181011	i appreciate iv of the fact that there is a new article that talks about facilitating voluntary return its key ad in theory a lot of member states might have it but in practice it is really under developed eu	i appreciative of the fact that there is a new article that talks about facilitating voluntary return its key and in theory a lot of member states might have it but in practice it is really under developed	/media/hugo/Seagate Expansion Drive/ALICE_BACKUP/voshpde/wav_files/zipfiles/20181011.wav	7
