	wavfile	start_seconds	start_frames	end_seconds	end_frames	identifier	inferred_text_with_hotwords	inferred_text_without_hotwords	motherfile	dist
331	/media/hugo/Seagate Expansion Drive/ALICE_BACKUP/voshpde/pipeLine/segmentation_wavfiles/20181011/332_20181011.wav	7606.256895833333	365100331	7625.206895833333	366009931	331_20181011	the psi directive is a step forward in expanding the reuse of public sector information as part of the european data economy the purpose of the proposed recasting amendments is to encourage and facilitate more reuse	the psi directive is a step forward in expanding the reuse of public sector information as part of the european data economy the purpose of the proposed recasting amendments is to encourage and facilitate more reuse	/media/hugo/Seagate Expansion Drive/ALICE_BACKUP/voshpde/wav_files/zipfiles/20181011.wav	0
332	/media/hugo/Seagate Expansion Drive/ALICE_BACKUP/voshpde/pipeLine/segmentation_wavfiles/20181011/333_20181011.wav	7625.206916666667	366009932	7648.656916666667	367135532	332_20181011	the approach taken is to extend some of the provisions of the directive to public undertakings and research data to reduce barriers for reuse by removing one of the charging exceptions i believe it is important to secure that all processes respect fair competition principles and that new provisions as	the approach taken is to extend some of the provisions of the directive to public undertakings and research data to reduce barriers for reuse by removing one of the charging exceptions i believe it is important to secure that all processes respect fair competition principles and that new provisions as	/media/hugo/Seagate Expansion Drive/ALICE_BACKUP/voshpde/wav_files/zipfiles/20181011.wav	0
333	/media/hugo/Seagate Expansion Drive/ALICE_BACKUP/voshpde/pipeLine/segmentation_wavfiles/20181011/334_20181011.wav	7648.6569375	367135533	7667.4069375	368035533	333_20181011	ensure the interoperability between systems so that data can be accessible for reuse we should encourage public sector bodies to make dynamic data available as early as possible through application programming interface eu	ensure the interoperability between systems so that data can be accessible for reuse we should encourage public sector bodies to make dynamic data available as early as possible through application programming interface s	/media/hugo/Seagate Expansion Drive/ALICE_BACKUP/voshpde/wav_files/zipfiles/20181011.wav	2
334	/media/hugo/Seagate Expansion Drive/ALICE_BACKUP/voshpde/pipeLine/segmentation_wavfiles/20181011/335_20181011.wav	7667.406958333333	368035534	7693.756958333333	369300334	334_20181011	apis and to clarify the recovery of the costs of en anonimising personal data as a marginal cost of provision for reuse with full respect of data protection i welcome rapporteurs amendments in which references to gdpr clarify that the reuse rules must fully respect the fundamental right to privacy	apis and to clarify the recovery of the costs of en anonimising personal data as a marginal cost of provision for reuse with full respect of data protection i welcome rapporteurs amendments in which references to gdpr clarify that the reuse rules must fully respect the fundamental right to privacy	/media/hugo/Seagate Expansion Drive/ALICE_BACKUP/voshpde/wav_files/zipfiles/20181011.wav	0
335	/media/hugo/Seagate Expansion Drive/ALICE_BACKUP/voshpde/pipeLine/segmentation_wavfiles/20181011/336_20181011.wav	7693.7569791666665	369300335	7719.206979166666	370521935	335_20181011	and the protection of personal data and be in full compliance with eu data protection laws thank you and looking forward to working together on this file ad from	and the protection of personal data and be in full compliance with eu data protection laws thank you and looking forward to working together on this file from	/media/hugo/Seagate Expansion Drive/ALICE_BACKUP/voshpde/wav_files/zipfiles/20181011.wav	3
336	/media/hugo/Seagate Expansion Drive/ALICE_BACKUP/voshpde/pipeLine/segmentation_wavfiles/20181011/337_20181011.wav	7719.207	370521936	7748.957	371949936	336_20181011	mr president i would like to thank the rapporteur for the draft report and also for the support for the proposal now the report is focusing on data protection and there should be no doubt the directive on the reuse of public sector information should be implemented in full respect of the data protection rules ad in a way that there are not too opposing concepts open data and the protection of personal data the go hand in hand	mr president i would like to thank the rapporteur for the draft report and also for the support for the proposal now the report is focusing on data protection and there should be no doubt the directive on the reuse of public sector information should be implemented in full respect of the data protection rules and in a way that there are not too opposing concepts open data and the protection of personal data the go hand in hand	/media/hugo/Seagate Expansion Drive/ALICE_BACKUP/voshpde/wav_files/zipfiles/20181011.wav	1
337	/media/hugo/Seagate Expansion Drive/ALICE_BACKUP/voshpde/pipeLine/segmentation_wavfiles/20181011/338_20181011.wav	7748.957020833333	371949937	7775.807020833333	373238737	337_20181011	there are both part of a conscious and proactive way of dealing with data by the public sector then i would also like to make the case and underline the positive aspects of the proposal and the impact it will have not only smes on job creation but also on ngos ad on citizens so open public data	there are both part of a conscious and proactive way of dealing with data by the public sector then i would also like to make the case and underline the positive aspects of the proposal and the impact it will have not only smes on job creation but also on ngos and citizens so open public data	/media/hugo/Seagate Expansion Drive/ALICE_BACKUP/voshpde/wav_files/zipfiles/20181011.wav	4
338	/media/hugo/Seagate Expansion Drive/ALICE_BACKUP/voshpde/pipeLine/segmentation_wavfiles/20181011/339_20181011.wav	7775.807041666667	373238738	7803.757041666667	374580338	338_20181011	will not only lead to new information services and products it will not only lead to fostering the development of artificial intelligence in europe but it will also lead to a better involvement of citizens in government matters the deadline for tabling amendments is the eighteentober	will not only lead to new information services and products it will not only lead to fostering the development of artificial intelligence in europe but it will also lead to a better involvement of citizens in government matters the deadline for tabling amendments is the eighteentober	/media/hugo/Seagate Expansion Drive/ALICE_BACKUP/voshpde/wav_files/zipfiles/20181011.wav	0
339	/media/hugo/Seagate Expansion Drive/ALICE_BACKUP/voshpde/pipeLine/segmentation_wavfiles/20181011/340_20181011.wav	7803.7570625	374580339	7832.9070625	375979539	339_20181011	thank you very much to the rapporteur and tolauesfor participating in that debate and thank you for your patience to everyone moldiwatedokthank you so we can now move to point nineteen another de presentation by the commission this is the	thank you very much to the rapporteur and tolauesfor participating in that debate and thank you for your patience to everyone moldiwatedokthank you so we can now move to point nineteen another o presentation by the commission this is the	/media/hugo/Seagate Expansion Drive/ALICE_BACKUP/voshpde/wav_files/zipfiles/20181011.wav	2
340	/media/hugo/Seagate Expansion Drive/ALICE_BACKUP/voshpde/pipeLine/segmentation_wavfiles/20181011/341_20181011.wav	7832.9070833333335	375979540	7860.257083333333	377292340	340_20181011	that on thirty may the commission proposed a new regulation on the exchange assistance and training programme for the protection of the euro against counterfeiting for the period twenty twenty one ad twenty seven twenty twenty seven the sole pericles four programme is based on article n one ad thrty three of the treaty it provides for a date of application as of the january two thousand ad twenty one	that on thirty may the commission proposed a new regulation on the exchange assistance and training programme for the protection of the euro against counterfeiting for the period twenty twenty one twenty seven twenty twenty seven the socalpericleasfour programme is based on article one thrty three of the treaty it provides for a date of application as of the january two thousand and twenty one	/media/hugo/Seagate Expansion Drive/ALICE_BACKUP/voshpde/wav_files/zipfiles/20181011.wav	14
341	/media/hugo/Seagate Expansion Drive/ALICE_BACKUP/voshpde/pipeLine/segmentation_wavfiles/20181011/342_20181011.wav	7860.257104166667	377292341	7883.707104166667	378417941	341_20181011	is presented for a union is presented for the eu is a continuation of the current park least two thousand and twenty programme and it specifically dedicated to the protection of euro bank notes and coins against counterfeiting again of a recurring them no impact assessment has been provided by the commission	is presented for a union is presented for the eu is a continuation of the current park least two thousand and twenty programme and it specifically dedicated to the protection of euro bank notes and coins against counterfeiting again of a recurring them no impact assessment has been provided by the commission	/media/hugo/Seagate Expansion Drive/ALICE_BACKUP/voshpde/wav_files/zipfiles/20181011.wav	0
342	/media/hugo/Seagate Expansion Drive/ALICE_BACKUP/voshpde/pipeLine/segmentation_wavfiles/20181011/343_20181011.wav	7883.707125	378417942	7906.057125	379490742	342_20181011	de des ad is the financial envelope proposal for the implementation of the programme for the period twenty twenty one twenty seven is going to be seven million seven hundred zero in current prices the previous programme was seven million three hundred and forty four zero year in current prices	mr esinite the financial envelope proposed for the implementation of the programme for the period twenty twenty one twenty seven is going to be seven million seven hundred zero in current prices the previous programme was seven million three hundred and forty four zero year in current prices	/media/hugo/Seagate Expansion Drive/ALICE_BACKUP/voshpde/wav_files/zipfiles/20181011.wav	11
343	/media/hugo/Seagate Expansion Drive/ALICE_BACKUP/voshpde/pipeLine/segmentation_wavfiles/20181011/344_20181011.wav	7906.057145833333	379490743	7929.407145833334	380611543	343_20181011	secondly in addition to to mentioned proposed regulation and accompanying regulation extending to the non participating member states the application has been proposed under the programme article three five two of the treaty as a legal basis and this instrument has been one of the mff files and mole follow the general parliament line is regards the mentioned files	secondly in addition to to mentioned proposed regulation and accompanying regulation extending to the non participating member states the application has been proposed under the programme article three five two of the treaty as a legal basis and this instrument has been one of the mff files and mole follow the general parliament line is regards the mentioned files	/media/hugo/Seagate Expansion Drive/ALICE_BACKUP/voshpde/wav_files/zipfiles/20181011.wav	0
344	/media/hugo/Seagate Expansion Drive/ALICE_BACKUP/voshpde/pipeLine/segmentation_wavfiles/20181011/345_20181011.wav	7929.407166666667	380611544	7950.0571666666665	381602744	344_20181011	i am relieved that mr de jong is the rapporteur on this because i i am not following this fill very well so mr de yong your the rapporteur for both files and you are going to speak at a moment but i am going iv the floor first to the commission and then to you so	i am relieved that mr dong is the rapporteur on this because i i am not following this fill very well so mr de yong your the rapporteur for both files and you are going to speak at a moment but i am going iv the floor first to the commission and then to you so	/media/hugo/Seagate Expansion Drive/ALICE_BACKUP/voshpde/wav_files/zipfiles/20181011.wav	3
345	/media/hugo/Seagate Expansion Drive/ALICE_BACKUP/voshpde/pipeLine/segmentation_wavfiles/20181011/346_20181011.wav	7950.0571875	381602745	7971.2071875	382617945	345_20181011	first to the commission for the presentation and present so mr juan ca who the head of the unit for ecfin thank you your welcome please go ahead with your presentation thank you	first to the commission for the presentation and present so mr yuan ca who the head of the unit for ec thank you your welcome please go ahead with your presentation thank you	/media/hugo/Seagate Expansion Drive/ALICE_BACKUP/voshpde/wav_files/zipfiles/20181011.wav	4
346	/media/hugo/Seagate Expansion Drive/ALICE_BACKUP/voshpde/pipeLine/segmentation_wavfiles/20181011/347_20181011.wav	7971.207208333333	382617946	7993.557208333334	383690746	346_20181011	mr de epp of presenting the pericles for programme within the libe committee so this proposal is indeed still necessary we still fate quite a threat in relation to euro country feating	mr el of presenting the peridless for programme within the libya committee so this proposal is indeed still necessary we still fate quite a threat in relation to euro country feating	/media/hugo/Seagate Expansion Drive/ALICE_BACKUP/voshpde/wav_files/zipfiles/20181011.wav	9
347	/media/hugo/Seagate Expansion Drive/ALICE_BACKUP/voshpde/pipeLine/segmentation_wavfiles/20181011/348_20181011.wav	7993.557229166667	383690747	8019.907229166667	384955547	347_20181011	the latest statistics of the european central bank covering the first semester show that still about three hundred zero counterfet banknotes are detected in circulation and that is for the first semester of two thousand and eighteen if you look at the for instance the semester in two thousand and fifteen it the figure mounted up to four hundred and fifty zero eu bank nods contefeatit	the latest statistics of the european central bank covering the first semester show that still about three hundred zero counterfet banknotes are detected in circulation and that is for the first semester of two thousand and eighteen if you look at the for instance the semester in two thousand and fifteen it the figure mounted up to four hundred and fifty zero bank nods contefeatit	/media/hugo/Seagate Expansion Drive/ALICE_BACKUP/voshpde/wav_files/zipfiles/20181011.wav	3
348	/media/hugo/Seagate Expansion Drive/ALICE_BACKUP/voshpde/pipeLine/segmentation_wavfiles/20181011/349_20181011.wav	8019.90725	384955548	8044.55725	386138748	348_20181011	of course due to the introduction of the new series with increased security features the counterfeating might have slightly increased for the moment but due to indeed a combination of measures both ocentication legislation and prevention through the training programme of the current pericles two thousand and twenty programme this threat is manageable	of course due to the introduction of the new series with increased security features the counterfeating might have slightly increased for the moment but due to indeed a combination of measures both ocentication legislation and prevention through the training programme of the current bearclesto thousand and twenty programme this threat is manageable	/media/hugo/Seagate Expansion Drive/ALICE_BACKUP/voshpde/wav_files/zipfiles/20181011.wav	5
349	/media/hugo/Seagate Expansion Drive/ALICE_BACKUP/voshpde/pipeLine/segmentation_wavfiles/20181011/350_20181011.wav	8044.557270833333	386138749	8073.307270833333	387518749	349_20181011	this threat is manageable how de we indeed to prepare the fourth generation of the pericles programme a mid term evaluation has been carried out on the pericles two thousand and twenty programme regulation three three one of two thousand and fourteen which has been carried out by an independent contractor independent from the commission and which indeed demonstrated	this threat is manageable how do we indeed to prepare the fourth generation of the pericles programme a mid term evaluation has been carried out on the pericles two thousand and twenty programme regulation three three one of two thousand and fourteen which has been carried out by an independent contractor independent from the commission and which indeed demonstrated	/media/hugo/Seagate Expansion Drive/ALICE_BACKUP/voshpde/wav_files/zipfiles/20181011.wav	1
350	/media/hugo/Seagate Expansion Drive/ALICE_BACKUP/voshpde/pipeLine/segmentation_wavfiles/20181011/351_20181011.wav	8073.307291666667	387518750	8096.357291666666	388625150	350_20181011	that the pericles programme has to added value it complements the actions carried out by the national law enforcement agencies and by the other competent authorities of the member states what also has been assessed as an important conclusion under this assessment was the fact that	that the pericles programme has to added value it complements the actions carried out by the national law enforcement agencies and by the other competent authorities of the member states what also has been assessed as an important conclusion under this assessment was the fact that	/media/hugo/Seagate Expansion Drive/ALICE_BACKUP/voshpde/wav_files/zipfiles/20181011.wav	0
351	/media/hugo/Seagate Expansion Drive/ALICE_BACKUP/voshpde/pipeLine/segmentation_wavfiles/20181011/352_20181011.wav	8096.3573125	388625151	8123.5073125	389928351	351_20181011	the actions currently been co finance or financed under the pericles programme should be continued because otherwise the sustainability of these actions could be endangered ad last but not least the programme has the specificity of multidisciplinary cooperation meaning cooperation among central banks law enforcement agencies the police in judiciary	the actions currently been co finance or financed under the pericles programme should be continued because otherwise the sustainability of these actions could be endangered and last but not least the programme has the specificity of multidisciplinary cooperation meaning cooperation among central banks law enforcement agencies the police in judiciary	/media/hugo/Seagate Expansion Drive/ALICE_BACKUP/voshpde/wav_files/zipfiles/20181011.wav	1
352	/media/hugo/Seagate Expansion Drive/ALICE_BACKUP/voshpde/pipeLine/segmentation_wavfiles/20181011/353_20181011.wav	8123.507333333333	389928352	8143.257333333333	390876352	352_20181011	analyses centres of eithledis central banks or of police authorities analysing the counter feeds and building up the evidence files for the prosecutors and last mit not least also of course private entities are working together under de per list programme so this particularity of multiples	analyses centres of eithledis central banks or of police authorities analysing the counter feeds and building up the evidence files for the prosecutors and last mit not least also of course private entities are working together under deperlist programme so this particularity of multiples	/media/hugo/Seagate Expansion Drive/ALICE_BACKUP/voshpde/wav_files/zipfiles/20181011.wav	2
353	/media/hugo/Seagate Expansion Drive/ALICE_BACKUP/voshpde/pipeLine/segmentation_wavfiles/20181011/354_20181011.wav	8143.257354166667	390876353	8161.1073541666665	391733153	353_20181011	multidisciplinary has been assessed as a great value and with that it is complementary to for instance funds like taiex or the internal security fund the commission therefore has used	multidisciplinary has been assessed as a great value and with that it is complementary to for instance funds like taiex or the internal security fund the commission therefore has used	/media/hugo/Seagate Expansion Drive/ALICE_BACKUP/voshpde/wav_files/zipfiles/20181011.wav	0
354	/media/hugo/Seagate Expansion Drive/ALICE_BACKUP/voshpde/pipeLine/segmentation_wavfiles/20181011/355_20181011.wav	8161.107375	391733154	8181.457375	392709954	354_20181011	mr in its staff working document which in fact replaces the impact assessment many of the elements under this midterm review which which it has communicated to the legis later through its communication of two thousand ad seventeen	mr in its staff working document which in fact replaces the impact assessment many of the elements under this midterm review which which it has communicated to the legis later through its communication of two thousand and seventeen	/media/hugo/Seagate Expansion Drive/ALICE_BACKUP/voshpde/wav_files/zipfiles/20181011.wav	1
355	/media/hugo/Seagate Expansion Drive/ALICE_BACKUP/voshpde/pipeLine/segmentation_wavfiles/20181011/356_20181011.wav	8181.457395833333	392709955	8210.207395833333	394089955	355_20181011	we also have had a public consultation of the pericles four programme the proposal and in this public consultation we received thirty reactions of private persons and also public authorities indicating quite positive reaction in relation to the continuation of the pericles programme beyond two thousand and twenty	we also have had a public consultation of the pericles four programme the proposal and in this public consultation we received thirty reactions of private persons and also public authorities indicating quite positive reaction in relation to the continuation of the pericles programme beyond two thousand and twenty	/media/hugo/Seagate Expansion Drive/ALICE_BACKUP/voshpde/wav_files/zipfiles/20181011.wav	0
356	/media/hugo/Seagate Expansion Drive/ALICE_BACKUP/voshpde/pipeLine/segmentation_wavfiles/20181011/357_20181011.wav	8210.207416666666	394089956	8227.857416666666	394937156	356_20181011	now the legal basis of the programme is for the participating member states as you already indicated article one ad three three an ordinary legislative procedure including an opinion of the european central bank which has been requested by the council and has been sent to the council	now the legal basis of the programme is for the participating member states as you already indicated article one three three an ordinary legislative procedure including an opinion of the european central bank which has been requested by the council and has been sent to the council	/media/hugo/Seagate Expansion Drive/ALICE_BACKUP/voshpde/wav_files/zipfiles/20181011.wav	3
357	/media/hugo/Seagate Expansion Drive/ALICE_BACKUP/voshpde/pipeLine/segmentation_wavfiles/20181011/358_20181011.wav	8227.8574375	394937157	8243.4074375	395683557	357_20181011	as i indicated the pericles programme is complementary to national actions the member states are the first line in protecting the euro against cantrefeating their law enforcement agencies	as i indicated the period as programme is complementary to national actions the member states are the first line in protecting the euro against cantrefeating their law enforcement agencies	/media/hugo/Seagate Expansion Drive/ALICE_BACKUP/voshpde/wav_files/zipfiles/20181011.wav	4
358	/media/hugo/Seagate Expansion Drive/ALICE_BACKUP/voshpde/pipeLine/segmentation_wavfiles/20181011/359_20181011.wav	8243.407458333333	395683558	8272.457458333334	397077958	358_20181011	dedicated agencies need to ensure full protection as you know perhaps under the geneva convention of thusadninehunded an twenty nine every participating member state to the geneva convention and all twenty eight eu member states have ratified and implemented signed and ratified ad geneva convention they need to have a national central office coordinating the police investigations	dedicated agencies need to ensure full protection as you know perhaps under the geneva convention of thusadninehundedandtwenty nine every participating member state to the geneva convention and all twenty eight eu member states have ratified and implemented signed and ratified e geneva convention they need to have a national central office coordinating the police investigations	/media/hugo/Seagate Expansion Drive/ALICE_BACKUP/voshpde/wav_files/zipfiles/20181011.wav	4
359	/media/hugo/Seagate Expansion Drive/ALICE_BACKUP/voshpde/pipeLine/segmentation_wavfiles/20181011/360_20181011.wav	8272.457479166667	397077959	8298.807479166666	398342759	359_20181011	on currency counterfeating and providing equal protection whatever the currency is if national or an international currency of course the euro is the european single currency it is a public good du so it requires this eu level complementary action complementing the national actions that is the reason why we considered that of course it should beat	on currency counterfeating and providing equal protection whatever the currency is if national or an international currency of course the euro is the european single currency it is a public good thus so it requires this eu level complementary action complementing the national actions that is the reason why we considered that of course it should beat	/media/hugo/Seagate Expansion Drive/ALICE_BACKUP/voshpde/wav_files/zipfiles/20181011.wav	3
360	/media/hugo/Seagate Expansion Drive/ALICE_BACKUP/voshpde/pipeLine/segmentation_wavfiles/20181011/361_20181011.wav	8298.8075	398342760	8327.8575	399737160	360_20181011	in the opinion of the commission continued beyond two thousand and twenty as i said it is consistent with other existing programmes like the tylext programmes and the international programme and the international security fund ad therefore we have tabled this proposal how what does the programme look like in fact it is to a very large extent business continue	in the opinion of the commission continued beyond two thousand and twenty as i said it is consistent with other existing programmes like the tylext programmes and the international programme and the international security fund and therefore we have tabled this proposal how what does the programme look like in fact it is to a very large extent business continue	/media/hugo/Seagate Expansion Drive/ALICE_BACKUP/voshpde/wav_files/zipfiles/20181011.wav	1
