	wavfile	start_seconds	start_frames	end_seconds	end_frames	identifier	inferred_text_with_hotwords	inferred_text_without_hotwords	motherfile	dist
0	/media/hugo/Seagate Expansion Drive/ALICE_BACKUP/voshpde/pipeLine/segmentation_wavfiles/20181015/001_20181015.wav	0.0	0	26.95	1293600	000_20181015	eu aftenoonwelcometo our meeting i have the honor to replace clogmarise for for today he has unforseen duties so i will start with	udaftenoonwelcometo our meeting i have the honor to replace clogmarise for for today he has unforseen duties so i will start with	/media/hugo/Seagate Expansion Drive/ALICE_BACKUP/voshpde/wav_files/zipfiles/20181015.wav	2
1	/media/hugo/Seagate Expansion Drive/ALICE_BACKUP/voshpde/pipeLine/segmentation_wavfiles/20181015/002_20181015.wav	26.950020833333333	1293601	47.10002083333333	2260801	001_20181015	adoption of the agenda i set me to the falling change in the draft agenda five the presentation by the commission of the new proposal on european border and coast guard rapporteur roberta mit all will take place at three a lock so right now instate of	adoption of the agenda i set me to the falling change in the draft agenda five the presentation by the commission of the new proposal on european border and coastguard rapporteur ropartamits alla will take place at three a lock so right now instate of	/media/hugo/Seagate Expansion Drive/ALICE_BACKUP/voshpde/wav_files/zipfiles/20181015.wav	6
2	/media/hugo/Seagate Expansion Drive/ALICE_BACKUP/voshpde/pipeLine/segmentation_wavfiles/20181015/003_20181015.wav	47.10004166666667	2260802	65.15004166666667	3127202	002_20181015	half pa four eight the vote on the draft opinion on the protection of persons reporting on breaches of union law had to peplespone to the meeting of october t eighteen if there are no objections to their agenda as modified	half past four eight the vote on the draft opinion on the protection of persons reporting on breaches of union law had to peplespone to the meeting of october t eighteen if there are no objections to their agenda as modified	/media/hugo/Seagate Expansion Drive/ALICE_BACKUP/voshpde/wav_files/zipfiles/20181015.wav	2
3	/media/hugo/Seagate Expansion Drive/ALICE_BACKUP/voshpde/pipeLine/segmentation_wavfiles/20181015/004_20181015.wav	65.1500625	3127203	84.6000625	4060803	003_20181015	it is adopted now i come to another point please note that interpretation will be available in all languages without accept croatian danish and killing ana	it is adopted now i come to another point please note that interpretation will be available in all languages without accept croatian danish and killing	/media/hugo/Seagate Expansion Drive/ALICE_BACKUP/voshpde/wav_files/zipfiles/20181015.wav	4
4	/media/hugo/Seagate Expansion Drive/ALICE_BACKUP/voshpde/pipeLine/segmentation_wavfiles/20181015/005_20181015.wav	84.60008333333333	4060804	103.95008333333334	4989604	004_20181015	another point nomination of rapporteurs for opinions maria grapini sd has to be nominated rapporteur for the opinion of the afco report on the implementation report on the implementation of the legal provisions and the joint statement ensuring parliamentary scrutiny over these centralised agencies	another point nomination of rapporteurs for opinions maria grapinia sd has to be nominated rapporteur for the opinion of the afco report on the implementation report on the implementation of the legal provisions and the joint statement ensuring parliamentary scrutiny over these centralised agencies	/media/hugo/Seagate Expansion Drive/ALICE_BACKUP/voshpde/wav_files/zipfiles/20181015.wav	1
5	/media/hugo/Seagate Expansion Drive/ALICE_BACKUP/voshpde/pipeLine/segmentation_wavfiles/20181015/006_20181015.wav	103.95010416666666	4989605	120.00010416666667	5760005	005_20181015	thus the commune committee endorsed this coordinators recommendation this is the case then the voting time today has been set for today as at seventeen fifteen	thus the commune committee endorsed this coordinators recommendation this is the case then the voting time today has been set for today as at seventeen fifteen	/media/hugo/Seagate Expansion Drive/ALICE_BACKUP/voshpde/wav_files/zipfiles/20181015.wav	0
6	/media/hugo/Seagate Expansion Drive/ALICE_BACKUP/voshpde/pipeLine/segmentation_wavfiles/20181015/007_20181015.wav	120.000125	5760006	145.250125	6972006	006_20181015	please make sure that you are here and that you have your electronic watting card with you then we come to the next point on the main point eu european coast border and coast guard two years ago to legislations reach an agreement on creating a new european border and coast guard guard this was	please make sure that you are here and that you have your electronic watting card with you then we come to the next point on the main point the european coast border and coast guard two years ago to legislations reach an agreement on creating a new european border and coast grd guard this was	/media/hugo/Seagate Expansion Drive/ALICE_BACKUP/voshpde/wav_files/zipfiles/20181015.wav	5
7	/media/hugo/Seagate Expansion Drive/ALICE_BACKUP/voshpde/pipeLine/segmentation_wavfiles/20181015/008_20181015.wav	145.25014583333333	6972007	162.10014583333333	7780807	007_20181015	at the hate of the two thousand and fifteen migration crisis since tend the situation at our external poses border has changed considerably but still the mediterranean s remains a place where tens of thousands of people risk a lives	at the hate of the two thousand and fifteen migration crisis since tend the situation at our external potasbotethas changed considerably but still the mediterranean s remains a place where tens of thousands of people risk a lives	/media/hugo/Seagate Expansion Drive/ALICE_BACKUP/voshpde/wav_files/zipfiles/20181015.wav	7
8	/media/hugo/Seagate Expansion Drive/ALICE_BACKUP/voshpde/pipeLine/segmentation_wavfiles/20181015/009_20181015.wav	162.10016666666667	7780808	189.75016666666667	9108008	008_20181015	each year further steps are still needed as part of the comprehensive approach to border management just last week the euro putin border and coast guard agency head its anniversary of two years in operation during these two years the agency has worked towards fulfilling its mandate the european parliament in its resolution of mad thirty two thousand and eighteen on the function of the schengen area expressed its concerns de	each year further steps are still needed as part of the comprehensive approach to border management just last week the euro putin border and coastguard agency head its anniversary of two years in operation during these two years the agency has worked towards fulfilling its mandate the european parliament in its resolution of mad thirty two thousand and eighteen on the function of the schengen area expressed its concerns	/media/hugo/Seagate Expansion Drive/ALICE_BACKUP/voshpde/wav_files/zipfiles/20181015.wav	4
9	/media/hugo/Seagate Expansion Drive/ALICE_BACKUP/voshpde/pipeLine/segmentation_wavfiles/20181015/010_20181015.wav	189.7501875	9108009	208.5001875	10008009	009_20181015	regarding the implementation of the current mandate this concern was mostly raised due to the injufien commitments by the member states to contribute sufficient human resources and technial equipment both to joint operations and the rapid reaction equipment pool	regarding the implementation of the current mandate this concern was mostly raised due to the injufien commitments by the member states to contribute sufficient human resources and technial equipment both to joint operations and the rapid reaction equipment pool	/media/hugo/Seagate Expansion Drive/ALICE_BACKUP/voshpde/wav_files/zipfiles/20181015.wav	0
10	/media/hugo/Seagate Expansion Drive/ALICE_BACKUP/voshpde/pipeLine/segmentation_wavfiles/20181015/011_20181015.wav	208.50020833333335	10008010	233.75020833333335	11220010	010_20181015	in addition parliament called for enhancing the role of the agency on return according to its current mandate after calls from the european council to strengthen the control of the external borders the commission has presented a new legislative proposal on the european border and coast guard today the commission is here to present to present the proposal and answer our questions i would like to give the floor domes that	in addition parliament called for enhancing the role of the agency on return according to its current mandate after calls from the european council to strengthen the control of the external borders the commission has presented a new legislative proposal on the european border and coast guard today the commission is here to present to present the proposal and answer our questions i would like to give the floor domes that	/media/hugo/Seagate Expansion Drive/ALICE_BACKUP/voshpde/wav_files/zipfiles/20181015.wav	0
11	/media/hugo/Seagate Expansion Drive/ALICE_BACKUP/voshpde/pipeLine/segmentation_wavfiles/20181015/012_20181015.wav	233.75022916666666	11220011	258.30022916666667	12398411	011_20181015	from the commission for ten ute de prenauncitcorrectlymoralesssitisallesmrsenbutitdoesnotmattswasamfacing the same provence with my name some time pa	from the commission for tenutesdepronauncitcorrectlymoralesssitisallesmrsenbutitdoesnotmattswasamfacing the same problence with my name some time	/media/hugo/Seagate Expansion Drive/ALICE_BACKUP/voshpde/wav_files/zipfiles/20181015.wav	9
12	/media/hugo/Seagate Expansion Drive/ALICE_BACKUP/voshpde/pipeLine/segmentation_wavfiles/20181015/013_20181015.wav	258.30025	12398412	274.95025	13197612	012_20181015	we thank you mr president good after new ladies and gentlemen its both an onerana pleasure to present here to you today the new european border in coast guard proposal adopted by the commission	we thank you mr president good after new ladies and gentlemen its both an onerana pleasure to present here to you today the new european border in coaseguard proposal adopted by the commission	/media/hugo/Seagate Expansion Drive/ALICE_BACKUP/voshpde/wav_files/zipfiles/20181015.wav	2
13	/media/hugo/Seagate Expansion Drive/ALICE_BACKUP/voshpde/pipeLine/segmentation_wavfiles/20181015/014_20181015.wav	274.9502708333333	13197613	292.80027083333334	14054413	013_20181015	on twelve september you gave me tenminute which i do understand because in the first place it should be the members of libe talking here and taking positions in asking questions but ten minutes is extremely brief for me personally because i	on twelve september you gave me tenminute which i do understand because in the first place it should be the members of liby talking here and taking positions in asking questions but ten minutes is extremely brief for me personally because i	/media/hugo/Seagate Expansion Drive/ALICE_BACKUP/voshpde/wav_files/zipfiles/20181015.wav	1
14	/media/hugo/Seagate Expansion Drive/ALICE_BACKUP/voshpde/pipeLine/segmentation_wavfiles/20181015/015_20181015.wav	292.8002916666667	14054414	319.0502916666667	15314414	014_20181015	counted up you know that secondly if i only read the titles of the chapters and the sections of the proposal i would already have consumed the ten minutes nevertheless i try to do my utmost and i am sure it is only the first presentation and first discussion we will have a lot of other occasions to further discuss in an indept way the questions that you might have	counted up you know that secondly if i only read the titles of the chapters and the sections of the proposal i would already have consumed the ten minutes nevertheless i try to do my utmost and i am sure it is only the first presentation and first discussion we will have a lot of other occasions to further discuss in an indept way the questions that you might have	/media/hugo/Seagate Expansion Drive/ALICE_BACKUP/voshpde/wav_files/zipfiles/20181015.wav	0
15	/media/hugo/Seagate Expansion Drive/ALICE_BACKUP/voshpde/pipeLine/segmentation_wavfiles/20181015/016_20181015.wav	319.0503125	15314415	346.0003125	16608015	015_20181015	with regard to the political context of this proposal allow me to first of all refer to the state of the union address of president juncker where in parliament in the plenary han he announced a new migration package to be adopted by the college on twelve september covering borders asylum return	with regard to the political context of this proposal allow me to first of all refer to the state of the union address of president juncker where in parliament in the plenary han he announced a new migration package to be adopted by the college on twelve september covering borders asylum return	/media/hugo/Seagate Expansion Drive/ALICE_BACKUP/voshpde/wav_files/zipfiles/20181015.wav	0
16	/media/hugo/Seagate Expansion Drive/ALICE_BACKUP/voshpde/pipeLine/segmentation_wavfiles/20181015/017_20181015.wav	346.00033333333334	16608016	361.8503333333333	17368816	016_20181015	and legal pathways aiming to maximise the eu support on borders and migration i stressed out only collective and resolute eu action in support will make a difference on the ground	and legal pathways aiming to maximise the eu support on borders and migration i stressed out only collective and resolute eu action in support will make a difference on the ground	/media/hugo/Seagate Expansion Drive/ALICE_BACKUP/voshpde/wav_files/zipfiles/20181015.wav	0
17	/media/hugo/Seagate Expansion Drive/ALICE_BACKUP/voshpde/pipeLine/segmentation_wavfiles/20181015/018_20181015.wav	361.85035416666665	17368817	386.8003541666667	18566417	017_20181015	he also clearly reminded that this package translate the commissions vision as presented for the next multiannual financial framework period a proposal adopted on the second may where a strengthened and fully operational european border in coast guard is envisaged including a standing corps of ten zero border guard	he also clearly reminded that this package translate the commissions vision as presented for the next multiannual financial framework period a proposal adopted on the second may where a strengthened and fully operational european border in coast guard is envisaged including a standing corps of ten zero border guards	/media/hugo/Seagate Expansion Drive/ALICE_BACKUP/voshpde/wav_files/zipfiles/20181015.wav	1
18	/media/hugo/Seagate Expansion Drive/ALICE_BACKUP/voshpde/pipeLine/segmentation_wavfiles/20181015/019_20181015.wav	386.800375	18566418	410.450375	19701618	018_20181015	this is indeed this proposal it is the central element of the september package when we were preparing this proposal inside the commission we were we were using the title ebcg two point zero as working title	this is indeed this proposal it is the central element of the september package when we were preparing this proposal inside the commission we were we were using the title ebcg two on zero as working title	/media/hugo/Seagate Expansion Drive/ALICE_BACKUP/voshpde/wav_files/zipfiles/20181015.wav	3
19	/media/hugo/Seagate Expansion Drive/ALICE_BACKUP/voshpde/pipeLine/segmentation_wavfiles/20181015/020_20181015.wav	410.45039583333335	19701619	428.00039583333336	20544019	019_20181015	bcg one zero had been adopted in two thousand and sixteen so with gives the bitty impression that the commission starts acting as a producer of i phones with an upgrade adversion each and every year for each and every two years	bcg one zero had been adopted in two thousand and sixteen so with gives the bitty impression that the commission starts acting as a producer of i phones with an upgrade adversion each and every year for each and every two years	/media/hugo/Seagate Expansion Drive/ALICE_BACKUP/voshpde/wav_files/zipfiles/20181015.wav	0
20	/media/hugo/Seagate Expansion Drive/ALICE_BACKUP/voshpde/pipeLine/segmentation_wavfiles/20181015/021_20181015.wav	428.0004166666667	20544020	444.9504166666667	21357620	020_20181015	so the most evident question is if bcg one zero was approved by the co legislators in two thousand and sixteen why already today there is this proposal on the bcg two zero	so the most evident question is if bcg one zero was approved by the co legislators in two thousand and sixteen why already today there is this proposal on the bcg two zero	/media/hugo/Seagate Expansion Drive/ALICE_BACKUP/voshpde/wav_files/zipfiles/20181015.wav	0
21	/media/hugo/Seagate Expansion Drive/ALICE_BACKUP/voshpde/pipeLine/segmentation_wavfiles/20181015/022_20181015.wav	444.9504375	21357621	468.3004375	22478421	021_20181015	and perhaps i can be rather short on what is the icatture in the proposal the so called standing cop of ten zero border guards and other operational staff the need to come with a proposal first of all there are five or six reasons and i will come back to dan but the first reason is a failure	and perhaps i can be rather short on what is the icatture in the proposal the so called standing cop of ten zero border guards and other operational staff the need to come with a proposal first of all there are five or six reasons and i will come back to dan but the first reason is a failure	/media/hugo/Seagate Expansion Drive/ALICE_BACKUP/voshpde/wav_files/zipfiles/20181015.wav	0
22	/media/hugo/Seagate Expansion Drive/ALICE_BACKUP/voshpde/pipeLine/segmentation_wavfiles/20181015/023_20181015.wav	468.3004583333333	22478422	486.45045833333336	23349622	022_20181015	in the implementation of the ebcgonezero regulation one of the most important improvements in the regulation adopted in two thousand and sixteen was better ensuring that the agency would have at its disposal	in the implementation of the ebcgonezero regulation one of the most important improvements in the regulation adopted in two thousand and sixteen was better ensuring that the agency would have at its disposal	/media/hugo/Seagate Expansion Drive/ALICE_BACKUP/voshpde/wav_files/zipfiles/20181015.wav	0
23	/media/hugo/Seagate Expansion Drive/ALICE_BACKUP/voshpde/pipeLine/segmentation_wavfiles/20181015/024_20181015.wav	486.45047916666664	23349623	506.50047916666665	24312023	023_20181015	sufficient human and technical resources to carry out the operations that would be required to assist member states to support them in the protection of their sections of the external borders you mentioned it yourself in your introduction	sufficient human and technical resources to carry out the operations that would be required to assist member states to support them in the protection of their sections of the external borders you mentioned it yourself in your introduction	/media/hugo/Seagate Expansion Drive/ALICE_BACKUP/voshpde/wav_files/zipfiles/20181015.wav	0
24	/media/hugo/Seagate Expansion Drive/ALICE_BACKUP/voshpde/pipeLine/segmentation_wavfiles/20181015/025_20181015.wav	506.5005	24312024	526.7505	25284024	024_20181015	during the two years lying behind us systematically the agency has been facing gaps in numen resources and technical equipment to effectively and efficiently carry out in joint operations that is not acceptable	during the two years lying behind us systematically the agency has been facing gaps in numen resources and technical equipment to effectively and efficiently carry out in joint operations that is not acceptable	/media/hugo/Seagate Expansion Drive/ALICE_BACKUP/voshpde/wav_files/zipfiles/20181015.wav	0
25	/media/hugo/Seagate Expansion Drive/ALICE_BACKUP/voshpde/pipeLine/segmentation_wavfiles/20181015/026_20181015.wav	526.7505208333333	25284025	542.8005208333333	26054425	025_20181015	there was a major improvement in the text by creating the so called rapid reaction tool of one five hundred desiated border guard that was really innovative	there was a major improvement in the text by creating the so called rapid reaction tool of one five hundred desiated border guards that was really innovative	/media/hugo/Seagate Expansion Drive/ALICE_BACKUP/voshpde/wav_files/zipfiles/20181015.wav	1
26	/media/hugo/Seagate Expansion Drive/ALICE_BACKUP/voshpde/pipeLine/segmentation_wavfiles/20181015/027_20181015.wav	542.8005416666666	26054426	567.3505416666667	27232826	026_20181015	but it has not been applied since the adoption of ebcgonszroand why because it can only applied in cases of rapid border interventions not for the normal joint operations which are very important so in that sense in all the front line states there were already joint operations going on	but it has not been applied since the adoption of ebcgonszroand why because it can only applied in cases of rapid border interventions not for the normal joint operations which are very important so in that sense in all the front line states there were already joint operations going on	/media/hugo/Seagate Expansion Drive/ALICE_BACKUP/voshpde/wav_files/zipfiles/20181015.wav	0
27	/media/hugo/Seagate Expansion Drive/ALICE_BACKUP/voshpde/pipeLine/segmentation_wavfiles/20181015/028_20181015.wav	567.3505625	27232827	584.5005625	28056027	027_20181015	and both umar resources in equipment they have to be provided by the system of the voluntary pledges of member states this is not acceptable surely not if we want to prepare for future crisis situation	and both umar resources in equipment they have to be provided by the system of the voluntary pledges of member states this is not acceptable surely not if we want to prepare for future crisis situation	/media/hugo/Seagate Expansion Drive/ALICE_BACKUP/voshpde/wav_files/zipfiles/20181015.wav	0
28	/media/hugo/Seagate Expansion Drive/ALICE_BACKUP/voshpde/pipeLine/segmentation_wavfiles/20181015/029_20181015.wav	584.5005833333333	28056028	610.1505833333333	29287228	028_20181015	so that is why that is why the commission has launched this idea of the standing cope of ten zero operational staff where does this figure come from well its quitesraight forward in the system for its joint operations the operas system there are around seven zero member states operational staff registered	so that is why that is why the commission has launched this idea of the standing cope of ten zero operational staff where does this figure come from well its quitesraight forward in the system for its joint operations the operas system there are around seven zero member states operational staff registered	/media/hugo/Seagate Expansion Drive/ALICE_BACKUP/voshpde/wav_files/zipfiles/20181015.wav	0
29	/media/hugo/Seagate Expansion Drive/ALICE_BACKUP/voshpde/pipeLine/segmentation_wavfiles/20181015/030_20181015.wav	610.1506041666667	29287229	638.3006041666666	30638429	029_20181015	there is the rapid reaction pool of one zero five hundred and in the return pools you have round six hundred to seven hundred member states experts if you then also take into account what president juncker has said that we need to go for mechanisms and means which are future proof for the management of migration	there is the rapid reaction pool of one zero five hundred and in the return pools you have round six hundred to seven hundred member states experts if you then also take into account what president juncker has said that we need to go for mechanisms and means which are future proof for the management of migration	/media/hugo/Seagate Expansion Drive/ALICE_BACKUP/voshpde/wav_files/zipfiles/20181015.wav	0
30	/media/hugo/Seagate Expansion Drive/ALICE_BACKUP/voshpde/pipeLine/segmentation_wavfiles/20181015/031_20181015.wav	638.300625	30638430	664.650625	31903230	030_20181015	we should for instance not just look at the figures deploy today by the agency in its joint operations we should take into account that more umar sources will be needed in the future so member states will have to mandatory contribute to this standing cope mandatory meaning	we should for instance not just look at the figures deploy today by the agency in its joint operations we should take into account that more umar sources will be needed in the future so member states will have to mandatory contribute to this standing cope mandatory meaning	/media/hugo/Seagate Expansion Drive/ALICE_BACKUP/voshpde/wav_files/zipfiles/20181015.wav	0
31	/media/hugo/Seagate Expansion Drive/ALICE_BACKUP/voshpde/pipeLine/segmentation_wavfiles/20181015/032_20181015.wav	664.6506458333333	31903231	693.6006458333334	33292831	031_20181015	we do away with the pledging system the voluntary contributions and on top of that we have a very important novelty that is that own staff of the agency statutuary staff will be able to become member of the teams to be deployed on the ground by the agency so it would be european officials that would carry out either return	we do away with the pledging system the voluntary contributions and on top of that we have a very important novelty that is that own staff of the agency statutuary staff will be able to become member of the teams to be deployed on the ground by the agency so it would be european officials that would carry out either return	/media/hugo/Seagate Expansion Drive/ALICE_BACKUP/voshpde/wav_files/zipfiles/20181015.wav	0
32	/media/hugo/Seagate Expansion Drive/ALICE_BACKUP/voshpde/pipeLine/segmentation_wavfiles/20181015/033_20181015.wav	693.6006666666667	33292832	709.0506666666666	34034432	032_20181015	activities or border control and surveillance activities that is an important novelty and it will be the starting point for all future actions to be undertaken	activities or border control and surveillance activities that is an important novelty and it will be the starting point for all future actions to be undertaken	/media/hugo/Seagate Expansion Drive/ALICE_BACKUP/voshpde/wav_files/zipfiles/20181015.wav	0
