	wavfile	start_seconds	start_frames	end_seconds	end_frames	identifier	inferred_text_with_hotwords	inferred_text_without_hotwords	motherfile	dist
90	/media/hugo/Seagate Expansion Drive/ALICE_BACKUP/voshpde/pipeLine/segmentation_wavfiles/20181015/091_20181015.wav	2008.401875	96403290	2028.451875	97365690	090_20181015	over time a eu going to have people with such different statuses working side by side how can you have a situation where by say the national a con de to staff for prolly be the least well paid is there any	over time a you going to have people with such different statuses working side by side how can you have a situation where by say the national a conde to staff for prolly be the least well paid is there any	/media/hugo/Seagate Expansion Drive/ALICE_BACKUP/voshpde/wav_files/zipfiles/20181015.wav	3
91	/media/hugo/Seagate Expansion Drive/ALICE_BACKUP/voshpde/pipeLine/segmentation_wavfiles/20181015/092_20181015.wav	2028.4518958333333	97365691	2047.1018958333334	98260891	091_20181015	way that this can stand the test of time i think it is a real concern which has to be looked into secondly on returns i am just trying to understand what is really new in the proposal on returns	way that this can stand the test of time i think it is a real concern which has to be looked into secondly on returns i am just trying to understand what is really new in the proposal on returns	/media/hugo/Seagate Expansion Drive/ALICE_BACKUP/voshpde/wav_files/zipfiles/20181015.wav	0
92	/media/hugo/Seagate Expansion Drive/ALICE_BACKUP/voshpde/pipeLine/segmentation_wavfiles/20181015/093_20181015.wav	2047.1019166666667	98260892	2076.1519166666667	99655292	092_20181015	have they really been increased powers for the agency or is it just a question of mobilising additional personnel is a real any increase in the powers of the agency bearing in mind that according to the figures that i have seen at the moment between twothousand and ixeentwothousnd seventeen the number of returns is not rising is actually falling and as regards cooperation with third countries of course we should welcome the fact	have they really been increased powers for the agency or is it just a question of mobilising additional personnel is a real any increase in the powers of the agency bearing in mind that according to the figures that i have seen at the moment between twothousand and ixeentwothousnd seventeen the number of returns is not rising is actually falling and as regards cooperation with third countries of course we should welcome the fact	/media/hugo/Seagate Expansion Drive/ALICE_BACKUP/voshpde/wav_files/zipfiles/20181015.wav	0
93	/media/hugo/Seagate Expansion Drive/ALICE_BACKUP/voshpde/pipeLine/segmentation_wavfiles/20181015/094_20181015.wav	2076.1519375	99655293	2094.3019375	100526493	093_20181015	they be cooperation with the agreement of the third country concerned i hear that your negotiating agreements with the western balkan countries but as regards migratory flows for the	they be cooperation with the agreement of the third country concerned i hear that your negotiating agreements with the western balkan countries but as regards migratory flows for the	/media/hugo/Seagate Expansion Drive/ALICE_BACKUP/voshpde/wav_files/zipfiles/20181015.wav	0
94	/media/hugo/Seagate Expansion Drive/ALICE_BACKUP/voshpde/pipeLine/segmentation_wavfiles/20181015/095_20181015.wav	2094.3019583333335	100526494	2116.9519583333336	101613694	094_20181015	most of the migrants are coming from further south should not be begin with our southern neighbours first it seems to me that that is where the needs are most pressing and also represent the biggest challenge in numbers as for the lisbonisation can you just explain what you mean	most of the migrants are coming from further south should not be begin with our southern neighbours first it seems to me that that is where the needs are most pressing and also represent the biggest challenge in numbers as for the lisbonisation can you just explain what you mean	/media/hugo/Seagate Expansion Drive/ALICE_BACKUP/voshpde/wav_files/zipfiles/20181015.wav	0
95	/media/hugo/Seagate Expansion Drive/ALICE_BACKUP/voshpde/pipeLine/segmentation_wavfiles/20181015/096_20181015.wav	2116.9519791666667	101613695	2145.001979166667	102960095	095_20181015	to help me understand what you mean by lisbonisation operationally in practice and as regards the governance of the agency i have not fully understood the model but as i am not a shadow myself i did not really familiar self familiarise myself perhaps as much at i should have done with the file president s questions as to the commission	to help me understand what you mean by lisbonisation operationally in practice and as regards the governance of the agency i have not fully understood the model but as i am not a shadow myself i did not really familiar self familiarise myself perhaps as much at i should have done with the file president s questions as to the commission	/media/hugo/Seagate Expansion Drive/ALICE_BACKUP/voshpde/wav_files/zipfiles/20181015.wav	0
96	/media/hugo/Seagate Expansion Drive/ALICE_BACKUP/voshpde/pipeLine/segmentation_wavfiles/20181015/097_20181015.wav	2145.002	102960096	2161.052	103730496	096_20181015	to the end of this issue but you can have de fr for two minutes mr mr president first of all i want to thank the rapporteur for for the overall positive approach	to the end of this issue but you can have defo for two minutes mr mr president first of all i want to thank the rapporteur for for the overall positive approach	/media/hugo/Seagate Expansion Drive/ALICE_BACKUP/voshpde/wav_files/zipfiles/20181015.wav	2
97	/media/hugo/Seagate Expansion Drive/ALICE_BACKUP/voshpde/pipeLine/segmentation_wavfiles/20181015/098_20181015.wav	2161.0520208333332	103730497	2185.902020833333	104923297	097_20181015	visa vi the commission proposal that i would say a good starter and with regard to the overview of aspects that he has stressed there is one element i would like to stress on behalf of the commission the respect of fundamental rights and international obligations including the principle of non hofudnaw in everything the agency is doing	visa vi the commission proposal that i would say a good starter and with regard to the overview of aspects that he has stressed there is one element i would like to stress on behalf of the commission the respect of fundamental rights and international obligations including the principle of non hofudnaw in everything the agency is doing	/media/hugo/Seagate Expansion Drive/ALICE_BACKUP/voshpde/wav_files/zipfiles/20181015.wav	0
98	/media/hugo/Seagate Expansion Drive/ALICE_BACKUP/voshpde/pipeLine/segmentation_wavfiles/20181015/099_20181015.wav	2185.9020416666667	104923298	2212.052041666667	106178498	098_20181015	we have said it jokingly during the trilogues on bcg one zero parliament us to out the respect of fundamental rights in each and every article of the proposal of course that has not been done but all the required safeguards have been put at the appropriate places in the text please	we have said it jokingly during the trilogues on bcg one zero parliament us to out the respect of fundamental rights in each and every article of the proposal of course that has not been done but all the required safeguards have been put at the appropriate places in the text please	/media/hugo/Seagate Expansion Drive/ALICE_BACKUP/voshpde/wav_files/zipfiles/20181015.wav	0
99	/media/hugo/Seagate Expansion Drive/ALICE_BACKUP/voshpde/pipeLine/segmentation_wavfiles/20181015/100_20181015.wav	2212.0520625	106178499	2234.2020625	107241699	099_20181015	at the commission proposals we did not affect at all at any place those safeguards so we did not try to turn back the clock on this point no the commission is fully in line with parliament on this point full respect for fundamental rights	at the commission proposals we did not affect at all at any place those safeguards so we did not try to turn back the clock on this point no the commission is fully in line with parliament on this point full respect for fundamental rights	/media/hugo/Seagate Expansion Drive/ALICE_BACKUP/voshpde/wav_files/zipfiles/20181015.wav	0
100	/media/hugo/Seagate Expansion Drive/ALICE_BACKUP/voshpde/pipeLine/segmentation_wavfiles/20181015/101_20181015.wav	2234.202083333333	107241700	2257.1520833333334	108343300	100_20181015	is required ing everything the agency is going including when carrying out operational activities in third countries so that is an aspect of course if parliament would like to see more safeguards we are always ready to listen then mr niedermuller has more	is required ing everything the agency is going including when carrying out operational activities in third countries so that is an aspect of course if parliament would like to see more safeguards we are always ready to listen then mr nidermuler has more	/media/hugo/Seagate Expansion Drive/ALICE_BACKUP/voshpde/wav_files/zipfiles/20181015.wav	2
101	/media/hugo/Seagate Expansion Drive/ALICE_BACKUP/voshpde/pipeLine/segmentation_wavfiles/20181015/102_20181015.wav	2257.1521041666665	108343301	2278.8021041666666	109382501	101_20181015	a negative approach i would say doubting whether there is really a need to already come today with an upgrade diversion of the bcg i think no one can contest that there is a need for change first of all because the current mechanism	a negative approach i would say doubting whether there is really a need to already come today with an upgrade diversion of the bcg i think no one can contest that there is a need for change first of all because the current mechanism	/media/hugo/Seagate Expansion Drive/ALICE_BACKUP/voshpde/wav_files/zipfiles/20181015.wav	0
102	/media/hugo/Seagate Expansion Drive/ALICE_BACKUP/voshpde/pipeLine/segmentation_wavfiles/20181015/103_20181015.wav	2278.802125	109382502	2296.252125	110220102	102_20181015	on the human resources put available to the agency are not working in practice the system of voluntary pledges does not function so all the support the agency should be able to give it cant give it most of its operations	on the human resources put available to the agency are not working in practice the system of voluntary pledges does not function so all the support the agency should be able to give it cant give it most of its operations	/media/hugo/Seagate Expansion Drive/ALICE_BACKUP/voshpde/wav_files/zipfiles/20181015.wav	0
103	/media/hugo/Seagate Expansion Drive/ALICE_BACKUP/voshpde/pipeLine/segmentation_wavfiles/20181015/104_20181015.wav	2296.2521458333335	110220103	2320.0021458333335	111360103	103_20181015	that is simply unacceptable we have developed a system now with the three categories might look a bit confusing but in the technical meetings we have fully ready to go into the last detail to explain how this should guarantee that in data agency always has at its disposal this number of ten zero	that is simply unacceptable we have developed a system now with the three categories might look a bit confusing but in the technical meetings we have fully ready to go into the last detail to explain how this should guarantee that in data agency always has at its disposal this number of ten zero	/media/hugo/Seagate Expansion Drive/ALICE_BACKUP/voshpde/wav_files/zipfiles/20181015.wav	0
104	/media/hugo/Seagate Expansion Drive/ALICE_BACKUP/voshpde/pipeLine/segmentation_wavfiles/20181015/105_20181015.wav	2320.0021666666667	111360104	2347.6521666666667	112687304	104_20181015	so there is the need to do that there is the need to change a regulation with regard to euro so and its evaluation and the results of that evaluation with the ebcg you cant just let it somewhere in a separate regulation know it needs to be integrated to make it all coherent and that mr leads in principle to what we had in mind to come forward with a recast	so there is the need to do that there is the need to change a regulation with regard to euro so and its evaluation and the results of that evaluation with the ebcg you cant just let it somewhere in a separate regulation know it needs to be integrated to make it all coherent and that mr leads in principle to what we had in mind to come forward with a recast	/media/hugo/Seagate Expansion Drive/ALICE_BACKUP/voshpde/wav_files/zipfiles/20181015.wav	0
105	/media/hugo/Seagate Expansion Drive/ALICE_BACKUP/voshpde/pipeLine/segmentation_wavfiles/20181015/106_20181015.wav	2347.6521875	112687305	2364.4021875	113491305	105_20181015	one regulation in which the bcg regulation and the eurosoegulaion would be recastedbutfor those two areas only but also for eu	one regulation in which the bcg regulation and the eurosoegulaion would be recastedbutfor those two areas only but also for re	/media/hugo/Seagate Expansion Drive/ALICE_BACKUP/voshpde/wav_files/zipfiles/20181015.wav	2
106	/media/hugo/Seagate Expansion Drive/ALICE_BACKUP/voshpde/pipeLine/segmentation_wavfiles/20181015/107_20181015.wav	2364.4022083333334	113491306	2382.1522083333334	114343306	106_20181015	there are changes true out a text i can tell you with the test we would have ended up because a recast leads to a very specific formeting of the commission proposal you would have received the proposal from between four hundred and four hundred and fifty pa	there are changes true out a text i can tell you with the test we would have ended up because a recast leads to a very specific formeting of the commission proposal you would have received the proposal from between four hundred and four hundred and fifty	/media/hugo/Seagate Expansion Drive/ALICE_BACKUP/voshpde/wav_files/zipfiles/20181015.wav	3
107	/media/hugo/Seagate Expansion Drive/ALICE_BACKUP/voshpde/pipeLine/segmentation_wavfiles/20181015/108_20181015.wav	2382.1522291666665	114343307	2398.102229166667	115108907	107_20181015	with all the strike rules of exist of existing provisions that have be put elsewhere it would have been a format which was not workable whatsoever so for that reason we come with a new version	with all the strike rules of exist of existing provisions that have be put elsewhere it would have been a format which was not workable whatsoever so for that reason we come with a new version	/media/hugo/Seagate Expansion Drive/ALICE_BACKUP/voshpde/wav_files/zipfiles/20181015.wav	0
108	/media/hugo/Seagate Expansion Drive/ALICE_BACKUP/voshpde/pipeLine/segmentation_wavfiles/20181015/109_20181015.wav	2398.10225	115108908	2425.75225	116436108	108_20181015	but for a whole series of provisions as i said at the beginning we just stake over we copypased the existing provisions we are not reinventing the will on all aspects of the bcg i also said the commission is reopening points that have been decided by the co legislator two years ago like the issue of returns the assistance for returns from third to ford countries	but for a whole series of provisions as i said at the beginning we just stake over we copypased the existing provisions we are not reinventing the will on all aspects of the bcg i also said the commission is reopening points that have been decided by the co legislator two years ago like the issue of returns the assistance for returns from third to ford countries	/media/hugo/Seagate Expansion Drive/ALICE_BACKUP/voshpde/wav_files/zipfiles/20181015.wav	0
109	/media/hugo/Seagate Expansion Drive/ALICE_BACKUP/voshpde/pipeLine/segmentation_wavfiles/20181015/110_20181015.wav	2425.752270833333	116436109	2442.1022708333335	117220909	109_20181015	it was one of the last points on the table in the trialogue we believe that in in light of the current geopolitical situation we should be able to provide support via the agency of course we are not saying	it was one of the last points on the table in the trialogue we believe that in in light of the current geopolitical situation we should be able to provide support via the agency of course we are not saying	/media/hugo/Seagate Expansion Drive/ALICE_BACKUP/voshpde/wav_files/zipfiles/20181015.wav	0
110	/media/hugo/Seagate Expansion Drive/ALICE_BACKUP/voshpde/pipeLine/segmentation_wavfiles/20181015/111_20181015.wav	2442.1022916666666	117220910	2470.2522916666667	118572110	110_20181015	that parliament should aplaut this strait away and just accept but on the other hand it is not because the colegislators deleted is from the proposal two years ago that automatically we should say no we do not discus it again the commission will explain the reasons why we re open the discussion and and it will be for parliament to see whether you accept that it is sufficient reason to change the	that parliament should aplaut this strait away and just accept but on the other hand it is not because the colegislators deleted is from the proposal two years ago that automatically we should say no we do not discus it again the commission will explain the reasons why we re open the discussion and and it will be for parliament to see whether you accept that it is sufficient reason to change the	/media/hugo/Seagate Expansion Drive/ALICE_BACKUP/voshpde/wav_files/zipfiles/20181015.wav	0
111	/media/hugo/Seagate Expansion Drive/ALICE_BACKUP/voshpde/pipeLine/segmentation_wavfiles/20181015/112_20181015.wav	2470.2523125	118572111	2490.9023125	119563311	111_20181015	or that you say no we stick to the refusal we gave in two thousand and sixteen we do not want agency support for returns from third to ford countries that will be in your hand but at least let us have the discussion whether i justified to change the regulation on this point or not	or that you say no we stick to the refusal we gave in two thousand and sixteen we do not want agency support for returns from third to ford countries that will be in your hand but at least let us have the discussion whether i justified to change the regulation on this point or not	/media/hugo/Seagate Expansion Drive/ALICE_BACKUP/voshpde/wav_files/zipfiles/20181015.wav	0
112	/media/hugo/Seagate Expansion Drive/ALICE_BACKUP/voshpde/pipeLine/segmentation_wavfiles/20181015/113_20181015.wav	2490.9023333333334	119563312	2515.6523333333334	120751312	112_20181015	mr de pre has also raised a few other issues but for instance like fado it would be a pleasure for me to dwell on that but in the light of the two minutes side got i am afraid had this is rot the technical but i am ready even bilaterally to explain those issues or in technical working parties that we might have in the coming days or weeks thank you mr de	mr de pre has also raised a few other issues but for instance like fado it would be a pleasure for me to dwell on that but in the light of the two minutes side got i am afraid that this is rot the technical but i am ready even bilaterally to explain those issues or in technical working parties that we might have in the coming days or weeks thank you mr in	/media/hugo/Seagate Expansion Drive/ALICE_BACKUP/voshpde/wav_files/zipfiles/20181015.wav	4
113	/media/hugo/Seagate Expansion Drive/ALICE_BACKUP/voshpde/pipeLine/segmentation_wavfiles/20181015/114_20181015.wav	2515.6523541666666	120751313	2533.4023541666666	121603313	113_20181015	thank you for for coming the shadows said that they will start the work immediately after de cession but we moving now to a next next point in our agenda this is point	thank you for for coming the shadows said that they will start the work immediately after decision but we moving now to a next next point in our agenda this is point	/media/hugo/Seagate Expansion Drive/ALICE_BACKUP/voshpde/wav_files/zipfiles/20181015.wav	3
114	/media/hugo/Seagate Expansion Drive/ALICE_BACKUP/voshpde/pipeLine/segmentation_wavfiles/20181015/115_20181015.wav	2533.402375	121603314	2549.552375	122378514	114_20181015	three eu eurojust report on terrorist financing and they will be a presentation by mr lenad national member for looxembourg at eurojust	three eurojust report on terrorist financing and they will be a presentation by mr lenad national member for looxembourg at eurojust	/media/hugo/Seagate Expansion Drive/ALICE_BACKUP/voshpde/wav_files/zipfiles/20181015.wav	3
115	/media/hugo/Seagate Expansion Drive/ALICE_BACKUP/voshpde/pipeLine/segmentation_wavfiles/20181015/116_20181015.wav	2549.5523958333333	122378515	2572.9023958333332	123499315	115_20181015	eu		/media/hugo/Seagate Expansion Drive/ALICE_BACKUP/voshpde/wav_files/zipfiles/20181015.wav	2
116	/media/hugo/Seagate Expansion Drive/ALICE_BACKUP/voshpde/pipeLine/segmentation_wavfiles/20181015/117_20181015.wav	2572.902416666667	123499316	2590.152416666667	124327316	116_20181015	as	at	/media/hugo/Seagate Expansion Drive/ALICE_BACKUP/voshpde/wav_files/zipfiles/20181015.wav	1
117	/media/hugo/Seagate Expansion Drive/ALICE_BACKUP/voshpde/pipeLine/segmentation_wavfiles/20181015/118_20181015.wav	2590.1524375	124327317	2619.9024375	125755317	117_20181015	mr president next pointed that chand is a presentation of the eu eurojust report on terrorist financing following similar report published in previous years as regards cases case law and applicable instruments i would like to give the flow de mr lined as already said the national member for looxebourg at eurojust who also kind to join us today to provide us and over view followed by answers and questions	mr president next pointed that chandis a presentation of the eu eurojust report on terrorist financing following similar report published in previous years as regards cases case law and applicable instruments i would like to give the flow to mr lined as already said the national member for looxebourg at eurojust who also kind to join us today to provide us and over view followed by answers and questions	/media/hugo/Seagate Expansion Drive/ALICE_BACKUP/voshpde/wav_files/zipfiles/20181015.wav	3
118	/media/hugo/Seagate Expansion Drive/ALICE_BACKUP/voshpde/pipeLine/segmentation_wavfiles/20181015/119_20181015.wav	2619.9024583333335	125755318	2636.452458333333	126549718	118_20181015	by members the floor is yours thank you for president members of parliament de and gentlemen i have been asked by the college of your just to	by members the floor is yours thank you for president members of parliament idi and gentlemen i have been asked by the college of your just to	/media/hugo/Seagate Expansion Drive/ALICE_BACKUP/voshpde/wav_files/zipfiles/20181015.wav	2
119	/media/hugo/Seagate Expansion Drive/ALICE_BACKUP/voshpde/pipeLine/segmentation_wavfiles/20181015/120_20181015.wav	2636.4524791666668	126549719	2662.102479166667	127780919	119_20181015	reef le present you the latest your just report on terrorist financing wel latest it has a bit more we kind of six months old it still question the main aim of this report is to actually explain what we are doing in the field of terrorist financing what you will not find here is	reef le present you the latest your just report on terrorist financing wel latest it has a bit more we kind of six months old it still question the main aim of this report is to actually explain what we are doing in the field of terrorist financing what you will not find here is	/media/hugo/Seagate Expansion Drive/ALICE_BACKUP/voshpde/wav_files/zipfiles/20181015.wav	0
120	/media/hugo/Seagate Expansion Drive/ALICE_BACKUP/voshpde/pipeLine/segmentation_wavfiles/20181015/121_20181015.wav	2662.1025	127780920	2690.1525	129127320	120_20181015	a risk assessment or a typology report or what exactly is going on in the field of terorist financing is something we cannot do that is nothing our mission and it is also not the information we have that would allow us to give you that picture which gets a lot of people would like to have but unfortunately we cannot do what this report shows is that we effectively help member states who in this	a risk assessment or a typology report or what exactly is going on in the field of terorist financing is something we cannot do that is nothing our mission and it is also not the information we have that would allow us to give you that picture which gets a lot of people would like to have but unfortunately we cannot do what this report shows is that we effectively help member states who in this	/media/hugo/Seagate Expansion Drive/ALICE_BACKUP/voshpde/wav_files/zipfiles/20181015.wav	0
121	/media/hugo/Seagate Expansion Drive/ALICE_BACKUP/voshpde/pipeLine/segmentation_wavfiles/20181015/122_20181015.wav	2690.1525208333333	129127321	2717.9025208333333	130459321	121_20181015	what a sensitive field want to cooperate how we help them to fulfil demission it is not always easy task because everything which comes to terrorism obviously has a lot of sensitivity lot of confidentiality and a lot of other services that are under the gut and the police a secret services so it is not an easy task but i think when you	what a sensitive field want to cooperate how we help them to fulfil demission it is not always easy task because everything which comes to terrorism obviously has a lot of sensitivity lot of confidentiality and a lot of other services that are under the gut and the police a secret services so it is not an easy task but i think when you	/media/hugo/Seagate Expansion Drive/ALICE_BACKUP/voshpde/wav_files/zipfiles/20181015.wav	0
122	/media/hugo/Seagate Expansion Drive/ALICE_BACKUP/voshpde/pipeLine/segmentation_wavfiles/20181015/123_20181015.wav	2717.902541666667	130459322	2742.9525416666665	131661722	122_20181015	you go to the cases you will see that we could could help i will not go in the narrative of these these cases they are chosen among the cases we have to show what we can do the report is addressed to our colleagues at term i also to tell them that even in this field you can come to us that we	you go to the cases you will see that we could could help i will not go in the narrative of these these cases they are chosen among the cases we have to show what we can do the report is addressed to our colleagues at term i also to tell them that even in this field you can come to us that we	/media/hugo/Seagate Expansion Drive/ALICE_BACKUP/voshpde/wav_files/zipfiles/20181015.wav	0
