	wavfile	start_seconds	start_frames	end_seconds	end_frames	identifier	inferred_text_with_hotwords	inferred_text_without_hotwords	motherfile	dist
89	/media/hugo/Seagate Expansion Drive/ALICE_BACKUP/voshpde/pipeLine/segmentation_wavfiles/2018012501/090_2018012501.wav	1997.2520181405896	88078814	2014.8020181405896	88852769	089_2018012501	where we learn that they did not fully use european law and they did not do properly due diligence and still there was no investigation so i think it is important that these changes and therefore i call on the commission	where we learn that they did not fully use european law and they did not do properly due diligence and still there was no investigation so i think it is important that these changes and therefore i call on the commission	/media/hugo/Seagate Expansion Drive/ALICE_BACKUP/voshpde/wav_files/zipfiles/2018012501.wav	0
90	/media/hugo/Seagate Expansion Drive/ALICE_BACKUP/voshpde/pipeLine/segmentation_wavfiles/2018012501/091_2018012501.wav	2014.8020408163266	88852770	2036.3520408163265	89803125	090_2018012501	to follow up their work discuss it with us and also hope that parliament will continue with its work and i have one question to the minister can you inform parliament about your exchange of information with the european commission i know there is an exchange of information because the commission is looking into these	to follow up their work discuss it with thus and also hope that parliament will continue with its work and i have one question to the minister can you inform parliament about your exchange of information with the european commission i know there is an exchange of information because the commission is looking into these	/media/hugo/Seagate Expansion Drive/ALICE_BACKUP/voshpde/wav_files/zipfiles/2018012501.wav	2
91	/media/hugo/Seagate Expansion Drive/ALICE_BACKUP/voshpde/pipeLine/segmentation_wavfiles/2018012501/092_2018012501.wav	2036.3520634920635	89803126	2053.2020634920636	90546211	091_2018012501	allegations and can you inform our parliament about what you had to say about this in writing and can we get a written response to our report this would be very helpful for our further work hu	allegations and can you inform our parliament about what you had to say about this in writing and can we get a written response to our report this would be very helpful for our further work you	/media/hugo/Seagate Expansion Drive/ALICE_BACKUP/voshpde/wav_files/zipfiles/2018012501.wav	2
92	/media/hugo/Seagate Expansion Drive/ALICE_BACKUP/voshpde/pipeLine/segmentation_wavfiles/2018012501/093_2018012501.wav	2053.2020861678006	90546212	2074.4520861678006	91483337	092_2018012501	i agree with your suggestion that we should listen to to a few words to the sins of ms daphne caruana what i suggest as you are also member of the pa participated in the mission you would have two minutes as a member of the missions so you will give your two minutes	i agree with your suggestion that we should listen to to a few words to the sins of ms daphne caruana what i suggest as you are also member of the part participated in the mission you would have two minutes as a member of the missions so you will give your two minutes	/media/hugo/Seagate Expansion Drive/ALICE_BACKUP/voshpde/wav_files/zipfiles/2018012501.wav	2
93	/media/hugo/Seagate Expansion Drive/ALICE_BACKUP/voshpde/pipeLine/segmentation_wavfiles/2018012501/094_2018012501.wav	2074.452108843537	91483338	2093.702108843537	92332263	093_2018012501	to at the end to the sense if you agree wet i am very happy to thank minustanletcontinue with i have on my coordinators list ms couple for the enf president	to at the end to the sense if you agree wet i am very happy to thank minustanletcontinue with i have on my coordinators list ms couple for the enfpresident	/media/hugo/Seagate Expansion Drive/ALICE_BACKUP/voshpde/wav_files/zipfiles/2018012501.wav	1
94	/media/hugo/Seagate Expansion Drive/ALICE_BACKUP/voshpde/pipeLine/segmentation_wavfiles/2018012501/095_2018012501.wav	2093.702131519274	92332264	2109.0521315192746	93009199	094_2018012501	we all the coordinator spoke so we turn now to the members of the mission who took were present in malta ms mr casa pleas	we all the coordinators spoke so we turn now to the members of the mission who took were present in malta ms mr casa pleas	/media/hugo/Seagate Expansion Drive/ALICE_BACKUP/voshpde/wav_files/zipfiles/2018012501.wav	1
95	/media/hugo/Seagate Expansion Drive/ALICE_BACKUP/voshpde/pipeLine/segmentation_wavfiles/2018012501/096_2018012501.wav	2109.0521541950116	93009200	2137.8021541950116	94277075	095_2018012501	mr president first of all i wish to express my appreciation to colleagues for the professionalism with which this report was drawn up the report is clear and the issues that must be addressed are clear to the main concern is of course that persons at the highest levels of government found to be involved in criminal activity remain in office today	mr president first of all i wish to express my appreciation to colleagues for the professionalism with which this report was drawn up the report is clear and the issues that must be addressed are clear to the main concern is of course that persons at the highest levels of government found to be involved in criminal activity remain in office today	/media/hugo/Seagate Expansion Drive/ALICE_BACKUP/voshpde/wav_files/zipfiles/2018012501.wav	0
96	/media/hugo/Seagate Expansion Drive/ALICE_BACKUP/voshpde/pipeLine/segmentation_wavfiles/2018012501/097_2018012501.wav	2137.802176870748	94277076	2165.452176870748	95496441	096_2018012501	de those who created the money laundering structures still held a licence and the bank that was used to launder the money remains operational all the while reports from malta fiau calling for police action against these people remain ignored the impunity is shocking it is against this backdrop that journalist daphne caruana galizia was assassinated	those who created the money laundering structures still held a licence and the bank that was used to launder the money remains operational all the while reports from matas fiau calling for police action against these people remain ignored the impunity is shocking it is against this backdrop that journalist daphne caruana galizia was assassinated	/media/hugo/Seagate Expansion Drive/ALICE_BACKUP/voshpde/wav_files/zipfiles/2018012501.wav	5
97	/media/hugo/Seagate Expansion Drive/ALICE_BACKUP/voshpde/pipeLine/segmentation_wavfiles/2018012501/098_2018012501.wav	2165.452199546485	95496442	2192.702199546485	96698167	097_2018012501	daphne targets continue to hold high public office pilart us bank continues to hold a licence to operating the eu next zia bt is still awarded government contracts today minister owen banichi is here with us but what is he here to tell us he will tell us that his government introduced legislation on whistle blowers but he will not tell us that they only protect the whistle blowers who support his government	daphne targets continue to hold high public office pilates bank continues to hold a licence to operating the eu next zia bt is still awarded government contracts today minister owen banichi is here with us but what is he here to tell us he will tell us that his government introduced legislation on whistle blowers but he will not tell us that they only protect the whistle blowers who support his government	/media/hugo/Seagate Expansion Drive/ALICE_BACKUP/voshpde/wav_files/zipfiles/2018012501.wav	3
98	/media/hugo/Seagate Expansion Drive/ALICE_BACKUP/voshpde/pipeLine/segmentation_wavfiles/2018012501/099_2018012501.wav	2192.702222222222	96698168	2219.552222222222	97882253	098_2018012501	he will tell us that they introduce the law that removes prescription on corruption but he will not tell us that they have made political hostages of the fia eu and the police so his colleagues can never be prosecuted he will tell us that they have introduced the new media law but he will not tell us that daphne caruana galizia as assets remained frozen at the time of her assassination because of legal action by the deputy leader of his own party	he will tell us that they introduce the law that removes prescription on corruption but he will not tell us that they have made political hostages of the fia u and the police so his colleagues can never be prosecuted he will tell us that they have introduced the new media law but he will not tell us that daphne caruana galitias assets remained frozen at the time of her assassination because of legal action by the deputy leader of his own party	/media/hugo/Seagate Expansion Drive/ALICE_BACKUP/voshpde/wav_files/zipfiles/2018012501.wav	4
99	/media/hugo/Seagate Expansion Drive/ALICE_BACKUP/voshpde/pipeLine/segmentation_wavfiles/2018012501/100_2018012501.wav	2219.552244897959	97882254	2245.1022448979593	99009009	099_2018012501	he will tell us that magisterial inquiries are ongoing in malta but he will not tell us that the prime minister filed an appeal to prevent some of the most important revelations from being investigated he will try to frame this debate as some sort of attack on malta but no this fight is for malta for the maltese and against the corrupt government de	he will tell us that magisterial inquiries are ongoing in malta but he will not tell us that the prime minister filed an appeal to prevent some of the most important revelations from being investigated he will try to frame this debate as some sort of attack on malta but no this fight is for malta for the maltese and against the corrupt government s	/media/hugo/Seagate Expansion Drive/ALICE_BACKUP/voshpde/wav_files/zipfiles/2018012501.wav	2
100	/media/hugo/Seagate Expansion Drive/ALICE_BACKUP/voshpde/pipeLine/segmentation_wavfiles/2018012501/101_2018012501.wav	2245.1022675736963	99009010	2264.3522675736963	99857935	100_2018012501	mr president i am grateful that i had the opportunity to be part of the malta delegation let me start with the conclusions because colleagues have already mentioned a lot	mr president i am grateful that i had the opportunity to be part of the malta delegation let me start with the conclusions because colleagues have already mentioned a lot	/media/hugo/Seagate Expansion Drive/ALICE_BACKUP/voshpde/wav_files/zipfiles/2018012501.wav	0
101	/media/hugo/Seagate Expansion Drive/ALICE_BACKUP/voshpde/pipeLine/segmentation_wavfiles/2018012501/102_2018012501.wav	2264.3522902494333	99857936	2283.402290249433	100698041	101_2018012501	de first i think this is a period of analysis is too short i do not think we should stop here with this report and with this analysis i doubt that we were able to meet all the interested parties i think we should take more time for our analysis on the malta situation because	first i think this is a period of analysis is too short i do not think we should stop here with this report and with this analysis i doubt that we were able to meet all the interested parties i think we should take more time for our analysis on the malta situation because	/media/hugo/Seagate Expansion Drive/ALICE_BACKUP/voshpde/wav_files/zipfiles/2018012501.wav	3
102	/media/hugo/Seagate Expansion Drive/ALICE_BACKUP/voshpde/pipeLine/segmentation_wavfiles/2018012501/103_2018012501.wav	2283.40231292517	100698042	2309.3523129251703	101842437	102_2018012501	for example we did not have the chance to talk to all the representatives of civil society or the mass media we did not get answers to our questions from the general prosecutor for example from the authoni general i ask in personally why does the investigation in the murder of daphne caruana galizia take so long and he did not give me an answer then when we met with the press we did not get answers to the question	for example we did not have the chance to talk to all the representatives of civil society or the mass media we did not get answers to our questions from the general prosecutor for example from the authoni general i ask in personally why does the investigation in the murder of daphne caruana galizia take so long and he did not give me an answer then when we met with the press we did not get answers to the question	/media/hugo/Seagate Expansion Drive/ALICE_BACKUP/voshpde/wav_files/zipfiles/2018012501.wav	0
103	/media/hugo/Seagate Expansion Drive/ALICE_BACKUP/voshpde/pipeLine/segmentation_wavfiles/2018012501/104_2018012501.wav	2309.352335600907	101842438	2325.102335600907	102537013	103_2018012501	whether they got the full reports when they rout those articles about the financial scandals so we did not get answers to a lot of questions and i think we should be very careful because i think we should be even handed here for example	whether they got the full reports when they rout those articles about the financial scandals so we did not get answers to a lot of questions and i think we should be very careful because i think we should be even handed here for example	/media/hugo/Seagate Expansion Drive/ALICE_BACKUP/voshpde/wav_files/zipfiles/2018012501.wav	0
104	/media/hugo/Seagate Expansion Drive/ALICE_BACKUP/voshpde/pipeLine/segmentation_wavfiles/2018012501/105_2018012501.wav	2325.102358276644	102537014	2351.852358276644	103716689	104_2018012501	of course we met with the network of civil society we met a gentlemen mr michel digulia gul who is also a councillor of the national nationalist party so i think i do not know how ethical this is because we need to be careful with these things we cannot toy with the citizens rights or with citizens life because a journalist has been murdered here let us not forget about that i think	of course we met with the network of civil society we met a gentlemen mr micaldigulia gul who is also a councillor of the national nationalist party so i think i do not know how ethical this is because we need to be careful with these things we cannot toy with citizens rights or with citizens life because a journalist has been murdered here let us not forget about that i think	/media/hugo/Seagate Expansion Drive/ALICE_BACKUP/voshpde/wav_files/zipfiles/2018012501.wav	7
105	/media/hugo/Seagate Expansion Drive/ALICE_BACKUP/voshpde/pipeLine/segmentation_wavfiles/2018012501/106_2018012501.wav	2351.852380952381	103716690	2380.002380952381	104958105	105_2018012501	in malta the citizens rights to free expression should be better defined and respected we were surprised to meet a so called mass media representative mr austingadwho used to be a minister and who was involved in a huge oil related corruption scandal there was talk about a swiss bank account and so on let us say all these things i do not think we should think with our political belonging we should think about	in malta the citizens rights to free expression should be better defined and respected we were surprised to meet a so called mass media representative mr austingadwho used to be a minister and who was involved in a huge oil related corruption scandal there was talk about a swiss bank account and so on let us say all these things i do not think we should think with our political belonging we should think about	/media/hugo/Seagate Expansion Drive/ALICE_BACKUP/voshpde/wav_files/zipfiles/2018012501.wav	0
106	/media/hugo/Seagate Expansion Drive/ALICE_BACKUP/voshpde/pipeLine/segmentation_wavfiles/2018012501/107_2018012501.wav	2380.002403628118	104958106	2402.652403628118	105956971	106_2018012501	the most important thing which is the security of the citizens of malta and the rights of the citizens of malta so in my opinion i think we should take more time to analyse the situation in malta in order to get a clear priturethankyur president i persually want to thank ms de	the most important thing which is the security of the citizens of malta and the rights of the citizens of malta so in my opinion i think we should take more time to analyse the situation in malta in order to get a clear priturethankyur president i persually want to thank ms	/media/hugo/Seagate Expansion Drive/ALICE_BACKUP/voshpde/wav_files/zipfiles/2018012501.wav	3
107	/media/hugo/Seagate Expansion Drive/ALICE_BACKUP/voshpde/pipeLine/segmentation_wavfiles/2018012501/108_2018012501.wav	2402.652426303855	105956972	2424.302426303855	106911737	107_2018012501	because of our brilliant cooperation i was also shocked of the results of this mission but i want to underline that this is not a maltese problem this is a european problem if we fail to see that then we will fail to help malta	because of our brilliant cooperation i was also shocked of the results of this mission but i want to underline that this is not a maltese problem this is a european problem if we fail to see that then we will fail to help malta	/media/hugo/Seagate Expansion Drive/ALICE_BACKUP/voshpde/wav_files/zipfiles/2018012501.wav	0
108	/media/hugo/Seagate Expansion Drive/ALICE_BACKUP/voshpde/pipeLine/segmentation_wavfiles/2018012501/109_2018012501.wav	2424.3024489795916	106911738	2450.4524489795917	108064953	108_2018012501	in malta there are very very tack procedures and they have to deal with that and they have to clear it up for example pilatus bank how can we digest that the bank has just one hundred and thirty stakeholders and at the same time imaginable amount of money in their de posits	in malta there are very very tack procedures and they have to deal with that and they have to clear it up for example pilatus bank how can we digest that the bank has just one hundred and thirty stakeholders and at the same time imaginable amount of money in their deposits	/media/hugo/Seagate Expansion Drive/ALICE_BACKUP/voshpde/wav_files/zipfiles/2018012501.wav	1
109	/media/hugo/Seagate Expansion Drive/ALICE_BACKUP/voshpde/pipeLine/segmentation_wavfiles/2018012501/110_2018012501.wav	2450.4524716553287	108064954	2477.002471655329	109235809	109_2018012501	it is something which we cannot understand and we cannot i just us i said the third thing i want to say because the members of the mission already said everything is something about mrs maria fymova who is wise blower and he she talked to us to through skype there is a war and against here	it is something which we cannot understand and we cannot i just as i said the third thing i want to say because the members of the mission already said everything is something about ms mari fymova who is wise blower and he she talked to us to through skype there is a war and against here	/media/hugo/Seagate Expansion Drive/ALICE_BACKUP/voshpde/wav_files/zipfiles/2018012501.wav	3
110	/media/hugo/Seagate Expansion Drive/ALICE_BACKUP/voshpde/pipeLine/segmentation_wavfiles/2018012501/111_2018012501.wav	2477.002494331066	109235810	2493.5524943310656	109965665	110_2018012501	in cyprus for different issues and i do not know if these things are related to the fact that she is a we supblower i with mrs gomes already road a letter to the autoni general of cyprus to	in cyprus for different issues and i do not know if these things are related to the fact that she is a we supblower i with mrs gomes already road a letter to the autoni general of cyprus to	/media/hugo/Seagate Expansion Drive/ALICE_BACKUP/voshpde/wav_files/zipfiles/2018012501.wav	0
111	/media/hugo/Seagate Expansion Drive/ALICE_BACKUP/voshpde/pipeLine/segmentation_wavfiles/2018012501/112_2018012501.wav	2493.5525170068026	109965666	2514.3025170068026	110880741	111_2018012501	tell us something about these allegations and why there is an international and european warrant a gas against a lastly i want also to welcome here the sense of ms caruana galizia and to express to them our condolences to thank you so much eu	tell us something about these allegations and why there is an international and european warrant a gas against a lastly i want also to welcome here the sense of ms caruana galizia and to express to them our condolences to thank you so much	/media/hugo/Seagate Expansion Drive/ALICE_BACKUP/voshpde/wav_files/zipfiles/2018012501.wav	3
112	/media/hugo/Seagate Expansion Drive/ALICE_BACKUP/voshpde/pipeLine/segmentation_wavfiles/2018012501/113_2018012501.wav	2514.3025396825396	110880742	2541.9525396825397	112100107	112_2018012501	mr president now i turn to the other members of the committee who wanted to take the floor wish to take the floor i have three members who indicated to intervene mr becker mrs fin and mr zammit i close now the list of interventions mr back a please please try to be shorter than two minutes help me than	mr president now i turn to the other members of the committee who wanted to take the floor wish to take the floor i have three members who indicated to intervene mr backer mrs fin and mr zammit i close now the list of interventions mr back a please please try to be shorter than two minutes help me than	/media/hugo/Seagate Expansion Drive/ALICE_BACKUP/voshpde/wav_files/zipfiles/2018012501.wav	1
113	/media/hugo/Seagate Expansion Drive/ALICE_BACKUP/voshpde/pipeLine/segmentation_wavfiles/2018012501/114_2018012501.wav	2541.9525623582767	112100108	2571.5025623582765	113403263	113_2018012501	mr president i will do my bas many thanks colleague ana gomes for her report on the mission to malta and the key consequences we can draw today not only regarding rule of law money laundering but on an unbelievable case of murders suspect which with with a very serious background of tremendous corruption seemingly even protected by justice and police authorities	mr president i will do my many thanks colleague anagomes for he report on the mission to malta and the key consequences we can draw today not only regarding rule of law money laundering but on an unbelievable case of murders suspect which with with a very serious background of tremendous corruption seemingly even protected by justice and police authorities	/media/hugo/Seagate Expansion Drive/ALICE_BACKUP/voshpde/wav_files/zipfiles/2018012501.wav	6
114	/media/hugo/Seagate Expansion Drive/ALICE_BACKUP/voshpde/pipeLine/segmentation_wavfiles/2018012501/115_2018012501.wav	2571.5025850340135	113403264	2592.2525850340135	114318339	114_2018012501	in the government top level and the direct influence circles around let me first of all made clear that the great people of malta do not deserve this picture in the world the responsible government officials should have had stepped back since month	in the government top level and the direct influence circles around let me first of all made clear that the great people of malta do not deserve this picture in the world the responsible government officials should have had stepped back since month	/media/hugo/Seagate Expansion Drive/ALICE_BACKUP/voshpde/wav_files/zipfiles/2018012501.wav	0
115	/media/hugo/Seagate Expansion Drive/ALICE_BACKUP/voshpde/pipeLine/segmentation_wavfiles/2018012501/116_2018012501.wav	2592.2526077097505	114318340	2614.6026077097504	115303975	115_2018012501	we must support the maltese people and strongly continue to prosecute the criminal and corrupt members in the highest ranking around the present maltese government even so it is it is fully unacceptable that criminal power elements	we must support the maltese people and strongly continue to prosecute the criminal and corrupt members in the highest ranking around the present maltese government even so it is it is fully unacceptable that criminal power elements	/media/hugo/Seagate Expansion Drive/ALICE_BACKUP/voshpde/wav_files/zipfiles/2018012501.wav	0
116	/media/hugo/Seagate Expansion Drive/ALICE_BACKUP/voshpde/pipeLine/segmentation_wavfiles/2018012501/117_2018012501.wav	2614.6026303854874	115303976	2635.4526303854877	116223461	116_2018012501	there in malta even call for arresting ep pa bit casa our european parliaments number one fighter to bring political clarifications in the judicial accusements regarding panama papers cruel brutal murder	there in malta even call for arresting mep dawit casa our european parliaments number one fighter to bring political clarifications in the judicial accusements regarding panama papers cruel brutal murder	/media/hugo/Seagate Expansion Drive/ALICE_BACKUP/voshpde/wav_files/zipfiles/2018012501.wav	4
117	/media/hugo/Seagate Expansion Drive/ALICE_BACKUP/voshpde/pipeLine/segmentation_wavfiles/2018012501/118_2018012501.wav	2635.4526530612243	116223462	2651.0026530612245	116909217	117_2018012501	i tell you all responsible officials in malta from here including your minister of justice dadid casa has our full support and you will not succeed	i tell you all responsible officials in malta from here including your minister of justice dadid kaza has our full support and you will not succeed	/media/hugo/Seagate Expansion Drive/ALICE_BACKUP/voshpde/wav_files/zipfiles/2018012501.wav	2
118	/media/hugo/Seagate Expansion Drive/ALICE_BACKUP/voshpde/pipeLine/segmentation_wavfiles/2018012501/119_2018012501.wav	2651.0026757369615	116909218	2667.0526757369616	117617023	118_2018012501	a team people of malta stand up against these people in your country you can rely on dati casa and the european parliament thank youmrprsidenmsplase	a team people of malta stand up against these people in your country you can rely on dati caza and the european parliament thank youmrprsidenmsplase	/media/hugo/Seagate Expansion Drive/ALICE_BACKUP/voshpde/wav_files/zipfiles/2018012501.wav	1
